标题,帖子数,日期,情感
东方财富30日发布业绩预告，相信大家很是期待！,23421,2016-01-29,0.9476363480935382
今天清仓出局，卸载了所有炒股软件，两年后再回,13509,2016-01-28,0.00589200246131949
东方财富，这股票小散户太多，而且散户还非常看,92353,2015-12-15,0.902489662437123
注册时代的伟大公司——东方财富的“不败九式”,101564,2015-12-22,0.8721520925125462
向爱国护盘的东方财富主力致敬！兄弟姐妹们，谁,67068,2016-01-27,0.9875428485085128
东方财富之谜,10876,2016-01-28,0.9534381044159174
重大通知：周三东方财富在35.97附近将有强大支,22189,2016-01-26,0.8867127449037485
开盘创业板两种情况，一种低开80点，一种略高开,8805,2016-01-27,0.43191871154237405
创业板底部出来后，主板会阶段性强势，由于资源,9449,2016-01-27,0.5692319422205862
64的本啊，亲，怎么办？,20109,2016-01-26,0.9711946000716626
东方财富今日超大单流入排名第11名(01-27),28262,2016-01-27,0.8553459398285739
东方财富(300059)融资融券信息(01-26),18990,2016-01-27,0.9592539724594212
我这次救了大家，大家赚钱独我哭，我买卖股规律,14221,2016-01-27,0.6575817134769811
跪求大家不要再卖了,7003,2016-01-27,0.26699490021871586
玩股吧这么久从来没喊出“满仓冲”此等语言，昨,6989,2016-01-27,0.10703474124500478
我今天说过暴跌，于是对了，下午我说了短线客可,14006,2016-01-26,0.40362296164642864
都来报报自己的被套价格,26919,2016-01-26,0.28074964807184755
熊市就入场，股票不站岗，牛市你清仓，资金往回,6433,2016-01-26,0.9922271096665646
东方财富(300059)融资融券信息(01-25),18673,2016-01-26,0.9592539724594212
嘴是两张皮，数据说真话,29619,2016-01-23,0.24187157814130045
50倍呀乡亲们,13205,2016-01-26,0.4728264514646334
东方财富大势己定。空头不过是最后挣扎。,25726,2016-01-21,0.9764588956230498
2850点后期必破，理由是大家都认为它是底，其实,19363,2016-01-15,0.9374689774028803
东方财富，远远没有到位，明天下跌5%，非让小散,14841,2015-12-09,0.8771164751765054
需要两个涨停才能回本的难兄难弟来报道下，互相,8094,2016-01-26,0.2665180638616371
东财周线图,33315,2016-01-15,0.4370901126849447
robinson888十问回答(东方财富）,23120,2016-01-23,0.4363211092089635
因为我持股此票才不涨，为了同志们我现在割肉了,6009,2016-01-26,0.08796174708717408
创业板业绩大幅变化的企业，一月底前要公布,25734,2016-01-21,0.22507931769058842
全部清仓，亏了一辆奔驰,22280,2016-01-25,0.5608304540994631
东财本周站上50元，节前收盘60元！,19025,2016-01-25,0.084238729114965
有大跌必有大涨,14071,2016-01-25,0.5696490936998192
无我、利他、普惠，冬菜董事长其实先生对自身企,15412,2016-01-23,0.6000568287381967
上证大盘：启明星形态。重要底部的信号！,12796,2016-01-25,0.1984167297593742
东方财富(300059)融资融券信息(01-22),19850,2016-01-25,0.9592539724594212
东财的估值很困难。,17454,2016-01-24,0.6005895981186711
东财在手机APP上最有可能导入几块业务，首先是,13890,2016-01-24,0.17822662830283187
古诗新版： 一曰：羊交猴年熊纷纷，亿万股民欲,33150,2016-01-15,0.9980768967191408
东方财富共78只基金持股43亿，排名19,17190,2016-01-23,0.9180734138168054
全球阶段性底部即将来临！ 隔夜美股已金针探底,39638,2016-01-22,0.9469358562494711
在投资东财前要思考什么问题,30279,2016-01-21,0.9820660937083823
东方财富:2016年1月18日-19日投资者关系活动记,62271,2016-01-22,0.9458277249231488
驻地完成，下午涨停！,12616,2016-01-22,0.7862481904235293
董事长其总回答投资者问题,21312,2016-01-22,0.9740434977864774
东方财富:2016年1月18日-19日调研活动附件之深,42492,2016-01-22,0.30624146028739263
东方财富今日超大单流出排名第13名(01-21),20756,2016-01-21,0.7292517997139222
高喊一声：明天涨。,17047,2016-01-21,0.3977490369081431
东方财富今日超大单流入排名第5名(01-18),38699,2016-01-18,0.9298937465969356
东方财富(300059)融资融券信息(01-15),19755,2016-01-18,0.9592539724594212
东方财富与同花顺价差继续增大。,13776,2016-01-21,0.7402375470587005
东方财富(300059)融资融券信息(01-20),13890,2016-01-21,0.9592539724594212
公司深度报告：内涵发展业绩进入爆发式增长期，,73302,2015-11-11,0.9190045304460119
2016-1-17 一、上周五大盘，未能延续周四的反弹,18398,2016-01-17,0.9429923626612589
东方财富：今日的回调只是上涨途中的正常回踩！,13889,2016-01-20,0.1206033810824404
同信证券2015年度业绩猫腻,28715,2016-01-20,0.3632762041548344
同信正确报表简单分析,12783,2016-01-21,0.9611866868841764
东方财富(300059)融资融券信息(01-19),20350,2016-01-20,0.9592539724594212
东方财富:关于控股子公司同信证券披露2015年度,48413,2016-01-20,0.888813693351834
晴晴：十字星止跌迹象,22462,2016-01-12,0.06474764317351889
东方财富今日超大单流出排名第1名(01-20),21462,2016-01-20,0.654786507960669
2016年操盘理念--股市是棵“摇钱树”需谨慎,7900,2016-01-19,0.9977885121412385
点赞的股票涨停。看见不点的，低开横盘或跳空跌,4185,2016-01-20,0.894443765576117
讨论：是股票就会有涨跌，再有价值也要知进退，,35983,2016-01-09,0.9757114793520303
从55元开始，买了100股，50元又买100股……每次,44428,2016-01-16,0.061908193278461865
我还是为明天行情给出独家预测：那就是根据我的,19138,2015-12-29,0.8100845289461723
57满仓了 不等了太郁闷了,10444,2015-12-14,0.0002689921012341001
东方财富2015年业绩预估,28969,2016-01-18,0.7759514413933895
牛去猴跳熊复来，抱定财富待黎明！      原油暴,52139,2016-01-16,0.8473128583196885
我48的本，有比我站的高的吗？,23872,2016-01-16,0.81409566845826
中国中车是朕的皇后虽然朕几乎从来不翻她的牌子,8803,2016-01-17,0.9305942443457531
明天开盘直接破2850点，等2500点左右抄底,12007,2016-01-17,0.022886627710589913
还有60多亿融资盘,呵呵,15478,2016-01-15,0.3631911184032611
钗头凤.股伤,9181,2016-01-15,0.5181627134318754
东方财富(300059)融资融券信息(01-14),20672,2016-01-15,0.9592539724594212
东方财富已经是半只券商股估值理应向证券股靠拢,10027,2016-01-16,0.24154228218595153
建议A股交易采取当日“买入卖出”二次！,9464,2016-01-15,0.049551438887002086
我对市场监管层的五点建议： 第一、立即暂缓注,25589,2016-01-14,0.9055840402080686
仙人指路,11568,2016-01-15,0.7901094453202276
我就问大家一个问题，昨天流入五亿涨八个点，今,18092,2016-01-15,0.5502185094103336
东方财富今日超大单流出排名第2名(01-15),15265,2016-01-15,0.6585255374882596
东方财富今日超大单流入排名第1名(01-14),52716,2016-01-14,0.8835453360976739
恐慌没有必要,11499,2016-01-15,0.5
早盘看我留言买入的此贴留个言,11379,2016-01-14,0.6972019544948803
宝硕股份77亿迎娶华创证券，东财44亿娶同信赚大,22470,2016-01-14,0.4690348743798338
主力今天有多坏明天涨的就有多高，大家看看啊，,20029,2016-01-14,0.5596273747055637
东方财富(300059)融资融券信息(01-13),21039,2016-01-14,0.9592539724594212
为了绝地反击，星期一我将和国家队共同作战，打,17970,2016-01-10,0.7018625998319525
感谢东方财富，刚刚涨停板走了，解套之余还赚了,10201,2016-01-14,0.9982971224033756
关于止损和止赢,27118,2015-12-17,0.8342625015171489
早盘已经发帖，今日千股涨停,12177,2016-01-14,0.7407008708084621
我被平仓了！ 同志们，再见了。,15317,2016-01-14,0.37326302209384576
东方财富：梦想照进现实，重大机遇来临,21977,2016-01-13,0.9973151611088491
二百八十万入市今早平仓只剩三万,18352,2016-01-14,0.08579254028812389
同信证券：“互联网+券商”铸就行业黑马！,7603,2016-01-14,0.9590866217093749
1.13周三大盘精准点位提前预测！（逢低补仓T）,16632,2016-01-12,0.91389497981643
黎明之前往往是最黑暗的,9257,2016-01-14,0.9296405705372615
中泰证券：东方财富买入评级,29160,2016-01-13,0.8421521345578012
5100-3600分文未损 本周三天净亏9万,12002,2016-01-13,0.30621168486361117
报表出台，同信1.4w亿成交量，高于太平洋证券，,22904,2016-01-13,0.2635905362036972
下半年坐了趟过山车，9月份32元买了3万股，11月,12795,2016-01-10,0.5307228503027018
大家别伤心了，明后天开始千股涨停！,16189,2016-01-13,0.2859886489000275
东方财富今日超大单流出排名第1名(01-13),14779,2016-01-13,0.654786507960669
东方财富:中国国际金融股份有限公司关于公司发,39685,2015-12-07,0.9946552946423393
今天收出第三星，大家懂了么，我只能说到这里了,25001,2016-01-12,0.027589704550210037
比广发证券高估了5倍！,13850,2015-12-16,0.4108152661628641
东方财富今日超大单流入排名第7名(01-12),42500,2016-01-12,0.9279419094571798
团长抄底A计划,24742,2016-01-11,0.17371201147554483
互联网券商异军突起 同信证券逆势增长 值得一提,16110,2016-01-13,0.9942392550113162
东方财富，明天操作指南!,23078,2016-01-12,0.6373656771942626
昨天43.5元进的。今天早上挂45.6卖出不成交，,22982,2016-01-06,0.20795774276999857
中期技术预测：创业板指数还有最后一条强力防护,15383,2016-01-10,0.997225873688933
谁比我惨，新年2只股第一个交易周就亏53万元，,45574,2016-01-08,0.006307905696832372
退役操盘手教大家如何判断反弹的力度,10509,2016-01-12,0.5772374776200215
57的本 今天这也算涨 我看不见 同病的顶下谢谢,12209,2016-01-12,0.13245734595423053
我就纳闷儿了，东方财富业绩这么好的股票，居然,10155,2016-01-12,0.6478276105873135
东方财富分红可能10送5股,30322,2016-01-09,0.3197389285396611
谢谢谢主力。我感激涕零。东方财富。我追寻你。,12779,2016-01-12,0.9852393929221998
注册制突然来临，建议暂时卖出东财,32323,2015-12-28,0.31508131674478423
东方财富是他们在出货折腾？,19613,2015-12-18,0.8529967250176476
大吼三声：不要怕！,18308,2016-01-11,0.17226265730689627
2016.1.12周二大盘点位精准预测与策略！（M头成,12585,2016-01-11,0.9333032825884077
汇率已经稳定，反手做多,14474,2016-01-11,0.7516675137507586
重要警告：上证指数见底不代表创业板见底，区别,16470,2016-01-08,0.3377546402190117
重要提示：大盘要短中期调整了，请做好风险控制,26928,2015-11-13,0.5221155063833411
立贴为证！如果能回到熔断前，我将全部清再也不,13727,2016-01-11,0.3696184971627049
2016-1-5  一、今日大盘惯性大幅低开，直接撕破,13291,2016-01-05,0.7575108405452889
1.11周一大盘精准预测与操盘策略！（耐心等待反,37871,2016-01-10,0.9897432861954407
重要通知：本尊提供的市场数据分析图都是超值大,18227,2016-01-09,0.88024119912173
东方财富,7948,2016-01-08,0.8504360551685276
41.7抢了5000股,21612,2016-01-09,0.5335023854475559
现在的东方财畗就是2008年的格力，高成长，长期,22118,2016-01-10,0.89711614460383
60以上的还有在的吗？,11093,2016-01-11,0.11363636363636365
是不是我太贪,20247,2016-01-09,0.5544037310309162
价值投资从此股开始,25363,2016-01-06,0.9471488962791552
如果按中信券商股的标准，本股高估3倍以上吧。,12424,2015-11-18,0.30905397770989895
今日发帖为大家打气。本人认为本轮调整目标为31,57941,2016-01-04,0.8378992305058182
郑重宣布：东方财富短期底部到了，互联金融龙头,14656,2016-01-08,0.9663855111619808
东方财富：落后与同花顺，,18043,2016-01-08,0.6687006753733021
求助站,10733,2016-01-08,0.23992166144130256
互联金融谁是龙头，一目了然不用废话了！,19612,2016-01-08,0.28932916509341966
东方财富(300059)融资融券信息(01-07),20639,2016-01-08,0.9592539724594212
上证大盘大盘：后市预测！去掉恐惧！,12399,2016-01-04,0.9823843371843658
笑死我了，早盘3056点不抄底的人，根本不适合炒,14525,2016-01-08,0.19197259415265133
我跟你有情。而你却无义。56元的本。啥 时能回,11075,2016-01-08,0.31358803606629226
熔断机制的影响（互动贴，持续更新）,27467,2016-01-05,0.2594746679300455
好标的放心拿着吧 今天的盘面把大家吓到吧？刚,34496,2015-12-08,0.8278991316424513
天哪，38.86，卖在最低点了，惨。,8960,2016-01-08,0.5086646510107105
想不到空仓的感觉真的美妙。,7749,2016-01-07,0.9128085238043462
东财全仓,8189,2016-01-08,0.28164153329284636
全球金融危机来了,6908,2015-11-13,0.9984358109409598
再发帖，首先对引误导大家左侧交易盲目抄底表示,14760,2016-01-07,0.0011404126149084926
1.8周五操盘要点！（变盘窗口还有一波探底）,10690,2016-01-07,0.8651456726054437
中国式熔断，熔断后只能买不能卖(顶起） 只有这,8081,2016-01-07,0.3571584043395277
东财2个月内涨至249.99元/股,13144,2016-01-06,0.027652794129427005
熔断新规,11555,2016-01-07,0.968823693493991
郑重预测：上证大盘后市合理运行图，送有缘人珍,16753,2016-01-07,0.7220852717192228
今天流出很少，表示正在启稳！,12950,2016-01-07,0.4845137864664719
重磅利空消息明朗，国家队隐现护盘,15878,2016-01-05,0.3811256542211169
做超级短线，不要管它什么业绩和市盈率，不要管,5835,2015-09-16,0.46448773584429626
明天预测,10355,2016-01-04,0.7609059619857397
整个吧里没有几个明白人，我问几个问题供你们考,26650,2015-12-26,0.8485155234782603
东方财富是中国最大的互联网金融公司，中国企业,20459,2016-01-06,0.9997045608624616
你说下午这个伙计反弹涨3个点是不是得老吓人了,9953,2016-01-06,0.030724904411335352
看估值不是价值投资,12007,2016-01-06,0.8772834873260896
确实是佣金5元。。。刚看交割单了,14962,2016-01-06,0.5319538624506157
东方财富(300059)融资融券信息(01-05),23903,2016-01-06,0.9592539724594212
一条每笔5元佣金的广告置顶所用的股吧，一定能,17506,2015-12-29,0.26552064246019946
12月28日大盘走势预测！年报行情即将打响！,23218,2015-12-27,0.9109523563655069
怎么办啊[哭]64元本！大师们指点指点,22746,2016-01-04,0.8673854512364346
今天上午东财很努力，一直在顽强抵抗，加油哦~,6038,2016-01-06,0.9950998386161414
东方财富周五恐惧症,16454,2015-12-18,0.9910433042267756
明日东方财富必将大幅上涨，原因如下,13740,2016-01-05,0.6780055928517771
郑重告诫：2016年东方财富是用来欣赏的，绝不买,11804,2016-01-06,0.9317757581439351
究竟是熔断机制测试，还是A股被恶意做空？！,32395,2016-01-04,0.18915058814369134
2016第一个精准预测：1月份东财最低价44-45元之,26986,2015-12-28,0.9986755923166543
42.48清仓了！清完反弹[哭]亏4万,12520,2016-01-05,0.8691008387323078
新股发行消息出来前，没有希望。今年新股发完，,20358,2015-12-31,0.08331082990338268
周三技术预测：中小创短线到底了，日线反弹进行,14067,2016-01-05,0.9252355831081704
议东财核心竞争力,28735,2015-12-10,0.9473185448539397
注册制将至，黄金第一股——东方财富。如果不回,11672,2016-01-05,0.34870790631374504
东方财富后市看法~（交流贴）,24235,2015-12-30,0.948639733815596
东方财富今日超大单流出排名第2名(01-05),10829,2016-01-05,0.6585255374882596
今儿一朋友问我为啥他5个股票盘中都突然停止了,29117,2016-01-04,0.05064880463508248
东财怎么了，2个多月没有一次像样的反弹，70元,13965,2016-01-05,0.016004756937411213
无药可救,10521,2016-01-05,0.813623616235371
明日大盘走势预测 准不准你说了算,10284,2016-01-04,0.752686018762845
东方财富(300059)融资融券信息(01-04),19684,2016-01-05,0.9592539724594212
东方财富今日超大单流出排名第14名(01-04),26658,2016-01-04,0.7194350120220716
东方财富复权后1.38元起涨价现在52元请抢购,43726,2016-01-01,0.9310729106718265
明天的走势,15520,2016-01-04,0.2845935741427815
冒死发布：注册制推出之日，就是中小创见底之时,9316,2016-01-05,0.03858240564395243
大跌不要紧，由我来拯救你们，信者有福！,8395,2016-01-05,0.6281646924099259
东方财富中期底部远未到来，真相就在这幅图里！,15448,2015-12-29,0.9944965870422827
下午是赌徒时间，如果自认为不是赌徒，请回避任,19334,2016-01-04,0.204905089179794
熔断机制人性化的设计，看了你就知道,11486,2016-01-04,0.6239896719628323
重大预测：上海战略新兴板开办之日，才是创业板,12893,2015-12-28,0.9767890931432613
必须开盘就卖出东方财富，2016年第一个交易日将,47815,2016-01-03,0.818708969108527
希望生于绝望时，反转定在极限地！ 这一个多月,99618,2015-12-30,0.24411216169629824
东方财富(300059)融资融券信息(12-31),17382,2016-01-04,0.9592539724594212
新年开始篇,10528,2016-01-03,0.16539453758680256
至2016年~~不得不看！不喜勿喷！,8487,2015-12-31,0.13304286403681187
如下几个问题，回答后立马卖出,12721,2015-12-25,0.04682617007928247
郑重公开宣布：今日本团队大举介入了东方财富！,29817,2015-12-29,0.9458352847432332
哈哈，大家到现在为止，都套了几个点了,25345,2015-12-31,0.39506533078649075
我的自选股,14289,2016-01-03,0.4737672181921908
我是北京国信用户，去年底在营业部把手续费改成,15860,2015-12-31,0.007967960844593835
东财和创业板指的对比,21669,2015-12-31,0.7222797145071742
咬定东财不放松敢买敢卖才成功。。。 山有高低,13288,2015-08-29,0.02234949632443395
马云昨天在乌镇互联网大会上的发言：“这是一个,70971,2015-12-17,0.9695735066704136
一封感谢信送给：股海游龙飞天起。,20031,2015-12-31,0.2053176254147645
今天买了一注二十倍的双色球，中奖后给大家把东,11550,2015-12-31,0.2108358436841512
东方财富今日超大单流出排名第8名(12-31),19349,2015-12-31,0.7644187338927216
我62进场的，现在52了，真心不知道值不值拥有,11981,2015-12-31,0.6867840781565215
大盘预测：精准判断下周大盘先上后下再上，红盘,23589,2015-12-25,0.9697329676799107
今天大单流入是为了明天砸盘，互联网券商已经得,37553,2015-12-30,0.6775840296410586
收盘拉红信不信,5197,2015-12-31,0.4544147077340944
我的买股小技巧，大家有好的经验交流一下啊,12674,2015-12-31,0.7459561266570024
娱乐一下而已,5390,2015-12-31,0.5444499594224983
东财能不能推出交易佣金500元包年？大家来顶一,8659,2015-12-30,0.15459332736164022
东财放大招，春节前开户永久享受单笔5元交易费,53198,2015-12-29,0.03982441647680923
今天东方财富主力流入548万元！！！,12631,2015-12-30,0.7466522178508302
东方财富——你我的财富！,14285,2015-12-30,0.9741575041021575
东方财富：万亿不是梦想,13648,2015-12-30,0.9558143597043766
希望富有,9692,2015-12-30,0.7876863168433357
东方财富(300059)融资融券信息(12-29),14307,2015-12-30,0.9592539724594212
12.29明日大盘走势预测,13884,2015-12-28,0.9692636524505769
发力！东财。,9754,2015-12-30,0.4370901126849447
老股民应该都记得，东方财富去年宣布股权激励的,43949,2015-12-25,0.9964541755136005
建议天天基金推出基金T+0！,5561,2015-12-30,0.9523729888122535
57的本，什么时候回呀,6656,2015-12-30,0.08553129667104176
我已经设置好了，每笔5元佣金，明天能生效吗？,10190,2015-12-29,0.09204635595115984
突然觉得东财是要把同信做成一个平台而不是一家,10328,2015-12-29,0.5083415142898323
每笔5元撤了，但个人认为大可以放心，5元不会是,11640,2015-12-29,0.09684115444490371
今天53.50挥泪离别东财，真的舍不得，从64买入,26308,2015-12-29,0.9927726178752833
东方财富:关于完成工商变更登记的公告,40608,2015-12-29,0.1971833579006148
东方财富:补充更正公告,63009,2015-12-29,0.4834704978922484
坚持53买的举手。举手的今年盈利在50%～100%左,14077,2015-12-29,0.5415947748923844
我对东方财富的看法,11461,2015-12-29,0.9110193180536222
东方财富携手同信证券 5大理由成为开户首选,45472,2015-11-26,0.9901057695427364
同信老用户享受优惠吗？很急希望好心人解答,9541,2015-12-29,0.8289409026958947
真的是一次交易5元，过2天调资金集中在东财,10774,2015-12-29,0.3131252014393694
东方财富:第三届董事会第二十九次会议决议公告,101619,2015-12-28,0.38277985545872517
今天跌了，市值却突破了一千亿，原来是增发上市,12852,2015-12-28,0.8058853813921046
周末特别奉献：天大好消息，你们的东财有救了，,22540,2015-12-26,0.7758366288655397
买了后没怎么涨过，,7285,2015-12-29,0.26636073094492796
厚重搏千浪，雾轻逐晨露；速弃杞人思，稳赚天地,27223,2015-12-12,0.9949900362250989
请攥紧A股的稀缺资源－冬菜和乐师！ 此话怎讲？,56771,2015-12-15,0.07345773075298945
切莫错误地解读A股市场的扩容，请不要误导投资,84549,2015-12-27,0.252550901096641
从三季度证券公司开户数据和注册制的推出看，中,5544,2015-12-29,0.5141103918809178
东方财富:公司章程(2015年12月),66149,2015-12-28,0.516643377213187
已成事实：东方财富62元是12月铁顶，越买越亏！,10042,2015-12-01,0.336112862347984
恭喜你们：东方财富周二正式进入54--48的新箱体,10841,2015-12-28,0.8215039302989536
东方财富:发行股份购买资产并募集配套资金实施,181379,2015-12-24,0.9986179427844306
今天发了个贴，被不少人喷，再写一个就不再继续,17739,2015-12-26,0.01676799371786797
东方财富(300059)融资融券信息(12-25),16724,2015-12-28,0.9592539724594212
东方财富:中国国际金融股份有限公司关于公司发,62904,2015-12-24,0.9946552946423393
近一个多月，大盘涨了6点，它跌了15个点资金流,7856,2015-12-28,0.7273563647184847
百强操盘手：乐视网复牌之日就是东财连续涨停之,150572,2015-12-25,0.5084458595816934
公司增长态势不变，拉开与同花顺的距离。特别是,7650,2015-12-28,0.7035839284288504
难怪东财一直持续阴跌，原因找到了,37122,2015-12-26,0.2636659514509119
首先祝大家圣诞快乐!下面我要说四句话：一、感,29168,2015-12-25,0.998194556939761
东菜十日内必有行情，大涨一触即发！拭目以待 ,18861,2015-12-26,0.9873079843683737
凭一年一百个来回的盘感，我在东财看到了什么？,17609,2015-12-26,0.5338069886430052
2016最严重警告：全力以赴全仓上海战略新兴板是,11584,2015-12-26,0.9472300589960675
2016重大预测：注册制+上海战略新兴板=创业板的,15297,2015-12-26,0.9887953263245428
回帖答复“一切技术都是”四个问题,37025,2015-12-25,0.10289331841102967
炒股不传之密：绝密心法,42260,2015-12-21,0.541143537309224
东方财富今日超大单流入排名第4名(12-24),37680,2015-12-24,0.915950878384721
最顶级的股市绝学 三分钟让你悟透绝学！,19416,2015-12-24,0.9979517024285988
东方财富:发行股份购买资产并募集配套资金实施,93423,2015-12-24,0.9986179427844306
东方财富:国浩律师(上海)事务所关于公司向特定,60735,2015-12-24,0.9950803935077012
今天你跑了吗？ 今天2次触碰下降趋势线上轨，几,21374,2015-12-22,0.059909186905183764
千万谨慎：东方财富只是回抽5日均线，照样没戏,15669,2015-12-02,0.02365327642633741
都疯了吗？以前定增的股份要上市了，人家成本是,14275,2015-12-24,0.702826455879049
马上一年到头了，盘点了一下，辛苦一年，全年收,9360,2015-12-24,0.4686424353517097
重大提醒：东方财富明日起不成功便成仁，生死一,15532,2015-12-24,0.9920228331647123
主力很：笨,12190,2015-12-24,0.27820415293558776
按理说，互联网金融三剑客东方财富，同花顺，大,17155,2015-12-24,0.9930784320043559
今天这T做得，56.26卖，57.7买，再也不敢做了啊,9217,2015-12-24,0.3948997693218903
短线多头有望发力 行情又是再次值得期待！,5984,2015-12-15,0.9847373794114083
今天买的人几平被套，我也一个[哭][哭][哭][哭],9462,2015-11-05,0.957784744824491
今晚的公告！,132531,2015-11-17,0.4500824065101334
午盘分析：东方财富60元都不敢摸一下，说明什么,10301,2015-12-04,0.5294017502590841
简单的讲一下不可不知的卖股三招： 一般20%的人,20824,2015-12-19,0.0325690182241406
300059你会跌到2块吗,7747,2015-12-24,0.06573847004245303
如果我一个散户每年交给同信证券5万手续费,14418,2015-12-23,0.03340297703171713
股市双骄，同花东财。 二零一六，惊天动地。 三,8162,2015-12-24,0.9722016185727245
12月23日大盘走势预测！高点吊线谨慎为好！,13451,2015-12-22,0.11815777306849196
国务院：推进符合条件的金融机构在风险隔离基础,13257,2015-12-23,0.9980187242688311
下午2:30涨停,7713,2015-12-21,0.5507854270030347
东方财富:国浩律师(上海)事务所关于公司向特定,69473,2015-12-10,0.9950803935077012
今天卖出的偷着乐吧,38188,2015-11-05,0.6503981514347386
东财只是短暂的休整，价值的魅力没有改变,10435,2015-09-08,0.9765207559659358
东方财富(300059)融资融券信息(12-21),24034,2015-12-22,0.9592539724594212
东方财富发展战略构想,22036,2015-12-21,0.998303497113392
