标题,帖子数,日期,情感
东方财富是创业板的龙头,23927,2017-08-14,0.7868123709462711
特大利好：东方财富周一涨停板，买入买入买入--,21396,2017-09-01,0.9965279548429491
致东财所有散户股东的一封倡议书!立flag!      ,38555,2017-08-26,0.2806260794231713
解析东方财富主要业务：静等风来,14366,2017-08-14,0.9947418410063997
神奇的均线在此得到验证[大笑],10045,2017-08-24,0.9519536489967724
拓展主业务风光独好 冲刺黑科技金光灿烂（共享,22270,2016-11-05,0.999918758421631
月线有启动迹象。创业板站稳1800.必见1950.,8239,2017-08-23,0.069698557802926
坚持定投到满仓终于有了收获！又到底部区域满仓,25156,2017-08-09,0.020706669491584284
可怜的傻逼散户的共同特点：底部区域给自己找出,60141,2017-06-24,0.03131341064576565
东方财富 承载梦想！！！,71707,2017-07-30,0.9746276703665985
这是一场ZZ牛市必须牛 ！ZZ需要牛市不要拿技术 ,30571,2017-06-24,0.9518431586814124
东方财富将复制科大讯飞成为国家队拉升龙头，满,40043,2017-08-14,0.5001237575475614
我已经满仓东方财富了,45341,2017-08-04,0.6507327038830221
请穷人、丝、小散、目光短浅的机构赶紧滚蛋，东,28474,2017-08-28,0.7376173453747877
截止2017年7月14日:2016年5月13日定向增发40亿,144628,2017-07-15,0.02246275216555893
人人都加一块砖，肥水不流外人田！！！ 今天，,2676,2017-08-31,0.017321282380540093
东方财富:第四届董事会第七次会议决议公告,28812,2017-09-01,0.15065743220971306
年线压制,1798,2017-08-25,0.4737672181921908
看看昨天我就说了我13.10买的，怎么样，Sp说6.8,1654,2017-08-25,0.28971935215411826
当下炒股致胜格言：炒股要听国家队话、跟着国家,18309,2017-08-16,0.908478017752155
东方财富：东方财富证券拟开展融出资金债权资产,8525,2017-09-01,0.9998540801875283
今天买进了，歇半年了，今天出手买进了，呵呵  ,57903,2017-07-20,0.7406637019533089
东方财富增发主力成本：        第一批：增发价,234751,2017-02-23,0.8560309343065104
强烈看好互联网券商!互联网券商盈利模式转型：,62549,2017-05-27,0.9621792974418413
东方财富已经跌破500亿，进入买入区间 一直关注,75426,2017-05-29,0.9387012452285702
东方财富8月25日盘中涨幅达5%,16043,2017-08-25,0.16925151401251604
打赌周一涨停,15797,2017-09-01,0.5661315108071885
东财实盘大赛八月赛季结束了,7644,2017-09-01,0.40285243050313724
利润才2亿，市值600亿！泡沫很快要破了！,9894,2017-08-25,0.4542862415466905
东财午后或火箭发射！ 6.8的智障语已然沦为笑柄,22204,2017-08-28,0.6197292723165718
本大姑看东财。,65217,2017-08-30,0.6184777508821596
东方财富:关于子公司收到《关于西藏东方财富证,67619,2017-09-01,0.9655350846582252
东方财富:关于子公司西藏东方财富证券股份有限,43983,2017-09-01,0.995715998993691
坐等收钱！A股就一家网上券商！,104126,2016-03-16,0.0379715269020674
东方财富8月份放出5倍的巨量，强烈看好。,19675,2017-08-30,0.7371685296694279
东方财富(300059)融资融券信息(08-24),11194,2017-08-25,0.9592539724594212
期望值将会把东财推向真正的巅峰 。现如今稀锂,37379,2017-08-03,0.8378682357277526
那个宇宙总龙头郭嘉队，我CNM骗了劳资昨天早上,7387,2017-08-25,0.624622455359549
东方财富(300059)融资融券信息(08-30),10090,2017-08-31,0.9592539724594212
强势涨停机构游资敢死队疯狂抢筹暴涨飙升超大黑,22868,2017-08-27,0.5114924232922934
东方财富，主升浪行情,18739,2017-08-16,0.986102083764915
次新股真是风了，macd双线开口同时上零轴，有再,5247,2017-08-31,0.16424916717634497
这个收盘漂亮啊，今天已经满仓，明天融资全进，,15786,2017-08-31,0.8657935942073895
最后一捶子上升这么多，少卖一一毛二下周看有机,3889,2017-08-25,0.8109045367633371
缺口和阻力！ （游资撤离新次新，大盘高位整理,17079,2017-08-30,0.9598057412395813
坚定看好东财大金融布局及发展，用东方财富证券,18154,2017-08-23,0.9972480971638796
可怜的傻逼散户的共同特点：底部区域给自己找出,34967,2017-06-30,0.03131341064576565
完成清仓，没有亏钱，一个月不碰她,10290,2017-08-31,0.012129463067315549
东方财富解决人与财富之间的距离，阿里巴巴解决,8410,2017-05-20,0.9817357484221695
在东方财富中签了。,8810,2017-08-30,0.7762488552734732
再次加杠杆买进,13459,2017-08-16,0.33531722369954986
东方财富解决人与安全之间的距离，阿里巴巴解决,24113,2017-05-20,0.9372098909053767
昨日晚间第三次再报某金大面积持股券商，郭嘉队,10881,2017-08-30,0.5783865964336143
今天不跳明天跳，明天不跳，后天跳，这个价位套,17801,2017-08-28,0.002365485664828082
全国股民开户，最后全都集中到东方财富，趋势。,10041,2017-08-26,0.9549097739016105
东方财富:关于控股股东部分股份质押和解除质押,54127,2017-08-25,0.9968401853887771
手机开户常见问题 ,681631,2016-03-09,0.5158382994605086
券商龙头,21559,2017-08-28,0.2505978542578735
哈哈空仓了,6396,2017-08-29,0.2603770592113267
东方财富(300059)融资融券信息(08-29),10742,2017-08-30,0.9592539724594212
全宇宙最大多头强势入驻东方财富.2020年市值将,588551,2017-07-27,0.9796445077543366
目前我半仓，不担心涨，也不怕跌，如果周一上午,17605,2017-08-26,0.04222381169230649
首先大方向上昨日言到，今年行情是吃饭行情这点,10120,2017-08-29,0.9982777092167985
本人先撤了,9128,2017-08-28,0.1726406800473954
这几天涨的好哦，本大姑在山里避暑，也没看盘。,32942,2017-08-18,0.5953720579795055
下周初承接上周末V型转折…… 2017～8～6 周末7,18336,2017-08-06,0.971536110821196
东方财富目标价30元，下周连续三个涨停板，有特,59184,2017-08-25,0.9962836163702052
创指回踩极限1790附近，东财回撤极限12.90左右,30020,2017-08-23,0.0018269410656525098
今日若低看，他日必仰望！ 市场的风云变幻，个,21165,2017-08-04,0.9950581472834364
大家好，秋冬季的行情从今日确立！只要不乱追，,13773,2017-08-28,0.965804094274979
维持东方财富25元中性评级不变！哥评级后才给哥,19283,2017-08-26,0.5111179737931847
一杯茶，一包烟，东方何需看一天。求上联[献花],8930,2017-08-28,0.7445171670303409
东财历史上曾出现过两次1年左右连续无涨停的情,38634,2017-07-11,0.937518199851175
定投买进东方财富,38612,2017-07-20,0.6634139083238793
赶紧跑！我从10.7元坚持到加杠杆满仓以来今天第,135811,2017-08-17,0.048273657406155523
8月2日我提示方大炭素将复制中国中车大崩盘，今,93112,2017-08-17,0.1925401738525503
收盘在14.81以上即可了,11514,2017-08-28,0.7955256882790501
东方财富要进入主升浪啦。 东方财富要进入主升,9649,2017-01-19,0.9758209844201964
东方财富8月28日盘中涨幅达5%,11497,2017-08-28,0.15226031632093018
大盘为何缩量创反弹新高？ 8.25的一柱长阳，貌,11094,2017-08-28,0.7545780659539566
卖早了没有,4842,2017-08-28,0.38650809120219776
没有战略眼光，整天盯着眼前的得失。开车也不应,38179,2017-08-21,0.9998612742116069
我刚开了东方财富账户，原来在方正证券，最高时,10672,2017-08-27,0.33224124113502373
都买进了吧，等着收钱吧。,6360,2017-08-25,0.08806204034408693
你太猛了，要拉停吗？大家猜怎么收盘吧～～～,3199,2017-08-28,0.9436099812315445
东方财富：2016年净利润为7.14亿元 拟10转2派0.,104291,2017-03-06,0.5565220308394607
尾盘8.03万手说明了一切。你懂的[大笑],27188,2017-08-26,0.2724323711140608
刚又批复新设八家分支机构，今年开满100家营业,13063,2017-08-27,0.474144194771267
来的生尖头们:  欢迎大家乘坐本次航班，您现在,26849,2017-08-01,0.2720147347748286
股民持东方财富，又不把帐户开在东方财富，想等,11995,2017-08-25,0.9627561209308474
新次新发力，钢铁侠携黑色系报复性反弹，创业板,19138,2017-08-25,0.46394667661262967
首先感谢各位股友的支持和信任，记得前天个人大,10177,2017-08-25,0.7983962926630653
这是一场ZZ牛市必须牛 ！ZZ需要牛市不要拿技术 ,17068,2017-06-09,0.9518431586814124
今天赚了3万多！晚上去庆祝,14286,2017-08-25,0.08223951284649622
A股市场何时能市场化,39032,2017-06-01,0.45762670906602587
短线谁也不好说，长线相对靠谱，而估值也抱括期,57819,2017-07-21,0.6405649850975481
短期目标16，中长期24。,8908,2017-08-25,0.827301497340047
短期目标16，很快就要到了。,5358,2017-08-25,0.9746596630364406
同花顺 东方财富,发图给咨询股友无关涨跌据此操,5560,2017-08-25,0.8241818213023152
关于核准东方财富新设8家营业部的信息，信息来,15775,2017-08-25,0.735847386110305
继续持有[鼓掌][鼓掌][鼓掌],3175,2017-08-25,0.8712677728154983
卖掉了，轻松了，涨跌再也没有关系,11424,2017-08-25,0.4000435961010491
10.20就是大底，三年翻倍到20.88,6653,2017-08-16,0.33311529598715683
东方财富[微笑],1675,2017-08-25,0.9421575960586909
今天 感觉就像大牛市。几天以前说过，国家不允,4841,2017-08-25,0.5577635829651071
卖,1758,2017-08-25,0.39004149377593345
最后一单,2606,2017-08-25,0.3437908496732025
[鼓掌],1128,2017-08-25,0.764705882352941
综合因素判断：周五东财看涨,11768,2017-08-24,0.7020391646649132
短期上涨过快有回调的需求，但不影响长线价值。,23277,2017-08-17,0.6673213559266019
强烈建议公司研发软件工程师研发网上开户软件的,5582,2017-08-24,0.025888638492838845
大家好，今天的走势就像墨菲定律一样怕什么来什,9626,2017-08-24,0.9021353728135476
从底部最底点到现在涨幅大概27%，然后看看前十,12849,2017-08-23,0.07449665385240856
市场环境影响业绩，券商业务逆势起航,112507,2017-08-21,0.8462533954587235
筹码已经大面积集结到主力的帐户里。散户的特点,23595,2017-08-19,0.3294103635175121
明天可能漂亮50强于创业板,7735,2017-08-22,0.9520880661974517
今天收盘价13，同志们看着办,3218,2017-08-23,0.30147534003405774
又套一批吧，算什么突破。,2623,2017-08-23,0.9428024508695902
知道七个涨停后股价是多少吗,11545,2017-08-22,0.9130712060584727
周二看盘：东富慢牛格局  调整即将到位,10866,2017-08-22,0.31983006357483235
互联网的证券春天来临,2499,2017-08-23,0.9978633677354249
就在市场觉得今日要挑战3300的时刻，昨日个人深,7166,2017-08-22,0.9997579254823653
富贵险中求,9434,2017-08-22,0.9659503581716623
明天再跌基本就可以离场了,6492,2017-08-22,0.15040423749212684
我看到了12，不过，要庄有脾气，12装成本太大，,3823,2017-08-22,0.0034253338923209142
暂时离场，各位珍重,2682,2017-08-22,0.4084449070846813
美国有“纽约”同时中国有“雄安”，美国有“曼,5968,2017-05-11,0.9965609320214395
坚定信心，敢于上车，市场在犹豫中上涨---,9497,2017-07-05,0.8688056077356884
启航,30829,2016-07-10,0.2809661354564341
替东财做个广告,13029,2017-08-16,0.34655349499618093
外围普跌难改A股慢牛趋势！ 如果洋葱们跟跌，应,13239,2017-08-18,0.8666270311526054
波段头部这么明显。加上大盘也是波段头部。理应,2985,2017-08-12,0.021272491435410656
东方财富又获得国家队证金公司增持1120万股,14007,2017-08-09,0.6399112290602443
下周主题：混改＋雄安＋创蓝。 第一、国企混改,25459,2017-08-21,0.3137863893031766
国内开放国际金融，中国将取代美国成为国际金融,6646,2017-08-16,0.9999287366239946
12.13进9800股 12.14进10000股，前期11.11成本,55420,2017-06-04,0.17884803676898942
奉劝某君谨言慎行！ 在股吧自由发表自己的观点,13913,2017-08-19,0.404890639623385
“蓝牛”市场的三大特色！ 本轮“蓝牛”行情彰,15620,2017-08-09,0.9999079314494407
混改接力，创业板上涨趋势确立。 今天的市场不,20986,2017-08-17,0.8100203614758487
涨跌寻常事，韭菜平常心，大跌不改“蓝牛”方向,14713,2017-08-12,0.8614583785717111
市场小心翼翼，A股缩量反弹，慢牛特征显现。 今,22281,2017-08-14,0.798846637611146
风水轮流转，创业板放量反弹。 有限的资金进优,22625,2017-08-16,0.9963815649566311
东方财富投资5000万元设立保险代理公司,131604,2016-04-14,0.9020945527732693
虽然今年基金的销售额略低于去年，但是申认购比,10303,2017-07-30,0.7164862032383489
人弃我娶，这样的股票，现在这个价位，等同于白,52280,2017-07-21,0.7820833557097395
东方财富，你将是2017年度的牛股，现在已经是龙,20632,2017-08-08,0.8992642559871868
揭穿价值投资的鬼话，如果真要价值投资，招商银,4620,2017-07-18,0.9997151511106501
再冲14.37我就卖，否则死守当股东了[俏皮],9672,2017-08-17,0.1173101119197798
揭穿价值投资的鬼话，如果真要价值投资，招商银,14522,2017-07-22,0.9997151511106501
竟然还有这个隐蔽资产，太低调了！ 14 上海东方,28246,2017-05-06,0.4506905399002843
小户晒一下！小赚，东方财富永远持有！,38721,2017-08-08,0.705403271113797
为保持股吧多空生态平衡，我也来唱空一下吧！，,25246,2017-08-13,0.877184859494453
每日更新香港外资买入东财数据,6414,2017-07-18,0.8784108758825239
东方财富(300059)融资融券信息(08-16),14984,2017-08-17,0.9592539724594212
东方财富(300059)融资融券信息(08-14),14887,2017-08-15,0.9592539724594212
互联网券商战略持续推进，业绩或已见底,123841,2017-07-31,0.9973036587110113
科技券商的“破与立”,139155,2017-08-09,0.6119205010541172
挣了5.2%，卖了，不知对否？,8012,2017-08-17,0.259307753442502
这么大的量堆，肯定不是小机构，三季报看，估计,15575,2017-08-08,0.3360212002905576
东方财富8月16日盘中涨幅达5%,16948,2017-08-16,0.0971985391977237
买少少,20831,2017-07-18,0.23706291460729922
我不但是个财迷，而且还是东财迷。入驻东财到昨,20399,2017-08-10,0.7456826895632748
300059值得埋伏,33742,2017-07-10,0.7117589263692973
小心一片看好声下割一茬韭菜！,26774,2017-08-09,0.017365547659659364
近两周以来，指数接近3300个人表示不乐观，三只,4525,2017-08-11,0.9523318053289975
东方财富(300059)融资融券信息(08-11),11058,2017-08-14,0.9592539724594212
最怕今天尾盘护盘也来个丢盔弃甲！,16503,2017-08-11,0.0901898553859779
东方财富8月14日盘中涨幅达5%,19404,2017-08-14,0.15199947424357207
创业板冲关在即  必有东财发力,18389,2017-08-09,0.8762313967531965
PC开户常见问题 ,328092,2016-03-09,0.45635222673078857
看好财富-该出手时就出手,7603,2017-08-08,0.8655587655454773
一首打油诗--就是股市近期的路线图。,61516,2017-08-02,0.9984039338577524
看图说话：东财龙头品相初显 回抽就是买点,4985,2017-08-12,0.7852226052276261
东方财富10.50附近已成世纪大㡳！ 一是2017年上,30042,2017-07-30,0.8946562644323204
执牛耳,11630,2017-08-04,0.7864636874750255
为什么汇金大手笔买券商，都快举牌华泰证券了。,18910,2017-08-11,0.07591032022840993
收盘下杀是为了吃筹码,7730,2017-08-11,0.8251415388472393
这个公司不仅在证券市场上的兴衰方面 ,4459,2017-08-12,0.8525897729222527
核新电力太阳能光伏发电 电想怎么用就怎么用，,3647,2017-08-12,0.7579404905516715
买买买,1854,2017-08-11,0.5
资源股爆跌后大盘跳水，上午卖出水泥股塔牌集团,4897,2017-08-11,0.09989352060220968
今天13.13全部被谁吃了,6554,2017-08-11,0.492469005223213
余额宝限额了、有转入限制一天一张卡只能转入一,5118,2017-08-12,0.19913792653729767
星期一继续买进[微笑],7131,2017-08-11,0.8530001144809644
BA丅和京东如此强大，Gjd为什么不凭借国家的资,3976,2017-08-11,0.849370178067315
20万散户，洗不动啊,7104,2017-08-11,0.0934373142776952
大盘都跌成狗了，但东方不跌就是强。,2576,2017-08-11,0.3843124683053022
惨了，惨不忍睹。这些天散户进入太多。后市又要,4055,2017-08-11,0.0678195481901307
主升浪行情即将开启，随着时间推移，必股价打到,11911,2017-08-11,0.9990526169870487
如果还有套单的朋友，不妨让我来帮你排忧解难,4614,2017-08-12,0.5562626327309034
西水往低流，东方海财富。,4060,2017-08-12,0.9331115875397332
东方财富一统江湖！,2714,2017-08-12,0.9365006696411813
国家队投資大图谱，资金流向大挪移，为什么昨天,4976,2017-08-12,0.9939797790215329
黄金定律：吧里唱多的人越来越多，即是股票卖出,3711,2017-08-12,0.8145869115246778
福兮，祸兮,2410,2017-08-12,0.4737672181921908
300059,2808,2017-08-12,0.5
群内一片唱多，我至今买的股票都会死的很惨。,2082,2017-08-12,0.8995712266099836
见过太多的股票，哪些天股吧好多唱多，就是主力,2027,2017-08-12,0.44761217933306663
資源股爆跌，八月只买创业板，买点昆仑万维，不,2157,2017-08-11,0.25545024599334276
大盘整体下跌原因众人所知涨幅过大周期股。中小,2145,2017-08-12,0.6423804585047441
看到这么多人唱多，就知散户云集，本来想出手，,2160,2017-08-12,0.8694438318873783
此股从47.53元跌到现价13元，腰下价都不到，经,30320,2017-08-08,0.03015265595068617
东方财富(300059)融资融券信息(08-09),13506,2017-08-10,0.9592539724594212
大家好，个人这次的预判有误，这里先和大家诚恳,12250,2017-08-10,0.5435812905758598
折腾点菜钱,7407,2017-08-10,0.06753743171681492
今天算了一下证金的持股成本，买入金额，亏损情,17469,2017-08-10,0.13659901457416201
开个新帖，谈谈自己对东方财富和市场的理解，对,47191,2017-08-08,0.83998977040345
下午出12.65的新低再进，[大笑]东财主力你能耐,6522,2017-08-11,0.32231356788013
中国的嘉信理财将要起航：对东方理财师的几点建,10512,2017-08-06,0.8058979210057232
买买买，今天又买了点东方财富,7510,2017-08-10,0.7689687678330757
今天证卷強于大盘，昨晚全球跌，买了个塔牌集團,4835,2017-08-10,0.057887757093556425
在东方发帖三年，不买点东方财富，对不起咱这张,7672,2017-08-06,0.09307291925033312
今日开始重新关注创业板,17748,2017-07-17,0.9855000112257172
从心理学角度看，现阶段创板的弱势格局下，每次,18961,2017-08-04,0.749230101005402
东方财富(300059)融资融券信息(08-08),13585,2017-08-09,0.9592539724594212
东方财富:关于使用自有资金与部分募集资金利息,44181,2017-06-28,0.9995046829349518
东方财富:关于公司创业板公开发行可转换公司债,44480,2017-07-07,0.8316509207776106
东方财富设立小额贷款公司获上海金融办批复,78141,2017-07-07,0.9825507396984858
东财-严重低估的互联网平台 东财证券，前期完成,44410,2017-02-13,0.9816427736469111
今日大势研判：,10899,2015-10-16,0.9668648415480823
当一个板块趋势起来的时候，尤其主力资金关照的,6174,2017-08-08,0.7356144509994141
东方财富(300059)融资融券信息(08-07),15648,2017-08-08,0.9592539724594212
个人上周表示不乐观，但是也没想到会这么狠。创,10885,2017-07-17,0.856688762930786
东方财富：底部放量，坐上主力自救的顺风车！,17655,2017-08-04,0.9393717318207778
两个月后14元以下的东财你这辈子也看不到了！！,14463,2017-08-07,0.05230368495597437
七月份东方财富沪深市场份额: 股票:1.5474%，排,19956,2017-08-07,0.8859978897333076
中报速递：东方财富2017年上半年盈利2.6亿元,95780,2017-07-28,0.7021035144921831
明显拉伸出货，看看现在大量卖出就知道了，收盘,21025,2017-08-07,0.6147634641714076
陪伴是最长情的告白，相信东财必能凤凰涅槃 东,41821,2017-04-25,0.9184154101376922
东方财富(300059)融资融券信息(08-04),16222,2017-08-07,0.9592539724594212
东财证券7月数据,22199,2017-08-05,0.3182101293873012
东方财富:关于公司2014年股票期权激励计划授予,110251,2017-08-03,0.8597091043968603
我不但全仓，而且还带杠杆，买的东方财富和基金,16531,2017-07-31,0.9331616484060975
东财将一大块利润藏了起来，以利于让一些机构吸,58983,2017-07-31,0.5254118827332217
五星出东方利中国！清晨东方的一缕阳光，一缕清,6712,2017-07-31,0.9591827069643546
看得懂东方财富的人都会清晰地知道东方财富未来,22095,2017-08-04,0.9993842161407761
东方财富(300059)融资融券信息(08-03),18481,2017-08-04,0.9592539724594212
东方财富(300059)融资融券信息(08-02),26172,2017-08-03,0.9592539724594212
趋势不变，震荡之后再创新高！  A股在周三创今,9664,2017-08-03,0.3309434989179465
今日最后31013手成交情况！,21858,2017-08-04,0.7617831242592715
下周热点应该在创业板小票身上。东财这周的爆发,14605,2017-08-04,0.9654613940899275
送转股是数字游戏并不提升投资价值！是诱多股民,28753,2016-03-23,0.9985637676049477
昨天开板，那么大的量，我全卖了，估计会回调洗,7098,2017-08-04,0.04432757767144058
底部放量是主力进场的信号，是散户进场追随的底,23040,2017-08-03,0.546238755075983
耐心等待回落11.6,4910,2017-08-03,0.30346350662089394
欲擒故纵，顺手割一把韭菜！ 周三，权重板块发,8393,2017-08-03,0.24272812287326828
作为一个90后操盘手，此股不破13，不会进。此股,52278,2016-10-16,0.04797236751826017
创业板相关问题汇总,40429,2015-08-23,0.3074607297614099
竞猜，这一波涨到多少？,9148,2017-07-27,0.515298232037348
四千点，既平“谎言”又圆梦！ 上到市场的监管,11589,2017-08-02,0.9821602556906339
国家意志人造牛！ 今天是中国人民解放军成立九,7512,2017-08-01,0.9997371639663329
东财下一目标，破10元，10以下想买的，可以分批,17074,2017-07-17,0.11847904116400798
东方理财师，好样的,26334,2017-04-04,0.4596137412336404
东方财富:关于子公司西藏东方财富证券股份有限,72546,2017-07-31,0.995715998993691
东方财富:2017年半年度报告,80004,2017-07-28,0.8491996137070593
若东财能发语音和红包的话，市值可达万亿,6335,2017-08-02,0.4352156183425425
东方财富证券上半年净利润增幅超过300%,122742,2017-07-26,0.6161429617981824
主力找到支撑点。开起拉升,3034,2017-07-19,0.40004585299292983
这个半年预告有点配合庄家洗盘吸筹，二季明显业,20397,2017-07-16,0.9883097589928007
有在东方财富证券设置自动打新股的吗？有中的吗,8128,2017-07-31,0.758794948552802
东方财富出现第五浪衰竭性下跌，目的就是底部区,45838,2017-04-21,0.6119795051400374
东方财富:关于全资子公司上海东方财富证券研究,76409,2017-07-25,0.9785728329254365
东方财富(300059)融资融券信息(07-28),8502,2017-07-31,0.9592539724594212
选择东方财富，走上致富之路！,4849,2017-07-31,0.9294292270753043
东方财富      承载梦想！！！,105368,2016-03-15,0.9746276703665985
上午买，下午套，尾盘做多都上吊!尾盘拉高是为,25560,2016-04-12,0.02320117584317749
A股的出路在于严打造假、垃圾股批量退市！ “翻,4775,2017-07-31,0.0030549896229326023
终于找到了原来全宇宙最大多头强势入注东方财富,17491,2017-07-29,0.9942393195214726
章建平不在十大股东内了,24368,2017-07-28,0.4718797800224448
经纪、两融增速显著，互联网券商优势已现,121680,2017-07-20,0.8803911694386576
深度报告：流量龙头，蓄势待发,167094,2017-06-27,0.21529026261655104
东方财富2017年半年报分析和 三，四季度利润表,16918,2017-07-29,0.5317081905947986
东财财富中报业绩预告分析 声明：以下分析全部,28275,2017-07-14,0.99282385580469
有搞头了，汇金增持一千多万股，同时一保险资金,34399,2017-07-28,0.7891764122492506
看中报。东方财富的炒股大赛的钱 到底支出多少,14044,2017-07-20,0.6523834582500473
还是老老实实学点财务吧,10875,2017-07-28,0.23088745908164854
东方财富铁地...,26863,2017-04-19,0.8417819657869046
东财的机会要快了！,18063,2017-07-26,0.9699928732819263
股市里大部分人的看法是错的,13389,2017-07-22,0.9543765013073839
太弱了。。。,3284,2017-07-27,0.6284343544995347
11.38清仓完毕 买进银行 把机构套在山顶！两头,8087,2017-07-27,0.661413212099986
300059东方财富，绩优股反弹会比较持久,8202,2017-07-27,0.8067987606245386
啥也不说，买东财赌的就是大牛市，没牛市，大家,6286,2017-07-20,0.8908845445950493
东方财富预计上半年净利润2.20亿元至3.00亿元,121092,2017-07-14,0.3757723871587888
东财3个月内涨到20到30,10066,2017-07-27,0.07862005558512208
个人对空方的态度是明确的、一贯的，对做空行为,4859,2017-07-27,0.6835848499033973
东方财富： 一心只为争功名，十年寒窗未曾停。 ,38023,2017-04-20,0.9401215563112405
东方财富已经跌破500亿，进入买入区间 一直关注,14165,2017-05-19,0.9387012452285702
本来只想说，延续观点，主板本周下不去。但是考,4642,2017-07-26,0.9220406321069236
指数表现一般，个股表现精彩,3646,2017-07-21,0.9080351623031733
我解释一下什么叫做物极必反，乐视是创业板，东,11140,2017-07-12,0.30374512879536053
后市的关键：资源股和券商还能弹多久？ 昨天，A,10717,2017-07-20,0.2821653866676017
东方财富(300059)融资融券信息(07-25),12491,2017-07-26,0.9592539724594212
