标题,帖子数,日期,情感
过了20就到30,过了30就到50,过了50就到...也许1,4664,2016-06-28,0.2674951281980926
此地无银三百两，骗筹码升级版，更坚定300了,5356,2016-06-30,0.3698983184997301
中国核建就是一家造房子的建筑公司，举个例子南,2867,2016-07-01,0.9442955371083811
中国核建涨停数还不到20个，怎么就停牌核查？,13221,2016-06-29,0.7970529887091558
前天缩量本来主力看不到希望了，也就没拖喊了，,1753,2016-07-01,0.05415323853815557
新股研究报告：核电工程建设龙头企业，国内和海,140130,2016-05-24,0.9423278958166594
今天中国核建复排，开盘价是多少？我觉得是22元,2741,2016-07-01,0.850590741767161
赶紧告诉我明天跌停价是多少？我要挂单卖卖卖！,5099,2016-06-30,0.0034767175848772203
停牌审查的股票只有核建复牌了，经受住审查、根,4023,2016-07-01,0.8928391015596306
零点零零秒挂单23.01买入，单号1378。证明买盘,7324,2016-07-01,0.1465400731829133
新的挂单价格,6693,2016-07-01,0.288841050068962
中国核建关于股价异常波动核查结果暨复牌公告(,8177,2016-06-30,0.9819121712952416
中国核建继续5个涨停板上,3518,2016-06-30,0.9836988078833541
规则不明确、随意性太大--停牌核查有依据吗？,4752,2016-06-29,0.19131969754436617
大家一起告上海交易所这些比养的,3925,2016-06-30,0.20743510861099002
明天是中国共产七一诞生节！为庆祝的生日，中核,2755,2016-06-30,0.810384519735626
核建董事会是聪明的！,16639,2016-06-29,0.9062449868795419
查上交所网站，停牌是真的,6711,2016-06-29,0.10894165827742985
中国核建发行价就应该在20以上,3877,2016-06-30,0.9439749311050387
复牌不卖反锁仓的回8.复牌卖的回7,21107,2016-06-30,0.0012184426247150437
广发证券：中国核建合理价值为5.18元,4913,2016-06-29,0.8919106382462368
成本三千多，卖不卖无所谓！,4990,2016-06-29,0.36232365853628057
此次停牌个人认为是非常不合理！原因有三： 1、,29422,2016-06-30,0.07444843266779899
亲们，理性分析，这个股是公募基金私募基金，国,4860,2016-06-30,0.9999985416982883
本团队经仔细调研后，庄严宣布：建筑、军工新龙,3393,2016-06-30,0.12191841223490496
中国核建明日复牌，请大家暂聚力于核建 停牌5只,6594,2016-06-30,0.6491782798370277
我的软件监测到，已经有340万封单等着买了。 我,10738,2016-06-30,0.03429586514872651
明天开盘必看,6003,2016-06-30,0.5172885362793603
我宣布，明天是中国核建上市的第一天，最少十五,6016,2016-06-30,0.791147226022747
特大喜讯：上交所通知明天核建以20.92元的发行,11170,2016-06-30,0.03760417005201988
新股开板普遍是50倍市盈率，按这个中国核建每股,14403,2016-06-26,0.7887610992556704
明天集合竞价阶段多注意封盘情况，经过今天的停,9454,2016-06-30,0.4183714060894421
今晚必看,10048,2016-06-30,0.7100568662410488
明天愿与主力抢筹的请举手,8406,2016-06-30,0.3943698079414878
复牌一字跌停！！！,11510,2016-06-30,0.11848924596573995
大家今天晚上一定要挂买单！原因是：,5320,2016-06-30,0.07522441797325563
中国核建 前无古人后无来者 ！  我的天啊！,2313,2016-06-30,0.8727100659384318
看图说话！,3441,2016-06-30,0.6174110207975949
能中核建的都是有钱人,4845,2016-06-30,0.3366750819109885
今晚有已经下单了的股友报道了,4268,2016-06-30,0.2676689922070409
说多无意，，明天最关键，每人挂500股吧，都想,3751,2016-06-30,0.15120772204198762
停牌核查，例行公事而已。 昨晚，一则公告， 引,24449,2016-06-30,0.052776356118441003
丝毫不气馁，顶多就一中性，就当熊孩子放了一个,2441,2016-06-30,0.8772503344941714
对中国核建停牌的疑问,11074,2016-06-30,0.9427962003201351
你认为核查合法，回1，认为非法，回2。,9587,2016-06-30,0.0009601898970947875
半小时过去，封板量增加了11.3万，现在351.3万,6072,2016-06-30,0.42603827028365693
社保在外面排了几个星期的队都没买到,不停怎么,4332,2016-06-29,0.049898900231029386
这次中核建签的都是10年以上的老麻雀,46必须到!,12515,2016-06-29,0.3918931771791577
我的大概意思是总量在缩小，别看封单少了，那是,19563,2016-06-29,0.3839335062996566
对于挂单,很多散户不敢挂,现在来给大家分析一下,5932,2016-06-29,0.17360285248046092
到现在一板收益才2000钱,真TMD不好意思说出口!,12517,2016-06-29,0.6991582692452148
今天下午有空托，机构在叫嚣着严查恶意做多，晚,6512,2016-06-29,0.48269049429515354
搞明白了，核建不是万科,4782,2016-06-30,0.6029925979032544
利好,3982,2016-06-30,0.5
请教，谁会拆字，60,16,11,5603,2016-06-30,0.05539084139998651
大家猜猜明天换手率是多少！！！,4365,2016-06-30,0.018495049862978674
明天复盘了。同花顺里出公告了,18256,2016-06-30,0.31396501133034416
停牌的真正原因,9785,2016-06-30,0.4133460412150185
我们散户要彻底粉碎机构的阴谋,明天有闲钱的继,1894,2016-06-30,0.8827024247454177
具备中国唯一，世界少有的上市公司，当然该大涨,2180,2016-06-30,0.9990692629816398
停的好，大利好！　　         新浪财经讯 6月3,5946,2016-06-30,0.5070785052002669
601611:中国核建:关于中国核工业建设股份有限公,157750,2016-06-29,0.980054339945106
中国核建公告:因公司正在筹划核建集团整体上市,8243,2016-06-30,0.5044771488651159
明天复牌，一点p事没有！只不过是未公告的重大,4868,2016-06-30,0.1673764303664802
复牌直接炒上3000元，新股稀缺、核建概念稀缺不,1972,2016-06-30,0.6204536019594976
有血性的散户团结起来，不卖！连板，向八一进军,1038,2016-06-30,0.10691708527576604
别瞎猜了，核建停牌是有重大事项未公布。,5550,2016-06-30,0.8000159743699571
5到20是量变，20到50是质变，50到100是裂变，10,7696,2016-06-29,0.33263174646308113
中国核建明天开盘死定了。又要死一批人了。,6286,2016-06-30,0.7759293423786916
重要的是说三边，停牌是好事，有公告为证,9301,2016-06-30,0.2123117754421907
停牌确认20.92元为发行价！,5766,2016-06-30,0.2985457797874912
中国核建最新公告:重要事项未公告停牌,13662,2016-06-30,0.9420573527040252
强烈抗议交易所随意、无正当理由暂停上市公司交,5434,2016-06-30,0.39545834793962986
刚说完不要随便停牌，话音刚落又随便停牌了。,1795,2016-06-30,0.2937114108820301
中核建16连后我个人的一些拙见,18309,2016-06-29,0.3119604636205088
每人每天挂封单的签到,4631,2016-06-29,0.09331452323485079
中签必看，非常重要。,36253,2016-05-27,0.7433805773521024
为什么16连板只停核建?只因核建太值钱!,6277,2016-06-29,0.011802768411801945
核建停牌是 机构的 阴谋,5164,2016-06-30,0.938733119302594
对这次证监会对五家次新股停牌的分析,19451,2016-06-29,0.7655379932790307
坚定信心：核建超威龙,21529,2016-06-13,0.9058660314910536
掐指一算，能连板到7月22日，知足了,34025,2016-06-19,0.39968504753454237
高人，怎么看停牌自查,7924,2016-06-29,0.5785459069545519
强烈对这种莫名其妙停盘行为谴责！,6064,2016-06-30,0.040237523492210436
46.8万股东居然这么齐心不抛售真是史无前例啊,6200,2016-06-30,0.612509802902503
随意停盘   中国股市的悲哀,2311,2016-06-30,0.9856499837815648
关于N核建(601611)盘中临时停牌的公告,123659,2016-06-06,0.44452185201201244
关于核建停牌的思考（详细） 核建16连击，很给,18378,2016-06-29,0.9964858299689349
对停牌公告的看法：这是违法行为！,7636,2016-06-29,0.13953468559433269
核查结果---散户不肯卖，气死你,3705,2016-06-29,0.061848564125074446
由于主力拿不到筹码故要求证监会出手。暴风科技,9384,2016-06-29,0.6662566500533325
停牌是在给核建做广告,5917,2016-06-29,0.40064488534114395
不卖者联盟，我第一个不卖，即使核查复牌也不卖,5720,2016-06-29,0.07064373865319606
核建停牌之猜想，中签的各位要有信心！ 为啥买,5748,2016-06-29,0.8913465409109286
中国核建目标40元，军工核第一股,4955,2016-06-27,0.9377490819011999
是真的吗？,6533,2016-06-29,0.6111111111111113
中国核建股票交易异常波动实施停牌的公告,8229,2016-06-29,0.9848883561126158
不怕，不怕，不怕啦！ 机构对倒不呀不怕啦！,7054,2016-06-22,0.2501899275314219
人品爆发了。,4628,2016-06-29,0.35072516527654074
中国核工业建设集团公司简介（中签必看）,19101,2016-06-25,0.7215856797569542
你们都拜错了！看我拜的《马祖师爷》特灵 又中,17941,2016-05-27,0.9195554999713014
老规矩明天9点15分挂涨停板买单!,3712,2016-06-29,0.040396715402723604
散户的力量也只有在新股中体现。,8082,2016-06-28,0.9788186677085742
20元开板概率不高，合理价25元，乐观30元,12605,2016-06-06,0.4937908506211557
中国核建真正价值在这,16638,2016-06-02,0.9556000195907834
懒牛预测中签率及收益,29901,2016-05-21,0.9898987073541277
下周起，一天赚一部手机，从小米到华为,8435,2016-06-25,0.7246489784800186
越往后的涨停板越值钱，大家一起加油！[献花],7122,2016-06-21,0.9528810208645779
感谢鸡狗锁仓,但也提醒鸡狗们请莫做它想!,17190,2016-06-29,0.6202342154199788
卖出的都是等钱办丧事,9051,2016-06-28,0.11420836485814867
孩子比我悟性,18183,2016-06-27,0.7887577711985915
未来中国核建股价  有图有真相  哈哈,7137,2016-06-29,0.9971574343940669
居然1手以下(0手)的交易也出来了，什么情况？,5386,2016-06-29,0.0321482673574508
尾盘出货非常明显.撤单数度太快.预测星期一必开,14560,2016-06-24,0.2380552714047448
勉强还有一根涨停.已经非常辛苦了.最后一根稻草,7566,2016-06-24,0.5807272425083972
6月6号要上市了！看到好多人中了一千股都希望这,51993,2016-06-02,0.22176322851555563
挂单，为自己为大家尽一份力,2958,2016-06-28,0.35267903186390104
中国核建将成为沪深两市第一高价股,6171,2016-06-28,0.2912482779308381
短期第一目标超五粮液，长期目标超茅台原因如下,35086,2016-06-08,0.9599065672829666
蛋货们，看，我忽悠你们干嘛？,10767,2016-06-29,0.011482660867819794
没有梦想和咸鱼有什么区别？？今起全部家当挂封,10560,2016-06-28,0.14701763891247532
今天有中签户卖出股票晒单后遭众人唾骂，这点不,3980,2016-06-29,0.9646465635527551
上午的量缩的不成样子了，筹码越来越牢固了,4328,2016-06-29,0.9430357715106343
自从核建上市到今天16个交易日，我天天挂单，没,5041,2016-06-29,0.3757378277676693
一天进1000元比我卖菜强多了，一定要给旁边卖豆,8159,2016-06-21,0.0957847232502903
20过了，30还远吗 ？？？,2264,2016-06-29,0.29640938606919554
首先请大家为轰隆隆鼓一下掌，感谢他晒单的正确,4810,2016-06-29,0.656345552537613
昨晚挂单6万股终于买到5000股核建好安逸！,8221,2016-06-29,0.40755423512926003
不恐高 不恐慌，捂股+挂单, 为自己为大家,团结 ,1211,2016-06-28,0.0006718944835800711
今天注定又是平静的一天。开盘半小时，盘中没有,8752,2016-06-29,0.8989617952518432
关于核建的几点看法,7328,2016-06-28,0.5567190991489877
中字头 首都北京 军工 核工业小盘股！你懂得！,3406,2016-06-29,0.5801335051868454
谈一谈核建你心目中理想的高度是多少!,16910,2016-06-26,0.3753451350968664
知足常乐，呵呵！,7267,2016-06-29,0.9751059760973669
机构也不是铁板一块，也有分歧。一些小机构其实,4156,2016-06-29,0.019038971958387774
中国核建进入新常态,7973,2016-06-28,0.9854444009719984
6月28日核建收盘播报。 集合竞价成交13141手， ,71294,2016-06-28,0.18860407182309746
挂了涨停板的报道了,3723,2016-06-29,0.8692439972352197
关于核电买卖的十句大白话,48091,2016-06-25,0.09039524233230334
宜将剩勇追穷寇 不可沽名学霸王,6052,2016-06-28,0.9949277855654427
没有梦想,与咸鱼有何区别(转三棵树吧 凹凸曼经,30733,2016-06-28,0.8989898989898991
每天坚持挂单买入，今天的已经挂好。,4113,2016-06-29,0.2807597909912415
刚中核建股票的时候，我跟我老婆说，一般新股至,7780,2016-06-28,0.5572430382221798
我做股票基本是T+0为主，很少这么关注新股，最,10169,2016-06-28,0.958209097417071
再涨7个停板，38元每股，大家有什么看法！,10465,2016-06-28,0.6884843821809231
文人定律之新股开板三大定律,16875,2016-06-27,0.03619155817500053
到三棵树吧取经,向三棵树散户学习,17445,2016-06-26,0.978045799038215
亲爱的核建粉们，请允许我谨代表核建不卖联盟，,10739,2016-06-23,0.9977745725381459
2016.6.28.核建收盘播报。 补充数据。 累计成交,12915,2016-06-28,0.6220045805093161
记住，一旦开板，不是我们卖的时候，反而是我们,5187,2016-06-27,0.2058879901250188
老夫掐脂一算，下周一必开板！,15621,2016-06-24,0.6285127816253283
中国核建股价不会破25元,10549,2016-06-28,0.27941986961402543
601611:中国核建:关于中国核工业建设股份有限公,87233,2016-06-26,0.980054339945106
明天可能开板.明天走了.祝大家发财,9170,2016-06-28,0.5007612221453394
是今天卖还是明天卖呢？？1000股是不是该知足卖,7588,2016-06-28,0.06171795401727609
应邀发,2993,2016-06-28,0.30311160051929864
中签的散户抛了吗？,5768,2016-06-23,0.5193969958594796
致中签者，中签是我们的福报，让我们利益最大化,26214,2016-06-11,0.8076244084153434
弟兄们，原来期待能赚一万块，过十五就知足，现,6397,2016-06-28,0.46248863693169373
中签者团结一致，一字天梯漫步云端吧。,37263,2016-06-16,0.7276878598293244
在即将登上20元的前夜，很多人开始彷徨，而我只,13824,2016-06-28,0.9194978327278399
今天是第15板，第一次看吧里发的核建33板图片时,7503,2016-06-28,0.69304633916959
再次感谢散户们的团结，让我们又多赚取了更高的,3669,2016-06-28,0.8824870246745116
中签中国核建的兄弟姐妹们，现在股市只有新股爆,2923,2016-06-28,0.3377567725844831
核建不卖联盟公告: 到即日止，剩下的都是铁杆儿,23330,2016-06-27,0.5748221556022205
早上挂买单的，有成交的吗？,7954,2016-06-28,0.11086167123806223
核建明天进入20元阶段了我们第一个目标位实现了,6342,2016-06-28,0.9384046925900218
登机。,5439,2016-06-28,0.5
每天打买1000股核建终于成交了，午休醒来原来是,10412,2016-06-27,0.6239025473555823
说句公道话吧，34.7元才是核建起步价，为啥？进,16276,2016-06-23,0.5200096734241261
今天忘记卖了，没想到又吃了一板，开心，明天一,18765,2016-06-14,0.38738752313943714
大家再接再厉，争取再翻一倍，到38才到今年中签,5670,2016-06-28,0.7432915910156672
向二十前进！为我们中签的散户点赞！为主力点赞,1985,2016-06-28,0.9620952163302177
核建还没开板，哈森皮鞋明天上市了，有中签的朋,3671,2016-06-28,0.5759395716592951
不放量，今天不会开板了，明天20.02见,7386,2016-06-28,0.09696671646660238
有缘的朋友一起擦皮鞋去。 今日西线无战事，核,4058,2016-06-28,0.9368944842185222
大家讨论一下 明天上20了 大家卖么？,12347,2016-06-28,0.3961285637166079
大家坚持住，中国核建和江苏银行两个巨无霸并驾,3119,2016-06-28,0.37239357682242347
前十二板的真实换手率不会超过3%,82884,2016-06-26,0.05857587364653882
准备用这一签买车呢,8161,2016-06-25,0.1903548839415582
挂了19. 02的报道了.[胜利],12448,2016-06-27,0.3873415667743353
美哉我核建中国，与天不老；壮哉我中国核建，与,9797,2016-06-20,0.9844852375016018
今天不跌停。。。我吃1000000000000斤大便。,22661,2016-06-22,0.09008111783372963
老股民一定还记得07年的中国船舶，从当初的10几,4882,2016-06-28,0.9785445454149015
今天23日早早挂单，碰运气：,10294,2016-06-23,0.00534735635389838
凡是12.99以下卖了的 都是傻逼,10273,2016-06-22,0.23772239177907317
明天15.72元不会开板的,5431,2016-06-23,0.0998531928369939
我说核建能上300，我的依据是,6619,2016-06-27,0.8542025034641137
中签请看，看了至少能多三个板，顶起来,14484,2016-06-27,0.23159702465614118
如果今后五天内，机构撒单硬要碰开盘，我们小散,4182,2016-06-22,0.003443680580098807
如果今天打开涨停板，小妹献出如花似玉身,6164,2016-06-28,0.614775347197686
涛声依旧,3807,2016-06-28,0.6552476304899219
实在对不起一起走过来的股友,4838,2016-06-28,0.06061262622215979
6月27日核建开盘播报。 集合竞价成交17633手， ,11431,2016-06-27,0.09583632237302131
46元是起步价!,4163,2016-06-27,0.9329455191423497
依旧看好核建，再挂1000涨停板,2933,2016-06-28,0.9382406549142349
今天有开板的气份,5080,2016-06-28,0.4737672181921908
牛哦，没想到大盘股也能这么多个板，幸亏没卖，,8117,2016-06-27,0.12986647330120815
按我推算，中国核建会在50元附近开板,6106,2016-06-27,0.8472266965090256
关于核建连板的思考（详细） 从核建上市以来，,22908,2016-06-27,0.9983435640780652
核建不卖联盟的弟兄顶起来，让空狗看看我们的力,3536,2016-06-27,0.8375880127046738
中签散户的伟大胜利...,10001,2016-06-27,0.46578328702738014
又胜利了，中国核建未来的目标价：34.70元 最近,9631,2016-06-27,0.9993067924616141
核建确实超出了我的预期，看这架势还有几个板。,11562,2016-06-27,0.8085813384873574
6月27日核建收盘播报。 集合竞价成交17633手， ,67514,2016-06-27,0.17490992115590576
核建17.29十分健康，明天19.02依然健康！,20987,2016-06-27,0.9705003698079596
你们忽略了最关键的问题,11004,2016-06-27,0.9306392593226702
朋友们千万别出,4429,2016-06-27,0.6152260783510701
€€第一创业这个垃圾都50了，核建不到90元都是,25708,2016-06-08,0.23042862991917834
星期一不开板我割十条叽叽,12571,2016-06-25,0.47990712055049367
核建明天要开板了,14306,2016-06-27,0.6862862292021225
定律：现在中一签必须挣3w！,6469,2016-06-27,0.12442540864339335
也来谈谈中国核建,8761,2016-06-13,0.8822009342475637
中核建到顶了 股价超过20我吃粑粑,13980,2016-06-24,0.4369843870733967
老规矩9点15分涨停板挂1万股买单!,3556,2016-06-27,0.026031125264226573
我真不能预测中国核建值多少钱，因为它太珍贵了,5251,2016-06-27,0.9919783728465678
再来20个板散户就该考虑买啥车的问题了!,5489,2016-06-27,0.10962244125285991
参考威龙股份和赛福天，就能判知核建的未来！,23747,2016-06-14,0.9166242673743731
中国核建中签者大联盟，不到30元不卖，有种你加,13823,2016-06-26,0.7937547657082973
参考威龙股份和赛福天，就能判断核建的未来！,35426,2016-06-15,0.9903342345789969
憋不住了，收盘前射了。,4917,2016-06-27,0.23984530004358717
中字头 首都北京 军工 核工业小盘股！,11024,2016-06-20,0.44347816975277976
报告大家我为给孩子的承诺：中新股给孩子5000元,6988,2016-06-27,0.9571080708545695
大家说这周还能全部一字版么,5475,2016-06-27,0.12443876562722878
新股不用看是否开板，而应在收盘前看换手率,8463,2016-06-24,0.35260193722928135
核动力航母  核潜艇  核电站  601611 你懂得！,17014,2016-06-15,0.8324967868163937
夜观星象，单姐掐脂一算：本周继续五连板,3145,2016-06-27,0.2175146339829358
601611:中国核建股票交易异常波动公告(2016/6/2,54682,2016-06-26,0.9588078627516274
中签散户三必知,8035,2016-06-27,0.5330308813415633
[图片],5482,2016-06-27,0.5826086956521737
下周五：40.76,2546,2016-06-27,0.4737672181921908
这个时期发行核建的目的其实是让大盘涨上去的!,11573,2016-06-25,0.9315566327076852
没挂单的散户兄弟们，挂点吧，提振士气，不是为,2671,2016-06-27,0.010917942987088813
601611中核建中报时有10送50股的高送转方案,8431,2016-06-27,0.12119960162737997
28号我去台湾出差8天 回来后依然开不了板,14411,2016-06-24,0.19163361196779094
夜观星象，老夫掐脂一算，6.27必开板！！,7802,2016-06-27,0.16904148275360675
这几天都有新股抽签！,5470,2016-06-22,0.2322615531481148
下周见30,10829,2016-06-24,0.2567126867021363
这一签肯定赚8万！,10431,2016-06-25,0.13773751726480077
解释机构为何敢在盘中砸大单,不怕砸没了吗?不会,7567,2016-06-24,0.00584156743245523
核建涨幅会让你大惊失色 很可能超过170元左右,23347,2016-06-24,0.6986048817074794
我没骗你！《你看，真涨停了吧！》 哈 牛 哈 加,10118,2016-06-10,0.9015610206602225
不必用不确定的猜想和确定性的事实对赌。 不用,5176,2016-06-26,0.9915399340440592
周末两大消息,极大利好中国核建,39869,2016-06-26,0.3956010582252686
关于核建的几大预言,37630,2016-06-23,0.7343040563996943
中国核建(601611)龙虎榜数据(06-24),96771,2016-06-24,0.9852506275475066
今天换手最多2%点几,空狗们不要半夜鸡叫,6036,2016-06-24,0.4247228016716059
持有“中核”的股友…上市后；大家一起共享99个,17623,2016-05-27,0.226169716937777
中核：上市后“超越”暴风30个涨停板 大家一起,24014,2016-06-01,0.8735356158740122
明天我在跌停板处等着：超大盘股中国核建从涨停,7668,2016-06-26,0.9136162006776127
中国核建，国防经济价值6000亿元,10690,2016-06-09,0.9557745101961621
持有“中核”的股友：6月30日；上市第17个 10％,5907,2016-06-24,0.012468761343464196
持有“中核”的股友：6月27日；上市第14个 10％,5969,2016-06-24,0.009970481457454938
持有“中核”的股友：6月24日；上市第13个 10％,9466,2016-06-21,0.012902418419126427
持有“中核”的股友：6月23日；上市第12个 10％,9510,2016-06-21,0.008890280205410828
持有“中核”的股友：6月22日；上市第11个 10％,10089,2016-06-21,0.00933373191188902
持有“中核”的股友：6月21日；上市第10个 10％,10468,2016-06-17,0.006048157262707798
持有“中核”的股友：6月20日；上市第9个 10％,10968,2016-06-18,0.007202412158868965
持有“中核”的股友：6月17日；上市第8个 10％,10898,2016-06-07,0.015212101556312807
持有“中核”的股友：6月15日；上市第6个 10％,11377,2016-06-07,0.009773925573665965
持有“中核”的股友：6月13日；上市第4个 10％,12861,2016-06-10,0.01214956826594582
持有“中核”的股友：6月8日；上市第3个 10％涨,13528,2016-06-07,0.02704772672759037
持有“中核”的股友：6月7日；上市第2个 10％涨,13842,2016-06-05,0.020847590870135768
持有“中核”的股友：6月6日；上市第1个 44％涨,19131,2016-06-05,0.0159789876128279
机构操盘手法:,7351,2016-06-23,0.8167816157508475
已经挂涨停板的来报道了,9104,2016-06-26,0.8568369296567805
明天早上每人挂1000股，将会有千万买单，谁他妈,3103,2016-06-26,0.0015940138249377345
中国核建能涨到什么价位？我已无这能力猜测了。,12419,2016-06-26,0.9929827195531186
喜报:今天买到1000股,24955,2016-06-23,0.3031459904047381
普京：中俄将拓展核能领域合作，核建再多十个板,6732,2016-06-26,0.987191699030362
羡慕周五的卖出者：今夜欧美简直就是屠城——,15839,2016-06-25,0.9971153202563655
调查，开板你会交出筹码吗,17716,2016-06-22,0.47294008576427127
有种莫名的感觉：核建会涨到60,5108,2016-06-26,0.3049894796910938
呵呵 王炸牛比 见过核炸吗 这波必见80元。。,2700,2016-06-26,0.987704254904233
华山顶才是核建的顶,5251,2016-06-25,0.8338335601976488
周二我把3W股核电卖了，全部买进核建,16618,2016-06-24,0.12177546907401182
对倒是为了让看到不是明显缩量，主力很狡猾。,6714,2016-06-24,0.04807438492238325
一个曾经中签江苏有线的投资者真实经历：去年身,36275,2016-06-23,0.995866726389955
散户团结起来，中国核建上40元,5585,2016-06-24,0.6101029683641123
为什么说中国核建将成为板王？因为中国核建是A,12571,2016-06-25,0.9968046152168574
全球唯一一家持续从事核电建造企业集团，你说值,4350,2016-06-25,0.6352152711881005
由于核建当时发行定价是15.60元，不知道为什么,10956,2016-06-25,0.05137549443629663
机构开始跑路了！昨天14:06卖出18000手巨单真的,8812,2016-06-25,0.09937422427920806
中核建下属子公司近期新闻动态（泄密请删）,9400,2016-06-25,0.42263659072571913
中核建5亿流通盘，300元才刚1500亿市值，世界极,8234,2016-06-24,0.06449833391485393
李稻葵：英国脱欧有利于人民币国际化,5132,2016-06-25,0.9728374472387447
菩萨说了开板前跑的不会让他下次中签了!,5894,2016-06-20,0.39182587733458907
601611:中国核建首次公开发行A股网下发行初步配,78784,2016-05-26,0.7294552552392071
通知 各中签小散主力们: 为了中国核建事业的发,5505,2016-06-25,0.8962633146084059
只要散户团结一致,涨到60是很有可能的!,3479,2016-06-19,0.3750780384166793
请教 1.8万手筹码哪来的,11749,2016-06-24,0.5296036571944501
6月24日核建收盘播报。 集合竞价成交16018手， ,29463,2016-06-24,0.20756947509796297
601611:中国核建股票交易异常波动公告(2016-6-2,55399,2016-06-21,0.9588078627516274
中国核建13天交易统计,17906,2016-06-24,0.9304535409386058
我说，如果下星期开板，大家有没有做好准备?,11944,2016-06-24,0.2886396814002876
