标题,帖子数,日期,情感
恭喜沪A东，以及小号小东97965 唱多成功,69827,2017-04-25,0.9876256403429231
核建下跌原因.就是为了吃解禁便宜筹码.哈哈哈,16610,2017-05-16,0.9953659956034572
上等人知道道理去坚持道理中原则做事.中等人怀,11293,2017-08-03,0.9924141370453572
刷屏发帖子目的是证明一毛根本无法短线赚钱.不,23820,2017-07-04,0.2240041759031255
每天小赚一毛钱.东财股友.北京中小股东.这三个,17325,2017-07-19,0.026606350125310096
大多数人看空中国核建.解禁日.咱们价值投资者开,31814,2017-06-12,0.9976582178295968
什么小东和一毛钱天天犬吠有意思吗?让大家都恶,1810,2017-09-01,0.6763807829086574
1月是18元，现在12.7元，买了放心。混改、军工,6864,2017-08-30,0.048352431466770596
[献花]冒充我司马懿马哥的大名，都是狗托，大家,2604,2017-08-28,0.06787288820943971
中国核建,混改先锋,21592,2017-08-17,0.9384628882380333
一毛我23元买的.下跌百分之五十.我成本8元为什,21285,2017-07-13,0.6413360912848156
大家看看一毛每天早上开盘关键时刻发帖子.不看,14860,2017-07-26,0.1716694289747085
大家看一毛今天不在开盘关键时间发帖子了吧.两,17866,2017-07-27,0.1699598792472785
中国核建：上半年净利同比增8.2% 证金公司新进,39653,2017-08-29,0.9413723303805385
中报速递：中国核建2017年上半年盈利2.94亿元，,29088,2017-08-29,0.8634107710311133
小东小毛给您们提个意见…您们天天刷屏，这天天,3627,2017-08-28,0.9465235887376707
这个股咋样？同学们？,10685,2017-08-26,0.1494878539205602
今天我司马懿马哥又来推荐一只大庄股，西安饮食,6216,2017-08-23,0.03377986915266884
[牛好困惑]女士们先生们朋友们！战胜内心的恐惧,5365,2017-07-23,0.9999416409471623
套了10个点了！要逼我跳楼吗？,17791,2017-08-22,0.7031387594734714
开盘是个极佳卖点，今天将开始拉升,10559,2017-08-23,0.07641519799964014
卖就跌，买就涨，买就涨停，买了就停牌重组，重,4340,2017-08-27,0.3191105721397107
我又来推荐两只股，时间窗口到，第一只是福达股,15788,2017-08-19,0.04795469983331102
一类股表现抢眼，后市有望全面爆发？！ ,73808,2017-08-18,0.8184578111376596
中国核建这周，是时间窗口，反弹的位子是13.30,26443,2017-08-17,0.9493727579284282
8月19号我在上证指数吧发帖，中国核建出货点在1,9866,2017-08-22,0.23511244908174667
难得我有文字图帖,16302,2017-08-18,0.9246063982085343
中国核建601611的深度分析，不看后悔一生！,35868,2016-07-02,0.9871141094601977
中国核建(601611)龙虎榜数据(08-18),99852,2017-08-18,0.9852506275475066
大家看一毛发看空帖子时间8月1号13.18.开始到昨,10935,2017-08-04,0.021464014586596303
601611:中国核建关于持股5%以上股东减持股份计,94958,2017-08-09,0.6700643397583017
中国核建8月18日开盘涨停,12681,2017-08-18,0.8108324021913951
中国核建8月17日打开涨停,17362,2017-08-17,0.5637724002937915
谢了  中核建。。。 好样的中核建，祝福继续持,95138,2016-07-01,0.9520740717453673
中国核建8月22日盘中跌幅达5%,18485,2017-08-22,0.4162073771039967
中国核建：前7月新签合同额410亿元 同比增17.2%,36828,2017-08-16,0.9581084610509957
中国核建是2017年股市3龙头,15174,2017-01-02,0.9591900080840682
我司马懿马哥用计算，时间窗口，量缩点推荐一只,10142,2017-08-18,0.031122857155376438
601611:中国核建股票交易异常波动公告,61900,2017-08-18,0.9627617986028257
《妖股追击》用心分享 2017.08.18 买卖记录！,12813,2017-08-18,0.9692829154745878
混改风口，一碗肥而不腻的红烧肉,17704,2017-08-20,0.18657137816358582
中国核建、佳电股份双双涨停——,57789,2016-12-25,0.9904601082356214
超级大鱼一条,28299,2016-11-23,0.5158934305297123
中国核建：股价连续涨停 无应披露未披露事项,45057,2017-08-18,0.9994282924198578
掛12.88减仓卖出中国核建结果以13.35涨停开盘成,6835,2017-08-18,0.364947363558089
中国核建8月17日盘中涨停,16045,2017-08-17,0.5669636933398087
一毛赔钱赔光本钱是他不知道做股票赚钱道理.他,4501,2017-08-08,0.6002015819382058
601611:中国核建关于经营情况简报的公告,90444,2017-08-16,0.893790531705124
鼠目寸光小骗子注定你们一辈子是穷鬼.哈哈哈,37148,2017-05-17,0.9125184986033605
中国核建贴吧有小东和一毛，扮演黑角和白角。先,8831,2017-08-11,0.8878963253267895
中国核建：中国信达拟减持不超1.98%股份,37477,2017-08-09,0.9770016867361146
可以买入了，来一波价值发现。三个月看高到14元,21357,2017-07-18,0.22294977096198476
我不需要别人相信我尽我一个普通股民的义务，看,7478,2017-07-28,0.6780838648765083
一毛你说说你为什么做骗子骗股民钱生存呢.如果,10434,2017-07-07,0.012723756434286693
请问一毛为什么删昨天前天发看空帖子.判断错误,3728,2017-08-04,0.031843465848761965
一毛昨天前天发帖子看空.告诉小散中国核建又要,3475,2017-08-04,0.2622904113277179
谢谢了，中核建。。 好样的中核建，祝福继续持,7993,2016-07-01,0.9447526695563947
小东和一毛钱都快滚吧，这里没有人喜欢你们。支,4691,2017-08-03,0.2141849670357049
短线下午核建怎么走.,25577,2017-05-12,0.9511782136221922
大家说说小东18忽悠散户接盘，为什么大跌后唱价,5541,2017-07-27,0.04211825237657363
[图片],20846,2017-06-14,0.5826086956521737
大家看看谁在骗人,19463,2017-06-14,0.13333333333333341
这吧很热闹观察小半个月，以我忍不住谈谈自己的,6012,2017-07-26,0.8997567822774746
本周分析：股市将震荡上涨,7506,2017-06-23,0.9189154650919735
这里到底有没有人出来管教下那两只狗,6316,2017-07-28,0.2286655004910927
特别注意:这次是战略重组，不是资产重组！战略,26229,2017-03-19,0.9991706268708511
看看骗子又自己揭穿自己了吧.说我是托是嘴炮还,2984,2017-07-14,0.1668589401077447
601611:中国核建关于经营情况简报的公告,76213,2017-07-14,0.893790531705124
行情在绝望中来临 如果你觉被核建折磨是忍无可,14508,2017-06-14,0.9788735499842023
进场: “双重改革”受益股,社保养老金标的股,7151,2017-05-21,0.9893200488469195
混改又如何？既已暴露，傻子才会拉抬此股！醒醒,40581,2016-12-19,0.0003078202928216145
看好核建，期待第二波冲锋[加油][加油][加油],12014,2016-11-05,0.9999235016054164
中国核贱，24到12，算不算腰斩,27086,2016-07-09,0.9047228460206314
601611:中国核建关于2016年年度股东大会决议的,47854,2017-06-21,0.9780441868271632
601611:中国核建关于经营情况简报的公告,51873,2017-06-14,0.893790531705124
601611:中国核建2016年年度利润分配实施公告,87944,2017-07-05,0.7813237656424061
别装了，拉起来吧,9013,2017-06-27,0.4830674347776972
中国核建：前5月军工工程新签合同额增长近8倍,64426,2017-06-14,0.956507397522325
军工核电业务安全有序，业务协同效应显著,112225,2016-09-02,0.9474086613531743
中国核建带领核电基建接棒，接替高铁基建炒作龙,30079,2017-03-28,0.33745751818171676
纳入国际指数，股民积极性正高，也是跳水的最佳,4862,2017-06-21,0.9634169615943315
这点风浪都受不了，抛掉的人离开吧，免得以后难,657,2016-07-01,0.059940577679098106
惊现隔岸观火日K线、已经很多很多年未见了。,33503,2016-09-23,0.4481486403631456
正在筹划重组的中国核建成立投资事业部,93781,2017-06-22,0.9614274231970178
幸好开板那天全出完了！这个垃圾就与中国核电、,7696,2016-07-25,0.09657140889578109
第一，刷屏很讨厌。第二，价值投资不是找套40%,8025,2017-06-17,0.8975188823393196
核建两年内不跌破10元，我吃屎10公斤。立贴为证,51002,2016-12-15,0.0019613838704167774
就像要退市的欣泰一样，天天跌,528,2016-08-08,0.43920311835489245
还不如是个搞房地产的呢,732,2016-08-15,0.5075705281272267
后面的封板，证明前面都是吓唬人,698,2016-07-05,0.34845407283407837
601611谨防B浪反弹结束,20075,2017-01-26,0.5098831130985805
珍惜中签筹码  敬畏市场定价,11384,2016-06-09,0.9661218612798572
中国核建目标已然是拨开云雾见青天，切勿急躁,126578,2016-07-04,0.9900154277620257
601611:中国核建:中信建投证券股份有限公司关于,48812,2017-06-05,0.993643817568272
601611:中国核建关于首次公开发行限售股上市流,59773,2017-06-05,0.7027663096115678
一年前是4.16上市。限受流通能不套现？鬼才相。,7532,2017-06-06,0.7623268686135352
吧里那几个大户雇佣的唱空水军也是可怜！,7306,2017-05-22,0.906926845216227
看看601900就知道啥时候开班，吹个毛线！,14528,2016-06-09,0.421874597530976
如果我没猜错，一念永恒3月7日进驻的应该是庄托,6882,2017-05-26,0.8757572381179678
千万别上当，买之前多看看中国核电走势就知道能,68981,2016-07-04,0.26404559697475105
还好在高点卖了，解禁后再考虑接点回来,8201,2017-05-26,0.5513787297774764
中国核建根本没有解禁压力，请看分析,23446,2017-05-26,0.9951992875444378
宁波港601018祝中国核建停板,14436,2016-06-16,0.9859465705786334
每天小赚一毛钱，你个死托，没有核建股天天发帖,4076,2017-05-23,0.1527949697919001
我17.07的本啊！还有比我惨的吗？,16412,2017-05-23,0.8901750077275126
601611:中国核建2016年年度股东大会会议资料,51244,2017-05-18,0.951448415648388
601611:中国核建关于经营情况简报的公告,87775,2017-05-15,0.893790531705124
请问我该怎么做,9106,2017-05-22,0.18991911064007716
核建4.36亿6月6日解禁！第一创业解禁前后一股暴,17801,2017-05-15,0.6292725431961994
我国核产业潜在产值达万亿级 核电出海将加速,39056,2017-04-17,0.9987444058523152
最新消息，雄安新区采用清洁能源，核电供电,11602,2017-04-06,0.01973095345011655
中国核建未来三五个月是风险大还是收益大.哈哈,10792,2017-05-19,0.9982289445252817
中国核建前2月新签合同额45亿元 同比增长近五成,40213,2017-03-14,0.6987074156443196
中国核建：控股股东与中国核工业集团公司筹划战,76123,2017-03-19,0.9466410836511423
601611:中国核建关于中国核工业建设集团公司与,117924,2017-03-19,0.9009535291570058
601611:中国核建2016年全年新签合同情况公告,119862,2017-01-12,0.3908852306079481
601611:中国核建关于日常关联交易的补充公告,25008,2017-04-29,0.9461047761030659
601611:中国核建关于经营情况简报的公告,61104,2017-04-14,0.893790531705124
中核建与中核集团启动重组 核电版“国电投”料,90033,2017-03-21,0.5370385871373843
预估下周起码一个涨停，测试一下人气,20749,2017-04-15,0.6079427629702826
神核在即，华龙出海，机会在哪？,22741,2017-03-26,0.9835069545657822
17元全仓加融资核建，全仓被套。我该怎么办？还,12010,2017-05-17,0.6906088119689613
中国核建业绩将有百倍增长 股价也将上百 期限5,15083,2017-02-12,0.9985106301971459
核电乘四大利好起飞，一文详解布局要点,53260,2017-02-16,0.6579534543303269
核电暴涨期就要来临，中国核电，中核科技，沃尔,16336,2017-02-06,0.9977574363320336
未来中国核建年净利润超过50亿不是梦,38783,2017-01-01,0.9824979049103019
背靠政策利好，军工改革红包行情值得期待！  ,58359,2017-01-05,0.9980737567401591
巨无霸来了！中国核建简析,98544,2016-05-24,0.9737416000014888
wEZPAR同意他是弱智的朋友给我赞下发个66,4881,2017-05-12,0.03030562713818541
一起理性简单分析一下中国核建,14438,2017-05-16,0.9991145987099284
股友wEZPAR你就是个傻吊不买不卖就滚出去整天在,8643,2017-05-08,0.06716007793373402
中国核建明天爆红，我相信，你信不信？,14035,2017-05-16,0.4286807818957531
中国核建就是一家建筑企业而已,17780,2016-07-02,0.9087718565507915
中国核建：前4月新签合同额148亿 同比降近15%,53289,2017-05-15,0.834874731034449
核武器下午涨停板.朝鲜核武器没有爆炸.中国股市,11053,2017-04-11,0.9988155360958292
未来3至5天核爆炸发生上涨到21元.哈哈,14984,2017-04-13,0.33266334675238374
今天核电暴力洗盘真完美.哈哈,7024,2017-05-11,0.9967438399029462
对每天小赚一毛钱的小骗子说几句你永远无法理解,8293,2017-05-03,0.03495904295062502
成本16元，谁比我高安慰一下。没有最低只有更低,9390,2017-05-05,0.15633565756403345
601611:中国核建2016年度现金分红说明会预告公,74703,2017-05-10,0.873052732171523
601611:中国核建关于副总裁兼总工程师辞任的公,60120,2017-03-27,0.8608539884154204
中国核建与中船重工物贸集团战略合作,35627,2017-05-08,0.81946595625573
601611:中国核建关于召开2016年年度股东大会的,38312,2017-05-04,0.980189823381291
核武器下周连续三天涨停板.,6364,2017-03-19,0.8322235925928461
大胆潜伏: 怎么跌的就会怎么涨上去（荐股）,12380,2017-02-18,0.9020354867406418
一季报速递：中国核建2017年一季度盈利1.10亿元,47905,2017-04-28,0.8963269463160836
京东方～2元显示技术世界级龙头+销量业绩倍增00,51973,2016-09-23,0.05318492725248147
中国核建拟10派0.70元,31687,2017-04-27,0.8311667500470776
核建明天有拉升，18元以下不宜卖出，坐稳扶好是,17423,2017-04-16,0.7845731661711578
我来给你们摧残了！谁先上？,9693,2017-03-15,0.8664694410454763
李志林：IPO“大跃进”果真是支持实体经济吗？,8258,2017-01-21,0.9586541904411775
603737三棵树已14个板；盈利已7万元，还没开板,16870,2016-06-27,0.7022206328882247
本周分析：清明节后走势预测,11252,2017-03-31,0.9645488083486562
中国核建:公司是我国国防核工程的重要建造商横,15982,2017-04-10,0.9977675207129967
2017年中国核建有望成为混改龙头,34626,2016-12-30,0.5843650820358106
核建看样子真是没有主力！,7175,2017-04-07,0.7878297235069667
核电走红三月天，重组光环使人眩。富翁不是短栖,10253,2017-03-31,0.03155002838330423
我持有中国核电和中国核建各一万股 市值不到一,16547,2017-04-04,0.6225766771323471
还在抱有幻想的人都该醒醒了！ 那些凡是劝你买,11467,2017-03-28,0.7636257296751726
娃哈哈 拜财神必中签 已中2签 图为证 申购新股,8233,2017-03-23,0.7616264825710907
本18.2 请问顾长官 何时能解套 谢谢,12682,2017-03-17,0.7257756367400221
下周将有特大惊喜送给大家 周一将是最后一次上,20663,2016-12-02,0.6297399847489659
中国核建之我见,42940,2017-03-20,0.895994042231519
朔风又起满天愁，乍暖还寒惹我忧。核建凯线时常,5330,2017-03-15,0.9837054205411767
南车从五块多涨到30多，翻了六倍！！核建翻个八,17925,2017-03-19,0.5018922749127014
战略重组后，中国核工业集团将下属所有对外工程,17335,2017-03-18,0.8997235387403972
核建好戏还在后头,17803,2016-09-19,0.9179939250588813
我又傻逼了，清仓了,13559,2017-03-17,0.4692778122296848
只能说这票近期压盘明显，散户流出的，然而根据,13446,2017-03-17,0.040714208404384
街上杨花飞絮尽，小院牡丹尚未开。莫愁股价东流,5125,2017-03-17,0.9170247958446809
走势疲软凯线阴，账面巨亏如流金。奉劝庄家莫装,5548,2017-03-12,0.0043518882846540485
特大好消息！明天不涨停我就任你们摧残！蹂躏！,17518,2017-03-14,0.14839590156360172
601611:中国核建关于经营情况简报的公告,67625,2017-03-14,0.893790531705124
衷心希望核建狂，扫雾驱霾遍地芳。期盼此股长久,4325,2017-03-12,0.8043536954927749
长江证券：环保渐趋严格 三维度把握投资机会,25047,2017-03-13,0.9980657853655653
601611:中国核建关于公司董事会、监事会延期换,58982,2017-03-09,0.8953505742241177
16.9卖了！下午肯定跌停！,5238,2017-03-13,0.07230239615986389
中国核建早盘高位出货，现在可以出场了！,2990,2016-12-06,0.9683092842913038
晨起雾霾笼江山，毛毛飞尘污河湾。巨亏痛苦悄然,3335,2017-03-09,0.9738239353015341
重大利好！！！ 据国资委微博3月1日消息，日前,19628,2017-03-01,0.01453795227984711
核建产业基金管理有限公司正式成立 03-01 17:35,16520,2017-03-01,0.9867970418610214
这种股只有傻逼会买,10276,2017-02-13,0.15481052738909573
祝大家新年快乐！,10079,2017-01-28,0.9306860965603504
有谁跟我一样中签到现在都不卖的，握个手，一定,15585,2017-02-13,0.1973535416580724
感觉今天核建会突破18.2元 大家以为如何啊,16474,2017-02-07,0.9605780732010009
被套四五毛的请进来报个数～,8243,2017-02-07,0.2766473620739095
中国核建将持续下挫到1.73元/股。你可以不信。,167488,2016-06-06,0.4782949277109523
进场:地方国企二线蓝筹股---跨年行情热点,8144,2016-12-19,0.8644026785794174
成天做梦，意淫,4974,2017-02-04,0.7423120211175855
中国核建,9931,2016-10-13,0.9384628882380333
我持有中国核建和中国核电各一万股 什么时候总,11536,2016-12-10,0.44090480419925604
浪逼真不是人推荐股票我们买了赔了钱问他咋办他,11017,2017-01-19,0.05203459337598426
妖婆这样才叫真正晒单，卖完601611远离死妖婆。,30499,2017-01-09,0.1277990868916402
再说一次逼胡浪有本事自己发帖让人类浏览跑到你,16378,2017-01-13,0.4323162713486164
奉劝那些执迷不悟者 赶快醒悟吧 立即换入航天电,11436,2017-01-25,0.046386586713586975
此时对大盘看法,19077,2017-01-13,0.7297953905324703
姐今天早盘的操作一个小T，这应该是姐在这个吧,14316,2017-01-16,0.37538240451282856
再发一次姐今天上午的交易记录，姐没走，姐走的,21458,2017-01-16,0.4584175287157001
妖婆股海大姐大换马甲：新疆网友,9894,2017-01-20,0.34619580441157105
说说601611或许对大家有好处仅供参考,29954,2017-01-18,0.7471896925366368
今天不上18自废JJ,9735,2017-01-24,0.5884716835338295
不但停建已经核准的110座火电厂，还要陆续关停,15293,2017-01-22,0.15359229731175417
跌停吧 别扭扭捏捏,4055,2017-01-24,0.1203916916133021
抓紧满仓:油气混改和地方国资改革的双重受益股,5071,2017-01-11,0.9657811846579721
601611如图这样A卖B买,14929,2017-01-12,0.4559891338717146
以现在的位置和换手来看，周一会涨停，下周涨至,19922,2016-12-17,0.7671569546776412
老子惨了 18.48满仓的 还有低吗 割不割呀 纠结,29264,2017-01-13,0.4297609073936426
中国核建上涨重势，下跌重质，低部成交,4810,2016-09-13,0.6174676520355905
人图暴富死难休，红绿丝萝自作囚。 涨跌相依分,5431,2017-01-16,0.0482353838279489
近期留意17.05能否有效跌破。,9342,2017-01-15,0.153952178209951
跌破9元必须的！,6929,2017-01-12,0.01793723855819762
中国核建2016年新签合同692.68亿元,52387,2017-01-12,0.5617609535345943
今日起转战核建。[拜神],8601,2017-01-11,0.9954064766276527
预言20-22日创新高,51055,2016-12-13,0.8835693917783182
周三完美一击,81962,2016-12-27,0.7237314778868709
姐的611成本分两次满仓，第一次买入价16.8第二,57586,2017-01-02,0.042772894765971015
炒股至今有五年，谁都没有我悠闲。买股很少走弯,13673,2017-01-09,0.025003931141754143
冬雨空蒙云似纱，满庭芳草怨春华。轻寒不阻核建,7876,2017-01-09,0.8387095083795831
明天跌停，快逃命,8191,2017-01-11,0.13257249188193276
中国核建，下一目标20.00大关！,7646,2017-01-11,0.9769866720621471
2017年春节礼物601611,28248,2017-01-02,0.7077888054717187
疯狗离开了，可以公开姐今天的操作了，果然今天,14107,2017-01-09,0.2266401251357144
中国核建19-23被套的闹一声,9708,2017-01-06,0.771221140272322
妖婆看看这才叫真正晒单,10241,2017-01-08,0.3262070937975423
姐继续晒，那个瞎逼逼的敢晒吗？,7706,2017-01-08,0.7639470286998327
逼胡浪看看自己大家也看看他,6709,2017-01-08,0.28419972235546376
不好意思打错了，18.55卖出，不小心打成18.65了,12454,2017-01-06,0.04483049173187936
热烈欢迎实盘短线炒股PK,你号称股海大姐大敢不,5731,2017-01-07,0.5274076108849609
17.5全卖了！应该下午跌停！,8143,2017-01-04,0.08445636994423611
善意提醒：管住手！还得调整一周左右！不喜勿喷,12691,2016-12-28,0.024707447649883085
混改+核电解冻将会推动其未来业绩大幅提升,84042,2016-12-31,0.5639635111527505
太不爽了！给人甩了！失恋了！谁来安慰下我？,7894,2016-12-27,0.1706649238759841
国改主要关注央企混改“6-1”标的,17510,2016-12-29,0.2034574560850535
2017年核建上35是大概率事件，混改是天大的利好,53410,2016-12-29,0.0463345934078101
国企亲儿子——中国核建，没理由不上涨,17572,2016-12-23,0.473719736726813
大家分析今天尾盘跳水的原因1、有利空。2、洗盘,15147,2016-12-30,0.6856346057757664
后市势不可挡 明天19.68 本周突破23,18263,2016-12-27,0.6685220044208438
我是一名离职的操盘手。 据我所知，主力也会关,17552,2016-12-20,0.5185967324239742
16年总结,10240,2016-12-30,0.30199246042357364
开心过节,机会远大于风险,7117,2016-12-30,0.7959724438686024
来看下能不能成妖！,39030,2016-11-14,0.8449136080087956
32的本守一个星期到头来还亏本卧槽,2457,2016-12-29,0.9102484615689942
下周三好戏连台！,24398,2016-12-24,0.4737672181921908
中国工程院院士到底想干什么？,79812,2016-08-04,0.24222453210189043
大盘分析。低近诱空。骗筹码。。。[微笑],5235,2016-12-25,0.9569582045358062
我的愿望能实现吗？谢谢！,7919,2016-11-29,0.8778848024212393
→下周每天将有一千元多大进账 高兴吧 哈88见哈,25393,2016-06-19,0.057807293851708685
中国核建：稀缺资源 名牌价值待体现(附股),28206,2016-12-04,0.9957673829032354
美，俄同时宣布扩大核力量，中国也不干落后，中,14087,2016-12-25,0.9936976278826677
中国核建能成为下次牛市的大牛股吗？,33459,2016-10-01,0.9415603462578683
今天高点应该在缺口附近，,12493,2016-12-21,0.13047255096715504
22日创新高，裸奔的SB咋不说话了,5723,2016-12-22,0.1900923592645134
中国核建年内过20！,4700,2016-12-21,0.9313232210888511
16.69出了16.38买进,3880,2016-12-19,0.47882469326530575
三江购物今日复盘，可以关注,13435,2016-12-06,0.9819169907113263
周二的三江购物继续持有即可，坚决持有，把它当,12976,2016-12-08,0.06282611908828573
13日早盘对大盘走势预判，对股票的预判看看6033,8670,2016-12-13,0.4334379226802032
妖股卷土重来 小心接到“最后一棒”,146249,2016-07-06,0.07977563807134391
明天走势,11295,2016-12-06,0.2845935741427815
今日小结：2016年12月12日,7419,2016-12-12,0.3184012882657292
今天有没有人加仓？,5528,2016-12-12,0.1988357961565208
日日日 日扯了 17.35进入 套了 但是始终看好这,11431,2016-12-09,0.5413847026666181
601611:中国核建2016年1月至9月新签合同情况公,118362,2016-10-12,0.08056528733427792
中国核建我认为才开始，目标价还没到,2550,2016-07-06,0.9834761054296433
早上会冲高4个点左右    下午继续跳水出货    ,5057,2016-12-09,0.19493982147864686
该股已经进入慢牛碎步上升行情 上升空间无比巨,28778,2016-12-03,0.6314581491975341
大家看看，我18.71买的，今天17.6跑的，有谁比,12004,2016-12-07,0.46492497984004777
向上突破已成定局,13474,2016-12-01,0.9407371530490313
中国核建将迎来前所未有的发展前景和扩张机遇！,6685,2016-12-07,0.9704243533407497
身家性命全部压在这个股上了 大命交给老天了 生,9473,2016-12-07,0.03447182126151027
机构发消息明天涨停，明天快买，哈哈,14137,2016-12-07,0.0688809337650571
姐前期在63393股吧里连续推荐，现在姐依旧连续,8634,2016-12-06,0.9973193681168884
中国核建今日超大单流入排名第5名(12-05),38939,2016-12-05,0.9726587302858299
谁是骗子谁是托？,4630,2016-12-06,0.04791583736815885
还有谁卖了吗 进来报个到呀 谢谢,5277,2016-12-05,0.1438383664469014
中国核建，如此走势，必定忧心忡忡！,7359,2016-12-05,0.9434802494376097
谁还有申购的核建 拿到现在了呀 哥申购1000股 ,6040,2016-12-05,0.8319476664110736
吧里散户朋友们多多注意，从不失手和亿万富翁都,5329,2016-12-03,0.9663223210588673
还好早盘卖掉了。呵呵，等跌下去接回。,6435,2016-12-05,0.25103952491122783
都看好反而危险。尾盘带量拉升可是股价涨幅并不,12815,2016-12-03,0.10494217841672282
跌了就加仓,1797,2016-12-04,0.10036474755015212
中核星期一肯定会跌到17元的,7904,2016-12-04,0.14965155689383447
中国核建最后一次奉告！有 泸天化 的需警惕，今,38700,2016-11-22,0.9538957364623593
17.68元卖了 心急了 没卖在高点 害怕被甩 心急,9208,2016-12-02,0.0042767253526148075
28元肯定能见到,5450,2016-06-25,0.23883708819170746
这股不到28 老娘裤子脱了让你看,23993,2016-06-15,0.20174960854790047
就是不卖 期限三年,4185,2016-06-12,0.319453621076356
再调到16元，全仓。,5751,2016-12-01,0.020527293464247864
主力牛逼！主力威武！,7062,2016-07-05,0.6215613084014777
22.6的本，什么时候解套啊,8035,2016-12-01,0.7657643776825962
怎么没人炒中国核建呢？？？,5569,2016-11-30,0.29447163350038874
中国核建今日超大单流入排名第19名(11-29),29767,2016-11-29,0.9554303090109718
我这么看核建——,27818,2016-10-16,0.6988242738351397
