标题,帖子数,日期,情感
招行已被唤醒！浦发，兴业何日会师，再现三剑客,22584,2016-08-19,0.43503783591384837
浦发，我一直在减仓,7937,2016-08-25,0.20911612494191123
三张图比较这波牛市走到哪里？,24941,2016-08-15,0.9176021221904527
证券时报记者曾炎鑫妖言惑众，破坏金融市场稳定,5468,2016-08-25,0.9994468119056878
两只银行新股标杆的伟大意义,7097,2016-08-24,0.22839972619549398
银行股我从来不碰，你看过老母猪能飞起来吗？,11832,2016-08-22,0.22745839078544228
贵阳银行高于江苏银行35%，估值约15倍,6369,2016-08-23,0.015686365341293862
紧急请教：明年浦发会恢复分30%现金吗？,7506,2016-08-22,0.022749087784606603
买入浦发，融资买入中兴，套了16.35,5680,2016-08-23,0.9651997722209431
位置趋势级别,52718,2016-06-01,0.6512271540448314
未来二个月，还是一九行情,9916,2016-08-13,0.9754300134450018
A Wonderous World Is Yet To Be Seen.  西班,13602,2016-08-17,0.39299135553911413
浦粉赚钱的道理,8763,2016-08-23,0.4808415954739491
眼下，如何看待分级B?,11126,2016-08-20,0.8678569536144267
只有国家队把浦发筹码抛出后浦发才有大涨的机会,10433,2016-08-20,0.6500532805192888
浦发为什么这么弱？,17958,2016-08-12,0.30486794767091097
王宝强离婚以后，AA制婚姻会流行,7027,2016-08-20,0.9945922244835406
这个操作如何评价？,7848,2016-08-19,0.3471706362548159
这种发行速度，市场能支持多长时间？,6894,2016-08-19,0.8927590374608843
世界这么大，我想飞去看看。（之十七）Munich, ,11161,2016-07-30,0.895879075129741
我现在是连续中弾……。又中签贵银了。很好很奭,5342,2016-08-07,0.983989145685193
有关浦发的报表,31169,2016-08-10,0.28139513439631236
傻根泡马蓉成本分析！,11776,2016-08-18,0.521743803955358
注解这两种交易模式。欢迎订正。,5594,2016-08-18,0.8858967149181807
看相帖，明天走向，16.44,8646,2016-08-18,0.6971159033440297
涨三天，跌三天，你认为会到哪里。,13039,2016-08-16,0.09318679685896658
16年上半年业绩符合预期，估值缺乏吸引力,35345,2016-08-16,0.41716054601883956
中国平安牛BB,5307,2016-07-19,0.4907461466988008
补缺开始了,2773,2016-08-18,0.5
历史会证明我的浦发补缺口论是准确的,7266,2016-08-17,0.7844995015200201
高位盘整不下跌，小秘书又被洗刷刷了,3773,2016-08-18,0.677419956465081
浦发收购上海信托迈出金控重要一步,17622,2016-08-18,0.9862597555443471
看看这样交易的差别。专注更重要。,10544,2016-08-14,0.8314024650779254
浦发吧里高人多，给分析分析宁波银行是咋了。,12633,2016-08-16,0.8184204361309497
明天猜测是低开走高，结果还是下跌中继续。,7422,2016-08-17,0.7129232009665789
其它综合收益（财报注释）,12476,2016-08-11,0.9901065578072382
全部清理了浦发，休战一下，穷,26651,2016-08-15,0.33278364506396496
粉丝还不少,4258,2016-08-11,0.8030562966677064
长期国债利率的下降就是金融资产价格上涨的洪荒,5854,2016-08-16,0.9604640824408235
梦想何时实现,5026,2016-08-16,0.8989898989898991
揭秘：今天是谁在卖出宁波银行和爱尔眼科？,8233,2016-08-16,0.04454812507125383
证券股业绩那么差，跟着凑啥闹,6976,2016-08-11,0.033380243439813606
即使做强盗，也要劫一个生辰纲。,7485,2016-08-16,0.8103105006688232
总理发布深港通,5185,2016-08-16,0.4353450092638744
米何一定要诅咒中小创呢？,4334,2016-08-16,0.4618476257478231
2016中报点评：增速回落，银行卡等手续费快增,27697,2016-08-15,0.08142162124889374
1,16174,2016-03-10,0.32689832689832665
等待了四小时，就为了看这十分钟,4487,2016-08-15,0.4017606301200697
浦发银行耍流氓！,8050,2016-08-11,0.007139122088476446
轻松一下，猜小秘书什么价位买回来？,5974,2016-08-15,0.9402713957669274
复合经典之战，券商股。,8574,2016-08-15,0.34299567493043326
盘子好轻啊,5480,2016-08-15,0.039313883073214706
回顾：近期“技术分析”预测比较准确,11781,2016-08-12,0.998837324061128
我会等,66721,2016-03-22,0.7407407407407406
风水轮流转，浦粉们的春天快了,13065,2016-07-11,0.9896438161824921
空仓银行股的鸡狗们已经是热锅上的蚂蚁,6281,2016-08-11,0.007588298084431178
我感觉这次是万科救了大盘。,5425,2016-08-12,0.6215777568367616
我就问浦发吧里还有不服的没有？,7019,2016-08-12,0.33045959409371206
沪、深二市股吧中，能令小秘书惶惶不可终日、避,10984,2016-07-30,0.29827178495886586
当拨苗咬你时，你记着顶我砸它的帖！,5748,2016-08-12,0.04226640463190656
为什么要持有银行股？,13408,2016-08-12,0.04085563910788714
浦发复牌第一天的跌停是重大利好！！,17524,2016-03-13,0.008954057768769341
每一个人来到世上都不能活着回去！,10227,2016-07-30,0.9072025272258816
其实小散来吧里主要是学习和排除杂音。,4286,2016-08-14,0.7334634054326467
江苏银行，逃了。,17323,2016-08-05,0.5515609139023204
我这一句话或许价值千金，你应该看看。,8439,2016-08-12,0.9266094917299086
我们曾目睹过：*欣泰退市的血雨腥风！,5026,2016-08-13,0.7296793018593575
零售板块发力，中收增速喜人,26193,2016-08-12,0.3796930249060073
市场的环境气氛已开始改变，很多人还是不知道。,8648,2016-08-09,0.9762133439679237
浦发银行2016年中报点评,9435,2016-08-12,0.028347900924015512
哈哈。牛帖，引自中兴吧深圳网友，致拔苗。,6839,2016-08-12,0.11034766240459037
要是下周浦发继续上涨，有人更跳起来呢。,7445,2016-08-12,0.062286501735552946
喂，市场已开始转向了，增持好股。,8093,2016-08-06,0.33531939898406704
我刚画的，还可以吗,9699,2016-08-07,0.5488180064031624
年线之上,33074,2016-07-02,0.890142453148024
代号0101,14240,2016-04-16,0.4737672181921908
[微笑][兴奋]再发,8748,2016-08-07,0.8447491636112077
600000:浦发银行未来三年股东回报规划(2016-201,91967,2016-03-10,0.5458638837150803
心太冷的16个小主 看了看盘面，这调控也太明显,14123,2016-08-03,0.7266451865019429
15.8元是分红后除权价，填权行情何时开启？,8092,2016-08-09,0.8999426239281664
打新门票平安银行净利润增长6.1%。给浦发提鞋也,8033,2016-08-11,0.15949479426623547
浦发半年报与一季报数据简单对比,18367,2016-08-10,0.5927554846690628
银子会一日游么[为什么],3994,2016-08-11,0.6599741376340565
关注浦发今晚公布的半年报,14639,2016-08-10,0.2723026857784806
看看浦发明天能涨多高。你想到吗。,7108,2016-08-10,0.39754704564992316
股市小蟑螂6   关于美术,12042,2016-08-09,0.004051403546542098
600000:浦发银行2016年半年度报告摘要,29515,2016-08-10,0.25474039200377074
浦发银行上半年实现净利润267.7亿元,17894,2016-08-10,0.08924162594673102
完了，不如去年！！！,5524,2016-08-10,0.2642810895519657
迷惑--看了浦发、华夏中报之后,9202,2016-08-10,0.20976362535110382
净利润增长12%，按现有股本计每股收益1.20元。,8426,2016-08-10,0.9886465132996656
浦发银行上半年净赚267.7亿同比增长12%,17132,2016-08-10,0.4495118545660248
它说宁波银行老叶赔了好几万,14551,2016-07-16,0.00551508580727178
本人的银行股组合，从2016年2月初到现在几乎未,6739,2016-08-08,0.07806475214702668
今天洗了多少阿猫阿狗。,23707,2016-07-27,0.23894100048493228
银粉们买点苏银吧,3789,2016-08-10,0.9857406889989665
请踏实地持有和增持浦发，很袖珍的股票。,6092,2016-08-08,0.32307312759262885
马路边的贷款，利率5.5%，2年，200万。融资利率,4279,2016-08-09,0.9303749062012397
央行：若频繁降准会加大本币贬值压力,11630,2016-08-05,0.3618335767687695
操作失败，还要交分红税,5895,2016-08-09,0.14074494953018957
江苏银行发行价11.6元／股，市盈率11.8，上市日,8394,2016-08-08,0.02090823883484505
优秀金融持续跑赢，改革提速监管趋严-金融行业,8105,2016-08-08,0.9999921200252716
光大为何是一只比万科更肥的猎物？  ,4423,2016-08-09,0.4205920571771601
DM9交易机会：0.97附近买入150244创业B,6001,2016-08-08,0.8834975482899659
“撑死胆大的，饿死胆小的”本人已满仓融资6万,17518,2016-07-30,0.5089180073167067
东方财富网《媒体称市场化债转股将从煤炭钢铁企,10236,2016-08-07,0.2913292036365335
我的确常被小秘书忽悠买入浦发，买了又不舍得卖,11154,2016-08-06,0.01183854765322423
江银上市后连续打板为何具有标杆意义？,11141,2016-08-06,0.9354781861513415
股吧不是你认亲找戚的地方！！！,12667,2016-08-03,0.05916285297170909
真的很痛……不知道有多少朋友被骗了。 拿着那,7608,2016-07-27,0.401217743021578
试错吧，最后发一次,19155,2016-07-15,0.2597796781078304
我喝多了一点点，自由发挥。,8443,2016-07-29,0.9633419951902026
逻辑混乱举例,6881,2016-08-03,0.5804501831129093
老谷你为啥关闭自己发起的帖子评论？,6989,2016-08-06,0.01126635025664835
是纸面富贵，还是其他，最后谁来买单,7202,2016-08-06,0.8926196637270059
与他人对等交流，只是一厢情愿么？,4668,2016-08-06,0.1312318581747134
新股银行股可以涨到三十倍市盈率，老股银行股可,19307,2016-08-04,0.005552098194964827
没事看看：《从概率上看投机的危害》,5562,2016-08-06,0.9681916002343074
好股票会慢慢被人收集了。拿好。,7765,2016-08-05,0.8925792393886679
有量就好,5721,2016-08-05,0.6317853705682674
今天中了个签苏州恒久，不知能否比苏银多赚点,7319,2016-08-05,0.7683139947836407
江苏银行会与浦发银行股价平起平坐,10731,2016-08-03,0.23198340607727685
南京银行上半年净利润同比增长约22%。,6764,2016-08-05,0.7968367967274473
给你一个抛出浦发的理由。,8674,2016-08-04,0.15420117535566502
崩盘公告，丢人不要在厚然无耻了.,8625,2016-07-14,0.005691363334639266
神仙斗法咱钩小鱼,3574,2016-08-04,0.9873879810730497
银粉们争口气,7600,2016-07-25,0.37622281693599346
两签江苏银行能获利多少？,14933,2016-07-23,0.11824856867502331
万科的下跌是其管理层的失败。17.60,10389,2016-07-18,0.5960061683354146
迎接最后一跌，指数必见大底,21523,2016-04-25,0.6437070967154495
江苏银行确认不是银行股,7100,2016-08-04,0.01267167057697316
江苏银行首份半年报业绩0.54元,12349,2016-08-02,0.4930524008256194
每天都在打砸浦发银行、兴业银行,3782,2016-08-04,0.011894695414755962
欣泰马上获利20%，再来20%，小浦你吹啊,8904,2016-07-27,0.16265747258589103
浦发银行的融资盘不及中兴通讯，消失的股东。,8108,2016-08-02,0.055265848487930924
浦发银行(600000)融资融券信息(08-02),4614,2016-08-03,0.37014738930766744
虽然说浦发不可能大跌，但浦发庄家和大股东坏到,9884,2016-07-29,0.009040839414030555
宝万之争其实每天都在上演,15003,2016-07-30,0.7934371119703166
以前有个叫探索李的股友。不来了。,5941,2016-08-03,0.7322229182745892
人性是决定投资成败的关键因子,8124,2016-07-30,0.9980229541933383
招商银行上半年净利润352亿元，浦发又如何呢？,17129,2016-08-01,0.15553061172217908
转摘：网联来了：第三方支付机构不再直连银行,4370,2016-08-02,0.015114120542123355
坐等一九行情,8312,2016-07-26,0.8794433566334721
美在花城之<天边有朵会笑的云>,11653,2016-07-26,0.9691717820630258
写在江银和贵银将联袂上市前夕,18620,2016-07-31,0.9568601643737691
越买越高价，浦发怎么啦。,8924,2016-08-02,0.7770390094495545
万和证券客户周水全同志有钱就任性！,10349,2016-08-01,0.5929617176355233
猜猜这是啥,7648,2016-07-31,0.5
明天或许在江苏银行带动下，整个银行板块涨停,9743,2016-08-01,0.2665775641548066
真话，说说我从老谷学到的知识,6991,2016-08-01,0.9312830350591965
为了大家共同利益，懒牛呼吁做高江苏银行,15972,2016-07-03,0.17575768596773822
银行低配17%-国金策略李立峰团队,25603,2016-07-25,0.9030861193435579
国际上银行股定价 一般股价是净资产一半 此股8,11359,2016-04-15,0.014031880213580039
能承受风险的标的真不是太多。,5286,2016-08-01,0.27437590654605537
不讨论大盘，去资产泡沫指那些内容？,10801,2016-07-27,0.7153906812466624
浦发，普发大家普遍发才行！,4985,2016-08-01,0.09635430094562303
你们不能因为有人无脑揣测而删我贴！！！,5810,2016-07-27,0.23470340839001647
每次急跌，预示着离二八转换更近一些,6440,2016-07-27,0.19305636089583134
蓝筹挺住:  一个*欣泰拉起，千个中小创跌停！,9593,2016-07-27,0.9343242135736709
回复沪七蛋,9312,2016-07-31,0.1447780622317325
江苏银行开板前，银行股异动了怎么办？,8470,2016-07-31,0.04504250125860976
银行股不涨，大盘你就歇菜！,4151,2016-07-26,0.09293148694815911
假设理念改变，这一批股民大都会成为牺牲品。,5063,2016-08-01,0.9989354185246789
问一下，关于兴业增发,9171,2016-07-29,0.29909168713559253
又到周末时！[微笑] 一起来玩，个个开心；文化,13985,2016-07-08,0.970511080944207
玩股票并不需要高深股票技术，需要更多的生活哲,7067,2016-07-31,0.9925493558708812
兴业的增发价15.10元,9233,2016-07-29,0.5644224791593287
明天去看电影,7518,2016-07-29,0.6631502194718999
美在花城之(香飘珠江),4156,2016-07-30,0.9146660975432676
我折磨黄鼠狼VS主力对散户,5069,2016-07-29,0.42999815018285314
我非常非常爽歪歪,9711,2016-07-27,0.6552476304899219
胆量是练出来，再增持浦发。,13752,2016-07-29,0.37595515489551723
分红到手该如何分配？,19219,2016-06-22,0.4074883522827125
老谷好,4580,2016-07-29,0.6317853705682674
持有高成长的阿胶、南行、浦发,32836,2015-10-09,0.6197361555064985
牛短熊长，好好理解 L 型。,4697,2016-07-28,0.6567153050934738
为什么浮躁,5754,2016-07-28,0.6111111111111112
perfect,12024,2016-07-27,0.4285714285714284
浦发银行世界500强排名升至第227位,18925,2016-07-28,0.35341501631280225
最好模式是创业板下跌，银行股上涨,4203,2016-07-28,0.12453456663320506
大盘大跌多一天效果也许不一样。,4796,2016-07-27,0.20476962415422872
不用性急，便宜货来了,5788,2016-07-27,0.6684522901737004
今天是大盘拉升前的挖坑！胆子大一点心一些,7111,2016-07-27,0.04943436672188428
复合增长率 超额复合增长率 银行 券商,9268,2016-07-24,0.044214609021853035
我现在打新又中了一个华舟应急，这个不股不知道,11195,2016-07-26,0.2990761982879071
求下联：虾兵蟹将闹浦发坚决不涨,4082,2016-07-27,0.6054102349671856
我想起了几年前谈输记在浦发吧的待遇。,10196,2016-07-26,0.431211333126859
结束看空助牛市！,16218,2016-05-30,0.7673861283639343
浦发大庄终于也没有耗过小秘书!,7177,2016-07-26,0.343075147609732
有谁中签江苏银行,16318,2016-07-21,0.3125520027735892
我想起了复合当年转战券商股。,15740,2016-07-23,0.3527858852260859
庄家新动向,12152,2016-07-23,0.8161554236318606
四天阳线还没到15.8元，耐心。,9628,2016-06-30,0.34614102456395046
看小董说借钱炒股与T+0那个可怕。,7478,2016-06-30,0.047616061744080174
说说涨跌停板制和T+1在新股中的应用原理。,5026,2016-07-05,0.9700209221327791
补仓。,12999,2016-07-07,0.3485697598175398
突然间，我有点相信K线。,8013,2016-07-03,0.30622480162344445
猜复盘后的万科，宝能在什么价再增持？,5848,2016-07-04,0.4294593631444209
万科复牌估计有1.9个跌停。,8928,2016-07-02,0.04040343213180253
要战就战。,6689,2016-07-10,0.7338420744331445
你又猜是谁出手开始买万科？？,14020,2016-07-05,0.37282182536307107
应考虑一下币值，资产价格。,6306,2016-07-07,0.7468223456230066
今天同时增持浦发与中兴H,,7841,2016-07-08,0.24092645975719862
今天继续增持中兴通讯H股。,6149,2016-07-12,0.06803107791843688
想要增持的也尽快吧，15.77,5121,2016-07-13,0.2836633593969302
再说说万科交易，实质？,19125,2016-07-09,0.16830350909732905
卖了一大堆纸质垃圾共5元。,7004,2016-07-16,0.031192582229777832
说说中兴A与H的比较。,9197,2016-07-13,0.561729417392513
你还能在浦发吧学到什么？,6291,2016-07-17,0.5656924816753899
债转股利好于银行，脑残的人不少。,8162,2016-07-19,0.5245707113937187
昨晚发了一帖删了，晒一晒浦发本月交易。,6513,2016-07-22,0.03508253740792644
发行规则是要修改一下了，,4954,2016-07-25,0.609230818575314
期指恢复是股市正常的标致之一。,6356,2016-07-24,0.8026156072074752
深交所：细化停牌冷却、内幕交易核查制度 果断,2820,2016-07-26,0.8793904314444312
数据说话：当前A股到底贵不贵,2990,2016-07-26,0.1322153018127683
同志们。我已把浦发全换成南京银行。请看我理由,17744,2016-07-18,0.016085042427089524
千亿解禁市值下周出笼 浦发银行占近六成,28590,2015-10-10,0.1662845533238747
我肯定加仓浦发,19757,2016-06-24,0.23820891466167715
错在哪儿 市场对银行股的定价太不公正了，为什,5415,2016-07-25,0.028960809504063878
看了浦发吧  真是 天大邪气的千分5概率...但是 ,12320,2016-07-22,0.10457204979717372
到江苏银行吧玩了会，别人的估值是我们的两三倍,7548,2016-07-23,0.44687022182273384
萌萌哒 [微笑],11342,2016-07-23,0.9660358710027578
为荷而来？ 夏日炎炎，缕缕清香，吹散您心上的,18779,2016-07-19,0.9929772655910631
姚大学根本不知那代人有多坏！,9124,2016-07-20,0.88109631522635
面对账户  冷暖自知,8985,2016-07-21,0.7746583216398736
终于中新股了！！！,7858,2016-07-22,0.4036380656075582
2800点以来，到底是谁在压盘和打砸浦发、兴业,6441,2016-07-24,0.08015498791156583
兴业又玩增发了。怎么看？,8007,2016-07-23,0.4990502314863464
平衡市——大盘稳定，个股突击！,110671,2016-05-22,0.3373738571883247
有一种空头，年复一年365天都有股票卖！,5057,2016-07-23,0.9047373609118443
各位注意：信用帐户交款的必须是现金,5860,2016-07-22,0.06795377554912052
求助，苏银中签，银证转账后如何交钱？,8199,2016-07-22,0.9488946529049261
江苏银行能涨到哪里？对其它16只银行股有什么影,7927,2016-07-21,0.05194432509463187
江银中一签，但愿赚个500大元,5955,2016-07-21,0.5605898589797756
2016年Ａ股最大丑闻,20800,2016-07-19,0.24461701218439114
浦发明天除权后应该是15.80元,25012,2016-06-22,0.08029244657603418
我对浦发资产净值的理解--18.97元！,26046,2015-08-22,0.45534530673263773
浦发银行跟踪报告：对公见长，稳健经营，维持“,34214,2016-07-18,0.47880641904993426
大家想过没有...假如 王垃圾和姚垃圾是一伙的 ,5848,2016-07-20,0.1630325462122899
理财是刚性兑付吗？,3130,2016-07-20,0.6581233342528555
一个黑黄金产业巨头逐渐形成,51997,2016-04-30,0.6413990020054139
进股市不是骗就是被骗,5001,2016-07-20,0.029481948917739476
说没问题的，要不开个户试试？,11556,2016-07-16,0.1746281205456559
最近从建行，光大，等银行股的走势来看，大资金,11261,2016-07-18,0.44925997323761924
600000:浦发银行关于举行投资者集体接待日的公,21993,2016-07-18,0.9495924526441967
私募新规中股基杠杆比率降到1:1,4208,2016-07-20,0.9936499384174415
闲聊下万科：复牌第一天就说了，什么价卖出都是,6306,2016-07-19,0.70118732183423
华夏银行（600015）爆股权争夺！涨目标20元！,17271,2016-06-27,0.31270710097983
好戏连台---看私募冠军创世翔12日起怎么从欣泰,10907,2016-07-09,0.9954589261094868
浦发怎么跟兴业差不多价钱了？,8692,2016-07-15,0.3430573179375721
浦发银行快爆发了，大家耐心等待，不要死在黎明,6591,2016-07-18,0.4472496375938926
盘面异乎寻常的强势...,7301,2016-07-14,0.8786312360144211
坚定不移地买入兴业银行,14851,2016-07-15,0.7564703888777258
日本银行股经历30年表现最好一周,4207,2016-07-18,0.6973055936732174
美在花城之(时光剪影的传奇) 珠江的河水诉说着,4337,2016-07-17,0.9985976865338071
说了会让很多朋友不开心...因为目前9成朋友没力,25034,2016-07-14,0.40577175293914103
买了喊涨，卖了喊跌，小人也！,4690,2016-07-17,0.7067375619508074
老牌公募杨东离职。杨东是谁？,5669,2016-07-17,0.9903328669736825
银行股全部分红完毕了，或等江苏银行定方向？,16511,2016-07-13,0.29597559233846704
＊欣泰每天出现大交易量的原因：,3546,2016-07-17,0.16893090815619893
难道我们比这些大佬们聪明？,4421,2016-07-17,0.34380181602792537
浦发一家抵澳门全部赌场收入,7589,2016-07-15,0.9890577866937695
600000:浦发银行2015年度全球系统重要性评估指,38100,2016-07-15,0.0009486654010116835
7月15日：3050做空指数+17.90做多万科,5852,2016-07-15,0.38589747927014006
平安银行行长的讲话传递的信息,25387,2016-07-08,0.3949487873276144
大股东2次低价增发给自己，实质就是股权争夺战,22957,2016-03-11,0.13414316086316236
好怀念那年,4883,2016-07-14,0.9656525981194629
新人报到！今天首次买入浦发银行，15.72买入，,6935,2016-07-14,0.24088552714726408
银行20倍市盈率到底贵不贵？,10737,2016-07-13,0.03255836552746094
宝能爆仓，几百亿灰飞烟灭，平仓后股份为他人所,6058,2016-07-14,0.203324145277191
浦发吧里 真有水平的.目前没几个了,44605,2016-07-04,0.4778652837437737
转发：鼓乐轻扬的帖: 群雄竞起，狼烟冲天。鹿死,8790,2016-07-07,0.15693355098375494
浦发、兴业最近遭遇压盘，落后上证大盘200点以,4916,2016-07-14,0.02708238971109611
普通老百姓买得起、喝得到茅台酒的几种可能,7772,2016-07-12,0.9275376098199196
浦吧成了谁家的了？,5265,2016-07-13,0.21270991843231468
洗脏 老谷 是浦发吧 真有水平的几个,9628,2016-07-12,0.19271358616585121
大行起舞，小行还会远吗,4970,2016-07-13,0.1395704755882039
浦发一家分店毛利1.85亿敌工商4家分店,5028,2016-07-13,0.023070493901279243
浦发去年隐藏135亿利润,34275,2016-07-12,0.27521422620197034
最后一帖，上证万点不是梦！,19311,2015-09-17,0.21727219974390966
为什么郁亮团队离开万科是全输的方案？,15555,2016-07-01,0.04454377348720562
长宁府，是天使还是魔鬼？,4387,2015-09-11,0.8974761418268367
以南京宁波银行为首的商业银行，将惊天地泣鬼神,3587,2016-07-13,0.07313536740778848
大家对这篇大“贬”银行业的文章怎么看？,10407,2016-07-08,0.6794834487880889
商场如战场，实则虚之，虚则实之。,4336,2016-07-10,0.914640121752159
上次那个72次4万股买单今天又出来了{2）,9108,2016-07-11,0.17840569142072094
钱袋张开，准备装钞票！,11877,2016-06-27,0.008878345867904147
事实证明还是中小板涨的快。银行股总是涨不过百,3825,2016-07-12,0.5149291935757837
银行业不良问题是风险信贷经营之常态,5432,2016-07-11,0.7376023395092004
手续费强劲增长带动业绩超预期，拨备压力好于同,38668,2016-05-03,0.9561550764113884
600000:浦发银行关于变更注册资本获中国银监会,41020,2016-06-30,0.9406487331774486
银行的风险,7140,2016-07-11,0.3537879064026296
明天的面子，是心理上的疾患。,5151,2016-07-11,0.43567608697891047
欣泰电气在浦发银行大连分行股权质押4200万股,13490,2016-07-10,0.5837849358478453
经济观察：养老金进来难道买300元茅台酒？,3703,2016-07-11,0.0911594467258322
再消灭一批赌徒！,9795,2016-06-13,0.22980543565975653
最近的行情，如你手上没五粮液片仔簧伊利可惜啊,3734,2016-07-11,0.9424684389224977
价值投资是保守的、守旧的。,15696,2016-05-28,0.9471488962791552
浦发：万.宝 举牌事件涉嫌暴利且扰乱金融 应严,19384,2015-12-28,0.7846286618736088
A股对银行有信心，H股就会有信心,32483,2016-03-27,0.28619400444058407
祝贺英国成功脱欧,26718,2016-06-24,0.9242535603067812
股灾原因分析,23107,2016-03-12,0.8140701019902251
硬骨头用电锯：万科式的改革好！,4941,2016-07-07,0.969926760045399
测测自己的智商。[微笑],6039,2016-07-10,0.7558485257103822
不相信欣泰会退市,6274,2016-07-09,0.1485606852154553
买入浦发就是闷声发大财，从第一选银行股就选定,10061,2016-07-03,0.061930386504305934
美在花城之(羊城美食),3833,2016-07-09,0.9830238641672991
请教欣泰电器赔偿的问题,7364,2016-07-08,0.1401817780375031
不让发，再发一遍：也说王石,4388,2016-07-08,0.09313075512106161
未来几天，空方机会很大，很可能会打暴宝能高位,6585,2016-07-07,0.9957621290226187
今天是5月的最后一天：他也是那些优秀的股票价,108872,2016-05-31,0.9314073233970533
农行首席的话。信不信？,13519,2016-05-17,0.5476339346199359
不要骂，浦发K线形态需要休整是很正常的,15024,2016-07-04,0.2915011353010236
美在花城之(粤味粤生活) 有高大尚的银行，w酒店,10536,2016-07-05,0.98540084639826
赚指数也好。,7880,2016-07-06,0.5655172230862581
看到”小散”在跌停板大胆买入，真是无语了！ ,13700,2016-07-04,0.8818202848834404
万科股东刘元生向证监会等7部委发举报信 5点质,8768,2016-07-04,0.8214333360457113
万科之争，是个耻辱！,12141,2016-07-02,0.8004672868447703
今天想说说基金。只知道拿人的钱去砸盘(希望万,3161,2016-07-06,0.7060433401417802
为什么宝能不在H股增持万科？,6125,2016-07-06,0.3873544329147527
茅台直奔300元啊！,10914,2016-06-03,0.09547519012431982
