标题,帖子数,日期,情感
影响股友心情的只是股价变化，过后原来是庸人自,9621,2016-02-17,0.6593628092291203
外围股市大跌之我见,66711,2016-02-12,0.7881608423663148
失去的金矿！,36116,2016-01-31,0.5
浦发银行16日起停牌 拟筹划定增事项,38369,2016-02-15,0.042726927926885594
虽然神创股的调整尚在漫漫途中，一时还看不到头,20122,2016-01-28,0.39234219231637424
与技友说浦发,37791,2016-02-07,0.2813951343963109
今天去了豫园,16814,2016-02-10,0.6549289800930568
浦发银行投资者：扫货绩优能源互联网10转30派6,11577,2016-01-27,0.9383124283183242
千股跌停辞旧岁，万众爆仓迎新春！求横批！,19898,2016-01-29,0.0023327124336270932
猴年第一天：钻天猴和二踢脚,13020,2016-02-13,0.1200350596844999
富德人寿继续举牌至20%，并和中国移动一块要求,80947,2015-09-12,0.368899459428506
我的猴年第一次技术分析预测待验证之趋势通道技,23644,2016-02-12,0.9949548980739896
浦发银行现价18元，当心腰斩！,20871,2016-02-06,0.0422282361069255
【年鉴】浦发银行热点事件 热门人物大回看,134667,2016-02-05,0.7960523858705746
指数就算跌倒1000点，浦发也值28元！,40449,2016-02-09,0.24031144335919596
大盘、浦发、休假期的思考,27757,2016-02-10,0.9803946265279809
春节要到了，预祝浦发吧的所有朋友：猴年吉祥！,15649,2016-02-06,0.32660446979848
坚守银行股不动摇,23333,2016-02-08,0.708190089550658
鉴于我的能力有限，全部撤出浦发，休息过年，主,40490,2016-02-05,0.4661816530540309
新年愉快，投资投机顺利。,14127,2016-02-06,0.8654356933494515
让智者去等W亿市值吧，本人节后将竞价卖出不发,14174,2016-02-05,0.22122498851601513
浦发给大家一个过大年的好心情！赞浦大庄家，谢,50893,2016-02-05,0.32344218996459684
请大家帮个忙,7606,2016-02-05,0.18839789196393364
浦友们：莫悲伤！《浦发银行来日方长》,284546,2015-08-24,0.9687048218907174
创板继续领涨,7504,2016-02-04,0.6332969185861136
索罗斯最新预言！,16740,2016-01-07,0.9269364016418526
沪深股市——龙头股的风采！,14787,2016-02-04,0.9875462707156667
生命人寿提前给坚守浦发的股友发过年红包了,14515,2016-02-05,0.6855723172898479
600000:浦发银行第五届监事会第五十二次会议决,43542,2016-02-04,0.003546078011819054
浦发红包收好了，哈哈~~~,10853,2016-02-05,0.09909033379610088
典藏恒久远，浦发永相随,14117,2016-01-21,0.9308173098564951
拾几年前老农喜欢的是高送转股。十年前喜欢上了,18758,2016-01-31,0.9878131576951562
抛！！！经济每况愈下，银行和券商离倒闭潮不远,33820,2015-08-26,0.6925122299790811
中央二套正在播，保监会提示注意风险。,18638,2015-12-15,0.264557724407541
大利空！外资大举撤退中国，险资成华夏银行接盘,17735,2015-12-29,0.437730448837369
今天大盘要涨了,7609,2016-02-04,0.7542516636794384
关于浦发与兴业等比价。,18105,2016-02-04,0.4845673774096074
蓝筹股的春天,21051,2016-01-28,0.9886460540846229
有人在吸纳筹码，但没人响应，,12114,2016-02-04,0.791271773297384
我选择持股过节！！！,8840,2016-02-04,0.10202418193865026
去杠杆！那么都有哪些杠杆呢？,9104,2016-02-02,0.4857885984016146
股市是最好的消灭财富的场所。16。5,19751,2016-02-01,0.9406643534333562
盖棺论未定、功过后人评；是一日游还是反转切莫,8103,2016-01-29,0.8246526653504819
四千努力唱多，3千五拼命做多，二千六跟人一起,19822,2016-01-30,0.9675331528801349
按部就班,10705,2016-02-02,0.6666666666666666
万能险A股劫：兑付洪峰将至 险资大幅减仓逃顶,28030,2016-01-31,0.5686024701986678
浦发银行：散户的机会来了！周四开启百点长阳,49202,2015-10-07,0.2372730258106419
12月28日：扇形线技术分析讨论（续）,66121,2015-12-28,0.616700162419207
8月29日发图测试：反弹目标3500,5581,2015-08-28,0.8526248130233794
8月24日卜莁：这一天，熊市来了么？,16808,2015-08-23,0.18999896755451529
不要把股市想得太复杂，很多事情都要通过时间来,12382,2016-01-30,0.9025791773389782
上证综指——下周多头攻击的热点方向！,52130,2016-01-23,0.9779539998515026
我相信--,20006,2016-01-29,0.5262327818078083
600000:浦发银行关于2016年第一期绿色金融债券,33393,2016-01-29,0.727060731026431
布局春发行情，夏长可能没那么容易！！！,9383,2016-01-29,0.5313240345390391
当你只能在市场跟人比大小时，胜负的天平其实早,14686,2015-12-04,0.8174163486065983
离开吧，资本市场只能关注皮夹子机会！！！,9216,2015-12-27,0.9803771846320777
发个贴，以为发在这，没想发到基金吧了？！！,8086,2015-11-22,0.26319806793268674
养老金万亿元入市！首选：华夏银行（600015）,17401,2015-12-24,0.8368152631310257
大家扫货盘小绩优：华夏银行！带涨整银行板块,11512,2016-01-20,0.9137748405850843
小编删了我的帖,13071,2016-01-28,0.5320284786741639
2015年浦发银行业绩指引略超预期,57266,2016-01-06,0.8665065059036201
这次持小股的人，真得很危险，来浦发避险吧。,13552,2016-01-28,0.26339453401829604
单针探底是底吗？参考1849点如果是底后市还有几,12550,2016-01-28,0.9235206140645975
空仓也是学问 1现在是牛市吗?应该不是。2大盘走,24558,2016-01-09,0.08148045969236983
危难之际，一招救市！！,13154,2016-01-26,0.08618020339586796
浦发以破位，大家不要在安慰自己了,46743,2016-01-23,0.39900084845221506
600000:浦发银行关于2016年第一期绿色金融债券,34236,2016-01-27,0.727060731026431
=午夜神灵在新年又有新观点与您分享=,17399,2016-01-01,0.42795034697605217
年底了，看看这些让人恶心的基金干了啥！,13068,2015-12-26,0.08741789529388888
驾校这样的股票我是不申购的。,9733,2016-01-27,0.5618564189277186
浦发高抛低吸，这是最好的中长期稳健投资策略。,29853,2016-01-22,0.9389628260763188
16个交易日股指四次千股跌停非理性，多杀多破位,8425,2016-01-27,0.26253349135605786
我的2016预测记录与验证记录,51379,2016-01-19,0.9717867811082517
坊间有说：“人越老越善”，a老农你却是越老心,8484,2016-01-26,0.9817956529320012
明天敢跌我也同样地买股！！！,11001,2016-01-26,0.025392384225928266
极端情况上证会跌到1949,8807,2016-01-26,0.15041401454756154
人家就发了点心声，口诛笔伐的？？？,10024,2016-01-25,0.09723609758593954
我什么也不种！,41217,2016-01-22,0.5
明天复明天，明天何其多,19673,2016-01-21,0.5504031315192732
转载,10639,2016-01-22,0.8333333333333333
浦发银行：金秋十月怎么走？节后建议布局四季度,9038,2015-10-06,0.07154810526957123
惊呆了，2万股买盘就可控盘,12383,2016-01-15,0.5571071611397952
五大行股价已跌到2400左右的价格,11775,2016-01-24,0.49139691184424217
前期我在庄里跟大家提到的浦发银行，不知道大家,35257,2015-12-20,0.5376394064195354
我可以负责任讲。小秘书就二傻子炒股。帮别人算,19402,2016-01-22,0.013413836820979741
如何找到十倍股——银行股投资的逻辑 ,107555,2016-01-22,0.2807969678074167
现在能止跌的，只有汇金和社保的资金了，,29388,2016-01-21,0.7255259952345866
大盘如期反弹了，在中小创的带领下反弹了！这次,28466,2016-01-18,0.7151251394326323
上证综指——多头来临！（2016年1月21日）,13962,2016-01-21,0.2735532270938552
大股东从来没有减持过的股票,9999,2016-01-21,0.6196497217558466
什么时候涨停也不奇怪，还有筹码吗？,6805,2016-01-21,0.4630528298869667
我要说什么呢，主力机构没有能力尽一步打压浦发,23252,2016-01-21,0.2907560432467341
银行无敌..是永远拿在手里就一定无敌吗,24526,2016-01-17,0.9894066551062259
如果你有十年的股龄，你会知道底在什么位置,10472,2016-01-21,0.7107550638565981
检验你是否价值长期投资！筹码比短期价格重要。,11178,2016-01-20,0.990066582371958
明天打新，套里面的终于又派上用处了！！！,9192,2016-01-21,0.036326798768614
浦发银行——短期做空时机即将到来！,67965,2016-01-19,0.8766627293899644
我的第二只股票，增持。,12175,2016-01-18,0.5617923335693455
600000:浦发银行关于发行股份购买资产暨关联交,57185,2016-01-20,0.5534683013593483
秘密地买入了一点浦发，等小股下跌，,9337,2016-01-21,0.9389630721473857
休息是最高效的赚钱方法,5445,2016-01-21,0.7303575933891968
为什么中国股市机构基金等赚钱的模式是诱骗中小,10679,2015-11-16,0.9843218647610033
2016年注定是银粉年，祝愿众银粉投资顺利！,57616,2016-01-01,0.9931953477313163
业绩快报显示2015年税后净利润符合预期；收入增,42277,2016-01-06,0.9009629297168588
600000:浦发银行关于获准发行绿色金融债券的公,41173,2016-01-20,0.670206814003105
浦发的几个参考点要注意。17.23,52925,2016-01-20,0.3091693934569294
三只银行股的业绩快报是股市报春鸟,23074,2016-01-15,0.8013465842467818
中文在线股东为改善生活拟减持不超201万股,10274,2016-01-18,0.1467597728642981
一个小散的喃喃自语,64479,2016-01-10,0.2949617163821483
一散户进寺庙问禅师：大师，大盘如此暴跌，我该,58359,2016-01-07,0.8371861650004325
3银行发布2015年业绩快报：浦发兴业净利增速减,62096,2016-01-18,0.3623208674962429
三千点之下股票价值逐步显现，只要破2850周线就,8067,2016-01-18,0.9145472197532231
浦发银行：中线基本面具有投资价值，深套建议耐,10183,2016-01-14,0.9465167092275811
浦发银行等强势股必须补跌,22261,2016-01-15,0.03337343971869955
创业版回归理性才会有真正的慢牛,18025,2016-01-04,0.9972244790170041
浦发银行(600000)融资融券信息(01-15),12865,2016-01-16,0.37014738930766744
不好意思，按我的选股要求，A股仍旧不能买！！,42528,2016-01-16,0.012178583087554484
我不介意透露一些操作，一些仓位，也许我欢迎下,23481,2016-01-15,0.45303858528463326
给你一个小学算法。去与留你看着办17.58,20209,2016-01-16,0.923116381808873
熔断机制确实是画蛇添足，但它其实不是暴跌的主,24926,2016-01-08,0.4046462459397675
不要怕，本人正在筹措资金入市托盘！！！,15911,2016-01-15,0.11391339077122009
真金不怕火炼！,11810,2016-01-15,0.4737672181921908
今天还是太心急了，下午在17.75元接了十万股，,17867,2016-01-15,0.025486396873645623
马光远：A股需对权力减持 对契约和信用增持,8432,2016-01-15,0.014516619360091298
年底或掀蓝筹股行情 招商大盘净值稳步攀升,12620,2015-12-03,0.8942488729358022
浦发银行(600000)融资融券信息(01-14),14909,2016-01-15,0.37014738930766744
浦发、兴业两个超级快报，足以秒杀许多中小创啊,19064,2016-01-14,0.68610803962262
兴业的业绩快报比浦发好,18092,2016-01-14,0.62031585880852
收复3016点五日线下周一将拐头向上，反弹延续中,5649,2016-01-15,0.9715144849107759
下午和明天可否大反攻？,14378,2016-01-14,0.34060359170817645
（一阳吞4阴绝不是散户干的事）,10637,2016-01-14,0.139459566368338
套现4亿，罚款1580万元，这买卖值啊！,17737,2016-01-10,0.35777252985829056
浦发威武！,12217,2016-01-14,0.28139513439631236
我这一贴一发出，小散空头要彻底崩溃，空头的进,12993,2015-09-30,0.046537258767373135
银行股今天翻红,12101,2016-01-12,0.1062815928750408
生命人寿会继续买入浦发银行,17787,2016-01-13,0.7263132729060225
非常集中等于暴涨！,79413,2015-11-23,0.45770975952451387
股民不需要口号！股民需要的是务实的态度,7863,2016-01-12,0.7790120233727429
小秘书你18.5走了。可19块几回来就是不对了。现,68525,2016-01-09,0.048251090219299964
浦发银行(600000)融资融券信息(01-12),12842,2016-01-13,0.37014738930766744
3000以下短期谨慎卖！！！,7971,2016-01-13,0.2630124202690808
已找到第二只股票作为补充，浦发不再唯一 17.45,11155,2016-01-12,0.2921153552904141
股民发造谣贴“能空仓就空仓、看到就是救命” ,9343,2016-01-12,0.8135939295976284
上市银行年报披露扎堆3月末 平均利润增速或低于,39032,2016-01-12,0.026250328564232817
外媒称：中国股市显大户逃离潮 预计16年向下千,12554,2015-12-23,0.8780812814141227
浦发银行 后期走势及个人看法,19963,2016-01-10,0.6744305035654807
入市后，为什么很多人总说亏多赚少，我来说说因,28479,2015-12-21,0.6072192194945228
离岸人民币兑美元快速回吐涨幅，20分钟内跌超30,8887,2016-01-12,0.5458791262250483
制度设计的严重不公平,9141,2016-01-10,0.6208533849418554
年前最后一波的主升浪，要不要把握！,58532,2015-12-25,0.8711077097629297
老调重弹,8900,2016-01-11,0.4737672181921908
我阳光，不怕套，不怕跌，视为机会 17.05,13267,2016-01-11,0.8550559763942166
3000点上加紧卖，否则一整年你只能等解套！！！,9783,2016-01-11,0.08426965050662394
当前大盘的技术分析一二,17305,2016-01-07,0.9547819203992328
浦发银行——股市保卫战的急先锋！,15558,2016-01-09,0.4358236942838627
我又买股了，不少于100股,11853,2016-01-11,0.16617742936834046
暂行熔断机制是保护了小股！！！17.12,5904,2016-01-11,0.12016210576413078
浦发是要守住，不要让坏人当道。17.36,4825,2016-01-11,0.3480796016079214
传一月份行情将破2850点！下月股灾将来临,13663,2015-12-25,0.5385691356537555
辩证思考。很多事情不是你所想像。,21553,2015-12-15,0.9863762427315679
很多人被套一些就受不了，17.49,16354,2016-01-09,0.11262812636070219
我认为浦发只值8块钱,21713,2016-01-09,0.017733187800160977
A股接下来靠谁托？？？,8509,2016-01-09,0.013425517599004788
银行H股的投资价值,15135,2016-01-09,0.5215673509009654
浦发浦发；我回来了,7619,2016-01-10,0.23331308155706065
看到这几天大盘及浦发的走势，对追高买入的朋友,31366,2016-01-07,0.5015154388785865
上证指数15年12月31日多周爻线解,12865,2016-01-04,0.17421326682544924
大批恶炒创业板的私募基金被清盘、平仓,12900,2016-01-09,0.9909527745540548
到了,18682,2016-01-08,0.5262327818078083
我已做好了长久战，不怕任何被套。,14685,2016-01-08,0.8809698610825315
小股民以自残的方式打败了国内机构。17.51,11878,2016-01-07,0.9540574865309038
现实点吧，傻瓜不够用了1,49173,2015-12-09,0.09415691082286815
熔断机制保护了价值投资者。正确的事要坚持。,14858,2016-01-07,0.9730352195047066
浦发的价值不随融断机制跳舞,8308,2016-01-07,0.0865843782896818
浦发银行今日超大单流入排名第7名(01-07),18862,2016-01-07,0.2432606158866154
浦发银行买点（2016年1月7日）,12696,2016-01-07,0.016823983237027718
我知道不会亏损，但需要一点点时间罢了。,11802,2016-01-06,0.20089479429986878
2500左右才可以进场捡皮夹！！！,7281,2016-01-07,0.4870601103880071
今天的半公室,10380,2016-01-07,0.5
技术分析熔断,10093,2016-01-07,0.8390175308770798
阅读4举报本帖 生命增持浦发已告一段落。想控股,22148,2015-12-15,0.804167541335697
没有任何实在利空的暴跌,11421,2016-01-04,0.5339250467367564
欧美大跌五日均线下压看3327支撑，量能覆盖巨阴,5233,2016-01-07,0.4366913237805289
新年第一个赞，点给长宁府,13866,2016-01-06,0.49866139194865156
浦发风险已经出现，生命人寿等机构不增持，20多,18855,2015-12-14,0.615347541343985
股海随笔---寻找成功的阶梯,9237,2015-11-07,0.9978095831114477
这是我炒股以来看到最有哲理的一帖，入木三分！,12266,2016-01-05,0.6085205310826233
证券行的融资融券什么时候降低利率！！,7551,2016-01-06,0.66883675721274
1.5机构荐股一览：5只个股还能涨3成以上！,53059,2016-01-05,0.550498355389499
转战兴业和南京的浦粉：别再互掐了！,71718,2015-12-05,0.3841264347984058
人保持股华夏银行19.9%！首钢抢权大战爆发！,9531,2015-12-31,0.13404284626684826
2015年业绩快报点评：不良超预期，拨备增压力,37882,2016-01-05,0.932571671317669
600000:浦发银行2015年度业绩快报公告,80722,2016-01-04,0.18483756452506606
两融余额14连增后首降 资金持续流入银行股,209719,2015-11-25,0.8076517048471609
首份2015年业绩快报：浦发银行净利润506亿增7.6,52616,2016-01-04,0.4919085214401473
熔断机制保护了买低估值的人，明天继续买。,22252,2016-01-04,0.4344357802882973
我只是一名对股票投资感兴趣的散户，此文仅是我,30313,2015-12-22,0.9806057048509297
浦发银行去年净利506亿 同比增7.6%,26011,2016-01-04,0.3731148264064702
再见2015！展望2016~~大盘解读,10203,2015-12-30,0.9293722738256281
浦发银行发布业绩快报 去年净赚505.98亿元,22772,2016-01-05,0.22670241044921635
那道小学数学题，今天公布我的答案,22652,2015-09-23,0.958034946204671
热烈庆祝,12962,2016-01-04,0.5000832375134057
再接再励,7228,2016-01-04,0.8
浦发不可能跌破18元。,17500,2015-12-28,0.00936256013259118
【讨论】熔断机制下 银行股才具备真正的投资价,28438,2016-01-04,0.6176427005765397
1月6日，浦发又是第一家公布年报快报,45719,2015-12-20,0.0041525741773700275
炒股改变了我的。。。,9999,2015-12-31,0.33579315211116434
10万打新买浦发银行仅赚1元，如果股票下跌10%亏,8240,2015-11-18,0.06385583235345382
600000:浦发银行关于发行股份购买资产暨关联交,14322,2015-11-23,0.5534683013593483
600000:浦发银行关于修订公司章程获中国银监会,34932,2015-12-29,0.8118760689521758
这里的人都空仓这么神奇吗，我又准备要买股了，,9870,2016-01-04,0.4599866577276872
上涨之时怕你手慢，买不到。,5785,2016-01-03,0.028322613043767042
年前最后一波主升浪，要不要把握！,13200,2015-12-25,0.8711077097629297
杭州银行、上海银行的发行价是多少？以多少市盈,57490,2015-12-30,0.0950263835000087
少数小散能被榔头敲醒，多数属于永不醒！！！,12471,2015-12-31,0.10866482557958601
榜样的力量,19677,2015-12-18,0.914464549334105
2016年浦发筹码比价格重要！！！,23601,2016-01-01,0.22556418730321304
谨记是资金推动股价上涨。1 2 7定律没有改变。,9811,2016-01-03,0.8295337264080498
2015很悲伤,8222,2016-01-02,0.9881671574971553
懒牛发布的第一份阳历年报，2015年懒牛盈利百分,19042,2015-12-31,0.6862991113286189
一个人注册几个号不难，难在要用几个身份性格。,10323,2016-01-01,0.27595737667092046
上午只成交了12万手，建议让浦发休市一年,7944,2015-12-30,0.05232019518564557
明年再战。损失中，把钱花出去。,17618,2015-12-31,0.6436341001638352
年底行情揭秘——波段买卖点的选择（2015年10月,94739,2015-10-19,0.38956340626384367
火山爆发前的银行板块，野蛮人哄抢的银行板块！,54026,2015-12-22,0.38212604241312054
我认为主力机构没有能力打压浦发。18.74,13124,2015-12-29,0.41553816134032917
继续加仓，欢迎下跌。,5198,2015-12-31,0.4313719623515795
20元以下的浦发是来提款！只要你拿得住！,13292,2015-12-23,0.346125963962004
但愿下午和明天守得住。损失中。18.55,13688,2015-12-30,0.35308833536811124
600000:浦发银行公司章程(2015修订),32898,2015-12-29,0.2774518951338615
小米鼠的嘴是怎么长的～～,5502,2015-09-22,0.6089328243882185
浦发流通散户已经少于12亿股！,22480,2015-12-23,0.266904401333656
随想，只是随想,7749,2015-12-29,0.4737672181921908
浦发是否再来一个举牌者？我看行。,9851,2015-12-28,0.10937413801226803
四次举牌耗资近700亿   富德生命甘当浦发银行二,106684,2015-12-24,0.6080677758711197
12月11日技术分析讨论：趋势反转的扇形画的对么,16784,2015-12-11,0.3072328576191039
我很穷，但心中富有，认清股市本质 19.41,49682,2015-12-25,0.9991459340106819
阴谋论说万科事件。,13011,2015-12-26,0.8299693380160773
19.18进浦发,19104,2015-12-25,0.2813951343963109
万亿打新资金托底年线收关注定完美，下周二十周,4773,2015-12-28,0.9781086506523916
下一个将被险资养老金举牌的蓝筹银行股是谁？评,49422,2015-12-26,0.1596497725982895
2015年度结算,26192,2015-12-26,0.03716274677826703
==浦发银行10元见===,13154,2015-12-24,0.048283559698119705
对明年中国股市的一点冷思考,19729,2015-12-25,0.9984527870025874
何必究结生命人寿是否要成为第一大股东,22927,2015-12-16,0.7916423075444816
浦发极低的成交量维持不了多久，必爆发!,16342,2015-12-24,0.050649462687744284
不知有多少双眼睛盯着浦发想低价买进！,10551,2015-11-12,0.2910371772083338
如果生命人寿半年前举牌20％浦发成功？！ 如生,31379,2015-12-21,0.37061084333285743
浦发银行(600000)融资融券信息(12-24),7696,2015-12-25,0.37014738930766744
浦发展望被评为负面？ 在穆迪将平安银行评级展,26537,2015-09-29,0.31910092355155706
创新高指标背离回拉修复莫慌，均线层层支撑两日,5309,2015-12-24,0.9733356097811442
一个老股民的平凡声音,17609,2015-12-23,0.9649996034035635
卖出了浦发很难再买回来。增持。,10963,2015-12-24,0.13845655859059658
还是没有买到好时点。,6972,2015-12-24,0.7704809825242371
基金采用温柔手法拿不到多筹码，,14152,2015-12-23,0.9864329311120971
浦发银行的奇异之处一路持有从不亏钱。,14838,2015-12-10,0.03425942328237619
尽快放开国内长期资金和各地养老金入市！！！,11837,2015-12-21,0.8154779503028474
上海信托的净资产是：24.5亿元而卖了近180亿元,9228,2015-12-22,0.2832524790133375
告别投机，投资蓝筹。银行板块即将爆发！,132105,2015-12-08,0.9984178912426348
12月9日国内四大证券报纸头版头条内容精华摘要,78937,2015-12-09,0.32222172956350925
富德生命600亿举牌上市公司 监管层重拳排雷,51025,2015-12-19,0.9954873274384257
29元买过浦发---铁杆浦发的铁证,16952,2015-12-17,0.037189264917192544
12月21日周一操盘要点建议：,18982,2015-12-20,0.3664517033748982
浦发等优质股才是今后市场中真正的稀缺品,17876,2015-12-08,0.3117661782410932
有没有一致行动人？操作不好 反了。,10727,2015-12-21,0.12493816115044099
其实浦发早就没有多少小散，股价只不过是虚数。,32513,2015-11-30,0.6282324868097632
富德生命600亿举牌上市公司 监管层重拳“排雷”,165593,2015-12-20,0.9525039433394353
下一步谁来争抢农行和华电国际第一大股东？,16685,2015-12-18,0.7854293602846435
如果下周生命人寿再次发布新增持5%,市场将如何,19624,2015-12-19,0.3850896541750072
你猜浦发的增发会在什么时候进行？,13520,2015-12-19,0.4845673774096074
对于保监会发文的看法,29227,2015-12-11,0.6184777508821578
王石内部讲话：不欢迎宝能系成第一大股东,12705,2015-12-17,0.48845446513464474
抛出九九久入西藏珠峰，总算没做错,30543,2015-12-05,0.35751724412020414
我选择了部份钱去消费和存银行。,14896,2015-12-17,0.007573141228165325
浦发周收盘价创历史新高,15527,2015-12-18,0.9539742180304118
关于收购的思考。,39818,2015-12-18,0.9921285848368748
下周或将迎来变盘点！,12657,2015-12-11,0.2686840488242115
今天浦发不发,27106,2015-12-14,0.09071746720839258
浦发会复制万科的走势吗,23137,2015-12-04,0.8314133580152332
浦发吧为何变得如此脏乱差！,8931,2015-12-17,0.025933952863427034
生命人寿四度举牌剑指浦发第一大股东,43250,2015-12-17,0.7495514682123265
浦发股价严重高估,6463,2015-12-16,0.6471525252529394
3500亿市值的浦发流动性变得像创业板了？,15508,2015-12-15,0.7510529764486858
好股啊！不拿住绝对遗憾终身！,69345,2015-12-16,0.5377522059888333
险资斥资千亿元抄底A股市场 管理层祭金牌防风险,24348,2015-12-17,0.9474948885374972
被套了几毛钱，什么时候解套 18.18,10240,2015-12-16,0.23727720432466382
浦发兴业资产质量：有企稳趋势,20352,2015-12-16,0.6474077977224197
我并不是盲目唱多银行，但我了解银行。降息最收,11948,2015-12-15,0.005193278202873075
明天开盘18.30元，上冲18.50元后回落至18.25元,16340,2015-12-16,0.009261260389252568
一阳带五星均线高度粘合面临选择突破，有打新资,3969,2015-12-17,0.997150619255593
又在呓语了,6471,2015-12-16,0.5
我们来推演为什么不良货款。所谓不动产银行认为,10432,2015-12-16,0.17342621786616375
富德系耗资607亿入股 浦发第一大股东能否易主存,45348,2015-12-15,0.3379241357320404
泥沙俱下！,3598,2015-08-24,0.23082833962758653
今日关注 周二大盘预测及操作要领,8002,2015-12-15,0.973536957670992
周均线高度粘合中线选择方向，二十周线尚有三周,6981,2015-12-14,0.4675570548567686
说说收购万科的宝能，显得富德人傻钱多手法笨,17863,2015-12-14,0.8930061099870598
一根假阳线改变了我的看法，明天适时启动融资。,16279,2015-12-14,0.9808048025306213
实在忍无可忍了，你看着办吧。,53891,2015-12-11,0.034260572358110086
被套的情不好受。18.15,13175,2015-12-14,0.5475867802899137
春风又绿江南岸，求此下句,17498,2015-11-23,0.45116125721185285
要想挣钱，只能融券做空浦发银行,10228,2015-12-11,0.0571479464294129
我认为星期一收盘会上涨，别被忽悠，18.60,24881,2015-12-13,0.03742315560956888
细说生命人寿,24600,2015-12-12,0.9116675691581552
