标题,帖子数,日期,情感
循环日記:市场继续下跌,融资继续买入,8359,2016-09-26,0.9550956258582447
李如成中信股份亏惨了雅戈尔该退市了，豪赌中信,13973,2016-09-20,0.9994530802850783
雅戈尔投资的宁波中车新能源科技有限公司研发生,10895,2016-09-26,0.7284320249575182
循环日記:从半年报看雅戈尔的房地产开发业务,14205,2016-09-25,0.8079580856843711
循环日記:雅戈尔投资股市的近况,15026,2016-09-24,0.9955800924071295
600177:雅戈尔关于全资子公司获得土地使用权的,54157,2016-05-24,0.8054594634321707
今天26元又可以减持500万股联创电子了！,9692,2016-09-22,0.6568332945018712
再次中了一个新股常熟银行，感谢雅戈尔,9403,2016-09-22,0.5006729032873408
因为雅哥尔在一季度为了调节利润人为提前对现了,7961,2016-09-22,0.06027327043115038
600177原始基金的问题,10680,2016-09-21,0.9572117312563219
雅戈尔连续下跌你们还敢买入吗，中信股份巨亏面,5315,2016-09-21,0.941863648130552
雅吧里的人总是一口一个价值投资，而正是格雷厄,11123,2016-09-14,0.9992282054062993
鲜花与狗屎,9557,2016-09-14,0.7658138788729517
看看万科，看看伊利，雅戈尔你不慌吗？,5151,2016-09-20,0.7142806928777118
中信大跌证金减持下降通道中快跑,6549,2016-09-19,0.7790511018824932
中国股市是穷光荣的时代？,4906,2016-09-19,0.9884528785422579
默默地关注32、33、34手的成交,6826,2016-09-19,0.9095434544229848
坚决要求今年送股!同意支持的加入!,6025,2016-09-17,0.17866222427227962
解读雅戈尔对中石油管道投资的收益---湖南小股,45010,2015-12-26,0.9923187267520095
咱也唱空两声,13587,2016-09-07,0.5009105579083616
今天决定：封存股票帐户，不再看盘。请大家帮助,12732,2016-09-14,0.5050546577236342
原来雅戈尔是投资高手,11993,2016-09-09,0.8062645482877743
长线持有亨通光电静候再翻番,8746,2016-09-05,0.15762018669733768
还真参于了分红，太后悔了。,16206,2016-06-29,0.10199856254526218
从45万元到254亿元 服装界“投资大佬”雅戈尔的,17403,2016-09-12,0.6533503933070364
中信股份已经涨2.6%了，一天回来几亿港币！,6258,2016-09-09,0.9938125448229475
允许险资去香港投资？老李有领先一步！,5750,2016-09-09,0.999271737523589
循环日記:炒股大王雅戈尔,24652,2016-08-31,0.7800697674096078
雅戈尔中报每股1，31元，己很不错了，市盈率才5,19565,2016-08-30,0.4057642213769109
求证雅戈投资的管道要上市吗？,12385,2016-09-10,0.5782463604023758
那些对雅戈尔有非议的人，我想告诉你，首先，中,11144,2016-09-10,0.6583631075993951
雅戈尔在联创电子上的减持很值得称赞！,11749,2016-09-08,0.9893502839811342
估值受益于银行地产板块上涨,83130,2016-08-16,0.06951319834528757
今天14：00不到就开始砸盘了？越来越早了！,3753,2016-09-09,0.37599633014852496
正宗的温水煮青蛙,9676,2016-09-01,0.7861174233559218
有些机构，能不能留点基本的底线？,2856,2016-09-09,0.7790778464876515
开盘价融满!,4832,2016-09-08,0.894950127932424
雅哥发力发力发力[鼓掌][鼓掌],29180,2016-07-11,0.8490468186623238
公告：鉴于本人对雅戈尔公司经营方式的认同、稳,20925,2016-09-02,0.8035998999515309
钟尽你要出就痛快点，打跌停也可以,2331,2016-09-07,0.5657064137045046
形势变了，追，涨过16元,4782,2016-09-06,0.703135644176379
大股东明明在增持，何来减持一说？,9951,2016-09-06,0.10408700758887868
雅戈尔真的资金短缺了吗？,26012,2016-09-05,0.9611456251899406
据可靠消息，360欲借壳雅戈尔在A股上市.,15034,2016-09-02,0.5387241763262229
谁帮主力支支招？,7634,2016-09-01,0.12233799525587519
有雅戈尔市值耐心打新股，二不误。,5949,2016-09-02,0.22989000278610938
我们坐庄的基本策略——消耗,8440,2016-09-01,0.8995256482899386
湖南小股民：雅戈尔让我懂得价值投资真谛。,11932,2016-08-27,0.9966253083499255
雅戈尔不到11元不想买入,2963,2016-09-01,0.12629257699486796
看到下面齐刷刷的千手买单，我很踏实！,2559,2016-09-01,0.5363922295860674
房产业务推动雅戈尔净利增5.78%,15606,2016-08-31,0.569128295735008
600177:雅戈尔关于公司募集资金存放与实际使用,20097,2016-08-30,0.8833805355209212
假如国家队当初救市买的都是蓝筹股！,6913,2016-08-31,0.6812966558846683
600177:雅戈尔2016年半年度报告摘要,46696,2016-08-30,0.7065878403244534
不明白一季赚1.1二季仅赚0.22元——,14877,2016-08-30,0.24545855233139324
先给唱空雅戈尔者第一个响亮耳光!,9346,2016-08-29,0.8858023896253746
普及点会计知识，战略投资股价涨跌不影响利润！,8166,2016-08-30,0.9998241234330584
在售面积,9859,2016-08-30,0.5402229961254015
雅戈尔何时上45元？,10049,2016-08-28,0.15958252506024484
说实话，买雅戈尔真的不如买宁波银行！,4763,2016-08-30,0.05011292300490722
雅戈尔，真金不怕洪洪火炼，十年金枪不倒，千锤,22160,2016-08-27,0.9767057558430513
这里的黎明静悄悄,9166,2016-08-29,0.7297953905324696
循环周記:详细复盘发现,逆市上升的雅戈尔,20946,2016-08-27,0.9284209589008608
中报一出，这货必跌破11元,7778,2016-08-11,0.01186039652400539
聪明人一定能看清雅戈尔价值 发展潜力定会被发,8248,2016-08-29,0.9079794691157305
预计,61869,2016-06-15,0.16666666666666674
湖南小股民：请教雅戈尔的财务报表问题？,8736,2016-08-27,0.6400669347088331
雅戈尔里有多少坚持五年以上的股友？,12632,2016-08-23,0.23118404320752706
湖南小股民：稳重的雅戈尔何时会暴涨？,16567,2015-11-08,0.9586512236346587
雅哥尔一季业绩主要靠本期变更联创电子会计核算,9389,2016-08-26,0.9992796644259788
雅戈尔需要越跌越买!金子!,7174,2016-08-25,0.4593347453173463
从2万起家的乡村小厂到中国服装业翘楚 雅戈尔如,10438,2016-08-20,0.012953243119991353
汗麻都涨停了，做为第一大股东雅戈尔你好意思吗,5621,2016-08-24,0.525630373695241
申万宏源证券最新预计雅戈尔中报增长5O%因投资,49710,2016-07-06,0.7656430221729745
循环曰記:盘面观察,市场准备反弹,6568,2016-08-25,0.9073250732556772
循环日記:个人股灾周年回顾,价值投机可保不败,7823,2016-08-25,0.9972132620897733
今日低点很可能就是阶段性低点,7734,2016-08-25,0.9902470332501244
雅戈尔属于养老股，年轻人不适合！,10414,2016-08-23,0.8491435524704973
中报前的真空期，你就诈吧,7630,2016-08-24,0.2550997892330462
循环日記:昨天继续缩量,市场并不乐观,5652,2016-08-25,0.8924071916552797
创业软件雅戈尔持有2400万无限售股票！,3962,2016-08-25,0.9890576364571403
循环日記:今天初进雅戈尔,祝大家好!,9510,2016-08-24,0.8747835535099273
雅戈尔持有的2400万股创业软件已经全流通，目前,16414,2016-08-17,0.5175758248745095
这个价位主力是上下两难啊！,4934,2016-08-24,0.7753480286159928
15.3下方筹码到底不敢砸,7123,2016-08-23,0.08082155557227022
预计雅哥尔全 年业绩将会在1.4-1.5元左右市盈率,10508,2016-08-20,0.09631166084312615
据内部相关人员称，由于公司二季度出现亏损，中,16874,2016-08-08,0.1965943391461742
一季度做假账保增发，现在钱骗到手了，原形毕露,9052,2016-08-10,0.5647896858051705
雅戈尔一季抛浦发银行等股票 获利2.47亿元,57673,2016-04-01,0.22240282130853672
看了这个，你还有幻想吗，高管减持的价位不得不,13741,2016-08-06,0.9963187244340307
600177:雅戈尔关于使用闲置募集资金购买理财产,33597,2016-08-18,0.7799104461591182
就一垃圾货，从三月到8月，大盘涨了多少，还在1,4421,2016-08-16,0.0661479453409427
机不可失，时不再来,6151,2016-08-17,0.4601756348185556
拿了一年零三个月亏了50万走人,7867,2016-08-16,0.6262844627249294
600177:雅戈尔关于总经理辞职的公告,73262,2016-05-25,0.07174579170506223
600177:雅戈尔关于买入中信股份情况的公告,28690,2015-11-30,0.95608777525479
600177:雅戈尔关于将部分募集资金续存为大额存,35271,2016-08-16,0.8966562733679906
夏日炎热，太阳似火，雅戈尔挺起!八月是雅戈尔,24980,2016-08-02,0.9842574365492982
业绩同比下滑45%，今晚公告,14141,2016-08-15,0.7818259534653813
我持有雅戈尔，参与了分红，现在贴权0.83元，又,25051,2016-07-02,0.3162766233233515
雅戈尔补涨行情就要开始了,10170,2016-08-13,0.9466454436934496
今天垃圾万科涨停带动挽救了雅歌尔，但万科下周,8380,2016-08-12,0.7801085506363469
雅戈尔业绩好，分红回报率高，发展潜力巨大，将,61244,2016-07-15,0.9885577336051231
业绩为王时代来临啦，国家要求投资质优白马股，,73601,2016-05-12,0.9999866062488216
日益稀缺的金银将巨幅上扬,5920,2016-07-31,0.5678383114913966
抢购潮必来 金银必狂飙,9145,2016-07-20,0.9885792777678778
审时度势调仓换股,14358,2016-07-16,0.08677194791005383
估计明天会回调一下，15.35已全部清仓，明天就,8568,2016-08-08,0.06239572620175371
雅戈尔(600177)高管持股变动信息(5-3),50717,2016-05-03,0.17026792899469
雅戈尔(600177)高管持股变动信息(7-28),43590,2016-07-29,0.17026792899469
大盘跳水了,3127,2016-08-09,0.574549474228723
15分图结构！已始！,4341,2016-08-09,0.388914816342697
被低估的多元化发展集团,125437,2016-07-28,0.8518381608630957
雅戈尔突破在即,5412,2016-08-08,0.7642709336536204
雅戈尔有很多长期投资者，请问各位雅戈尔半年报,83054,2016-06-08,0.7172169499762995
T的卖点,4123,2016-08-08,0.6487680588010155
股价30也合理,9300,2016-08-04,0.6471658380214533
雅哥尔集团才持有7亿股，如果恒大买万科的95亿,12166,2016-08-06,0.4304997152820904
【投资者传闻求证】计划并购重组？,24691,2016-08-03,0.5902040668187558
当下第二次卖出机会,6164,2016-08-04,0.7264105752482248
老子今天全卖了，再也不碰鸭割儿！,8176,2016-08-02,0.3433093405017229
雅戈尔买入逻辑:1两市市盈率第二低，远远低于服,17509,2016-07-31,0.004519722566424078
横有多长 竖有多高,19704,2016-07-27,0.4593164419821164
请勿再骂垃圾股,5374,2016-08-03,0.015243140001080513
每日一骂，垃圾股，骂不骂都是垃圾！,2721,2016-08-03,0.04828701320621098
600177:雅戈尔关于用募集资金置换预先投入的自,33594,2016-04-19,0.7851512577532207
资金一下子都跑哪里去了？,3798,2016-08-02,0.9441176528978104
600177:雅戈尔关于使用闲置募集资金购买理财产,49589,2016-06-14,0.7799104461591182
假突破！何况日线图上段内背驰着,10865,2016-07-29,0.91464951130355
最近两个月手气不好，没中一个新股,6417,2016-07-31,0.05953297746893771
好了，骂了几天，本周，本月收盘了！,10295,2016-07-29,0.2784029381673533
刚才在万科吧里发了一贴，吸引垃圾万科投资者过,6372,2016-07-28,0.9740480952167527
不劳你们操心，我的雅戈尔基本没动！,8749,2016-07-29,0.16136761493817997
今天要破15元，不信等着瞧！,6919,2016-07-29,0.02263385618154201
看空的理由,7347,2016-07-28,0.2756452636329626
以我多年来对这个庄家的了解看，今天肯定调整！,7761,2016-07-28,0.4719057808914364
今天15.44再出5000股，连涨三天，连出3天！,7586,2016-07-28,0.10916427156124386
连涨三天，真是逆天了，雅戈尔不是雅戈尔了？,11317,2016-07-28,0.1022896092337311
周线调，不T日内者，勿抄,6164,2016-07-27,0.3836891585242642
尼玛，还真逆天了，今天这颗伟哥药效不错啊！,8001,2016-07-27,0.7607840275129892
预测雅戈尔中报业绩在1.4-1.6元间，最高在1.8元,22548,2016-07-05,0.8946716084969475
确定了360借壳小雅了，不要卖了,10406,2016-07-27,0.37798452076723466
14.74减仓1万股，开始减仓！,5525,2016-07-27,0.08536584817068171
放眼望去，没有几个股票比雅戈尔还恶心了！,3659,2016-07-26,0.6824381285025299
这是怎么回事？,10922,2016-07-25,0.3302166330419527
别得意，雅戈尔就是起来也是几秒钟就泻了！,1820,2016-07-27,0.6161821823477089
卖点到了！砸砸,6212,2016-07-26,0.022524375098216698
现在开始，全力唱空这个垃圾股！,2487,2016-07-26,0.05936149069714236
长线，短线！被套的需细思量,4252,2016-07-25,0.7573797482637735
看到市盈率3.6你就平静下来，但你不知市盈率是,9593,2016-06-20,0.17669272279852155
我向牙哥尔推茬东旭光电时才7元，现在将近11元,3738,2016-07-18,0.0009765576749890537
雅戈尔高超的战略投资企业，股价翻番N倍可期,22099,2016-07-22,0.9980373454289664
抄大底干大活是卖菜妹的拿手好戏，卖菜妹策划过,6144,2016-07-18,0.051840875515631546
主力资金疯狂直奔涌入这15股 后市必将再创新高,22854,2016-07-14,0.4803395435235456
3月21日至今 正好4个月雅戈尔 在14.30元横盘,9763,2016-07-21,0.027784033638218464
空仓,5233,2016-07-21,0.2603770592113267
银联有意拆分银联商务单独上市,9862,2016-07-21,0.9271071705841613
不可做天怒人怨的事情！做多了遭报应的！,4295,2016-07-21,0.11583931522754365
600177:雅戈尔关于使用闲置募集资金购买理财产,41784,2016-07-19,0.7799104461591182
雅戈尔(600177)融资融券信息(07-20),5785,2016-07-21,0.8054594634321686
反攻开始。满融！,9127,2016-07-15,0.4737672181921908
今天下午发满融的帖，被吃了？,4122,2016-07-19,0.3085781942619251
跑了,5322,2016-07-18,0.5348837209302327
要坚信价值投资最正确 安全第一!申购新股标的持,7173,2016-07-16,0.9961271719437995
昨天又被忽悠,4279,2016-07-17,0.07098325463229516
湖南小股民：雅戈尔的投资者在寂寞中前行，未来,8320,2016-07-16,0.9999841276194921
600177:雅戈尔关于将部分募集资金续存为大额存,42237,2016-07-13,0.8966562733679906
雅戈尔是个僵尸股，实在无奈,16677,2016-07-09,0.057734748240561684
mb的，持股一年多了，这股那个说的那天能涨停了,45013,2016-06-03,0.06929190480249237
变态的股票，变态的主力！,5667,2016-07-14,0.17613266478061862
做T的又卖了,6760,2016-07-11,0.7896658584775652
9元我等你包邮，,6568,2016-07-01,0.04676094961682742
我一卖就涨，就差我这几手吗[哭],5347,2016-07-12,0.4374043718037305
明天突破89天线14.39.拭目以待。,5521,2016-07-12,0.34327087505643983
昨天晚上分红16000，今天全亏了还搭上5900老本,10537,2016-06-08,0.4193239819314666
雅戈尔(600177)融资融券信息(07-05),4550,2016-07-06,0.8054594634321686
居然有人说 高分红不好？不知道这些人到底对投,70841,2016-05-05,0.02787976768593403
谁都看出有人在压盘，但庄家就是要压，你怎么地,6827,2016-07-05,0.5102671721460013
一般来说，业绩拖到8月30日公布的，业绩都不会,8859,2016-07-05,0.13413530128693907
我送雅戈尔的庄家几个字，大煞笔！,7794,2016-07-04,0.45389277613590784
向组织汇报今年上半年炒股情况,10486,2016-07-03,0.06048661059226057
600177大手购买的中信股份亏惨了，这才是关键,8595,2016-07-04,0.9827935958179524
一季度出售金融资产获利2.47亿 雅戈尔问鼎A股“,38955,2016-04-01,0.9456288603393622
雅戈尔(600177)融资融券信息(07-01),6069,2016-07-02,0.8054594634321686
今天指数走势共振!必收大阴线!,4822,2016-06-30,0.6150664579846767
今明两天会出现抢权行情，明天估计在16元附近！,16217,2016-06-06,0.11687190021013094
假如你分红的钱继续买股的话，股价下来是好事！,18929,2016-06-09,0.39901355007375594
英国脱不脱和我们有关系吗？,8337,2016-06-24,0.8241803600361203
雅戈尔一季度出售金融资产获利约2.47亿元,26885,2016-03-31,0.951220089312541
真涨了,6732,2016-06-21,0.6980740834344219
600177可做长线投资,76727,2015-11-28,0.8852591036829031
看二线蓝筹股的代表五粮液，已经走出牛股特征！,8517,2016-06-17,0.9702665698323307
动态市盈率3倍 600884杉杉股份市盈率105倍 没有,9335,2016-06-15,0.15334345106066305
主力的时间，算得太准了,19076,2016-06-08,0.5383613606537727
600177:雅戈尔关于将部分募集资金续存为大额存,43244,2016-06-13,0.8966562733679906
感谢庄家，今天给我14元加仓的机会！,5632,2016-06-13,0.3959800136479009
坚定信心，持股待涨！高股息率低市盈率，安全度,11150,2016-06-06,0.36888534817245533
买入雅戈尔一个点位，节后有望无限大量。,9852,2016-06-08,0.9785362363173495
600177雅戈尔，两市第一绩优股，横有多长，竖有,20802,2016-05-31,0.26179579768087813
今天盘中雅戈尔已经突破1.4以来的高点了！,15023,2016-06-02,0.6941577172394503
本人昨天最后5分钟卖出,8947,2016-06-08,0.30313812991828315
操作股票的目的有两个，一个是赚钱，一个是赚股,6343,2016-06-09,0.18155897342340355
分红其实也是一场骗局,17084,2016-06-08,0.6828413057785753
没见过这样的分红，本来账面是盈利，今天打开一,8907,2016-06-08,0.04233252055184322
600177:雅戈尔2015年度利润分配实施公告,164184,2016-06-01,0.175975855963995
怎么我的分红才19万2，按每股0.8元，应该是24万,13065,2016-06-07,0.010502051011393454
小雅下周二分红股权登记日，目前持有众家上市公,29195,2016-06-03,0.24942982401312064
明天除权后14元5角7分，将开盘一字跌停，因为雅,11251,2016-06-07,0.13655068476752386
雅戈尔16年业绩是爆发年，预计半年报2元,340820,2016-04-18,0.07834829055273962
今天，谁能卖在高点，谁又套在高点！,6765,2016-06-07,0.4700472967731678
雅哥起舞，大跳探戈，尔等拍手称好，雅戈尔质优,20218,2016-05-11,0.9853029549603348
快跑，顶背离了，下周10个跌停,11813,2016-06-04,0.04585834810825962
复了盘，下周一开盘跌的可能性较大,8599,2016-06-05,0.17306384839071987
全部砸出了，拜,15988,2016-05-30,0.4048758738564763
期望雅戈尔成为长线持股者的集聚地！,18801,2016-05-14,0.3364201187707433
向下补跌的可能性很大，雅戈尔买入的不建议 ！,14011,2016-05-25,0.44034320913724967
雅戈尔年报每股1.96元 今年一季报每股净利润1.1,17403,2016-04-29,0.06057175464528908
坚决买入低市盈率高股息率雅戈尔股票 大家心知,33422,2016-05-24,0.8236742987375689
虽然大跌，2016年的雅戈尔依然楚楚动人。,22572,2016-01-31,0.8024742382758892
满融，满融,6630,2016-06-03,0.4737672181921908
雅戈尔今天一阳穿三线,126779,2016-05-27,0.7123330326892559
湖南小股民：猜猜雅戈尔的走势真相。,17970,2016-05-27,0.9477495804996656
雅戈尔势必强势,17704,2015-12-16,0.37807258150573353
两市最能赚外快的公司不差钱,26930,2015-12-04,0.024519619690476113
600177:雅戈尔第八届董事会第二十六次会议决议,50144,2016-05-25,0.12668285862941941
13:32,12683,2016-05-27,0.5
雅戈尔全年累计出售金融资产增利14.7亿元,19633,2015-11-27,0.9062183482299341
又中一签,8154,2016-05-26,0.4039438605437079
单凭雅戈尔一季报的0.96元收益股价就值19元，20,21538,2016-04-29,0.6054279083574322
600177:雅戈尔独立董事之独立意见,28260,2016-05-25,0.6869219617883551
600177:雅戈尔2015年年度股东大会决议公告,55664,2016-05-19,0.7244996674893328
与股灾时比较目前雅的投资价值,23105,2016-02-09,0.9584183373662613
放一百个心！买,7043,2016-05-25,0.7331207554378024
我说雅戈尔,11571,2016-05-22,0.36572569315150527
高分红的问题就是这样，近期买入的都希望卖出，,12706,2016-05-20,0.8278954451189506
600177:雅戈尔未来三年(2015-2017年)股东回报规,58550,2016-05-19,0.9941762384388138
177分红预案策划：每10股派6元转增3股。支持的,12132,2016-04-28,0.0828925659090829
量不定，有利润的可先卖,4605,2016-05-19,0.1635294449032172
雅戈尔吧  [600177.sh]或将还有大动作,39342,2016-05-11,0.5034003085787917
600177:雅戈尔2015年年度股东大会会议资料,58709,2016-05-11,0.5623625125217302
也谈雅戈尔之价值投资之修正篇,49304,2016-05-05,0.9350147624748526
金银股票最具确定性长期上涨潜力,9380,2016-05-14,0.9355996326548858
600177:雅戈尔关于将部分募集资金转为大额存单,43921,2016-05-16,0.21026769540117451
为何要跌，主因美元周线回抽,4983,2016-05-16,0.19277454380512415
为什么机构不待见雅戈尔？--回复挚爱雅戈尔的散,30872,2016-04-29,0.42794976220257464
不亚于降杠杆清配资的利空！保监会召开险资风险,21631,2015-12-29,0.6039089719221246
雅戈尔真正的绩优拿好了，跟牢姚氏夫妇长线持有,10140,2016-05-13,0.9100536388232514
开始跳水了,3202,2016-05-13,0.5
满融,4870,2016-05-11,0.5
已经卖了,5448,2016-05-10,0.39004149377593345
想到大股东们买成15.08元，而我才买14.5元。[大,11654,2016-04-15,0.15246726971820312
莫被一季报的盈利迷了眼！,17581,2016-05-07,0.5517613349398762
满了,5646,2016-05-09,0.4470588235294115
雅戈尔总经理年薪600万一年，职工3万一年，上个,21340,2016-05-04,0.1206152603493531
减持的高管是李如祥 老总叫李如成 什么关系明眼,15358,2016-05-04,0.055985086253671934
600177:雅戈尔2015年年度报告摘要,62209,2016-04-29,0.8350202751810465
2015年报及2016一季报点评：全渠道战略下服装业,100834,2016-05-03,0.6617457903582042
600177:雅戈尔关于将部分募集资金转为大额存单,85984,2016-05-02,0.21026769540117451
600177:雅戈尔2016年第一季度报告,84196,2016-04-29,0.7748559806030249
2016-5-1除非大盘全面上涨否则雅戈尔很难走出独,8833,2016-05-01,0.7410066482249191
100万变成40万了，谁有我惨,19228,2015-08-25,0.7628845795408691
中信的投资已经产生30亿元的账面损失,20206,2016-05-01,0.8610951421847399
雅戈尔就是中国的伯克希尔，老李就是中国的巴菲,6877,2016-05-02,0.9973700286902799
庄股形态,11700,2016-04-13,0.8438377694717777
600177:雅戈尔未来三年(2015-2017年)股东回报规,54284,2016-04-29,0.9941762384388138
600177:雅戈尔2015年年度报告,59308,2016-04-29,0.65204687853703
中金公司今天在出货！,9932,2016-04-29,0.3114096047130921
600177:雅戈尔:中信证券股份有限公司关于雅戈尔,12872,2016-04-29,0.9179155685762722
600177:雅戈尔审计报告及财务报表(2015年度),31555,2016-04-29,0.5807076414163918
鸭子是现金奶牛！每年分红都不会少！,7002,2016-04-28,0.21648741758832957
年报不出不睡觉,8364,2016-04-28,0.10597497096530306
大家猜猜看今晚的送股分红方案,17766,2016-04-28,0.535924481667209
开盘不追，,4396,2016-04-28,0.3780049185395983
谁敢买入，就等被套三个月吧。,13489,2016-04-20,0.5052420690566967
15元以上还有近9亿股的套牢盘等待解放。,16102,2016-04-17,0.11536981412978342
奉劝那些什么都不知道就喜欢胡说的，稍微学习下,13742,2016-04-26,0.016179332123489543
背驰卖点，一定要卖,10634,2016-04-27,0.1877658108399387
宁波银行为小雅一季报增加0.10元收益，半年报0.,18610,2016-04-25,0.0619163150311699
雅戈尔十大股东持股变动,61090,2016-04-15,0.14468395774693443
4倍PE一A股史上最低的，却少人问津。新股发行也,12031,2016-04-25,0.027776092036065014
该股今年必上30元，耐心持有必有丰厚回报，不信,5696,2016-04-27,0.2539102068156097
先空仓,9494,2016-04-26,0.233625295383747
又满上，冲,6196,2016-04-26,0.4309531172876008
雅戈尔走成这样，我真是输了,160832,2015-08-24,0.7909051231165973
耐心等待13.5元一线的加仓机会。,14509,2016-04-11,0.5779302338685764
期待黄金白银股未来几年超10倍涨幅,14367,2016-02-23,0.9390366352595955
萝卜白菜，各有所爱！,7486,2016-04-17,0.7067264598113195
明日行情看好 向上缺口有望回补,4837,2016-04-19,0.8986811036434643
明日向上突破，买！,6835,2015-12-03,0.9741821869716842
600177:雅戈尔关于使用闲置募集资金购买理财产,34450,2016-04-19,0.7799104461591182
600177:雅戈尔2016年第一季度业绩预增公告,76967,2016-04-18,0.6852136846445389
昨天买的，卖完了,7701,2016-04-19,0.6319546586566039
雅戈尔吧！！你妈妈们喊你回家吃饭,9658,2016-03-09,0.8329060690022632
现金分红既得交税又要除权，损人不利己。,10009,2016-04-17,0.015451444797636826
雅戈尔预计一季度业绩增长60%至80%,23411,2016-04-18,0.7616222460164641
中金估计还有3000万股要派发！,3960,2016-04-19,0.22001018842867204
这股有看头！,26612,2016-04-13,0.2079756308686912
雅戈尔一季度净利润同比预增6至8成,24682,2016-04-18,0.11461147920603332
雅戈尔一季度净利预增60%-80%,26592,2016-04-18,0.4941444517136028
600177:雅戈尔关于上海证券交易所《问询函》的,40677,2016-04-18,0.18221862360543462
一季度业绩预估,18722,2016-04-11,0.38144533704754424
==========涨停飞一般的感觉，波段的完美诠释，,7770,2016-03-18,0.9664628466471249
再说一遍，增发的钱是中石油的！,13172,2016-04-15,0.2322954230973474
看看是谁买走的这50亿元筹码！,19673,2016-04-15,0.726018924758141
600177:雅戈尔关于变更对联创电子科技股份有限,82484,2016-04-07,0.9830534613872264
雅戈尔的锂电池不在上市公司板块内吗。[微笑][,8588,2016-04-15,0.791670275736917
中信保荐、申万50亿现金认购，认购价15.08元/股,16230,2016-04-15,0.4245701963457852
支持雅戈尔，支持老李,6669,2016-04-14,0.6728698555552515
一次出卖老股东利益的增发。,22353,2016-04-14,0.5332432743312833
一季盈利1.27元!,8291,2016-04-14,0.7419019040866053
雅戈尔分配预案10派20元,17523,2016-04-13,0.12221576413734392
600177:雅戈尔:中信证券股份有限公司关于雅戈尔,63108,2016-04-13,0.9179155685762722
