标题,帖子数,日期,情感
去年10亿元房地产减值准备可成为今年利润,18113,2015-12-13,0.4093943196030484
只与人交流……,10602,2015-12-14,0.7609679957629217
从汉麻产业重组看雅戈尔高超财技,30097,2015-11-20,0.9735535137559567
又一利好：雅戈尔投资新能源产业,19409,2015-12-15,0.4915391943476308
哥卖了!拜,6822,2015-12-17,0.7215664367832448
雅戈尔获准8775万元受让浙商保险4500万股,41610,2015-12-18,0.1543331557988279
服装行业整体低迷 雅戈尔投资新能源产业反哺主,37045,2015-12-18,0.6771865110526818
反哺主业  雅戈尔资新能源产业,23038,2015-12-18,0.07032059917872813
王石对宝能系宣战，其实有点晚了！,4914,2015-12-18,0.4727592683416908
再次加仓,15887,2015-12-07,0.21885480997103046
本人持雅250万股，是否可以举牌？,5798,2015-12-18,0.4699832201155236
下月能涨到37元吗？,5392,2015-11-17,0.25411040489712255
600177:雅戈尔关于收到《中国证监会行政许可申,75159,2015-12-17,0.9360616559441207
在股市能赚大钱者都是意志坚定之人。,7482,2015-12-17,0.9909335133082303
终于解套了，在不碰它了,5219,2015-12-17,0.06458788083377875
600177:雅戈尔对外投资补充公告,59474,2015-12-16,0.6172286386960492
不把中国股市的毒瘤公募基金清除，中国股市无望,5465,2015-12-16,0.9995347470253071
恢复公信力，市场才有未来！,5391,2015-12-15,0.9052096098540574
今年初雅戈尔太阳城房价11000，没人买，现在，,15954,2015-12-13,0.34953930203642536
踏空者快要疯了，已风度尽失。,3231,2015-12-15,0.26821728041736836
有毛用，现在雅戈尔已经患上了利好无视症了！,5572,2015-12-15,0.3672529502501506
大盘回光返照，谨慎追高！,6143,2015-12-14,0.9386955215192917
已具备封板的条件。,7627,2015-09-01,0.35023520552962784
我佩服一个人物！,7409,2015-12-07,0.8191675866596683
晚上女朋友突然出现在我的房间，一身性感的内衣,17158,2015-12-14,0.6169460017840968
汉麻产业重组完成，是雅戈尔重大利好,27107,2015-12-09,0.6390981986754943
做长期股东，让雅戈尔为我赚大钱,15450,2015-12-10,0.35920123881756494
一个从大户到散户人的自白,11549,2015-12-08,0.4286726235385875
不以善小而不为，不以恶小而为之！,2174,2015-12-14,0.3869725518915482
中国股市~雅戈尔：当前形势与对策（湖南小股民,7450,2015-12-13,0.9986776399762173
有那么多获利盘吗？？？,20192,2015-11-26,0.034507796921611655
600177:雅戈尔关于联营企业汉麻产业投资股份有,75433,2015-12-10,0.972412183264482
是谁主宰市场下跌，大家务必清醒！,6337,2015-12-11,0.9905457204240353
匹凸匹涨停与雅戈尔大跌强烈对比,8122,2015-12-09,0.7633101432562595
雅戈尔，长短皆宜，不要一根筋！,4565,2015-12-10,0.845511266707222
好几个看到我被套开心的不得了，真心好笑！,10954,2015-12-08,0.7467359259674572
600177:雅戈尔关于买卖可供出售金融资产情况的,22787,2015-11-27,0.8688372893415371
有利润先收掉点！不愿坐电梯！,3002,2015-12-10,0.05904971039034601
放一百个心、不赚哥消失,4846,2015-12-09,0.645327706622269
征求比雅戈尔还屎的股票！,5813,2015-12-09,0.833138302348031
采访卖菜妹,6025,2015-12-09,0.43739826764057343
业绩优秀的雅戈尔股价为何如此低估？,25430,2015-12-03,0.9916736101171083
雅戈尔每次大跌我都大买，事实证明套不住我！,9364,2015-12-08,0.18191854309558908
雅戈尔持有中信股份14.25亿股、浦发银行3.58亿,3537,2015-12-09,0.3398387787320991
今日我进了点雅戈尔。,9682,2015-11-30,0.731342513934024
600177:雅戈尔2015年第三次临时股东大会决议公,63676,2015-12-07,0.5835596836264267
所有议案高票通过，压制因素消失,11315,2015-12-07,0.6323523215266612
抢！,3118,2015-11-27,0.6309523809523809
不就是套几毛钱吗，算什么，还买！,2844,2015-12-08,0.3064382814190749
不务正业种种,20937,2015-10-24,0.47694832922174346
600177:雅戈尔2015年第三次临时股东大会的法律,35911,2015-12-07,0.9313228796764744
今天也许是分水岭，一旦定增通过了，也该正常了,14813,2015-12-07,0.643142694799303
一个人物,5109,2015-12-07,0.6734317084786219
股东大会网络投票流程！,5338,2015-12-07,0.8849874046153473
雅戈尔为了压低增发价拼命砸盘！,4102,2015-12-07,0.6922092745898474
下周一，最后一洗,3882,2015-12-06,0.20591411267114546
利好频频雅戈尔意在维稳提升股价,30549,2015-11-28,0.9742888836921677
600177主力真够煞费苦心的,5399,2015-12-04,0.17033413037244294
一个人物你见识过股指期货的高频交易吗,3645,2015-12-04,0.929464103892718
600177:雅戈尔关于收到《中国证监会行政许可申,22697,2015-12-04,0.9360616559441207
刚刚整理的一些资料，希望能帮到各位！中国股市,35623,2015-08-25,0.9713346975055236
不懂装懂的人真多！,3130,2015-12-04,0.5485992903808508
雅戈尔目标位160元（理由是明年G20在杭州举行，,5946,2015-11-17,0.4360594620159163
明天2万亿打新资金回流二级市场,3881,2015-12-03,0.9566732657373616
七十多万资金一个新股没中！没劲,3721,2015-12-03,0.2633660071541791
2015.12.3实盘,3685,2015-12-03,0.4737672181921908
未来一两天必须回落，请看原因：,17951,2015-11-09,0.42527406079451646
600177:雅戈尔关于参股公司挂牌新三板的公告,23050,2015-12-02,0.2277878724737421
2015.11.13实盘,12376,2015-11-13,0.4737672181921908
雅戈尔参股公司1日在新三板挂牌,9111,2015-12-02,0.07563254028207811
管你们认为还能涨多少，我明天16.5以上会出部分,3412,2015-12-02,0.2387574636925286
利好接踵而来：雅戈尔参股宁波金田铜业,7227,2015-12-02,0.21026769540117218
雅戈尔不论什么方面条件都会上30元，因此，现在,3496,2015-12-02,0.34320172181949526
雅戈尔增持中信股份至4.9%,8546,2015-12-01,0.9324162758179322
大股东5亿元增持为何引而不发？,5722,2015-12-01,0.09261704355189859
雅戈尔2015年三季度持有多少股票？,5743,2015-11-30,0.49642201001592445
雅戈尔再次增持中信股份1.36亿股,10838,2015-11-30,0.8321462058271081
买错也要买,28632,2015-11-23,0.5297553442327992
投资获利14.72亿 雅戈尔被建议改名 ,12981,2015-11-30,0.6089574237495334
雅戈尔买入中信股份1.36亿股 耗资17亿元,8960,2015-11-30,0.9257732614779932
“股神”雅戈尔“归核”之路有多长？,12672,2015-11-30,0.9558905147561461
再次声明，本人不受任何徒弟，我的操作没有参考,1530,2015-11-30,0.10903749253375172
为什么建议大家买入？,15712,2015-11-30,0.6106693445754431
注重回报率的公司，值得长期投资！,13326,2015-11-30,0.9540264805356503
雅戈尔售金融资产 今年已获利14.72亿元,13438,2015-11-27,0.9271282997740449
你们这帮有意见持有雅戈尔的脑残，有本事来个涨,2818,2015-11-24,0.20003456979578316
下周连续调整雅戈尔在13.08元以下震荡要一个月,2577,2015-11-28,0.2794154866016122
关注影响周一走势的新消息面变化！,3525,2015-11-29,0.6268594076126516
600177:雅戈尔对外投资进展公告,40295,2015-11-26,0.7813821497688196
必须跌下来真的，他们都是7-8元的筹码，想叫哪,6979,2015-11-22,0.44126257893977405
持有雅戈尔必须长期持股才能有赢利,2535,2015-11-18,0.00859745745342222
雅戈尔明天开盘一字跌停，,2669,2015-11-24,0.17055317394423564
雅戈尔李如成从不考虑股民死活，李如成雅戈尔是,2250,2015-11-27,0.13288527305504272
周五这根阴线,3210,2015-11-29,0.6876724734066737
借鸡生蛋、空手套白狼的雅戈尔,35183,2015-10-20,0.329703704229961
怎么看雅戈尔的增发？,6407,2015-11-28,0.5724802113877708
有股友计算雅戈尔持股330亿元，合每股14元,18628,2015-11-10,0.002253874373461473
雅戈尔7月至11月获投资净利润5.75亿元,16508,2015-11-27,0.6399680616315374
最近股吧唱多主要以雅戈尔参股多家公司为题！,4875,2015-11-25,0.8510130897148788
机构和大户减持，中户和散户接棒！,4114,2015-11-26,0.3515690912252353
假如跌破15元，那我真的要满仓了！,2610,2015-11-27,0.010649699605497998
雅戈尔晋升浙商财险第二大股东 财务投资转向产,12638,2015-11-26,0.3921458510657544
汉麻又创新高，雅戈尔浮盈超20亿元，明年业绩翻,34096,2015-11-25,0.9986264131423948
雅戈尔明天连续跌停，年底披星带帽，明年退市！,6960,2015-11-15,0.04447174404915044
雅哥哥的持股资产：,10019,2015-11-25,0.9943244110028123
中国银联（雅戈尔参股）与苹果支付达成合作,5589,2015-11-25,0.3640788767082396
站岗在16.40，有一起的没？？？,3885,2015-11-25,0.1082724222793886
调整缩量，这个价位卖的人是傻子！,3981,2015-11-24,0.414130036120527
健康牛市中哪些板块最牛？,45847,2015-11-08,0.9741424359886893
调低定增价仍为大利好,39080,2015-11-20,0.5012102314708526
中国银联与苹果支付达成协议 雅戈尔参股,3877,2015-11-25,0.15337090862116654
雅戈尔明天跌破15元是大概率，李如成雅戈尔定向,5041,2015-11-24,0.001068419525012465
调低增发价是绝对的利空!跑跑跑11元在回来 利用,7542,2015-11-21,0.12909955789284933
雅戈尔业绩优良，极具安全性，把握低吸机会！,4141,2015-11-16,0.9819705526802965
如果今天大盘向上，雅戈尔会涨停板,27375,2015-11-23,0.9677878455003385
从股吧点击量看，雅戈尔散户减少一半以上，是祸,4643,2015-11-21,0.08627072951782533
下周小雅走势的一点猜想,7670,2015-11-21,0.9885921086254194
卖卖卖卖给机会了，买建设银行去了，走人了,2330,2015-11-23,0.504194774358388
致买菜妹：我想从好的方面去理解你的说法，我们,3094,2015-11-22,0.8013979966898245
600177:雅戈尔2015年非公开发行A股股票募集资金,10625,2015-11-20,0.7785831917383682
600177:雅戈尔2015年非公开发行A股股票预案(修,17084,2015-11-20,0.12555696129956473
按定增的新规定，雅戈尔增发价是按定增当日的股,10075,2015-10-29,0.3591189569823292
买这股的看看，我不坑人,4689,2015-11-20,0.25048491901955783
大家快快卖出雅戈尔，买建设银行去了，月底人民,3585,2015-11-19,0.5094942376707108
雅戈尔凭借汉麻产业重组获利20亿元,6344,2015-11-19,0.4739170514673998
11月16日的大盘及个股提示：,267885,2015-11-15,0.01103778735305383
将10送10股配6后继续保持高送转潜力,30485,2015-11-11,0.10072625119192036
引离杯，歌离怨，诉离情。是谁谱、掠水鸿惊。秋,10787,2015-11-06,0.9976532965551853
买了15万股，陪主力玩,6119,2015-11-13,0.44338379154386365
创业软件成为两市第一高价股，将推升雅戈尔股价,9819,2015-11-15,0.10239857024764698
光说不练假把式，要有成交记录！,3534,2015-11-16,0.18136938322226992
国家队不会申购新股，不会与民争利,9824,2015-11-12,0.22684785342892333
补发一下昨晚的思路，跟今日走势有所差距，但不,215071,2015-11-10,0.7969625193647195
满,4205,2015-11-13,0.4470588235294115
一轮属于普通老百姓的长期大牛市已开启！,5267,2015-11-09,0.9742350114043448
2015.11.09,5886,2015-11-09,0.5
强烈要求网管把总发垃圾贴误导股民又无聊至极拿,1864,2015-11-13,0.012459167797874482
雅戈尔加注中信股份 累计近150亿港元逼近举牌线,10329,2015-10-19,0.9044577011181105
600177提示：,125693,2015-11-05,0.40711553837320447
最近可以买点博增发通过的消息！,2697,2015-11-12,0.3246721741521579
大家有没有发现一个现象？,2368,2015-11-12,0.3294329599538538
只需保持信心，11天内一定会涨13%以上，雅戈尔,8408,2015-10-30,0.4376575984508527
600177:雅戈尔关于公司副董事长辞职的公告,16180,2015-11-11,0.25954454090780965
雅戈尔副董事长李如刚退休 今日递交书面辞呈,10017,2015-11-10,0.8680910313568014
发177一档数据,5265,2015-11-09,0.4572396207863113
各位股友 鸿运当头 发财,8542,2015-11-06,0.3584832661083446
明日大盘重挫150点，雅戈尔破15没有任何悬念，,4501,2015-11-09,0.18957928477036745
雅戈尔国内股票今天目前已经浮盈近11亿！,9842,2015-11-09,0.9733674560870936
午后趋势,5931,2015-11-09,0.7570705854499163
卖菜妹发出命令请自觉排好队买进雅戈尔10倍黑马,7429,2015-11-02,0.012100745669612722
重启新股发行是二级市场重大利好,8818,2015-11-06,0.22482270696004214
牛市归来，雅戈尔股价年前会回到上半年最高点,6268,2015-11-06,0.9691784395192345
稳健而又远见的投资大师----李如成！徐翔事发，,10483,2015-11-03,0.9912039440907001
IPO重启，各位怎么看？,4504,2015-11-06,0.10646479478370618
在箱顶14.3已经全卖光,5942,2015-11-04,0.14787686643774545
600177:雅戈尔关于买入中信股份情况的公告,71760,2015-10-19,0.95608777525479
引用四川成都股友的话 “”徐翔的逐利，以损伤,9969,2015-11-02,0.2517413542206891
看看177今天什么都没干,6243,2015-11-04,0.14197401610649452
徐翔被捉，是低估值蓝筹股的福音，雅戈尔的福音,7377,2015-11-02,0.9982973754424511
中信银行、宁波银行大涨，雅戈尔岂能不涨？,7312,2015-10-21,0.2585752634282258
牛市重归，我依然坚守,11164,2015-10-15,0.9642703922596537
国家队大举买入，业绩超预期，该大涨了,41789,2015-10-29,0.9439912353674204
服装运营效率继续改善 投资及土地收储等拉动净,23891,2015-10-30,0.9408684966660036
14元出掉的50万股，在13.83买回来，有多少差价,4091,2015-11-03,0.014264380207971605
雅戈尔持股的浦发银行重大利好，逆势上涨，大单,32705,2015-09-29,0.0025268840361840628
中华大姐说强烈买进雅戈尔目标短期39元长期160,7183,2015-10-25,0.15006448890893198
我相信老李关于177的裂变之说,4914,2015-10-30,0.31850449388377144
雅戈尔三季报净利增66% 证金汇金持股3.73%,62211,2015-10-29,0.4144284710927941
还在卖出的人恐怕真是头被驴踢了。,3848,2015-10-28,0.32967517803152113
600177:雅戈尔2015年第三季度季报,17921,2015-10-29,0.6975232127312034
大约算了一下，雅戈尔持有的股票市值已超过300,8573,2015-10-29,0.1993617551083453
雅戈尔前3季盈32.52亿元 同比增66%,17376,2015-10-29,0.9014706752781386
老子也怒了，MLGB证金买入几亿股不公告不说，还,72035,2015-08-19,0.662602309929557
感觉大盘暴跌的脚步越来越近了！,3572,2015-10-28,0.9851470384482784
我介绍的股票一定不会失败，开盘买入一定赚,6376,2015-10-21,0.6416810323963068
一个人物是好人，大家要尊重他，他这样的人多了,6207,2015-10-03,0.9573813703855762
10倍黑马提醒，雅戈尔600177中期目标39元，长期,7049,2015-10-25,0.5132528074647335
600177:雅戈尔2015年第三季度业绩预增公告,72688,2015-10-23,0.500721383629222
今天不适合做T，雅戈尔走势骗弱！,3435,2015-10-27,0.07334022328097467
不知所吟………… 熙攘股市，风格渐将变。 雅戈,6245,2015-10-24,0.9932511286936211
600177:雅戈尔关于全资子公司获得土地使用权的,60657,2015-10-26,0.8054594634321707
雅戈尔“弃船”服装主业疑窦,31332,2015-10-26,0.030230374917280645
TTB再谈雅戈尔,6439,2015-10-21,0.7085923308003611
看今天的战绩！,3140,2015-10-26,0.5618565332226944
暴跌,6509,2015-10-23,0.7499999999999999
你为何辱骂雅戈尔？,5812,2015-10-23,0.4737672181921908
永遇乐-小雅哥 千股绩优，两市难觅，雅戈尔处。,5619,2015-10-23,0.9768624168435726
为什么雅戈尔总是下跌的时候就是有人大量的卖出,20984,2015-10-14,0.6447757414496551
谈177的市盈率，,8247,2015-10-14,0.2097084643809901
湖南小股民：在旅途中,8889,2015-09-05,0.9719741213564153
你们咬我骂我又怎样，看我的雅戈尔帐户！,5831,2015-10-22,0.23776087925813516
粗略估算一下，小雅持有的中信，宁波，南京，浦,5111,2015-10-20,0.904003093752367
2015.10.21实盘,3666,2015-10-21,0.4737672181921908
伦敦发来的命令消息：600177雅戈尔必须上涨到39,5023,2015-10-20,0.03835045363608025
有分析师说本月雅戈尔目标位26.5元，买进上涨！,8594,2015-10-15,0.3859710778617025
雅戈尔才是中国的伯克希尔。,3691,2015-10-20,0.7758239012590509
不断加码 雅戈尔累计148亿港元投资中信股份,47712,2015-10-20,0.9858260026568457
2015.10.13实盘,7274,2015-10-13,0.4737672181921908
雅戈尔147亿投资中信股份,4808,2015-10-20,0.9765801959571628
本机构，把雅戈尔搞到160元方法全仓买进，然后,8848,2015-10-15,0.016069247460046898
雅戈尔投资中信股份 持股比例达4.43%,9007,2015-10-19,0.9126662169155654
雅戈尔于7月9日承诺：未来半年内用5亿元增持自,4578,2015-10-17,0.20393095778029913
五鬼运财 涨停板！,7645,2015-10-16,0.8913455845327158
短线卖点!今收阴,1894,2015-10-16,0.2541088277620299
重要通知：下周要攻击增发价17.58元请大家做好,16338,2015-10-09,0.6875136555993338
浦发10.8大跌是庄家洗盘操纵,40627,2015-10-10,0.41066256937287327
雅戈尔(600177)融资融券信息(10-13),3970,2015-10-14,0.8054594634321686
雅戈尔忙转型 凸显传统行业“秋寒”,66360,2015-10-12,0.9996244732672096
下属公司员工维权 雅戈尔遇“转型后遗症”,14296,2015-10-12,0.28636604061428317
5亿元的增持，50亿元的增发，目前仍然是雾里看,15493,2015-10-09,0.4184158114980103
小雅五大利好,9787,2015-10-04,0.47629798174899574
别以为下半年不能卖股就没有投资收益，不会太差,18727,2015-09-26,0.24517123620458237
高科技、网络股的想象力无法pk雅戈尔,9130,2015-10-04,0.4728506993230941
股灾后的上涨行情看蓝筹股,17097,2015-10-02,0.7510556770749354
雅戈尔持有的汉麻产业当前市值12亿，明年可出售,10517,2015-10-01,0.746135012369172
下午冲高卖!节后要跌,5474,2015-09-30,0.43234365939882713
雅戈尔有没有10送10转10的可能？,4483,2015-10-08,0.043584066135424426
再给大家讲个真实的投资故事吧。,5707,2015-10-05,0.9647176259547935
汉麻重组获批为明年高位套现铺路。,5336,2015-09-30,0.9941234921419938
5亿元增持何时动手？,11951,2015-08-29,0.5024101847827097
要留余粮打鬼子!,2389,2015-09-29,0.4128074924250065
谨记：卖出容易买回难。,2786,2015-09-29,0.7692269380238411
准备举报造谣者！,2783,2015-09-29,0.7476999865000017
【投资者传闻求证】：公司将择机退出西气东输项,6685,2015-09-29,0.8380547353558987
拼命造雅戈尔的谣，这些人早晚要进牢房。,5701,2015-09-26,0.36841428806862087
今天雅戈尔应当上涨,8492,2015-08-26,0.1837233963534416
我依然坚守雅戈尔,10454,2015-09-17,0.9090266105846649
暂不议论雅戈尔,29759,2015-08-21,0.09654588091363903
国家队重点拉升大银行，交行放巨量再大涨,15092,2015-09-01,0.13139421140230267
增持公告：本股东25元以下增持500万股，并计划,6632,2015-09-28,0.029949027081258572
人若贱，他的股票必也贱。,2461,2015-09-28,0.8592019376393385
女人炒股自有一套 赚钱概率高于男性,买进600177,7093,2015-09-28,0.24132421219435185
10倍黑马提醒，雅戈尔600177具备上涨10倍的动能,11037,2015-09-21,0.036995062125091405
千股跌停迎中秋，对下联赞,3510,2015-09-25,0.9831376391250585
参与国有企业混合所有制改革排头兵：雅戈尔,16025,2015-09-24,0.9448702078748256
已补满,4045,2015-09-25,0.42980136384530243
个人财报分析之雅戈尔2015年半年报分析,103272,2015-08-31,0.9819628795769373
雅戈尔600177将走出独立上扬行情目标39元,5409,2015-09-24,0.9601567927709892
国家队理应纠正救市中的错误决策,21565,2015-09-21,0.7818906975063561
雅戈尔(600177)融资融券信息(09-23),4834,2015-09-24,0.8054594634321686
我啥得!抛了,1965,2015-09-24,0.5455370938053219
雅戈尔600177中报业绩1.3元上涨就是洗盘 上涨到,70563,2015-09-22,0.12409968036834085
明年6月份，炒股过日子的雅戈尔有望回到4块？,1648,2015-09-24,0.4829803464822592
美国西雅图发来的消息雅戈尔股票必须上涨短期39,3476,2015-09-23,0.37648079684202485
特大利好中华大姐来了，雅戈尔上涨到160元,8486,2015-09-18,0.024082551353431403
买进雅戈尔的资金准备完毕,6355,2015-09-21,0.8848105806261538
卖了,3129,2015-09-21,0.39004149377593345
萨拉热窝的公民们现在最后通报，雅戈尔600177市,4506,2015-09-21,0.17698831656178893
人因跌而惶惶，我因跌而津津。写下这段文字，与,13399,2015-09-18,0.8043858345632433
10倍黑马提醒，雅戈尔600177中期目标39元，长期,10170,2015-09-17,0.5132528074647335
中信股份会用雅戈尔买股的120亿的钱来购买雅戈,5640,2015-09-19,0.8427635600836224
请问老师，雅戈尔21.6的成本，何时能解套？谢谢,11240,2015-09-05,0.6104316102776667
经反复折腾，3200由支撑位变成一层铁帽子，空仓,4310,2015-09-18,0.47564114706394767
雅戈尔(600177)融资融券信息(09-16),4853,2015-09-17,0.8054594634321686
三季报披露时间临近 这些雷区股请小心,18935,2015-09-14,0.32974782034804306
一直满仓的我五千一百多点下来，现在亏损10%，,3426,2015-09-17,0.05815692884714807
注意!被骗筹,3738,2015-09-16,0.1304725509671556
猫哥!你还在压个毛,2425,2015-09-16,0.7722251262747168
雅戈尔是否被低估呢？,4588,2015-09-15,0.7297953905324696
虎落平阳。,3088,2015-09-15,0.6406996764803269
不买可惜,4615,2015-09-15,0.404224876789852
完美,2974,2015-09-15,0.8233995584988961
转入资金已又买,6841,2015-09-14,0.9563957291700016
昨日尾T了的要注意逢低抢货,2016,2015-09-15,0.9619209732179842
立军令状，无论什么时候，无论什么情况，我都抱,4414,2015-08-25,0.5102641341872158
雅戈尔(600177)融资融券信息(09-14),5528,2015-09-15,0.8054594634321686
有人砸为买货!有人砸为割肉!,2526,2015-09-14,0.022159966894550465
下星期暴跌，不跌我吃大便,5988,2015-09-12,0.6594505454985322
雅戈尔会上去，不要怀疑,8487,2015-09-11,0.24840766938596437
一直听人买雅格尔的嚷嚷价值投资，价值投资。很,13080,2015-08-20,0.9988612057696674
刚听到的消息，臭雅背后的博弈,14866,2015-08-28,0.757873458512241
雅戈尔锁仓公告,9583,2015-09-10,0.1359888171015191
放任下跌寻找市场底,7540,2015-08-25,0.9851250328936012
先砸再买,2068,2015-09-11,0.10192504679541114
3.61亿股宁波银行，3.05亿股浦发银行,11.367亿,4448,2015-09-11,0.0021417582330968132
飞机要飞了,3844,2015-09-10,0.4695789497682107
剩下—半全卖了,3943,2015-09-09,0.5284477484654178
应当限制和废除鼓励投机的股指期货等制度,10823,2015-09-04,0.9508100720217754
一九分化的历史将重演,18509,2015-09-01,0.9528134685491094
今天银行股力挺大盘，交行领头！雅戈尔也快了。,40318,2015-08-31,0.7074972184494835
银行股大涨，雅戈尔必涨，二八转换开始,12802,2015-08-27,0.5111198501431464
雅戈尔(600177)融资融券信息(09-07),6360,2015-09-08,0.8054594634321686
持股一年以上免除红利税，这个确实对于雅戈尔这,5932,2015-09-07,0.5471138922180769
套牢大合唱,3693,2015-09-07,0.7349721305564924
雅戈尔(600177)融资融券信息(09-02),6254,2015-09-03,0.8054594634321686
振荡下行中蓝筹股亮眼,70550,2015-08-26,0.7813215420673388
600177:雅戈尔关于买入中信股份情况的公告,114175,2015-09-01,0.95608777525479
24的本还有救吗,4976,2015-09-04,0.6402752007592808
大家怎么看中信大跌,8154,2015-09-02,0.7086410610972269
特大利空来袭--股指期货10手即为异常交易！,15830,2015-09-03,0.27317063072540126
600177:雅戈尔关于控股股东股权结构调整的公告,96096,2015-09-02,0.3439700847245213
雅戈尔(600177)高管持股数据一览(9-1),17119,2015-09-01,0.2844831525368945
我敢说 雅戈尔的优势在国内上市公司中是最好的 ,8145,2015-09-03,0.7803464187538838
应该是大股东出手了,90090,2015-09-01,0.581988950791746
被洗出别后悔哈,5199,2015-09-02,0.17768022104632242
决不要割肉!有利润除外,2779,2015-09-02,0.36860029854442644
为一个人物说句话,4240,2015-08-31,0.5438779878479999
一九分化是后市主旋律,5213,2015-09-01,0.6864403227850107
稳步推进服装业务，投资大健康和能源产业,20934,2015-09-01,0.4461753553029292
品牌服装运营效率明显改善 资产端重估价值极大,53466,2015-09-01,0.2874474852007246
反弹目标在16元一线。,7790,2015-08-28,0.4489270785110241
一个人物是扫帚星,5205,2015-08-29,0.7348872569868743
湖南小股民：今天买进了一点雅戈尔。,4976,2015-08-26,0.7831167577791716
现在是T出去的好机会,3260,2015-08-31,0.9561387609765739
打电话去公司，强烈要求公布证金，汇金持股明细,12758,2015-08-19,0.0765789806441044
当下是不能追的,2186,2015-08-31,0.6326097055028959
追进必遭,4075,2015-08-28,0.6448370004603772
600177:雅戈尔2015年半年报,38726,2015-08-30,0.27583839992140957
600177:雅戈尔2015年半年报摘要,107188,2015-08-30,0.5070958580046617
马上到顶了,5018,2015-08-28,0.564325747220889
今天尾盘不涨停就坚决换股,5987,2015-08-28,0.019003338789735036
《应该重新审视这个市场了》,34021,2015-08-20,0.9740090800753247
雅戈尔：基金分歧已经很严重！股友小心被上套！,71979,2015-08-26,0.5306468250511952
股东好,4731,2015-08-28,0.6317853705682674
养老金是股市定海神针,6296,2015-08-23,0.8109505168820554
雅戈尔是蓝田第二吗？,9587,2015-08-23,0.3671472726313395
遭了!抛底仓了,4554,2015-08-27,0.4149385314638975
说句真心话，我最希望这次增发成功，中信集团做,8062,2015-08-27,0.9220799078530736
高开冲高尾盘杀跌，,5532,2015-08-27,0.09026313546440345
