标题,阅读,评论,字数,影响力,时间
昨天那么多人吓傻了乱跑，今天果然还是涨了吧?,3554,58,144,4.5,2015-09-18 15:49:18
IPO重启市场该如何消化,3478,4,401,3.5,2015-11-06 19:28:35
中国中车，今日操作建议！！！,56821,53,210,3.0,2015-11-05 15:10:57
八百点行情新细节，中线看上图，长线看下图,28293,42,144,4.5,2015-11-05 13:27:19
_______假摔？有反对的吗（2015，8，20）_____,2235,44,202,3.5,2015-08-20 15:34:30
咋地，美吗？,1720,18,6,3.0,2015-09-25 10:02:18
沪指冲高回落收盘站上3500点 资金抢筹77股,17363,12,2862,0.0,2015-11-05 17:25:23
中国中车今日超大单流入排名第1名(11-05),26054,56,345,0.0,2015-11-05 16:09:27
中车墨迹神马今天你必定涨停,31189,99,13,4.0,2015-11-05 11:21:30
方向出现选择明后天个股有望继续突破大涨！,102929,147,180,4.0,2015-11-04 10:23:41
29的朋友还在不在,4574,39,124,2.0,2015-11-05 13:16:29
________短线请绕行（2015，8，21）___________,2678,27,904,3.5,2015-08-21 19:30:23
______斗胆胡说（2015，9，25）___________,3019,18,222,3.5,2015-09-25 11:22:49
【讨论】强势拉升，KDJ指标金叉，新高可期？,23712,24,1535,4.0,2015-11-05 10:39:09
中国中车(601766)融资融券信息(11-04),10806,10,550,0.0,2015-11-05 08:11:02
中国中车，一带一路权重股，明日有望继续上涨！,7838,27,145,3.5,2015-11-05 12:23:41
我走了，带着一丝遗憾，毕竟为国护盘的中车之行,2687,19,166,4.0,2015-09-12 13:35:22
冲天长阳走向何方,2246,2,416,3.5,2015-11-04 21:37:32
7年股龄，今日继续空仓,8121,46,193,2.0,2015-09-08 19:12:12
中车调整到位，反弹一触即发,7414,15,127,4.0,2015-11-01 21:29:06
中国中车本周走势及后期操作策略。,9861,36,232,3.0,2015-11-04 12:28:39
惊天内幕：中国中车明天可能封涨停,9893,27,478,2.5,2015-11-04 17:00:08
中国中车建议持股为主,10461,25,196,3.5,2015-10-30 17:54:33
中车老头操盘手法,6247,9,598,4.0,2015-10-30 21:37:22
中国中车 超极限调整结束 光明就在眼前 明天...,55224,42,25,3.5,2015-11-03 15:13:59
【讨论】10连跌后能否否极泰来？,10821,12,1558,4.0,2015-11-04 10:42:53
中国中车(601766)融资融券信息(11-03),7242,5,540,0.0,2015-11-04 08:10:08
你们太可笑了，什么都不懂还来跟本神说炒股!,3289,39,243,4.0,2015-09-16 19:55:19
中国中车 个人操作及建议,5533,17,207,3.5,2015-11-04 12:20:00
中国出口东盟首个轻轨项目在马来西亚正式运营,14072,31,749,0.0,2015-11-03 16:30:01
中国中车今日超大单流出排名第11名(11-03),8720,15,338,0.0,2015-11-03 16:22:01
________击近示远（2015，10，23）__________,5817,17,250,3.5,2015-10-23 11:04:30
周二走势预估！,125162,182,883,4.0,2015-11-02 19:15:31
期待中车下周一翻红,8303,39,174,3.5,2015-10-31 15:14:05
601766:中国中车H股公告(股份发行人的证券变动,26822,24,638,0.0,2015-11-02 16:59:08
你说中国中车会有十连阴吗？,8166,29,136,3.5,2015-10-30 22:01:27
【讨论】连跌9天，你等反弹是否等到花儿也谢了,26892,46,1513,4.0,2015-11-03 09:48:48
中车董事长被中纪委带走！,6791,19,134,2.5,2015-11-03 15:05:04
估计又有大师，瞎忽悠了,18084,75,123,2.5,2015-10-16 15:44:07
五浪下跌!目标破三千点!现在每次反抽都是清仓的,9982,18,209,4.0,2015-11-03 14:20:27
尾盘虽然跳水，但主力机构资金依然加速流入,2856,8,470,1.0,2015-09-17 16:47:23
中车能否成为大盘的风向标,7022,84,322,4.0,2015-09-11 05:12:32
____捂紧本就不多的筹码（2015，8，24）_________,4062,56,664,3.5,2015-08-24 15:43:12
打低敢买，拉高舍得卖，唯此可赚些盐钱。,2893,23,160,2.5,2015-11-03 13:10:00
三季报，你怎么看,12345,46,230,2.0,2015-10-31 07:37:19
中车事件,6887,28,272,3.5,2015-10-30 09:06:23
中国中车：我持有我坚信，走势分析。,5324,8,263,3.5,2015-11-03 09:27:45
持有中车的兄弟姐妹，我持有，我坚信。,5127,8,264,2.5,2015-11-03 09:33:12
坚持看多，铁公鸡明天可能成为首先启动的指标股,16834,39,22,4.5,2015-10-19 17:10:01
【讨论】中车前三季度净利润80亿，符合你的预期,14501,20,1524,4.0,2015-11-02 09:50:08
反弹结束了吗,2885,5,561,3.5,2015-10-29 08:52:54
永远和大家同在！,66933,109,347,4.0,2015-11-01 12:00:46
昨天提示底背离形成后的报复性大反弹将出现！,3015,140,181,4.0,2015-08-27 11:29:32
个股开始分化寻找补涨股！,33956,51,287,4.0,2015-10-27 08:18:06
中车前三季度净利80亿 与铁总博弈告一段落,30524,19,1502,0.0,2015-11-02 03:56:20
少说多做！,44440,83,204,4.0,2015-11-02 11:02:44
中肯看待周一走势！,19004,29,457,4.0,2015-11-02 07:57:52
中国中车三季报净利79.6亿 证金系持23.7亿股,14588,14,399,0.0,2015-10-31 01:24:31
迷请新闻-今天下午将暴动，因为大大将去越南和,2622,9,174,3.5,2015-11-02 13:42:50
迷请解盘--太遗憾草色青青已经疯了，大家现在可,2498,19,176,3.5,2015-09-30 11:37:55
中车已毫无价值可言，拉高缩量套人，必将大阴反,10898,29,153,4.0,2015-10-20 04:46:41
为什么涨?因为要成就我这个图，全靠铁公鸡发动了,16567,49,146,4.5,2015-10-20 15:10:29
再一次重申，按我的神图还有八百点行情！,55150,23,152,4.5,2015-10-21 08:54:48
各位股友注意了，飞天云彩在圈钱 各位股友注意,5968,12,333,2.0,2015-10-31 15:32:00
几个托给大家爆爆光，尤其这个西边的云彩，飞天,7210,13,265,2.0,2015-10-31 16:48:54
丝绸吧一发就被删，看来串通好了，看看吧，目的,6562,20,191,2.0,2015-10-31 16:36:10
中国中车前3季净利79.61亿 同比微增,18119,14,351,0.0,2015-10-30 23:14:22
整理有望结束下周有望迎来连续突破！,46471,51,250,4.0,2015-10-30 11:39:34
601766:中国中车2015年第三季度季报,70973,30,1117,0.0,2015-10-30 20:27:00
【讨论帖】二孩来了！能否助中国中车驶向世界？,8590,17,5747,4.0,2015-10-30 13:24:14
601766:中国中车关于公司及下属子公司购买理财,27484,12,1425,0.0,2015-10-30 19:49:41
缩量调整后周四有望再出阳包阴的概率！,126079,92,821,4.0,2015-10-28 20:48:31
________朋友，勉强拿住吧（2015，10，30）____,4331,11,231,3.5,2015-10-30 11:41:03
中国中车(601766)融资融券信息(10-29),8150,16,534,0.0,2015-10-30 08:04:45
看清趋势与方向，波段做多,5237,34,1279,4.0,2015-10-30 08:58:53
______聊聊（2015，8，21）_________,1846,16,474,3.5,2015-08-21 12:30:57
中国中车今日超大单流出排名第10名(10-29),9801,13,338,0.0,2015-10-29 16:08:38
【讨论】已经7连阴的中国中车底部快到了？   ,48237,53,3053,4.0,2015-10-29 16:02:59
周一关注000818。能涨成妖股吗？,7145,16,146,4.0,2015-10-24 16:59:42
今日收盘得到“三思三思三思”的行情，特此开一,5863,18,149,3.5,2015-10-27 16:24:42
空仓的我小心翼翼的控制仓位做次多,32847,41,1100,4.0,2015-10-29 08:59:51
来到中国中车分析一下趋势，行情,1959,12,182,3.5,2015-10-29 17:39:50
十股选择理由综述(内附走势图）,25315,35,1338,3.0,2015-10-24 09:40:10
成本15元，怎么办！,4301,19,290,2.5,2015-10-29 10:01:31
不要追高，谨慎抄底。,7933,41,1113,4.0,2015-10-28 00:37:58
601766:中国中车关于召开2015年第一次临时股东,28590,52,1627,0.0,2015-10-22 18:07:41
【讨论】你依旧坚守在中国中车的理由是什么？  ,30473,37,2957,4.0,2015-10-28 17:15:42
中国中车(601766)融资融券信息(10-28),8423,8,546,0.0,2015-10-29 08:11:33
中国中车能中长线布局吗？,15747,19,241,3.0,2015-10-29 08:59:58
少说多做！,36480,78,325,4.0,2015-10-28 11:56:41
中车应给广大股民一个交待,4793,27,234,3.0,2015-10-27 11:10:51
仍然属于量能弱反弹下周走势取向！,89618,66,404,4.0,2015-10-23 15:09:17
中肯的点评周三走势！,99789,100,664,4.0,2015-10-28 06:02:04
中国中车(601766)融资融券信息(10-27),8072,5,546,0.0,2015-10-28 08:13:22
全体车迷集体锁仓公告：主力，你爱咋咋地,13143,21,139,4.0,2015-10-15 17:58:22
上车就不后悔，我坚信。今日盘面分析（讨论）,1616,7,385,2.5,2015-10-28 10:58:25
中国中车今日超大单流出排名第12名(10-27),15249,11,342,0.0,2015-10-27 16:15:22
中国中车 没有压力 蓄势待发 一飞冲天 哈哈我信,57193,37,24,3.5,2015-10-26 10:04:35
今日盘面复杂 慎重操作为主,29309,35,628,3.0,2015-10-27 09:07:52
____要大胆持股，无惧干扰（2015，8，17）_______,38361,60,466,3.5,2015-08-17 19:03:24
【讨论】均线纠结，横盘走势还将延续？,18121,14,1536,4.0,2015-10-26 14:57:35
中车，相信定然还会重拾升势（论股）,7243,27,235,3.5,2015-10-26 17:17:31
中国中车(601766)融资融券信息(10-26),9117,8,540,0.0,2015-10-27 08:15:26
今晚新闻联播帮中车做了大大的广告!,16328,53,213,2.5,2015-10-26 20:44:27
双降And双降，空仓的继续空仓。,40672,48,1295,4.0,2015-10-26 08:53:42
大盘完美收阳，如我所料，下周依然看好,32602,36,237,3.5,2015-10-23 17:43:58
害人不浅飞天云彩！！！,9365,43,236,3.5,2015-10-25 17:29:11
中国中车 上新闻联播了 特大利好 明天涨停 ！！,25401,20,176,3.0,2015-10-26 19:18:12
双降出台后下周的走势取向！,162274,174,1428,4.0,2015-10-25 17:13:43
中英鼓励双方企业深耕高铁项目 中国中车或受益,54185,34,2417,0.0,2015-10-26 02:28:48
_______能不说就不说（2015，8，21）________,1106,36,171,3.5,2015-08-21 09:43:49
龙骧将军：周五能否收出红周五（论股）,5758,24,659,3.5,2015-10-23 11:59:47
本人首创提出铁公鸡概念，你们不得不服,2980,29,180,4.5,2015-09-20 23:53:30
新思路：若中车周二还不上15.51反而会出现快牛,29057,184,194,4.5,2015-09-19 10:10:57
上午开会没看盘，午市收盘一看，铁公鸡果然发动了,8888,48,151,4.5,2015-10-12 12:13:42
铁公鸡行情今天应该开始了,13540,115,175,4.5,2015-09-25 07:21:19
中国中车接招国际内燃机车采购潮,8384,14,234,0.0,2015-10-19 14:46:11
中车拿下高铁自主化最后难关 大功率核心芯片商,68203,65,1796,0.0,2015-10-23 03:46:11
昨天提示风险来临，在上午已空仓，准备资金抄底,60611,66,583,4.0,2015-10-23 09:06:28
大盘震荡上攻压力3400点 持股待涨控制仓位（个,31469,54,356,2.5,2015-10-23 14:56:59
中车下周开盘走势预计,64891,55,126,3.5,2015-10-23 15:30:24
今天我也出手了！,12997,60,136,4.0,2015-10-23 14:25:36
中国中车,8123,19,149,4.0,2015-10-17 00:59:43
中车今天不到15，我请大家到阳澄湖吃蟹！,66255,91,150,3.5,2015-10-19 10:31:42
求下联：你上车，他下车，齐心协力炒中车,4402,28,89,3.5,2015-10-25 09:53:26
承接盘越来越弱不排除还有深调的概率！,88491,140,522,4.0,2015-10-22 12:23:01
中车在，梦就在!(解析中车),6069,14,201,2.5,2015-10-23 19:29:30
下周起，中车走势,4992,11,325,2.0,2015-10-24 00:13:37
迷请解盘--收在14.44意思是要喜喜喜，也就是说,7100,21,178,3.5,2015-10-23 15:02:26
今天铁公鸡行情第二波估计由中车领涨!,6023,19,148,4.5,2015-10-21 10:46:56
下周中字版全涨，不涨我吃屎！,4859,18,138,2.0,2015-10-23 22:05:05
这二天七上八下的走势！,7458,34,158,4.0,2015-10-22 22:04:21
中车尾盘2亿买单分析,94819,49,239,3.5,2015-10-16 19:46:01
两天没开，今天在开一帖，有问题的带票来,8188,69,148,3.0,2015-10-22 20:55:23
中国中车造出最强高铁“中国芯”,41483,61,1034,0.0,2015-10-22 22:20:51
而今的中车想必我们有目共睹(附操作策略),5662,36,261,3.0,2015-10-23 14:26:39
心如湖水！,109807,104,262,4.0,2015-10-22 22:44:27
中国中车(601766)融资融券信息(10-22),8715,9,548,0.0,2015-10-23 08:13:32
【讨论】徐翔重新杀入A股，他会买中车吗？,211998,55,1447,4.0,2015-10-22 14:02:57
股吧造假之飞天云彩！！！,6473,38,162,3.5,2015-10-22 09:52:25
买中国中车，总共亏了30多万，纸包不住火，老公,33503,48,168,3.5,2015-10-22 16:01:54
断头刀后的走势动向！,113559,104,1064,4.0,2015-10-21 21:38:02
志在必得，中车竞标泰国最大机车订单,6354,10,319,4.5,2015-10-22 20:28:00
龙骧将军：明日操作策略,19515,24,423,3.5,2015-10-22 20:12:31
错过下午的短线机会！,78645,121,246,4.0,2015-10-22 15:02:20
不要急于抄底，不要急于割肉，调整仓位，等待行,24915,44,1510,4.0,2015-10-21 23:49:49
反抽较为弱势继续观望！,21398,83,179,4.0,2015-10-22 09:47:17
2波反弹太漂亮太妖艳，实在是太诱惑太害人了！,3810,21,386,2.5,2015-10-22 14:35:27
中国中车(601766)大宗交易数据一览(10-21),22236,35,479,0.0,2015-10-21 19:25:31
中国中车今日超大单流入排名第14名(10-21),20805,27,338,0.0,2015-10-21 16:09:16
中国中车：明日操作策略，重点提示！,12497,26,306,4.0,2015-10-21 22:05:47
601766:中国中车2015年第一次临时股东大会会议,83529,29,1752,0.0,2015-10-13 16:54:43
中英合作引发A股掘金潮 三大板块或率先启动,36745,20,5264,0.0,2015-10-21 11:18:46
明天开盘直接卖，低开跌停，不信走着瞧！不大跌,29603,66,194,3.0,2015-10-21 00:34:18
亏的睡不着觉，，哎！！！有人说花生米就酒越喝,4433,19,168,3.5,2015-10-21 23:13:27
3400点之上私募大佬徐翔重新杀入A股 备战五中全,32844,36,2112,0.0,2015-10-21 07:14:08
下周二或周三可能大阴线暴挫！,38631,20,129,3.5,2015-10-17 22:17:10
种地100年也不够中车跌2分钟的.26的本..卖掉玉,3215,11,212,2.5,2015-10-21 17:30:53
【讨论】尾盘突然拉升，铁路基建的春天来了？  ,66362,36,2923,4.0,2015-10-20 17:04:06
明日走势：低开高走，抓住机会,4203,15,128,3.5,2015-10-21 16:26:06
调整明天是否会到来？建议大家切勿追高进场！,4331,8,2344,3.5,2015-10-21 00:45:54
拉升中车的后果不堪想象,51156,38,428,3.5,2015-10-20 15:17:53
中国中车(601766)融资融券信息(10-20),11746,8,550,0.0,2015-10-21 08:13:22
大盘股会不会一日游后续行情走向！,84793,70,797,4.0,2015-10-19 19:50:36
中字头个股尾盘暴力拉升,41805,19,3333,0.0,2015-10-20 15:02:19
中国中车(601766)融资融券信息(10-19),12923,13,548,0.0,2015-10-20 08:12:27
15.35追了神车，我要剁手吗？,92893,45,128,2.0,2015-10-20 15:23:56
今日足以证明中车必然为龙头股，没人怀疑吧（讨,31741,57,286,2.5,2015-10-20 18:40:40
热点追踪板块：高铁,3862,3,196,3.5,2015-10-20 09:25:00
老杨尾盘看中车-10.20！,15062,20,367,3.0,2015-10-20 16:06:21
下午大涨百点时，中车请你不要落后,17007,32,132,4.5,2015-10-20 12:34:35
周2大盘预测与策略,5086,14,2388,2.0,2015-10-20 02:43:28
今天的风险在于下午！,235749,182,184,4.0,2015-10-16 10:07:04
经济数据低于七后面的走势！,111965,68,244,4.0,2015-10-19 10:46:19
下午二点四十五分，迟到的空头提着双截棍匆匆来,3411,5,273,4.0,2015-10-20 15:14:41
两点半，股指进入了跳水高风险时间段！,2595,11,248,4.0,2015-10-20 14:30:57
15.38买了中车，是不是手贱了？,8114,20,144,3.5,2015-10-20 15:08:42
技术上连续超买指标出现后的走势！,139297,187,714,4.0,2015-10-17 17:33:24
【讨论】你来说说中车看多或看空的理由,35840,27,3031,4.0,2015-10-19 14:42:14
601766:中国中车关于2015年第一次临时股东大会,4711,8,1978,0.0,2015-10-13 17:12:39
不要不服气，我说的中车惊破天行情迟早要来到,29262,49,149,4.5,2015-10-16 21:33:25
这么大的盘子，有连拉几个涨停的可能吗？,6874,29,223,4.0,2015-10-18 19:05:25
601766:中国中车H股公告(董事会会议通知)(2015/,26870,14,566,0.0,2015-10-14 18:18:03
股易草根大盘走势分析,5527,25,420,3.5,2015-10-16 21:30:40
周四依然有望再冲新高！,48229,49,265,4.0,2015-10-14 12:46:40
高铁设备出海步伐将呈加快之势 推荐七股,26854,14,5924,0.0,2015-10-18 21:15:37
一7个涨停《一中国中车世界第一石墨烯超级电容,9667,12,827,4.0,2015-10-18 15:09:10
缩量回踩后周四依然有望阳包阴！,3365,72,536,4.0,2015-09-23 20:19:52
石墨烯电容，价值几许？有图有真相,5173,8,16,3.5,2015-10-18 19:36:19
广日股份周五收盘后放出特大利好,5944,8,438,3.5,2015-10-17 09:05:18
18元的成本，山上很冷！还有兄弟陪同站岗吗？,4105,38,155,3.5,2015-09-17 16:21:16
【讨论】中车走势为何如此纠结？,30743,30,2974,4.0,2015-10-16 14:27:34
中肯的点评！,46599,83,569,4.0,2015-10-16 07:51:35
7只个股尾盘净流入资金超亿元,46973,11,1563,0.0,2015-10-16 16:36:38
30元中车明年上半年全解套！,8043,21,128,4.5,2015-10-16 19:36:18
中国中车(601766)融资融券信息(10-15),9933,8,548,0.0,2015-10-16 08:06:39
中国中车(601766)大宗交易数据一览(10-15),18201,26,479,0.0,2015-10-15 19:02:45
大盘聚集正能量冲击3500点中国中车,4104,11,242,0.5,2015-10-16 13:02:38
中国中车今日超大单流入排名第7名(10-15),13383,14,338,0.0,2015-10-15 16:10:44
中国中车，铁公鸡行情的三个代表之一，拿着不会,1425,20,187,4.5,2015-09-30 10:06:13
当大潮退去，有铁公鸡才有资格祼泳！,1733,35,140,4.5,2015-10-08 09:55:33
周四走向！,82919,191,582,4.0,2015-10-14 19:53:56
晒晒九月份业绩,4856,43,124,3.5,2015-10-08 17:42:53
中国中车研制成功世界领先的大功率石墨烯超级电,5029,54,806,0.0,2015-10-10 13:37:17
【讨论】华泰证券能否带领券商走出一波上涨行情,6714,7,3039,4.0,2015-10-15 16:59:44
下午的走势！,78908,104,251,4.0,2015-10-15 12:23:02
少说多做！,8820,104,203,4.0,2015-10-14 09:29:08
不惧风暴！大胆抄底吧！,3883,9,255,3.5,2015-10-13 19:51:46
601766:中国中车重大合同公告,38463,111,996,0.0,2015-09-29 21:31:34
中国中车大连公司获7.4亿广州地铁订单,3371,22,612,0.0,2015-10-09 16:24:54
中国中车在美国投资建厂奠基 预计投资6000万美,2799,27,1674,0.0,2015-09-05 09:22:03
中国中车(601766)融资融券信息(10-14),9246,9,546,0.0,2015-10-15 08:12:33
少说多做！,24637,50,186,4.0,2015-10-15 10:11:02
中国中车今日超大单流出排名第14名(10-14),6123,9,337,0.0,2015-10-14 16:11:24
连续震荡盘升明天还有望冲高！,2895,10,339,4.0,2015-10-14 12:43:14
我威震霸天，你们不能不服！,1837,22,137,4.5,2015-10-14 09:42:54
十月的行情：三涨一平一退（为什么发不上贴子）,1884,18,2553,4.0,2015-10-14 01:36:47
牛市行情已经开启？谨慎看多（为什么发不上帖子,1754,15,2437,4.0,2015-10-13 00:22:53
下午走势分析,1129,68,332,3.0,2015-09-14 13:32:14
周三的走势动向！,3678,125,338,4.0,2015-10-13 18:12:03
少说多做！,21555,71,150,4.0,2015-10-12 09:39:48
中车的磁悬浮列车也搞出来了!,1900,20,293,4.5,2015-10-13 21:41:16
【讨论】能否突破60天均线上演中级反弹行情？,990,9,3027,4.0,2015-10-13 15:23:04
印尼国企部长：中国方案是雅万高铁项目唯一选择,1238,20,154,4.0,2015-10-02 22:11:10
中国中车(601766)融资融券信息(10-13),1918,6,552,0.0,2015-10-14 08:05:26
继续以实盘来说话！,2442,87,202,4.0,2015-09-07 17:52:08
开着宾利进股市 求下联 。。,1366,58,14,2.5,2015-09-12 18:14:08
既然有人还在质疑，就说明这个消息新，我发张图!,1081,11,148,4.5,2015-10-13 22:44:08
中国中车今日超大单流出排名第8名(10-13),1737,9,335,0.0,2015-10-13 16:11:41
中车会涨到58左右的。,1022,17,190,4.0,2015-10-13 17:29:47
我7月10号预测两个月后的今天是行情启动的开始,2268,36,241,4.0,2015-09-09 22:29:53
少说多做！,2397,81,205,4.0,2015-10-13 10:08:52
明天小盘票仍然有望继续突破！,2217,55,246,4.0,2015-10-13 11:31:17
下周开始空头会急了有望迎来周线强突破！,3770,165,331,4.0,2015-09-11 15:04:49
中国中车的一点看法！,1015,26,196,4.0,2015-10-13 13:22:20
中国中车今日超大单流入排名第6名(10-12),1726,7,335,0.0,2015-10-12 16:21:59
连续长阳突破后的周二走向！,6449,59,531,4.0,2015-10-12 20:41:16
【讨论】单从技术角度来讲，中车的最佳买点在哪,29906,11,3029,4.0,2015-10-12 11:16:38
突破三十天线后下周的走势动向！,2401,70,683,4.0,2015-10-10 20:29:35
大阳突破后周二有望再度突破！,1773,49,180,4.0,2015-10-12 11:11:22
【讨论】技术革新的中国中车下周要起飞了？  ,7152,26,3159,4.0,2015-10-10 17:04:39
京九高铁走向基本确定 两大板块将受益,1392,7,424,4.5,2015-10-12 09:30:44
强势突破站稳三十天线整理结束下周大涨！,1789,46,177,4.0,2015-10-09 13:40:52
中国中车今日超大单流出排名第8名(09-29),1353,6,340,0.0,2015-09-29 16:24:43
又到中秋节了，好心酸.求对联,938,22,209,2.5,2015-09-25 07:51:52
今天结婚，希望明天中国中车高开高走，给我一些,1278,23,164,3.0,2015-10-11 14:27:27
中国新一代大功率石墨烯超级电容问世,2491,25,733,0.0,2015-10-09 19:25:11
养老金入市？ 天涯看后后背发凉,1437,23,157,3.5,2015-08-23 19:44:15
中车明天涨停机率是190%。,1140,15,127,4.0,2015-10-09 20:37:40
601766:中国中车第一届董事会第五次会议决议公,9896,14,1035,0.0,2015-10-09 16:31:41
卖股票的方法,2974,115,244,3.5,2015-09-12 10:09:24
中国中车(601766)大宗交易数据一览(10-09),3723,15,479,0.0,2015-10-09 19:11:09
【讨论】窄幅波动 变盘在即？,1218,15,1440,4.0,2015-10-09 14:49:58
中国高铁驶入美国 中车投资6000万美元在美建厂,4875,35,1406,0.0,2015-09-30 11:14:53
【讨论】中车能否再度崛起引领大盘向上突破？,1041,27,2000,4.0,2015-10-08 14:09:09
中国中车(601766)融资融券信息(10-08),1433,7,548,0.0,2015-10-09 08:14:01
市场将面临着短期的分化,901,20,385,3.5,2015-10-09 11:03:12
巴菲特有700多亿美金，全球有70亿人，每人分1亿,1564,27,210,1.5,2015-10-09 10:51:56
601766:中国中车H股公告(股份发行人的证券变动,10416,26,738,0.0,2015-10-07 17:00:44
明天开始上演丈夫不在家行情———逼空,1090,11,130,4.0,2015-10-07 19:02:29
持股过节还是持币过节,1193,21,606,3.5,2015-09-30 08:12:39
节后的走势！,1741,31,397,4.0,2015-10-07 06:58:16
确定性成长股300259新天科技,1117,6,154,4.0,2015-09-30 19:32:00
节后有望开门红！,1783,60,486,4.0,2015-10-07 06:44:32
现在买入铁公鸡股，仍然可以获取一路一带原始暴,910,18,204,4.5,2015-10-08 10:20:59
中车明天涨停机率是170%。,1297,16,127,4.0,2015-10-06 20:39:32
节后或将见底反弹,2115,93,847,3.5,2015-10-06 09:56:58
印尼选择中方修首条高铁：被中国胆识折服,1613,25,257,2.0,2015-10-01 08:01:11
40不是梦[俏皮],1621,12,124,3.5,2015-09-30 15:41:15
(原创）几个愚蠢可笑的股市名词和理念,1913,13,1518,3.5,2015-10-05 13:22:15
走势有些不太妙！,1443,39,184,4.0,2015-09-25 10:38:10
601766:中国中车内部控制工作规定,3655,8,1837,0.0,2015-08-31 19:36:02
中车估值修复基本到位，青青护盘结束，进驻军工,1815,21,162,4.0,2015-09-12 08:17:47
中车；不管对与否，预测是为了更好的应对。,1381,55,728,3.0,2015-09-21 11:26:05
A股8周巨震实录：89万账户在黎明前清仓,2317,51,3776,0.0,2015-08-21 21:42:59
此方法判断顶和底  准确率极高,1213,49,1532,2.5,2015-10-05 10:09:50
一富婆走进女子休闲会馆，领班忙前来接待：大姐,1584,7,304,3.5,2015-10-04 08:43:21
中国中车近期共签署约780亿元合同,2265,22,704,0.0,2015-09-30 08:36:29
【讨论】有多少人买入中车的理由是“从39到13跌,2136,49,5423,4.0,2015-09-28 14:27:49
据我所知印尼排华情绪曾相当强烈，出现过严重的,1827,19,238,4.0,2015-10-02 08:46:23
大师的原话，关于下半年的意见走势。。。必看！,1178,12,2093,3.5,2015-10-02 11:55:48
看不清楚自己了,1333,28,120,3.5,2015-09-26 11:51:05
邂逅花千骨，又遇云中割，不幸套中套，难逃双劫,1158,24,147,4.0,2015-09-28 06:05:08
如本神两个月前预测的一样，探底已经结束了,1760,57,153,4.0,2015-09-16 14:49:01
全球股市告急！A股必将震惊世界！,1129,28,1206,2.5,2015-09-23 08:54:26
继续实盘如下！,2741,70,324,4.0,2015-09-30 14:26:01
中车节后轻松超30元或是必然……毕竟：,1048,24,166,3.0,2015-09-30 15:38:20
大盘走势有些许不妙！,1301,49,151,4.0,2015-09-30 10:06:27
【讨论】中车的利好能否在节后继续发酵  ,1208,24,2030,4.0,2015-09-30 16:49:53
中国中车的两个投资要点,1141,15,5449,3.5,2015-09-30 16:25:24
中国中车(601766)融资融券信息(09-29),1223,8,548,0.0,2015-09-30 08:35:25
中国中车近期签订780亿元重大合同,2771,49,340,0.0,2015-09-29 22:37:46
中国中车集团公司正式成立,8516,35,1568,0.0,2015-09-29 14:40:10
【讨论】不断拓展海外市场的中车你会选择买入吗,1343,28,5180,4.0,2015-09-29 16:39:55
今天涨停，我就去买个IPHONE6S，庆祝下,825,12,137,3.0,2015-09-30 09:49:08
中肯的点评！,2279,39,824,4.0,2015-09-29 22:36:34
中国中车集团公司正式成立 崔殿国任董事长,2488,33,249,0.0,2015-09-28 14:52:05
印尼国家的高速铁路已经接受中国的提案。,717,3,208,3.5,2015-09-29 15:19:02
印尼接受中国高铁方案 明日涨停[胜利][胜利][赚,1586,19,163,3.5,2015-09-29 16:56:37
今天尾盘很可能创业板还要逆势番红！,1321,37,213,4.0,2015-09-29 14:23:51
明天的操作指南！,1552,57,352,4.0,2015-09-29 15:16:30
9月22日盘面分析,1004,18,485,3.5,2015-09-22 22:47:22
创造可复制改革模式 中国中车定位国际投资集团,159843,18,1568,0.0,2015-09-29 02:54:55
中国中车(601766)融资融券信息(09-28),1466,7,538,0.0,2015-09-29 08:09:18
少说多做！,1516,45,190,4.0,2015-09-29 10:02:49
今天开始独自面对全国看空盘！,875,28,171,4.0,2015-09-28 10:59:12
今天晚间再来探讨一下明后天的走势！,1471,27,226,4.0,2015-09-28 15:02:24
中美将组建合资公司资金闻风而动 高铁王者归来,5578,61,2577,0.0,2015-09-19 04:00:47
