标题,阅读,评论,字数,影响力,时间
感觉不妙 好像又有媒体出来报道什么利空消息了 ,4743,11,192,4.0,2016-04-07 13:06:04
彻底破位崩盘了 利空消息主力先知先觉 等我们收,5633,8,198,4.0,2016-04-07 13:29:19
今天主力绝对借拉高出货 因为美国这几天又要公,3435,3,190,4.0,2016-04-11 09:56:12
大家想想一季报证金增持中车1.4亿股为何？,11826,11,192,4.0,2016-05-02 17:01:24
俄罗斯拟首建“中国轨距铁路” 或带来东北经济,27804,9,315,4.5,2016-05-03 08:58:44
继续关注下面点位的得失,9778,7,671,3.5,2016-04-27 22:57:43
解析一季报:股价被腰斩  和它脱不了干系,18340,8,1643,3.5,2016-04-29 08:14:50
世界首列氢燃料混合动力有轨电车在唐山下线,41637,17,322,4.5,2016-04-28 08:51:18
601766:中国中车2016年第一季度报告,65387,15,1100,0.0,2016-04-27 21:48:09
中国中车获芝加哥地铁项目 标的金13.09亿美元,22892,26,591,0.0,2016-04-19 13:47:38
测试你智商的一道题，很多朋友都做不出来,7269,177,138,3.0,2015-09-15 16:06:38
大胆预测：现在的中车，就是未来10年后的第二个,10501,8,578,4.0,2016-04-17 20:23:39
即将变盘，5000点轮回，A股从海底出发,13523,36,234,3.5,2016-04-23 15:30:37
缩量反弹关注下面点位得失,7820,6,535,3.5,2016-04-26 22:42:31
中国中车2015年净利润118亿同比增长9.27% 拟10,54387,46,887,0.0,2016-03-29 17:02:53
弱反将会再次出现跳水走势！,9649,7,675,3.5,2016-04-24 22:21:58
去年的这月。。我生了个儿子取名叫罗中俊。如今,14147,31,247,2.5,2016-04-15 21:50:39
中国中车混合动力动车组已完成调试,19894,28,267,0.0,2016-04-22 11:35:49
601766:中国中车关于13南车01、13南车02受托管,47970,9,1836,0.0,2016-04-22 16:50:26
为什么删我帖子？？,8703,7,631,3.5,2016-04-21 22:36:24
高铁概念活跃 中国中车涨2.49%,21298,8,198,0.0,2016-03-11 09:56:27
实在忍不住了，回来中车发个帖子，抓啊，主力啊,13180,16,258,4.0,2015-11-27 18:10:39
只要养老资金还没进场 市场就不会真正的好起来 ,3038,0,212,4.0,2016-04-19 10:10:42
那一年，我9岁，她11岁，我告诉她我将来要娶她,7132,9,964,3.0,2016-04-20 08:58:01
注意变盘节点,11039,2,435,3.5,2016-04-19 22:46:27
短线还有上涨动能,9031,7,623,3.5,2016-04-14 23:11:28
短线关注缺口是否回补！,6438,2,727,3.5,2016-04-18 22:15:08
中国中车获芝加哥地铁项目在美国正式签约,37541,33,538,0.0,2016-04-17 03:02:23
少说多做！,124368,101,386,4.0,2016-01-04 18:03:19
601766:中国中车关于13南车02公司债券的付息公,39037,10,1857,0.0,2016-04-15 16:38:42
获得芝加哥交通管理局新订单,84273,30,813,0.0,2016-03-14 14:23:41
车严重低估的中国股市将会合力拉出一波具特色气,20443,20,200,3.0,2016-01-24 15:10:20
35元成本的还有在的吗,22712,31,136,1.5,2016-01-28 21:56:49
过了好久才有勇气在这里发帖！想当初买股票的时,9329,10,480,1.0,2016-04-16 20:35:58
将恶意做空A股者绳之以法才能治本,6961,7,182,4.0,2015-08-28 13:26:41
知名机构4月10日内参：中国中车（601766）首次,16874,21,199,4.0,2016-04-10 15:07:04
远离中国股市吧。这只牛只会吃掉股民的草，还给,32758,62,230,4.5,2015-11-27 16:02:09
果真是一卖就涨呀。难道机构能看到我的账户？,42089,72,178,4.5,2015-11-24 15:19:44
股龄7年，2013年5月至今的操作情况,29601,35,189,2.0,2015-11-19 20:00:37
中国中车今日超大单流入排名第20名(04-14),15318,7,336,0.0,2016-04-14 16:09:19
中车再获85亿元美国地铁订单 目标数量为846辆车,49232,69,861,0.0,2016-03-24 10:03:55
中国中车赢得美国芝加哥846辆地铁车辆项目,25404,35,604,0.0,2016-03-10 23:28:36
中国中车获印度德里76辆地铁订单,20865,29,211,0.0,2016-03-24 16:58:43
中国中车今年主攻美国市场：要做公共交通领域的,22573,21,1927,0.0,2016-04-14 04:05:59
中车拿下美国地铁最大单 虎口夺食击败庞巴迪,50709,66,1872,0.0,2016-03-11 03:26:57
不要说二十元啦！中车到四十元也只能算是刚刚起,15695,26,232,2.5,2016-04-12 18:56:15
601766:中国中车:中国国际金融股份有限公司关于,49734,15,1739,0.0,2016-04-11 16:46:37
中国中车：铁总“长工”继续,22055,11,3134,0.0,2016-04-13 21:07:02
关注突破类个股，谨慎做多,8537,7,1010,3.5,2016-04-13 22:53:43
601766:中国中车:中国国际金融股份有限公司关于,61275,24,2054,0.0,2016-04-11 16:57:37
趋势尚不明朗，谨慎做多！,7392,1,917,3.5,2016-04-12 22:42:01
601766:中国中车关于公司控股股东拟发行可交换,51295,26,658,0.0,2016-04-11 16:47:15
周一关注缺口能否回补,10226,4,1272,3.5,2016-04-10 21:47:55
节后买股前要注意到这三件事,5506,71,903,3.5,2015-10-06 09:00:20
明天涨停开盘，并且封住涨停板，空头死路一条。,12511,12,154,3.5,2016-04-06 14:35:04
中国中车今日超大单流出排名第14名(04-05),19341,11,330,0.0,2016-04-05 16:11:37
中国中车去年净利118亿在手订单2144亿元,21725,12,884,0.0,2016-03-30 15:28:53
601766:中国中车2015年年报,35453,6,1320,0.0,2016-03-29 16:44:46
您有一份中国中车吧未读的操盘攻略，快来领取,58765,7,1559,2.0,2016-04-01 16:33:23
节后的走势观点！,131249,111,238,4.0,2016-02-15 09:41:23
谈谈买了中车后的感受：在十元介入中车后，每天,20351,2,308,3.5,2016-04-02 14:33:37
如此精准的预测，却被污为屁股决定脑袋,594828,2379,673,4.0,2015-11-10 14:22:25
大家一定小心一个托叫：迎接估值回归,30376,80,339,2.5,2016-03-31 15:55:52
中车扬帆起航！盘中惊现短线买点！,101894,129,302,4.5,2015-11-23 11:07:38
涨了就是涨了，跌了就是跌了,8705,36,192,2.5,2016-03-22 15:17:33
中国中车年报解读：令人失望,47868,17,3336,3.5,2016-03-31 09:36:58
601766:中国中车2015年度内部控制评价报告,36014,12,1772,0.0,2016-03-30 17:17:09
害人股.套牢一年了 赔80万.17才能回本.,13634,18,153,2.5,2016-03-29 18:22:05
601766:中国中车2015年社会责任报告,29980,18,161,0.0,2016-03-29 16:45:16
中国中车去年净利增9.27% 在手订单逾2000亿元,18998,13,718,0.0,2016-03-30 03:11:27
601766:中国中车财务报表及审计报告(2015年12月,35619,2,189,0.0,2016-03-29 16:45:36
周五大放送,18302,26,205,3.0,2016-02-19 11:34:27
601766:中国中车独立董事对公司2015年度对外担,7984,6,951,0.0,2016-03-29 16:43:48
601766:中国中车关于公司股东拟发行可交换公司,66699,32,758,0.0,2016-03-22 16:59:16
中国中车(601766)融资融券信息(03-28),7871,8,524,0.0,2016-03-29 07:41:39
国资委：中国中车与中国建筑签署战略合作框架协,85912,104,255,0.0,2016-03-23 15:16:06
中国中车获发达国家最大订单,27161,20,1254,0.0,2016-03-11 15:43:16
周线收十字星，注意变盘节点！,4740,0,1071,3.5,2016-03-27 21:18:27
调整还将继续，创业板更要警惕风险！,10397,1,967,3.5,2016-03-24 23:29:24
少说多做！,126618,169,249,4.0,2015-12-24 14:47:07
中肯的看待！,98556,55,460,4.0,2016-01-11 14:12:36
中国中车(601766)融资融券信息(03-24),9307,4,526,0.0,2016-03-25 07:38:47
中国中车：重磅消息流出，短期强势上涨一触激发,15309,51,271,3.5,2016-03-22 16:50:23
解析中国中车未来走势（仅个人意见）,16355,29,473,3.5,2016-01-08 14:45:45
强反不成当心中阴调整出现！,43836,7,893,3.5,2016-03-23 22:56:24
中国中车与中国建筑签署战略合作框架协议,12954,8,178,0.0,2016-03-23 15:03:05
强势调整，注意卖强买弱把握节奏,9356,0,861,3.5,2016-03-22 22:44:10
中国中车：震荡调整迎来反弹 强势拉升整装待发,9295,21,356,3.5,2016-03-22 20:31:44
601766:中国中车关于用自有资金归还募集资金的,71341,32,519,0.0,2016-03-21 16:19:02
优选超跌没有涨的个股,37872,8,1135,3.5,2016-03-21 22:03:33
如果周一涨停，留言的每一个人送三星S7一部！,17055,130,136,2.0,2016-03-20 12:03:53
601766:中国中车H股公告(董事会会议通知),78028,14,564,0.0,2016-03-14 17:03:26
价值投资人大胆介入002130 沃尔核材,78831,189,150,4.0,2016-01-06 17:15:42
方向还有待确认,43143,18,926,3.5,2016-03-17 22:26:40
与高者为伍与德者同行，必得善果。再冰冷的股市,38345,49,326,3.5,2016-03-05 23:05:14
中车集团成立新公司发展非轨道交通业务,33536,21,256,0.0,2016-03-17 15:56:20
中国中车今日超大单流入排名第10名(03-16),18148,8,345,0.0,2016-03-16 16:07:05
关注小而美300121。,4373,0,134,4.0,2016-03-11 17:27:34
做多错多不如继续欣赏,5560,0,900,3.5,2016-03-16 22:58:08
管清友:南非爆发黑天鹅事件概率大 避开相关公司,62738,16,3189,2.5,2016-03-15 15:19:35
明天安排中车护盘了,9423,28,141,4.0,2016-03-10 17:00:22
这里别追高，再强调一遍！,5820,9,134,4.0,2016-03-14 10:55:00
中国中车7元以上是高风险区域,9195,13,79,4.0,2016-02-25 10:35:43
散户的误区--频繁交易的陷阱：第四更新,50617,87,1600,3.0,2016-01-07 16:23:04
其实主力也很“傻”，第十一更新,20708,40,3602,3.0,2016-01-14 21:10:52
神车好戏即将开场 不可轻易丢弃筹码 下周看涨,19545,93,773,3.5,2016-03-11 16:40:19
中国中车今日超大单流出排名第6名(03-14),18386,7,333,0.0,2016-03-14 16:08:11
40元买进的，请问各位大神，啥时候可以解套呀，,25441,27,179,2.5,2016-03-04 08:25:13
中车调整已经到位(所谓的慢牛都是掩人耳目）,16491,21,208,1.5,2015-12-24 15:11:17
下周机会重大，你必须打起12分精神，随时进场抢,8613,10,959,2.5,2016-03-13 23:25:53
中国中车中标13.09亿美元海外地铁车辆采购,13019,6,328,0.0,2016-03-10 22:51:31
火箭军急配“导弹列车”几十列！！,11004,8,403,3.5,2016-03-12 18:52:04
纪念股市回到2800点---当代著名诗人:白交易。,12050,30,253,3.0,2016-03-12 09:22:00
风雨之后会见彩虹！,127121,804,287,4.0,2016-01-28 16:04:16
春风又绿江南岸，求下句？,6550,19,12,3.0,2016-03-11 16:20:16
十大机构论市：两大板块肩负大盘逆转重担,43858,365,9608,0.0,2016-03-11 15:30:11
多空对决2800点 强弱紧盯一风向标,15357,19,1566,0.0,2016-03-11 14:56:24
中国中车中标13亿美元大单 地铁车辆采购创美国,24777,13,317,0.0,2016-03-11 03:51:59
先来个三涨停。,6224,10,7,3.5,2016-03-08 01:18:30
【热点追踪】高铁股强势崛起的原因是? ,21629,6,4620,4.0,2016-03-11 10:49:33
机构：沪指击穿2800点 洗盘意味浓厚,9947,14,1531,0.0,2016-03-11 11:27:35
中国中车斩获最大单出口发达国家地铁项目,25706,20,577,0.0,2016-03-10 20:33:44
中国中车中标13亿美元地铁车辆采购项目,18388,19,310,0.0,2016-03-10 19:38:37
大家评评，能有几个涨停？,11922,22,134,3.0,2016-03-10 22:30:20
中国中车：短期止跌反弹，但力度有限~！,6802,44,347,2.5,2016-03-10 17:45:13
中国中车中标芝加哥13亿美元地铁采购项目,12841,11,279,0.0,2016-03-11 08:28:01
中国中车获芝加哥13亿美元地铁订单,27974,28,662,0.0,2016-03-10 11:51:21
明天中车高开低走,5748,13,138,3.5,2016-03-10 19:59:35
601766:中国中车关于额外发行最多为2亿美元2021,106612,28,801,0.0,2016-03-07 18:42:46
中国中车获芝加哥13亿美元地铁订单,9139,18,639,4.5,2016-03-10 11:15:07
2016年3月4日大盘点评以及下周操作策略。,11674,6,852,2.5,2016-03-04 21:17:55
本周A股阶段性反弹已经确立！,5975,9,823,4.0,2016-03-07 15:28:30
制造题材、讲故事，股评推荐，对倒放量，忽悠股,5173,36,378,4.5,2015-09-10 15:26:43
说说您买了中国中车到现在亏了多少？,175082,237,144,3.5,2016-01-05 11:21:44
中国中车(601766)融资融券信息(03-02),15798,6,536,0.0,2016-03-03 07:38:20
朋友们不要急，大盘只看准一个特点就行。,5952,65,429,3.0,2015-08-25 13:39:35
“惊弓之鸟”担心第四轮暴跌,154822,122,3272,0.0,2016-02-26 01:29:47
求横批，猜对有奖,13931,37,140,3.0,2016-02-26 13:28:32
601766:中国中车H股公告(中国中车股份有限公司),106726,10,1766,0.0,2016-03-01 16:55:46
中国中车(601766)融资融券信息(02-29),13621,6,528,0.0,2016-03-01 07:39:28
現在抄底為時尚早,22116,98,205,2.0,2015-11-30 11:42:53
求下联：南车，北车，合并成烂车,24205,86,131,3.5,2015-12-26 23:05:56
谢百三给新主席的信：呵护亏损巨大1.4亿股民 02,17235,10,2040,2.0,2016-02-27 18:51:11
中国中车后期会怎样？,8484,24,259,3.0,2016-03-01 09:00:17
国企改革行情炒作后股市大跌 投资者谨防再做接,42028,8,2152,0.0,2016-02-24 22:07:31
中车20150821,6419,32,302,3.5,2015-08-23 18:45:03
换来了这个,13404,16,120,3.0,2016-02-25 16:19:40
中国首条中低速磁浮铁路重载试验 3月将按图试跑,48196,17,999,4.5,2016-02-25 09:26:21
今天看到网上有人举牌子问候新领导，希望股市来,14449,3,1486,3.5,2016-02-21 23:39:54
今日技术分析,4153,16,371,3.0,2016-01-15 09:25:50
还有没有25我朋友在！,15345,32,132,2.0,2016-02-24 15:04:24
中国中车(601766)融资融券信息(02-23),11921,6,532,0.0,2016-02-24 07:39:40
叶檀：中远中海重组为何市场反应与中车差别巨大,476017,198,1593,0.0,2015-12-15 01:35:16
哄女友的方法： 女朋友和我发火、理由万种多！ ,5393,7,238,4.0,2015-09-14 07:58:36
明天，中车将以连续第四个涨停为牛市背书!,3797,86,150,4.5,2015-08-31 17:05:18
中车接棒保险保障基金成三股东 中华保险股东“,57127,20,2201,0.0,2016-02-14 23:50:37
中国中车近日看法及大盘点评,14051,36,483,4.0,2016-02-16 16:46:21
中国中车今日超大单流入排名第19名(02-16),15947,3,341,0.0,2016-02-16 16:20:43
倾巢之下有完卵，做好精准狙击,86384,652,921,3.5,2016-01-06 09:52:00
中国中车今日超大单流出排名第6名(02-15),17812,5,332,0.0,2016-02-15 16:14:36
601766:中国中车收购资产进展公告,87906,13,682,0.0,2016-02-05 18:35:48
赔了三十多万 终于和老婆离婚了 三个多月的挣扎,2389,71,168,3.0,2015-09-10 11:39:14
中车：林洋10转30派6元,35766,36,335,3.5,2016-01-06 11:56:08
多年经验对股票投资的一些思考,146104,209,738,3.5,2015-12-16 16:26:29
擦干泪水，重新上路，锁定中车，为国护盘，不求,6044,177,170,4.0,2015-08-22 06:08:12
整天看空中车的菜鸟们，牛姨坚定认为1.29中车必,35659,32,228,4.0,2016-01-29 13:20:50
什么都不懂，跳出来胡喷，收拢均线呢看不见！,28315,36,207,4.0,2015-11-22 00:53:50
本次熔断的思考,46591,105,587,3.5,2016-01-04 16:23:09
【年鉴】中国中车热点事件 热门人物大回看,145112,5,3301,2.0,2016-02-05 15:38:40
机构：五大利好支撑 第五轮牛市一定过万点,119436,873,11547,0.0,2015-12-06 13:01:10
中国产充电公交车将在奥地利试运营,32544,15,824,4.5,2016-02-04 14:08:58
中车啥时候能回本，29.36元本，哭泣，没钱补仓,11517,22,165,2.5,2016-01-22 20:16:09
买中车的理由！,21479,13,216,3.0,2016-02-05 14:42:00
薇薇宝宝想入点中车，现在点位合适吗？,19508,18,139,3.0,2016-02-04 13:47:10
中国中车购中华联合保险股权获保监会核准,28725,5,202,0.0,2016-02-06 00:08:24
601766:中国中车关于购买理财产品情况的公告,65024,20,1010,0.0,2016-02-04 17:11:14
底部三金叉买入大法，抄底必备好用技术--免费分,3206,8,2029,2.5,2015-10-02 19:06:49
小鸡已经满仓被套，请各位大侠手下留情啊！,18107,16,156,3.0,2016-01-26 11:54:57
中国中车我25.6的本 五年可能都出不来 ！1,13945,14,135,3.5,2016-02-01 13:32:43
灵车有种跌到1人民币 本姑娘就解开凶赵 免费挤,13820,26,26,4.0,2016-02-01 15:30:44
说实话，谁也不知道大盘何去何从,9624,13,1815,3.5,2016-02-01 05:27:40
601766:中国中车H股公告(股份发行人的证券变动,56406,6,721,0.0,2016-02-03 17:03:36
中国中车13元以上大盘是高风险区域，中国中车市,6160,26,169,4.0,2015-09-11 13:40:02
【讨论】别人输了80%就一定能抄底吗？,32072,12,1671,4.0,2016-02-03 14:05:40
一石二鸟——— 美 联 储 在 行 动 之 战 略 目,72166,127,453,4.0,2015-12-12 15:01:17
本姑娘几个月前今日股市  现在亏了  大姨妈都不,53554,105,26,4.0,2016-01-27 19:59:59
外媒：中车与美国初创公司Hyperloop洽谈合作,43489,25,317,0.0,2016-01-28 11:56:38
中国中车(601766)融资融券信息(02-01),10200,3,524,0.0,2016-02-02 07:38:49
601766:中国中车建议发行于2021年到期之6亿美元,85662,25,1166,0.0,2016-01-26 08:42:14
601766，35元的本能解套吗,19426,32,16,3.0,2015-12-18 16:16:54
601766:中国中车第一届董事会第十次会议决议公,62773,16,848,0.0,2016-01-18 17:18:33
！！国家队护盘无诚意，散民卧倒也是一种自我保,20950,39,1593,3.5,2016-01-08 19:46:24
帖子预告,37857,92,275,4.0,2016-01-20 22:07:19
市场再度“断崖式”暴跌的可能性正在降低,194892,349,2201,0.0,2016-01-17 08:31:59
真想一死了之。,9927,17,124,2.0,2016-01-28 16:34:45
我站在35元的高岗上，120W投入现在只有25W了，,18744,23,207,3.5,2016-01-28 14:28:06
……亏得只剩胸罩 、和内裤了，怎么办…………,30643,46,205,3.5,2016-01-27 09:21:21
还有20以上的朋友么！,21744,45,132,2.5,2016-01-27 09:46:08
中国中车下跌有所减缓，仍应保持谨慎。,23036,103,181,2.0,2016-01-14 09:15:29
今天开贴就说大盘,14209,22,447,3.5,2016-01-15 23:16:29
[鼓掌]注意！主力有大动作，巨资抄底.一路一带,6730,13,464,3.5,2016-01-20 13:20:49
什么时候是抄底的时机？抄底的时机有哪些？,18264,24,954,4.0,2016-01-06 13:06:53
中国中车44.55亿竞得中华联合保险13.06%股权,25068,16,449,0.0,2016-01-11 13:12:34
_____整体进入第三阶段（2015，12，4）________,9156,24,174,3.5,2015-12-04 10:02:02
2015最后一站,35319,122,676,4.0,2015-10-03 12:16:57
中国中车 一夜之间 已经又回到那个年代。。,10722,15,93,4.0,2016-01-26 09:44:07
我通过低抛高吸，把成本做到了六十元,14250,19,144,3.0,2016-01-25 09:58:57
叔叔 叔叔 请问 中国中车现在可以买吗？,17684,47,20,4.0,2016-01-22 13:02:25
中国中车25元本.今年能解套吗..,24319,36,85,2.5,2016-01-23 22:06:18
叔叔 叔叔 俺刚才一不小心 把买单敲成卖单 成交,9205,22,145,4.0,2016-01-26 11:06:43
中国中车今日超大单流入排名第20名(01-19),24464,8,339,0.0,2016-01-19 16:18:16
中车还会跌回10元 等着瞧,18261,41,155,3.5,2015-11-30 11:08:37
中国中车打击之下隐藏着什么……,11998,23,259,3.0,2016-01-22 10:43:04
我对股市的理解,5017,8,864,3.5,2016-01-05 13:58:36
中车H股才8元价高位出快*下来全仓转扫惊天低估,116367,623,583,3.5,2015-08-12 16:15:28
中国中车旗下企业获伦敦地铁千万美元订单,11318,9,591,0.0,2016-01-14 14:13:34
中国中车拟设立金融租赁公司,45636,26,481,0.0,2015-12-24 02:43:29
中国中车11-12月签414亿元销售合同,19692,10,240,0.0,2015-12-29 18:20:32
大盘后市的两种走法,12424,42,587,4.0,2015-10-31 16:11:18
警告：本人明日正式建仓中国中车！,39068,82,178,4.0,2016-01-07 15:38:01
稳扎稳打，步步为营！必读策略！,12175,45,452,3.5,2016-01-18 17:16:50
中国中车！接下来如何应对？,16834,67,166,3.5,2016-01-21 10:40:20
601766:中国中车董事会审计与风险管理委员会工,48178,9,1792,0.0,2016-01-18 17:19:25
今日不涨停  我把卵蛋掏出来 砸破,35836,133,84,4.0,2015-12-08 10:28:15
中国中车今日超大单流出排名第11名(01-20),18239,14,343,0.0,2016-01-20 16:22:17
明天周四操盘要点透析，运筹帷幄（全方位）,14300,16,3577,4.0,2016-01-20 17:48:05
今晚看好两只强势股,20940,37,129,3.5,2016-01-20 20:38:16
明天周一操盘要点，运筹帷幄决胜千里。,39424,27,3419,4.0,2016-01-17 20:32:44
易淘：周三操作策略,4185,4,171,3.5,2016-01-19 00:41:46
我上周四分析的大盘大家可以关注一下,28389,28,233,4.0,2016-01-19 21:12:22
A股触底反弹，如何精选个股把握短线赚钱机会？,26026,72,918,3.0,2016-01-19 15:06:23
一季度涨跌节奏,7775,26,325,3.0,2016-01-04 21:38:54
本大师郑重宣布彻底接管中车，各路牛鬼蛇神速速,7216,21,153,4.0,2015-11-08 20:29:20
周末了，大家放松下；遇见这样的情况你会说什么,4089,18,164,3.0,2015-11-28 14:23:11
中国中车我不唱多，但是盘面来看确实还算不错的,10545,160,197,4.5,2015-09-18 14:49:30
【讨论】趋势向下，为何还要坚守？,19341,11,1862,4.0,2016-01-18 14:32:34
明天周二操盘要点透析，风险管控，运筹帷幄,6925,6,3136,4.0,2016-01-18 19:01:56
下周一大盘怎么走,14751,23,241,4.0,2016-01-15 15:34:14
1.6今日直播！,11610,46,203,3.0,2016-01-06 09:01:48
周五最后一个交易日，今天的直播你敢看吗？,9980,30,227,3.0,2016-01-08 08:44:41
明天大盘还有一次下探,21297,24,246,4.0,2016-01-14 18:08:38
大家说说中车能到多少钱,48190,147,132,3.0,2015-10-04 22:34:02
草根看市沪市有望迎来波段行情,4270,11,1351,3.5,2016-01-14 21:21:28
中国中车股价熊市最多值1.80元，第二只中石油，,12206,45,172,4.0,2015-10-28 13:26:24
竞猜 下周大盘2850会不会破,11476,27,75,2.5,2016-01-16 17:13:57
强烈呼吁明天测试上涨熔断！,57858,44,442,4.5,2016-01-04 15:41:01
中国中车旗下企业获伦敦地铁千万美元订单,39213,23,646,3.5,2016-01-14 14:36:03
如果今天下跌，你敢上车吗？,65321,80,2158,4.0,2015-10-27 08:51:18
这样操作不赚都难,7236,14,826,3.5,2016-01-14 15:38:15
今天就详细分析一下中车！！,32234,37,252,3.5,2015-11-09 13:50:30
我欲清仓归去，又恐迅速反弹，踏空不胜寒。,8646,16,211,2.0,2015-11-19 23:03:13
少说多做！,47620,31,241,4.0,2016-01-07 23:10:10
飞天云彩，你有多少小号？尽管冲我来！,13483,38,329,3.5,2015-12-03 22:51:20
我的30W只剩5W多了，大家叫我情何以堪？唉，老,33097,64,279,3.5,2016-01-12 13:23:31
股民发造谣贴“能空仓就空仓”被罚15万,9267,14,494,3.0,2016-01-12 18:09:34
明后天的走势预估！,73272,137,577,4.0,2016-01-06 20:18:34
大盘走势馨馨的拙见！十字星，这是止跌的信号！,5296,12,491,2.5,2016-01-12 17:27:37
28岁女孩与58岁男人的经典对白，感动!（今晚不开,22960,39,1233,3.5,2015-12-11 20:31:05
3000点吹弹可破  双筑底反弹一触即发 明日大盘,10080,11,2371,2.5,2016-01-11 20:53:27
又见深V，又现牛股（附股）,24993,97,760,3.5,2016-01-08 17:49:43
中国中车转型首秀：44亿入股险企布局金融业,110640,67,1605,0.0,2016-01-11 02:44:00
再求下联：利好多，跌的多，跌到中车变灵车,15348,41,150,3.5,2015-12-29 20:31:25
警告：中国中车必将先于大盘上涨！,7412,6,137,4.0,2016-01-11 17:06:15
亏损一千六百万，迎接阳光跳下去，不连累家人了,18800,38,136,3.0,2016-01-11 12:24:10
10.6清仓，亏29万，我在8元等你！,13371,25,148,3.0,2016-01-08 21:22:07
相信我  这是黎明前最黑暗的时刻,10210,52,4191,3.0,2016-01-07 17:00:20
601766:中国中车收购资产公告,120993,56,1979,0.0,2016-01-08 19:00:38
天大利好，中车分拆南北车,12854,8,132,3.5,2016-01-09 18:29:01
中国中车斥资44.55亿购得中华联合保险13.06%股,57061,30,525,0.0,2016-01-08 20:55:11
扫货600421杨帆股份，将第五次举牌  中天集团决,14803,49,205,3.5,2015-10-22 13:43:08
还有35元以上的吗？好冷阿[大笑][大笑][大笑][,8354,14,163,3.5,2016-01-07 15:09:54
中国中车44.55亿元竞得中华联合保险20亿股股权,30014,13,419,0.0,2016-01-08 22:54:32
日后A股市场走出慢牛，大家可以把悬着的心放一,26951,63,1080,3.0,2016-01-05 11:30:05
中信一帆 股市实时解析下午场,5996,12,284,2.5,2016-01-08 13:18:28
奇怪，我的帖子哪里去了,18211,41,170,4.0,2016-01-07 13:19:14
熔断机制实施，可能带来哪些影响,35126,74,446,4.0,2016-01-04 15:53:54
老子亏了20万，割肉走人，好好上班，善待家人，,13193,21,206,3.5,2016-01-05 10:00:44
难道神车又准备再次启动了？,10830,18,125,3.5,2016-01-06 18:48:47
筑底加速 深蹲布局待反弹,14205,59,529,3.5,2016-01-06 13:23:12
少说多做！,175279,173,450,4.0,2016-01-05 15:57:59
近两月拿下逾400亿元大单,22861,17,776,0.0,2015-12-30 03:17:59
终于清仓中车，再碰剁手！,4144,8,134,3.5,2015-12-25 09:36:40
中国中车：受今日熔断的冲击，中车走势分析,15924,51,285,3.0,2016-01-07 15:43:18
过去8年2桶油熊霸全球，今后7、8年必然由车和铁,6923,24,166,4.0,2015-12-11 08:42:01
1-7  写在熔断机制再次生效的今天：股民朋友你,5367,13,1199,3.0,2016-01-07 17:19:36
明后天有望出现连续反弹！,52189,76,201,4.0,2016-01-05 10:25:29
今日的熔断机制有导致踩踏的嫌疑,7154,20,644,4.0,2016-01-04 15:46:21
图解：央企重组风刮起 下一个会是谁？,175250,114,2285,0.0,2015-12-14 19:35:33
1月7日周四高抛低吸点位预测，操盘建议,9471,16,3043,4.0,2016-01-06 17:14:11
开贴—中车走势分析（个人观点）,12654,38,301,3.0,2015-12-22 11:29:33
开贴-中车今日分析,7865,16,198,3.0,2016-01-05 10:11:42
中国制造2025之高铁：中国高铁“走出去” 迎爆,36309,23,2904,0.0,2015-12-31 03:41:32
中国中车(601766)融资融券信息(01-05),12105,7,538,0.0,2016-01-06 07:38:55
我需要四个涨停板解套！你们呢？,3784,20,140,3.5,2016-01-06 12:10:10
开贴！看大盘，论中车！盘点过去的一周！,9959,10,632,4.0,2015-10-17 09:43:30
中国中车是中央一级央企。中国高铁技术是我们国,132183,251,251,4.0,2016-01-01 20:14:40
试验成功,8677,23,118,2.5,2016-01-04 13:15:53
正式开始熔断！,69440,60,187,4.0,2016-01-04 13:16:15
“一带一路”走进实质操作阶段 两条主线掘金(附,109643,89,2076,0.0,2016-01-03 10:41:56
开门触熔断是危还是机？大盘再度下探会随时出现,5426,69,628,3.0,2016-01-05 14:04:21
