标题,帖子数,日期,情感
你慢慢的跌 把价值投资套的牢牢，哈哈,7649,10,2017-03-09 11:27:28,0.9674794405345288
中国平安五十元上方应该会在春节后轻松达到！本,14243,13,2016-12-11 22:57:23,0.5628708793764579
万花丛中一点红—深度解析中国平安大健康产业,13661,1,2017-03-10 17:29:51,0.9951302814720826
欢迎大家点评 1，美联储12月联席会议必然加息！,18967,79,2015-10-22 13:34:13,0.04067214536785446
中国平安(601318)大宗交易数据一览(03-03),21577,8,2017-03-03 18:12:14,0.1878547976906606
证监会应该调查平安的内幕交易哦,12181,29,2017-03-02 10:50:57,0.11909307273419156
详解巴菲特2017股东信，跟着股神轻松跑赢市场,16814,12,2017-03-02 08:45:32,0.9997567190349685
多空博弈机会来 狂人预测挖金矿,26615,32,2017-01-22 15:00:32,0.9761235170221104
平安正引领大盘步入慢牛！,5207,4,2017-02-23 11:47:19,0.6631596256778399
陆金所累计交易量突破6万亿夯实风控带来的流量,15378,4,2017-02-27 11:57:09,0.7860024433682316
套了我四只股票想官司都没处去说理套的太高了！,10553,15,2017-02-24 17:16:06,0.5021822749852275
中国平安开门红暴增73%，意味着什么,29601,5,2017-02-18 13:12:35,0.7068307885242653
给平安管理层的倡议---回购,9870,18,2016-09-06 06:57:58,0.02251577809485117
护盘工具,3009,16,2017-01-16 14:28:53,0.6975104698406057
坚持价值投资，勿选中国平安！,48768,88,2017-02-09 09:51:03,0.8456509018395366
中国平安首月平安财险原保费收入约237.17亿元,28908,9,2017-02-14 18:17:39,0.5413640562885497
欺天业绩１月保费收入增长３４%,11978,20,2017-02-14 21:02:05,0.9988265187343045
有3倍涨幅、即将停牌的超小市值明确卖壳的重组,8513,18,2017-02-05 09:27:44,0.22706829220339264
麦格理:中国平安目标价升至62港元 评级“跑赢大,12577,6,2017-02-14 09:59:33,0.37969380648787077
进场:“一网三化”混改和国资改革的双重受益股,4915,4,2017-02-08 08:19:05,0.9869235979446327
坚持价值投资，首选德国平安！,39121,70,2017-01-19 10:58:25,0.9989325271027089
坚持价值投资，首选法国平安！,46799,70,2017-02-06 10:23:01,0.9957143080453787
坚持价值投资，首选美国平安！,39867,70,2017-02-05 12:51:06,0.99707073534622
我爱平安背后的神秘...,9885,13,2017-02-03 13:31:00,0.9629139588533815
601318:中国平安办公地址变更公告,49150,9,2017-02-07 19:12:12,0.3090890284933119
从量能看平安,6522,2,2017-02-07 11:35:02,0.20417451459866265
中国平安，百花残来我花开，凭啥？,16019,9,2017-02-01 11:08:30,0.09524044984567714
现在留下的，大都是平安的坚定持股者，任机构震,12667,14,2017-01-25 14:11:46,0.30625823517498274
进场:地方国企二线蓝筹股---跨年行情热点,6128,4,2016-12-18 10:36:29,0.8644026785794174
熊市阶段的每一次反弹都要想方设法将筹码交给别,94175,59,2015-09-18 10:40:31,0.9397115173265013
我持有中国平安打新股,21455,33,2016-12-05 17:29:17,0.16158829637974903
人生有多少个十年可以折腾呢？,6955,15,2017-01-08 08:28:26,0.761703831486532
本人郑重宣布，平保冲击突破37.5这个长达16个月,9384,18,2016-12-09 10:09:31,0.6550743494713714
快点买吧，36以下机会不多了,13711,14,2017-01-17 13:21:07,0.683008373350678
回看好平保之股友，非常赞同您们的观点，本人—,8643,18,2016-12-11 18:48:28,0.9149184723209869
四唱雄鸡翻白肚皮！,4870,22,2017-01-04 12:33:34,0.9618561846724899
今天买进的明天能获利了结吗？,2127,0,2017-01-16 14:52:30,0.10088417955800033
放量创新低后，可不可以去抄底？       周一早,8049,4,2017-01-16 15:55:53,0.1480458651691302
股市又一次崩盘了！,9466,0,2017-01-16 15:56:10,0.8673360477029417
601318:中国平安保费收入公告,75169,12,2017-01-13 16:27:55,0.8884804714545186
601318:中国平安关于平安信托披露2016年度未经,56768,12,2017-01-12 18:17:36,0.14347169944580884
601318:中国平安保费收入公告,67310,13,2016-12-13 16:36:08,0.8884804714545186
花旗:重申对内险股反弹看法 首选中国平安中国人,17517,4,2017-01-12 15:19:28,0.9708729332722047
这两年买平安的应该都赚钱了，之前在08年高处买,5375,7,2017-01-12 13:03:30,0.2378150927116487
$中国平安(SH601318)$ 陆金所2015年交易量1.8万,8935,3,2017-01-05 16:14:39,0.8461405430697161
投资保险公司：买入睡觉，醒来数钱？,16139,9,2016-12-21 13:32:14,0.8949928757987227
只要跌就进,1555,2,2016-12-20 11:09:43,0.12408900940809242
中国平安：请不要再诱多了！,14868,21,2016-12-27 11:04:17,0.5089125873205793
天灵灵地灵灵平安是个神马东西？,84768,548,2016-11-10 11:10:46,0.3737846294444327
海南岛2019是不是潜伏特务？,4153,32,2017-01-05 09:41:33,0.2778923966237338
35元以下的中国平安，大胆买入,15894,10,2016-10-31 13:45:34,0.6911351299753562
过年翻两倍妖股行情，大牛胚子啊，好行情龙头带,17963,32,2016-12-11 12:08:34,0.992798638260221
趋势涨停战法:中科电气复制5月18号走势短线翻倍,16221,38,2016-11-27 10:08:11,0.9022963232745675
平安银行：中国平安所持22.87亿限售股将于9日起,29071,23,2017-01-04 22:30:01,0.005615247033764037
平安再启动时，别弄丢了你的筹码,33033,52,2016-08-19 10:55:36,0.043574691216565764
亲身体验——平安互联网金融,9882,9,2016-05-30 11:08:16,0.9903913773715939
希望吧友们一起将在本吧里恶意中伤、污语连篇的,9319,38,2016-12-06 11:13:51,0.9332553448672259
平安即将逆转向上突破，长牛可期！,29179,31,2016-03-09 13:42:00,0.994929803969249
这些天，平安在等什么？,6752,8,2015-11-25 16:02:40,0.13679429118526265
看尾盘10分钟的决斗！,9656,13,2015-09-01 15:04:41,0.09940262237073871
宜将剩勇追穷寇，不可沽名学霸王,11139,22,2016-08-09 13:27:31,0.9949277855654427
让共创平安股吧良好氛围,6273,12,2016-06-20 11:00:49,0.2470000002888869
2016.7.27,记住这个日子,17512,22,2016-07-27 15:15:18,0.5
从8月月底开始，平安主升浪即将开始,18964,24,2016-08-23 11:47:31,0.5495315597731757
兹建议：新股上市10日之内，每日施行上熔断！兹,1723,12,2016-12-27 19:28:59,0.516705927677463
平安走成这样小散看戏就行，该急的是手中一大把,2786,14,2017-01-04 13:56:23,0.8798395822442044
股价每年底部抬升20%，中国平安靠的是什么？,11827,9,2016-12-10 16:42:42,0.2848724616651781
中国平安：新业务价值增速爆表,16951,11,2015-08-21 09:18:48,0.2158251392866306
但斌今天谈中国平安,13169,13,2015-08-23 12:13:41,0.31297308176735406
看看美国的股票你们就知道该买什么股票了,19815,39,2015-12-04 13:24:06,0.9598553112786193
现起至未来三年、其下多个子公司将成功上市、各,15366,15,2016-08-15 23:05:00,0.882991067061823
中国平安必将成世界第一投行,9229,6,2016-10-24 16:47:43,0.9875550580074727
平安的业绩级别是世界级的，新业务价值同比增长,9452,12,2016-10-27 20:01:05,0.913298857234457
花旗：内险股估值已处历史低位首选中国平安及国,26894,9,2016-11-21 15:29:40,0.9768172666079762
平安目标价为何一夜被调高24%,20997,7,2016-09-28 08:18:35,0.5270197589824857
中国平安称价值被低估45%重估要走科网的路,35742,29,2016-12-09 20:57:21,0.5064362213156405
投资中国平安的六大理由,47211,57,2016-11-13 10:46:29,0.5963370334570051
从年K线看平安,54627,98,2016-10-18 14:01:57,0.29641559302143194
平安三季度基金仓位变化与股价分析,23617,37,2016-10-27 11:21:12,0.9849183944208769
又到山花烂漫时,10667,9,2016-04-22 15:50:18,0.4489183321464677
同股同权，究竟谁在肆无忌惮的扭曲价值投资？,18979,21,2016-12-14 15:35:42,0.8360072773156252
无题,13338,17,2016-12-12 15:00:49,0.5
股海20年感悟,19096,34,2016-10-27 14:01:53,0.8187313157838239
基金经理们在跟国家队唱对手戏吗？,20244,24,2016-09-01 11:24:19,0.8524299388939198
海南岛2018嘴比屁股大啊[牛],3939,18,2016-12-27 10:35:43,0.4317972743654509
中国平安(601318)大宗交易数据一览(12-28),13856,7,2016-12-28 18:34:35,0.1878547976906606
今日证指数弱市震荡调整，全天波动的幅度只有14,4154,9,2016-12-27 17:25:17,0.6949525523591722
国家队入场了吗,4163,18,2016-12-26 11:03:30,0.4737672181921908
601318:中国平安H股公告(董事会召开日期),56928,6,2016-12-23 19:23:21,0.08509501040256562
有谁比我高，37买，不知何时才解套,10637,26,2016-12-19 14:11:52,0.8443432376522967
中国平安(601318)大宗交易数据一览(12-19),19241,10,2016-12-19 18:11:32,0.1878547976906606
日K线看平安,15828,20,2016-12-05 11:29:59,0.16489730554220172
此时的中国平安符合戴维斯双击标准,25030,33,2016-11-23 18:47:37,0.677414319347034
中国平安(601318)高管持股变动信息(12-9),20586,11,2016-12-12 20:44:56,0.12769219291535705
601318:中国平安保费收入公告,51873,6,2016-11-14 18:50:21,0.8884804714545186
中国平安四家子公司前11个月原保费收入合计4276,19949,13,2016-12-13 18:40:45,0.6502915892385196
中国平安：已部署应对利率下降寿险 未来可释放,22733,8,2016-12-09 16:14:27,0.9029389700255179
中国平安管理层终于开始为维护自己股价采取实际,18685,16,2016-12-09 20:18:46,0.5553749664785324
拓展主业务风光独好 冲刺黑科技金光灿烂（共享,17665,35,2016-11-01 16:59:17,0.999918758421631
中国平安：大象起舞处处动人？,15628,15,2016-07-19 08:53:36,0.961987399342093
地王与举牌,8668,9,2016-11-29 11:31:02,0.7269486531855583
陆金所上市对公司发展将起到什么样的作用？,10189,6,2016-11-30 20:18:49,0.9775528903765236
马上起飞,抢入,将快速到85元,14507,18,2016-11-14 22:02:40,0.5155016601368635
36.5全部卖完。谢谢机构给我卖了个好价格,12669,29,2016-11-25 10:32:31,0.5659307975685726
加油！,3321,17,2016-11-24 13:28:17,0.9047619047619047
又冲高回落，又是令人极度失望，又是齐声唾骂中,8040,9,2016-11-11 14:55:19,0.04621808618450063
中国平安(601318)融资融券信息(11-21),3992,5,2016-11-22 07:44:05,0.74705791977755
中央证金，中央汇金三季度共减持中国平安5.24亿,14813,15,2016-10-26 22:20:02,0.08607462245176645
小提示,9579,23,2016-11-06 22:47:36,0.5
平保子公司首十个月合同保费收入增21％,15855,7,2016-11-14 19:54:48,0.6833624610832327
中国平安2015年三季报[震撼超极][点击查看原文],17967,7,2015-10-18 11:09:31,0.39704356523709716
防剁手？中国平安子公司平安银行停发三季度奖,22282,9,2016-11-14 10:24:50,0.3320404547398781
四两拨千斤,该股走势表明证监会的态度,8078,7,2016-10-31 07:28:36,0.5
东阿阿胶、平安低估值高成长,18354,18,2016-10-12 06:22:11,0.919597624497392
美帝创历史新高了~平安何去何从？A股呢？,4431,12,2016-11-11 07:55:34,0.6153848310689309
中国平安今日超大单流入排名第8名(11-09),7142,5,2016-11-09 16:08:37,0.6195264694249891
大闹楚天,4041,13,2016-11-02 15:20:05,0.6735827053738707
大和：中国平安前九月已实现全年盈测96%目标价,11328,3,2016-11-01 10:30:50,0.8464659374060606
大和升平保H股目标价至56元 料明年下半年或要集,13720,7,2016-11-01 12:20:13,0.9435393163313501
去年以来卖出超10亿股 业绩靓丽的中国平安为何,12830,14,2016-10-31 13:56:06,0.8958305467836247
寿险新业务价值保持高增长,28670,4,2016-10-31 17:18:53,0.9254567763216995
中国平安2016年三季报点评：投资亮眼，互金业务,41086,4,2016-10-30 13:15:38,0.427898162851298
瑞信：中国平安前九月业绩强劲目标价升至51.8元,15456,6,2016-10-28 12:29:51,0.9941359556609918
平安到底栖息多少金融大佬？王开国朱玉辰齐齐加,21907,6,2016-10-28 22:55:54,0.9991921406397409
业绩逆势保持高速增长,35148,4,2016-10-28 15:19:04,0.9444394505534476
中国平安季报解读：奔跑中的大象,9757,2,2016-10-28 11:48:15,0.995899743059737
业绩稳健，多管齐下,18426,4,2016-10-28 14:42:57,0.7085923308003611
中国平安会计估计变更致前三季利润减少172.35亿,20983,7,2016-10-27 22:46:52,0.9601942322312589
抛！供给侧改革消产能去库存势必增金融业呆坏帐,36964,56,2016-01-12 10:13:04,0.6610913082045508
中国平安猖狂坑害股市，所向披靡无人敢敌！,8766,20,2015-09-30 11:03:03,0.6322748731122603
平安三季报预测,27586,19,2016-10-14 14:42:08,0.566250095834921
601318:中国平安2016年第三季度报告,39357,18,2016-10-27 20:32:33,0.5307600075036433
我在平安工作,16005,16,2016-10-16 12:38:54,0.2536073848526844
中国平安三季度归属于母公司股东的净利润同比增,17787,10,2016-10-27 20:17:34,0.7626436646954444
中国平安首9个月多赚17%至565亿人民币,8917,3,2016-10-27 20:43:36,0.3750082271533478
601318:中国平安:普华永道中天会计师事务所(特,14904,3,2016-10-27 20:33:04,0.023195208677944
今天买了点中国平安，不知明天公布的三季报咋样,13882,18,2016-10-26 18:06:37,0.0023669957899448146
我2007年140元投资平安，已经过去十年，依然亏,12377,28,2016-07-12 10:13:03,0.2485387325831674
中国最臭的癌股——中国平安,6664,9,2016-10-17 15:48:39,0.10876544964325041
撑死胆大的，饿死胆小的,150079,1597,2016-05-02 18:10:59,0.40713331428382027
中国平安保险业务负责人：公司股票被低估最多45,24124,11,2016-10-25 15:26:15,0.17533337970928287
买中国平安必须明白的九个问题,12591,5,2016-10-26 09:07:14,0.5560016667362391
价值投资无疑是对的，但是,18304,18,2016-10-19 07:55:02,0.956402082526282
此股必成妖  什么时候成妖  认真看  仔细想  高,15550,11,2016-02-02 14:12:35,0.9751236610781946
今天平安又要进行丑恶表演了，丑陋的601318,6108,9,2016-10-19 07:40:14,0.7896569834404512
[大笑][大笑][大笑]沃尔核材的畜生周和平从14年,4346,3,2016-10-21 00:36:27,0.9070365620846897
中国平安：平安银行前三季净利增长5.52%至187.1,26710,6,2016-10-20 20:42:55,0.28154802416554625
601318:中国平安保费收入公告,46472,9,2016-10-17 19:20:34,0.8884804714545186
9月保费收入点评：寿险快速增长，财险稳步跟进,36927,2,2016-10-19 18:22:24,0.8912703599211356
中国平安(601318)大宗交易数据一览(10-13),14042,5,2016-10-13 18:12:09,0.1878547976906606
中国平安(601318)大宗交易数据一览(10-18),14214,5,2016-10-18 18:47:50,0.1878547976906606
中国平安前9月平安财险原保费收入约1274.27亿元,16820,3,2016-10-17 19:30:28,0.2995800525281931
601318:中国平安保费收入公告,56253,17,2016-09-14 19:04:59,0.8884804714545186
中国平安今日超大单流出排名第1名(10-11),12331,7,2016-10-11 16:08:12,0.19221690408026804
摩通：内地寿险股评级及目标价,20450,8,2016-10-11 13:34:07,0.9032689578909908
他妈的中国烂股市，永远都是垃圾股暴涨，,3741,8,2016-10-12 13:25:31,0.11432360023686516
中国平安估值被低估 国际研究机构称“出现最佳,30430,12,2016-10-08 03:44:43,0.8348102241073247
中国平安将迎37%的上涨空间？寿险+互金+综金估,32993,16,2016-09-30 06:42:10,0.06437014808732433
中国平安开市前有一宗大手成交 涉资2,590.8万元,17813,8,2016-09-29 09:56:57,0.47100456020746617
中国平安(601318)大宗交易数据一览(09-28),13539,2,2016-09-28 18:07:26,0.1878547976906606
深度分析,8044,7,2016-09-24 14:44:06,0.899541226889163
传平安陆金所正商洽香港IPO 估值或超2000亿?,31464,15,2016-09-23 16:55:56,0.8860049494656599
中国平安，价值重估刚刚开始？,27888,5,2016-09-20 11:31:17,0.3546295624354947
以价值投资眼光看中国平安。,99277,74,2016-01-18 17:23:54,0.949788181072932
中国平安今日超大单流出排名第2名(09-21),5011,6,2016-09-21 16:05:51,0.1948050785429395
中国平安(601318)大宗交易数据一览(09-20),14270,4,2016-09-20 18:27:15,0.1878547976906606
汇丰取消中国平安综合金融估值折价,13241,5,2016-09-20 03:54:31,0.4057416299848092
中国平安四家子公司前8个月原保费收入合计3228,21781,8,2016-09-14 21:21:58,0.803215593866408
最让我后悔的是买了平安，这烂股把我牢牢的困死,15929,12,2016-09-15 17:28:55,0.010712797113422101
平安股价多年不涨的真实原因：核心员工持股计划,18412,12,2016-06-30 10:32:38,0.5440855842614171
想问下，今年到现在炒股有正收益的吗？除了中签,12041,17,2016-09-10 20:33:01,0.31164961119122747
丢人,8396,12,2016-09-07 11:15:19,0.09090909090909094
中国平安有一宗大手成交 涉资2332.8万元,13252,4,2016-09-08 11:25:36,0.7971888517645601
42的本，不知道啥时候能回,9213,12,2016-09-06 13:38:33,0.4252474950102447
中国有股市以来、本次才是真正、进入大蓝筹时代,11765,10,2016-08-15 19:34:54,0.9954911643515573
中国平安有3宗大手成交 涉资1.15亿元,23987,4,2016-09-06 17:57:44,0.6792426822245644
东方财富最后一贴发在中国平安．,8150,10,2016-07-13 13:59:33,0.58350669295564
除开一笔股权转让获利71亿元，上半年平安业绩增,15322,32,2016-09-03 17:06:53,0.6581376579356089
去年高位买的,既然赚钱了,11003,5,2016-09-03 19:47:22,0.8050314766020896
中国平安定会翻番,11276,11,2016-09-01 15:29:38,0.17429200861763217
601318:中国平安2016年中期分红派息实施公告,121355,11,2016-08-26 19:59:09,0.8038595124115115
中国平安中报解读：九个关注点,20365,15,2016-09-01 08:19:30,0.9428792868443591
中国平安今日超大单流出排名第8名(08-30),5621,4,2016-08-30 16:08:32,0.2893063006020339
证券时报记者曾炎鑫妖言惑众，破坏金融市场稳定,12580,14,2016-08-25 04:47:39,0.9994468119056878
半年报点评：主业稳健，互联网战略逐步推行,34870,4,2016-08-24 12:17:04,0.8855197007983077
印度老板密会马明哲:只为一件事,28686,5,2016-08-22 18:13:12,0.6838709126932159
上半年多亏了一次股权转让 但利率下行趋势让中,13212,12,2016-08-22 15:12:24,0.2815952069695713
慢牛已开启越跌越买！,17407,369,2016-08-18 21:05:00,0.41679989952458285
首席投资官陈德贤：中国平安如何破局“资产荒”,17839,4,2016-08-20 03:04:36,0.9654076029878964
半年报点评：寿险新业务价值增长依旧迅猛，净投,30991,4,2016-08-18 14:28:39,0.8626120485186098
投资保险股，更需看重新业务？,8673,4,2016-08-19 20:51:10,0.608080836212236
中国平安VS兴业银行，谁更好？,22306,10,2016-08-19 14:39:58,0.6545711687530222
中国平安：业绩一枝独秀,15679,9,2016-08-19 08:59:22,0.634313528234026
马明哲详解平安“四大生态圈”,20153,7,2016-08-19 06:32:36,0.20085809973436564
平安中报解读，鸡蛋里挑骨头？,22051,14,2016-08-18 08:33:46,0.12437426366991067
打新门票中国平安业绩逆势增长17.7%的秘密,7575,20,2016-08-18 06:03:23,0.9980410547175518
个险增长引领行业，但投资收益率下行,21717,4,2016-08-18 09:47:47,0.9860918922619699
中国平安中报：水击三千鹏飞有日,20127,13,2016-08-17 21:20:01,0.9440621893566071
中国平安上半年净利增长17.7%,8491,5,2016-08-18 03:32:26,0.7376633734597637
601318:中国平安2016年半年度报告摘要,38171,15,2016-08-17 19:55:35,0.6320634044985687
中国平安上半年净利润407亿元 同比增长17.7%,15921,11,2016-08-18 05:42:59,0.6831559536379844
中国平安互金业务首度盈利 上半年贡献利润71.42,13138,5,2016-08-18 04:09:38,0.18715676324945174
中国平安(601318)融资融券信息(08-17),3676,4,2016-08-18 07:42:52,0.74705791977755
601318:中国平安2016年半年度报告,39814,7,2016-08-17 19:55:37,0.3887651933765778
中国平安上半年净利润408亿，同比增加17%多！,14311,10,2016-08-17 18:00:03,0.6544671487622075
保险股：牛市双击，熊市双杀,11263,3,2016-08-15 09:08:11,0.8120417567267181
601318:中国平安保费收入公告,51945,12,2016-08-12 18:48:53,0.8884804714545186
中国平安今日超大单流出排名第7名(08-11),7219,5,2016-08-11 16:07:39,0.2876933879675001
601318:平安银行股份有限公司2016年半年度报告,30981,4,2016-08-11 18:52:42,0.20871873365064075
中国平安(601318)融资融券信息(08-11),4149,4,2016-08-12 07:39:29,0.74705791977755
大家猜猜看，601318几时可上40元，是一年？一个,7801,13,2016-08-10 17:23:53,0.18078993692960355
中国平安(601318)融资融券信息(08-10),3828,3,2016-08-11 07:43:02,0.74705791977755
中国平安(601318)大宗交易数据一览(08-09),15517,5,2016-08-09 18:50:34,0.1878547976906606
中国平安(601318)融资融券信息(08-09),4177,4,2016-08-10 07:42:12,0.74705791977755
中国平安(601318)融资融券信息(08-08),4041,4,2016-08-09 07:44:27,0.74705791977755
中国平安今日超大单流出排名第6名(08-08),5534,4,2016-08-08 16:08:39,0.238494215878577
中国平安旗下平安证券上半年客户数首进前四,23032,8,2016-08-06 09:41:08,0.17201091019316572
中国平安人事变动图谱：银行高管相对稳定 互金,26661,15,2016-08-04 17:28:39,0.36225114357224253
判断：肯定又暴跌收大阴线无疑了一一一一一一一,13133,53,2015-11-16 09:55:52,0.8997457304237786
***判断：今天尾盘肯定又是暴跌收大阴线啦呀 尾,10930,23,2015-10-30 14:07:12,0.04141109342781124
肯定又崩盘啦 崩盘了 跌停无疑啦 !!!!!!!!!!!!!,16053,67,2016-01-05 09:04:45,0.21281099087268418
中国平安(601318)融资融券信息(08-03),4013,5,2016-08-04 07:42:46,0.74705791977755
中国平安(601318)融资融券信息(08-02),4900,5,2016-08-03 07:44:21,0.74705791977755
险企并购成功案例：中国平安收购深发展,25871,8,2016-08-03 07:45:33,0.9979349441860379
预测下平安半年报,11054,13,2016-08-01 08:53:58,0.6813170551166723
平安股价一年涨6元,5080,8,2016-06-27 11:52:44,0.34372315750048077
中国平安(601318)大宗交易数据一览(08-01),15306,8,2016-08-01 17:44:58,0.1878547976906606
股债双杀，投资欧洲失败，平安中期亏损217亿,5682,6,2016-07-29 10:16:41,0.599845554128866
【讨论】中国平安尾盘突遭拉升的原因是？,25577,11,2016-07-27 16:18:00,0.17848069692710844
供给侧水泥板块年收入超高将轮动为市场热点,33329,57,2016-03-19 09:36:10,0.9595835213822098
保险业务优于同业，综合金融优势明显,63657,12,2016-07-10 14:46:44,0.9845272476016845
平安高层正在利用一系列令人眼花缭乱的资本运作,11661,36,2016-07-22 09:35:48,0.9928181249052555
中国平安(601318)大宗交易数据一览(02-02),34816,16,2016-02-02 18:40:22,0.1878547976906606
迅猛布局黑科技产业链仅此一家 将成黑科技巨头,56949,118,2016-04-26 17:58:46,0.8120737468026509
中国平安海外急难救援服务应对台湾车祸,18759,5,2016-07-19 23:18:16,0.9976160325048846
中国平安(601318)大宗交易数据一览(01-19),38486,15,2016-01-19 17:59:40,0.1878547976906606
3只个股大宗交易超5000万元,33122,12,2015-10-22 09:50:43,0.1142010147222483
有个傻逼专家给我推荐中国平安，被我一句草泥马,11081,10,2016-07-08 14:04:28,0.8978267808994012
中国平安：大象起舞处处动人？,11387,10,2016-07-18 19:37:40,0.961987399342093
中国平安(601318)大宗交易数据一览(01-08),31257,9,2016-01-08 17:49:42,0.1878547976906606
中国平安(601318)大宗交易数据一览(04-19),26622,14,2016-04-19 18:09:33,0.1878547976906606
601318:中国平安关于平安信托披露2016年上半年,39760,6,2016-07-14 16:44:22,0.588274223448829
601318:中国平安保费收入公告,44266,16,2016-07-14 16:38:31,0.8884804714545186
601318:中国平安:平安信托2016年上半年度未经审,35119,4,2016-07-14 16:38:32,0.01447176701911923
喔价必减半2020年人口达顶峰14.5亿 之后减到10,73758,52,2015-09-11 21:57:46,0.6015133733399551
2015年入口数剧严重糙假！0.4亿佬人返老还童 20,15261,29,2016-05-29 20:26:51,0.8588317704717902
中国平安(601318)融资融券信息(07-05),5289,3,2016-07-06 08:05:04,0.74705791977755
阿弥托福，感动中国,24513,9,2015-09-04 14:30:20,0.9518951853697026
601318:中国平安2015年度分红派息实施公告,114268,11,2016-06-27 18:24:50,0.48291951556575585
盈利表现靓丽，业务持续稳健增长,80879,14,2016-05-06 09:32:22,0.9891593163225304
A股中中国平安最保险，绝非千般拉高为出货,15706,21,2016-06-16 16:10:10,0.18424808658607195
中国平安初探及2015年度股东大会见闻,10291,6,2016-06-23 10:12:56,0.9773463270889521
不要参与任何指标股的交易,47090,155,2016-02-25 14:24:29,0.8514906170178485
601318:中国平安保费收入公告,45397,14,2016-06-13 16:20:18,0.8884804714545186
你怎么办？领先于别人一周上涨,7970,10,2016-05-31 11:55:01,0.17571954506285437
平安好医生五亿美元融资 互联网医疗的重资产时,22047,6,2016-06-04 13:34:31,0.9626938524169664
要相信中国平安！,19742,22,2015-08-23 11:29:22,0.4163463798523914
中国平安利润增长低于平安银行，PE,PB都大大高,15726,25,2016-04-26 20:04:13,0.009533048392683763
今年必定是.二.八.行情贯穿全年,19778,56,2016-04-27 18:36:54,0.9962350731323406
中国平安,近期逆势上涨,下周估计会这样!,33303,653,2016-05-13 17:10:24,0.4163463798523914
河北信盈长大6个月天天分批天天买进中国平安,13527,16,2016-04-14 08:02:43,0.9743697379675237
平安如没有果家队护盘艹纵，20元也没人看,11122,71,2016-05-20 08:58:36,0.11741156698210531
拟孵化第二个子公司独立上市 中国平安尾盘大幅,19154,11,2016-05-19 15:36:39,0.03892750644795229
PE在60倍以上的股票大家要坚决清仓买进业绩好的,4063,9,2016-05-11 11:10:19,0.15843118990620353
善意提醒不懂股票的这些傻子们不论是大盘股还是,79885,119,2016-02-05 09:22:54,0.15387875404163398
中国平安的护盘行为一定会遭到无耻的失败，平安,6121,27,2016-05-18 13:12:35,0.009880264800039007
