标题,帖子数,日期,情感
上海保交所望于6月成立 多家上市公司或入股,29684,7,2016-05-17 17:11:40,0.24716729611888355
今年A股最大热点就是重组借壳板块:以360为代表,13933,14,2016-04-27 23:53:27,0.2105131322563174
不亚于降杠杆清配资的利空！保监会召开险资风险,20912,21,2015-12-29 13:52:39,0.6039089719221246
中国平安解套策略,4235,11,2016-05-15 17:24:05,0.9130269576167538
601318:中国平安保费收入公告,72105,16,2016-05-13 16:40:30,0.8884804714545186
别买入！耐心等待融资盘被强平爆仓时抄底不迟31,28349,34,2016-01-14 13:30:59,0.24430383339225514
理层放大招，捉妖股！依法治市、严惩操纵 净化,6864,14,2015-10-29 14:03:00,0.3824468387536858
中国平安今日超大单流入排名第1名(05-09),17002,8,2016-05-09 16:05:57,0.48765881393496835
平安季报预测及操作,18892,23,2016-04-26 17:42:21,0.8327528245189583
利空！保监会叫停1年期理财型保险产品 1-3年产,11056,22,2016-03-21 07:26:09,0.4674500481431162
601318 中国平安台与002560通达股份相比谁最大,110166,310,2015-10-09 15:39:09,0.8717306022459408
中国平安今日超大单流出排名第1名(05-03),13697,12,2016-05-03 16:06:53,0.19221690408026804
中国平安一季度净利同比增3.7% 增速大幅回落,14528,9,2016-04-27 06:49:36,0.3756716880681571
平安一季报点评：净利润本该减少,14117,5,2016-04-27 08:57:57,0.0384498361138802
平安一季度快报：净利润200亿 总资产超过5万亿,23347,13,2016-04-26 19:25:17,0.2506422255069124
601318:中国平安2016年第一季度报告,48124,6,2016-04-26 19:26:54,0.7105685132147785
中国平安一季度净利润207亿元同比增长3.7%,16188,6,2016-04-26 19:46:20,0.7823031979226935
中国平安，资本市场下一只大额举牌股（本人所有,75121,50,2015-12-18 15:43:45,0.6288508242214714
中国平安今日超大单流入排名第3名(04-25),8392,9,2016-04-25 16:09:27,0.5562776866160052
置顶关于严厉打击黑嘴5毛第一号令,675565,664,2016-04-09 11:04:40,0.4554603317089976
十六岁开始做股托？[不赞],388850,351,2016-04-13 17:00:23,0.9001867592311789
601318:中国平安:平安银行股份有限公司2016年第,51350,3,2016-04-20 20:02:17,0.14452854140645355
601318:中国平安关于披露平安银行2016年第一季,45984,4,2016-04-20 20:02:16,0.6907853626850915
大宗交易揭秘：成交超18亿 溢价狂扫煤炭股(附表,70552,15,2016-04-19 20:11:45,0.8477439921537281
成交前十遭净卖出1.5亿 本周沪股通净流入83亿,46635,16,2016-04-15 19:44:01,0.8089931061546622
平安16亿元将购入澳洲电信持有汽车之家48%股份,21344,14,2016-04-15 19:03:46,0.08936512207289271
平严重低估的中国股市将会合力拉出一波具特色气,24495,19,2016-01-24 15:41:27,0.9957423499629615
业绩稳健增长，迁徙效果显著,46456,6,2016-04-01 14:10:29,0.983658142140169
601318:中国平安保费收入公告,61677,31,2016-04-14 17:56:29,0.8884804714545186
中国“大而不能倒”险企名单将出炉：平安人保安,25665,7,2016-04-16 07:57:12,0.26129142523094484
澳电抛售汽车之家47.7%股权 中国平安或接手,22919,10,2016-04-15 21:14:15,0.1690288591573803
平安集团将以16亿美元收购汽车之家47.7%股权,23670,10,2016-04-16 13:14:36,0.19830211395010622
沪股通加快“北上”布局节奏 逾17亿元资金加码,110220,89,2016-04-15 00:57:48,0.36052842548530406
成交前十获6亿净买入 沪股通四天净流入80亿,59687,24,2016-04-14 21:02:30,0.9645988305921207
724家上市公司高管涨薪10% 45位年薪超500万,27923,63,2016-03-26 09:29:21,0.36971928447639035
15年7月9日10点左右满仓买进！你有这种魄力么？,13800,28,2016-04-05 22:50:07,0.005663956677989801
快快快！双杰电气300444创业板中反弹最小的超小,5402,15,2016-03-21 13:11:20,0.7994805845145606
中概股回归项目受资金热捧 五险企现身360私有化,33811,15,2016-04-09 09:23:20,0.9651506132557334
中概股回归受资金热捧 五险企现身360私有化财团,103196,87,2016-04-10 03:59:21,0.9581938490843335
公司高管千万年薪几近绝迹,23140,9,2016-04-07 09:01:28,0.0898767271328409
我的粉丝太少了！,9957,29,2015-12-17 12:09:23,0.4782468326420515
1月份熔断一开始就跑路了！看图把！,8377,30,2016-04-05 22:24:11,0.16626106546695574
这是我上周到现在的操作,13982,19,2016-03-22 11:26:22,0.6546207359070487
来来！我又来嗮图！最近收获可以呀！,11939,13,2016-04-01 10:48:05,0.6640876164624228
来大家HI下！这是我几天的操作,4871,9,2016-03-22 11:23:33,0.2652095326930546
2600了！我来接飞刀！,18024,28,2016-01-27 12:23:03,0.369334034025276
2600！我来接飞刀,6863,10,2016-01-27 12:57:47,0.369334034025276
沪股通连续十八日净流入 成交前十遭净卖出2亿,52637,21,2016-04-01 19:53:24,0.7523358872015445
险资为啥现身360私有化财团？投资形势严峻 高收,19071,5,2016-04-07 16:22:12,0.90409205449038
六大上市险企去年净赚超4300亿 险资救市虚晃一,40522,91,2016-04-02 00:57:33,0.9835177253648327
国进民退，,7441,13,2016-04-05 09:20:22,0.2925013150118482
中国平安陈德贤年薪1286万元两市第一高薪,13932,13,2016-03-31 15:31:40,0.5141458984082323
与你相聚中国平安，31.92,12618,12,2016-04-02 15:28:09,0.634313528234026
哈哈，平安吧里5毛特别多！,2734415,2517,2016-03-14 07:33:11,0.6117252833802242
平安首度揭秘准上市平台“大陆金所”：平安净投,27303,9,2016-03-16 21:51:40,0.32338904611440855
中国平安去年净利稳增38% 陆金所P2P交易量涨2倍,18207,5,2016-03-15 21:45:16,0.8974072210978797
两市第一高薪易主 中国平安陈德贤年薪1286万超,16873,35,2016-03-31 03:37:45,0.6967649065252424
幽灵！一个黑色幽灵！一种黑科技将在东方兴起！,10852,31,2016-03-23 23:39:35,0.9520873061104775
保险公司年报PK：中太平成长性好,17104,5,2016-03-30 09:14:56,0.9960568058935734
安心上班，别看股票！,6366,13,2016-03-24 07:51:09,0.7232486752221317
2015年年报点评：承保投资稳健成长，互金业务大,55268,9,2016-03-28 11:32:12,0.9256543760459998
举国欢庆噼里啪啦啪啪啪~~~,30484,137,2016-03-23 06:22:36,0.028041956889676256
601318:中国平安关于2016年度核心人员持股计划,73866,30,2016-03-22 20:07:11,0.19183459779141776
中国平安核心人员持股计划完成股票购买 耗资逾4,26452,11,2016-03-22 21:15:02,0.157649938382305
互联网保险好时代已到来 布局3只个股,51092,9,2016-03-13 07:57:14,0.8018684341521294
互联网保险最好的时代已经到来,41440,9,2016-03-12 10:10:04,0.9770011187910275
【讨论】股神巴菲特看了平安那点事已经哭晕在厕,24612,11,2016-03-25 14:01:54,0.9040418063936497
601318:中国平安关于平安银行非公开发行优先股,48366,12,2016-03-23 17:21:45,0.005361789842900477
价值投资有多难？？？,10781,114,2016-03-20 19:23:25,0.3651876908483058
中国平安 今日操作建议！！！,29637,297,2016-03-15 22:29:11,0.3346084800410343
业绩优异符合预期，互联网金融日趋成熟,50411,6,2016-03-22 08:09:25,0.999961393922992
2015年报点评：乘势而起，业绩喜人 应需而动，,71197,7,2016-03-21 11:43:01,0.35735759669085143
富通宣布对股东进行补偿 中国平安或获偿6000万,18505,19,2016-03-18 16:41:39,0.21156674317967727
富通宣布对股东进行补偿 中国平安或获偿6000万,34444,14,2016-03-18 20:43:06,0.21156674317967727
未来2年，平安有啥隐忧和惊喜？,20999,8,2016-03-18 09:46:54,0.8917324291603487
自从到深圳去开中国平安股东大会，重仓中国平安,183142,207,2015-08-20 07:36:28,0.0951504577301654
2015年报点评：综合金融平台各项业务快速发展，,44843,5,2016-03-17 20:23:41,0.9890890221282734
300元大牛股中国平安,30844,157,2016-02-22 18:29:53,0.10362785484499182
平安回应支援万科传闻：没有这方面信息,51691,21,2015-12-22 08:55:52,0.38151575250965
基金增持券商股 中国平安遭甩卖,21359,19,2016-03-17 07:41:12,0.504775923783185
2015年，平安一切平安——中国平安年报点评,34557,9,2016-03-16 20:40:56,0.023319359799993666
请给我一个持股的理由吧？没有吗？,35983,27,2015-09-11 10:10:20,0.030834663219882485
业绩再创辉煌，综合金融完善,38918,6,2016-03-16 13:17:37,0.9988628847514891
年报点评：保险业务稳健发展，投资收益创近年新,38524,6,2016-03-16 15:56:25,0.9933275000714027
中国平安今日超大单流入排名第1名(03-16),12704,9,2016-03-16 16:07:08,0.48765881393496835
平安年报解读：新业务增长是亮点,17105,5,2016-03-16 09:54:18,0.8384632026723271
【讨论】平安净利润大增，你看好它的未来吗？,32669,21,2016-03-16 10:38:19,0.9628168257419643
跟踪点评：陆金所B轮融资完成，IPO或提速,65172,7,2016-01-20 09:04:28,0.8490311505100937
中国平安2015年净利同比增长38%,10942,13,2016-03-16 02:16:29,0.7352605949376098
中国平安净利润542亿 多家公司发布年报,34640,33,2016-03-15 19:28:23,0.2162104133934264
601318:中国平安2015年年报,74437,25,2016-03-15 18:48:15,0.1794555633920415
首份上市险企年报出炉 中国平安净利润增38%,13513,16,2016-03-16 02:49:36,0.5639987236077927
平安年报猜测：哪项指标会亮眼？,39240,16,2016-03-15 10:27:50,0.8332535928900161
601318:中国平安董事会关于会计估计变更的专项,24140,8,2016-03-15 19:29:08,0.4836254003961383
中国平安净利润同比增长38%  创新业务发展迅速,19041,13,2016-03-15 19:27:22,0.9589310206141691
601318:中国平安关于认购平安银行非公开发行优,58082,14,2016-03-14 19:48:37,0.2066552209543734
为什么你赚不到钱 是因为你不懂得风险控制,18219,118,2016-03-09 22:27:36,0.09581124789672935
中国平安今日超大单流出排名第7名(03-14),8317,8,2016-03-14 16:08:11,0.2876933879675001
中国平安子公司1-2月保费收入1193亿,21515,10,2016-03-14 08:49:22,0.8134951350717353
601318:中国平安关于披露平安银行2015年年度报,61892,10,2016-03-09 18:59:13,0.08645873735642584
601318:中国平安保费收入公告,86405,14,2016-03-11 18:50:54,0.8884804714545186
平安银行利增10.4% 拟10转2派1.53元,41740,17,2016-03-10 08:46:38,0.05242337839385558
资金流向：一枝独秀 银行板块净流入16.04亿(附,14974,8,2016-03-09 21:16:19,0.9880847052252476
持续放量有利于后市继续拉升,43439,658,2016-03-03 15:56:33,0.30685913192962766
首次覆盖研究：构建金融生态圈成效显著 互联网,81430,11,2016-03-07 15:06:41,0.9996971320632977
601318:中国平安H股公告(没收未领取的2009度中,61020,6,2016-03-08 18:59:12,0.01744601240852295
中国平安天天如此砸盘，已经严重威胁到了大盘安,36019,83,2016-01-22 11:54:13,0.9470328484601991
中国平安：欲至14元，先上41元,26974,12,2016-03-05 23:19:42,0.3297273931138238
平安银行---未来目标价,23761,73,2016-02-25 18:01:59,0.887995107479535
【热点追踪】保险股暴涨，背后真相吓你一大跳！,74135,15,2016-03-04 13:35:03,0.7382287515925113
银行等权重股大涨探秘 “未必是国家队出手”,95632,30,2016-03-05 09:29:18,0.6875722902653438
A股入“两会”维稳期 主力疯抢这20股(附表),69068,13,2016-03-04 18:36:31,0.16063835842374397
德银：中国经济料现周期性回升 股市还能再涨（,48633,29,2016-03-03 14:33:48,0.9698906507993638
业绩差的股票永远跑不过业绩好的股票,12105,7,2016-02-29 18:22:47,0.941556139189682
“抄底能手”重出江湖 沪股通44亿抢筹,554656,940,2016-01-28 04:15:23,0.3123342317943394
喔价必折半！独生子女怔憡使人口减到10亿！无人,27734,26,2015-09-26 19:41:24,0.5867178323383424
中国平安今日超大单流入排名第8名(02-29),11016,5,2016-02-29 16:03:50,0.6195264694249891
上海仅25%夫妻打算生二孩！人口危机 喔价必折半,4803,12,2015-11-22 12:21:14,0.9872190070434687
601318:中国平安关于平安银行非公开发行优先股,71154,11,2016-02-26 19:46:39,0.005361789842900477
平安银行非公开发行不超2亿股优先股获核准,25808,6,2016-02-26 16:55:37,0.005444341057787572
险资1月抄底A股逾1000亿 可能已实现浮盈,31723,9,2016-02-25 08:10:33,0.6497929144552393
开门红表现强劲，价值成长领先同业,82498,11,2016-02-23 09:53:18,0.9987358321053964
中国平安子公司1月保费收入893.58亿,41832,10,2016-02-22 08:31:16,0.9694891115779356
年前分析最后一只牛股，不放过了,32615,341,2016-02-02 10:49:18,0.559117174868044
请给我一个持股的理由吧？！跪求！！！,38777,26,2015-09-17 11:37:46,0.0018626511132135981
601318:中国平安保费收入公告,110182,32,2016-02-19 18:14:42,0.8884804714545186
公司跟踪报告：看好健康医疗产业，平安好医生打,50088,14,2015-12-30 17:28:43,0.6100542080377893
基本面强劲，互联网发力,17944,18,2015-08-21 18:38:40,0.9538506099190306
寿险业务表现强劲，内含价值增长稳健,23491,12,2015-08-21 15:55:54,0.9701241882386916
保费高速增长，综金持续发力,16732,7,2015-10-28 21:26:18,0.9022719238403629
传统+互联网迅猛发展，协同效应开始显现,16370,10,2015-10-28 17:13:35,0.9995833037473243
利润加速增长，业务质量稳步提升,17498,12,2015-08-24 13:44:34,0.5245949035260867
协同效应助推未来增长,73819,19,2016-01-21 13:19:45,0.997656539614032
产、寿险经营业绩远好于同业，互联网金融进入加,21643,18,2015-10-29 10:46:40,0.9947352392960767
业绩稳健 股价上升空间巨大,24232,17,2015-10-28 08:22:21,0.8830777250204397
植根保险与个人客户，开启开放式发展新篇章,44340,7,2016-02-05 16:38:01,0.6921590181440946
实践证明市值配售新股是券商的大大利空！打新资,31278,34,2015-11-08 09:08:50,0.8935566102250886
PE在60倍以上的股票大家要坚决清仓买进业绩好的,11860,16,2016-01-24 20:32:48,0.15843118990620353
中国平安没有企稳迹象,42040,335,2016-01-22 13:09:24,0.1763910139694016
三季报点评：保费、投资双向开花，互联网金融崭,8493,6,2015-11-01 10:12:13,0.9925005078896504
平安人寿12亿美元高级债落地,27783,6,2016-01-29 14:58:57,0.6003070037434208
年前扭亏机会在哪里？,135256,169,2016-01-25 16:21:08,0.7945767680112211
601318的老吧友谁还在？报个名吧！,9625,46,2015-08-28 21:15:53,0.7098955163103617
财政部将推第三批PPP示范项目,31041,7,2016-01-26 08:22:32,0.10350092485470075
中国平安，还我血汗钱，37.33成本何时解套,22742,33,2015-11-18 15:18:46,0.6001251564755492
从万科被收购一事来简评中国平安 万科是好公司,32304,22,2015-12-19 21:09:54,0.9258188929576524
2016预测:大盘大C浪调整，上证重回2500下方！新,42446,45,2015-12-31 16:39:52,0.34874744822921844
跌停跌停跌停跌停跌停跌停跌停跌停跌停跌停跌停,9126,22,2015-12-17 14:48:57,0.061576609553166906
看了这组数据，马司机该买块水豆腐撞si。,15537,19,2015-12-30 13:37:25,0.9367927666785075
股市从哪里涨上来的还跌回哪里去的,8052,9,2016-01-16 15:57:09,0.7595471918578307
1.25 优化说明及全面剖析,7457,23,2016-01-24 22:47:43,0.8901750077275132
今天中国平安又创新低！,20486,28,2016-01-21 16:30:23,0.5362617031499656
人社部回应养老金入市时间 哪些个股会入法眼？,288090,334,2016-01-24 02:35:23,0.8209427827740032
价高位出快*转人民币贬值（000983）西山煤电将,176882,194,2015-08-12 13:24:15,0.8152260041317004
券商股获基金增持 银行股被狂抛,80252,39,2016-01-23 09:05:07,0.33497711495469984
红包行情开启,35892,60,2016-01-06 18:56:57,0.7405635760741256
【讨论】高开低走凶狠砸盘 平安已成做空股市的,21319,15,2016-01-22 13:21:45,0.9175092493738223
炒股的挑战,5110,6,2016-01-20 17:12:24,0.5048393571599155
601318:中国平安:平安银行股份有限公司2015年度,91341,19,2016-01-20 18:41:55,0.12176184002756685
601318:中国平安关于平安银行披露2015年度业绩,58434,5,2016-01-20 18:41:55,0.356736633433834
只赚指数不赚钱的行情 是机会还是风险（为啥不,35946,67,2015-11-05 16:50:36,0.1255008960832289
一旦入主重庆金交所传闻属实 平安集团将囊括六,39048,10,2016-01-18 02:12:31,0.01815095571363856
4000点才是A股牛市的开端 2015年04月21日13:44 ,7593,8,2016-01-16 08:59:26,0.4862312221771993
平安套过我四年,15961,23,2016-01-16 23:58:02,0.511032412002712
陆金所完成B轮融资 估值达到185亿美元 ,23109,7,2016-01-18 10:45:45,0.9805185618919959
中国平安今日超大单流入排名第1名(01-15),18605,4,2016-01-15 16:36:01,0.48765881393496835
中国平安2015年保费收入同比增长18%,26252,6,2016-01-15 08:56:59,0.9770151038607465
平安二次押宝金交所,24547,2,2016-01-15 13:48:18,0.6153803443602192
洗完盘之后的大涨这是大家没有想到的问题啊,17239,23,2016-01-13 19:33:18,0.40849884256878777
融慧财经：A股展开反弹 保险股有望走出谷底,10363,8,2016-01-15 13:34:38,0.6700800120086008
601318:中国平安保费收入公告,61415,9,2016-01-14 18:41:34,0.8884804714545186
中国平安(601318)融资融券信息(01-12),9619,5,2016-01-13 07:39:57,0.74705791977755
洗完盘之后的大涨这是大家没有想到的问题啊,24522,28,2015-12-30 11:49:02,0.40849884256878777
明天若顺势低开，则第二个8.25的机会来临！大胆,43107,55,2016-01-07 14:59:35,0.8660966683302547
别为“看上去很美”的制度付惨痛代价,13913,8,2016-01-10 08:51:35,0.8707860486899378
601318:中国平安关于平安银行非公开发行优先股,56191,5,2016-01-08 19:09:29,0.005361789842900477
洗完盘之后的大涨这是大家没有想到的问题啊,20525,18,2015-12-25 12:57:33,0.40849884256878777
融资余额四连降 警惕杠杆“双刃剑”,98610,32,2016-01-08 04:12:17,0.9630668516993531
【热点追踪39期】保险四大天王都脸红了！这意味,26898,4,2016-01-08 13:54:20,0.6204877150701663
平安涨多少？可能跟伯克希尔一样很高130元一股,22095,33,2015-12-23 18:36:32,0.30587224002476
触熔首日融资余额降125亿 融资客逆市布局近百股,125267,26,2016-01-06 02:55:58,0.9549719334477808
马明哲新年内部讲话透露新战略：全面开启平安3.,31254,10,2016-01-04 09:43:04,0.5488642053668077
36的本，有比我的高么？亏的都不敢看了,20170,76,2015-08-18 20:34:16,0.11615171693719584
这种大牛股的特征：题材要找两市具有唯一性和垄,10976,11,2015-12-13 09:27:42,0.7579005688657109
释老毛：价值投资只输时间不输钱,14504,7,2015-12-05 09:31:27,0.8337635925238399
2016年1月2日立帖，2016年大黑马非中国平安莫属,15126,14,2016-01-02 21:53:12,0.2769582971970548
祝福中国平安所有股友新年快乐,5887,3,2016-01-01 00:45:42,0.9626828292066097
晚间影响市场的重要政策消息速递(12/30),121438,41,2015-12-30 20:25:38,0.6471438665927038
凭平安股表现，明年决定不在平安投车保了。,6059,14,2015-12-30 12:13:46,0.2305601418088855
险资举牌太猛 保监会12月29日专门开会防风险,13006,7,2015-12-29 13:14:57,0.24340264291526548
2016年最佳交易策略：抛售人民币 只看好一只A股,93352,25,2015-12-29 13:40:15,0.29283253728229164
中国平安(601318)大宗交易数据一览(12-28),28772,15,2015-12-28 18:16:06,0.1878547976906606
中国平安今日超大单流入排名第3名(12-21),28659,9,2015-12-21 16:08:51,0.5562776866160052
中国平安开启安邦模式，巨资扫货。业绩再次暴发,33678,32,2015-12-24 14:13:56,0.2349169439360077
平安互联网金融高速增长 健康医疗和财富管理“,30061,6,2015-12-15 11:20:16,0.999538163572327
平安普惠的雄心：最大消费金融服务提供者,33719,9,2015-12-16 16:44:08,0.49686950964990506
中国平安斩获“卓越互联网金融平台”等多项大奖,35902,14,2015-12-14 16:54:57,0.7393083254811482
平安多个互联网子公司瞄准上市,37611,8,2015-12-16 15:12:51,0.5678383114913983
601318:中国平安H股公告(董事会召开日期),53837,4,2015-12-24 17:13:21,0.08509501040256562
有人提到伯克希尔我这几天查了美国巴菲特经营的,15820,26,2015-12-06 20:03:40,0.9989801345872857
今天大涨这是大家没有想到的问题啊,3902,12,2015-12-24 08:02:31,0.7473607614555695
科普贴：险资举牌持股20%的好处,23039,7,2015-12-24 09:31:06,0.9808712999805957
中国平安今日超大单流入排名第4名(12-23),23082,4,2015-12-23 16:11:03,0.5775553859354557
现在越来越多的散户明白了买股票就买业绩好的股,30355,34,2015-12-09 08:40:53,0.8353573339986001
今日涨的三个点，明日全部吐回，跌幅五个点以上,13167,19,2015-12-21 15:13:04,0.8250011936543421
中国平安董事长马明哲荣登《财富》2015年度全球,13927,12,2015-12-09 11:11:01,0.83034196305019
12月28日，本人重仓了平安，潜伏了平安，2016年,11746,13,2015-12-20 21:32:33,0.0008082238958161403
建设银行一一流通盘和万科一样大,业绩都很优秀,3316,6,2015-12-02 11:10:08,0.9800733201443125
平安：柏堡龙002776有望成为两市最高分红分配的,10293,10,2015-12-07 10:36:07,0.14402176632631758
流通盘太大了年前下跌到26元去了,4151,11,2015-12-14 02:49:01,0.21450026966067648
平安好医生筹划A轮融资 预估值近40亿美元,27494,4,2015-12-16 02:43:16,0.567192506485071
“三马”排名变化 折射中国平安互联网“价值 ”,34917,9,2015-12-15 01:16:11,0.6090312069809515
跟叔再送一次礼！平安老朋友都会知道！,20308,63,2015-12-04 12:46:26,0.902020485278543
沪深300指数今起调样 中国平安仍为最大权重股,161751,23,2015-12-14 05:49:37,0.5651417838033844
12月14日晚间重要行业研究汇总(附股),165020,27,2015-12-14 15:50:55,0.1496322415586684
利空！放开存款利率浮动上限！必将缩减存贷差减,12515,31,2015-10-23 20:22:39,0.5412920425220163
601318:中国平安保费收入公告,69264,29,2015-12-11 16:44:15,0.8884804714545186
有人全球最赚钱的行业是保险行业最赚钱的股票是,18251,22,2015-12-08 08:29:09,0.8929429330926729
预言：平安10日内见不到35块！,15881,29,2015-12-07 15:00:01,0.006611046540032084
伯克希尔和平安的比较,12652,19,2015-12-08 16:36:24,0.2045996330501284
中国平安：现价买进，十年十倍！,166188,131,2015-09-25 11:59:15,0.6039663157501021
中国平安今日超大单流入排名第12名(12-08),20112,3,2015-12-08 16:09:36,0.4905075573888481
基本面完美 8股不买就赔大了,81035,43,2015-10-15 10:25:01,0.6758661126569472
沪股通资金抄底路线曝光 24股越跌越买,21465,14,2015-12-02 18:11:55,0.7861658874065679
去杠杆剿灭百亿两融规模个股 20只百亿个券仅存2,50685,93,2015-09-11 22:20:45,0.09500436141907298
从券商席位看到有大资金不停的买进我也买进了真,5196,13,2015-12-02 17:57:49,0.6969673841905272
中国平安(601318)融资融券信息(12-02),4142,6,2015-12-03 08:09:39,0.74705791977755
沪港通这一年：蓝筹白马股最受欢迎 85股股价翻,16532,32,2015-11-17 07:43:54,0.3553282037340999
中国平安今日超大单流入排名第5名(12-02),5863,6,2015-12-02 16:02:32,0.6246289993982598
12.1机构荐股一览：5只个股还能涨4成以上！,43136,32,2015-12-01 19:14:52,0.6217543338915933
我今天买进了200万的中国平安,3630,7,2015-12-02 09:52:09,0.3494920339715549
业绩符合预期,29417,21,2015-12-01 15:29:37,0.7894016078152319
平安：两市最高分红分配,9984,14,2015-11-28 11:41:46,0.050876114621380086
租房平台引入Uber模式 平安砸6亿元杀入租房市场,8742,10,2015-11-26 13:34:03,0.03230311967724464
能做价值投资的股票没几个让我们看看伯克希尔股,13802,17,2015-11-27 01:07:48,0.9288526810950495
601318:中国平安关于认购平安银行非公开发行优,13067,12,2015-11-19 18:43:10,0.2066552209543734
同样保险股为什么伯克希尔的股价就这么高都是保,7255,14,2015-11-26 11:48:24,0.49979896886470265
追魂神秘部队悄悄建仓60亿股,7142,13,2015-11-25 01:12:23,0.5798185178824573
四只保险股，几千只A股中的精品,13218,30,2015-11-14 11:45:57,0.1477293647134601
平安拥抱互联网,11162,13,2015-11-24 15:59:34,0.9205032876638576
中国平安(601318)大宗交易数据一览(11-23),8490,16,2015-11-23 20:55:01,0.1878547976906606
中国平安，我44块的成本，越跌越买．,5702,19,2015-11-21 00:03:56,0.1571936575765378
神秘资金会继续爆拉券商吗！,6505,7,2015-11-07 18:21:00,0.912270170243844
金融巨鳄“圈地”金交所 平安或入股重庆金交所,10944,12,2015-11-19 04:38:03,0.18558603665298534
大利空！市值配售是证金汇金、与小股民争利！！,7360,15,2015-11-07 18:54:59,0.5860224077940851
沪股通连续21天净流出累计近250亿 兑现金融股收,11701,99,2015-11-17 15:33:54,0.03021312382586283
两融新规降杠杆 非银金融板块或首当其冲,13119,71,2015-11-16 02:17:43,0.9936058358377154
601318，觉得他讲的挺有道理，迷糊的可以问一下,17641,102,2015-11-04 10:48:43,0.8353176578046939
601318:中国平安保费收入公告,39584,32,2015-11-12 19:13:10,0.8884804714545186
601318:中国平安关于监事辞职的公告,8232,7,2015-11-12 19:12:49,0.1351100450679108
11月6日，我坚定的认为股市在养老金没有入市之,9186,17,2015-11-06 21:23:18,0.426836666150038
中国平安(601318)融资融券信息(11-10),4667,8,2015-11-11 08:10:30,0.74705791977755
中国平安今日超大单流入排名第10名(11-10),6319,5,2015-11-10 16:08:57,0.5160353897152059
资源股单骑救主 强势反弹格局依旧,10320,15,2015-11-10 15:02:59,0.41693580741774616
基金看上了哪些股票,18200,7,2015-11-09 15:52:27,0.9694115673346588
“证金系”扎堆大蓝筹 股东榜频现“持股2.99%”,108746,126,2015-10-28 05:46:01,0.07126607584542
IPO新政下，打新资金会进场么？,4367,14,2015-11-07 14:07:31,0.9680161043277681
