标题,阅读,评论,字数,影响力,时间
中山公用怒吼：广发证券算个球，它涨1倍我能涨3,32167,91,195,4.0,2017-08-29 08:50:25
持股过国庆节，节后有高回报，10月份稀土涨价是,48336,44,214,0.0,2017-09-29 14:31:39
下跌放量，上涨乏力，明显出货行情,7371,48,142,3.5,2017-09-18 14:00:09
久盘不上小心尾盘跳水！,5503,38,125,0.0,2017-09-18 13:35:49
我  现  在  一  无  所  有  了,301941,467,331,2.0,2016-05-16 22:36:35
呵呵，冲高回落。没救了，横盘一个月,5210,38,144,0.0,2017-09-18 14:03:48
估计是证金这个垃圾在出货,6074,47,134,3.5,2017-09-18 14:03:42
主力出这么多，看来要大跌。,6010,38,136,3.0,2017-09-18 13:50:09
北方稀土,59797,49,120,0.0,2017-08-13 16:52:18
坚定看好北稀的长期价值。 本人13.08元进入北稀,45330,42,361,0.0,2017-09-22 12:33:36
一路有你  风雨也温柔,55978,54,451,2.5,2017-09-22 10:51:10
军事战略稀土上100元也不贵3333333333333333333,12499,17,166,3.5,2017-09-29 11:15:48
准备好抄底资金了！我卖房子全仓这个稀土！和国,41743,113,174,3.0,2017-09-25 13:45:51
北稀和盐湖对比，懵逼！都有这种感觉吧！,14133,20,148,3.0,2017-09-20 18:15:41
天空没有翅膀的痕迹，但鸟儿已经飞过 [微笑] [,5293,16,1675,3.0,2017-08-31 07:56:19
稀土龙头别装死，差不多了该上场了。,60062,79,144,3.0,2017-07-19 14:16:10
600111:北方稀土关于控股股东可交换公司债券进,97369,98,1293,0.0,2017-09-20 18:42:58
20元卖光了,27748,63,122,2.0,2017-09-12 11:41:33
9-29过节到底是持股还是持币,9791,32,181,0.0,2017-09-29 09:21:19
节前就这样了。不动如山，动若脱兔。如果对大盘,6608,8,211,3.5,2017-09-27 13:21:13
郭郭论市：9-20北方稀土等待大盘释放风险,31132,44,106,0.0,2017-09-20 07:21:13
16.5元附近闭上眼买进稀土龙头600111,187997,192,133,0.0,2017-07-28 14:18:56
强势涨停机构游资敢死队疯狂抢筹暴涨飙升超级大,8587,19,119,4.0,2017-08-12 07:04:49
９丶１９顾瑞谈股，盘中整理,11453,53,13,2.5,2017-09-18 19:57:38
反复震荡充分换手的北方稀土迎来超级主升浪,166891,211,310,2.5,2017-09-15 11:02:09
感觉,23810,35,122,3.0,2017-08-28 16:28:48
稀土价格上涨，助力轻稀土龙头业绩爆发,145555,49,1004,0.0,2017-08-24 17:04:54
我只信一句话：稀土拉高成稀屎，稀土下砸真稀有,9381,24,156,4.5,2017-08-22 21:08:04
入！,7084,29,114,4.5,2017-08-24 22:08:32
钕铁硼周涨幅40%，镨钕氧化物将再掀涨价狂潮,31483,28,623,2.5,2017-09-19 11:46:13
当机立断，抄入,12087,32,124,4.5,2017-08-24 22:07:33
北方最后一贴,78880,94,429,1.5,2017-09-15 15:40:16
北方稀土投资价值已现，加仓！,10681,23,79,4.5,2017-08-23 20:25:50
追逐烟花的绚丽不如静待手中111的绽放,8630,24,148,4.5,2017-08-24 22:08:56
破了，村里的农民都笑了！,10406,26,134,4.5,2017-08-11 23:38:59
北方稀土涨到头了怎么办？调仓甘肃品牌超牛莫高,6195,16,727,3.5,2017-09-14 16:09:26
早盘提示， 17-20区间会踩破，,18887,21,203,1.0,2017-09-22 08:29:52
~~002201九鼎新材  随时喷发,6412,12,259,0.0,2017-07-13 19:47:40
北方稀土(600111)大宗交易数据一览(09-22),62055,15,473,0.0,2017-09-22 18:51:34
北方稀土9月25日盘中跌幅达5%,23309,5,184,0.0,2017-09-25 14:19:44
闲聊贴！唱空的都来看看他们的嘴脸,19669,22,601,1.5,2017-09-22 08:55:33
不明资金开始砸盘了！死定了！,5959,8,125,4.0,2017-09-15 13:25:34
你想怎样？你到底想怎样？,2551,1,134,2.0,2017-09-13 14:12:32
友情提示,67777,62,493,3.5,2017-08-08 22:26:39
~~同济科技燃料电池研究有重大突破,7387,12,136,2.0,2017-07-20 12:04:56
石墨烯电池哪家强,11401,24,69,0.0,2017-08-02 19:06:35
长期趋势看好，补3331缺口后就放心了，耐心等待,1912,0,158,1.0,2017-09-15 10:31:19
很明显,32347,48,472,2.0,2016-11-16 21:29:24
割了，可以涨了,2493,0,143,1.5,2017-09-15 11:39:52
埋尸，种韭菜,1291,0,6,2.0,2017-09-15 14:10:28
女士们先生们：今天意外过关！修正后市玩法！牛,13762,19,144,4.0,2017-09-13 16:30:43
北稀后市依然看涨,14949,15,299,3.5,2017-08-09 11:23:00
600111:北方稀土关于第二大股东所持公司部分股,69657,8,611,0.0,2017-09-15 18:25:34
超短线第二关键支撑点已上移16.65！明天收盘为1,19871,36,154,4.0,2017-09-19 16:14:18
周一看广晟,46033,72,130,2.0,2017-08-11 17:59:43
砸的差不多了吧，养老金可以再加仓了,3310,44,144,3.5,2017-08-23 09:37:46
稀土板块大面积爆发,2018,0,177,2.0,2017-09-12 13:22:00
尾盘收绿，恭喜,1623,0,122,3.0,2017-09-12 13:52:34
这也跳得太快了吧！,1649,0,128,2.5,2017-09-12 14:03:11
上面的压单加起来有万手，好可怕,1972,0,140,2.0,2017-09-13 14:38:40
卖盘太重大涨太难,1521,0,126,2.0,2017-09-13 10:41:40
毛笔了吧，夏季巴搞，套起！,1347,0,136,2.5,2017-09-12 14:24:46
整个稀土永磁版块都在回调，此股不能独善其身,1466,0,152,2.0,2017-09-14 13:03:26
北方稀土四季度将可能面临稀土原料产品无货生产,45120,36,385,2.0,2017-09-16 00:22:48
北方现在压力太大，19元附近，先出去为妙呀。,2615,1,154,1.5,2017-09-14 14:49:29
6个多亿呀！你是上帝弃之不顾的儿子的幻影[想一,2164,0,155,2.5,2017-09-14 15:01:05
600111:北方稀土公开发行2017年公司债券(第二期,58507,14,841,0.0,2017-09-19 09:29:13
稀土拉稀大盘能够好吗人气板块,4047,12,14,3.5,2017-09-08 13:14:03
暴力啊,1696,0,116,2.5,2017-09-13 10:23:56
图型屎态化，今天不涨了,1927,0,132,1.5,2017-09-13 14:03:04
在五矿稀土面前你是一坨屎,2213,0,134,1.5,2017-09-13 15:24:21
没有像横店东磁那么涨，倒是和它一样跌,1861,0,146,2.0,2017-09-14 14:25:36
跟跌跟的很稳，跟涨跟不上去。,1613,25,138,1.5,2017-09-14 11:29:17
散户必看炒股格言和现金策略！,20871,32,675,4.0,2017-07-08 16:26:58
明天又是一河南焖焗面， 逃！！,32881,57,433,0.0,2017-08-16 16:14:26
空调我们选择格力，手机我们选择华为，新能源汽,10516,19,168,3.5,2017-07-08 19:53:01
拉稀了[鼓掌],1720,12,120,2.5,2017-09-12 14:37:30
9月9日周六的两大重磅利好消息 第一:工业和信息,7154,0,343,3.0,2017-09-09 22:18:35
600111:北方稀土关于第二大股东所持公司部分股,58635,19,611,0.0,2017-09-15 18:25:34
0.98元业绩仅此1家次新股股价不到10块江苏银行,48474,95,184,2.5,2017-04-27 21:27:04
稀土上涨，主力却砸盘！目的暗指三季度报，三季,56406,58,328,2.0,2017-09-06 20:25:47
出货啊，快跑,10584,42,122,0.0,2017-09-06 10:32:19
北方稀土大行情已经开始 北方稀土股价与稀土价,39545,35,173,0.0,2017-07-26 07:00:03
突然直线地拉升: 深振业A 沙河股份 深物业A ...,3316,11,165,3.5,2017-09-08 13:14:53
600111:北方稀土公开发行2017年公司债券(第二期,58058,8,1867,0.0,2017-09-14 19:59:45
跌停啊傻逼  我好接盘,3119,25,131,0.0,2017-09-08 11:55:16
北方稀土9月15日盘中跌幅达5%,18978,6,184,0.0,2017-09-15 10:21:35
600111:北方稀土公开发行2017年公司债券(第二期,42347,7,1430,0.0,2017-09-14 19:59:32
北方稀土缠式理论分析，不带任何个人情绪,48292,44,878,1.5,2017-08-24 16:01:32
北方稀土(600111)融资融券信息(09-14),11196,8,550,0.0,2017-09-15 07:38:15
600111:北方稀土公开发行2017年公司债券募集说,58497,17,1977,0.0,2017-09-14 19:59:37
本次稀土价格为什么上涨。要涨到什么时候,258687,366,479,0.0,2017-07-26 21:55:39
北方稀土(600111)融资融券信息(09-08),13564,6,548,0.0,2017-09-09 07:37:54
坚信资源股的牛市已经来临,343448,364,398,4.0,2017-08-13 19:45:00
核心内参泄露（002199东晶电子）要大涨,13289,54,291,3.0,2017-09-11 16:57:44
错过了锂矿、钴矿翻倍机会，一定要抓住钛矿翻倍,23191,35,669,2.5,2017-08-29 08:16:57
下一支方太炭素,18608,26,1496,4.0,2017-08-02 21:25:18
北方稀土(600111)融资融券信息(09-12),17309,6,558,0.0,2017-09-13 07:37:10
不出意外今天收盘价18.5附近！注意,13620,26,129,4.0,2017-09-13 10:33:53
八月收盘是买点，开关肯定又做反了！,13814,20,136,3.5,2017-09-01 23:03:33
高位出货区间开关积极提示风险！13元以下区间积,7009,22,168,4.0,2017-09-12 14:59:12
北方稀土9月12日盘中涨幅达5%,9892,13,182,0.0,2017-09-12 11:03:47
北方稀土本周将强势归来,43506,55,371,0.0,2017-09-04 16:03:25
北方稀土是中长线价值投资的稳健标的,12478,15,152,3.5,2017-09-11 13:46:24
北稀建仓正当时，长持必获厚报。 1.稀土行业目,523453,657,573,3.0,2016-10-22 16:24:29
稀土再度提升战略性资源，试问：目前335元的北,9512,9,178,3.5,2017-07-26 11:24:35
一个跌停+3个点就是开关预测的16.32！可不可怕,9594,20,146,4.0,2017-09-11 19:12:04
镧铈价格再次大幅上涨,54709,98,143,2.5,2017-08-23 13:57:41
下周关注300555 。,7000,17,134,4.0,2017-09-02 20:00:46
北方稀土会慢慢涨，节节高升,4252,7,77,3.5,2017-08-07 14:18:59
北方稀土本人近期看高到40元(十月一日前)，远期,50318,70,181,0.0,2017-08-28 11:52:42
[鼓掌]向全国人民问好！祝全国人民幸福安康！,5368,10,182,4.0,2017-08-14 12:39:21
眼下多种因素对北稀构成了重大压力！开关的预言,13862,6,170,4.0,2017-09-10 22:58:52
重磅！捷成股份坐收电影《战狼2》50亿元票房,3254,11,834,4.0,2017-08-14 10:21:41
目前杭州园林股价上82元，看大千生态股价43元这,7018,21,270,3.0,2017-09-02 13:40:42
北方稀土(600111)大宗交易数据一览(09-08),63006,15,472,0.0,2017-09-08 18:35:07
二次买点加油,13473,64,6,2.0,2017-08-28 13:08:14
北方稀土进入盘整已成定局（写于8月22日晚）,51157,34,1050,1.5,2017-08-22 20:49:27
南方稀贵期货稀土连板3天 南方稀贵期货稀土连板,17926,16,179,3.0,2017-09-05 13:14:00
本来是一把撑握世界命脉的利剑，却弄得这么烂，,29500,85,193,2.0,2017-03-15 09:39:50
华宸信托注册资本增至8亿元 北方稀土将不再参与,57086,7,2196,0.0,2017-09-08 02:59:14
调整不买入北稀要待何时？,27180,57,353,3.5,2017-08-02 09:01:22
北方稀土(600111)融资融券信息(07-28),21508,2,548,0.0,2017-07-29 07:38:09
黄国东：3300点拉锯战下周收复,40187,69,709,4.0,2017-08-12 14:29:46
北方稀土(600111)融资融券信息(09-06),13426,5,548,0.0,2017-09-07 07:36:24
9月6日夜盘稀土电子现货盘继续涨停!,13129,7,404,3.0,2017-09-07 08:56:15
北方稀土(600111)大宗交易数据一览(09-06),77663,23,473,0.0,2017-09-06 18:26:04
稀土业务量价齐升，未来成长可期,109098,46,1494,0.0,2017-08-18 15:10:59
北方稀土，本周走势预判,26181,38,407,0.0,2017-08-30 16:21:58
八月的风会向哪边吹？,22546,29,1083,4.0,2017-07-31 16:50:49
五矿稀土要成为龙头吗？,5086,10,124,3.0,2017-09-06 14:46:25
官网公布：北方稀土重点产品今年价格翻倍了,20327,10,20,0.0,2017-09-04 21:48:59
痔哥今天怎么没出来BB,7182,21,132,2.5,2017-09-01 09:33:38
开关10元满仓双成药业，7元多杀进亿晶光电，这,9014,17,184,0.0,2017-08-29 18:16:31
有色趋势行情延续，关注还没启动的黄金个股，如,4628,12,176,3.5,2017-07-13 10:43:14
我就要18全部卖出！这股票短期这走势太浪费其他,14603,30,186,0.0,2017-08-29 10:52:32
这个很难吗 新股一人一手，大数据了。改成每千,20380,124,305,1.5,2017-08-26 20:34:48
~~三浪三主升浪的龙头是军工，航天电子是领头,5656,9,231,3.5,2017-08-23 18:50:35
北方稀土，下周走势预判,21620,25,297,0.0,2017-08-25 16:31:24
北方稀土站稳平台，确认支撑,17035,6,309,0.0,2017-07-22 21:59:34
~~保护胜利果实 该换股操作了,8039,14,156,3.5,2017-07-13 23:26:57
北方稀土9月1日盘中涨幅达5%,14945,5,178,0.0,2017-09-01 11:17:51
周期股强势回归，坚定看好北稀22元不动摇。,42466,84,284,0.0,2017-08-21 14:36:30
终于摸到了18.39！清仓良机！,9551,19,127,4.0,2017-09-01 09:56:26
好久没有看账户了，今天看看又亏了,4134,13,132,3.0,2017-07-17 11:27:51
应该出哪个，在线等,4505,7,128,3.5,2017-08-02 08:39:42
北稀的同胞们：明天会很不幸！17.34开盘6个点下,20579,24,143,4.0,2017-08-29 20:45:55
稀土价格疯狂飚升，行情远未结束,33037,20,935,4.0,2017-08-12 10:30:51
上涨放量，下跌缩量,19897,26,129,4.0,2017-07-21 19:20:26
下跌就是机会,11840,32,121,3.0,2017-08-10 13:35:22
北方稀土，明日走势将如何演绎,23445,21,383,0.0,2017-08-28 17:00:48
稀土还会涨，6哥在此推算后市必上22元左右，欢,26123,26,236,2.5,2017-07-30 18:56:53
Adler分析问题的能力差 短线水平臭    第一，Ad,29175,44,426,0.0,2017-08-18 07:24:03
目标价26,36076,52,120,1.5,2017-07-19 18:33:10
经长期观察，确认涨跌开关就是09-10年中国远洋,173841,407,357,3.5,2016-01-22 13:18:40
17元豪无价值！15.35才有短线反弹价值！但都是,7981,17,143,4.0,2017-08-23 13:59:25
20元一直站不稳，今天快速拉上20元上面，但卖单,29992,39,259,3.5,2017-08-15 10:37:08
包钢稀土再廉价卖外国  对得住这片大地》？,12605,22,151,0.0,2017-08-20 14:15:59
盛和资源：唯一不受配额限产稀土霸主(国外矿 和,6975,10,3375,4.0,2017-08-18 09:59:46
山西西姆东海炭素石墨电极价格上调，本周方大炭,12332,6,347,4.0,2017-08-23 14:55:26
北方稀土8月23日盘中跌幅达5%,28621,13,184,0.0,2017-08-23 14:33:41
短线高手17.25处有T+0一次！不会不要博！,10971,26,134,4.0,2017-08-16 14:39:39
赚没赚多少，一天亏到完。苦啊,10059,30,138,3.0,2017-08-16 15:20:08
中报速递：北方稀土2017年上半年盈利1.12亿元，,67239,35,231,0.0,2017-08-17 18:44:56
稀土行业协会：建议暂缓收储和释放稀土储备,36295,41,501,0.0,2017-08-22 10:18:37
北稀人做好减仓准备工作！,21756,32,123,4.0,2017-08-01 14:36:04
北稀股校通知：昨天跑了！你可以毕业了！中专毕,14356,21,152,4.0,2017-08-16 20:50:35
费用提升影响上半年业绩，长期向好趋势不改,86782,19,1162,0.0,2017-08-22 10:15:04
当心尾盘小跳水！明天再一低开多头被关！,5429,15,130,4.0,2017-08-15 14:04:06
关于8月18日北方稀土操盘的一点设想,86497,52,684,1.5,2017-08-17 22:07:39
核心内参泄露（000430张家界）要大涨,12590,47,227,2.5,2017-08-21 15:50:02
抓紧做好上路的心理准备！喝碗二锅头！或许在明,11625,16,146,4.0,2017-08-22 14:36:18
稀土板块就看你的了，会在来一波的，加油！！！,62271,99,154,3.5,2017-07-12 10:09:58
北方稀土(600111)融资融券信息(08-21),13523,4,548,0.0,2017-08-22 07:38:05
8 8 8稀土大涨，稀土概念王者归来。,18092,17,338,3.0,2017-08-14 23:15:45
坚信能突破22元！看好北稀,32040,37,413,0.0,2017-08-18 12:07:18
周一的反弹千万不要抢！否则一买就套！,30375,45,129,4.0,2017-08-19 18:51:46
北方稀土三大利空引发巨变，暴跌因子已证实，这,13453,8,115,0.0,2017-08-21 13:56:02
佛前三炷香，明天有低点干！,8827,16,136,3.0,2017-08-10 18:01:06
静观变化，做好阶段性获利了结准备。（8月16日,62774,46,1164,1.5,2017-08-16 20:44:41
和南京银行、宁波银行、北京银行一样，上市以后,6063,16,178,0.0,2017-08-10 16:56:23
600111:北方稀土关于对全资子公司内蒙古稀奥科,102064,19,1784,0.0,2017-08-17 18:20:48
稀土永远是稀有的国宝，日本人有多嫉妒,30855,34,366,3.5,2017-08-04 16:24:30
中金买北方稀土养老金入正海磁材,10332,5,140,3.0,2017-08-20 08:36:22
稀土都说每股要到50元，100元，暂时也不要想那,16411,6,207,0.0,2017-08-20 15:15:12
尼马，又给十多家卷伤们骗了,5513,19,136,1.5,2017-08-16 15:53:06
北方稀土：上半年净利同比增258% 证金公司增持,252055,125,692,0.0,2017-08-17 18:27:38
揭穿价值投资的鬼话，如果真要价值投资，招商银,22031,36,646,0.0,2017-07-09 08:13:16
600111:北方稀土第六届董事会第十八次会议决议,57038,79,652,0.0,2017-08-17 18:21:20
北方稀土(600111)融资融券信息(08-10),14335,5,552,0.0,2017-08-11 07:39:04
一公斤竟然卖10个亿?震撼稀土！呜呼北方稀土,10536,17,195,3.5,2017-08-14 07:45:43
600111:北方稀土2017年半年度报告摘要,89571,26,1033,0.0,2017-08-17 18:20:03
半年报无新亮点！预期空间无想象力！相对业绩预,21357,23,188,4.0,2017-08-17 19:15:54
祖军的公司,12337,61,120,0.0,2017-08-14 15:21:23
明天只能涨，不能跌，明天跌就是做头部,25366,65,141,3.5,2017-08-14 21:31:00
600111:北方稀土2017年半年度报告,71218,9,1319,0.0,2017-08-17 18:20:21
中国战略稀土钨矿龙头央企改革金属新材料王者归,12183,16,270,4.0,2017-08-14 15:40:36
北方稀土个人看法！,14788,21,272,0.0,2017-08-14 09:51:29
北方稀土(600111)融资融券信息(08-16),16741,8,552,0.0,2017-08-17 07:34:48
入场收尸:地产称霸南京，医美雄冠亚洲,3313,9,899,3.0,2017-08-13 10:38:27
今天真得没什么可说了。,93887,61,539,1.5,2017-08-15 06:16:53
木头来北方稀土安家，期盼出现中国神土！,11598,18,144,4.5,2017-07-13 14:07:31
北方稀土(600111)融资融券信息(08-14),22756,10,542,0.0,2017-08-15 07:36:17
周二大盘震荡小阳为主,9737,3,275,4.0,2017-08-14 17:47:42
稀土不是暴涨，应改正为普涨行情,24780,22,260,3.5,2017-08-13 09:50:38
下星期一不暴跌俺砍掉一手指再也不炒股了！还唱,24442,43,23,0.0,2017-08-13 15:38:52
15以下补仓，到12满仓，等下一个波段,9168,20,148,2.5,2017-08-14 09:42:16
稀土资源是抗衡西方贸易战的法宝,10632,7,596,3.5,2017-08-14 17:43:09
盛和资源：唯一不受配额限产稀土霸主(国外矿 和,7662,6,3138,4.0,2017-08-14 12:05:44
包钢集团，把稀土资源全都给包钢股份，北方稀土,17048,15,94,4.0,2017-08-14 17:19:49
全球最大稀土资源利润如何分配？包钢和北方稀土,20282,20,306,4.0,2017-08-14 21:00:28
8月14—18日一周持股预想,84338,61,1117,1.5,2017-08-13 19:59:40
8月14日稀土氧化钆价格今天涨了52%,18088,3,426,4.0,2017-08-14 18:40:45
重大失误，逃过了方大。却没有逃过北方稀土！昨,36382,33,352,0.0,2017-08-11 20:02:42
600111:北方稀土关于第二大股东减持股份计划实,166169,135,1564,0.0,2017-07-13 18:47:26
稀土破局真成长，沉静玫瑰始盛开,160850,66,1406,0.0,2017-08-11 15:47:59
北方稀土8月14日盘中涨幅达5%,18452,15,186,0.0,2017-08-14 13:47:14
北方稀土：历史最高681.5，若干年后会不会去突,7249,7,111,3.5,2017-07-26 11:28:24
在价投时代，北方稀土将取代广晟有色等小盘稀土,6182,9,176,3.5,2017-07-27 10:03:03
想被外资抄底稀土吗？不可能，稀土主权只有我国,3299,13,178,3.5,2017-08-08 10:17:21
周一必定暴跌,13048,13,122,3.5,2017-08-13 20:33:26
稀土的价值和钢铁是不一样的，这次钢铁股有可能,114405,20,294,3.5,2017-08-11 13:03:52
上一轮牛市叫稀土高科，行情刚起动时6元，我同,42754,36,366,2.0,2017-08-11 17:44:26
北方稀土(600111)融资融券信息(08-09),20277,8,550,0.0,2017-08-10 07:38:30
8月9日北方稀土操作提议,136801,157,1543,1.5,2017-08-09 06:50:04
高度关注有色板块、涨价类股票风险（写于8月9日,22783,24,1919,1.5,2017-08-10 18:37:01
月月中签窍门！上市一路连板！顶贴点赞连中大签,5856,12,249,0.0,2017-08-11 18:24:22
600111北方稀土 锂电池板块 此股前期大涨后在高,10317,4,222,3.0,2017-08-11 20:53:44
11点35分才看盘，呵呵。,59480,71,329,1.5,2017-08-11 11:56:27
北方稀土(600111)融资融券信息(08-11),25291,5,548,0.0,2017-08-12 07:38:14
染料行业垄断性：分散染料历史底点每吨12000元,3547,12,432,4.0,2017-08-03 15:52:43
600111:北方稀土2017年半年度业绩预增公告,190100,84,814,0.0,2017-07-14 16:46:40
一杯茶，一包烟，北烯何需看一天。求下联[赞],8815,12,151,1.5,2017-08-11 21:03:53
600111:北方稀土:控股股东包钢(集团)公司关于北,143548,24,394,0.0,2017-07-31 18:46:07
收购甘肃稀土，加强稀土产能整合,134829,12,1166,0.0,2017-07-27 08:20:25
综合计算，平均一年赚5亿，最多30倍市盈率，北,28353,24,202,0.0,2017-07-29 13:42:34
北方稀土主力流出，行情将继续放大,22518,30,327,0.0,2017-08-09 13:16:41
今天在20.28元买入2500股，有点事看盘晚了套了3,12166,13,201,3.0,2017-08-10 11:39:00
关于本人8月10日早盘换股情况的通报,55503,60,602,1.5,2017-08-10 19:12:05
走[献花][献花][献花][献花],7826,20,128,4.0,2017-08-10 10:46:14
北方稀土8月11日盘中跌幅达5%,20399,4,181,0.0,2017-08-11 10:53:31
111主升继续中，从方大炭素过来的兄弟杠杠的,4218,4,154,3.5,2017-08-07 12:52:16
今日稀土价格继续飙涨 稀土概念股有哪些？   投,20070,15,595,4.0,2017-08-10 15:34:45
北方稀土明日大涨。,30073,3,69,2.5,2017-08-10 14:34:09
仅靠镨钕结构性价格上涨，北方稀土很难再有表现,5828,9,613,2.5,2017-08-10 11:37:26
22块要来了！坚定看好北方稀土！,27999,40,262,0.0,2017-08-07 11:34:10
一旦明天低开，将又有一大批人站岗！,6862,6,144,3.0,2017-08-02 15:51:36
形势似乎一片大好（写于8月3日晚）,110549,173,795,1.5,2017-08-03 22:16:49
8月8日北方稀土操作建议,64516,75,635,1.5,2017-08-08 08:22:23
复制贵州茅台的酒鬼酒,6459,0,130,3.5,2017-08-09 14:17:42
稀土有神秘大股东介入,13994,18,133,2.0,2017-08-04 09:43:00
气疯了,2053,36,116,0.0,2017-08-08 11:26:07
北方稀土总经理张忠：促进稀土产业可持续发展,76701,10,1889,0.0,2017-08-08 02:19:56
盛和资源：唯一不受配额限产稀土霸主极具成长性,10316,11,12051,3.5,2017-08-07 10:44:30
星期一不高开高走 我去吃屎,22708,44,136,0.0,2017-08-04 20:30:22
出击,13733,22,114,4.0,2017-08-08 10:05:28
加仓持股待涨[鼓掌][鼓掌][鼓掌],27542,92,134,2.0,2017-06-15 09:26:49
看看五日分时图，早上放量突破W后，缩量回踩确,19515,7,203,3.5,2017-08-08 15:08:09
此票2017可能会创新低,23538,48,397,4.0,2017-01-01 21:30:06
曾经有一份珍贵的股票摆在我面前我没有珍惜，等,23378,33,229,3.5,2017-08-07 16:57:35
(与美国航空协会签署战略合作协议)国内首家国际,12358,14,705,0.0,2017-02-08 22:40:41
002604龙力生物，正宗石墨烯龙头股,7164,17,877,4.0,2017-08-02 21:35:22
警告！抓紧跑！没时间了！,13685,26,123,4.0,2017-08-04 13:46:08
8月继续看好（兼聊自己的选股思路）,62982,84,1114,1.5,2017-08-07 08:16:39
涨停清仓，明天跌3点介入,6614,30,134,0.0,2017-08-07 16:09:38
发现有人动用数百账户操纵大盘有色垃圾股，抓人,2549,43,135,0.0,2017-08-07 16:24:24
现在经过反弹之后,4760,38,128,0.0,2017-08-07 16:45:31
所谓价值投资，北方稀土估值高过创业板指数数倍,5659,38,154,2.5,2017-08-07 16:28:02
今天这盘口 是板了 这种“板”敢追的 亡命之徒 ,5473,35,31,3.5,2017-08-07 15:13:09
重磅 访谈专家、走访一线调研稀土价格还能翻倍,12472,6,9050,3.5,2017-08-04 19:20:52
18.15元全仓买入北方稀土，大家好运！,62147,126,150,3.5,2017-08-01 09:35:06
今天开盘如有回弹机会是最好逃命机会！否则玩完,11379,23,141,4.0,2017-08-07 07:09:44
今天喷我的 星期一拭目以待吧。我说了星期一高,34869,45,237,0.0,2017-08-05 13:40:26
坚定看好北方稀土，未来成长性有望超茅台,9250,15,148,3.5,2017-07-27 11:30:23
稀土行业龙头有价无市，股价会去到22元，虚位以,37831,95,339,0.0,2017-07-31 19:27:19
热烈祝贺北方稀土成功降级为稀土行业的小三,8651,10,150,2.0,2017-03-01 10:03:03
北方稀土拟10派0.10元,28301,8,329,0.0,2017-04-14 20:32:19
一天亏8个点，日了狗了,18843,30,132,3.5,2017-08-04 14:55:21
继续坚定看好北方稀土（写于8月2日晚）,90487,86,1262,1.5,2017-08-02 22:14:40
凑一下包钢稀土利好,20934,10,185,3.0,2017-08-04 21:44:09
稀土军须品+调价函+巧用方大炭素巨震洗盘,11324,6,150,3.5,2017-08-04 19:26:49
跌到10天线时有一个对5天线的反抽,16339,16,223,3.0,2017-08-04 22:16:54
昨天和今天，洗盘效果很好，散户，被洗出局，股,25781,19,173,0.0,2017-08-03 16:36:41
北方稀土(600111)融资融券信息(08-04),25085,3,552,0.0,2017-08-05 07:38:45
无利不起早，北方稀土后续走势分析。（写在建军,99578,105,1410,1.5,2017-08-01 06:29:47
主力已控筹.调整到位 主升浪.理伦目标位26元付,28540,48,196,3.5,2017-08-03 17:37:17
对北方稀土的进一步研究,54071,55,1813,3.0,2017-05-09 11:48:04
北方稀土8月4日盘中跌幅达5%,33967,17,182,0.0,2017-08-04 14:42:36
某位大神给你一些建议。,26955,57,1395,0.0,2017-08-02 17:22:06
北方稀土有成为17年大牛股潜质……,6904,6,85,3.5,2017-03-02 10:25:32
昨天午盘雄安集体反弹，这对八月份的行情来说是,12974,69,160,3.0,2017-08-02 09:12:02
北方稀土高位持有到现在了，还有希望拉升吗，我,9396,13,117,0.0,2017-08-02 14:16:29
假摔看得多了，继续摔啊。（8月3日开盘前）,56434,95,207,1.5,2017-08-03 09:07:47
今天稀土、钨的期货报价继续大涨！！大家可以看,12736,7,166,3.0,2017-08-03 14:07:31
唉…不爽利…,3540,15,122,1.0,2017-08-03 14:51:41
有意思，我早上发的帖不存在了！,55917,126,185,1.5,2017-08-02 12:02:23
昨天追的票，今就调整,1825,37,130,0.0,2017-08-01 15:12:26
尽管稀少，但利润很低。,2310,28,197,2.5,2017-08-01 16:51:51
指数马上摸3200,2470,0,139,0.0,2017-08-03 05:20:00
北方稀土前面加个XD为何意？,17857,14,138,0.0,2017-06-06 10:40:32
北方稀土(600111)大宗交易数据一览(08-01),111415,15,473,0.0,2017-08-01 18:29:20
怎么今天又奔涨停去了？,33038,69,213,1.5,2017-08-02 13:12:21
19.20追进去1万股！剁手！,20625,26,140,2.5,2017-08-02 15:09:01
