标题,阅读,评论,字数,影响力,时间
江苏银行你看跌何不回家休息 ？,25423,89,421,3.0,2017-09-20 18:04:50
有图有真像，江苏银行2017年8月2号解禁60多万股,24923,16,205,0.0,2017-05-26 12:02:31
看着合适就买，觉着不好就不碰。我买了！,28985,105,148,3.5,2017-09-08 13:38:45
600919:江苏银行首次公开发行限售股上市流通公,111108,95,1709,0.0,2017-07-27 18:40:11
炒股炒差价不炒业急600531一600891一600909一30,10170,60,290,4.0,2017-09-21 09:05:36
善意提醒：别小看这次大解禁！（二）,47393,150,135,0.0,2017-08-02 12:01:21
沪指9月必到3400！ 10月必过3534！ 立帖为证 20,38007,137,155,0.0,2017-08-10 11:03:00
京东金融与江苏银行达成战略合作,39264,27,275,0.0,2017-09-28 19:16:33
咱散友就今天开买，越跌越买[傲]买得庄家怀疑人,13770,51,159,1.0,2017-09-27 14:10:27
沉舟侧畔千帆过,18244,115,124,0.0,2017-09-16 13:11:49
10倍！,28538,41,241,3.5,2016-08-02 00:47:09
构建新型金融科技生态 江苏银行与京东金融达成,28522,22,1279,0.0,2017-09-28 17:51:17
放心吧！沾上江苏银行会叫你一生都内牛满面！,42179,90,215,2.5,2017-08-15 16:23:42
江苏银行中报点评：同业结构调整，投资收益大增,45997,16,1504,0.0,2017-09-04 16:56:36
创新低!!!,16053,69,122,3.0,2017-08-01 09:39:17
我建议《江苏银行》改成《僵尸银行》，赞成的点,2489,3,160,1.0,2017-09-27 13:54:05
江苏银行(600919)融资融券信息(09-26),5654,4,496,0.0,2017-09-27 07:54:40
江苏银行三阳开泰后有回调。回调价位是多少？,45746,119,93,0.0,2017-07-14 09:03:23
吧里有人傻唱多，大家小心,9578,10,934,2.0,2017-09-26 20:18:37
坑挖完了，电梯上行,6301,7,287,3.5,2017-09-25 10:22:12
江苏银行(600919)融资融券信息(09-19),5835,9,494,0.0,2017-09-20 07:45:54
江苏银行的操作策略,17951,35,279,2.0,2017-09-23 11:05:50
江苏银行，底部盘整，快要拉升了,17466,16,156,0.0,2017-07-20 15:49:16
哈哈，就是你,8182,39,6,3.0,2017-09-22 12:53:26
江苏银行为何如一潭死水阴跌不涨？面临500亿元,20210,29,724,3.5,2017-09-13 16:51:45
倒金字塔法买入，保你稳赚,9743,22,200,2.0,2017-09-23 11:17:42
江苏银行(600919)融资融券信息(09-21),7039,7,496,0.0,2017-09-22 07:45:08
江苏银行(600919)大宗交易数据一览(09-21),25970,10,472,0.0,2017-09-21 18:13:11
600919:江苏银行关于董事及高级管理人员辞职的,46297,36,435,0.0,2017-09-19 16:09:51
江苏银行你看跌何不回家休息 ？,22674,79,421,2.0,2017-06-25 10:37:45
江苏银行(600919)大宗交易数据一览(09-20),28090,15,650,0.0,2017-09-20 18:26:18
次新股中0.98业绩，股价不到9元的就剩江苏银行了,56764,140,216,2.0,2017-08-25 14:49:56
小散亏钱主因：总认为下跌是主力打压吸筹！,29876,66,131,2.5,2017-08-16 11:09:08
大翻转！江苏银行突传利好！连续涨停！,36336,55,231,2.5,2017-08-05 10:22:41
918?什么意思?,13034,79,128,3.5,2017-06-19 22:34:05
江苏银行(600919)融资融券信息(09-11),7687,6,506,0.0,2017-09-12 07:54:10
600919:江苏银行2017年第一次临时股东大会决议,39348,12,1098,0.0,2017-09-14 18:45:00
次新股0.98元业绩股价不到10块仅江苏银行！,234713,515,156,1.5,2017-03-15 14:51:50
江苏银行(600919)融资融券信息(09-14),6429,2,498,0.0,2017-09-15 07:46:22
江苏银行业绩一年每股盈利一元。拿五年。每股净,17051,17,151,3.0,2017-08-26 08:49:12
有谁是10元5以上的成本报上名来，三年之内别想,11791,20,162,2.5,2017-09-11 18:04:58
江苏银行破发已成定局，又一个资本家马上要离开,113599,187,103,3.0,2016-07-21 21:59:12
可以关注刚上巿证券股601881一600909一002500一,16938,122,221,4.0,2017-08-30 17:32:51
立足江苏  拓展全国  比肩兴业  傲视群雄一一城,111157,411,182,4.0,2016-07-22 21:54:23
江苏银行最大的利好就是困扰持股心态的主要因素,19268,32,350,2.0,2017-08-26 18:53:16
江苏银行(600919)融资融券信息(09-12),6373,3,498,0.0,2017-09-13 07:47:31
600919:江苏银行关于召开2017年第一次临时股东,35543,7,1465,0.0,2017-09-08 16:28:00
国家队掘金:地产称霸南京，医美雄冠亚洲,4927,8,1266,3.0,2017-08-31 09:14:21
江苏银行(600919)融资融券信息(09-08),8203,19,514,0.0,2017-09-09 07:44:55
江苏银行(600919)融资融券信息(09-06),5747,5,508,0.0,2017-09-07 07:56:17
江苏银行(600919)解禁股信息(09-04),18515,19,289,0.0,2017-09-03 00:02:02
江苏银行(600919)融资融券信息(08-01),20051,25,508,0.0,2017-08-02 07:48:32
银行“缩表”明显 江苏银行业上半年表外余额同,22993,25,909,0.0,2017-09-05 18:17:36
600919:江苏银行2017年第一次临时股东大会会议,48247,10,520,0.0,2017-09-03 14:00:16
有人敢赌吗，周一大涨,12979,25,130,0.0,2017-09-02 06:54:45
有没人给我打赌，老牛说周一低开低走，有反对吗,13246,31,154,3.5,2017-08-27 10:34:33
600919:江苏银行关于非公开发行优先股申请获得,60198,43,469,0.0,2017-08-22 16:03:40
老牛那个新希望木有什么搞头，那股尽是老鼠仓，,4851,11,242,0.0,2017-09-02 09:32:15
真正决定一家金融机构估值的 始终是募钱和管钱,17322,9,2584,0.0,2017-08-31 13:37:37
江苏银行(600919)融资融券信息(08-31),5489,3,496,0.0,2017-09-01 08:04:44
江苏银行半年报增长一成,10071,3,192,0.0,2017-08-30 10:27:00
600919:江苏银行:中银国际证券有限责任公司、华,18160,8,1624,0.0,2017-08-29 20:28:49
中报速递：江苏银行2017年上半年盈利61.77亿元,38135,15,233,0.0,2017-08-29 20:47:29
600919:江苏银行首次公开发行限售股上市流通公,28484,11,1451,0.0,2017-08-29 20:26:32
江苏银行：上半年净利近62亿元 同比增逾10%,26796,6,244,0.0,2017-08-29 21:41:11
600919今晚发布半年报公告：业绩增长10%，不良,19647,12,191,2.0,2017-08-29 12:30:06
江苏银行明天不涨到9元3我准备吃翔。,12208,25,87,2.5,2017-08-28 18:33:20
老牛出江苏银行加仓新 希望,5023,5,136,3.5,2017-08-29 10:00:58
[成交满仓]漂亮50中国股市的心脏；沪深300中国,6793,4,605,3.5,2017-07-17 13:14:50
[牛毛估估]女士们先生们朋友们！战胜内心的恐惧,7140,18,863,3.5,2017-07-24 08:07:38
毫无底线，刘主席和江苏银行都毫无底线，谁是妖,23763,55,158,2.5,2017-07-31 09:46:39
我才开始买，就疯了好多人，有意思，本人准备陆,5770,8,170,3.5,2017-08-18 10:25:42
江苏银行(600919)融资融券信息(08-24),6572,4,504,0.0,2017-08-25 07:45:43
600919:江苏银行首次公开发行限售股上市流通的,108170,67,1341,0.0,2017-07-27 18:42:04
江苏银行(600919)大宗交易数据一览(08-04),46548,33,489,0.0,2017-08-04 18:23:30
江苏银行(600919)解禁股信息(08-02),55603,55,364,0.0,2017-08-01 00:02:22
江苏银行(600919)大宗交易数据一览(08-14),37228,22,499,0.0,2017-08-14 18:34:48
江苏银行(600919)大宗交易数据一览(08-22),30919,24,579,0.0,2017-08-22 18:42:29
江苏银行(600919)大宗交易数据一览(08-08),42063,24,487,0.0,2017-08-08 18:37:04
这个指标你们会用吗，好严重的底背离，又在放量，,11323,23,190,3.5,2017-08-21 11:43:45
华为销售额5800亿元与江苏银行合作意义重大！！,107714,219,91,0.0,2017-04-28 13:26:17
江苏银行(600919)融资融券信息(08-18),8934,33,508,0.0,2017-08-19 08:36:37
8月2日后，南京银行将比江苏银行高估20％,20537,20,82,3.0,2017-05-14 07:51:26
涨时重势 跌时重质,7778,28,86,2.0,2016-12-20 10:04:28
恭喜大家没被新增40亿流通股吓跑,29510,37,215,1.0,2017-08-08 09:04:02
给大伙普及一下我用短短2个月时间不到炒股从10,9218,8,408,3.0,2017-08-15 16:13:38
江苏银行(600919)融资融券信息(08-11),7255,7,512,0.0,2017-08-12 07:47:05
社保加仓: 怎么跌的就会怎么涨上去（荐股）,6600,7,1015,4.0,2017-07-27 17:43:22
周线MACD下跌不低于前低，股价创新低，走背驰，,8119,11,194,2.5,2017-08-10 16:32:34
江苏银行是否出事了？,1136,5,103,0.0,2017-04-10 11:46:08
进场: “双重改革”受益股，社保养老金标的股,3989,5,1300,4.0,2017-07-31 11:04:59
炒股有三大好处！,6629,10,130,3.5,2017-08-05 14:14:59
周一收盘在8.5元以下。,7609,7,228,3.5,2017-08-05 13:53:42
10亿融资客+1年套牢盘+46亿解禁=调整2年！,13955,50,160,2.5,2017-08-03 10:11:52
这次解禁近市值450亿，按每天成交平均6亿，其中,11868,16,214,3.5,2017-08-03 22:40:33
今天买了174手，不看了 年底再说,12088,35,17,2.5,2017-08-02 13:46:30
江苏银行与华夏银行比较后 ：中线破净资是大概,29490,26,249,3.5,2017-08-01 15:56:13
江阴银行请看人类内燃机工业革命时期美国为什么,7072,39,531,3.5,2017-08-01 10:18:39
砸锅卖铁换苏行，新车新房带新娘，冲锋号吹起，,7408,16,222,3.5,2017-08-03 09:51:06
价钱合适，今天买了一点。 主力敢买，咱为什么,40755,75,191,3.5,2017-05-15 11:46:17
善意提醒：别小看这次大解禁！,31529,122,135,0.0,2017-07-28 14:18:42
江苏银行，彻头彻尾就是个骗子,7927,4,210,2.0,2017-08-02 14:10:58
江苏银行明日涨停板！,16071,20,156,1.0,2017-08-01 15:51:19
8月解禁规模环比上升19.3% 江苏银行解禁规模最,24141,2,230,4.0,2017-08-02 09:51:17
反向思维，今天应大力买进江苏银行,5946,12,142,3.5,2017-08-02 05:50:58
我想问一下，今天抢的筹码是为了明天砸盘吗，还,5068,11,194,3.0,2017-08-01 10:28:29
连续投诉了几天证监会都没有任何回应！骗子江苏,5518,10,218,3.0,2017-08-01 15:14:54
江苏银行董秘应该下课，网友在询问时为什么不能,8378,27,270,3.0,2017-07-31 17:12:50
举报江苏银行信息披露严重违规！！！它们披露的,7453,11,259,0.0,2017-07-26 04:19:28
2017年8月2日，江苏银行限售股解禁58亿股,20465,18,184,3.0,2017-04-28 21:31:24
600919:江苏银行关于2017年第一期金融债券发行,45440,10,537,0.0,2017-07-31 18:37:20
以9.08买回前以9.58卖出的江苏银行，可是还是掉,5607,6,192,3.5,2017-07-31 09:46:33
江苏银行限售股解禁日期，有图不一定有真相,14447,13,486,3.0,2017-04-30 16:38:25
江苏银行：短期关注分时缺口。,5340,10,147,4.0,2017-07-28 23:54:45
江苏银行：本人以连续净买入的实际行动，支持下,13028,20,158,4.0,2017-07-21 15:30:13
老牛iliepr的新希望,3752,8,144,4.0,2017-07-24 20:25:03
宁波港601018祝江苏银行涨停板,13228,37,86,4.0,2016-08-03 10:09:07
麻烦了！猜想系列1：在当下股东套现成风的环境,8187,22,280,0.0,2017-07-29 06:31:22
麻烦了！猜想系列2：本来如果没有这次解禁基本,8162,23,295,0.0,2017-07-29 07:06:35
下周一江苏银行不是跌停板我准备吃狗屎和猪粪。,9418,18,154,2.5,2017-07-29 10:13:15
600919:江苏银行:中银国际证券有限责任公司、华,62272,32,1407,0.0,2017-07-27 18:38:45
江苏银行限售股解禁点评：江苏银行2018年后净资,11432,24,294,0.0,2017-07-29 09:20:39
江苏银行解禁是巨大利好,11339,13,368,0.0,2017-07-28 23:18:38
割肉单亮相！,4817,19,63,3.5,2017-07-28 09:54:50
怎么突然变成解禁40亿股了？还要不要脸！,9612,18,205,3.0,2017-07-28 09:29:18
明天江苏银行不是涨停板我准备吃狗屎和猪粪。,13410,41,152,2.5,2017-06-28 15:00:27
江苏银行股这两天徘徊不前，原因是8月2日限售股,13628,28,142,0.0,2017-07-26 10:24:36
分析一下周k线。这周大概率收红，我觉得9.72左,5991,21,170,3.0,2017-07-26 15:29:29
沪指大盘前期的岛形反转形态基本确立本波反弹已,13048,45,296,3.5,2017-07-17 14:46:05
走势还可以，在突破平台后回抽，从10.19下跌8天,8476,13,41,3.5,2017-07-26 15:11:54
周1收盘单--老牛老牛老牛老牛老牛老牛老牛老牛,3806,12,265,3.5,2017-07-25 15:31:33
老牛周3收盘单来了，,6773,16,194,3.5,2017-07-19 15:14:12
珍惜你这一生唯一的解套机会，解套就走，逃离赌,7567,14,193,3.5,2016-12-12 10:44:59
有启动迹象,8578,13,120,3.5,2017-07-11 09:45:09
怎么突然冒出来38%的解禁？怎么提前解禁不出公,15519,22,158,3.0,2017-07-21 09:43:08
江苏银行：日线K图,10367,25,141,4.0,2017-07-18 21:42:20
咬住青山不放松。不到15元，就不出手。,19607,64,148,2.5,2017-05-13 19:38:56
10.42元,31420,56,120,2.0,2017-02-21 09:47:12
明天江苏银行不跌破9元我准备吃狗屎和猪粪。,6329,13,152,2.5,2017-07-11 15:52:20
明天不涨停，我直播裸奔，立贴为证！欢迎见证！,13756,23,158,3.5,2017-06-29 03:46:25
七大牛散坐镇江苏银行,13458,16,327,2.5,2016-12-16 22:30:41
C919正式启航,17858,64,131,3.5,2017-07-12 10:32:17
士气低落，我来鼓励下，江苏银行可持股到14元，,41059,59,1982,2.5,2017-04-13 19:04:45
江苏银行：刚做的日线图。,9396,34,144,4.0,2017-07-15 15:01:14
江苏银行今天必帐三个点以上，有钱开盘就满仓，,8085,16,113,3.5,2017-07-13 05:17:13
为什么说江苏银行能够涨到20元以上？？？,12793,17,320,0.0,2017-07-03 16:01:00
到处都有 张银三倍反超，我没有江苏银行到我认,9668,15,192,4.0,2017-04-16 16:59:34
转发自股友帖子，值得一读，值得借鉴！,15790,64,1406,3.0,2017-07-06 08:48:30
神马玩意，全是骗子。,9641,126,130,0.0,2017-06-16 14:48:13
现在买江苏银行10个交易日不涨到10元5我准备把,10448,18,190,2.5,2017-06-29 12:38:55
江苏银行今年8月份不涨到11元我准备吃狗屎和猪,7841,14,101,2.5,2017-07-06 15:46:34
目前来看 鸭子上翘嘴 悬了！,2901,14,14,0.0,2017-06-20 10:46:50
江苏银行股价：破9加仓。,3809,14,75,2.5,2017-07-04 17:36:17
撤吧！,9367,23,173,3.5,2017-06-28 14:49:19
600919:江苏银行关于董事辞职的公告,38802,16,514,0.0,2017-06-30 15:52:11
沪指大盘将在本周产生阶段性（从3016点反弹来中,9381,25,485,3.5,2017-06-20 09:09:52
江苏银行你看跌何不回家休息 ？,38581,138,421,2.0,2017-05-08 07:25:10
貌似任务已完成 喝茶观虎斗,2986,12,13,0.0,2017-06-23 10:33:26
更正： 6.21周三 必砸8.71元附近 你丫信不？,6008,24,162,0.0,2017-06-05 11:52:41
割肉的小散儿发出凄惨的嚎叫！叫声很悲凉！,38277,234,171,2.5,2017-04-17 13:11:31
600919收盘9.19，明日要起飞。,11480,22,148,3.5,2017-06-20 20:43:29
江行还是小姑娘，南行己是老太婆了,8153,15,133,3.5,2016-08-13 10:13:10
散户珍惜自已的筹码，不要被机构骗走了,14784,71,174,0.0,2017-06-07 10:05:12
江苏银行不涨之谜彻底被我研究透了！非常钦佩！,79197,104,259,2.5,2017-03-31 11:38:05
尾盘拉涨停！10.70元！,9900,51,139,0.0,2017-04-14 10:41:36
这票今天如果不拉板很不科学。,11771,46,132,3.0,2017-06-01 10:49:01
分红1.5%之后 下砸10% 算算账吧,5672,22,148,0.0,2017-06-05 13:34:38
尾盘拉涨停10.31元！   AAAAA,8692,34,152,0.0,2017-06-08 10:55:10
明天继续下跌,8691,24,122,3.5,2016-12-15 23:53:29
昨天给说 分1个跌10个 都不听嘛,6922,21,144,0.0,2017-06-06 11:17:09
小散们有钱就加仓 ，等到15元出一半,13872,147,146,0.0,2017-03-27 13:56:50
今天不涨停，小妹妹随你玩！,12224,20,125,0.0,2017-06-05 09:04:31
谁能解释哈，分了红为什么账户上的钱变少了！,9235,7,152,3.0,2017-06-06 09:01:44
被限售解禁吓着的，这回，上当了吧？,12897,37,224,2.0,2017-05-27 20:50:44
600919:江苏银行2016年年度权益分派实施公告,174872,38,1931,0.0,2017-05-25 19:16:05
放量滞涨特征明显，走人了。,10287,8,136,3.0,2017-06-02 14:39:55
江苏第一行[大笑][大笑][大笑]达摩之剑[鼓掌][,9945,27,159,0.0,2017-06-01 10:00:57
银行股走强领涨两市 江苏银行涨近3%,36701,5,265,0.0,2017-06-01 10:19:46
一日行情，此时不跑，更待何时,3953,7,126,3.5,2017-06-01 11:10:15
银行龙江苏银行,10711,13,126,4.0,2017-05-09 15:22:11
今天江苏银行能收复9.00，哥是尽了一份力的...,12547,38,140,2.0,2017-05-25 18:54:16
证监会：请依法常态化监管治市！查处操纵股价的,12795,36,349,3.5,2016-08-17 10:24:00
不玩了，9.21跑!,8590,25,128,3.0,2017-05-09 14:12:40
我的交易软件上显示江苏银行（600919）2017年08,16023,19,204,0.0,2017-05-21 22:46:44
已破位。,6486,20,123,3.5,2017-05-23 09:49:05
不知道9.88的本能不能解套,12548,17,138,0.0,2017-04-14 12:07:42
江苏银行需要耐心等待8元多,22711,70,78,3.5,2017-04-18 16:29:06
有江苏的朋友没？江苏银行在当地口碑怎样？能否,13418,21,160,0.0,2017-05-23 11:12:09
江苏银行流通市值500亿比较合理！,3789,8,152,3.0,2016-08-03 15:06:55
江苏银行这一波反弹不涨到10元5我直播吃狗屎和,14636,19,131,2.5,2017-05-09 18:57:12
从9.9元开始买的5000股，再每跌一毛就买5000股,13064,18,201,2.5,2017-04-28 14:50:25
周末，经济学家韩志国连发两篇文章，揭露新股发,13646,15,249,1.5,2017-05-22 17:39:03
诉讼缠身长期应收款剧增5倍 江苏银行资产质量承,39379,27,2487,0.0,2017-05-20 01:03:02
江苏银行永远不会出现9元以下的股价了，马上分,13123,11,181,2.5,2017-05-19 14:07:47
上图啥也不说了,13881,30,7,3.0,2017-05-17 16:58:57
江苏银行在这个节点一定爆发！排山倒海！,46165,133,370,2.5,2017-04-10 11:42:33
江苏银行必然跌到4元的原因分析,15419,27,81,3.0,2017-05-12 18:55:46
江苏银行第一目标68元 未来的深发展,12819,11,86,3.0,2017-05-13 16:33:07
江苏银行最大利好是没有真正大股东！,25333,54,177,2.5,2017-04-22 06:33:24
李志林本周周评应上人民日报,8520,12,552,0.0,2017-05-06 07:43:32
江苏银行惊人发现，流通股10%，十大流通股东就,14316,14,109,2.5,2017-05-02 16:57:32
江苏银行：2016年净利润同比增11.72% 三只社保,29243,30,345,0.0,2017-03-19 15:45:58
同志们！我是个菜鸟，我想咨询一下：我10.00的,18547,28,215,0.0,2017-03-24 16:09:21
妥妥的了，江苏银行被举牌了！,16003,25,247,2.5,2017-05-07 16:31:47
不少次新股银行类股票已涨到20多，可江苏银行才,123803,395,174,2.5,2017-03-01 06:45:48
江苏银行：一季度净利30亿元 同比增11%,25649,21,186,0.0,2017-04-26 20:11:45
江苏银行估值太高，只值６元！,6765,3,162,4.0,2017-05-01 23:14:52
关于江苏银行限售股解禁的时间和数量，到底信哪,26778,29,167,3.0,2017-04-28 22:03:25
“小”而美，“变”则优,87591,41,1161,0.0,2016-09-04 13:57:39
江苏银行的股价到了阶段性顶部，以盘整为主，建,23552,47,127,4.0,2016-08-19 09:45:49
f10里看到： 2017年8月2日，限售股解禁58亿股,6393,10,140,3.5,2017-04-28 13:07:06
江苏银行确确实实全面向好！！！,6035,9,147,0.0,2017-04-28 14:00:14
做多资金今日提防地位反杀局，目前3毛钱空间空,3751,37,156,3.0,2017-04-27 09:03:29
真的没良心，江苏银行从15元跌到9元，没良心,5334,6,154,0.0,2017-04-27 20:33:43
0725倒数第一股价业绩倍增半导体显示全球领导者,49266,154,205,4.5,2016-09-19 21:03:12
一季报速递：江苏银行2017年一季度盈利29.88亿,13355,2,229,0.0,2017-04-27 07:34:09
息差超预期；拨备计提稳健,33694,2,1123,0.0,2017-04-27 10:30:08
600919:江苏银行2017年第一季度报告,80148,9,1026,0.0,2017-04-26 19:28:45
是谁造就了中国股市熊冠全球,4228,15,136,3.0,2017-04-24 15:12:18
大家看看梅雁吉祥的走势，再看看本人在吧里的留,63515,125,164,4.0,2016-10-26 12:48:09
2016年报点评：生息资产、手续费快增，资产质量,25415,5,1393,0.0,2017-04-20 08:51:44
急诊！！！各位大哥帮忙分析一下该怎么办,16416,33,148,0.0,2017-04-14 16:09:47
股友们大家算一笔帐，比如拉芳603630新古，发行,12450,10,261,3.5,2017-04-14 23:03:01
600919:江苏银行关于发起设立消费金融公司进展,56994,24,1817,0.0,2017-04-12 19:37:13
黎明之前的黑暗。,9630,33,126,3.5,2017-04-12 16:43:38
2016江苏银行分红啦！！！！每10股送1.78现金（,25845,18,188,3.0,2017-03-19 14:30:02
今天在割在地板上9.75割的，觉得割对的点赞,7782,10,154,3.5,2017-04-10 16:17:22
江苏银行投资分析,21153,8,312,0.0,2017-04-08 04:18:14
放行银行股就是为权贵的帐面收益快速变现,9868,19,173,2.5,2016-08-05 15:56:38
600919:江苏银行2016年度股东大会会议文件,31633,6,1459,0.0,2017-03-30 17:42:08
静看江苏银行走势。,43207,119,128,3.5,2017-03-03 18:36:26
600919:江苏银行:关于江苏银行股份有限公司非公,40855,24,1497,0.0,2017-03-27 17:54:52
江苏银行前十大流通股股东变阵：机构替换“牛散,32818,4,1177,0.0,2017-03-28 02:15:23
600919:江苏银行关于非公开发行优先股申请文件,26932,7,650,0.0,2017-03-27 17:53:32
600919:江苏银行关于签订战略合作协议的公告,30733,28,830,0.0,2017-03-21 19:56:12
江苏银行公布2016年报：以绿色金融引领战略转型,14011,18,741,0.0,2017-03-22 18:59:58
次新银行股中 股价最低11元以下 业绩最优良 最,8549,2,271,3.5,2017-03-24 21:50:03
江苏银行：与华为签订协议 正式建立战略合作关,23758,20,232,0.0,2017-03-21 21:45:15
江苏银行2016年净利润同比增11.72%,11622,8,364,0.0,2017-03-19 21:50:44
我再重复第三遍，你敢跌破9.91我就加满仓，快跌,5418,6,166,3.5,2017-03-22 10:22:27
八个涨停板,6078,7,245,4.0,2017-03-23 04:19:03
再次善意推荐一支好股：现价7.55的美菱电器，中,4218,7,180,4.0,2017-03-22 13:57:28
善意提示：火速换掉银行股 买入79元附近的移为,3586,15,160,4.0,2017-03-21 10:20:05
600919:江苏银行:中银国际证券有限责任公司、华,24778,4,1688,0.0,2017-03-21 19:56:25
600919:江苏银行2016年度业绩说明会会议纪要,33003,6,1894,0.0,2017-03-21 21:00:21
下周跌破9元,11245,16,122,3.5,2017-01-19 14:24:47
规模快速增长，不良改善可期,14196,15,1061,0.0,2017-03-20 17:49:03
江苏银行去年净利增11.72% 三只社保基金抱团入,17098,6,747,0.0,2017-03-20 06:34:00
手续费增速亮眼，关注资金条线转型升级,12887,10,1711,0.0,2017-03-20 10:40:16
600919:江苏银行2016年年度报告,32025,6,989,0.0,2017-03-19 14:14:29
600919:江苏银行董事会决议公告,10746,7,1670,0.0,2017-03-19 14:13:02
看图说话,34628,55,4,4.0,2016-10-16 11:14:37
江苏银行9.83成本价随我买进5000股的朋友都成绩,6724,59,121,0.0,2017-03-16 14:02:20
600919:江苏银行关于收到《中国证监会行政许可,50683,17,552,0.0,2017-02-14 15:41:00
哪位仙人能告诉我，13.06的成本还能回来吗？,13892,33,156,3.0,2016-09-12 20:37:47
此股有国家队压盘，不碰为妙！,11393,16,188,3.5,2017-03-08 13:19:52
买了就压箱底，没有一只次新股不突破第一次的高,10526,31,160,2.5,2017-03-10 09:36:49
江苏银行正式入局刷脸取款增至三家,12832,7,388,0.0,2017-03-14 03:54:17
相比较别的次新银行股，江苏银行应该在18元以上,8140,16,158,3.5,2017-03-09 12:34:56
安安心心等待年报分红！,8145,10,177,3.5,2017-03-12 17:42:09
600919:江苏银行关于聘任高级管理人员的公告,35420,10,1011,0.0,2017-02-24 16:58:44
今天次新银行大跌，希望江苏这垃圾砸到10元，等,1923,15,141,3.5,2017-03-10 11:06:40
江苏银行不仅下跌而且一直操纵下跌 太无耻,2120,16,165,0.0,2017-03-10 11:43:32
老是早上拉高，后下来，出货概率大，准备子弹，,1778,14,201,0.0,2017-03-10 11:53:48
银行股有集体出货的迹象，尤其是江阴，量柱拉的,4496,26,217,0.0,2017-03-10 21:16:45
同批次新股暴涨，滞涨的江苏银行会否被操盘养老,18149,40,152,3.5,2017-03-02 11:10:43
张家港银行再次涨停，难道不能带动你也涨涨！,13297,54,152,3.0,2017-03-01 11:05:42
季报0.78元，9.6亿元参与苏银金融租赁公司增资,61093,269,275,2.5,2016-10-30 17:05:31
不看别人赚多少；不攀他股涨几板；不听专家怎么,6866,4,239,3.5,2017-03-07 09:10:15
大胆潜伏: 怎么跌的就会怎么涨上去（荐股）,8095,10,623,4.0,2017-01-18 07:31:06
江苏银行即将成为妖股，验证吧,20416,21,79,0.0,2017-03-02 14:57:07
从大盘惊魂两天（上周四，五两天）看江苏银行表,6957,3,296,3.5,2017-03-06 07:47:40
布依现价买入600919,7248,7,134,4.5,2017-03-02 13:39:47
我查了一下资料发现问题主要出在董事长夏平身上,4513,7,247,2.5,2017-03-01 23:48:50
江苏境内的好多银行都涨停了，你还像个几把那,5627,19,21,2.0,2017-02-28 09:57:31
昨天10.08元清仓江苏银行一夜未眠，昨晚各地新,15478,21,275,2.5,2017-02-25 10:05:13
数只江苏地方银行连续涨停600919江苏银行相对低,22608,71,147,3.5,2017-02-21 10:33:05
其他次新银行股都很贵了，只有买江苏银行了,6296,5,151,3.5,2017-02-28 11:39:58
看看江阴银行股价17元多，再瞧瞧江苏银行10元多,12767,37,233,2.5,2017-02-24 15:47:32
下午要是再跌一点～～,8227,27,221,3.0,2017-02-21 11:45:41
江苏银行上10元即可到来,29228,47,108,3.5,2017-01-24 22:32:14
下周一长阳或涨停600919江苏银行[大笑],8443,9,150,4.0,2017-02-25 13:03:26
江苏银行上市的真实政治目的,76690,140,417,3.0,2016-07-24 07:07:48
明天必涨领头羊！,7372,7,126,0.0,2017-02-21 18:14:15
今天上午的走勢说明起跳前下蹲，下蹲越低弹跳越,5199,5,230,3.5,2017-02-24 11:51:52
死了都不卖 不给我翻倍不痛快 我们散户只有这样,13481,26,268,1.0,2017-01-13 00:22:08
开头篇： 我喜欢你美貌（次新）；年轻（市值）,3745,10,213,3.5,2017-02-15 08:59:39
吴江银行低开拉涨停，估值最低江苏银行也要表现,8025,13,97,2.5,2017-02-20 09:51:47
江苏银行最大优势是股价最低的次新股,13108,34,185,3.5,2017-02-14 09:17:54
2016年快报点评：资产总额增速较快，不良率持平,29050,7,597,0.0,2017-01-24 20:14:33
前面买入的先站岗,24335,62,125,3.5,2017-01-06 13:17:22
啪啪啪啪！四个响亮的大嘴巴子！抽得空狗们晕头,11627,29,204,3.5,2016-08-05 09:23:46
股价最低的次新股,5355,8,231,3.5,2017-02-14 21:03:37
