标题,阅读,评论,字数,影响力,时间
中签者看过来，务必顶上去让更多人看到。,130113,774,691,3.5,2016-07-22 09:49:19
注意啦：开板也不要卖，要看几天！！,12084,45,160,3.0,2016-08-03 20:31:05
江苏银行前10大股东，华西股份排名第九，是唯一,6800,12,109,3.0,2016-08-04 17:25:48
起码还有3个板，理由,7799,6,335,1.5,2016-08-04 23:37:05
江苏银行中签涨板获利计算，19涨板，供大家参考!,24280,40,1154,3.0,2016-08-01 21:42:34
江苏银行中签率及盈利预测。,128139,99,458,3.5,2016-06-24 10:20:42
苏银将被爆炒！十大股东不是基金也不是个人的这,27182,68,361,3.0,2016-08-03 18:21:03
量能再次缩小江苏银行！,5190,5,192,4.0,2016-08-04 15:56:35
配号尾数100010284106，虽然还没有公布中签号，,9921,12,209,4.0,2016-07-21 18:46:04
我每天都坚持挂买单100股，大家像我一样齐心一,2245,11,170,3.0,2016-08-04 10:34:37
注意！卖出10手以上的单，基本确定是机构联合对,14246,49,212,3.0,2016-08-03 21:26:36
对比其它银行数据，江苏银行市盈率偏高，市净率,4075,4,237,3.5,2016-08-04 22:14:33
女儿开学学费和昆明旅游就看你得了，100元，加,15809,50,25,3.5,2016-08-02 17:26:06
江苏银行不破发的根本原因（9.19元是起步价）,24626,22,1078,3.5,2016-07-22 06:05:46
江苏银行什么时候开板？我来告诉你答案,55561,138,790,3.0,2016-08-04 10:34:36
江苏银行30个涨停,8370,17,129,3.5,2016-08-01 22:31:27
半夜挂新股12.01能不能行？？？？,5927,4,146,3.0,2016-08-05 00:08:28
9元03分已经挂上了！十手不多,7548,15,140,3.5,2016-08-01 19:56:14
江苏银行今日正式登陆A股,26365,17,1267,0.0,2016-08-02 01:58:18
今天我来段顺口溜，说说这江苏银行怎么走，众小,17543,54,265,3.0,2016-08-04 14:52:13
兄弟们，中签才多少钱，急什么卖，大不了当不中,6403,10,204,3.0,2016-08-04 20:30:27
叫开板的3种人 1、没中新股的，酸爽型；2、中了,4346,8,249,3.0,2016-08-04 21:32:56
江苏银行净利增速保持两位数 上市首日涨幅触及,29842,9,1274,0.0,2016-08-03 03:48:10
紧急通知！紧急通知！紧急通知！,81451,383,460,3.0,2016-07-24 18:58:09
有钱出钱天天封涨停，没钱出力为封涨停的喝彩，,4500,22,184,3.0,2016-08-04 16:57:13
明天继续数板,8186,14,132,3.5,2016-08-04 19:38:37
不开板不卖！,3378,6,264,3.5,2016-08-04 11:58:12
由于90%的限售股在2019年才卖，目前流通股只占,9057,11,222,3.0,2016-08-04 19:14:59
有人说江苏银行上市后会跌破发行价，我说绝不可,86408,132,294,4.0,2016-07-20 11:05:10
相信能上15的，来顶个，团结就是力量,4526,21,133,2.5,2016-08-04 10:31:17
NND，第一天9.03就跑了！,25926,68,143,3.5,2016-08-03 09:33:57
开板价将超越其他银行股，否则还叫新股？另外大,5494,5,204,3.0,2016-08-04 18:15:50
五个亿的江苏有限，曾经炒到70，十个亿的江苏银,9255,11,172,2.5,2016-08-04 19:59:21
如果按500亿的流值计算，目标价为43.32元！,3564,3,158,3.5,2016-08-04 20:12:04
江苏银行一定会被爆炒[赞][赞][赞],3121,7,80,3.0,2016-08-04 14:29:42
筹码锁定良好，明天大慨率会继续涨停。,3763,6,146,3.5,2016-08-04 20:00:57
江苏银行35元开盘！,3878,4,71,1.5,2016-08-04 18:42:22
团结就是力量 10手的卖单不一定是散户的，骗筹,3895,9,212,1.5,2016-08-04 15:55:56
三棵树赚了12万1000股。江苏银行才赚了几千块，,13385,15,230,2.5,2016-08-03 22:11:24
亲们，那位算一下，大约多少市值能保中一签江行,14560,12,144,3.5,2016-06-21 20:40:00
江苏银行连续“涨停”一览表,25553,36,352,2.5,2016-07-28 18:23:32
按照现在的换手率，没有20个涨停板，机构是砸不,5375,8,182,2.5,2016-08-04 18:03:06
手贱，点错，清仓了，求安慰，如何才能买回来，,10564,21,170,2.5,2016-08-04 15:29:45
328万股江苏银行遭弃购 主承销商“捡漏”昨日浮,82300,84,1737,0.0,2016-08-03 04:03:53
好好捂股、江苏银行天天向上！,17722,79,791,3.5,2016-08-04 03:11:34
贴封单，信心比什么都重要！坚定信心！,6850,31,130,3.5,2016-08-04 09:28:49
希望江苏银行特停,8679,30,142,2.0,2016-08-04 14:22:01
江苏银行静态股价123.87元应该不属于暴炒,8160,18,199,2.5,2016-08-04 15:09:45
新股不用看估值，也不要预测打几个板，走一步看,8485,17,290,4.0,2016-08-04 12:41:41
叫开板的3种人,3344,10,216,1.5,2016-08-04 10:21:19
江苏银行很有可能创造银行股新的神话，江苏神行,5271,15,218,3.0,2016-08-04 16:21:54
想问问本周卖的人，难道你就等这几千元钱用吗？,5444,16,215,4.0,2016-08-02 13:00:29
至少还有10个涨停,4222,11,121,2.5,2016-08-04 10:26:07
江苏银行定位！说破发的，说盘子大的可以离开了,33155,91,416,3.5,2016-08-02 10:45:40
江苏银行能否激活银行板块达到合理估值？,6499,13,148,4.0,2016-08-02 17:10:23
今日江苏银行上市，江苏银行本次申购价格为6.27,6066,7,1129,3.5,2016-08-02 21:35:36
江苏银行连板的方法,21136,40,281,3.0,2016-08-03 16:51:06
对比兴业银行、浦发银行，江苏银行股价到二十元,9243,9,187,3.5,2016-08-01 17:26:32
江苏银行将成为银行板块龙头！,11989,21,122,2.0,2016-07-23 08:53:16
初步推算涨停11个,6794,15,180,2.0,2016-08-03 15:27:25
明天开板，收盘跌5%，立帖为证！,7146,23,141,2.5,2016-08-04 12:19:33
江苏银行会破发吗 欢迎质疑  江阴农商行 贵阳银,7514,10,170,3.5,2016-07-23 18:38:38
苏银今日换手率0.47再创新低,5043,11,140,3.5,2016-08-04 15:02:12
江苏银行第11个板可以超中信,4135,6,145,2.0,2016-08-04 14:00:47
愿主保佑！愿神灵保佑！愿长生天保佑！苏行开板,3436,10,139,2.5,2016-08-02 13:08:06
经历过的：中国核建，3元多一一21元多抛的！小,7668,13,195,3.5,2016-08-04 12:03:26
图为证！每天9:15有钱的买10手，没钱的买1手，想,2928,5,793,3.0,2016-08-04 11:35:45
100元以下不卖联盟请举手[献花][献花][献花][献,2143,10,163,3.5,2016-08-04 07:20:38
注意！说卖了的！都是庄家派来捣乱，扰乱股友信,1601,10,222,2.5,2016-08-04 10:13:06
我觉得江苏银行会破发，也是炒新暴利的终结者,6792,17,152,2.5,2016-07-23 10:46:36
江苏银行真实情况分析,6536,19,587,1.5,2016-08-04 13:12:25
中签者看过来!!!!!! 务必顶上去让更多人看到。 ,3280,13,774,2.0,2016-08-04 12:29:36
我用测算法，认真推算了一下认为该股至少能涨到,5906,8,180,4.0,2016-08-04 10:39:16
中签者看过来!!!!!! （转，但是要顶在前排，不,7402,42,773,2.0,2016-08-04 10:24:49
严正声明：让苏银吧里多点正能量，请唱空的、说,12361,44,338,3.0,2016-07-25 14:24:01
大智慧十档看盘显示，接单的都是大单，中签的朋,5765,16,109,2.5,2016-08-04 10:36:32
呼吁中签的天天涨停挂1000股，打开涨停再卖出中,4622,18,183,3.5,2016-08-02 11:42:36
那些说破发的，开板的,2276,9,134,3.0,2016-08-04 13:08:42
中签的幸运者，告诉大家每签挣10万的诀窍：3005,21469,38,243,3.5,2016-07-28 22:53:36
为什么抛盘一天比一天少，什么情况啊？,6989,11,130,2.5,2016-08-04 11:29:20
今天不会开板了，全天成交量不会超过昨天的。,6758,28,152,4.0,2016-08-04 09:48:39
转发“原始股59”的江苏银行什么时候开板？我来,8724,24,760,2.0,2016-08-04 10:49:25
今天该不该卖啊？,4605,24,151,3.0,2016-08-04 10:33:04
中签者看过来!!!!!! （转自别的新股吧）,12815,65,720,2.0,2016-08-03 15:15:05
江银机构对倒，千万别上当受骗！,20721,55,333,3.5,2016-08-02 16:59:24
市值已经超过了建设银行，太可笑了,3956,19,144,1.5,2016-08-04 09:45:56
江苏银行首秀超市场预期 上市银行股打开估值空,94250,133,1743,0.0,2016-08-03 00:13:35
同志们，今天封单减少，加油每人加一手。,2990,23,148,3.0,2016-08-04 09:26:29
中国核建流通5亿股本，160万手成交量第二天开板,5447,8,156,2.0,2016-08-04 06:29:55
今天会打开，散户快抛，第二个中石油，今天买的,3240,24,170,2.0,2016-08-04 09:24:28
江苏银行向50元出发。,2998,14,73,2.0,2016-08-03 14:16:27
同志们 朋友们：我们散户有100万个中签的 大伙,1535,8,203,2.0,2016-08-04 09:11:24
今日必开板,3207,16,120,3.0,2016-08-04 09:14:39
机构疯狂出货套现，小散快来接盘！天下哪有十几,2338,7,172,2.5,2016-08-04 08:50:03
江苏银行没卖出的朋友都来这里顶帖吧，每天都来,3305,31,244,3.0,2016-08-03 11:03:05
抛盘几近枯竭,5993,14,122,4.0,2016-08-03 13:27:11
结合其他几个银行的发行价对比后复权价格，因为,3113,7,222,3.0,2016-08-04 07:46:14
江苏银行没卖出的朋友都来这里顶帖吧，每天都来,12816,132,233,3.0,2016-08-03 10:45:27
明天500万手封单，全天一字板,6484,14,140,2.5,2016-08-03 22:33:12
不是苏银估值高，是其他银行的估值太低。 不要,3854,8,194,4.0,2016-08-03 14:16:49
大家谈谈什么时间容易中签？,10264,9,170,4.0,2016-08-04 06:15:33
明天大慨率会继续涨停！,9699,11,179,3.5,2016-08-03 20:08:22
江苏银行满打中一签，中签的大部分人都有百万以,10437,11,246,3.0,2016-08-02 23:08:04
不要怪我没提醒，明天开板，然后走低到9.2左右,10049,11,221,2.5,2016-08-03 23:12:03
20以上是肯定的，给大家看看每天的涨停价,11299,17,290,2.0,2016-08-03 21:55:31
一二三，大家一起努力吧，江苏银行明开板，时间,5342,7,164,2.5,2016-08-03 22:30:35
8月3日苏银收盘播报。 集合竞价成交23135手， ,29478,79,565,4.0,2016-08-03 15:10:58
城商行组团IPO，你会买银行股吗,31918,22,1654,4.5,2016-08-03 08:03:52
所有银行股市盈率都在5－7倍，苏银明天必开板，,23268,72,174,2.5,2016-08-02 15:14:23
觊觎九年城商行IPO终破冰 江苏银行立商业银行上,32231,4,2907,0.0,2016-08-03 06:53:40
银行板块迎新 江苏银行明日登陆A股,28618,29,1090,0.0,2016-08-01 21:05:33
比一百家创业板小公司利润还多的袖珍银行8月2号,10349,14,249,2.5,2016-08-01 00:07:21
炒江银新股，讲究的是顺势连续涨停...,13125,41,401,3.5,2016-08-03 16:19:51
6.27元乘2是卖出点[胜利],6815,13,136,4.0,2016-08-03 18:31:35
江苏银行新股上市30天内和银行、市盈率没有半毛,3198,6,184,2.0,2016-08-03 21:33:13
坐看破发[胜利][胜利][胜利][胜利]，银行资管加,4028,7,174,3.5,2016-07-29 16:27:30
新股应该什么时候卖出？来点干货 首先大家要明,5913,3,931,1.0,2016-08-03 20:29:13
小散千万不要相信挂几手这种话，一旦开板，套的,6278,12,214,2.5,2016-08-03 18:18:36
江苏银行明天9点35分必定开板，随后逐步到发行,12449,23,107,2.5,2016-08-03 18:10:00
希望各位中签的散户锁住筹码，珍惜机会，坚决不,5948,27,307,2.5,2016-08-03 15:12:49
江苏银行明天可能上市，新股破发第一家，没人要,10962,17,145,4.5,2016-07-31 12:01:40
说明天开板完全就是没有吃到葡萄酸溜溜的滋味！,20321,40,154,5.0,2016-08-02 18:36:37
中国电影中签者来向江苏银行吧祝贺，祝天天涨停,5450,11,97,2.5,2016-08-03 19:34:16
宁波银行总股本39个亿市盈率7.04倍，江苏银行总,14327,25,98,4.5,2016-08-01 22:32:07
真搞不懂一些死脑筋为会么总是要纠结江苏银行的,4264,7,174,3.5,2016-08-03 17:40:46
明天要开,8071,22,118,2.5,2016-08-03 15:01:22
中签者看过来,3416,13,713,1.5,2016-08-03 16:08:20
明天开板！信不信由你，反正我是信了！   真不,13916,35,274,4.0,2016-08-02 13:05:23
8月3日，下午至尾盘买单为何从320万降为80万？ ,7506,6,179,3.5,2016-08-03 16:09:11
江苏银行明天不开板，后天必然开板,19987,38,1169,3.0,2016-08-02 15:58:54
有大单抛出了，快跑,7231,23,128,3.0,2016-08-03 09:46:55
新股股价炒作高低完全靠中签者的持股信心,4140,9,359,4.0,2016-08-01 08:17:16
走势会不会与江苏有线一样啊？抛盘的人逐渐减少,4657,6,156,3.0,2016-08-03 15:14:58
昨天上午承销商瞬间抛光了被弃购的三百多万股股,3427,6,310,2.0,2016-08-03 12:57:35
从昨天到今天的封单来看，江苏银行至少要20以上,10456,20,216,2.0,2016-08-03 11:59:31
苏银今日换手率仅为0.68,7113,15,136,3.5,2016-08-03 14:48:46
江苏银行中签率预测！,9262,14,175,4.5,2016-07-19 21:14:58
江苏银行必须涨到100以上银行就是有钱，银行就,14702,62,134,3.5,2016-07-30 16:09:18
江苏银行(600919)龙虎榜数据(08-02),109885,73,585,0.0,2016-08-02 16:22:32
N苏银今日超大单流入排名第7名(08-02),52561,27,329,0.0,2016-08-02 16:05:16
银行板块不动，“江苏银行”明日开板是大概率！,3508,5,158,2.5,2016-08-03 14:06:17
不敢奢望能涨多高，按现在熊市必炒新股的惯例，,4614,17,186,4.0,2016-08-03 10:56:41
今天不开板，直播剁吊,13303,56,130,2.5,2016-08-03 08:44:51
挂十手买单,1529,9,169,1.0,2016-08-03 12:33:29
为什么江苏银行市盈率非要向其他的银行股看齐？,3361,12,215,3.5,2016-08-03 12:09:50
实时贴封单，请坚定信心！,6850,35,124,3.5,2016-08-03 09:31:45
新股庄家操作的一些己见 1、首先，庄家手里是没,8478,10,535,2.0,2016-08-02 19:23:27
苏银价格预算。,10023,18,196,2.5,2016-08-03 06:55:36
江苏银行的中签者预祝明天贵阳银行发行成功，大,3140,9,142,4.0,2016-08-03 10:28:32
苏行最低估值，每股118元，这是最低估值！,5144,15,152,4.0,2016-08-02 12:05:18
147个配号 怎就不中？,10128,14,130,3.5,2016-07-22 15:54:33
中签者看过来600919,5953,12,572,3.0,2016-08-02 14:18:04
机构在大量抛出！,3173,13,126,3.5,2016-08-03 09:31:00
今天跌停板开盘，连续跌停板大戏开始了！,3412,22,140,1.5,2016-08-03 08:30:53
专家机构股评说，小康9元，结果47，马桶盖15，,20659,41,173,3.0,2016-07-24 20:47:25
今天集合竞价封板量是昨天的4倍。,3470,13,142,4.0,2016-08-03 09:29:42
封单实时贴出来，坚定信心！,1538,4,132,3.5,2016-08-03 09:29:33
我噻，4.8亿股封板，比第一天还牛逼,3061,9,146,3.5,2016-08-03 09:16:31
同志们我们玩的是市梦率，不是市盈率！,1289,12,146,3.5,2016-08-03 09:19:55
江苏银行就是一只新股，不要跟同行业去比较，如,3386,6,207,4.0,2016-08-03 07:21:55
8月2日苏银收盘播报。 集合竞价成交5863手， 开,32141,70,644,4.0,2016-08-02 16:45:51
三新股集中上市 N苏银顶格秒涨44.02%,71796,28,640,0.0,2016-08-02 10:14:08
小散是股市做多的正能量，机构是恶意做空主力军,4133,9,258,4.0,2016-08-03 05:43:00
今早，封单约2百3拾万，收市约1百万，筹码减少,11208,14,180,3.0,2016-08-02 20:58:37
江苏银行上市首日受追捧,13671,5,1090,0.0,2016-08-03 03:14:02
关于江苏银行股份有限公司人民币普通股股票上市,135708,54,318,0.0,2016-08-01 09:09:32
写在江银和贵银将联袂上市前夕,25342,25,933,4.0,2016-07-31 19:16:14
看看资金流向吧，谁在买谁在卖一目了然。中签的,8017,11,196,4.0,2016-08-02 12:36:01
咋感觉明天就会开板[大笑][大笑][大笑],5017,7,140,2.5,2016-08-02 22:44:53
不看好的以及被忽悠卖掉的请走开，新股就是新股,3771,7,203,2.0,2016-08-02 21:28:20
希望来15个板以上，同意点赞[胜利],5057,10,142,1.5,2016-08-02 17:17:05
请问江苏银行你什么价位卖？,22424,42,136,4.0,2016-07-29 20:20:15
为什么我发布的帖子不见了。我说苏银有可能创最,11033,15,234,3.0,2016-07-23 14:14:54
真的很奇怪，白送1000股股票么？,10686,7,206,1.5,2016-08-02 17:45:28
紧急通知！不要去回复那些说江苏银行要破发的贴,5987,28,504,2.0,2016-08-02 16:32:32
祝贺中签的朋友，这次中签比想像低太多，满打都,11234,12,253,3.0,2016-07-22 01:16:48
想知道为什么今天卖出8000多万吗？,13242,17,332,2.5,2016-08-02 14:57:54
江苏银行是银行蓝筹股的引擎和催化剂！师母已呆,6630,10,109,3.0,2016-07-30 13:25:42
明天开板,5993,11,118,4.0,2016-08-02 19:01:02
江苏银行开启A股上市之旅 首秀顶格涨44%报9.03,46081,26,818,0.0,2016-08-02 10:19:24
请问大家中的是一千股还是两千股？,7562,17,142,2.5,2016-08-02 16:30:45
明天必定开板 空仓几天了 搞一手玩下[大笑][大,3540,11,158,2.5,2016-08-02 21:09:49
之前江苏有线中签率1.24%，都24个涨停！江苏银,9680,14,193,3.0,2016-08-02 20:04:38
中国经营报这种恐波法的文章出来，让中鉴的情何,12187,11,223,4.0,2016-07-24 15:51:31
江苏银行流通盘其实很一般，才一百多一点亿市值,4599,6,180,3.5,2016-08-02 18:35:35
好了，没走的，还在的来报道一下[微笑],8919,40,144,3.0,2016-08-02 10:07:35
这是我见过最奇葩的股，第一天成交量居然差不多,13773,9,182,1.5,2016-08-02 14:47:27
可怜之人，必有可恨之处，上午卖出的，进来看看,13792,30,143,3.5,2016-08-02 12:55:27
知足常乐,19236,71,146,3.0,2016-08-02 10:52:08
江苏银行将开新股破发的先河，理论价值2.14元！,8660,19,114,1.5,2016-08-01 15:28:36
明天就破板[不屑],6983,22,124,4.0,2016-08-02 14:43:12
江苏银行20元到24元之间开板.25元也有可能,5908,13,173,3.0,2016-08-02 15:57:10
说破发的都会跌破眼镜,1653,4,85,3.5,2016-08-02 09:08:55
在江苏银行达到15元之前没必要看盘,3068,4,269,3.5,2016-08-02 15:50:06
0.9的换手率，对新股来说比较高了，那些蠢人在,6947,9,160,1.0,2016-08-02 14:39:04
小伙伴们实现诺言的时候到了,4560,19,149,3.0,2016-08-02 10:09:29
想问一下，有人买进了没？,6540,15,134,2.0,2016-08-02 10:19:18
怎么第一天可以成交那么多呢[滴汗],8015,19,140,2.5,2016-08-02 11:41:15
还不跑？就跑不了了！快卖9*02元！,4498,16,146,2.5,2016-08-02 10:57:34
此股有许多第一次中签的人，不太明白新股规则，,6753,8,327,4.0,2016-08-02 13:12:19
资金零售转型升级，资产质量边际趋稳,70281,36,1570,0.0,2016-07-22 09:52:12
明天不开.我就不炒股了[大笑],5704,17,136,3.0,2016-08-02 11:05:09
关于江苏银行上市后价格走势分析一是江苏是我国,9616,13,269,3.0,2016-07-25 10:09:34
老子卖了，谁说的破发，,4552,15,132,2.0,2016-08-02 09:35:55
100万股以下的买单都可以撤单了,4578,22,166,3.5,2016-08-02 10:44:22
中国核电发行近40亿股，还遇到股灾1.0都在首日,7465,21,155,2.0,2016-08-02 10:50:23
中签也许一辈子也就一次！要珍惜手中的筹码！,2555,13,706,1.0,2016-08-02 11:10:16
我没中签，祝苏行破发50%。,5125,19,130,2.5,2016-08-02 09:11:03
明天跌停板！,2584,12,122,2.0,2016-08-02 10:20:45
哎，服了，这么多蠢货炒股，新股涨幅限额44%会,13824,30,184,2.0,2016-08-02 09:35:05
"拜財"" 中簽 88888888",15240,51,336,4.0,2016-06-20 09:14:16
你妈我最早9.03挂单十万股怎么一股也没有买到！,5023,14,188,3.5,2016-08-02 10:13:09
600919为什么没有交易？,9702,17,144,1.5,2016-08-02 09:44:02
想知道今天换手率这么高是好还是坏啊,4408,10,144,2.0,2016-08-02 10:06:49
凭什么江苏银行的股价比净资产高！老银行哭瞎在,4236,13,160,3.5,2016-08-02 09:19:00
江苏银行8月2日将在上交所正式挂牌,15033,11,209,0.0,2016-08-02 08:51:13
屁大个地方商业银行；江苏银行圈钱724亿元，后,10018,16,173,4.5,2016-07-31 21:40:12
江苏银行明天就要登台亮相了，破发的概率及大，,10946,19,166,4.5,2016-08-01 16:49:46
空狗一辈子都中不到签。就这素质，散户团结起来,1416,8,154,3.5,2016-08-02 09:32:31
已经在涨停价下单了~~,6164,20,137,2.0,2016-08-02 09:10:20
恭喜中签的！以破发开盘，创A股先例[鼓掌][大笑,9368,31,152,3.0,2016-08-01 22:39:01
打压中小创新兴题材成长行业，关注蓝筹银行,1578,8,151,4.0,2016-08-02 07:17:05
新股中签=运气+真诚,3129,11,136,4.0,2016-08-01 19:00:53
二十个涨停板以下坚决不卖，大家顶起来,5520,18,146,3.0,2016-08-01 11:27:27
不排除暴炒，最高可到,27170,46,150,3.5,2016-07-22 07:04:57
江苏银行连续“涨停”一览表 天数 涨幅 股价 第,31999,44,378,3.0,2016-07-26 22:37:14
哈哈哈哈，我今天已经锁定资金6270元了你们呢,17904,37,156,3.0,2016-07-22 10:49:11
江苏银行破发是板上钉钉的事！江苏银行的上市或,4073,5,123,4.0,2016-08-01 22:29:29
刘强东猛追奶茶，为什么不找张柏芝?,7857,22,164,4.0,2016-07-22 11:37:47
唱衰骗筹:鸡狗们开轮第一板斧,16466,49,1091,4.0,2016-07-24 09:44:20
请每个中签和持有的朋友每天都顶一下这个帖子 ,13738,76,667,3.5,2016-07-23 15:29:57
江苏银行的上涨高度会出乎意料,4903,5,79,3.5,2016-08-01 21:20:22
为什么我的股票池里的苏银申购股票余额、可用余,8189,18,202,2.5,2016-08-01 19:33:41
新股会破发？我笑尿了！,5813,12,269,4.0,2016-07-31 14:11:32
8月2日江苏银行涨44%,11327,15,138,4.0,2016-08-01 06:19:16
明天开板你卖吗？,10799,31,125,2.0,2016-08-01 10:43:21
《江苏银行：可能成为今年破发第一股！》,15352,18,312,4.0,2016-07-11 13:48:57
假设上涨20%你敢买吗？,5795,13,155,3.5,2016-08-01 08:12:17
有人提议锁仓，每天在涨停板挂100股买单，这个,2696,6,242,2.0,2016-07-31 23:37:26
6千多都不敢拿一个月的人，真的不该来炒股了。,4291,17,154,3.5,2016-08-01 00:38:07
备战苏银。 今年中的第三签江苏银行(前两个是核,21626,19,315,4.0,2016-07-29 20:16:16
600919:江苏银行公司章程,49799,12,147,0.0,2016-07-31 14:22:50
中了三千股，祝贺各位！,8264,13,131,3.5,2016-07-22 09:26:41
江苏银行破发才是正常的，不破发才是不正常的。,4319,13,246,1.0,2016-07-31 17:26:04
才中江苏银行两签，又中中国电影2签,24228,32,131,3.5,2016-07-30 00:32:26
江苏银行肯定破发，就是几个跌停板的问题了,8042,22,140,2.0,2016-07-30 12:39:29
江苏银行的伙伴们请注意， 0.46%的中签率，中签,11023,19,320,2.5,2016-07-29 19:17:03
预祝江苏银行 开盘破发跌停！！！,3810,7,142,3.5,2016-07-31 11:51:45
江苏银行理论上值6元，但首日收盘价我给7.5元。,6861,11,156,3.0,2016-07-29 14:23:49
30元可以达到，40元完全可能，50元并非不能，60,5778,10,178,2.0,2016-07-31 00:14:52
大家都是几点申购的？一般是那个时辰概率高点,18114,35,152,3.0,2016-07-23 15:43:17
醉了，申购134个号都没有中签。,9918,19,142,3.5,2016-07-22 06:02:45
小散户才几个鸟市值，还100%中，老子满打才叫10,18874,25,146,3.0,2016-07-16 23:53:00
江苏银行破发：连续9个跌停板不是梦！,8807,14,138,1.0,2016-07-29 20:56:41
理智判断开板价在8.5元-10元之间！,5904,9,148,4.0,2016-07-30 14:35:10
理论上讲顶格申购可中两签,4023,8,124,2.5,2016-07-21 13:30:54
江苏银行中签了，到现在还有谁没扣款？我没扣,16036,24,93,2.5,2016-07-24 22:10:52
小的门，江苏银行合理价在15元．,17177,22,187,3.5,2016-07-27 21:15:21
中签的散户每天在涨停价挂1手，有多少人会去做,7780,28,206,0.5,2016-07-28 16:15:51
新股研究报告：依托区域经济，期待管理提升,52925,13,1347,0.0,2016-07-22 15:41:35
热烈祝贺江苏银行登陆上市！8月2日是全体江苏人,10306,7,168,3.5,2016-07-29 16:52:58
次新股火爆行情一去不复返了，江苏银行破发的可,5434,7,160,4.5,2016-07-29 08:18:45
第一时间抛售！！！,14427,20,308,3.0,2016-07-22 00:12:04
我觉得江苏银行的涨幅会超出大多数人的预计,12927,13,151,1.5,2016-07-28 20:29:17
历史上兴业银行曾经涨到70块,7880,12,134,4.0,2016-07-29 06:47:22
做了个梦，二十个板,4511,22,128,3.0,2016-07-29 09:51:20
今年中的第三签为江苏银行.第四签为新华文轩.所,14208,26,229,3.0,2016-07-28 21:10:08
600919:江苏银行首次公开发行股票发行结果公告,143746,42,1503,0.0,2016-07-25 20:14:27
江苏银行破发的概率及大，市盈率高过现有银行平,6713,8,140,4.5,2016-07-28 21:27:11
苏银  好不容易中个签，也说说心里话。这次虽然,15924,14,633,1.0,2016-07-24 05:30:24
江苏银行遭机构弃购，基金二季度减持金融股,49619,51,558,4.5,2016-07-26 10:51:52
恭喜中签的朋友，等待破发吧，股灾离你不是太远,17242,70,181,3.0,2016-07-21 20:40:32
苏银广大中签股友们，请您听我说……,12184,19,413,2.5,2016-07-27 21:48:44
听说江苏银行能造洲际弹道导弹，上市连续50个涨,9412,19,143,4.5,2016-07-23 18:18:07
我的申购配号和公布的中签号都不一样，居然也中,16698,19,207,2.5,2016-07-25 23:19:32
当时中中核建，一帮傻鸟也喊着破发，也有高人预,10806,16,216,3.0,2016-07-21 21:15:32
紧急通知！紧急通知！！ 紧急通知：中签江苏银,7966,15,470,2.0,2016-07-27 18:33:48
江苏银行上市后炒作的时间会很短,7665,3,81,3.5,2016-07-27 21:14:24
苏银开板大约在20至25之间；,17203,21,140,3.0,2016-07-23 10:59:18
江苏银行要跌到一角,4228,7,254,4.5,2016-07-27 16:48:19
江苏银行：周五上市,13290,8,69,3.0,2016-07-27 15:51:49
80万资金去抽签都没中签，难、难、难！难过上青,6452,8,166,4.0,2016-07-26 22:40:42
十二个号中一签。。在吧里什么水平？,8044,18,144,1.0,2016-07-26 17:20:19
江苏银行主要网点数：苏州5908、无锡2701、南京,4503,5,142,3.5,2016-07-26 17:51:16
瞎BB什么呀，不就是6000多元钱嘛，多大个事，卖,5333,14,230,3.5,2016-07-26 08:57:26
6千元股票在握一个月，就是胜利！,4660,9,172,3.5,2016-07-25 23:52:24
江苏银行未必一定破发，别太紧张,7420,8,185,3.0,2016-07-25 20:21:15
本人抄股20年，累计亏损100万以上，江苏银行是,10522,10,257,3.5,2016-07-23 23:23:02
古人云，运气来了门板都挡不住!似乎是在说我呢,6221,10,154,2.0,2016-07-24 23:43:31
江苏银行新股报告：对公业务占绝对主导，利息收,40476,8,812,0.0,2016-07-20 07:50:08
