标题,阅读,评论,字数,影响力,时间
江苏银行原党委书记王建华接受组织调查,22972,11,370,0.0,2017-02-15 10:23:40
周一跌停,16569,45,118,3.5,2016-11-21 00:46:22
郑重宣布本人持有江苏银行卖出，看不到希望了，,7836,14,179,2.5,2017-01-12 13:54:27
江苏银行向9.6元目标位前进，前进，进！,14994,27,91,3.5,2016-09-09 20:43:40
长期看，江苏银行合理价格在3元附近,36175,95,144,3.5,2016-08-22 18:55:01
黑色星期四，江苏银行跌停,14724,27,134,3.5,2016-08-17 20:28:34
下周跌破9元，拭目以待,17084,52,132,3.5,2016-12-23 18:26:44
江苏银行下一周见8.22元,14432,31,77,3.5,2016-08-21 21:33:38
明天跌破10元是大概率,9746,29,132,3.5,2016-12-19 19:52:12
很好，终于等到加速下跌了，耐心观察底部的到来,11763,22,156,3.5,2016-09-26 19:24:25
昨天提前预警跌破10元，套住的,7144,22,134,3.5,2016-12-20 19:49:38
江苏银行跌停，呵呵呵呵,13539,36,134,3.5,2016-12-09 13:06:15
多头不死，空头不止,13330,40,128,3.5,2016-09-26 17:23:35
下午跌停，跌停，跌停,21560,65,130,3.5,2016-08-19 13:23:53
留下买路钱,5982,21,120,3.5,2016-12-19 13:18:30
谁是股价最低的次新股，最低的次新银行股,6999,15,115,3.5,2017-02-14 09:27:14
我只9.6元等着，呵呵呵呵,48448,113,136,3.5,2016-09-27 14:21:26
提前预警下跌，市场已经验证,9193,20,136,3.5,2016-12-19 11:53:45
600919:江苏银行董事会决议公告,46894,21,737,0.0,2017-02-09 16:48:27
600919 后市预测,42708,97,160,2.0,2016-12-27 20:21:52
600919:江苏银行关于变更投资者联系电话的公告,26779,5,502,0.0,2017-02-09 16:49:19
超1100家A股公司预告了今年业绩 江苏银行暂列赚,284354,440,1987,4.5,2016-11-20 16:15:42
600919分析,14836,14,236,2.5,2017-01-26 11:17:38
600919:江苏银行2016年度业绩快报公告,96815,23,989,0.0,2017-01-18 19:04:21
打满,11574,28,133,2.0,2017-01-12 14:42:38
秦淮小散不走，江银不会涨！,6329,13,136,0.0,2017-01-12 13:59:16
600919:江苏银行关于优先股发行方案及公司章程,49064,13,612,0.0,2017-01-19 17:04:03
吧里都在看涨，继续下跌,6085,14,132,3.5,2016-12-27 21:35:51
我前面赚了5毛不舍得卖出，现在是套了1.2元每股,7955,28,24,0.0,2016-12-27 14:27:37
最近庄派出不少空狗叫空 说明该股有戏,14955,44,197,2.0,2017-01-01 17:06:22
600919:江苏银行关于南京分行开业的公告,30176,10,428,0.0,2017-01-17 15:40:05
忽悠买入的现在站岗，,10934,32,130,3.5,2017-01-12 13:29:50
空方认怂,6932,28,127,2.0,2017-01-09 11:25:56
600919:江苏银行关于独立董事任期届满辞职的公,37209,13,630,0.0,2016-12-30 18:25:18
今天破9.5，向9元前进,7723,26,134,3.5,2017-01-10 10:17:38
你还想在更低的位置布局江苏银行？,14759,47,284,3.5,2017-01-09 13:33:57
注意江苏银行3个重要支撑位,20817,24,254,2.0,2016-08-27 12:17:28
业绩增速5年缩水八成 江苏银行不良率连涨四年,17726,22,1277,0.0,2017-01-10 04:59:58
资产质量持续改善可期，估值优势明显,33107,13,1009,0.0,2016-12-28 08:31:17
明天江苏银行跌破9元5，如果不跌破我吃屎给大家,10595,26,164,2.5,2017-01-08 13:04:01
再跌13个月，跌到2.35元横盘，反弹到2.6元不错,5796,16,184,4.0,2017-01-07 12:27:09
我在9.6元等着您,24194,91,128,3.5,2016-11-16 21:58:13
趋势涨停战法:中科电气复制5月18号走势短线翻倍,14649,35,184,3.0,2016-11-27 18:40:09
做空就是老港。是庄的空狗。骗散户筹码，今后爆,9353,31,218,1.5,2016-12-28 12:58:46
成本12.36请高手指点。,7367,11,148,0.5,2016-12-30 16:03:06
不听劝，今天买入的又是全军覆没,20580,45,140,3.5,2016-09-14 14:59:58
买！买！买！重要事说3遍,10289,53,135,2.0,2016-12-26 12:53:22
成本9.9，不知道能不能解套[哭],5761,23,141,3.0,2016-12-27 10:27:13
600919:江苏银行关于南京分行获准筹建的公告,42850,9,424,0.0,2016-12-26 16:00:39
次新股江苏银行下周补跌,10299,17,132,3.5,2016-11-11 21:44:44
你割肉 我成全你 买进！,5454,33,131,2.0,2016-12-26 13:53:53
打碎低位获取廉价割肉盘的阴谋企图，小散们请联,2480,22,26,3.0,2016-12-26 11:01:17
唱空帖多的时候 正是庄稼打压吸货时,12740,54,177,2.0,2016-12-06 10:44:55
600919:江苏银行董事会决议公告,33487,6,609,0.0,2016-12-26 16:00:14
今天做空没出来滋滋滋？,7198,35,137,2.5,2016-11-28 21:04:03
12.12元割肉走路！,24842,63,132,3.5,2016-08-26 15:28:44
今天晚上吃狗肉 空狗 朋友报名,2935,17,140,2.0,2016-12-26 14:15:25
我在9，6等着,3954,12,124,3.5,2016-11-09 13:25:12
江苏银行创新低，大家猜得出什么价是底呢？,7847,16,91,3.0,2016-12-24 10:01:56
在吧里面鼓动买入的全军覆没！,7496,25,138,4.0,2016-12-23 16:07:05
狗托在股吧里发言,16216,66,165,3.5,2016-10-21 14:45:07
太弱了，这里绝对不是底，全天线下运行，始终都,6252,15,263,3.5,2016-12-23 15:32:49
今天如果暴跌，上周五狂买入的大资金都傻子吗？,3723,8,166,1.5,2016-08-08 09:27:15
现在已经一目了然了，谁是股托,24134,66,308,3.5,2016-09-15 15:57:09
这个秦淮小散是哪里的傻逼？ 人家卖出就是二逼,5107,10,195,3.5,2016-12-21 14:00:47
隐性资产高达50亿以上！600919,8995,13,346,3.0,2016-11-15 14:38:29
我买了点，看明天获利多少,69767,206,219,4.0,2016-09-12 13:54:40
江苏银行，今非昔比（如今有融资盘了）流通盘自,9768,6,200,3.5,2016-12-19 11:48:01
开心开心！！哈哈！！,5748,21,130,3.0,2016-12-19 08:53:18
我已经中了第四签,5587,10,149,3.5,2016-12-18 12:09:13
人弃我取,7200,42,123,2.0,2016-12-19 10:39:47
600919:江苏银行2016年第二次临时股东大会决议,37922,10,1240,0.0,2016-12-18 14:06:56
江苏银行是一家不错的银行,7376,9,103,3.5,2016-12-16 12:30:05
苏银中长期仍将处于调整态势,29120,120,422,3.5,2016-10-30 13:00:11
八大理由看多江苏银行，周一强力反弹3%以上！,6757,13,591,2.5,2016-12-17 23:14:07
我们无法预料涨跌，但我们可以自己判断！,4107,5,148,3.5,2016-12-15 22:19:13
要起来了！江苏银行,9581,44,9,4.0,2016-10-14 10:58:32
10.50买入 11.07元卖出 傻庄 哈哈,14676,34,142,2.0,2016-12-09 10:32:49
16.09.28：不怕不识货 就怕货比货,7167,21,336,4.0,2016-09-28 10:16:31
被低估20%,7290,6,75,3.0,2016-12-12 16:00:39
江苏银行明天跌停,32211,75,67,3.5,2016-08-23 18:47:14
下个星期15块见,8281,13,126,1.0,2016-12-07 15:02:17
本月肯定会举牌起码3个板，上周吸筹10个亿，均,14504,7,207,3.5,2016-12-03 17:27:01
江苏银行入选融资融券了，后面会有增量资金，可,20668,22,134,2.5,2016-12-02 17:41:45
保险举牌的标的，必是江苏银行,13212,14,166,2.0,2016-12-01 18:54:10
今天苏银的猛摔初步判定为假摔，明天大概率会盘,12523,26,186,3.5,2016-11-30 21:53:06
江苏银行：拟发行优先股不超过2亿股 募资不超过,28680,60,292,0.0,2016-11-29 19:10:44
600919:江苏银行关于非公开发行优先股预案的公,40343,10,448,0.0,2016-11-29 18:47:26
可怜的散户为什么要去接盘呢,4141,12,136,0.0,2016-11-30 14:08:15
牛市不作短、 熊市不作长；牛市不杀跌、熊市不,3706,6,280,2.0,2016-12-01 06:27:59
优先股的意思,4850,6,190,3.5,2016-11-30 11:06:57
江苏银行短期又进入调整期了,9790,28,85,3.5,2016-11-29 19:45:28
今天教你如何识别股托，险中识别股托,9493,26,350,3.5,2016-11-29 21:35:40
提高公司资本充足率 江苏银行拟发行优先股募资2,20935,6,742,0.0,2016-11-30 01:45:36
江苏银行啊江苏银行我已经要把您忘了，您怎么今,4441,5,148,4.0,2016-11-24 13:35:04
早上进的被套几毛了,1992,6,128,3.0,2016-11-30 11:22:59
11.47追高10万股，强烈看好后市！,6797,7,148,4.0,2016-11-28 14:36:36
一周来资金持续流入8个多亿，没有一个涨停板（,5078,4,205,3.5,2016-11-29 10:24:57
炒股要明白几个问题： 1，有没有主力（引领股价,5598,2,302,3.0,2016-11-28 21:56:52
据说人品好的容易中签，不知真假，你们说呢？反,14013,31,186,3.5,2016-07-31 21:55:18
昨日收盘说了，今日会围绕11元整数关口震动洗筹,13466,10,201,3.5,2016-11-25 15:57:37
明天继续暴跌，第一目标9.6元,15251,46,140,3.5,2016-09-06 19:25:33
蓄势，冲过11.65压力位，封板就是大概率了！,4739,4,156,3.5,2016-11-28 10:11:10
江苏银行调整马上结束,13175,22,10,4.0,2016-11-08 22:56:24
以我17年的经验，上海银行开板日，就是我大江苏,17285,20,143,2.5,2016-11-17 19:30:46
11.25跑了,7665,8,121,4.0,2016-11-25 17:04:51
这个星期破10元，拭目,12913,40,130,3.5,2016-11-16 13:33:54
有看懂的吗,10309,15,120,2.5,2016-11-25 15:05:17
此股下午加仓8000股，大家感觉怎么样？,5374,6,150,0.0,2016-11-25 13:10:53
今天收盘价预测，本人预测价：11:30,3968,8,148,3.0,2016-11-25 12:14:46
江苏银行只有到11元才有参与价值,8201,18,96,3.0,2016-09-05 14:38:21
江苏银行8月15日最高14.84元，9月30日最低9.96,25621,45,174,2.5,2016-11-03 10:07:51
韭菜的操盘水贴：久违了，919。,37020,98,1073,3.0,2016-09-20 07:44:19
今日高点10.99成交量能177万手超越了昨日，但是,10224,6,386,3.5,2016-11-23 17:13:55
江苏银行获评“2016年度第一财经金融价值榜”年,4491,7,1543,3.5,2016-11-20 14:48:25
江苏银行暂列赚钱榜榜首,3036,3,648,3.5,2016-11-20 14:47:15
要急涨至22元，抢入，戓坚定持有,14492,22,142,3.0,2016-11-14 17:24:42
呵呵！今天尾盘再次杀回头！,6524,29,13,3.5,2016-11-21 17:33:00
江苏，银行，目测价值25元。开始建仓了，，你们,8260,12,171,0.0,2016-11-21 18:25:14
今天很多赔钱卖掉的！,7853,7,130,1.5,2016-11-18 19:09:31
强势涨停机构敢死队疯狂抢筹次新高送转暴涨大牛,16424,24,100,4.0,2016-06-21 14:25:48
强势涨停机构游资敢死队疯狂抢筹次新高送转暴涨,14911,19,102,4.0,2016-06-22 05:17:13
江苏 13元 有在的吗 郁闷,10872,25,130,3.5,2016-11-16 09:53:07
主力哥若能缩量收10.52足矣！,2491,8,76,3.0,2016-11-18 14:08:41
收盘猜猜猜,4558,16,120,3.0,2016-11-17 11:52:35
终于炒到金融银行股了,5561,10,131,4.0,2016-11-08 14:32:48
先知先觉者会持有小盘银行股,4865,6,369,3.5,2016-11-15 19:50:58
今年的上证难道就不能去摸一下年k线的上影线？,3807,10,204,4.0,2016-11-13 19:57:38
看好了！蛟龙出水了！,10807,31,121,2.5,2016-11-08 14:38:56
认清狗托的真面目,19171,95,311,3.5,2016-10-21 00:11:54
为狗托画像,19802,104,221,3.5,2016-10-22 14:50:58
新突破，低位机会,3173,4,126,4.0,2016-10-28 09:53:17
昨天10.43挂单卖，今天10.13又挂单买上了，呵呵,3959,5,164,3.5,2016-11-09 11:29:17
有个北京网友整天胡说八道，必是狗托，务必记牢,2540,15,279,3.5,2016-11-08 08:13:24
苏银明天大概率会升起,7447,23,156,3.5,2016-11-09 15:57:50
今天若再推高 是减仓良机,4235,20,148,3.5,2016-11-09 08:56:50
我清仓了苏银，感觉四号到八号会断崖，我只是个,9472,23,191,1.5,2016-11-02 12:22:20
前天挂10.43卖昨挂10.13买今挂10.43卖都全成交,2964,3,192,3.5,2016-11-10 10:31:11
靴子落地了！买入再说,14767,31,130,3.0,2016-11-09 13:02:58
那些吆喝20元的人哪里去了,1595,3,136,2.0,2016-10-02 11:55:42
赢富网查到中签了，中签号是618,41396,55,142,3.5,2016-07-21 16:35:48
江苏银行今日超大单流入排名第10名(11-08),25773,11,299,0.0,2016-11-08 16:05:42
这是什么路子,10136,0,122,0.0,2016-11-08 14:31:38
进场就是现在，此处献上有望涨停两票，没买入的,4290,3,87,3.5,2016-11-08 15:26:43
蛟龙出海！,3163,18,120,2.5,2016-11-08 09:55:55
第一步11元，其后是8元，最后是3元,30371,94,146,3.5,2016-08-24 15:59:23
600919:江苏银行关于董事任职资格获得核准的公,33329,14,513,0.0,2016-11-07 16:07:22
600919江苏银行处于底部区域，可以适量吸纳！,3991,7,158,3.0,2016-11-04 11:59:18
此股有一点值得我们深思，有个机构的分析师在视,31082,32,314,3.0,2016-10-13 22:02:12
国家控制股价，银行是定盘星，汇金国家队现在回,5539,4,244,3.0,2016-11-05 18:26:17
昨天上午开盘走人，现在回过头来看走势。,6125,7,687,2.5,2016-11-04 19:10:20
江苏银行只要跌破10元我就加仓,4131,8,120,4.0,2016-10-14 10:07:42
不良持续企稳；非息占比回升,33616,11,1255,0.0,2016-11-01 17:58:02
不留遗憾！全仓杀入！不留遗憾！全仓杀入！,4740,4,150,4.5,2016-11-04 17:37:15
11.6进了1万股，能解套吗,8895,15,14,2.0,2016-11-01 11:00:26
一旦原始股解禁，江苏银行最高不会有6.50元。,5030,17,156,3.5,2016-11-04 12:58:09
强烈控盘独立行情就要开始,4371,5,136,3.0,2016-11-01 13:36:55
31号季报就是涨停日,13272,24,126,3.0,2016-10-28 10:18:24
江苏银行合理价格在3元附近,37896,102,77,3.5,2016-08-22 19:46:43
第一次想骂人。,6420,13,806,2.5,2016-11-02 15:32:36
苏银短期需调概率大,13697,72,184,3.5,2016-10-27 21:52:02
600919:江苏银行关于2016年第三季度报告补充更,40482,8,1070,0.0,2016-11-01 18:55:35
江苏银行的主力没钱，是个大穷逼。,3388,6,83,2.5,2016-11-01 14:40:29
600919:江苏银行2016年第三季度报告(更正版),38666,12,1013,0.0,2016-11-01 18:55:35
有史以来本人见过最差的新股！8.2号才上市，一,6487,7,242,3.0,2016-09-13 11:53:25
业绩快速增长，不良率保持平稳,28200,9,930,0.0,2016-10-31 15:09:57
下午江苏银行跌停,9539,23,126,3.5,2016-08-17 10:33:22
江苏银行从14.84元下跌和调整已经有47个交易日,6786,8,238,4.0,2016-10-28 11:58:00
这一次10元可能守不住了,12226,27,134,3.5,2016-10-13 11:12:53
昨天抢着买入的大户们，今天先站岗,6281,10,142,3.5,2016-10-13 11:02:56
江苏银行资产规模前三季猛增,25312,8,676,0.0,2016-10-31 05:44:11
真没出息，杭州银行人家20多元收盘，我们大江苏,7269,8,143,2.5,2016-10-27 14:03:49
600919:江苏银行2016年第三季度报告,47866,21,1008,0.0,2016-10-30 14:51:23
下午跌停，拭目以待,11337,28,128,3.5,2016-08-19 12:58:39
下周连续跌停,22077,47,122,3.5,2016-08-20 21:09:03
不错所料，尾盘暴跌,7631,14,128,3.5,2016-08-24 14:44:59
江苏银行资产规模前三季度猛增 拟发行200亿元绿,15337,6,844,0.0,2016-10-30 22:17:21
贵阳银行第三季度业绩每股1.46元。,11830,28,87,2.5,2016-10-27 22:46:40
12元第一目标位已经到达，12.21元今天先买入一,16041,27,166,3.5,2016-08-25 13:17:28
强烈要求停发新股,6906,13,232,3.5,2016-09-19 18:57:03
10.6元进的怎么办啊。。,6599,13,136,0.0,2016-10-28 13:49:13
追高了,2983,9,121,0.0,2016-10-28 10:07:55
我是姑苏刘宏，我看好江苏银行！！！,4131,6,144,4.0,2016-10-27 18:51:20
杭州银行14.39元上市就是江苏银行爆发,17368,36,243,2.5,2016-10-25 21:10:17
我来设场赌局：我赌江苏银行10月底站稳12元。输,26933,61,216,3.5,2016-10-22 15:33:46
理论上，江苏银行会被炒作至68．88元！,81311,274,727,3.5,2016-07-27 21:13:31
江苏要入仓了,2604,4,122,3.5,2016-10-27 10:31:59
日你妹.买了你就翻不了身了,2108,8,126,3.0,2016-10-27 10:09:25
本姑娘追高了，今天的最高价！,9485,16,184,1.0,2016-10-24 16:47:13
绿能宝4.8兆瓦光伏项目获江苏银行8年期项目融资,15885,5,729,0.0,2016-10-24 15:39:48
10.10买入，能赚钱吗,10552,25,138,2.5,2016-09-29 11:26:09
掐指一算，江苏银行2019年9月开始有大行情，东,12014,22,232,3.0,2016-09-24 08:12:55
江苏银行不涨原因分析！,11213,11,375,1.0,2016-10-19 17:23:59
江苏银行今日超大单流入排名第12名(10-24),18772,2,299,0.0,2016-10-24 16:07:49
苏行这个位置还能追吗，踏空者问？,5881,15,142,2.0,2016-10-24 13:41:35
坚决不卖，继续吸纳!,4230,14,130,3.5,2016-08-25 10:37:34
下周一仍应以防范风险为主,13906,31,273,3.5,2016-10-21 16:18:09
我们要求停发新股！停发新股！停发新股！,4324,18,148,4.0,2016-10-17 14:12:33
10元以下买入，放那比存银行安全,3277,10,142,3.0,2016-09-30 13:12:18
江苏银行暂时看9.19元,5595,10,75,4.0,2016-10-22 08:29:05
预计周五主力会继续出货，且股价继续下跌。,7472,23,197,3.5,2016-10-20 15:11:49
江苏银行今日超大单流出排名第14名(10-17),18319,7,300,0.0,2016-10-17 16:07:31
江苏银行 大暴跌开始了！,24767,67,134,3.5,2016-08-26 15:15:32
无任何理由看好中期市场,13972,74,337,3.5,2016-10-15 14:38:51
大霄哥谈股论金：江苏银行必将崛起，江银将带领,9126,12,226,3.5,2016-10-19 16:40:49
上联；今跌明跌天天跌，下联；你割我割人人割。,2946,11,170,3.5,2016-09-29 06:48:57
明天跌44%,5192,11,119,3.0,2016-08-01 16:32:43
亏8个点的进来！给这股套残了！什么时候解套呀,4579,5,156,4.5,2016-10-20 18:05:49
都是有才华的人，大家回家洗洗睡吧！！！,3779,7,148,2.0,2016-10-20 14:45:38
江苏银行是个畜生，天天跌你妈个B的,3410,5,85,3.0,2016-10-19 13:56:19
预计周二主力仍会以出货为主,7870,28,342,3.5,2016-10-17 15:35:01
此时唱空愚昧,2970,5,121,4.0,2016-10-18 23:51:06
快要爆发了。,6884,16,161,3.5,2016-10-17 12:15:27
14.82成本，求解套放人。,10785,21,138,4.0,2016-09-30 11:32:50
破十加仓,4702,16,119,4.0,2016-10-18 07:56:32
10.09元买了江苏银行，大家祝幅我吧,7281,20,180,2.5,2016-10-13 14:24:56
下周一需防回落风险,11324,40,197,3.5,2016-10-14 15:16:35
今天挂单10.09买100股试盘，又被套了，靠,4100,11,156,3.5,2016-10-17 10:41:41
苏银今天出货概率大,6889,29,254,3.5,2016-10-17 07:22:33
今天没清仓的朋友，明天会后悔的,6277,10,140,1.5,2016-08-29 22:09:32
我是次新股之王，只要我进的股必须涨，今天我进,12174,16,225,1.5,2016-10-14 16:37:07
600919:江苏银行关于变更注册资本及公司章程获,57480,20,616,0.0,2016-10-14 18:40:21
江苏银行：鄂武商A000501业绩艳极八方，每股收,7761,20,113,4.5,2016-08-25 09:55:38
今天又把昨天试探买的100股10.08的卖了，看这情,6105,9,172,3.5,2016-10-14 11:39:36
江苏银行 路在何方底在何方 ，底在脚下哈哈！,17463,56,22,3.5,2016-09-26 15:09:30
两个月来第七签！,6562,24,164,2.0,2016-09-22 08:37:37
看看我这几天的成果，羡慕还是嫉妒了?,17555,34,146,3.0,2016-08-17 21:51:20
周五主力继续出货的概率更大一点,8664,49,197,3.5,2016-10-13 15:05:16
昨天试探10.08买100股今天不小心的挂10.22卖了,4446,8,195,3.5,2016-10-14 11:19:55
不要指望卖到最高价买到最低价,8988,17,137,4.0,2016-09-30 19:42:21
终于要涨啦。上央视新闻啦,12870,9,134,3.0,2016-10-13 19:26:25
预计黑周四跌幅会超过今天,7155,46,200,3.5,2016-10-12 19:06:32
江苏银行还要跌！哈哈哈，跌到7元就可以进了！,1823,3,95,3.5,2016-10-12 17:49:24
坚决不碰银行股,4986,11,179,3.5,2016-10-09 09:13:25
同志们！俺不服又回来咯！狗庄！,3668,11,184,3.5,2016-10-12 21:25:25
上联：七贱下天山，求下联和横批,2572,15,15,3.0,2016-10-12 14:20:39
江苏银行盘子小效益好一定会爆炒目标价40元/每,12346,442,99,3.0,2016-08-02 00:44:06
不好意思，今天把中签的2000股出了,9469,18,149,3.0,2016-08-11 13:30:00
江苏银行上市转型存隐忧 不良率连年高企资产承,20678,16,2385,0.0,2016-10-10 11:42:21
江苏银行最佳买入点是4.5元,6827,11,79,4.0,2016-10-05 00:47:12
今天试探挂单10.17买100股，昨天卖的只剩200股,2349,9,197,3.5,2016-10-11 07:12:01
下午跌破10.8拭目以待,18160,89,134,3.5,2016-09-20 13:07:35
已经下跌很久，现在跌无可跌,4709,9,137,3.5,2016-10-10 22:19:45
江苏银行是否已调整到位？,28691,48,372,3.5,2016-09-30 15:17:51
今跌明跌天天跌，下联；你割我割人人割。 横批:,4840,24,164,3.5,2016-09-29 17:45:59
不看好江苏银行，兔子的尾巴一样,3312,12,140,3.5,2016-10-10 09:09:54
业绩表现稳健，继续领跑银行股,109670,44,1096,0.0,2016-08-17 09:20:08
打新中签了吗？中了！今天中了江苏银行。,16254,34,156,3.0,2016-09-26 15:20:35
今天涨停，不要问我为什么…,5058,20,136,2.0,2016-09-26 07:53:26
14.6元的本，2w股,9983,16,137,3.5,2016-10-06 21:17:10
江苏银行暴跌开始，目标位６元，大盘暴跌目标位25,30128,106,236,4.0,2016-08-11 19:02:01
银行股不会涨，会继续跌！沪深是个垃圾市，你看,6013,15,194,4.0,2016-09-30 17:03:06
600919:江苏银行关于董事会秘书任职资格获得核,35336,18,528,0.0,2016-10-09 15:22:34
猜收盘价：猜中有红包[牛][牛],3028,24,136,4.0,2016-09-30 13:40:37
草泥马节奏，劳资13.78得成本，两周不看你跌成,4838,9,160,2.5,2016-09-27 10:57:26
龙虎榜数据又打了“武汉汉口股神”一大嘴巴,10701,11,528,3.5,2016-08-09 21:52:18
换手才21%，抓紧买回,7438,16,125,3.5,2016-08-05 09:44:03
“武汉汉口股神”你就是凤姐,3886,7,300,3.5,2016-08-10 14:07:23
江苏银行……银行板块的出头椽子！ 银行股中的,8732,17,198,4.0,2016-10-05 06:17:03
江苏银行提醒， 昨天下跌中继 逆势回抽， 今天,9745,16,130,4.0,2016-09-14 06:14:24
与华夏银行做个比较！,8028,11,204,2.0,2016-10-03 19:20:52
江苏银行 个人观点,15191,15,242,2.5,2016-09-28 19:23:08
刚才卖了个近最高点,32619,132,126,3.5,2016-08-11 10:54:02
[微笑][微笑][微笑]600919哥早告诉你们要跌到1.,6842,17,135,4.0,2016-09-23 15:50:57
10月1日加入SDR了，利好银行，10月10日必涨停,12199,22,162,3.0,2016-10-01 10:31:37
柳暗花明又一村……！ 2016年9月30日(华盛顿时,9468,12,311,4.0,2016-10-01 11:09:40
今天9.7买入5000股，过了节能捡一个便宜吗，过,8718,15,205,2.0,2016-10-01 00:35:14
600919:江苏银行2016年第一次临时股东大会决议,45754,17,1384,0.0,2016-09-28 15:52:01
江苏银行价值几何？,39058,120,78,2.5,2016-09-01 19:56:04
为了能打新，刚刚特地配了点江行,7951,26,144,3.5,2016-09-30 11:06:39
江苏银行：短短32个交易日，下跌了48%的小盘绩,7473,10,144,3.5,2016-09-30 15:11:12
13块2毛的成本，同志们山上好冷，来些人抱团取,4618,15,142,2.5,2016-09-30 14:55:05
10元是铁底   买[买入][抄底],2440,14,136,3.0,2016-09-30 10:15:24
有人说十几二十个涨停板？我笑了。能撑过五个都,24150,54,219,3.0,2016-08-07 19:31:13
江苏银行：20元以下坚决不卖签到处[看多],12589,31,89,2.5,2016-07-22 22:42:17
谁看多谁买，老子走了亏2.9万。服了,2276,15,134,2.5,2016-09-30 10:28:59
江苏银行和以前16只银行股的比价分析（大家探讨,194108,346,442,3.0,2016-08-08 17:17:47
600919:江苏银行2016年第一次临时股东大会的法,28363,6,179,0.0,2016-09-28 16:04:34
江苏银行上市首日涨幅44%，概率能有多大？,38701,34,171,3.5,2016-07-21 19:16:54
全国才几家上市银行？？江苏就占了5个，江苏银,2856,8,219,3.5,2016-09-30 09:31:33
苏银下周一可能会开启暴走行情！,8960,12,176,1.0,2016-09-24 16:28:07
江苏银行 一帮人都在唱空，单从缺口而言，昨天,5376,23,147,2.5,2016-09-27 23:16:38
历史新低，抄底机会来了,3281,13,161,2.0,2016-09-23 10:56:43
:抄底正当时,3418,19,123,3.0,2016-09-13 19:40:12
眼巴巴的看着机构的仓转嫁给了散户！呵呵,6582,46,148,3.5,2016-09-29 10:02:28
今天100%补缺口10.66，涨停有一定几率，买[买入,3153,14,174,3.5,2016-09-29 09:47:07
公开发消息说上海银行新股可能破净，证明江苏银,5129,10,207,3.5,2016-09-27 09:51:14
福？祸？,5223,9,137,3.5,2016-09-28 20:47:27
10.08进了70手，没有只跌不涨票，该股高位成交,6750,10,261,1.5,2016-09-28 20:07:04
因为k线离5日线太远，修正再杀，,3796,25,142,3.5,2016-09-28 09:50:15
你赢了.,3813,9,123,2.0,2016-09-28 13:37:29
江苏银行是个典型的操纵股价欺诈市场行为!强烈,2763,7,113,3.0,2016-09-28 13:48:15
感觉此股要暴涨了,4705,10,127,3.0,2016-09-27 22:56:09
建议广大的小散，除了这次上当受骗买了江苏银行,6181,20,221,3.0,2016-09-27 13:26:00
一股不卖，给儿子留着,9064,29,130,2.0,2016-09-07 20:25:34
当心拉涨停,2317,13,119,3.0,2016-09-26 13:19:51
10元必破！这是我对江苏银行的基本判断。,2510,6,150,2.5,2016-09-27 22:15:26
10元次新股，还抛，市场內人都变大傻了,4915,11,148,3.5,2016-09-27 13:07:36
看似好转，实则骗局。,12892,39,174,3.5,2016-09-23 15:34:13
卖的傻逼，我就想知道，你们是挣到钱了？,3216,8,148,2.5,2016-09-27 09:33:06
12.60冲动买进。有谁能理解我现在的心情！姐姐,23439,40,194,2.5,2016-09-19 11:59:43
庄家进入最后的丧心病狂中，千万不要倒在黎明前,3338,11,154,3.0,2016-09-23 13:28:03
此股明天涨停,2527,4,122,3.5,2016-09-26 15:06:01
抢呀，机不可失，即将急涨到16元,5039,14,142,3.5,2016-09-24 22:14:06
600919:江苏银行关于召开2016年第一次临时股东,25620,7,1592,0.0,2016-09-11 16:14:44
请问上市就是为了圈钱吗？,2205,4,134,3.5,2016-09-26 17:58:25
今天买这货亏了100多万，惨。,8002,10,131,3.5,2016-09-26 16:20:54
江苏银行下跌近30%，可以进驻了,4100,13,83,3.0,2016-09-26 13:15:48
放量下跌，还有人买，明天继续砸！不屑,2577,5,146,3.5,2016-09-26 16:41:27
买了的别哭哦，看看其他银行股的pE你就知买入江,3883,7,168,1.5,2016-09-09 13:24:01
一个字，买,2562,14,120,2.5,2016-09-20 13:06:32
什么是尽头，越补越低，谁能告诉我哪里是底？,2854,14,152,3.0,2016-09-26 14:24:44
这支股票让我亏了12000。割不割？,3095,14,146,0.5,2016-09-26 13:47:13
越跌越买，坚定持股,1644,7,167,3.5,2016-09-23 12:59:51
江苏银行价格应该比江阴银行高,2477,9,127,3.5,2016-09-26 11:13:43
操它，操低....江苏银行,969,3,136,3.5,2016-09-26 10:33:00
江苏银行已经到了阶段性底部，大家耐心等耐几曰,4187,8,120,1.5,2016-09-16 20:25:32
