标题,阅读,评论,字数,影响力,时间
600919:江苏银行董事会决议公告,57012,9,690,0.0,2016-09-11 16:14:44
明天主力大概率会继续出货,5301,14,163,3.5,2016-09-21 14:23:39
请大家明天开盘清仓，江苏银行行长心脏启死了,3266,4,152,3.0,2016-09-25 15:30:50
气得江苏银行直翻白眼,15172,28,80,3.0,2016-09-14 21:44:57
在江苏银行上亏损超过2万的出来冒个泡！,11877,34,148,2.5,2016-09-23 22:29:10
哎，12.6的本怎么搞，愁死我了！！,5261,11,146,2.0,2016-09-23 18:37:22
江苏银行必破10元,5435,32,153,2.0,2016-09-23 17:03:10
坚决反对不断发行新股,7888,27,206,3.5,2016-09-10 23:04:42
教大家一招，如何江苏银行如何打新中签率高，以,16974,31,346,2.5,2016-07-20 15:46:12
同志们不到9元勿进，免得被套,3576,8,138,3.0,2016-09-24 07:15:06
江苏银行称未出示过证明 中欧体育否认为购买AC,24208,16,1824,0.0,2016-09-23 05:44:25
应铁粉，解答江苏银行。 1250亿市值已止跌，箱,4766,8,207,4.0,2016-09-22 13:50:34
一百万买了你，本来想买房的，现在厕所不见了，,4757,8,215,2.0,2016-09-23 18:12:38
通达股份(002560)是超低估直军工腾飞在即坚定挖,18004,136,1424,4.5,2016-08-10 11:31:26
今天的下跌，使得不坚定的筹码继续流出，血淋淋,3159,7,195,2.0,2016-09-23 14:06:13
江苏银行回应“AC米兰收购”：未提供相关证明,19607,10,848,0.0,2016-09-22 16:48:32
谁14块买的，哭死,5903,28,128,2.0,2016-09-22 12:39:05
江苏银行随时可能直线拉升,3906,9,72,3.5,2016-09-19 11:39:55
江苏银行是目前所有银行里最好的，流通市值100,4893,11,144,2.0,2016-09-20 10:16:15
下周题材股有望成为短线主角,11030,47,135,1.5,2016-08-21 19:30:39
十一块以下割肉的都是傻比,3868,10,134,3.0,2016-09-15 06:53:53
江苏银行首次回应“AC米兰收购”：从未提供相关,19839,16,589,0.0,2016-09-22 14:24:34
情况不妙啊！换手率都0.93%了,25597,48,170,3.0,2016-08-02 22:00:03
今天证明了我昨天：主力继续出货的判断了。,5977,29,190,3.5,2016-09-22 15:05:10
江苏银行600919预估60元可期！中签不易，抛掉可,4150,16,148,2.5,2016-08-03 09:17:05
11元买入2万股，试试运气。[拜神],4664,11,142,2.0,2016-09-22 12:06:42
今天别去砸，否则可能价砸不下来还白白丟筹码,1647,7,152,3.5,2016-09-22 10:12:07
探底成功 ，反转向上,3297,10,126,3.5,2016-09-20 10:45:08
江苏银行明天大跌,7376,8,67,3.5,2016-08-16 00:37:33
不消停成为一代摸股王。,5262,13,153,2.0,2016-07-22 19:50:13
11.76的本被套了咋办啊？,3838,14,133,2.5,2016-09-06 09:42:53
江苏银行下流已经养成习惯，每次反弹都是卖出的,4660,8,99,3.0,2016-09-13 16:44:01
现在买还是有风险的,6752,16,128,3.0,2016-08-28 17:20:26
我已经失去了方向，自从买了江苏银行这垃圾股每,28150,123,184,3.0,2016-09-09 11:12:43
从K线形态看，江苏银行基本跌到位了。,19777,37,157,2.5,2016-09-05 17:06:58
给江苏主力资金吸筹的时间不多了,10976,22,365,3.5,2016-09-12 10:03:55
江阴银行的磅礴走势气得江苏银行直翻白眼,6112,7,89,3.0,2016-09-13 20:24:56
不到11.5谁也别买，谁买水谁傻。[大笑][大笑],25035,92,152,4.0,2016-08-26 14:29:12
看江阴银行大胆买江苏银行和贵阳银行,5048,11,144,3.5,2016-09-13 22:51:31
600919经过努力克服压力，不久总市值有望突破17,5700,9,176,4.0,2016-08-15 13:57:15
昨天布依悄悄来了，主力你砸600919太过份了，布,8452,13,206,4.5,2016-09-13 06:25:04
光头佬有好嘢:祝大家中秋节快乐，江苏银行节后,9317,16,352,4.0,2016-09-15 09:01:20
16.8.20浅谈江苏银行,29347,57,2018,2.5,2016-08-20 10:13:17
融资及时雨，向规模要回报,91394,42,1205,0.0,2016-08-07 11:33:02
16.8.26,14348,38,556,2.5,2016-08-26 15:29:52
跌到10元，我来买100股玩玩,3609,5,140,3.0,2016-09-14 18:12:09
一股亏2.7块，坚决割，扶贫没有底限，呵呵,8194,31,133,3.5,2016-09-13 09:48:16
我今年76岁了，14.55买入江苏银行2200股，拜问,21613,68,151,4.0,2016-09-09 10:22:09
江苏银行明天继续下跌5%,7999,9,75,3.5,2016-08-11 18:39:14
谁在江苏银行身上赚到钱了？,6995,24,183,3.0,2016-09-09 15:39:02
越是这么下跌凶狠，说明庄家要这股票。如庄家真,9599,9,247,3.5,2016-09-12 22:05:49
（江苏银行）跌时不敢买，拉起拼命追，谁都想天,19453,28,28,4.0,2016-08-17 11:42:05
江苏银行:（综合分析布局之振荡整理）,39157,63,18,4.0,2016-08-12 22:33:14
难得的袖珍银行股（一百亿锁定三年），必暴漲,55728,97,21,4.0,2016-08-10 22:38:43
江苏银行:（任凭狂风恶浪冲击都屹立不倒，坚持,8889,11,27,4.0,2016-09-05 23:11:14
现在才是爆跌的开始，我14.27全仓的，今天11.05,8653,14,192,3.0,2016-09-12 18:42:58
个股研判：江苏银行,9187,7,571,3.5,2016-09-10 22:42:53
昨天下跌时，江苏银行放量了，由前一日的成交量,13690,17,302,2.5,2016-09-10 14:44:20
苏银现在下跌主因是割肉盘而不是获利盘，本人14,8239,8,274,3.0,2016-09-10 20:17:09
卡卡11.68进驻江苏银行,6553,9,178,4.0,2016-09-06 10:34:53
警惕！警惕！警惕！,11657,18,238,3.0,2016-09-06 16:35:56
江苏银行拟发行200亿元绿色金融债,34601,45,491,0.0,2016-09-11 17:21:31
中能够找到答案，,1457,16,126,2.5,2016-09-01 11:40:44
600919:江苏银行金融工具公允价值估值管理办法,26945,4,1774,0.0,2016-09-11 16:14:44
江苏银行抓紧时间建仓，不要错过,13469,15,112,3.0,2016-08-30 22:00:37
[牛][牛][牛]周一大盘不熔断，直接跌停！,3086,6,86,4.0,2016-09-09 22:03:56
！！真正打压股价的人！！,8763,12,275,3.5,2016-09-10 09:48:52
600919:江苏银行2016年第一次临时股东大会会议,34744,5,1863,0.0,2016-09-11 16:26:52
这垃圾银行 这么炒  没天理,11341,47,129,2.5,2016-08-04 09:57:55
亏了钱的进来！大家来说说到底要跌到多少？,4730,11,150,4.5,2016-09-09 15:34:27
被套和空仓者关注11-2元~11-28元可大胆加仓和建,4985,8,210,3.0,2016-09-09 17:17:43
我今年67岁了，14.56买入江苏银行3200股，拜问,4910,29,184,1.0,2016-09-09 09:56:21
主力几乎没有利润，看你怎么走,6851,12,138,2.5,2016-09-07 13:56:04
600919:江苏银行首次公开发行A股股票上市公告书,143597,60,1719,0.0,2016-07-31 14:22:25
散户太多，已经成为弱势股了,5513,18,174,3.5,2016-08-24 11:13:30
股性呆滞，很难赚钱,5460,16,161,3.5,2016-08-22 14:15:27
仔细分析今天走势说明后市不容乐观,9876,15,191,3.5,2016-08-18 11:33:00
为什么散户应该小心谨慎对待江苏银行,10817,25,237,3.5,2016-08-21 12:48:22
江苏银行恐破发 中签率高达0.467%,163727,356,1411,0.0,2016-07-23 15:26:56
江苏银行，一组半年报数据让人醍醐灌顶 茅塞顿,12485,10,1040,3.5,2016-09-02 11:20:00
可以换股，但千万别离开银行板块。,5331,10,167,3.5,2016-09-05 14:28:49
江苏银行尝鲜 首单不良资产收益权转让,20048,11,947,0.0,2016-09-08 01:14:41
江苏银行疑似见底了,11533,9,474,3.5,2016-09-06 20:51:35
一股亏了2.1块多，实在受不了割了这JB，认栽！ ,3199,9,140,3.5,2016-09-06 11:31:39
明天起10个跌停,9550,22,126,3.0,2016-08-31 22:05:38
最少28个涨停,3326,13,124,3.0,2016-08-02 08:00:16
可以确定江苏银行明天板上可以卖了。,17855,22,145,3.5,2016-08-04 22:25:49
周五买入12500股，不到18元不抛！立贴为证！（,35767,52,318,2.0,2016-08-07 22:31:56
江苏银行就是一垃圾，同意点赞！,37472,167,15,3.5,2016-08-08 17:17:01
这个股没人赚钱，就是说明不值这个价钱，今天一,4953,13,149,3.5,2016-09-06 11:35:37
江苏银行今日超大单流出排名第13名(09-05),20313,11,346,0.0,2016-09-05 16:10:05
中石油第一.国泰君安第二.江苏银行第三。套你不,10149,14,174,2.5,2016-09-03 07:42:24
江苏银行将来会被空头作为工具，等着桥瞧，总有,11495,27,113,2.5,2016-08-03 13:06:56
别人怕的时候我11.58元买入五万股,9582,40,146,2.0,2016-09-05 15:04:10
今天大胆买入了80万股,5447,13,139,1.5,2016-09-05 15:42:38
[大笑][大笑][大笑]神奇的中国股市，你每一次买,9187,21,140,4.0,2016-09-02 08:57:37
看不懂了吧[大笑]从明天开始涨停，没上车的没机,5095,8,160,3.0,2016-08-08 15:02:36
11.72全仓杀入,3282,11,128,1.0,2016-09-05 14:14:47
形态难看  希望仍存,8078,45,385,2.5,2016-09-01 21:54:17
11.7的一万多手拖单，等会又要对倒砸了,3348,6,159,3.0,2016-09-05 13:31:57
江苏银行垃圾：每天跌1毛、2毛、3毛，我14元2毛,3032,7,129,2.5,2016-09-05 14:22:00
下週江蘇銀行見8塊,6712,11,128,4.0,2016-09-04 13:32:34
我14、14元、8月16号买、一直补一直套、这股跌,15232,25,211,1.5,2016-09-02 16:42:26
十九元,6309,17,3,4.0,2016-08-05 10:31:43
已满仓，再跌也没关系了，等到月底季报出来就有,11879,19,187,2.0,2016-09-02 14:43:06
继续为大家诊股,18596,49,230,3.0,2016-08-29 21:23:16
希望江苏银行成为破发的第一支银行新股。[大笑],4910,3,160,3.5,2016-09-02 15:19:06
江苏银行今日超大单流出排名第8名(09-01),22146,9,339,0.0,2016-09-01 16:07:38
看看目前换手率6.31%，但凡阴跌不止的票，换手,4673,6,229,3.0,2016-09-02 14:03:20
一定要坚决举报恶意打压股价行为,4555,9,153,3.5,2016-09-01 22:47:16
流通市值只有142亿的新股。大家还唱空。艹。只,5640,13,232,3.5,2016-08-26 10:58:15
走他妈妈滴。亏损18%。还要不要人活了。,6198,12,149,3.0,2016-09-01 15:18:35
一杯茶，一包烟，一只死股看半天。求下联？高手,12310,51,134,3.5,2016-08-30 14:58:51
江苏银行已见底，立贴为证,7848,12,151,3.0,2016-08-29 20:54:07
[大笑][大笑][大笑]东方即红师兄，300372欣泰电,4876,8,147,4.0,2016-08-31 19:37:41
还有中签的没走吗？,9251,23,128,3.5,2016-08-31 16:07:49
600919:江苏银行关联交易公告,47406,45,1889,0.0,2016-08-30 20:12:50
各种唱空的，你既然不看好该股，为什么要在这儿,4085,23,160,3.0,2016-08-30 11:01:29
#不要以为贵阳银行市盈率高.第一创业市盈率奇高,7267,21,184,3.5,2016-08-29 11:38:48
史上最纠结的打新股就是江苏银行。到底要不要申,26497,25,187,3.5,2016-06-21 13:26:25
收盘价12.26元,5244,9,128,3.5,2016-08-30 14:33:50
江苏银行股份有限公司是由江苏省内的原无锡商行,11769,21,340,4.0,2016-08-28 14:52:46
600919:江苏银行董事、监事和高级管理人员持有,22259,3,1877,0.0,2016-08-30 20:12:21
江苏银行突然出公告利好明天绝对是要涨停的节奏,15531,10,160,3.0,2016-08-30 23:06:01
600919:江苏银行关于聘请2016年度会计师事务所,20530,2,817,0.0,2016-08-30 20:13:28
600919:江苏银行内幕信息知情人管理办法,25026,5,1946,0.0,2016-08-30 20:12:50
苏银13.76建仓，不知何日解套,7713,20,142,1.5,2016-08-30 09:32:31
吧里有没有高手，这个这个位置上能不能继续补仓,10092,12,226,3.5,2016-08-29 18:38:13
18--22见,8261,11,124,3.5,2016-08-29 22:11:09
专治各种“股”病，免费诊断,11635,76,245,3.0,2016-08-22 17:25:58
江苏银行集小盘，绩优，新股题材于一身，必涨,10211,16,136,3.5,2016-08-27 21:07:48
闲来无事都晒晒成本 我先来看看有没有比我高的,7696,29,138,2.5,2016-08-29 11:11:14
600159涨十个一字板还是低价绩优股！大资金强力,3241,3,166,4.0,2016-08-29 17:26:19
江苏银行一定步中神油后尘，神油从48到6， 江苏,6845,14,131,3.5,2016-08-27 12:15:13
够啦！一群没有江苏银行的股票却在天天叫空的猪,6025,13,156,3.5,2016-08-28 16:29:51
江苏银行现在12元，5个月时间要跌不到8块以下，,7567,16,111,2.0,2016-08-28 08:55:42
9.03挂1万股！,8192,14,128,3.0,2016-08-02 00:01:57
布依今天在12.10元以下5倍买入600919,4130,7,156,4.5,2016-08-29 09:46:54
还有赚钱的吗,5411,10,122,3.0,2016-08-28 18:11:45
建设大家注销江苏银行的所有帐户，太黑了！,8766,9,150,4.0,2016-08-27 08:36:29
江苏银行今日超大单流出排名第17名(08-26),29802,11,338,0.0,2016-08-26 16:11:45
为什么说目前股价离底部很近了,16728,25,387,3.5,2016-08-28 00:56:51
周一直接拉一个涨停  让空军吃屎。,9808,13,143,3.5,2016-08-27 19:59:32
江苏银行要5个月时间里回不到8块以下我脑袋切下,4791,9,99,2.0,2016-08-28 08:53:12
亲身经历：第一创业的时候，也有人说如国泰君安,8536,10,244,3.5,2016-08-27 21:01:59
一只股价严重扭曲的新股,5810,11,387,3.5,2016-08-28 08:34:04
苏行现在价格实在太高了。 对比南京银行，本益,5294,5,213,2.0,2016-08-27 21:58:42
如果没割肉的朋友就请忍一忍，下周二，最迟下周,15397,19,215,2.5,2016-08-26 15:24:39
600919:江苏银行关于选举职工监事的公告,37865,20,466,0.0,2016-08-26 17:43:59
[兴奋][兴奋][兴奋]不知道为什么，荣超和哥同一,6213,11,155,4.0,2016-08-20 20:20:46
600919:江苏银行关于董事辞职的公告,51713,22,364,0.0,2016-08-21 14:06:35
16.8.25,15311,38,589,2.5,2016-08-25 17:02:00
明明大势已去，我为何还不信邪。。。竟全仓这里,9953,26,176,3.0,2016-08-26 14:41:54
完全是一堆散户,5352,10,102,3.5,2016-08-26 21:25:27
大反攻开始了！,7481,37,7,3.0,2016-08-26 14:42:02
大盘普涨，苏银继续跌。今天难受吧？绝对难受的,9502,33,245,2.5,2016-08-26 11:21:11
600919:江苏银行关于职工监事辞职的公告,60432,39,381,0.0,2016-08-21 14:07:11
流通市值在同股中明显偏低逢低每个价位买进五位,56130,161,101,4.0,2016-08-05 15:12:05
江苏银行半年内股价不会下探14元以下，无惧恐慌,5824,8,105,4.0,2016-08-16 07:31:25
银粉告诉你，为什么这么多人极度害怕银行股上涨,20952,48,137,3.5,2016-07-24 11:00:01
刚12.3五万全部股卖掉感谢庄家拉一把没让我赔钱,3143,8,140,2.5,2016-08-26 14:14:15
13.62本，7000股今天割了！,4024,8,138,0.5,2016-08-26 11:26:32
今天至少高开3个点，不要问我是谁，股神天一！,4695,18,158,3.0,2016-08-26 07:09:31
请求证监会严查此股票。欺诈上市，欺骗散户。每,5806,18,203,2.5,2016-08-25 14:51:43
明天至少高开3个点，不要问我是谁，股神天一！,8001,9,158,3.0,2016-08-25 21:21:08
[牛][牛][牛]苏银的确走弱了，市值又大，建议关,3519,8,122,4.0,2016-08-25 16:53:47
江苏银行 主动买套 机不可失 失不再来 速买！,9160,44,23,3.5,2016-08-25 08:31:53
看涨江苏银行的，这次舒服了吧,8637,23,218,3.0,2016-08-24 19:23:28
推荐一只好股票,3638,10,148,3.5,2016-08-25 10:33:43
江苏银行亮相A股 经营业绩呈高增长态势,28624,15,1087,0.0,2016-08-03 02:49:59
如何看待今日走势,7961,10,315,2.0,2016-08-24 16:30:32
12.90牢不可破，铜墙铁壁，不信你砸！,7518,38,20,3.5,2016-08-23 13:50:39
苏银波段回调黄金分割0.618计算已经到位。,7217,11,363,3.5,2016-08-25 06:58:49
江苏银行今日超大单流出排名第3名(08-24),27813,15,339,0.0,2016-08-24 16:08:02
[牛][牛][牛]看到苏银暴跌，速度清仓银行等大难,1998,3,140,4.0,2016-08-25 06:18:03
苏银是银行新股定位最低的一只，也是新股定位最,5739,4,178,4.0,2016-08-24 20:17:47
[牛][牛][牛]警告，关注苏银！如果苏银不能止跌,4461,6,131,4.0,2016-08-24 20:44:32
如果苏银不值现在的股价，其他新股的泡沫有多高,4626,7,174,4.0,2016-08-24 20:19:59
[兴奋][兴奋][兴奋]苏银在今年上市的新股中，定,3129,3,164,4.0,2016-08-25 06:10:30
本周预测，欢迎讨论。,12396,13,492,1.5,2016-08-23 18:06:54
今天600919迎来首个涨停！,9447,19,140,4.5,2016-08-24 06:00:27
今天在13元以下你买入600919了吗，明天此股涨停,13766,14,164,4.5,2016-08-23 17:19:20
今天布依在12.85元以下买入600919，理由下午601,4196,8,186,4.5,2016-08-24 13:02:26
为什么大家应该尽快减轻仓位,7180,14,210,3.5,2016-08-21 18:26:26
16.8.23,10173,17,935,2.5,2016-08-23 16:30:43
16.8.24,9805,29,1034,2.5,2016-08-24 12:49:40
一杯茶，一包烟，一只死股看半天。求下联？高手,6617,36,134,3.5,2016-08-24 15:58:51
昨天14.30进场的。今天傻眼了。,11261,18,132,2.5,2016-08-17 18:21:08
谨防主力拉高出货,5105,10,138,3.5,2016-08-23 15:09:11
现在对江苏银行失去信心的请举手,4113,11,145,3.0,2016-08-24 13:48:04
今天没卖，完蛋了。本以为会拉升，结果尾盘突然,6738,12,221,1.5,2016-08-24 15:17:58
江苏银行机构太阴毒，散户千万不能买!!我不断提,4655,8,139,2.5,2016-08-24 13:37:00
全仓13.96的本，这温水给我煮的那叫一个舒坦啊,6028,16,196,1.0,2016-08-22 10:40:22
江苏银行今日超大单流出排名第16名(08-23),27006,15,336,0.0,2016-08-23 16:10:31
江苏银行看到25元立帖为证第一价位,8124,16,17,1.5,2016-08-21 16:55:49
傻子才会卖,6138,11,141,2.0,2016-08-04 10:08:51
我真的想骂人了，老子买进去，就连跌了5天。,3718,15,133,2.0,2016-08-24 11:16:02
如果江苏银行开板后就往下砸，以后怎么再发其他,18221,34,225,3.0,2016-08-05 18:44:46
半小时后再次开涨板，立帖为证,6554,15,138,3.0,2016-08-05 13:18:20
11.41买点,11602,18,124,4.0,2016-08-08 10:49:40
在我账户中江苏银行和贵阳银行都是中签到的新股,8695,18,1092,3.5,2016-08-21 07:09:45
[兴奋][兴奋][兴奋]哥认为证金在全面出逃，逢高,2281,5,95,4.0,2016-08-22 12:18:13
刚浏览了一下关于银行板块的新闻，估计明天上涨,9516,6,231,2.0,2016-08-23 22:40:52
为什么主力不看好江苏银行,24994,28,134,3.5,2016-08-18 21:36:10
今天主力净流出12165.65万，超大单流出12272.01,7229,17,201,3.5,2016-08-23 19:28:42
無量拉升，明顯誘多，不進,7224,16,134,4.0,2016-08-23 14:12:21
明天到12.5可以轻仓参与,6292,10,140,4.0,2016-08-23 17:34:40
贵阳银行盘口分析，明天仍是一个涨停，600919在,4442,3,135,4.5,2016-08-23 13:22:09
13.6再入,60190,455,6,4.0,2016-08-18 09:40:22
明天江苏银行如果不跟贵阳银行一起涨停，本将军,13951,32,176,4.0,2016-08-21 22:53:41
下午不漲停，評論的每人發1000塊錢,6864,41,146,4.0,2016-08-19 12:56:22
今天预计收盘价在13.68左右,3388,11,140,2.0,2016-08-23 14:11:08
现在拼命打压，哈哈哈，下午就涨停了,5444,16,161,3.5,2016-08-23 11:23:23
中签的还有吗？我还在坚持。,6058,16,136,3.0,2016-08-22 21:38:01
看来今天不少江苏银行的朋友割掉了带血筹码了，,20736,63,247,2.5,2016-08-22 10:27:37
大胆买入600919，600149涨停己保障，下午600919,4551,10,192,4.5,2016-08-23 13:12:46
周一走势,35735,109,4,4.0,2016-08-19 18:22:02
一大批贵银的看着苏银，一大片散户都在围观苏银,5241,5,254,1.0,2016-08-22 21:46:46
江苏银行董事王弋因工作调动辞职,26672,17,171,0.0,2016-08-21 16:06:56
中签不容易，一千股能不能获利一万元？,17322,32,136,4.0,2016-08-02 16:18:57
狠毒的主力   割肉就拉     服你了。,2977,7,146,3.5,2016-08-22 11:35:12
布依集合竞价买入600919,2824,7,138,4.5,2016-08-22 09:26:27
银行股套牢以后很难解套,7438,22,159,3.5,2016-08-17 23:20:21
中签者看过来!!!!!! ，务必顶上去让更多人看到,22374,93,737,3.0,2016-08-03 16:17:24
苏银四连跌是何寓意？总市值一千多亿，流通市值,12531,12,287,2.0,2016-08-19 17:02:59
各位股民朋友，大伙儿应该看到今天的公告了。估,9974,19,442,2.5,2016-08-21 20:16:11
董事辞职是利好还是利空？,11775,16,134,3.0,2016-08-21 15:39:31
[兴奋][兴奋][兴奋]银行在调整出货，600691可以,3656,6,109,4.0,2016-08-17 21:18:38
江苏银行把江苏人的脸丢尽了,3678,5,154,3.5,2016-08-20 19:50:22
苏银机构研报三个月给予目标价18元。不以一时胜,6861,9,193,3.0,2016-08-21 05:25:29
作为刚上市绩优次新股，江苏银行已经被严重压盘,12174,22,215,4.0,2016-08-20 17:42:07
江苏银行今日超大单流出排名第5名(08-19),28554,13,339,0.0,2016-08-19 16:07:12
你愿意买入18元的贵银，还是以13元买入苏银,6767,11,173,3.5,2016-08-20 20:22:34
低位了，主力亏钱砸盘卖出，为什么？看后你就懂,17481,35,762,3.0,2016-08-20 14:10:34
银行股的市盈率分析,4082,6,191,3.5,2016-08-20 20:49:21
我江苏银行，贵阳银行都中了1000股，江苏银行开,6190,6,258,3.0,2016-08-20 21:54:40
江苏银行今日超大单流出排名第20名(08-16),34660,6,341,0.0,2016-08-16 16:07:47
周一贵阳银行18元封涨停并且继续连板涨停，江苏,10735,19,197,4.0,2016-08-20 14:14:29
江苏银行的亮点是股权很分散，容易产生股权之争,7977,6,121,3.5,2016-08-20 01:14:14
【讨论】主力出货股价下跌，你还愿意继续坚守吗,22457,19,1815,4.5,2016-08-19 13:53:16
下周苏银正式开启主升浪,9119,8,132,4.0,2016-08-19 22:43:15
为什么江苏银行下跌空间十分有限,10397,20,204,3.5,2016-08-19 20:11:56
希望大家能够齐心开版再卖，这样20个版没有问题,4759,16,158,4.0,2016-08-04 14:33:48
中签的散户，还有没卖的吗？,5158,13,136,1.0,2016-08-19 07:03:21
目前从市场局面上看，600919近期价位运行区间可,14541,21,202,4.0,2016-08-08 12:32:26
[牛][牛][牛]通知，下周全国一亿股民全给哥来买,9051,11,134,4.0,2016-08-12 15:29:21
週一必漲停,5186,14,120,4.0,2016-08-19 18:06:56
贵阳银行一路上涨，封杀了江苏银行的下跌空间,4207,4,94,3.5,2016-08-19 22:03:12
贵阳银行何时打开涨停取决江苏银行被砸程度,11948,8,198,4.0,2016-08-17 23:42:43
江苏银行流通市值最小，理想上讲应到17元,9119,19,145,4.0,2016-08-15 12:02:55
今天不漲停，從此退出東方財富，立帖為證,5856,14,148,4.0,2016-08-18 07:13:25
吸筹接近尾声,4798,15,129,4.0,2016-08-19 14:04:49
周一会不会破13[为什么],4760,6,131,2.5,2016-08-19 14:48:55
洗盘两天很正常。,6511,6,8,4.5,2016-08-18 09:02:32
江苏银行反攻势头明显，短期股价将继续上攻,24235,7,75,3.0,2016-08-15 14:00:21
今天13.55补仓但一股都没卖，因为我相信明天或,6502,11,203,3.5,2016-08-18 15:27:40
苏银中签了还未出手的有吗？举手,9598,25,140,1.5,2016-08-18 21:33:15
下午漲停,4391,22,118,4.0,2016-08-19 11:29:49
江苏银行主力快速吸筹完成控盘即刻开启一波拉涨,6459,7,157,4.0,2016-08-18 15:34:12
某人来电说下午要涨停，让我接一下，元芳，接不,4030,10,158,2.5,2016-08-19 11:26:41
今天收盘价15.03,4466,9,122,4.0,2016-08-19 10:23:36
江苏银行不但今天尾盘资金流出，明天还要低开,39005,63,229,4.0,2016-08-15 21:07:40
下午跌停！,2822,12,123,3.5,2016-08-16 13:37:47
这股可能会回到11.28，你别生气 因为我太资深了,7320,10,142,4.0,2016-08-18 18:58:08
那些嚷着苏银要破发的人，你们错了怎么不出来道,4956,13,190,4.0,2016-08-15 13:23:24
大咪咪，咪咪大,5932,10,124,4.0,2016-08-18 20:19:03
今天主力流出资金1.556亿元,6422,9,151,3.5,2016-08-18 18:06:00
1380以上买的举手,6670,13,130,4.0,2016-08-18 17:50:33
（江苏银行，天广中茂）九啸龙呤惊天变,5386,13,18,4.0,2016-08-17 11:29:03
江苏银行今天三波大资金入场，明天贵阳银行16.3,12693,24,141,4.0,2016-08-18 15:07:25
江苏银行今日超大单流出排名第3名(08-17),31318,20,339,0.0,2016-08-17 16:07:50
差不多了,4480,7,176,3.0,2016-08-18 15:21:29
今天主力又在反复出货,2372,6,163,3.5,2016-08-18 13:26:36
江苏银行机会来了！！！,21304,105,83,4.0,2016-08-09 09:08:48
能混到15元就不错了,13462,10,123,4.5,2016-08-02 22:46:39
资金大量流入，主力已经控盘,10680,15,162,3.5,2016-08-16 19:48:47
江苏银行虽然这两天跌了（其实也就跌了0.56元）,3758,2,355,2.5,2016-08-17 23:54:29
洗盘结束，逢低可入,2205,2,128,3.5,2016-08-17 23:29:06
江苏银行(600919)龙虎榜数据(08-15),80610,71,627,0.0,2016-08-15 16:53:27
今天江苏银行庄家狂压盘至13.40元，比今天涨停,13941,26,222,4.0,2016-08-17 18:07:51
今天是江苏银行最后上车机会，明天和贵阳银行同,11303,21,180,4.0,2016-08-17 17:05:12
明天就是买买买,14519,24,342,3.5,2016-08-11 18:25:54
今天是加仓的好机会，有买入的吗？，我赌明天涨,5234,10,162,3.0,2016-08-17 18:38:00
我的心好累，把东旭光电亏了7个点卖了。然后4个,4907,9,201,3.0,2016-08-15 11:07:51
临近尾盘换手率急剧放大，强庄也已进驻，明天一,7344,15,176,4.0,2016-08-17 15:07:29
600919:江苏银行:关于《江苏银行股份有限公司关,131719,45,406,0.0,2016-08-05 19:50:30
一个新股赚不到一万元,7938,14,218,2.5,2016-08-05 11:30:26
江苏银行又回到加仓价，机构万手买单频现，明显,5407,8,103,4.0,2016-08-17 10:57:47
贵阳银行今天巨单涨停股价赶超，苏银主力今天最,7287,49,133,4.0,2016-08-17 12:27:51
按30分钟，5分钟技术指标看，这股下午完蛋，小,3536,9,196,1.0,2016-08-17 12:19:55
它敢跌停我就加仓,18319,56,296,4.0,2016-08-08 10:08:55
心态放好，周一只要突破13.60元，江苏银行下周,38653,65,190,3.5,2016-08-13 21:47:36
有史以来最便宜的新股江苏银行，上市后必将被爆,58488,87,458,3.5,2016-07-21 10:34:48
深港通获批，周三江苏银行或迎开板后的首个涨停,9026,7,154,3.0,2016-08-16 21:21:42
二次连板前的疯狂洗盘！你中招了吗？,3363,14,137,3.0,2016-08-17 09:58:38
11.52已进，感觉良好。,11040,28,136,4.0,2016-08-05 10:27:31
明天貴陽銀行開板，主力正式進駐江蘇銀行，目標,10380,11,158,4.0,2016-08-16 20:19:07
[牛][牛][牛]深港通来了，没额度，明日抢筹业绩,2920,4,116,4.0,2016-08-16 20:53:41
[牛][牛][牛]关注业绩成长，002587涨过50元不高,2091,4,102,4.0,2016-08-16 11:51:56
嘿嘿，看好的人太多，不洗盘怎么再拉升。 [加油,5556,10,169,4.5,2016-08-11 17:49:01
今天收盘应该控制在14.19--14.26之间，,13367,26,158,2.5,2016-08-16 13:59:08
