标题,帖子数,日期,情感
大家告诉我，这一波22稳不稳,16867,2017-08-28,0.7390071842699046
券商股值得重仓买入和拼命捂住的根本原因,79018,2017-05-10,0.22994020083370292
一心陪股友走完中信证券从现价到33元全程,77264,2017-04-27,0.9899992268430376
咯咯咯咯 狂笑 翻倍股 晨鸣季报隐藏业绩核弹！,10820,2017-06-12,0.9989601105626001
华泰证券今上午稳跌-2.01%，中信还能守住？,39265,2017-07-21,0.8902746974729705
2年前轰动一时的外资司度炒A股终曝光 中信证券,51475,2017-05-25,0.7184322021179217
屮屮华泰证券融资完成就是中国的高盛了≈二个第,83387,2017-05-28,0.987605987637141
中信证券拿着就是---最值得托付养老！,10374,2017-09-03,0.8911263580325457
为司度两融业务违规“开绿灯” 中信、海通、国,64362,2017-05-28,0.802732668212552
券商股今天表现不错。中信短期的问题按姐的看法,248211,2017-05-25,0.9938827793928667
==华泰证券第一梯队大券商绩优成长互联网券商龙,67251,2017-05-28,0.9991483265696962
->华泰证券+美国金融科技企业颠覆“金融系统”,209981,2016-11-27,0.9999687895317774
标准的上升下漂旗型,51259,2017-08-04,0.314394080265437
大道至简，知易行难，知行合一，得到成功（续）,138145,2017-05-22,0.9493771180406797
中信证券即将爆炸主升到38元,17458,2017-08-26,0.9465942905955967
次新股0.98元业绩仅此1家江苏银行股价不到10块,30876,2017-04-27,0.049974062228806404
季线往上走,都是大牛股!,14412,2017-08-21,0.5406968291127165
空调要格力，手机要华为，新能源汽车？,9305,2017-07-09,0.12837558176758024
坚决定投买在史诗级大水牛的初期！2017年撸起袖,20879,2017-05-25,0.37631362192134377
股票相对于疯狂增长的M2来说太便宜了！,22443,2017-06-12,0.9682941819926824
》》》买买买（献给有缘人！中信证券是GJD重仓,58738,2017-06-23,0.9710265031641124
GJD全控银行、保险、券商、两桶油、大型煤炭企,22929,2017-03-21,0.06817264528673905
拉升保险后拉升银行，拉升银行后拉升券商！现在,43081,2017-06-22,0.0076547465199897635
缩量下跌放量上涨明显主力资金进场信号，一个“,15668,2017-05-27,0.6434082309428164
519暴涨行情只会推迟不会缺席！坚决定投买在史,16967,2017-05-26,0.26747231555797435
股灾期间为外资机构违规提供两融 中信证券被罚,41844,2017-05-24,0.31801645103744647
预防踩上业绩地雷,13033,2017-07-15,0.7416571991902833
[不说了]请问各位高手们，此股是否会枯木逢春铁,5922,2017-05-15,0.08940686460336855
[游资做多不死心]漂亮50英豪300必将疯狂展我中,7477,2017-06-12,0.9304870881197629
历史再次惊人的重演目前看来大盘在复制1999年5,59042,2017-06-24,0.9935207347921433
15万股中信边打新边等下次牛市来，一起想法的股,54246,2017-03-22,0.9261323695765887
希望中信证劵天天暴涨！,50177,2017-08-25,0.6593293997600881
毒品问题 吸毒举报贩毒 毒资奖给吸毒个 加国家,42396,2017-05-15,0.9911878485532805
战胜华尔街,46746,2017-05-14,0.9854062487073498
本少爷专冶pm2.5,38628,2017-05-14,0.8213909561638829
模型 全民基本信用,133569,2016-12-31,0.7085923308003611
模型2 全民基本信用,123379,2017-01-01,0.5194568209406358
节前分化！节后又如何？        今日上证指数继,14943,2017-05-26,0.986925096912216
不要对券商股继续抱有幻想，银行传统模式已经不,6771,2016-07-21,0.96655866831323
爱我中华，扬我国威，股市的影响力最大，最强，,8239,2017-03-11,0.9999950340077728
佛光普照，感恩正能量们弘扬正义！阿弥陀佛，阿,3945,2017-08-11,0.995226413865788
这一波想冲3400必须证券股带头,23493,2017-07-19,0.04495871198095713
中信证券今日超大单流出排名第5名(09-29),21165,2016-09-29,0.7861077281442229
最近，很多人在抨击新股快速发行。这些人无非是,10968,2017-06-02,0.8111476760136139
大国崛起大牛市系列！关于雄安，千年大计。千年,20397,2017-04-06,0.9990870220220152
恐慌了.机会来了,31053,2017-05-11,0.7341794495700423
狂笑 瞎子也狂笑 业绩翻倍 股0.99今年三倍，翻,11591,2017-05-24,0.20940363332354495
狂笑狂笑  瞎子也狂笑 业绩翻倍 股0.99今年三倍,14669,2017-05-24,0.25184990965565945
狂笑 呆子都会抢 瞎子也狂笑 业绩翻倍 股0.99今,10890,2017-05-24,0.488956824832688
狂笑 呆子都会抢 业绩翻倍 股0.99今年三倍，翻,11390,2017-05-24,0.3588739372419474
狂笑 狂笑 呆子都会抢 瞎子也狂笑 业绩翻倍 股0,10917,2017-05-24,0.025312433897087483
对中信证券中报点评,42440,2017-08-25,0.7739917691410425
上行动力严重不足.假突破或成立,76485,2016-08-30,0.9552606080880462
压在中信上的黒乌鸦终于飞去。中信将开启加值回,75977,2017-05-24,0.9205591097137479
可怜的散户必有可恨之处，可怜的傻逼散户的共同,21500,2017-03-20,0.6716771708725684
可怜的散户失败的原因就是：底部区域极度恐慌而,21931,2017-03-06,0.008424070180150234
》》》买买买！二十年操盘经验得出分析中信证券,25226,2017-05-30,0.9852952022572887
新股发行无限量供应其发行速度由市场决定形成如,10349,2017-06-02,0.24243930675450343
519暴涨行情只会推迟不会缺席！坚决定投买在史,20779,2017-05-25,0.26747231555797435
2017年中报点评：归母净利润下滑6%，成本控制初,23150,2017-08-29,0.862554137189759
中信证券(600030)融资融券信息(08-24),5886,2017-08-25,0.9630896642925719
王健林会见中信证券董事长张佑君,41562,2017-06-27,0.9982589858779172
2017半年报点：收入结构均衡 龙头地位凸显,26485,2017-08-28,0.9882451354445352
明天继续逼空，本周k线中阳,13914,2017-07-13,0.5170835993352234
业绩强劲可持续，估值修复可期待,9793,2017-05-02,0.9487547548709727
中报速递：中信证券2017年上半年盈利49.27亿元,48612,2017-08-25,0.723160279719512
中信证券中期净利润约49.27亿元同比减少6.01%,23128,2017-08-26,0.8746818835826833
600030:中信证券2017年半年度报告,46454,2017-08-25,0.8489214905792138
散户必看炒股格言和现金策略！ 孙子云：先立于,37096,2017-04-22,0.08329665475196413
再次开仓杀入！,5722,2017-08-25,0.19554048627155707
给石墨烯电池估个值,7911,2017-08-02,0.39727768673378505
中信证券一季度净利增长40.18%至23亿元,29707,2017-04-28,0.9822628924657015
我持有6000股中信证券，今天分红2100元，可帐户,26874,2017-08-18,0.3701658989886999
昨天买进的中信，为了包住分红16.82离场，我不,18303,2017-08-18,0.7799982356636838
600030:中信证券2016年年度A股分红派息实施公告,152623,2017-08-10,0.8494404756068353
本ID的次新股今天又是大丰收！[大笑][大笑][胜,3691,2017-08-17,0.4346358897933741
中信证券完成发行45亿元公司债券,10992,2017-08-15,0.53524701463132
开个认真讨论中信证券的帖子！ 这几天的量都不,29766,2017-06-09,0.8301101221247419
入摩手记,71298,2017-06-21,0.9054782663684761
多家券商披露一季报 中信证券及光大证券获证金,37947,2017-04-28,0.873705619286026
2017年一季报点评：业务稳步发展，费用控制提升,7833,2017-05-02,0.5745384071841932
中信证券配合做空反思：高管当年年薪7127万节操,283845,2017-06-05,0.9982839853755874
600030:中信证券2017年半年度业绩快报公告,134127,2017-07-14,0.8401323011778039
600030:中信证券关于收到中国证监会行政处罚事,82859,2017-05-24,0.5581498848529945
重识庐山真面目，龙头昂首再起航,91167,2017-05-31,0.17912834679396616
价值投资将欲行，忽闻创业涨停声。各路研报深千,6068,2017-07-28,0.9974254270129344
中信证券派发末期股息每10股3.5元,50804,2017-06-20,0.5183460862037609
进场: 怎么跌的就会怎么涨上去（荐股）,11877,2017-08-06,0.7541933135049772
GJD全控银行、保险、券商、两桶油、大型煤炭企,12697,2017-04-22,0.06817264528673905
中信证券7月净利润7.17亿元同比下跌24.3%,44848,2017-08-04,0.7523424636826821
中信证券7月份净利润7.16亿元人民币,41031,2017-08-04,0.8702658171583113
年报点评：龙头地位不变，继续加强海外布局,25632,2017-03-29,0.36761540445881224
2017年撸起袖子加油干！当前我国资本市场的主要,19767,2017-03-12,0.9995425372186325
判无期或s刑,30695,2016-05-06,0.32727236396410775
嘉欣丝绸总分红率显著高于贵州茅台！嘉欣丝绸才,5461,2017-04-06,0.7733080454100324
养老金老谋深算掐时精准,广发中信长阳虎啸券商,10448,2017-03-09,0.8258115214338239
17.42  拔河比赛  多方胜！,5622,2017-08-04,0.7086610766292815
600030:中信证券2017年7月份财务数据简报,98194,2017-08-04,0.8981988441187436
基金抱团炒个股是中国式庞氏骗局，隐患危害大60,21864,2016-07-22,0.6167342253067752
期待券商王者归来 君临天下[赞],9345,2017-06-19,0.9435998812934631
中信还欠散户至少一个涨停板，强力买入,2386,2017-03-29,0.951146315239151
昨天全仓中信证券，期待今天突破18,3255,2017-08-03,0.9907761570109495
2017年撸起袖子加油干！什么样的散户是傻逼，身,16850,2017-03-13,0.870118629388956
寻到15年涨50倍的下一个恒瑞，要复制恒瑞需满足,2849,2017-07-17,0.9989926693485262
强烈看好券商!券商盈利模式转型：投行将成为券,20858,2017-05-27,0.7281095668896396
八月拿下20元,1534,2017-07-31,0.18980709883920488
中信证券同比下降6%调仓泰山石油大消费龙头为宜,9445,2017-07-15,0.05387420438966373
散户能否突破重围，中信证券上涨必将波澜壮阔，,17316,2017-07-18,0.9917906323334423
中信证券(600030)融资融券信息(07-28),703,2017-07-29,0.9630896642925719
中信证券，王者归来！,49452,2017-06-19,0.9787111278732542
说什么也没用，有图有真相,15518,2017-06-23,0.6291776563828176
新慢牛行情来了，中信大胆融资做会涨到25,16130,2017-07-24,0.9996284289517213
狂抢！咯咯咯！抢盘了，黄金砸头！晨鸣投资价值,14422,2017-03-01,0.9993387030243963
最近，很多人在抨击新股快速发行。这些人无非是,11960,2017-05-28,0.8111476760136139
新股发行不能停的重要理由：新股发行市场化可以,15311,2017-06-03,0.013998161080678195
2亿股民小瞧了加入MSCi价值，更忽视了国际化后,12948,2017-06-13,0.9171404572335651
券商板块光凭这一点就足以成为下一场牛市领头羊,29652,2017-06-10,0.6139394235683264
中信和券商板块还有两天调整，然后迎来上涨，三,17095,2017-03-20,0.07623690760480084
中信证券(600030)融资融券信息(09-29),8522,2016-09-30,0.9630896642925719
保持一点清醒！ 大盘应该是回调未到位！出了个,110092,2017-04-06,0.8906812844107637
画皮正一张张脱落,3271,2017-05-24,0.7093798312704367
坚持自己的信仰，让正义之剑来审判腐朽的垃圾们,65555,2015-09-07,0.994495464517677
券商唱歌跳舞为那般？券商救市所持中字头股票50,10403,2016-12-01,0.9678833134225091
中信证券6月净利润按年跌32%,36350,2017-07-10,0.6056834791788354
中信证券上半年净利润达49.27亿元同比减少6.01%,41746,2017-07-14,0.5947022168587441
半仓中信证券，看好。,11143,2017-06-23,0.44755633682137386
实战炒股口决： 十四工作线，不破不走人。短线,29767,2017-01-29,0.9596611393517058
中信证券主力资金流向监视,4682,2017-06-20,0.9880677281277289
随着A股被纳入MSCI，A股生态将发生巨变！,34999,2017-06-22,0.4521464063999334
价值投资  永远是一个人的修行,27692,2017-06-21,0.9940254031544422
我只做周线，小震荡无所谓,6015,2017-07-19,0.32111890208926575
中信证券6月净利润8.26亿元人民币,22282,2017-07-10,0.6413785583687491
中信价值多少,11481,2017-06-30,0.9080794853558297
>华泰证券+美国金融科技企业颠覆“金融系统,3630,2017-07-20,0.9999719011372331
高成长股，加快新能源汽车锂电业务，捕到一只新,5571,2017-07-20,0.5690359889199842
价高出不如下全转买*惊天一路一带龙头600307酒,9950,2017-06-04,0.5499834178749361
中信证券的近期目标：突破18.29的前高,10623,2017-07-09,0.9932391550257658
明天突破18元,5356,2017-07-11,0.7288574938983686
六分钱之间来来回回，你累不累啊？！！没操纵谁,7773,2016-09-30,0.03173758480750544
最新策略：小盘央企+超跌+低价+实质性重组+并购,3563,2017-06-06,0.19258242571955964
集中兵力，炒新的热门板块龙头股票： 1，首先选,5531,2017-01-01,0.7535101215049678
亲：价值投资首选：煤炭行业中的茅台业绩增十倍,5790,2017-07-16,0.9999272168721396
中信证券是做空中国股市第一股,13347,2016-09-23,0.9767887689673306
中信证券：上半年净利49.27亿元 同比下降6%,60848,2017-07-14,0.777392789243474
基金抱团炒个股是中国式庞氏骗局，危害大030,12880,2016-07-21,0.948949627315205
抛！机构连拉股价，制造概念，用人性贪婪，忽悠,39197,2016-03-22,0.9616263649280308
中信崩盘啦 崩盘了  !!!!!!!!!!!!!!!!!!!!!!!!!,325660,2015-09-13,0.8362829599107254
银行保险新高飞了000001,4804,2017-07-12,0.17361269695299053
南京银行、中信方向相反,14919,2017-04-03,0.9523178519954687
转发:我在遥望,大盘之上,有多少股票在自由地滑,4621,2017-06-26,0.4737672181921908
600030中信证券 券商板块 此股近期随着大盘的反,6865,2017-06-26,0.7061686344629545
中信甘心当广发的跟班。没点出息。,5451,2017-06-26,0.3013261558611253
去买002869.,4394,2017-06-26,0.46938625558411406
真他妈逼炒蛋，还没长就想调整，主力有病,4816,2017-06-26,0.09567961556632032
黑色星期一有多黑？ 中美贸易问题不断，吃亏的,17508,2017-06-24,0.967454474419424
牛市开始,9588,2017-04-21,0.7499999999999999
远离毒品，远离A股！,6426,2017-06-30,0.6847452382512536
中信证券   王者归来    坚定持有,7057,2017-06-27,0.9601046721692916
《一个雄霸全球的大牛市正式开始》15年的疯牛只,17886,2017-04-08,0.7462882890882214
卖光小盘股和次新股！加仓券商板块！所有板块都,9448,2017-07-07,0.03941219694579812
中信很高明，伤股民不滴泪,6311,2016-09-30,0.959055721381649
2:30！,1936,2016-05-25,0.5
税制改革方向及推进增值税立法等多种因素,5265,2017-07-09,0.9981285775456012
600030:中信证券2017年6月份财务数据简报,93496,2017-07-10,0.8724759896040026
中信证券真的坑人,1950,2017-07-03,0.8733454484480028
实践是检验真理的唯一标准，九根稻草压死7翻身,7383,2017-07-08,0.8630486932187741
特殊通告：金钼股份创历史新低7.05元，不要错失,2359,2017-05-08,0.9523187519501101
16.97 拔河比赛  多方胜！,6089,2017-06-26,0.7086610766292815
大盘要狂拉1000点[想一下],3976,2017-06-26,0.6115522341876345
全体等韩教授公布黑幕！,5122,2017-07-06,0.4152024079103862
券商高管的高薪，基本无持股,6582,2017-05-16,0.17975374564564794
小漢奸[大笑][大笑][大笑],2237,2017-07-04,0.8469429471244454
板块涨时压盘抛卖，空军工具，涨不起，跌第一,6256,2016-09-29,0.429360954889069
券商股下跌才刚刚开始，大家注意保命！,3158,2017-07-04,0.26579788900787515
今天大盘跳水，千古跌停板，互相转告做个好人，,2058,2017-07-04,0.5926466364267218
送给为定增而买股的股民：定增原来是这样玩的,3753,2017-06-26,0.9313657950133907
明天能到多高?能突破前面高点吗？,6165,2017-06-26,0.5539995985178066
真的要做千年的王八吗？,7720,2016-09-30,0.9704425329347145
超低估值机构扫货可能性大____________________,23181,2017-05-13,0.8509949174455376
2017年注意这几条还不晚！,29739,2017-04-02,0.29347183509746755
中信应该狂买。,3516461,2015-09-08,0.8096706360967051
600030:中信证券H股公告(股份发行人的证券变动,27918,2017-07-04,0.6609848850549367
本少爷专冶pm2.5,415740,2015-12-31,0.8213909561638829
战胜华尔街,185753,2016-01-12,0.9854062487073498
走了。数钱去鸟…,4227,2017-06-27,0.40056406547149126
一天涨跌。0.3。。骗。,3650,2017-06-26,0.04234726794618837
全球股市上涨，为什么中国股市不涨？,29573,2017-06-12,0.9718331830234267
滥竽充数,7063,2016-09-30,0.22764514909921518
大盘日周月线收阴迎十一，节后,6385,2016-09-30,0.15457427925870382
节前维稳，买入券商，我不信还会跌,7795,2016-09-30,0.8412499654583039
谁在一直抛啊  。,5399,2016-09-30,0.5714285714285716
今晚可能就有好消息，香港已经传出好消息了,27463,2016-09-29,0.6306981544800129
明天15.78元收盘！,5214,2016-09-29,0.2734319911554368
今天是瞎了眼了，买了一只最差的券商股。,6166,2016-09-29,0.0336592490164922
东北证券大股东东北医药龙头亚泰集团土地储备竟,7804,2016-09-30,0.7969102976935426
柳钢2016年半年报较往年同期暴涨900%。三季报较,6016,2016-09-30,0.48784403327629244
今天100%砸盘,6157,2016-09-30,0.391383654489703
券商中的极品~~~垃圾,8973,2016-09-30,0.48231896072404534
买点中信压箱底，就当存银行了,13382,2016-09-28,0.8377627883331199
24500股，反转,7540,2016-09-29,0.21061241711830692
主力近期持续净流出，而且幅度不小，节后应该不,4236,2016-09-30,0.13423588371247341
加仓静等深港通到来。,4810,2016-09-30,0.4380739038710664
大盘不到2970证金是不会动的，只会砸盘！,7805,2016-09-30,0.18412723602366177
历史大底部，节后第一天涨停潮！,8245,2016-09-30,0.5941941269130426
120分钟底背离 应该反弹12天,8255,2016-09-30,0.010767031709577601
9月30号买卖点,7744,2016-09-29,0.022874059214205267
臭不要脸终于要绿盘了,5636,2016-09-29,0.07200447374904007
你吗B砸吖,6803,2016-09-29,0.1361474128716409
中信下午如不跌停，我自宫！,9040,2016-09-29,0.7727222225535425
今天券商股全红，只要冲出个带头大哥就全飙了,8634,2016-09-29,0.09978846981023382
午后大盘爆涨。,3206,2015-09-07,0.6085828851502839
化曲折为财富，说明通往财富的道路是曲折的，我,5696,2016-09-30,0.9985910351969942
16.19 是今天的多空分水岭,9042,2016-09-30,0.6312759669894753
天窗一直开着？......赶紧跌，跌下来好补仓！,9035,2016-09-30,0.0025150687125405913
中信证券今天又联合外资做空A股，真可耻,10142,2016-09-30,0.42126274381861417
清仓不玩了，过个祥和的国庆[大笑],10073,2016-09-30,0.6771359945259167
下午2点别忘了跳水狗庄,7766,2016-09-29,0.22375516436140064
已逢高减仓再涨到16,8全倒给你,12270,2016-09-29,0.25204135558736696
国庆节，我们伟大的节日，中信证券会让股票收红,8360,2016-09-30,0.9020888311029354
注意点 跨越三大行业（高科技 军工 有色）的楚,8095,2016-09-29,0.8220786351812458
空军司令,6326,2016-09-29,0.4737672181921908
静等中信的王者归来。静等更合规则的中信打造资,8082,2016-09-29,0.999974067844081
一个可以改变人生的历史性机遇，一个诗史级大水,12432,2016-09-29,0.9659703881367352
中国史上最大的房地产泡沫怎么调控呢？股票市场,8948,2016-09-30,0.9944232694174802
一开始地产不允许买卖就不会出现这么多问题,6839,2016-09-30,0.028330448164543
16.19 是今天的多空分水岭,9698,2016-09-29,0.6312759669894753
中信集团、证金公司、社保基金近期会增持中信证,6469,2016-09-27,0.9849261292866199
大量买入,7553,2016-09-22,0.7499999999999999
嘉欣丝绸，A市唯一的世界首富概念股。,15803,2016-04-16,0.9905923347818102
中信做空很坚决。走人,5798,2016-09-30,0.9511281306516233
草他吗。中信的人抓的还是少，再抓一些人进去就,5196,2016-09-29,0.7556069497534804
视察中信领军跳水，倍加油呵护，赞赏识鼓励支持,8159,2016-09-28,0.9999795837355931
中信不值得散户买入，垃圾股,6767,2016-09-29,0.4917558460016149
剔除四月以来IPO的成交金额，今天的成交金额恐,8501,2016-09-29,0.030368992830179353
今天进去的又要吃套了，大盘明天继续杀跌[大笑],9025,2016-09-29,0.042950685549870915
中信证券继续上涨的理由,10641,2016-09-27,0.35055379757802774
无论怎样看，都不份“该有的”,10722,2017-06-28,0.5864326393533111
上吊线,4758,2017-06-21,0.48365530667329815
死芽,4059,2016-09-29,0.5
想不到龙头变华泰了。,9035,2017-06-22,0.13575639856084032
高盛观点后入MSCi后中国股市交易制度将前进三十,11509,2017-06-01,0.9925393471094462
如何分辨各种消息（个人经验）,70364,2015-10-24,0.5244937151148967
买入上海石化(600688),125316,2016-05-21,0.3141388674957901
600030目标22元,13415,2017-06-23,0.6333888785648635
16.44了哦，可以进货了吗？大家说说看,9596,2017-06-13,0.11343387908983193
中信证券原总经理徐刚复出 “救市”风暴中曾协,169847,2017-06-17,0.9974103570918162
铁定入摩许诺下半年T十0实施.券商飞起来涨!,11098,2017-05-25,0.9653974797916929
叹为观之禁大股东减持中信证券成了袖珍股筹码太,7181,2017-05-31,0.365464414835858
海通的目标随想！,12616,2017-06-19,0.7715459660625491
香港的中信大跌，快跑,8465,2017-06-15,0.94635689913607
中信证券无论从市盈率或市净利看都处于绝对的底,9806,2017-06-20,0.8764603588496296
谁在摆弄，大家心里有数,5974,2016-09-07,0.8182313426953005
修复行情由此起！,97958,2017-05-17,0.9431682478726386
只要你是人，不管是哪个国家的人，都要面对,30674,2015-08-22,0.9703461640354842
逐步满仓买入一一一一一一一一一一一一一一一一,11316,2017-06-14,0.9516261395310353
证监市场整肃风暴 22起案件火线移交,1227331,2015-09-01,0.9859482268460588
6月14日，韩志国再度发布微博表示,8393,2017-06-15,0.19715508102894286
总算突破了[微笑][大笑][鼓掌]下周继续[胜利][,5351,2017-06-16,0.9888780519401229
下周大盘周阴信不信随你！,5608,2017-06-09,0.22530545298805427
2年前轰动一时的外资司度炒A股终曝光：中信证券,22828,2017-05-24,0.7184322021179217
本ID宣布：抛光大盘股！全力做多中小创和次新股,5031,2017-06-15,0.011965778857679243
套人模式,11195,2017-06-09,0.743126881387746
太牛了刚上市3周不到，就有13家机构蜂拥调研扎,2548,2017-05-04,0.05243856236476563
蓝筹大牛已经开启，2015年投入5000亿元救市资金,18406,2017-05-30,0.993099107830125
大盘股搞死整个市场！,3859,2017-06-01,0.11086951948317181
中信证券(600030)融资融券信息(06-09),9211,2017-06-10,0.9630896642925719
卖了就不跌了？！怎么办啦？我操？！,2134,2017-06-12,0.04091795138184118
中信证券(600030)融资融券信息(06-12),5399,2017-06-13,0.9630896642925719
600030:中信证券关于召开2016年度股东大会的第,25160,2017-05-31,0.949077358723451
资金倾巢入券商,六月入摩铁定了!大利券商国际化,10411,2017-05-26,0.9831588256586965
走了换效益好分红更高兴业银行去了,1546,2017-06-01,0.741895924483088
券商股龙头 中信等 将再次 率领大盘 走一个大级,1963,2017-06-01,0.346781863019168
中信证券：每手“13中信01”实际派发利息为人民,1722,2017-06-01,0.9941243249283924
中信证券(600030)大宗交易数据一览(06-08),31097,2017-06-08,0.6714306667166071
中信证券(600030)大宗交易数据一览(06-07),28047,2017-06-07,0.6714306667166071
美国有纽约同时中国有雄安，美国有曼哈顿同时中,4557,2017-04-28,0.9981847902349505
中信证券5月净利润同比下滑32%至5.22亿元,28410,2017-06-06,0.7578093368829703
当年日本券商入摩后大涨六倍!游资机构清仓雄安,9343,2017-05-23,0.9476023884427714
600030:中信证券2017年5月份财务数据简报,51360,2017-06-06,0.900870265900627
中信不怕罚,23548,2017-05-25,0.7687070917494024
尾盘肯定又崩盘了 !!!!!!!!!!!!!!欢呼!!!!!!!!!,77937,2016-05-17,0.09208064027444485
A股纳入MSCI概率大增——价值蓝筹股或率先受益,19614,2017-06-02,0.9916348460724533
下午拉指数，国家会用证券板块来拉,3154,2017-06-05,0.20599607525539365
杨安乐/董红波,22603,2015-09-27,0.9918281415890171
卖烧饼与股市——凤凰财经综合,4374,2017-06-04,0.9394560202265623
抛！机构连拉股价，用人性贪婪忽悠小股民在高位,8385,2015-11-24,0.96512331570731
600030:中信证券H股公告(股份发行人的证券变动,25048,2017-06-01,0.6609848850549367
我就知道一点，加息了，股票肯定跌，在我们股市,8126,2017-05-29,0.7948614787335855
中国恒大地产大涨15%连创新高 今年暴涨195% 201,3190,2017-05-29,0.9691484425877834
哈哈哈 卖楼抄底有钱任性 你们在卖 我在买  你,2646,2017-05-31,0.806662437787244
中信证券(600030)融资融券信息(05-31),6526,2017-06-01,0.9630896642925719
4月大利好背景下主力资金净流出3700亿，龙头板,3216,2017-05-05,0.9011849254613428
大盘接近前面跌停，不是高手建议空仓！,37797,2015-08-25,0.0223553664320838
因2015年的“外资做空”旧案 三券商被重罚4亿元,20964,2017-05-24,0.10381695929189627
证监会：请依法常态化监管！查处庄操纵股价的不,15372,2016-08-17,0.982370558417218
有很多人总是大胆包天，从来不怕死,2719,2017-05-31,0.38311243554158836
中信证券应该是个起点，追进还来得及不?,8695,2017-05-25,0.9250501141626897
目前成交量券商走强！,8058,2017-05-07,0.6801597548133327
