标题,帖子数,日期,情感
淘金论股早盘温馨提示：,5646,2015-11-18,0.47880036399377646
中信证券今日超大单流入排名第1名(11-18),36787,2015-11-18,0.8937183413445908
大盘调整目标3450点!空仓耐心等待买点!,2372,2015-11-13,0.3371029851041647
中信证券重组试图比肩高盛,17272,2015-11-17,0.9845867335834475
每日一精华--中国信证券！现在出手还来的急！,13006,2015-11-16,0.960893858367193
中信证券：今天追进去的报个到，看看谁的高,11054,2015-11-17,0.5905387026479849
中信杭州四季路营业部力压“兄弟”溧阳路 首次,35071,2015-11-18,0.9956992122634392
【讨论】中信证券能否成为中国版高盛？,49462,2015-11-18,0.9979279882248979
尾盘下跌似是有意为之，来看明天如何操作！,4468,2015-11-18,0.04081714998217134
又一大佬谢幕 巡视组会放过中信证券吗？,41007,2015-11-17,0.906740435925415
中信证券全资子公司被证监会撤销证券业务许可证,1005797,2015-10-20,0.8083182744820392
中信今天为什么要来一个假突破？,77945,2015-11-17,0.984245889099279
中信证券调整两融担保折算率 蓝筹股折算率提升,247560,2015-11-04,0.9340487617802841
两融余额环比大增 融资客疯抢蓝筹股,644366,2015-11-06,0.9550086025450506
下周四坚决介入，然后不离不弃，坚持两年，等印,18493,2015-10-02,0.7525263969716804
中信证券董事长王东明退休 欲打造“中国版高盛,24756,2015-11-18,0.9999940751444247
今天600030尾盘不涨停我从100层楼跳下去,4899,2015-11-18,0.07361991466197693
券商两线平行绝非偶然,10897,2015-11-17,0.8889161377478572
明日刀光剑影间的策略：周三分析,13354,2015-11-17,0.9912947285098276
周三T+0点位，最新资讯,4307,2015-11-17,0.27806657646467825
原来中信一直不涨是因为有王东明啊，是不是可以,4232,2015-11-18,0.9408742074460595
上涨旗形不存在，非常抱歉,10419,2015-11-12,0.058402327095841366
降杠杆：信用账号保证金幅度调高之另类思维,14458,2015-11-14,0.2361115952525561
紧紧抓住证券手 步步跟着券商走！,8390,2015-11-15,0.9876162366785557
【讨论】券商股集体发力，二次启动点你追不追？,33785,2015-11-17,0.4468963608922272
中信证券拟任董事长张佑君：做什么都要有游戏规,31667,2015-11-17,0.999896483748314
券商一哥王东明谢幕 巡视组会放过中信证券吗？,7965,2015-11-17,0.7551267421201118
武术冠军 投行大佬 汪潮涌妻子 李亦非对A股做了,65036,2015-09-02,0.9991230912690056
中信证券中高层会议王东明张佑君各表感言,9346,2015-11-17,0.9981776713656385
趁着这个周末之际，和你们叙叙旧，有个股问题可,6978,2015-11-14,0.5448614730265576
第五浪很快开始，坐稳了,7555,2015-11-17,0.9590345416141713
张佑君称争取用10年时间把中信证券打造称国际性,5260,2015-11-17,0.9670891612975915
王东明卸任中信证券董事长 张佑君将接任,10778,2015-11-17,0.9980665566075877
牛哥再次归来！周二分析！,8365,2015-11-16,0.6906150956320684
抄底接盘资金上午已耗尽，下午一泄千里式暴跌！,4120,2015-11-16,0.980370437456641
中信证券今日超大单流出排名第1名(11-16),16105,2015-11-16,0.6776523076109319
【讨论】提高融资保证金比例对中信股价有何影响,11616,2015-11-16,0.9940189437940323
风暴转向 监管层枪口已瞄准公募机构,22489,2015-11-16,0.9945466344137334
明天在券商股的带领下千股跌停！,5787,2015-11-16,0.15264316882129814
中信证券:下周必然走势，谁来见证！,20936,2015-11-15,0.948441070750061
证监会副主席姚刚被查 曾被称为发审皇帝,67183,2015-11-14,0.4960594351584987
一道小学数学题证明你是否适合玩股票？,20910,2015-09-16,0.9765403572281215
锂电板块继续发酵 主力连续两周扫货,67941,2015-11-14,0.9458901921307711
下周或继续上演二八行情,6194,2015-11-13,0.9704472370193904
监管层再降杠杆：融资保证金提至100% 这些“三,9685,2015-11-13,0.753868797488649
下周将迎上涨周期,5208,2015-11-14,0.08903042233122926
必看：调整融资担保为100%的利好分析,15454,2015-11-13,0.9619097268248826
中信证券今日超大单流入排名第5名(11-13),10689,2015-11-13,0.9363098010199649
券商“打虎”:中信证券掀冰山一角,47480,2015-11-06,0.9111435746500768
“牛”儿已到眼前了 能否骑上看胆了！,13667,2015-11-09,0.991563929141306
下周大盘了，融资盘开跑！,6012,2015-11-13,0.6402843972696669
我的融资保证金比例从来都是低于100%的,6211,2015-11-13,0.20172031737473461
今天大盘何去何从之论证,16312,2015-11-09,0.7697696329529458
有谁拿100万可以融资200万？是什么时候？是哪家,4473,2015-11-13,0.9194838342704389
啦啦。分享时贴，回顾一下和大家做个小结聊聊吧,4381,2015-11-11,0.9545412431829818
几天前对中信的预测全应验了，预测未来几天中信,10276,2015-11-07,0.9988491873899628
中信证券最高层一半人员被查 传审计署已入驻,245274,2015-09-18,0.41895262890215335
“内鬼”除了中信 还有国信？,33556,2015-10-25,0.9308866502426427
两融余额重上1.1万亿  多券商下调警戒线平仓线,36362,2015-11-12,0.3527206115873037
上午的走势和我们的预期依然一致,3813,2015-11-13,0.6986335561190122
告诉你这是大涨的前夕，大涨最快明天开启,48131,2015-11-12,0.7098485208805088
中信证券今日超大单流出排名第7名(11-12),8053,2015-11-12,0.7810951051814876
【讨论】散户没人买单，所以中信不会下跌？,11084,2015-11-12,0.8501280538573589
“大本营”遭震慑 游资江湖格局生变,10688,2015-11-13,0.8876236441134111
今天券商板块怕是有可能下午要跳水！,10897,2015-11-12,0.3110836116024591
两融大幅回潮：单日净买入创历史新高 四大变化,35070,2015-11-11,0.9827720981782807
尾盘跳水,然后明天大幅低开低走,成功套牢所有人,4086,2015-11-12,0.19636481288720165
中信证券(600030)融资融券信息(11-11),8028,2015-11-12,0.9630896642925719
20.21 不破，继续持有你的股票,3532,2015-11-12,0.6459326369557157
专业炒作中信证券。今天没板，继续加仓,4665,2015-11-09,0.0782092483240715
实盘图15.30的成本，10300股。,13206,2015-09-29,0.18903665517899437
【讨论】强势上攻后回踩5天均线是否为介入良机,18405,2015-11-11,0.6470459613098849
两市日融资净买入额达331亿 创历史新高,5595,2015-11-11,0.9939460222712339
来分析中信证券,券商板块是最近的主线蓝筹板块,3725,2015-11-12,0.9775275628296369
中信证券(600030)融资融券信息(11-10),13851,2015-11-11,0.9630896642925719
证监会拟对并购重组全流程优化 11·9成审核分界,6938,2015-11-11,0.08953368713590071
中信证券 操作要点（个股解析）,27816,2015-11-10,0.9903812065356769
周四看盘！,4805,2015-11-11,0.606821014169666
这次ipo实质影响不大。,9523,2015-11-06,0.16257153174332972
20.18 我又回来了,4883,2015-11-11,0.43729549222775765
中信证券：大盘跌得好！从今起A股将疯狂“掉钱,40569,2015-11-10,0.2793855712665614
今天不收红 我就跳黄浦江,5652,2015-11-11,0.308782671522862
中信证券今日超大单流出排名第2名(11-10),14994,2015-11-10,0.6812642321306526
劵商股！不要以为是金条，涨高了，一样的股纸，,4927,2015-11-10,0.12882003863582436
四连阳后蓝筹小盘争鸣：券商股又起来了 谁在买,176031,2015-11-10,0.9285700838080827
本周让空头躲进狗窦哭！,4784,2015-09-08,0.4131647146841738
大盘彻底企稳，上攻初期目标3700！,7543,2015-09-07,0.9766891457429117
股海随笔---你有消息吗？,8002,2015-11-07,0.7093366089628095
证金系799股大起底：八成公司盈利 整体股价跑赢,15597,2015-11-10,0.6064673728329115
券商股再掀涨停热浪,9218,2015-11-10,0.16723272974226455
徐翔ST长油狙击战交集中信证券,33552,2015-11-07,0.24221732430829823
【讨论】昨日融资客大举扫货，主力会轻易让他们,20179,2015-11-10,0.9824358260024961
11.10大盘走向 （敬爱的管理，谢谢）,2948,2015-11-09,0.9546171599527743
中信证券今日超大单流出排名第1名(11-09),56396,2015-11-09,0.6776523076109319
中信证券(600030)融资融券信息(11-09),10603,2015-11-10,0.9630896642925719
草根老师本来不想说，看在都是过来人份上，给看,7080,2015-11-09,0.8188325205564604
中信反转指日可待！,64962,2015-09-21,0.848551425214066
明天收盘如果不超过21元我就割鸡鸡,5514,2015-11-09,0.10790878506107948
分析师高喊牛市2.0版来了 股民担心又是一个坑,8916,2015-11-08,0.6852491664961231
【讨论】IPO重启后你看好中信的中期走势吗？,22377,2015-11-09,0.7466164189612056
股价会朝多数人不利的方向移动，现在看多的剧增,4873,2015-11-07,0.937761637303372
19.18 不破，继续持有你的股票,4625,2015-11-09,0.6459326369557157
重启IPO，明日关键点位策略！,5069,2015-11-08,0.6819327497864396
IPO重启！11.09关键点位！,8824,2015-11-09,0.10640153738500158
那些想买的，赶紧买呀。我不阻拦你们。,2691,2015-11-09,0.155949673332211
哎，今天追高被套了；21.5追的,3330,2015-11-09,0.23742756602635773
20的成本，出还是不出啊。,6918,2015-11-09,0.20895713238594327
赶上牛市了，,3604,2015-11-09,0.845708452480363
谁走漏了重启新股的消息？,26005,2015-11-07,0.016179710536501135
18.50==》22.00,7025,2015-11-06,0.5
中信证券最终的结局猜测,4854,2015-10-30,0.9987906878886657
中信证券！近期看法！！,44072,2015-11-08,0.8478131515608645
主力紧盯锂电池板块 亿元级巨单频频闪亮,35708,2015-11-07,0.0930189233057076
为什么中信被低估: 1.社保18元后入一百多亿港股,11985,2015-11-01,0.7092990624754376
中国股市周一将会出现断崖式暴跌,13010,2015-11-07,0.9724652599030847
！！33的时候我看空！！,11303,2015-09-11,0.2652727659822188
瞎折腾什么呀！中信就是卖壳也值３０元。,28077,2015-09-23,0.2698066061540214
IPO重启！牛抬头！,3734,2015-11-07,0.07466573448679326
王牌分析师：中信证券目标价80元不算高！,10733,2015-11-06,0.984358328807416
牛牛来了 中海网络科技，未来两百元牛股！大上,6773,2015-10-28,0.9537528248273258
中信证券 这两天是最关键的点位（论股）,66736,2015-11-04,0.9441849992244367
分析师高喊牛市2.0来了 股民担心又被割,11566,2015-11-06,0.9365400100654173
是谁提前泄露了IPO重启消息，让券商股票连续暴,9330,2015-11-06,0.05666746441039938
这是一场博弈，结果就看这个,7544,2015-11-06,0.9019604946760732
严查内幕交易!,39216,2015-11-06,0.6142170694677968
周末影响市场重要资讯回顾：十八届五中全会明召,18532,2015-10-25,0.9964439414645536
中信证券今日超大单流入排名第1名(11-06),39529,2015-11-06,0.8937183413445908
沪指涨1.91%剑指3600点 资金抢筹102股,23320,2015-11-06,0.9176929452104352
券商三涨停，这是最大的内幕交易，为何没人管？,9428,2015-11-06,0.16660944277158685
韭菜又到了收割季节，大家别当韭菜了。看完想想,4111,2015-11-06,0.38020380343102667
“牛市2.0说”浮现 股民担心又被割,7420,2015-11-06,0.9869477141261952
大德投资：成交量来了10。19号券商股接班题材股,42459,2015-10-18,0.22431073838923532
深港通乌龙引发大涨 你跟不跟,23335,2015-11-04,0.9199519966467437
个人看法，中信证劵！！,47320,2015-11-04,0.33733813498916243
中信证券10月净利13亿 环比增长95%,17363,2015-11-05,0.9886099166248897
我很认真的告诉你们，我能预知未来，中信未来2,50737,2015-08-29,0.9889686966039756
券商成A股攻上3500主力 10月业绩完美亮相,53111,2015-11-05,0.8671767667370834
中信证券10月净利12.98亿环比增95%,35329,2015-11-05,0.9824361074252798
大五浪杀跌开始!破三千洒洒水!最幸福的事莫过于,4094,2015-11-03,0.9483531777599311
我看好中信。股价三年中总会到28-32元。,11520,2015-09-27,0.9355986546216923
今天上午又加仓了。我现在只吃不拉。三年,11515,2015-09-14,0.16391517036790548
中信证券率先调高“两融”担保品折算率,11620,2015-11-05,0.8318792988335875
我彻底被洗出去啦,26091,2015-11-05,0.22361809045226133
600030:中信证券2015年10月份财务数据简报,35752,2015-11-05,0.8534415063129482
中信证券 个人操作和建议,24437,2015-11-05,0.7007728044807671
【讨论】券商股王者归来，能否复制去年底的走势,19816,2015-11-05,0.9314969697735638
！！每次调整都是进场机会！！,40208,2015-10-16,0.47917211590935727
三季度券商自营重仓472股 11只个股市值损失超3,24127,2015-11-04,0.007613590842953211
中信证券(600030)融资融券信息(11-04),11000,2015-11-05,0.9630896642925719
中信证券调整两融担保折算率,9928,2015-11-05,0.7146470170538242
中信证券今日超大单流入排名第2名(11-04),16679,2015-11-04,0.895283352165482
【讨论】中信证券头肩底形态成立，市值超越养鸡,47074,2015-11-04,0.9980225283292466
逆跌势而涨起来，中信证券明天开始涨起来，我请,5172,2015-11-03,0.7004161006710599
监管趋严券商Q3净利跌七成 中信负面缠身业绩未,5355,2015-11-04,0.980177194007131
16.91  终于说再见了,5994,2015-11-04,0.5937544858657643
一片欢呼，怎么忘了养老金还没有入市,5082,2015-11-04,0.43840386199082915
600030:中信证券关于吸收合并中信证券(浙江)有,30867,2015-11-03,0.9825720096068925
让中信坑了的战友跟我来，扳回损失。,37721,2015-10-31,0.5519365882949178
本股神预测，2点半绝对跳水，只能保持3成底仓！,3314,2015-11-04,0.11770154672146094
三季报点评：Q3业绩同比大幅增长，仍需关注高管,24471,2015-11-03,0.9127755501196749
中信（林妺妹也），你身家靓丽，但衬托不起你华,13817,2015-08-28,0.9985310253436479
基金三季度股票配置普降10% 券商股遭到抛售,17035,2015-10-29,0.9266005028894774
8券商三季度自营浮亏 布局医药等板块或扳回一城,8788,2015-11-04,0.9383321544500518
揭秘中信证券做空轨迹：香港子公司成独门利器,15873,2015-11-03,0.9949970659082864
【讨论】中信总市值不到2000亿，还不如一个养鸡,18022,2015-11-03,0.9549690490608288
中信证券今日超大单流出排名第19名(11-02),7046,2015-11-02,0.6889238741237488
中信证券：四高管仍在被调查,8131,2015-10-30,0.7937324785148538
【讨论】私募大佬被抓，市场能否完成二八转换？,10600,2015-11-02,0.9987885723012978
11.03盘面面临关键抉择！附关键点位！,5387,2015-11-02,0.9981520189355146
徐翔被抓，王亚伟就是下一个,7951,2015-11-02,0.4124843682498819
徐翔落马 大盘能否重演中信高管被调查后触底反,22830,2015-11-02,0.9948970057742446
伞形信托清理最后一天 45家涉伞公司股票(名单),39230,2015-10-30,0.7810653266903321
每股盈利1.4，超过了预期，不管股价如何，这个,7181,2015-10-29,0.4564840735126273
只能用龌龊俩字形容国家队,6358,2015-09-07,0.13078060268130032
明天的股市将是黑色星期一,7070,2015-11-01,0.8704900365087185
采取严刑峻法，把股指期货做空股市漏洞堵死，还,9236,2015-08-27,0.9758807551251641
中信证券风波中仍保券商龙头 证金系三季度持股,12999,2015-10-30,0.8014936001866775
你们以为上午捡到一两个点便宜，殊不知下午一跳,8217,2015-10-30,0.7610327212803067
也不知道之后该怎么办了，买了中信,6749,2015-10-31,0.6154349668744044
券商股获证金系青睐 证金系入驻22家券商,12815,2015-10-31,0.1349952296372391
无知!一个大利空你们居然当成大利好？,8913,2015-10-29,0.3205058601516977
中信证券今日超大单流入排名第1名(10-30),31019,2015-10-30,0.8937183413445908
高管多米诺式遭查  中信证券20岁生日险奏安魂弥,9756,2015-10-30,0.9988559814486673
《中信牵头中国资本报价35亿欧元收购曼联》,18723,2015-10-30,0.9994998389312657
中信证券前三季度净利159.86亿 同比增151.16%,8417,2015-10-30,0.9820380696698592
中信证券又出事了？真相其实是这样的,72542,2015-10-20,0.9612564830465216
中信证券前三季利升1.5倍 证金持股超10%,35509,2015-10-29,0.4674079057891599
券商资管业务规模排名 中信证券居首,18099,2015-10-28,0.8334348823635365
中信证券三季报净利近160亿 证金系持股12%,70354,2015-10-29,0.2539167512066167
【讨论】中信证券的三季报能否超出市场预期？  ,12078,2015-10-29,0.9633624415969151
下周一关注000818。能涨成妖股吗？,4450,2015-10-24,0.9445623603443607
600030:中信证券2015年第三季度季报,179309,2015-10-29,0.9356204489318878
养老金入市明年启动 25机构或有资格竞标管理人,5974,2015-10-29,0.5203878632908089
【讨论】市场出现什么样的利好才能让券商板块整,20843,2015-10-27,0.83523167939689
中信证券董事长二遇谣言！这代券商老总正重复上,32770,2015-10-24,0.9594621397775934
两点半之后高台跳水!威力将远超上午!,3439,2015-10-27,0.8039133875058235
君子问凶不问吉，高手看盘先看跌。,3164,2015-10-28,0.011861601672231159
下午又能见到千股跌停的壮观场面！空仓就是赚钱,3350,2015-10-28,0.8265252463183665
600030:中信证券2015年短期公司债券(第一期)发,32679,2015-10-27,0.8897569965798445
大公国际将中信证券纳入观察名单,29198,2015-09-23,0.9172101080740515
标普将中信证券置于负面观察名单,15712,2015-09-19,0.9897595456091876
国信证券总裁自缢身亡 留遗书：请勿扰妻儿！,10178,2015-10-24,0.8804087293313834
下周重点关注4只股票：重点关注4只股票：,4515,2015-10-25,0.9791345868362621
方星海曾与肖钢同坐 称股市问题根源在于制度障,31980,2015-10-22,0.9999945534334059
中信不好做，散户多,4527,2015-10-20,0.8899206045943386
一图理清中信证券事件复杂人脉网：或为同门或为,16430,2015-10-27,0.9187723531788309
中国信达减持中信证券H股 从10.36%减至5.94%,42544,2015-09-25,0.720250937348753
中信浙江疯狂十年：曾引入中国第一游资 后被美,23214,2015-10-27,0.9997909586364349
【讨论】高开低走的中信是主力洗盘还是主力出货,22373,2015-10-26,0.9580857368135852
真人，15，24 抄底的机会来了,3909,2015-10-27,0.9038969550918883
不和你恋爱了走了,3186,2015-10-26,0.8116083720740345
今天还是满仓，不过股全部换了，今天又有近2%的,5293,2015-10-26,0.014422639823932992
我的成本16.20大家都是多少？,4033,2015-10-24,0.4191962051789814
中信证券又有三位高管被调查,39156,2015-09-16,0.805533462357663
中信证券总经理落马 核心决策层半数被查,31876,2015-09-16,0.9808210591353266
周末影响市场重要资讯汇总,22440,2015-10-26,0.3210795684376315
中信证券今日超大单流出排名第7名(10-26),7424,2015-10-26,0.7810951051814876
中信证券事件再升级：总经理程博明被查,29086,2015-09-16,0.49833862110146454
中信证券再次被列入观察名单,22339,2015-09-25,0.8257898088866777
中信证券子公司业务许可被撤为哪般,11512,2015-10-20,0.7900644932741245
收购罗素失败 中信证券海外资管业务断臂,17162,2015-10-12,0.9933984690092896
15.70 不破，继续持有你的股票,5124,2015-10-26,0.6459326369557157
王东明  千古罪人  必遭横祸,8827,2015-08-25,0.8120609217542847
强烈建议中纪委、国家安全委员会调查五大券商全,7739,2015-08-23,0.3864204895392406
券商板块跌幅靠前 中信证券领跌,10493,2015-10-20,0.6805127013624414
证监会主席助理张育军被免 被调查或缘于救市,20574,2015-10-14,0.030900536140528012
中信证券违规交易疑团,117742,2015-09-21,0.6437070967154495
中信金石总经理祁曙光被带走,38194,2015-10-23,0.8598931716814298
明天要离婚了！,4058,2015-10-26,0.8930932209786054
涉嫌内幕交易 中信证券总经理程博明被调查,17859,2015-09-16,0.4917942459688438
“双降”后周一又该如何操作？,3761,2015-10-26,0.2728829137296692
中信证券20周年“内部信”背后：成长的豪迈与烦,11389,2015-10-26,0.9994298482200475
中信证券子公司被撤销 “虚惊一场”,10242,2015-10-26,0.9904728361121311
求下联：中信国信有信无信,8083,2015-10-24,0.9097142454669894
网传中信证券董事长坠楼 回应：假的,79096,2015-10-24,0.9589276196916275
中信证券董事长王东明内部信曝光,53056,2015-10-24,0.9938942207429908
雅戈尔斥17.3亿元购中信股份1.5亿股,115032,2015-10-20,0.9217957104673136
中信“四大金刚”继续扫货 涉及15只个股,50587,2015-09-16,0.9879742087312093
主流资金调查：公募私募加仓博反弹 超级大户多,7155,2015-10-22,0.9997265273166949
中信已经启动了，春节前后看到28-32元。,13725,2015-10-12,0.5701949839837749
一群呆子.马上中信证券到50元,19378,2015-09-12,0.716538177574213
中信证券明日是涨停的节奏啊！,6613,2015-09-23,0.9838552731586697
有人陪我一起拿中信80元以上在走的吗？,18189,2015-09-03,0.8681978760928782
明日起，以中信证券为首的卷商军团将联合银行军,178838,2015-08-25,0.9114433166607535
中信证券，都快满仓！万分感谢，我已经满仓了，,6094,2015-09-23,0.7959268475110584
中信明天开始连续涨停，不信吧！看结果,25733,2015-09-09,0.762481449647128
未来7年内，中信将突破118元！,15607,2015-09-14,0.9948628285771651
散户要珍惜手中带血的筹码,7901,2015-09-21,0.9986845625187047
中信证券周一上涨 理由如下,4558,2015-10-25,0.13940439652921255
中信国信总裁无信一死一囚。求下联,4140,2015-10-24,0.9023427977189568
中信牵手ABP伦敦首秀 17亿英镑“亚洲商务港”明,14639,2015-10-24,0.9995854412123428
某会负责人多日不见后出现在苏州,3137,2015-10-24,0.05839228388758444
将军：量价关系的具体应用方法,5531,2015-10-23,0.9383371488268953
钟小板：妖股不死，行情不止！（论股）,23848,2015-10-22,0.31243626508164746
子公司被撤销业务许可 中信证券：吸收合并,8654,2015-10-22,0.979557729679246
龙骧将军：剧烈调整会持续多久 企稳在何时,14959,2015-10-21,0.8786206042114794
完了,5339,2015-10-21,0.6633532140490392
当下行情，只有够胆的人才可以玩！,5953,2015-10-20,0.9748879065310432
目标 60日线 17.80,7560,2015-10-16,0.280478350600023
***明天肯定大幅高开大涨因为我买到了,10073,2015-10-17,0.011411988729915334
煮酒：剧烈调整会持续多久 企稳在何时（晚评+明,3098,2015-10-21,0.17809711137407902
中信证券公告澄清 子公司被撤销系误读,18003,2015-10-21,0.9709419306628185
中信证券获准吸收合并全资子公司,9291,2015-10-21,0.8482846087791391
明天中信最起码高开，最高可涨停,6578,2015-10-20,0.763683477075441
【讨论】15.8左右的中信证券还值得买入吗？  ,19334,2015-10-20,0.9940610253233247
券商台面下的“潜规则”：中信证券那几个哥们到,93058,2015-10-06,0.9957673406387259
600030:中信证券关于吸收合并及注销中信证券(浙,19993,2015-10-20,0.9596657014667094
中信证券子公司被证监会撤销证券业务许可,12278,2015-10-20,0.9696468382872802
股海随笔---投资箴言,4821,2015-10-17,0.9894785108064568
中信证券(浙江)公司解散 已被撤销证券业务许可,12413,2015-10-20,0.9945758229597668
明日大盘仍具备有上冲动力,5082,2015-10-19,0.9810239098765763
高管被查 “中国高盛”梦碎,16857,2015-10-19,0.9721304542614501
600030:中信证券H股公告(董事会会议通知),98320,2015-10-19,0.1617415719882207
股海随笔---在孤独中勇敢前行,7246,2015-10-14,0.999639010019247
沪指大涨难掩资金隐忧 机构买的没有卖的多,6235,2015-10-19,0.933218331506837
中信证券再现14年12月上旬的态势---不感意外!,19715,2015-10-16,0.8595584160124594
做样子行情，今天节前最后一个交易日,7801,2015-09-30,0.9743354342852054
！！A股不是随便一个人就可以赚钱的！！,5740,2015-10-16,0.05836779115349533
本周累计九板，下周将更完美（关键位）,11000,2015-10-16,0.8002337949722103
~~~发财了,9138,2015-10-17,0.590244462793028
市场下跌护盘资金出手 中信“四大金刚”近日继,187619,2015-09-15,0.999964811903546
若晴天和日，就静赏闲云。若雨落敲窗，就且听风,51087,2015-09-05,0.13606046092637025
中信证券今日超大单流出排名第8名(10-16),7170,2015-10-16,0.78243567702608
券商再配置逻辑: 高成长、低估值、高弹性,16725,2015-10-16,0.9995496219722421
晚间影响市场的重要政策消息速递(9/24),11220,2015-09-24,0.6471438665927038
不要幻想抄底！下午还有百点重挫！五浪下跌开胃,4449,2015-10-16,0.9671061215373307
身陷“内幕交易”旋涡中心的中信证券,23670,2015-10-12,0.8836969293959378
【讨论】中信证券正在渐渐失去他的龙头地位？  ,10323,2015-10-15,0.9865524955142279
晒晒九月份业绩,27194,2015-10-08,0.8294457583903977
中信证券（600030）周五涨停的几率非常高！,6193,2015-10-15,0.9123280817344103
腾笼换鸟、凤凰涅槃上证大盘2900点左右将重新回,7153,2015-08-25,0.15660101831814777
中信证券今日超大单流入排名第10名(10-15),7064,2015-10-15,0.9040308134956021
两个2货：嘉珉好好和迪苖，一个喊抢筹，一个喊,4131,2015-10-15,0.21524401880368715
