标题,帖子数,日期,情感
中石化油气管网混合经营破冰 抛川气东送管道半,8153,2016-08-04,0.13138194690780225
明天不会涨停吧？,9005,2016-08-02,0.2536751037005791
上海国企再发力 壳资源身价飙升 丰华股份时机成,18686,2016-08-01,0.09394644947139852
养老金来了,6504,2016-08-03,0.5
万科启示：给梯子、再抽梯子,6331,2016-07-31,0.7535559409362518
600028:中国石化第六届董事会第七次会议决议公,25875,2016-08-02,0.037127162029353844
中国石化：川气东送管道业务拟公开引资,15215,2016-08-02,0.04261156409380851
5元以下的中石化，大胆买入吧！持股两个月就可,52547,2016-07-05,0.21054491363671413
股市鸡肋行情会持到什么时候？,3597,2016-08-02,0.9458397637656397
中国石化(600028)融资融券信息(08-01),4800,2016-08-02,0.7210047151351948
下周不上五元，我撤退！,7223,2016-07-29,0.1833935788800587
欢乐猫，咱们不送了！,5290,2016-08-01,0.31991406929267907
好久没买过这么稳的股票了,9042,2016-07-29,0.8094220941474433
劳资发不出贴图，不和渣渣理论不和瓜瓜耍咯，真,4182,2016-07-24,0.010409833196471707
品咖啡，看暴跌，爽歪歪,5549,2016-07-29,0.8935272937897488
600028:中国石化关于控股股东增持公司股份计划,41285,2016-07-07,0.20810004588079523
好多股民都在等着低吸中石化，祝他们都能低吸成,3292,2016-07-29,0.6670346426251769
大敌当前,10020,2016-07-21,0.5
既然跌不下去，那就来根中长阳吧,14793,2016-07-20,0.18570897574171463
注意：一定要小心3会联手发动的股灾。  理财资,5900,2016-07-27,0.30837065654157325
中国石化(600028)大宗交易数据一览(07-14),21728,2016-07-14,0.16832554308462
大家好，我是老鞍。,12196,2016-06-25,0.6500144333332528
大家好，我是老鞍。,30619,2016-07-01,0.6500144333332528
指数没有跌多少，那是因为权重股护盘拉抬，权重,13396,2016-06-30,0.004684398316187721
茅坑股真够臭的,3648,2016-07-25,0.015450618674686667
年收入超高供给侧水泥板块将轮动为市场热点,41200,2016-03-18,0.9595835213822091
我有个问题搞不懂，真是百思不得其姐,6690,2016-07-19,0.14333394938333233
中国石化比600802贵200倍还做着坐等拉升的白日,63220,2015-12-29,0.07014547769289103
中国石化易跌难拉600802仅其不足1分可翻166倍到,49332,2015-12-22,0.014487570546172224
5元附近石化为091011三年箱底又是121314三年箱,39018,2015-12-02,0.09730597165033994
解密中国石化易跌难拉600802相对来说仅仅只有2.,41701,2015-12-17,0.14284857702381215
压得越厉害，只会损失更多廉价筹码,7908,2016-07-21,0.10692503798144493
600028:中国石化2016年上半年生产经营业绩提示,43816,2016-07-20,0.5901191432134064
迅猛布局黑科技产业链仅此一家 恐成未来巨头,62226,2016-04-26,0.7925166665931421
全线给套了。请叫我套王。直接上图还能解套吗？,56227,2016-03-15,0.8195061077942762
看图吧。你天天涨。你还有点良心的话就给我解套,42548,2016-04-08,0.9627421879653737
看图。世界上最崔悲的事情发生了。最高点买入。,41014,2016-04-06,0.9999061125814666
强烈建议吧里设置私信或悄悄话，猫就能和喜欢的,4271,2016-07-19,0.950205488433989
发现一个超级好帖，猫就是这样一步一步走过来咯,3873,2016-07-19,0.9793563441800979
大家来回答2个问题,6177,2016-07-19,0.13893724466080404
亏大咯，小魔怪，劳资给你糖吃好不好咯，真特么,2973,2016-07-19,0.26047817836994946
洒局-……[微笑],3692,2016-07-18,0.6075213037399276
中长阳还是中长阴？,4431,2016-07-18,0.7221006429403174
来，51兄弟、小猫兄弟，酒来了！相逢握手泯恩仇,5092,2016-07-18,0.5067369447003528
丫挺的老女人，说几句北京土族话让大伙见识咯，,4380,2016-07-16,0.5580118327161564
俺的院子还算幽静，不远处，几声犬吠断断续续…,5277,2016-07-15,0.9979019355761823
西湖 清风，这只不过是个工具，别太在意！,3278,2016-07-15,0.9685363147461157
今天第3个，深度解析老女人liwei51伤心病狂喷猫,6291,2016-07-17,0.8997789802041931
也谈谈庄托,2103,2016-07-18,0.5511851441960692
10家央企陷审计风暴 中海油盲目花142亿并购外企,27153,2016-07-01,0.4499057532839782
中国石化(600028)大宗交易数据一览(05-24),19747,2016-05-24,0.16832554308462
好久没持有中石化了,9183,2016-07-14,0.08201651930594811
600028:中国石化关于章建华先生辞职的公告,28650,2016-07-13,0.2622707187786857
西湖摊上大事咯，你和机器猫一起要被抓咯，哈哈,3113,2016-07-16,0.9280943025543574
杂不见老女人咯，买黄瓜去咯，哈哈哈哈哈哈哈,3745,2016-07-15,0.15778941547446457
机器帽在这个吧里喜欢的人多去咯，你们杂辣么大,7438,2016-07-13,0.6109875009213908
完鸟完鸟，是不是要坑爹的节奏咯，刚才瞬间474,4830,2016-07-14,0.5177426178301676
为什么会有庄托？,8276,2016-07-13,0.35861345388839394
人在做，天在看。,4454,2016-07-13,0.57228677844791
猫猫你好无聊，在这只超级大盘股在耗时间！,6979,2016-07-12,0.1965603733849608
机器猫又被女妖缠身踏不准节奏咯，真特么想不通,2477,2016-07-12,0.9534384588329939
MD,一个个猴精猴精的,2751,2016-07-12,0.5
小魔怪耍死辣些来骂劳资的渣渣才好咯，太高兴咯,2545,2016-07-11,0.03763876461650184
这会是什么样子的小牛市行情？放一根中阳或者大,32522,2016-07-05,0.9570540226892927
要把自以为是的狗汉奸洗出石化……,3243,2016-07-11,0.0019983113978939704
收集利好的快递小哥难道辞职不干了？,2831,2016-07-11,0.0007618195343603862
中国石化：控股股东累计完成增持7200万股 约占,28617,2016-07-07,0.06305884321840072
郎个郎个郎个郎，小老鼠们不要方，下蹲是为更好,3795,2016-07-08,0.9616070392485977
昨天4.81没卖，今天亏大了,3952,2016-07-08,0.2475711860259886
水务跑路咯，机器猫空仓不亏钱咯，大牛来咯小老,5037,2016-07-07,0.07862207858071224
增持完毕，意思就是增持期满，可以减持了，71%,7156,2016-07-07,0.3837066986528256
最近一直忙着其他事情，就没有精力盘中发帖，现,13827,2016-07-07,0.24169858110794662
那么多人买万科？ 博傻啊！,8141,2016-07-06,0.4874472694769949
看别人帖帖耍股票都是金牌猪脑壳咯，再来骂机器,2929,2016-07-06,0.31195404735127885
今天没力气骂了,3521,2016-07-06,0.03364652557212289
关注 又一重大政策呼之欲出 这个上市公司将乌鸡,30207,2016-07-05,0.9677487859320347
中国石化(600028)融资融券信息(07-05),4910,2016-07-06,0.7210047151351948
大V天津股侠：加仓猛干的机会!目标3500点。机器,3335,2016-07-05,0.6212095546646427
骗子们怎样在股市赚钱的,8662,2016-07-01,0.429638225689701
完鸟完鸟，小魔怪480出不去咯，莫非要被割韭菜,2210,2016-07-06,0.0019611141988096215
技术的小船说翻就翻,5268,2016-07-05,0.3959267543749805
转帖帖，小老鼠们对号入座咯，机器猫机会多多咯,3965,2016-07-03,0.8761838148236256
完鸟完鸟机器猫踏空咯，小魔怪要翻番咯，小老鼠,4277,2016-07-04,0.06601044665193889
牛市来了还是又一次诱多来了？市场主力利用万科,10018,2016-07-04,0.9953414292139571
趋势昨天突破了，虽然这个突破是劵商强拉指数，,14792,2016-06-29,0.6157514599602064
Who can share  my  feelings,6070,2016-06-29,0.44767845850986676
有些朋友是按照计划抄底了，可是不执行纪律，不,10488,2016-06-30,0.17283126786859515
今天大盘还是戴绿帽帽咯，因为女妖怪一出来必然,3389,2016-06-30,0.9062838803465185
老鞍，记得吃药,5267,2016-06-30,0.9056919719961195
一定要珍惜明天可能出现的调整机会，这个调整大,17585,2016-06-29,0.8564078007071543
中石油国企改革取得重大进展 油改概念股率先受,49215,2016-06-29,0.7275933593599051
上午大盘完全按照预判高开高走无限接近我说的29,10558,2016-06-29,0.9764185455852364
今天低开低走是健康的，高开高走才是罪恶，我们,16618,2016-06-28,0.1881907398830419
我不能确定后天还能不能继续涨，我能够确定的是,19350,2016-06-28,0.12160654678022087
如果下午大盘站稳2875点，那么明天以及后天上午,13955,2016-06-27,0.08171526249203698
中石化回应“超级汽油可省油30%”：不符合实际,22628,2016-06-25,0.23514712463639365
超级汽油可省油30%？中石化称与实际不符,24740,2016-06-26,0.037735867070539775
下周大盘行情预判以及操作基本原则，反复摔打散,14240,2016-06-26,0.9659533522324408
大盘在这个地方可上可下，红盘涨2个点以上的，,6685,2016-06-27,0.3681258398082289
正常发帖都发不出去了，堵的要命。,11582,2016-06-26,0.006688667705215479
。中石化内部人士曝“超级汽油”研发成功：省油,6865,2016-06-25,0.09053705713939597
600028:中国石化2015年度末期A股分红派息实施公,98102,2016-06-17,0.8173107332803793
目标价13元一直未变，放心持股！,34049,2016-03-31,0.7538908828029058
地板价给业绩兜底，未来大利有待市场化,61058,2016-01-14,0.9085769138397808
只能等分红了,11613,2016-06-21,0.24735590214928505
深度报告：业绩拐点即至，正迈步从头越,23238,2015-11-30,0.9796513128983799
年报点评：炼油化工业务强力好转,39733,2016-04-01,0.15417207442749448
石化油服获注中石化240亿元石油工程资产,38981,2016-06-17,0.0034176620780208555
利空！保监会叫停1年期理财型保险产品 1-3年产,8672,2016-03-21,0.4674500481431162
欢迎索罗斯做空,8902,2016-06-14,0.8330774839346402
石化。直接上图。关灯流泪吃着面。什么都不说了,39743,2016-03-31,0.26021547161785064
耐力和运气的对比，股市如棋局局新，如何！,18251,2016-02-29,0.9915010998115659
中国石化：目前已建成一些试点充电站,23741,2016-06-02,0.37312011794958255
中国石化：重振“雄”风，快快上车！,19901,2016-06-01,0.6137061459647264
咋晚做了个梦，梦见小姨子睡上铺，我睡下铺。这,22491,2016-06-09,0.01275758945528016
今天还可能是次新股的行情,5035,2016-06-08,0.8987184499279389
与诸位共勉，死守 中国石化 ，永远坚持价值投资,52687,2016-01-15,0.8950863269062044
这么大的盘子，会有托？你们该吃药了！,11100,2016-02-04,0.06562880504009372
2016年，上证1480见,11647,2015-12-05,0.3343612940629669
16Q2预判化工板块盈利放缓，开采大幅减亏,41709,2016-06-02,0.06080560495962384
今天晚餐白开水烫大白菜算了,160382,2015-08-21,0.43459749587463015
等待六十日线附近的机会,9964,2016-05-05,0.7052798193773987
季报点评：炼化业务盈利改善带动1Q16 业绩同比,16541,2016-04-29,0.36999953782967787
中国石化“十三五”末拟在渝建成页岩气年产能15,7912,2016-05-23,0.38372024051147546
中国石化维持目标价为7.32元和“强烈推荐”评级,154754,2016-01-01,0.7195174084678972
中石化一季度净利润同比增长超200%,13949,2016-04-29,0.7925341559313713
2850点压力能否突破,14370,2016-03-04,0.9693809138645083
不亚于降杠杆清配资的利空！保监会召开险资风险,9602,2015-12-29,0.6039089719221246
大盘2200点，不是那个庄，那个机构可以做到的。,10726,2016-02-17,0.6485539521982304
别买入！耐心等待融资盘被强平爆仓时抄底不迟28,17917,2016-01-14,0.14640895462528092
管理层放大招，捉妖股！依法治市、严惩操纵 净,4667,2015-10-29,0.06609823593873188
戴厚良任中国石油化工集团公司总经理,13597,2016-05-09,0.03589243930231589
中央任命戴厚良为中石化总经理,13231,2016-05-09,0.009842891167767265
老天爷还是公平的,12187,2016-04-12,0.32980960785659164
原来是资金都去炒商品期货了,33516,2016-04-22,0.8027221672286283
再次测试，请勿惊慌！,9171,2016-05-04,0.38266065203365596
两市开盘后沪强深弱 沪指涨0.35%,69994,2016-03-16,0.5688999634880879
中国石化今日超大单流出排名第2名(05-03),13063,2016-05-03,0.17470871176475622
开个贴挑战子子,20077,2016-02-26,0.7183396903234449
600028:中国石化2016年第一季度报告,30402,2016-04-28,0.6823549410568714
中国石化是中国现在最有价值投资标的的股票,24480,2015-12-27,0.9274278708671844
央企电商势力崛起 中石化易派客登场,15884,2016-04-24,0.19392578542465932
销售公司董事会多元化，等待惊喜,39439,2015-12-30,0.6957921046914068
年报点评：2015年炼化业务盈利大增，为2000年以,30624,2016-03-30,0.3642974677208688
心会跟爱一起走·石投就石头！,9693,2016-02-12,0.9211958748637228
1792家上市公司获政府输血 中石化50亿元成去年A,43839,2016-04-21,0.7891248868736865
一一一无法抹杀的超跌反弹动力一一一,24084,2016-01-18,0.6529052169292073
证金、汇金20亿股7元上套，养金5元之下殿后炒二,25848,2016-04-01,0.03843600614189291
兄弟们：今天重仓中石油，赌一把；石化应该也会,26382,2016-02-17,0.05188790867462978
中石化向社会开放中国最大工业品电商平台“易派,9565,2016-04-18,0.9336857055332951
石严重低估的中国股市将会合力拉出一波具特色气,22291,2016-01-24,0.9946984926911399
重磅利好：中国养老金有望很快直接进入股市投资,10880,2016-03-28,0.9982810323054702
留下长长的上影线，哪位高手分析一下这是洗盘么,10487,2016-04-11,0.9773821821096667
中国石化——独家消息！！,22287,2016-03-30,0.024426040220285272
你TMD还会干啥？？,6953,2016-04-07,0.018912064753144442
15年净利降32%，股息率较好，维持买入评级,41584,2016-03-31,0.1900691295219854
分析：还不能确认新一轮下跌就此开启,13468,2016-04-10,0.4434115055558133
中国石化为什么会大涨？,23297,2016-04-05,0.5936425882536058
标普将中国移动中石化等20家国企展望降至负面,14748,2016-04-01,0.5305242556973409
广东出牛股，关注603002，底部区域，目标价15元,3620,2016-03-31,0.41224043236749386
大盘不管怎么画还是在2327.5,7287,2016-01-26,0.6615711350731818
绝对神奇的2327.5,14485,2016-01-26,0.8675081527338349
整体上股性不活，短期看难有大的利润,7479,2016-04-05,0.6254776351426343
从黄金想到你所想不到的两桶油指向,19316,2016-03-07,0.21514822436987624
主力资金最青睐个股揭秘,27018,2016-04-01,0.9284972115018281
本人坚持价值投资，但本人全藏的银行股。来石化,10133,2016-04-04,0.1233694983615059
中国石化今日超大单流入排名第1名(04-01),12796,2016-04-01,0.4544005141668541
尼玛，上5元就卖底仓了,10083,2016-04-01,0.1322888089946218
奇葩：众小散套牢了证金汇金国家队，可能吗？,19710,2015-12-31,0.4294185333385583
炼油和化工板块双向好 未来业绩提升空间大,26626,2016-03-31,0.9870657660395921
中石化：油价到60美元方可全部盈利,12584,2016-03-31,0.07877852370438476
港股石油贵石化仅2毛，A股却贵3元，世界一奇葩,2351,2016-01-13,0.0036561408231000625
幽灵！一个黑色幽灵！一种黑科技将在东方大国兴,11551,2016-03-23,0.7356530872758026
发个星座运程与被深套的股友共勉。 以下是我的,56269,2015-08-12,0.04073295480060357
中石化年报，看这四点就够了,38107,2016-03-30,0.3203651631593214
三桶油去年日均赚2.41亿元 同比降近六成,11113,2016-03-30,0.028845976310171384
【讨论】“两桶油”在今日强势崛起的原因是？,30773,2016-03-30,0.9239461164420175
中国石化2015年净利润达433亿元 同比下降11.4%,29439,2016-03-29,0.1990087897011935
600028:中国石化2015年年报,46517,2016-03-29,0.1606267893401463
3元很快会到。,8146,2016-01-27,0.709720508695517
一想到汇金将来要套现部分中石化股份，我就激动,12558,2016-03-25,0.9511521841524377
谁干的？,12938,2016-03-24,0.7499999999999999
痞子讲股中国石化是走还是留？,32319,2016-03-21,0.6211076889738133
中国石化一条消息引发的思考,19118,2016-03-24,0.9230290259939331
坚定持有中石化,17872,2015-12-28,0.2281742111066769
大家一起骂…,6005,2016-03-24,0.11605625149478771
高手自吹不算，你能预测出今年中石化的高点吗？,14922,2016-03-18,0.21704932183415082
这是玩残小散的节奏！,15461,2016-03-18,0.7280836628056255
中石化是因为大盘股滞涨吗？,9756,2016-03-21,0.7914300764473371
君子不立危墙之下、现在空仓是最好的选择 、、,24803,2016-03-10,0.59380437635415
中石化应对低油价再发力 启动石油工程区域化重,25991,2016-03-17,0.07136380446810509
地球人已无法阻止中石化上攻了。,17233,2016-03-08,0.9126289719306916
600028:中国石化2015年生产经营业绩提示性公告,85081,2016-01-27,0.8319313261146306
熊市最低双熊股价预测：中石化2.8-3.2，上证174,8248,2016-01-27,0.9342421123012191
不要有任何幻想，每次反抽都是卖出好时机[胜利],13026,2016-01-06,0.9885110451418909
中国石化集团公司启动石油工程区域化重组,22188,2016-03-16,0.013719481865396954
中石化不是维稳那么简单,28834,2016-03-04,0.6229158872290899
把泡沫挤干净，3.5见,5772,2016-01-27,0.5115148858350606
缺德鬼主意：鼓吹利好让大家买的，十次就有十次,16949,2016-01-31,0.24344395112513317
只有有良知的人才会提示大家卖出石化。劝散户买,7167,2016-01-11,0.0842848232674176
立马割肉离场，全救金融危机再次出现！恒双创新,6886,2016-01-21,0.9995274838040759
中石化攻守皆备，迎接炼化景气周期,28962,2015-09-07,0.4687470520981809
二季度炼化业绩大幅好转,11979,2015-09-02,0.698008728964262
分享:交易员心中最经典的文章--人性的缺陷,12978,2016-02-08,0.995498995642483
关于中国石化股价与价值的思考当前买卖理论依据,85941,2016-01-16,0.9609433675766672
部分权重股尾盘冲高回落 大宗商品标的获逆市追,25804,2016-03-11,0.11507698657885468
认真专研股票，股票不是闹着玩，不懂股票的人不,23646,2015-09-30,0.9890374552836638
如果不通过，那我会把这个故事发到天涯,10691,2016-02-10,0.8088745006573446
买中国石化的友友，沉住气，细算一笔账：,29917,2016-01-21,0.10195649788974115
油气改革方案有望两会后出台 概念股值得关注,38660,2016-03-08,0.8444945000156509
最高“统帅部”命令:,12711,2016-03-04,0.4596731376905352
国鸡油价下跌正是三桶油的战略机遇,将有大行情!,23895,2016-03-04,0.9976000708529739
港股打到3.89？,17069,2016-01-20,0.4737672181921908
石化双雄涨完,就要涨三桶油了!,18812,2016-03-02,0.5593862911246107
今日实战上图,5494,2016-03-03,0.9901271399112556
蓝筹估值8倍：中石化2.3元，中石油3元。,18946,2016-02-15,0.08829976214864699
中国石化分红会是多少？竟猜,14792,2016-03-01,0.2285900214155624
1483卖出海螺，买回中石化。,8783,2016-03-01,0.04950782361952055
中国石化今日超大单流入排名第15名(03-01),13366,2016-03-01,0.5088001901992643
油气领域望迎供给侧改革春风 概念股站上风口,77177,2016-03-01,0.9988115283826994
算不算追高了，昨天加仓至100万股啦！,13402,2016-02-25,0.2408786604284876
新年里又疯了几个,7526,2016-02-14,0.07831282022635222
什么都不说上图,10237,2016-02-01,0.3393329090754259
从上海石化业绩判断，公司业绩有望超预期,63130,2016-01-28,0.6837510866632697
跟踪报告：销售公司董事会成立，混改继续推进,33843,2015-12-29,0.27105587579793144
油气改革综合试点将开启 7股或受益,131101,2016-02-24,0.9171855505042174
“十三五”规划将引领市场新热点 健康中国等五,20222,2015-10-26,0.9884413804995413
中石化回应胜利油田巨亏：暂停4个小油田可减亏2,46306,2016-02-19,0.3356194730292922
我没有证据，只是怀疑砸盘的是正规军：基金。,10587,2016-02-14,0.5127124799863482
中石化业绩下滑，估值还高，3元以下比较合理,8453,2016-01-26,0.7668751731938904
帖子目前为止是发不了了在石化吧里，只能考虑重,7494,2015-10-19,0.015719280238534417
哪位大侠有时间去奕城挑战下棋艺，哈哈,9052,2016-02-19,0.9079086021280216
最佳剧本：二八转换，放量拉升中国石化,15062,2016-01-12,0.6529246967005403
解码中石化重组：炼化工程板块赴港IPO,32336,2016-02-14,0.2828605932506929
下周中国A股的走势,18361,2016-02-13,0.4767026216205902
中国石化目前表现止跌，但反弹力度有限，暂不考,31921,2016-01-18,0.11144240438361186
这几天的中石化走势说明了什么？,52988,2016-01-20,0.21997366363513726
中石化究竟值多少钱？以几个高低点来衡量对应指,41756,2016-01-22,0.720131605701999
中国石化 让我看到你的光明！！！,12568,2016-02-18,0.3303698788678544
600028:中国石化2016年第一次临时股东大会会议,58457,2016-02-17,0.350796265570237
中石化断腕为求生 胜利油田50年来首次关停油田,90458,2016-02-17,0.2616139515518201
操呢玛的中石化，逼疯女保安，又逼疯V17470,8706,2016-02-06,0.16988379894649652
中石化胜利油田4个油田今年将整体关停！50年来,15182,2016-02-17,0.5955904693405766
操盘程序总结,5274,2016-01-18,0.65405457829069
解码中石化重组：炼化工程板块赴港IPO 油服板块,164954,2016-02-12,0.07792688760262079
上次从7元用一个月跌到4,37元，这次不会直接从5,9159,2015-12-04,0.03469643350322038
A股奇葩，庄家之友更奇葩,5494,2016-01-24,0.36068889388455316
o孑孓o：我觉得你两成左右的持仓没有错，错在给,10322,2016-02-10,0.11201361622353667
中化二把手蔡希有被调查 中央巡视组去年3月曾彻,28307,2016-02-09,0.10370858989682996
石油反转在即！大盘反转在即！,15927,2016-01-24,0.13231209021131352
中石化还有20％下行空间,13539,2016-01-29,0.13642407983176374
托，批的是羊皮。,7138,2016-02-02,0.24669907156262716
小贱给大家拜年了（不许笑）,6393,2016-02-07,0.6942145257352785
2016年供给侧改革要发威了,23813,2016-01-03,0.9279227341247456
金融危机不是几天的暴跌就能结束！葬尽浮华始见,6682,2016-01-05,0.9986881495541292
孑孓2月1日交易计划,7826,2016-02-01,0.005293392757824145
孑孓2月2日交易计划,6306,2016-02-02,0.005381435107143062
感觉要暴跌了就是一个唱空狗，哈哈,6843,2016-02-03,0.9359928903814101
放量拉升新龙头崛起，让国人分享红利，过个开心,8406,2016-02-03,0.9248848025428877
中石化这么大的盘还托个屁啊，难得有人这么客观,6010,2016-02-03,0.3504817021898857
小散户根本不知道啥叫熊市，才被跌几十个点，就,8099,2016-01-28,0.3042122910444849
股友们，你们真的被套的那么惨啊。这解套真的不,6940,2016-02-04,0.6509197142364419
新疆与中国石化在西北油田实施混合所有制改革,31174,2016-01-20,0.997217114527001
犬托童话小林就一纯s比,4603,2016-02-03,0.9968233988798024
利好或许可以涨停板放量拉升主升浪，新龙头崛起,6783,2016-01-28,0.9056233595332253
女保安完全正常了,5785,2015-12-31,0.24816748788981946
谁在拿托说事，那他自己就是拖。自己笨还怪托，,11171,2016-02-03,0.014454717370287584
o孑孓o:100%是庄托，他的回帖设置了，不是每个,8788,2016-01-27,0.09930753397229919
强烈要求中石化从未分配利润中拿出1000亿来增持,11460,2016-01-26,0.17464408415020438
中国石化今日超大单流出排名第11名(02-02),8506,2016-02-02,0.13961633810550655
还有人记得，中国远洋从100多元跌倒2块多吗？哈,13015,2016-01-28,0.5535276447524983
吧里根本就没有托，就算能忽悠一万个小散有啥用,5527,2016-02-02,0.006361927204013851
郑渊洁语录：把听得懂的话，往听不懂里说的，都,4411,2016-02-02,0.5087763540345416
向恶庄宣战,17288,2016-01-24,0.4737672181921908
春联求横批：千股跌停辞旧岁，万民套牢迎新春。,6768,2016-02-01,0.05447896783509454
从明天起，每天发自己的实盘交易记录,55428,2016-01-26,0.09566458913114151
中石化两大油田启动混改 销售公司或单独上市,95172,2016-01-28,0.08671246820342038
“剪羊毛”行情令人唏嘘 股民盼着猴年股票给力,127635,2016-01-31,0.9973623370793038
锁仓联盟,3875,2016-02-01,0.411518592936718
关注石化很久了还是下不了手,15128,2015-12-12,0.5131393515911735
跟踪报告：2015年经营数据分析,64947,2016-01-29,0.9057191516217197
为了祖国全仓冲进去。,7571,2016-01-28,0.3825329386333727
继续嘚瑟：4,25元4,20元4,15元4,1元挂单买入,7687,2016-01-29,0.9240011473500075
如果身处顺境不要张扬,16117,2016-01-11,0.9688790221638692
注意：o孑孓o：这个人很可能是托。,8070,2016-01-26,0.38424216365821695
哈哈，嘚瑟嘚瑟：我狂，故我在！,5378,2016-01-28,0.5692440570506505
我姓牛 儿子快出生了 麻烦大家给牛娃娃起个凶猛,3424,2016-01-28,0.9268859943446637
刘军洛的微博。。。,44762,2015-12-05,0.5792322783631928
《股市大合唱》,4643,2015-08-20,0.890142453148024
中石化两大油田双双启动混改 销售公司单独上市,27367,2016-01-28,0.07874800642319313
中石化吧最敬业的人是谁？,14076,2016-01-13,0.6269770777562212
中石化：积极稳妥推进混合所有制改革,23262,2016-01-26,0.9635772108768806
赔了钱，不反省自己却说别人托,6905,2016-01-26,0.0017320827567253172
中国股市到了最危急的时候,7989,2015-08-22,0.9795847683045509
