标题,帖子数,日期,情感
中国石化（002493）：5年之内，必涨3倍！,26684,2017-08-09,0.7681543508292812
茅台你可以卖，平安你可卖，格力你可卖，但中国,37707,2017-07-31,0.09794557986041408
约65%仓位，期望满仓。,24835,2017-08-30,0.09612820477278461
中国石化千里之行始于足下,158392,2017-04-09,0.33595411634790395
三桶油半年报全部出炉 中国石化日赚1.5亿元“最,95113,2017-08-28,0.01794328558610614
11月10日5元买入中石化，涨到59.6元,233704,2016-11-10,0.02868614898376476
[俏皮]漂亮50英豪300必将疯狂展我中华5千年大帝,7921,2017-06-12,0.9744639855029587
中石化延期销售公司上市 提速混改再圈定天然气,45643,2017-09-02,0.10389373170479754
次新股0.98元业绩仅此1家江苏银行股价不到10块,36996,2017-04-27,0.049974062228806404
实战炒股口决： 十四工作线，来回做波段；突破,56149,2017-03-23,0.986755970349184
2017上半年中石化业绩分析：净利润同比增长约22,16818,2017-08-28,0.9622676505882758
揭穿价值投资的鬼话，如果真要价值投资，招商银,31058,2017-07-03,0.9997151511106501
入场收尸:地产称霸南京，医美雄冠亚洲,6632,2017-08-15,0.2613908113232535
狂笑 狂笑 瞎子也狂笑 业绩翻倍 股0.99今年三倍,13677,2017-05-24,0.25184990965565945
狂笑 瞎子也狂笑 业绩翻倍 股0.99今年三倍，翻,14459,2017-05-24,0.20940363332354495
呆子都会抢 瞎子也狂笑 业绩翻倍 股0.99今年三,12725,2017-05-24,0.3873138884971421
笑笑笑 狂笑 呆子都会抢 业绩翻倍 股0.99今年三,10226,2017-05-24,0.8691075516145628
证金公司增持“两桶油” 油气行业混改预期升温,202397,2017-08-29,0.16226792611095886
约50%仓位，计划明天加到70%仓位。,18683,2017-08-17,0.017961793167296403
中石化半年报亮点。,15503,2017-08-27,0.45065748518378246
中石化：销售公司IPO或推迟 正推进管道、地热等,102405,2017-08-28,0.061998020211870064
现价买，翻倍卖,13965,2016-10-14,0.577482445946654
耐心、坚定!,23462,2016-09-19,0.7907679774843098
你懂的[赞],25626,2016-11-16,0.9096018490786377
难道我要成传说中的韭菜。,179286,2015-09-17,0.31549054798584963
中石化上半年净利大涨四成 上游业务仍很艰难,14508,2017-08-28,0.8497150685304656
中国石化集团：主动服从服务雄安新区等国家战略,12064,2017-08-01,0.9983869461990217
中国石化：中报净利润271亿元 同比增长40.7%,147140,2017-08-27,0.38607758890491106
它们涨了，石化怎么样？,19692,2017-07-31,0.3384204055164508
真正龙头,11356,2017-08-21,0.27083333333333337
中国石化上半年净利润270.92亿元 同比增长四成,8894,2017-08-27,0.6364928694993603
中国石化飘红已是必然，后面或将这样走,14086,2017-08-25,0.3774945277738192
中报速递：中国石化2017年上半年盈利270.92亿元,17543,2017-08-27,0.20554163952676485
看完本帖内容会增强信心：解码中石化专业化重组,25746,2017-08-18,0.3527128850197051
新股发行不能停的重要理由：让凯撒归凯撒市场归,8811,2017-06-12,0.06081972954919124
石化如此价格低，哪里见到大牛市,12678,2017-08-18,0.34436130665497944
中石化吧里有一群男同人夭利用内幕信息波段操作,14204,2017-05-09,0.9634737729468884
中石化拟投2000亿元 优化升级四大世界级炼化基,66224,2017-03-02,0.6349385688713002
中石化将投资2000亿打造四大炼化基地,56229,2017-03-02,0.9539486715618989
中国石化“十三五”拟投2000亿元 打造四大世界,53192,2017-03-02,0.9691570155297653
中国石化十三五拟投资2000亿打造4大炼化基地,50737,2017-03-02,0.9042214522677448
“十三五”期间中国石化拟打造4大炼化基地,47606,2017-03-02,0.20018016876663325
中石化鄂安沧管道获国家核准,28353,2017-07-25,0.9029776197701228
紧急公告：601958 金钼股份正创历史新低，青菜,6194,2017-06-12,0.9941927156977014
黄羊，我愿抛弃哪所有财产，陪你去放羊,6059,2017-08-20,0.9703405892847822
对话中石化,77019,2015-11-16,0.4499223660838505
预计二季度业绩环比下降，不改上半年同比明显增,46077,2017-07-23,0.4302830368827143
涨停几时有，把酒问青天，不知大盘走势，还能牛,15738,2017-02-07,0.3589625150640874
核心内参: 地产称霸南京，医美雄冠亚洲,7419,2017-08-12,0.9315669100106516
现40%仓位石化，期盼满仓。,32609,2017-08-07,0.08665551321642373
以后到处发这个！有补充的吗？ 一个超跌的MSCI,13688,2017-08-11,0.08473118918500344
中石化在2+26城市区域内炼厂完成国六升级,27242,2017-07-03,0.31808093898526
中国石化不行了，换股马上赚回来，信者赚！,11244,2017-07-18,0.0028819030835245396
中石化董事长王玉普：将用好混改重要手段,35562,2017-08-10,0.9920673928643795
中石化集团：以销售公司股改为突破口加快建立中,35192,2017-07-14,0.1320825044224686
著名经济学家马光远看中国股市：离开这个骗局！,24476,2017-06-01,0.9955138667966862
A股市场还有更好的股票吗？,27859,2017-01-20,0.8876320906482471
扒下股评师的外衣---大股托,9827,2017-06-11,0.21323830070831995
要不做奴隶，要不就去死。,36432,2017-02-26,0.594935470614259
咳、咳，老夫掐指一算，今天该中石化救驾了~,4677,2017-07-27,0.5226229471846782
8号买入明细。,9687,2017-08-08,0.7416322338529585
砸下来很简单,3096,2017-02-13,0.33934005707100146
下午大跌了,3970,2017-02-13,0.22045276270880132
进场:“一网三化”混改和国资改革的双重受益股,5433,2017-02-11,0.9869235979446327
市场出现分化，蓝筹股集体走强，,2895,2017-02-13,0.9730850101138016
今天盘整，明天过10日线，买进,3409,2017-02-13,0.1363926606973188
中石化：地热能源已将雄县打造成“无烟城”,31803,2017-08-07,0.051319608786128734
6.08进了2万手中石化,8091,2017-07-25,0.5005469181559483
4号买入明细。,13172,2017-08-04,0.7067552081068589
鸡年首次过来石化报到。,15373,2017-02-09,0.10946813991167015
抓紧满仓:油气混改和地方国资改革的双重受益股,8183,2017-01-25,0.9657811846579721
最新消息:莫斯科发生军事改变 普京下落不明,13008,2017-02-13,0.9338960677375053
4600万吨原油加工产能闲置 中国石化集团审计出3,42452,2016-07-01,0.10891920221803186
600028:中国石化2016年年度末期A股分红派息实施,118188,2017-07-11,0.7364218390024031
中国石化首个煤层气田供气超亿立方米,17093,2017-02-13,0.8447597422456379
两会利好！放量拉升突破，蓝筹龙头崛起！目标16,13953,2017-03-05,0.9372834896939433
韩自国是什么样的经济学家？ 1、2007年8月23日,15033,2017-06-12,0.43133084248909903
每当给车加油，就想到中国石化,45985,2017-06-17,0.8594264234539
满空大师門：和尚们看高中国石化涨到7元,7433,2017-02-12,0.23101071874622325
2号买入明细。,10126,2017-08-03,0.6304482005225568
中国证券网 武汉谋划三个国家级产业新基地建设 ,7341,2017-01-06,0.2968305786372567
2号买入明细。,4447,2017-08-02,0.6304482005225568
眼中钉，肉中刺，不除不行得呀,1527,2017-07-28,0.060665907012543374
中国石化的上涨是对近几年扭曲的投资价植观的修,28623,2017-01-16,0.43436055012456076
中石化吧里人夭男宠大监的那些内幕交易!,8373,2017-05-09,0.4097942199283384
下来全转买*一路一带丝路龙头600307酒钢宏兴最,32949,2017-05-08,0.6886477600938257
进场: “双重改革”受益股,社保养老金标的股,734,2017-07-30,0.9893200488469195
绩优低价中盘二线蓝筹,7062,2017-06-23,0.9682939504209828
5没穷，6没绝，7就不会翻身，关机[不屑],2771,2017-07-05,0.02569976609434388
散户们别跟主力抢中小盘便宜货炒底，否则难见底,4685,2017-06-26,0.29329394452646707
今天拯救世界，就靠中石化了,3632,2017-02-13,0.9589992970642399
抛！经济恶化,拉股价，用人性贪婪，忽悠股民在,54801,2016-01-29,0.8250483988915179
白痴不抢！咯咯咯！抢盘了，黄金砸头！晨鸣投资,17376,2017-03-01,0.9990014513534955
现价7.08的美菱电器，已经展开中长线趋势行情，,1931,2017-02-14,0.9974253874601405
分红送股要除权，你账户上不会多出1分钱，而且,11603,2017-06-30,0.015858242277762002
中国石化依走势已定型，外有融资地陆续流入，这,4629,2017-07-14,0.9891552508905498
证券时报网  AH股比价 2017年06月23日 18:24,5072,2017-06-23,0.060047122002522935
AH比价趋于合理   有望走出独立行情,7891,2015-09-14,0.9932307492070825
持股联通的大咖,6246,2017-07-15,0.20588882834908517
顶尖高手投资的六大不败法则：      法则一：买,26245,2017-01-28,0.9987033004793375
进场: “双重改革”受益股,社保养老金标的股,8622,2017-05-21,0.9893200488469195
中石化首虎王天普腐败细节：请客一次花4万公款,76724,2016-10-20,0.9877601111938906
中石化原总经理王天普获刑15年半 青岛大爆炸案,26148,2017-01-24,0.9855548365930226
虽然近期弱势不断,2897,2017-06-28,0.4793730361103238
顶尖高手投资的六大不败法则：      法则一：买,16316,2017-01-21,0.9987033004793375
600028:中国石化2017年上半年生产经营业绩提示,94060,2017-07-20,0.5901191432134064
我个人认为下周一大盘会在两桶油为首的的带头下,12152,2017-06-24,0.09820078904314722
拉600028不如拉600688和601985,6894,2017-05-31,0.4144577084592702
今天，又是哀鸿遍野的一个交易日……,5482,2017-06-22,0.9863608739828233
今日关注石墨烯板块江海股份，中超控股,4568,2017-06-26,0.9897267027144768
昨天的那个盘中拉高就,2732,2017-06-25,0.7379333131352642
消息称中石化3高管涉印尼项目欺诈案遭国际刑警,13830,2017-03-21,0.006063728651125366
权重股飙升的原因,14083,2017-05-25,0.11708602253538458
怎么回事  石化还没动  他们就挺了,4848,2017-06-22,0.07146758367705541
中国石化重上30元。,25935,2017-02-22,0.08022395324407738
强推江西铜业,9456,2017-06-11,0.6399342695802664
B股是散户资金避风港，B股将成为投机者生存的市,78401,2016-12-28,0.643790454857328
庸主，你走吧，就好去养马喂马劈柴面朝大海,3407,2017-06-26,0.9560712778629497
庄家国家队太低估股民空倉的决心了！,8111,2017-07-14,0.7504633208556603
墨电极价格的两个关键点——复产+囤货,4138,2017-07-17,0.6585368995944454
管理升级，大幅下降的财物费用增厚了利润。切身,12347,2016-11-05,0.014707446777177058
[cp]这篇文章很有意思：逼狼去吃草，太经典了！,11498,2017-06-03,0.9961253812861479
证监会本周核发9家IPO批文。,5276,2017-07-08,0.2319115280392403
庸主，鹰击长空还是掩耳盗铃呀？,3444,2017-07-04,0.9535955615653092
股民们大胆买入中石化吧，不要上了庄家的当！,10755,2017-06-26,0.963051977996655
小小的主力   今天很任性啊,6674,2017-06-26,0.9693039665069719
住房公积金打通异地壁垒 4.5万亿缴存结余望盘活,4822,2017-06-25,0.0929715685119511
乱冲乱撞的默默离开了，才能慢的下来！,5705,2017-06-24,0.8388073014248157
中国石化(600028)融资融券信息(06-22),6876,2017-06-23,0.7210047151351948
20号在进不了，还有脸活吗？哈哈,4343,2017-06-13,0.07184860616245925
现在炒股的人为什么越来越少了,13745,2017-07-01,0.1688278065467732
水皮杂谈：“婴儿底”能扛住千股跌停吗？,93615,2015-09-18,0.14282780159803843
中国石化,11991,2016-11-22,0.3843035039501209
下一个贵州茅台 下一个中国平安 下一个格力电器,7945,2017-06-26,0.34947955262561103
600028：第二轮买进，成本5.953元。,16894,2017-06-19,0.19477354573584782
快点分红,1931,2017-06-28,0.7290675443487193
俺买一手，它涨；俺买拾手，它跌；俺再买贰拾手,3988,2017-06-29,0.6119765566113994
漫长的严冬来了，个股在波动中，波幅逐渐被拉直,4895,2017-07-08,0.63960306102682
有人说平行线最可怕，但我认为最可怕的是相交线,5657,2017-07-06,0.5182635826126476
中国石化，早买早发财,34573,2017-04-06,0.5992543422330361
次贷危机中迅速走出并,2641,2017-06-26,0.9954697825532122
沪指上涨2.72点,3231,2017-06-22,0.16325642840016963
中国石化(600028)融资融券信息(06-23),6912,2017-06-24,0.7210047151351948
江湖险恶   下周再战,6076,2017-06-23,0.7211003299085004
看看B股走势，便知这三、二年内必有厚报！,3526,2017-06-22,0.22654953947205692
紧急呼叫,5023,2017-06-23,0.5294947133879224
明日留意：中国石化，永创智能，海鸥股份,4812,2017-06-22,0.9947384721151441
基金抱团炒个股是中国式庞氏骗局，隐患危害大02,27899,2016-07-21,0.8070914819762757
上半年50座大城市卖地超1.2万亿 平均地价涨超30,3674,2017-06-25,0.1731157214427682
中国石化，我坚守了七年。（你何时再起飞？）,49820,2016-11-17,0.16487950165159493
《个股关注》,4315,2017-06-26,0.5646230618921692
中国石化第一目标价:5.72,5569,2016-05-30,0.8760557369801734
吃人股市——快快关门！,4773,2016-05-27,0.9708945897063884
李大霄：中国股市，准备起飞！,10043,2016-05-28,0.9865100213021344
把卖单全撤了，都别卖，让我一手封涨停,5381,2016-05-27,0.03557313105403892
巴菲特: 现今投资蓝筹股就是投资石油股,21059,2015-09-03,0.9997036586258963
股市操盘十大技巧之一，有涨早杀丶有跌早追。,4057,2016-05-23,0.9855477429374296
抢筹突破：本周汽柴油价将迎“三连涨” 每升上,5569,2016-05-24,0.7545502443597456
奇正出击,3258,2017-07-02,0.2860696175168054
国际金融大鳄索罗斯中国门徒：郑卫平转型音乐界,7383,2016-05-27,0.999868553759419
ddddd中国股市最大的特点 折腾 这样版那样版 板,5500,2016-05-30,0.8617526578653345
石化跟上：中石油工程建设资产注入*ST天利上市,5784,2016-05-30,0.3412735860835261
Ａ股——天天都是哀鸿遍野！,5429,2016-05-30,0.9875776027514582
600028:中国石化公司债券2016年跟踪评级报告,30671,2016-05-29,0.12431549228748884
平台己搭好，不知是三米板还是十米台,3532,2016-05-29,0.22240197918708293
中国石化(600028)融资融券信息(05-27),8750,2016-05-28,0.7210047151351948
中字头股票下周拉升！,6347,2016-05-27,0.6296236989733667
看空是何其贪婪，直接加满，暂不融资！,5635,2016-05-27,0.8290125812407872
中国石化(600028)融资融券信息(05-26),6107,2016-05-27,0.7210047151351948
我算是踩到猫尾巴了哈哈,6500,2016-05-26,0.5357787710200319
利好（石化多重要）：法国动用国家战略石油储备,6503,2016-05-26,0.8880875479571456
这个时候还有人唱多 你别卖我卖 呵呵,3535,2016-05-30,0.9576900467226389
我不要！！！,4858,2016-05-27,0.20637898686679168
两桶油油是不是又要护盘咯，浪个浪，哈哈哈哈,5878,2016-05-30,0.3297380101825551
愿——Ａ股吃人股市，早日关门大吉！,3206,2016-05-30,0.08103611116646392
吃人股市——天天利空，天天暴跌！全球中最垃圾,3513,2016-05-30,0.9895277486200579
两桶油的各种库房发基本都塞满了这到底是主何吉,5653,2016-05-27,0.018556397827821036
600028:中国石化关于“10石化02”、“12石化01,32072,2016-05-29,0.11082751421323878
射了射了……广发港股暴涨！百亿豪赌深港通？跟,4795,2016-05-27,0.9946518580903088
人气涣散：两桶油业绩均低于预期,8901,2015-10-29,0.0946571995576333
樊继贤们注意休息别累着啊！时间充足你在这不惑,4232,2016-05-29,0.49880703119729664
使得此类流通盘普遍较大的个股,5322,2017-06-28,0.14535404363766324
如果IPo狂发和指数涨跌关系不大，为何15年股灾,15026,2017-01-17,0.29360547253060787
压盘的你等脑子是否有病，上证50指数最近两周周,7734,2017-06-29,0.23014950600469852
典型的套人拉高 小心小新,3859,2017-06-28,0.35397669781514673
中国石化，.股市下跌时成交量可以不用放大，股,12767,2017-06-23,0.8422901470998265
但斌：美股10年退市近万家！100年大牛市不是只,13036,2017-01-20,0.6593705176218544
2016年12月2号，2017年1月6号这两根周K线连起来,12160,2017-05-27,0.0025194224072543348
军民融合：强化顶层设计 强调落地实施  2017年6,3343,2017-06-24,0.9998249787877591
中石化是否调整到位，下周有可能收阳线吗？请各,3363,2017-06-09,0.10326465113928751
中国26年股市历史，从来没有狂发新股见底的先例,69368,2016-09-22,0.9460864434033188
A股这样的股市，对得起你的投资者吗？看看全球,4405,2017-06-21,0.9958858633930503
买入上海石化(600688),213837,2015-11-11,0.3141388674957901
最惨烈的白马，蓝筹杀跌，还没到来，补跌钉在板,4538,2017-05-03,0.8893970624965959
国际石油价格已跌破45美元了，下一关口40美元！,6802,2017-06-17,0.009127847296390601
毛利6百多万，纯利2千多万，牛,4504,2017-06-07,0.8368689972273742
跌的越来越猛了！,5631,2017-06-15,0.7048064138547694
600028:中国石化2017年第一次A股类别股东大会再,29151,2017-06-14,0.6977437506750391
600028次新抄底时日小散看好这个位置想诱导小散,12586,2017-06-05,0.5930095253995663
猪力  你是在给我们秀肌肉吗,5425,2017-06-02,0.9855251454642578
茅台市值5600多亿,10687,2017-05-23,0.5934061952629907
中石化第一目标8元，不到8元不减仓。7月份到10,45078,2017-01-26,0.011216371549345516
庄家不行,3751,2017-06-10,0.24193831549861822
连续涨停板，空方开始崩溃了。,6753,2016-05-27,0.8494132180260746
中国股市的最后一滴血，一定是中国股民诀别市场,111097,2015-09-21,0.9991402263545373
若有人问你对股市的看法时，一定要问对方的仓位,11700,2017-06-03,0.6248762737577122
现在的走势不过是2010年底到2011年初换个方式重,33399,2017-01-19,0.33263871068207573
一年多发行了300多只新股，堰塞湖是一只没少，,10276,2017-03-31,0.07712075133188101
惨烈的所谓白马、所谓蓝筹的下跌还没开始,2504,2017-05-24,0.9947779440567963
600028:中国石化2016年年度股东大会及2017年第,31700,2017-06-07,0.6666886309170097
卖卖卖卖卖卖卖卖卖卖卖卖卖卖卖卖卖卖卖卖卖卖,5670,2017-01-04,4.7979194263247926e-05
看看大V微博就知道，，明天000016继续大张,2283,2017-05-23,0.2772654978798239
我挂6元一手，看谁敢碰老爷,1247,2017-05-24,0.027103152826303156
中石化原总经理王天普受贿贪污一审获刑15年半,7815,2017-01-24,0.15339425256590333
福建省省长苏树林被查 曾任中石化总经理,68421,2015-10-08,0.6184033347064083
苏树林曾称中石化员工年薪10万已很高 要知足,16126,2015-10-10,0.9724758347060865
中石化原董事王天普被开除党籍,7763,2015-09-21,0.8880270197245547
中石化集团原总经理王天普被开除党籍 涉严重违,33791,2015-09-18,0.779757599417661
中石化原总经理王天普严重违反政治规矩被开除党,13166,2015-09-18,0.9882706125217237
高桥石化宝钢搬迁 引发土地价值猜想,19912,2015-11-11,0.9888607159505558
蔡希有除夕前夜被查 中石化“三虎”过年狱中相,297600,2016-02-07,0.5235817627955113
兵哥，一盒便饭你蠃了，你走吧，最好别回头,19763,2017-05-25,0.28726171277296353
明天暴涨。。。。。。,9867,2017-05-17,0.25052595876306116
今日没大问题,8471,2015-10-22,0.890142453148024
熊市：正式开始了，目标2000点,22089,2016-01-26,0.9708583109082474
滥发新股的暴跌魔咒只会迟到永远不会缺席,16286,2016-11-02,0.9588686320566051
全球定律魔咒：圈霸天下，熊冠全球！,59216,2016-04-02,0.48046948302628856
4500点下不减持，4000下不重启IPO，散户们又被,46471,2015-11-29,0.009828096358748484
现在持有中石化的，不是长线投资者就是股神级的,3646,2017-05-19,0.7642232981202826
明天继续干   等你们朋友。。,7476,2017-05-31,0.13434506623644293
既然是价值投资，为什么不买港股，港股更便宜些,8512,2017-05-29,0.8183496284834884
=↘=1400倍高市盈率高市净率高股价高风险估值太,26649,2017-01-31,0.4850432822738592
=↘2=股价泡沫太大都透支了5~10年的业绩了！可,26395,2017-01-31,0.8418140338578063
恒大暴涨近23%今年涨超200% 特色小镇概念暴涨 2,6346,2017-05-29,0.9836314544278524
中国石化与中国中车签署战略合作框架协议,54899,2017-05-25,0.6876963808037125
中国石化为什么明年1月能上8元？/（回答投资者,25496,2016-12-23,0.7421448585360627
你认为你春节后还可能6元买到中国石化吗？,22394,2017-01-16,0.14302945388244837
宁波港601018重大事项复牌中国石化,72426,2016-03-16,0.2173876360486392
明天不涨停我吃一吨大粪,12784,2017-05-23,0.41772906966054646
不让发贴了？雨一直下,9572,2017-04-17,0.5368597964011862
今天止跌收小中阳线，明天国检集团创新高,8073,2017-05-01,0.25331458129211937
太痛苦啦，吃了一盒便饭割了一台华为P9,5479,2017-04-18,0.28600324427185475
2017不用祈祷了：中国股市依旧是圈霸天下，熊冠,27936,2017-01-02,0.9961661882136909
证监会：请依法常态化监管治市！查处操纵股价的,27170,2016-08-17,0.897761891575638
中央巡视组不会视而不见严查欺诈和腐败！,54753,2015-11-11,0.006361229927697165
利好：石化正研究销售公司深化改革方案,13852,2017-04-06,0.990035843497938
利好抢筹：A股今年大概率纳入MSCI明晟指数,5010,2017-04-21,0.3330403036441594
外媒：A股今年有望纳入MSCI新兴市场指数,1712,2017-05-05,0.6962851570485222
利好：石化董事长：零售子公司上市由董事会决定,19957,2017-03-27,0.1541062275429269
600028:中国石化关于召开2016年年度股东大会、2,11482,2017-05-11,0.8454316322186275
Q1业绩可能是2017年盈利高点，关注销售公司境外,14838,2017-05-01,0.28511895736912796
抢筹！外媒：石化零售子公司欲实现A股H股上市,20916,2017-03-31,0.05562137637059916
我不知道啥叫钻石底黄金坑，只看见了昨天的千股,21813,2016-01-05,0.014344371570139902
今天重回石化报到，希庄家给予照顾。,2933,2017-05-02,0.9329761848729905
中国石化(600028)融资融券信息(05-12),3118,2017-05-13,0.7210047151351948
利好！蓝筹龙头崛起一飞冲天，反弹目标16！16！,26458,2017-03-26,0.9250020720079463
中国石化为国产大飞机C919配套润滑油脂,2543,2017-05-10,0.19571133241448946
可燃冰让污染环境的两桶油更加不值钱了,6905,2017-05-19,0.08827631894540999
利好抢筹：石化或参组财团 投资沙特阿美的IPO,8445,2017-04-19,0.81993591338395
放量拉升突破，横扫各种汉奸走狗，加油正能量的,128968,2016-07-21,0.9631312221279832
牛市来了，闻到牛的味道了！,11244,2017-02-24,0.6874766928325938
高管列表暗示了什么？,60465,2015-11-03,0.5547821775422954
小林子，今天清仓了2391，下次再见！,7008,2017-05-17,0.25611768009105174
中国石化销售公司拟IPO  上市地或选择香港,3603,2017-05-01,0.603844881777797
金自天正人工智能龙头,3018,2017-05-17,0.48301370298762447
还拉，作假指数有瘾啊,1388,2017-05-12,0.32381460156058783
石化必跌到3元，小散血肉模糊,10312,2016-02-19,0.04583681447256305
行情尾声，注意风险！经济每况愈下，牛市没基础,15651,2015-11-18,0.9972142685143891
融入“一带一路”建设 中国石化提出“4322”构,1379,2017-05-10,0.7056546942308763
特大利好抢筹：2017年希望能推出石油期货,10593,2017-04-13,0.21139890877931522
大利好：中国原油期货合约最早或在7月份准备就,6493,2017-04-18,0.4778525676956237
放量拉升突破，横扫各种汉奸走狗,37683,2017-02-16,0.42849264698595746
利好抢筹：发改委叫停进口原油使用权申请,559,2017-05-03,0.22087787757763988
娘们孩子在操盘,540,2017-05-09,0.9657975820427549
每次粤fhy出现在中石化吧，中石化股价都会跌，,545,2017-05-05,0.5101106754322146
没砸下多少[想一下],737,2017-05-10,0.09733217253738768
688集团军,38577,2015-11-10,0.4737672181921908
逃离中国股市，中国股市是最最最坑爹的场所，没,23342,2016-08-29,0.9181037656939979
谁在砸中石化？,19209,2017-03-28,0.10151663946195699
我在4元等你,12998,2017-03-09,0.26820741526603864
嘿嘿嘿嘿嘿！,2655,2017-04-25,0.7467020686789906
放量拉升突破，蓝筹龙头崛起，反弹目标16,46084,2017-02-13,0.9475439963986244
二千二百点：观点不变。早晚会到，熊市就是熊样,13485,2016-02-17,0.4280039448646292
为了IPO真是蛮拼的，操控期指哄骗韭菜，迟早收,22675,2015-11-24,0.12444823698605922
8年5次全球融资第一跌幅第一双冠王说明什么问题,16187,2016-12-29,0.921413156093554
漫天遍野的利好换来的就是无穷无尽的IPO和减持,28646,2016-05-05,0.9949942644277302
天天狂发新股，你即便就是全球通，都是跌跌跌！,27571,2016-10-14,0.06837468968464366
大盘向下岛形反转,9635,2017-04-17,0.5903697299256508
今天没戏,20501,2017-03-27,0.2500000000000001
圈霸天下，全球大涨咱不弹，熊冠全球，全球微跌,39560,2016-01-22,0.6320294418830293
没有退市制度，注册制就是长期的超级大利空！,22002,2015-11-27,0.5308758822078782
我就想问问唱多吹多的这扶贫大缺口何时补？三天,40638,2016-09-12,0.31205053459440923
千股暴跌辞旧岁，亿人巨亏迎新春，求横批,37734,2017-01-17,0.012316999279812668
