标题,帖子数,日期,情感
不追高，耐心等待回调,4157,2015-08-26,0.25115919547782706
4,27元继续买入中国石化，目前仓位24，92%,5569,2016-01-26,0.4109289617486338
有哪位好汉挂买436啊哈哈,6824,2016-01-22,0.5136592447570655
真正的交易者是孤独的：,8629,2016-01-23,0.9354890982725353
2327.5才是底,33679,2015-09-29,0.7822533195792605
中国石化，3元是铁底！,7552,2016-01-23,0.2616703967344852
本股神认为：4.5-3元，应是中国石化的合理价值,9676,2016-01-23,0.5329907202620444
新疆与中石化西北油田实施混改 8股或受益,64263,2016-01-22,0.8183655984750678
终于脱掉单身狗了，求祝福哟！大家祝福我吧！,6804,2016-01-21,0.9727275325259822
时隔 3年小哥又回来中国石化了,12201,2016-01-15,0.30897421843116624
话说，跌倒3.8，甚至3.5，你真的还不恐惧？不会,17067,2016-01-17,0.5751780344626964
4.38买入8万股，等着发财了,13151,2016-01-18,0.5123392740324423
月线上看，中石油至少跌到6元以下！而中石化深,7388,2016-01-17,0.03240293268067773
4.85买入时还担心买不上，现在4.46，真能跌，爷,10102,2016-01-15,0.835333367907831
中国石化(600028)融资融券信息(01-15),10583,2016-01-16,0.7210047151351948
有一种职业：社会工作，有一群普通人：社会工作,7965,2015-10-08,0.9994029772063274
大盘股没救了,5069,2015-10-27,0.2883928661326973
中国石化今日超大单流出排名第1名(01-14),18417,2016-01-14,0.1723303928953962
中石化高管偷盗4.7亿元成品油获刑无期,15159,2016-01-13,0.9367116496050336
中石化下午如不涨停，我自宫！！,5205,2016-01-14,0.11619165211853277
公司半年报：2Q15，炼油、化工业务盈利明显改善,7977,2015-08-28,0.2002323046479717
国家发改委13日公布了新的成品油价格形成机制，,18911,2016-01-13,0.13742026114501193
2Q炼化盈利大幅提升,10075,2015-08-27,0.3006079803217687
29元买的中石化的有没有?还敢不敢站出来！,7004,2015-11-03,0.08910292567851552
美原油又创新低，你怎么看？,12422,2016-01-12,0.9186985126908259
谁去用爱烘干女保安这颗潮湿的心！哈哈,4557,2016-01-12,0.438243632822253
港股企稳煤炭钢铁发力 资源股大行今年首推中石,43050,2016-01-08,0.18995988406234754
看不明白，一分分的涨，一角角的跌，谁这么多筹,9249,2016-01-08,0.5227820735722414
下周一必大涨，不涨给大家每人冲50话费！任性,20964,2016-01-09,0.9839188277065932
有缘者见、积功德：600028月线级别金叉，连续涨,17857,2015-12-13,0.5166876538791063
为什么熔断出现很频繁？近期为什么频繁暴跌？,14469,2016-01-07,0.6422132350551415
600028:中国石化关于召开2016年第一次临时股东,53756,2016-01-07,0.21052286976661294
2016年新股申购新规与技巧,21451,2015-12-19,0.9835056305136011
误判国际原油大势 中国油企败走加拿大：部分投,42835,2016-01-07,0.3111096735197094
中石化在北部湾海域试获日产千吨油井,11780,2016-01-06,0.8558161507439229
中报业绩基本符合预期，环比大幅改善，维持买入,9931,2015-08-27,0.5586689589927036
还对话中石化，对中石化还有啥可说的,5683,2016-01-07,0.26188422077965356
不能等了，买入,6720,2015-09-16,0.612718738264278
发现一只老庄托在到处害人 大家小心,4581,2015-12-29,0.06986193172552069
明天中石化高开后怎么走,29494,2015-12-15,0.16721241975966006
中石化在我国北部湾海域试获高产油气流,14631,2016-01-06,0.9849151064099662
无论啥原因，2桶油这么个玩法都是有点过了！,3906,2016-01-05,0.1142390870576494
油价惊悚不自忧，更看低谷反弹力,45324,2015-12-16,0.9969164550159056
中国石化建成国家级页岩气示范区,25026,2015-12-22,0.7546320266147382
请问中国证监会主席：中国股市值不值得长期投资,4274,2015-11-29,0.981972867581363
北汽新能源与中石化合作建设电动车快换站,40678,2016-01-02,0.013076283669390731
持有中石化8年，什么时候能解套啊？,20600,2015-12-23,0.31255808018537035
走到哪都不让回帖，谈股价不让谈，开玩笑不让开,8542,2015-12-31,0.09806641648615899
不要唱多，也不要唱空，客观看事情。,13368,2015-12-15,0.9620103413897164
页岩气寒潮  中石化逆势点火,13709,2015-12-30,0.15648230453634515
关于增中国石化股票的公告,13553,2015-12-30,0.7846608432711795
中国石化这种股一半涨幅不会太大， 再涨就不能,18655,2015-12-03,0.022594357365399942
中国石化重庆涪陵页岩气田50亿方产能建成,11007,2015-12-29,0.1886050754136338
中石化混改渐入正轨 销售公司组建董事会和监事,16316,2015-12-29,0.05065758654917307
下午中石化收盘价猜想,18251,2015-12-16,0.8658059912599796
中石化荣幸登上2015年最恶心股票榜首,17850,2015-12-24,0.4465225295174843
中石化不是一般意义上的大盘股滞涨,18171,2015-12-21,0.7263879891095416
600028:中国石化关于聘任高级副总裁及更换财务,29105,2015-12-28,0.06257765871340559
为什么老子满仓70万股，就不涨？,13035,2015-12-22,0.466729977892117
600028:中国石化第六届董事会第四次会议决议公,27690,2015-12-28,0.09050099217221697
操作策略,8108,2015-12-23,0.7804038850064997
600028:中国石化2015年公司债券(第一期)票面利,8457,2015-11-18,0.41912844569797425
中石化广州分公司炼油区起火 上月底刚宣布停工,14461,2015-12-25,0.056896771027880155
周五高开封涨停,11256,2015-12-24,0.7340789113675065
《关于石油，啥是美国人连想都不敢想的事》,4754,2015-12-24,0.12281204766269382
老鸟提示：短期拥抱中石化,非常值得期待,19613,2015-12-23,0.9082941694404169
丁二烯价格连续上涨 四股利润大增有炒作机会(附,66404,2015-12-23,0.013895003543453521
伊拉克总理访中 传推动与中石化共组合资石油营,26104,2015-12-23,0.676756980857872
亲爱的，我三分之一的仓位为你留着，你不要老是,6883,2015-12-22,0.21891544059680768
中国石化参股俄罗斯西布尔10%股权顺利交割,28513,2015-12-18,0.9566089360447875
两根小阳线 多空双方激烈角逐谁占优势？,4522,2015-12-02,0.15187083436076532
中国石化 关键节点 这个走势是守还是走！！,49328,2015-12-16,0.572569489423074
买入中石化正当时,11776,2015-11-09,0.7731170316865514
呼叫牛19大哥，啥价位T一把比较好,12666,2015-12-16,0.9015380169991126
4.8这点位很重要，不会轻易失守，散们坚定持股,13807,2015-12-11,0.5727214441156948
中石化获准收购西布尔集团20%股份 中俄能源合作,42578,2015-12-15,0.3694305224158133
明年电力石油等竞争性环节将真正放开,27845,2015-12-14,0.4413704055728239
真他妈的烦，今天可能又加仓不了。,13612,2015-12-08,0.00902621199934317
妈的，终于T了一把,4954,2015-12-14,0.8412696119838055
请教高人:什么样的人才会买中石化?,11929,2015-12-12,0.07709013035730461
2015年12月10日星期四上证走势预测图,8218,2015-12-09,0.12035222090481634
价值投资：太凄悲憤了……有谁,10044,2015-12-10,0.9981941247466986
你们砸吧，我抄把底行吗？120万股，不到净资产,13478,2015-11-30,0.11116737848941749
不弄死庄，就会被庄弄死,19458,2015-11-26,0.027282299962853918
原油价格跌至七年最低 油气改革窗口期打开,51039,2015-12-09,0.7882394296101385
2015年12月3日星期四上证走势预测图,4990,2015-12-02,0.13857290351685347
买入中石化8大理由：1:石油连续大跌，利好石化,11763,2015-12-08,0.007639528205342971
中长线投资者建仓时机来临,7754,2015-12-02,0.9956608098389533
哥一个单砸出去，估计那几个散100个账户也接不,4023,2015-12-08,0.037418373958742035
中石化港股4.68元，工商银行港股和国内的分别是,7334,2015-12-07,0.04187947569362738
守得好累,5451,2015-12-07,0.8203400968663859
油改方案出台倒计时 3股望再演绎跨年度行情,17582,2015-12-04,0.6245116539490851
中石化不涨的原因  大揭秘,13787,2015-11-23,0.24813202518843647
将2007年至今9年来K线缩小在一屏上，5元是石化,8759,2015-11-07,0.028293747476231257
今日，化石多空分水岭89日均线价524，攻克站上,4851,2015-12-04,0.9621878624605968
前复权中石化06年底收盘5.41元，9年间每股净利,15795,2015-11-12,0.3476703038326817
今日预测...,5319,2015-12-03,0.9772060590031599
中石化，如果明天 板了，你跑吗？,6175,2015-12-02,0.091153860698585
中石化将预告2015年度业绩达1元以上，原因如下,6049,2015-11-08,0.15034093859887376
石化石油合并重组停牌在即：加油站销售公司+油,12756,2015-11-17,0.002331376871079649
不要一天到晚说破净,3824,2015-12-01,0.579318577051342
老子成本在6.6元，有谁比我高呀,2996,2015-12-02,0.7893770492358824
《一一吖：割在4.91元了：彻底的不玩了一一》,2384,2015-12-02,0.19742993762743233
很多人不知道谁是国家队，我来告诉你。,2721,2015-12-01,0.44203575909801907
到底是5元贵还是128元贵？,8149,2015-11-20,0.11170861539239552
钢琴曲黑色星期天要人命，这石化黑色星期五也要,3591,2015-11-27,0.12649640248364735
第一次买中石化不知道对不对？,3497,2015-11-26,0.11518282540426772
世界500强的中国石化，十二年价值回归之路,7940,2015-11-20,0.9921332842021685
买入石化的伙伴们都是什么心情呢,3817,2015-11-25,0.2985042520059712
壳牌热卖饮料 中石化要卖水果,8568,2015-11-25,0.5792274639992621
11.24大盘及个股解析。,5097,2015-11-24,0.8845552137051754
600028:中国石化2015年公司债券(第一期)发行结,8095,2015-11-22,0.10982928468806596
转：一个炒股的农产品研究员对双降的研究结论！,7596,2015-10-25,0.5247585156817857
既然个股杀不动，那，就此做多吧,22242,2015-09-09,0.35250687890130694
灭绝人性，惨不忍睹！,113071,2015-08-25,0.7310507116379525
中石化欲转型当电商,11120,2015-11-19,0.9415196313264769
我们响应国家号召 买入蓝筹股做价值投资 可是 ,3195,2015-11-20,0.9723250275513502
看到028只有可怜的5.18 我贪婪了 二话不说 我直,3751,2015-11-18,0.12997954416664992
俄油将与中石化年底前签署油田协议,8538,2015-11-19,0.014285977556594331
中国石化40亿挂牌转让华泰保险13.9%股权,6219,2015-11-19,0.043347555603829746
中石化在粤开通线上支付 布局跨界整合,6895,2015-11-18,0.03413529952008043
你们真的还在这里,5613,2015-11-18,0.6565328414014552
赢在牛股的启动点，各种迹象显示此股将一飞冲天,20842,2015-10-13,0.013678097768166753
中石化拟退出华泰保险 持股挂牌价达40亿元,9304,2015-11-18,0.012116761865555437
你们这没赚过这点小钱啊。。。。卖什么么。。。,2414,2015-11-18,0.07687826328822622
现在不想爆粗口的都不是人！！！,2673,2015-11-18,0.020383833433442744
中石化发力柴油车升级 建成华中地区最大柴油车,6402,2015-11-17,0.6257008852379702
这儿老朋友还有几个,3982,2015-11-09,0.8571428571428571
股海随笔---论人性的弱点,16416,2015-11-11,0.9860055486927227
中国石化(600028)大宗交易数据一览(11-11),6076,2015-11-11,0.16832554308462
中石化十月收盘价有奖竟猜,11521,2015-10-22,0.2997707170257341
正式宣布：周三中石化涨停,9101,2015-11-10,0.4283625308966149
两桶油，形态走好，建议不要做短线。随时会加速,5155,2015-11-09,0.8461422595946478
中国石化今日超大单流入排名第11名(11-10),28079,2015-11-10,0.3936044968752709
中国石化近期操作策略，耐心持有即可!,5592,2015-11-09,0.7561641963015195
中石化能套证金多长时间？,10198,2015-11-02,0.39379505282242533
中石化回应搬迁高桥石化补偿500亿：讹谁了吗,37933,2015-11-09,0.02478396188264531
大家都来说说，你们是怎么高位套牢的？,5894,2015-11-06,0.7491571253446679
石化大股东7月7元附近增持7.2千万股，计划1年内,17822,2015-10-19,0.00019501624477036295
幸运大猜奖： 有谁能精准猜中下周一开盘价的,送,5919,2015-11-07,0.9888562348381696
前复权中石化也曾辉煌：05年到07年有过30倍涨幅,5963,2015-10-23,0.9627256099101106
600028:中国石化关于拟向合格投资者公开发行201,36323,2015-11-06,0.7288849186819665
上海高桥石化搬迁进展：中石化欲求500亿补贴,24152,2015-11-06,0.009918115117603432
中石化和中国银行操盘手暴露了  有证为据,4956,2015-11-06,0.35762375620386877
11月第一周中石化收盘价有奖竟猜,15133,2015-10-30,0.13267768429356197
中国石化(600028)融资融券信息(11-05),3601,2015-11-06,0.7210047151351948
估计石化会到6.1元,5472,2015-11-04,0.17442245487771268
我说女保安不是托，就是一个炒股输傻的人，,3456,2015-11-04,0.01423877356952763
周三机构强烈推荐6只牛股,23317,2015-09-01,0.05753396767491992
市场热点是否有可持续性，,18510,2015-11-05,0.8310875983330022
中国石化(600028)融资融券信息(11-04),3916,2015-11-05,0.7210047151351948
机构周三强烈推荐6只牛股(9/2),31348,2015-09-02,0.1322388113471601
狂妄太多出自无知,5107,2015-10-31,0.7468568143334117
油价二次探底导致炼油大幅库存跌价,8621,2015-11-01,0.010858271614256232
中石化的庄都是电脑自动操盘的，这么大的盘子每,4301,2015-10-30,0.1596328232346399
中国证券史上最黑暗的一幕，中石化三季报严重造,7088,2015-10-29,0.89155505080468
说好的478低开呢？,3700,2015-10-30,0.23643430516514918
600028:中国石化2015年第三季度季报,48166,2015-10-29,0.5900591074472127
中石化前3季度赚超600亿第3季赚超400亿，前3季,15330,2015-10-20,0.9255004798268754
这里有没有专家，帮我看下002430,3185,2015-10-28,0.689088735750851
卖的都是散户,8304,2015-09-22,0.38897374115032335
午盘信息,4469,2015-10-28,0.4737672181921908
开始进入倒计时了,7072,2015-10-09,0.5
中石化，真可怕，一套八年没变化。征下联？,21494,2015-09-10,0.5512742812699963
中国石化(600028)融资融券信息(10-23),4092,2015-10-26,0.7210047151351948
郑重提示：中国石化、上海石化一个月内必停牌的,50022,2015-10-24,0.052024978763740015
600028:中国石化2015年第一次临时股东大会决议,9173,2015-10-23,0.5193918202344847
600028中国石化2015年日线第一次地量出现？,16169,2015-09-12,0.2979787618712214
重大消息，下周有望出现变盘走势！,84119,2015-09-12,0.23615399978382678
别人贪婪的时候我最恐惧，而在别人恐惧的时候我,120843,2015-09-16,0.9950765292381817
股海随笔---寻找成功的阶梯,4899,2015-10-16,0.9978095831114477
尾盘10分钟，下周一高开无疑，涨停节奏可期也。,17133,2015-10-16,0.16554625732495576
中国石化涪陵页岩气田探明储量增至3800亿方,49576,2015-10-16,0.4596786324589557
我期货亏了600万，你看下螺纹钢的走势，就知道,5747,2015-10-14,0.9415145955734314
中石化经营概述：目前估值不便宜,15372,2015-10-15,0.7744708232439911
中国石化轻微震荡但买入机会较大！,30592,2015-10-13,0.6780861025379612
股海随笔---在孤独中勇敢前行,3718,2015-10-14,0.999639010019247
从全球贵金属价格操纵案看金融市场严重问题,8800,2015-10-04,0.9952019556128645
中国石化1300多亿元新气管道工程项目获核准,11586,2015-10-14,0.45467724378058927
GS对后势的简单分析。,65636,2015-09-22,0.8942518583298193
600028:中国石化2015年第一次临时股东大会会议,11910,2015-10-14,0.350796265570237
赚一点点钱是个标准的庄托,3343,2015-10-14,0.22045619464018973
这个吧里的赚一点点钱和女保安是什么东西？,3810,2015-10-14,0.21661283767089168
能看到娆娆不算本事，能泡到娆娆 算真本事，能,2670,2015-10-14,0.04422920981472234
中国石化正在突破压力位！,50978,2015-10-12,0.9673633330248377
股市盈利的秘密武器；散户必读,16666,2015-10-08,0.9990987498355642
十月行情，比较看好！！！,5987,2015-10-09,0.4058759259595325
中石化元坝气田年底全面建成投产,7231,2015-10-12,0.3858301392735334
中国石化把握好这个机会！,20840,2015-10-10,0.9461671980340489
三桶油被调查高管已超50名 中石化曾称王天普玷,46029,2015-09-19,0.6876865637397094
5.69进入滴，还有比我站得高的吗,9754,2015-09-25,0.6946123125770769
我们办公室有个姐姐很像花千骨呢，非常漂亮。,8043,2015-10-08,0.9986938436276975
中石化天津油库距居民小区仅4百米 搬迁迟迟无进,6408,2015-10-09,0.003911406172239507
你只需十秒，买卖？,3625,2015-10-08,0.35852757616523356
匆匆那些年可爱漂亮的家伙。,6933,2015-09-15,0.9852600300325188
如果明天中石化涨停,10552,2015-10-06,0.22669215381646313
明天中石化的开盘价猜想？,6741,2015-10-07,0.732006342407744
死亡成交量频现，大盘已到底部区域---大正看盘,8570,2015-09-11,0.6135857386711273
港股都跌到4.48元了，做股票要现实些，客观些！,9615,2015-09-30,0.6069005921206896
个人感觉今天是个机会，可以适当抄底。,11622,2015-09-23,0.6839756451933289
买了中石化，担惊受怕头都炸，进了中石油，解套,7761,2015-09-30,0.190191460160701
扪心自问：到现在为止你找到人生的价值点了吗，,6790,2015-09-30,0.7085857617954872
俄罗斯一炮，大宗商品都要暴涨，石油，煤炭，有,9769,2015-10-01,0.11039310002182634
希望明天会更好！,5411,2015-09-15,0.5950113463295311
各位师傅，大家好，新股民报到，请各位师傅指点,3486,2015-09-28,0.04380519639962277
我猜会破4元到3.5元左右，有没有相信的？,67706,2015-09-28,0.03162282754545531
不破除这两个死结中国股市将永无宁日！,9156,2015-09-04,0.8217590494428683
长期投资中国石化，一定赚钱。理由：,8525,2015-09-17,0.4343144235599615
油气改革概念将迎政策风口,73612,2015-09-20,0.7969288315247636
女保安419其实是庄托,3768,2015-09-21,0.2110738184032107
20万股中石化每年分红够我日常消费了！！！,6009,2015-09-22,0.10551290879606989
石化行业“十三五”规划 7股洼地,7366,2015-09-19,0.1319147828260313
无数股民痛不欲生，由此，《黄河大合唱---股票,11511,2015-09-17,0.9730825335055024
600028:中国石化2015年上半年度A股分红派息实施,83374,2015-09-16,0.22933432131208142
蛋哥：大胆满仓！ 等了一个多月！终于确定了大,24557,2015-09-14,0.5470997482605181
中石化引入职业经理人一周年 董事会或将年内完,7787,2015-09-17,0.9408812498307451
A股命系国企改革成败 改革牛十字路口,34450,2015-09-17,0.9913226971476835
石油化工行业：期待体制改革尽快推出,8259,2015-09-16,0.9803566009680525
中石化月线四连阴,5678,2015-08-31,0.33101227377268494
中国石化的选择题：整体上市还是分拆上市,70798,2015-09-15,0.8836164054732761
中国石化：主力的意图明显、明日将有大动作上演,4294,2015-09-14,0.8849951576286763
中国石化：让我们荡起双桨！ 重回石化吧发帖的,7303,2015-09-01,0.004592060587645164
哥看不下去了，太欺负散户了，果断出手,66964,2015-08-24,0.2184561230420864
再晒交割单,27805,2015-09-02,0.5325443950901657
600028:中国石化关于召开2015年第一次临时股东,14937,2015-09-07,0.21052286976661294
后期走势预判,6389,2015-08-27,0.8901750077275126
昨天虽然没有暴跌，但是创业板百点的跌幅依然让,3539,2015-08-27,0.9140335352551742
大盘危难之际，中石化理应挺身而出,2551,2015-09-10,0.5389818879888552
交割单,5862,2015-09-08,0.5
有迹象表明，中国石化即将腾飞,6218,2015-09-09,0.24541645650280752
学着看淡一些事情，才是对自己最好的保护！,13281,2015-08-27,0.7909913727206386
底部已现,3065,2015-09-07,0.14376360504365737
中石化中报点评：零售业务被低估,7393,2015-09-01,0.1302989263241494
对破净运行，我严重怀疑公司公告的准确性,4121,2015-09-08,0.13321129203772042
中石化能买吗,14324,2015-08-26,0.3448808307046367
三桶油整合大戏即将上演！,37277,2015-09-06,0.32533870428259193
600028:中国石化第六届董事会第二次会议决议公,40027,2015-08-26,0.09941892441149713
中石化已与俄罗斯西布尔集团签订战略投资协议,7141,2015-09-07,0.8275998627469916
中石化将参股俄最大石化企业西布尔,8559,2015-09-06,0.12066900542187409
中石化收购俄油两家子公司49%股权,28910,2015-09-03,0.7340438522772
晚上出去有事,才回来,看到了中金所经深入研究和,74401,2015-09-05,0.2113445824285748
中石化港股今日大跌 对此合同不认可？,11109,2015-09-04,0.26938011040532395
普京来了趟中国 中俄签了什么,24764,2015-09-04,0.5933629562009746
中石化与俄石油将联合开发在俄两油气田,95845,2015-09-04,0.022785640491659986
600028,4712,2015-08-31,0.5
@wps123456789,6498,2015-08-29,0.5
关闭股指期货，还股市一片蓝天，给散户一条活路,5157,2015-08-19,0.5684779899762695
上调H股评级,8707,2015-09-01,0.2847096815186475
【调查】亲，你今年赚钱了吗？,4586,2015-08-31,0.37549775014333575
oooooooo  不惧暴跌，看好后市，继续抄底通吃 o,9744,2015-08-24,0.13279508960988073
杀牛人强烈呼吁：暂停股指期货交易！！,4444,2015-08-25,0.08659875618893387
中石化炼化工程中期收入同比降7.7% 出现负增长,7682,2015-08-31,0.9562233873400313
坚持信念，长期持有中国石化,7974,2015-08-29,0.518174013842286
踏破铁鞋·,4253,2015-08-25,0.833099349796071
王玉普：一带一路油气先行 中石化海陆双栖有可,9584,2015-08-27,0.9990122839482096
今天我把融资买的15000股卖了。,7715,2015-08-27,0.5037098432032299
中石化上半年赚244亿拟现金分红109亿,9865,2015-08-27,0.2671478214095022
博弈与对垒,3733,2015-08-26,0.7297953905324696
油气改革总方案正征求意见 油气管网分离是重点,9976,2015-08-27,0.9963623843758387
中国石化涨逾1% 中科汇通跻身第四大股东,8801,2015-08-27,0.30194174663610784
油气价格下行，上游亏损可能扩大,8717,2015-08-27,0.08706967966812396
600028:中国石化2015年半年报,16188,2015-08-26,0.19208468367235354
中国石化中报净利244亿下滑22% 拟10派0.9元,88439,2015-08-26,0.6509775344518006
中石化年报主要数据,5943,2015-08-26,0.266457018961758
中金所对164名客户采取限制开仓1个月的监管措施,18774,2015-08-26,0.08841381583299901
【讨论】中石化的走熊能否换来中小创的再次雄起,6558,2015-08-26,0.6726545870930527
老乡们，哥受伤了，待到春暖花开时,6012,2015-08-25,0.9548029227077852
中国石化：终于到底了。 大胆买进，大胆持有，,29133,2015-08-17,0.784573252011138
晚饭全体股民都是绿豆芽吧,3081,2015-08-25,0.9513583574892368
中国股市：强者生存！ 蛋哥； “做股票做的好的,6699,2015-08-22,0.9950050947879742
我觉得不是人为在做空,3220,2015-08-25,0.13073661479652154
【讨论】中国石化是否能再次为了护盘而暴力拉升,36767,2015-08-24,0.7571649554707709
股市暴跌破位，后续不乐观,2979,2015-08-24,0.9838261475145927
中石化10.9亿美元收购哈萨克斯坦石油资产,24186,2015-08-24,0.7357865000343718
中国石化今日超大单流出排名第15名(08-24),8953,2015-08-24,0.20569223300727557
5.03全仓了。 赌一把,7723,2015-08-24,0.74902667583175
，弱势状态下的中国石化成交换手仍在继续下降。,2836,2015-08-21,0.6414056727696933
女子生来不彷徨 保家卫国离故乡 安居乐业胜利时,3455,2015-08-21,0.9502588050142226
玩成语接龙：穷途末路,4435,2015-08-21,0.8724196626927738
5178点开始，大盘进入熊市模式《大盘分析》,2190,2015-08-24,0.9679604556728337
到了最危险的时候每个人被迫发出最后的吼声！,3329,2015-08-23,0.7432476005565056
石油价格战：低油价下的博弈,7318,2015-08-22,0.3164939959487988
【讨论】中国石化下周是否会为了护盘而暴力拉升,29865,2015-08-21,0.8251411369239783
石油价格战2.0：中国或能利用低油价成为赢家,60228,2015-08-22,0.7605172515470072
外媒：中国石化10.9亿美元收购哈萨克石油资产,14522,2015-08-21,0.7080008490037099
中石化元坝气田项目年底建成34亿方净化气产能,132102,2015-08-20,0.15858384350599852
【讨论】中国石化何时才能真正崛起？ ,28177,2015-08-19,0.7425323023146423
中国石化(600028)融资融券信息(08-19),5352,2015-08-20,0.7210047151351948
相比较港股和A股的中国石化价格,7620,2015-08-19,0.3725372640220391
