标题,帖子数,日期,情感
保险公司热衷收购房企股份 港媒：购买风潮将加,117987,2016-01-03,0.9758088200704467
国寿老鼠仓涉案金超9亿 副总非法获利1594万,25402,2015-12-04,0.06596548428253257
外媒称中国人寿10亿美元入股普洛斯美国仓储业务,11306,2015-11-05,0.4861437583403959
中国人寿海外再出手 拿下伦敦一写字楼40%股权,7767,2015-11-30,0.9738807359940689
601628:中国人寿关于认购中国邮政储蓄银行股份,31553,2015-12-08,0.3291377290247506
中国人寿拟斥资130亿元参股邮储银行,37323,2015-12-08,0.4683328573732193
再送一单大海你看得懂吗？,7952,2015-12-01,0.38188650780442557
保险板块涨超2% 中国人寿领涨,20573,2015-12-24,0.5990198889306131
大海就是你妈个二百五，小丑，不天天叫到你要死,79797,2015-09-10,0.42377872150559814
随时满仓蓝筹迎接明年申购潮！,9053,2015-12-02,0.9841603701944879
日日操大海……蛋疼仔……好吗！,23176,2015-10-23,0.9282094232185606
建设银行一一流通盘和万科一样大,业绩更好,7367,2015-12-02,0.9800733201443125
再送一单大海蠢货收,12958,2015-11-13,0.1947737808024531
疯狗大海在人寿最少亏几百！哈哈……,10312,2015-12-05,0.5910293658624248
中国邮政储蓄银行成功引进战略投资者 融资规模4,87032,2015-12-13,0.9984264932396675
保监会鼓励险资参与京津冀交通建设,9390,2015-12-04,0.9910635692949146
个税递延型养老险政策12月出台,15358,2015-12-03,0.5961296138054231
养老金隐形缺口扩大 个人税延型养老险政策年内,11010,2015-11-30,0.8272850063018665
个人商业养老保险税收优惠政策望年底前出台,8685,2015-11-30,0.5126670610105433
地产与保险你中有我 17家险企现身28只地产公司,11667,2015-11-26,0.15344203759310626
资金加速调仓换股 大金融洼地效应显著(名单),28567,2015-11-21,0.8065477467799631
利空！市值配售是汇金证金、大股东与小股民争利,11041,2015-11-07,0.7232680566069504
今天又赚钱了，大海妈今晚又想爽一爽！,67924,2015-08-26,0.428310147899406
全红了，把融资额清了-151104,4865,2015-11-04,0.837442367257568
中国人寿重庆违规销售被罚 产品仅列最大合同收,16277,2015-11-06,0.04017201661700309
中国人寿谋求入主银行 广发与华夏均在列,24300,2015-10-29,0.6346308548003999
估计错了 -- 151030,6585,2015-10-30,0.3834098120032723
10月29日股市早盘内参 QFII新进32只个股增持21,16143,2015-10-29,0.0847476651974618
中国人寿谋求入主银行 “相亲”广发和华夏等银,17595,2015-10-28,0.9842422928243184
中国人寿三季报净利增22.8% 证金汇金持有6.6亿,6220,2015-10-28,0.8575159027692624
601628:中国人寿2015年第三季度季报,7469,2015-10-28,0.8520163712096734
大盘反弹行情还没有结束！,6143,2015-10-22,0.9268890702678639
有良知的老师会告诉你：赶快清仓离场……1,24812,2015-09-11,0.988735866483472
3千点是上帝送给我们的礼物！,3766,2015-10-08,0.6799539788788921
人寿折腾大半年了，我想静静,12054,2015-09-01,0.7675330930435339
中国人寿 2015年小单T实录，大海过来看,6136,2015-10-10,0.9353285958598337
大海BB 被B 空了,2697,2015-10-12,0.5291418642486839
一不小心卖了又一不小心买回,1888,2015-09-09,0.006714255331704555
扒一扒十大超级牛散的投资手法 你和哪位神似？,5680,2015-09-19,0.9160936890418445
一张图告诉你，朕是如何吸筹砸盘的……  3,3055,2015-09-03,0.19041853904597483
解码十大超级牛散:投资手法各有差异 财富惊人,8008,2015-09-18,0.5219105401666696
大海BABA,恶空该沉默了,2046,2015-09-09,0.760137486970071
中国人寿1-8月保费2775亿 同比增17%,2657,2015-09-15,0.9174603553004375
9月10日晚，警告：中大阴线马上降临,1938,2015-09-10,0.483905195424603
9月9日，连续多日的恐怖缩量为后市的暴跌奠定了,1595,2015-09-09,0.3807525605782752
大盘阶段性底部再现！,1242,2015-08-27,0.7362320801892063
抄底途中--150825,1696,2015-08-25,0.10843357540888732
放心：天是不会掉下来的！,1281,2015-08-23,0.29959853547566395
8月27日国内四大证券报纸头版头条内容精华摘要,5062,2015-08-27,0.5038273222420883
【讨论】保险股尾盘暴涨，它才是真正的救市先锋,1208,2015-08-27,0.22634849162197812
机构一致看好 10股或成反弹先锋,8480,2015-08-27,0.055726343355927965
229股涨停揭秘:沪指大涨冲击3100 金融股暴力飙,3632,2015-08-27,0.940264583208812
业绩符合预期，寿险业务良好,2201,2015-08-27,0.6584806836991175
8月25日盘后分析，12元必破,1102,2015-08-25,0.031240630402241454
中国人寿中期净利315亿 同比增长71%,1825,2015-08-26,0.954655183140235
【讨论】人寿奋起拉升 可否使大盘转危为安,1097,2015-08-25,0.8671302133902288
忙碌一天，做个汇总-150824,1201,2015-08-24,0.19469694410396599
大股东中国人寿大规模认购背书  远洋地产百亿公,4621,2015-08-25,0.8935106431418485
中国人寿今日超大单流入排名第5名(08-24),1301,2015-08-24,0.8534607157040511
本周亏大了，旧贴也顶不动了,1189,2015-08-21,0.07858524266738065
