标题,帖子数,日期,情感
老Q：投资谋略（第二季）聪慧不可尽，贫贱尚需,1406183,2017-07-01,0.985188584768978
兴业银行（601166）：5年之内，必涨3倍！,91496,2017-06-28,0.6932793823264618
25之前卖兴业我不敢说你错但肯定不对。,29954,2017-07-12,0.014001229881929533
sb主力年年有，今年特别多。有种继续砸兴业,19151,2017-08-10,0.190410297451303
便宜有好货，好货有便宜。,963382,2017-06-16,0.7072234665687198
散户必看炒股格言和现金策略！     孙子云：先,42448,2017-04-09,0.08037291965991733
实战炒股口决： 十四工作线，来回做波段；突破,51687,2017-04-15,0.986755970349184
本人在17.61融券卖空2万股，狗庄有本事拉到30元,127736,2017-07-12,0.006597357175916918
兴     业     抄     底     价    位     ： ,27856,2017-08-08,0.448447195891729
机会摆在大家面前就看如何把握了,92983,2017-04-19,0.9653164516914159
为什么工行都创出历史新高了，兴业怎么还在破净,13143,2017-08-23,0.773811246734135
大笑大笑 咯咯咯咯咯，晨鸣三年利润之和超现公,18334,2017-06-26,0.9969774902521022
咯咯咯笑，晨鸣三年利润之和超现公司市值。 今,23051,2017-06-26,0.9531210882448131
兴业的市盈率到三十倍,98889,2017-04-26,0.3396678024219001
弱者道之用,73381,2016-12-26,0.4981527343955531
邀请你过来西部矿业601168一起发财！即将公布重,30778,2017-06-27,0.31024760465510837
16只老银行股2017年中报简评及估值比较,10015,2017-09-02,0.011282975033062415
[重大事项]MSCI Inc.来了，漂亮50必将是永远中,8734,2017-06-21,0.9936199910704042
同业之王兴业银行营收大降 同业缩表、资本充足,32703,2017-08-31,0.9914002571266266
攻市场4000点之前，可大胆进行低吸的10只潜力个,29519,2017-08-07,0.9598107761116244
当下可底部大胆建仓的超跌低价潜力黑马个股,18810,2017-07-28,0.4763965513284031
吸纳：中长线必将走牛的小盘潜力成长个股,19544,2017-07-27,0.9994418282625313
攻市场4000点之前，可大胆进行低吸的10只潜力个,37311,2017-06-22,0.9598107761116244
这类个股有望成为2018年中的超级大牛股之一,33917,2017-06-16,0.5903747256913198
这里有金矿已有人开始在偷偷挖掘,25072,2017-05-25,0.9693449217380475
兴业银行携手中升集团加快布局“汽车消费金融”,15174,2017-09-01,0.576838948379203
比较创业板与纳斯达克市场的投资价值,6976,2017-08-07,0.9718109383505693
周期股涨完，来个530股灾然后才是银行表现时候,14573,2017-08-07,0.1948641934222336
垃圾兴业不要涨！,14289,2017-08-07,0.21132347778181493
最新统计数据显示，上半年社会融资规模“表外转,12397,2017-08-07,0.9751814172664972
11灰心万分沮丧的我把情况告诉了芸,7420,2017-08-05,0.5174253456202144
怎么做到的，营收300多亿，利润100多亿，银行的,11538,2017-08-06,0.06236274683888321
兴业银行二季度业绩大幅下滑！,99217,2017-05-18,0.32396550148941206
坚决满仓兴业银行，并持股不动摇，每股30元之前,199429,2017-06-28,0.02111170376252358
这么便宜的兴业银行，你们还要卖，我一直喊30元,169879,2017-07-06,0.15846211687605505
抛！机构连拉股价，制造概念，用人性贪婪，忽悠,15475,2015-09-14,0.9616263649280308
持有兴业银行的可放心关电脑一年,38822,2017-06-05,0.09987177315741513
兴业银行：上半年净利润增长7.34%,11051,2017-08-30,0.6266576635387268
底部拐点确认，重申强烈推荐、组合首选,34814,2017-08-30,0.6102528256256619
对兴业2017年半年报的合理预测,38485,2017-08-28,0.59021580515694
中报速递：兴业银行2017年上半年盈利316.01亿元,51594,2017-08-29,0.15002117230728274
兴业银行净利润增长7.34% 不良双降,13714,2017-08-30,0.4943468776122344
兴业和招商半年报比较差别不大,22808,2017-08-29,0.45130120108952143
601166:兴业银行2017年半年度报告,44857,2017-08-29,0.27518754268693024
上半年兴业银行净利316亿 同比增长7.34%,18388,2017-08-30,0.7179706253972755
兴业银行：上半年净利316亿元 同比增长7.34%,39992,2017-08-29,0.5627570506629315
月K线三连阳，估计要在18元下方横盘一阵了，充,20571,2017-08-01,0.10216712615379975
15.30元左右坚决买入兴业银行,70821,2017-04-24,0.35233355018468204
601166:兴业银行2017年半年度报告摘要,59593,2017-08-29,0.5062808245775542
当下价值投资中兴业银行与贵州茅台谁更有投资价,15287,2017-06-30,0.9964410169758899
兴业银行上市以来6条周均线均向上只有4次！,7886,2017-08-29,0.28776458525842397
三泰开阳，月阳线稳固，8月起飞（追 招行）,15193,2017-07-31,0.22900011239483553
兴业银行杂谈—2017-转帖。当作安慰吧,15003,2017-08-09,0.5658544182392848
兴业与招行比为什么差这么多？,18267,2017-05-24,0.058937973687715584
不出意外本波段预计到23.15左右,14151,2017-08-25,0.5498296511362201
兴业银行(601166)融资融券信息(08-25),9209,2017-08-26,0.6380770554322551
中国股市最大的超级傻瓜究竟是谁？这个问题要问,17501,2016-03-24,0.9789970469580968
未来几年兴业银行2009年的15涨到43的过程大概率,39057,2017-06-09,0.9855531352401634
兴业银行和京东做了一个两年前大家就不玩了的业,44295,2017-08-24,0.1332489463537031
兴业银行(601166)融资融券信息(08-24),6234,2017-08-25,0.6380770554322551
兴业银行与京东合作，大家都去办兴业银行卡，那,11171,2017-08-23,0.08959105114968713
兴业银行联手京东金融推出“小金卡”,38284,2017-08-22,0.8562860426830559
呆子也笑 狂笑 白痴不抢 瞎子狂笑 业绩翻倍 股0,22223,2017-05-11,0.01263553294197095
有4万股兴业银行，成本18.15元，现在赔钱2.92万,47171,2017-08-08,0.042735652664529056
巜纳入MSCl崔生银行股戴维斯双击行情》早日漂亮,53667,2017-06-22,0.9468200677038318
选择自由，选错的都陪，银行股已经连续上涨有一,4764,2017-08-02,0.7162823530524673
2017（上）阿林的四年价值投资之路，增长315.6%,2600821,2017-01-01,0.9863139266806019
养老金入市，在二级市场入选股票标的，可作为参,12858,2017-08-19,0.9749584150319599
兴业每股净资产、收益都略高于招商,21737,2017-08-18,0.8747665024802452
现在买兴业的赚钱速度必将最低达到年收益20%左,14828,2017-05-20,0.982160900155767
兴业银行(601166)融资融券信息(08-18),9563,2017-08-19,0.6380770554322551
早说了中国股市智商最低的全都在北京，国家队随,21329,2015-11-05,0.7025505992495806
净资产 已经 接近 20了，有什么可怕的？,11698,2017-08-14,0.3312337883806846
融券卖出，坚决做空垃圾兴业银业！,16993,2017-07-27,0.05869768522046037
持有到现在已经持有了兴业银行3年零5个月15天，,25489,2017-08-09,0.0075714973894827065
601166兴业银行 银行板块近期持续高位放量回调,4107,2017-07-23,0.07602966328459404
兴业银行(601166)融资融券信息(08-11),10552,2017-08-12,0.6380770554322551
警告：兴行银行被融券做空1396.11 万股，小心闪,29153,2017-07-26,0.014848452086223207
你认为兴业银行有没有投资价值,75139,2017-03-21,0.4584751643772056
特别通告：MSCI指数标的股601958 金钼股份正创,7566,2017-06-22,0.7285582283512549
兴业银行泡沫指数是有目共睹的，装逼早晚被雷劈,10018,2017-06-29,0.3250716733986997
找不到理由：招商银行高出兴业银行50%估值？？,15120,2017-07-26,0.0015018730617510911
抢 瞎子也狂笑 业绩翻倍 季报再增长300%翻倍搖,20231,2017-05-07,0.8557456835457276
兴业银行当前合理价格是27,32175,2017-03-19,0.21294883105764928
净资产收益十几个点，如果公司缺钱可以向全体股,4383,2017-03-27,0.1024330760071096
真是看不懂了，跟招行的差价越来越大，是招行高,12930,2017-08-07,0.19832629589839001
601166:兴业银行关于非公开发行A股股票申请获得,139112,2017-01-12,0.03311401565112326
我是兴业的股东 我同意增发 钱是大家挣的 你不,6725,2017-03-25,0.1172463050079009
招商涨到100元，兴业跌倒10元！,4846,2017-08-08,0.16025611591849032
惨惨惨？ 今日证监会网站信息,12502,2017-03-24,0.8318051279039184
兴业.银行为啥执意要搞破净增发     其实我是为,8719,2017-03-26,0.0007981386376414434
散户反制利器-持筹比例,3568,2017-08-08,0.45590705284672617
银行坏帐真是无底洞,有质压如此,无就惨多多,3869,2017-03-26,0.03585365040342248
兴业银行，持股从此开始了。相信自己的判断，主,17700,2017-06-10,0.5838648600125987
兴业银行为什么没有业绩预告呢？,6175,2017-03-27,0.6083251915449104
增发预案留伏笔，预计兴业将派送高额特别股息！,13418,2017-03-25,0.002081052880577583
兴业银行第九大股东天安财险保险股权结构，正在,18910,2016-11-15,0.05962977383110746
告诉你江铃000550为何严重低估今年必翻番的原因,7025,2017-07-16,0.5445377067919474
狂笑狂抢，业绩去年翻倍股0.99，今再翻倍超2元,14976,2017-04-28,0.12092335635775875
抢盘啦，业绩去年翻倍股0.99，今再翻倍超2元，,13558,2017-04-28,0.12055432136989841
热烈  庆祝数千亿养老金入市买股增值，大型券商,4893,2017-07-28,0.21644451768930628
两个为什么,5917,2017-03-25,0.451171875
兴业银行分行原总监利用放贷受贿70余万,20846,2017-07-24,0.3811437588114236
悲愤，按破净增发，已通过发审会！,8985,2017-03-25,0.03854361037065723
只要大家坚持投诉，低价定增仍实施不了,7593,2017-02-18,0.19676401561877666
集中兵力，炒新的热门板块龙头股票： 1，首先选,5092,2017-01-01,0.7535101215049678
兴业银行睁开你唯利是图的眼珠看看平安发行可转,11569,2017-07-29,0.08166403654958032
让你们反对定向增发，现在秋后算账,6489,2017-07-28,0.5543367931638182
兴业未来三个月（6-8）走势分析,45487,2017-06-01,0.8975706005286439
又到年终总结时，阿方2016年的成绩。,75623,2016-12-30,0.8334190379800451
早晚有一天 兴业银行 会到30以上。那 我就可以,9586,2017-07-31,0.04344196217466467
601166:兴业银行非公开发行A股股票发行结果暨股,49580,2017-04-10,0.06388250425049335
16.39买入兴业银行。,84236,2017-05-25,0.5087022611889793
兴业银行走势持续偏弱 短期风险继续释放中 游资,10328,2017-07-20,0.6993872656484684
提前预测兴业银行上半年业绩同比增长8%，每股业,18375,2017-07-26,0.9547243360889975
七月看兴业，招行退二线。,22724,2017-06-28,0.6886189711694083
601166:兴业银行关于注册资本变更获中国银监会,44837,2017-07-26,0.9334895332027906
兴业银行走出两年盘局。 兴业银行在股灾前历史,35135,2017-07-14,0.6218648800317171
银行股真的只是护盘那么简单? 实质上A股优质低,16496,2017-07-11,0.007394756431966298
综观50指个股、唯银行股可再向上、其它个股已估,5279,2017-07-21,0.00831979442662567
进场: “双重改革”受益股,社保养老金标的股,4625,2017-07-29,0.9893200488469195
小脚女人,8207,2017-07-19,0.47412264644500113
抛！经济恶化,拉股价，用人性贪婪，忽悠股民在,23226,2016-01-29,0.8250483988915179
601166:兴业银行公司章程(2017年7月修订),33728,2017-07-26,0.35248511843542685
实话实说：兴业银行股票每天净增值1分钱，为何,13495,2017-07-20,0.07509637060526408
低估值城商行——最后一块价值洼地,29089,2017-06-25,0.8728883994411621
2017年的下半年将是大象起舞阶段,20426,2017-05-17,0.9801190114028412
持有兴业好长时间了，,7949,2017-07-17,0.39681935566738225
六月你不入手，七月兴业离你远去,37427,2017-06-12,0.6662299801611904
市盈4.89还要卖？,13031,2017-06-14,0.07298330247601736
A股超级大盘蓝筹股价值投资的定义一定要先搞清,45647,2017-01-11,0.7099270110455238
加仓买进，进行第一次加仓买进,22728,2017-06-09,0.10327437482017732
兴业银行、中信证券和平安银行今年都有翻倍的大,51640,2017-06-01,0.19269907079684645
宁波银行  4.44%,6282,2017-06-28,0.060056632607899174
一些投资界大V天天指责国家队，其狼子野心昭然,12531,2017-05-13,0.993902000953562
数据说话， 兴业银行上市十年， IPO首发10.01亿,15340,2017-06-28,0.19083738370673653
种下一棵摇钱树 赢得广厦千万间,33195,2016-10-29,0.8567668724050597
兴业银行二季度业绩稳步增长，机构已调研，正拉,17055,2017-07-18,0.686126536294752
兴业银行等A股优质低估值银行股与欧美优质银行,23047,2017-07-12,0.21000043895005793
兴业银行挺进全球银行30强 成本收入比第一 07-0,36150,2017-07-04,0.5919276410767952
基金抱团炒个股是中国式庞氏骗局，隐患危害大16,23830,2016-07-21,0.8319286191339242
入M后南京银行、兴业潜力最大,16885,2017-06-22,0.41323827443704775
大盘翻红了，银行又可砸盘了,2222,2015-10-22,0.32514013119862795
抛！机构连拉股价，制造概念，用人性贪婪，忽悠,39573,2016-03-22,0.9616263649280308
明晟MSCI此时设MSCI中国指数正当其时。,21405,2017-06-15,0.725054625960472
听我的话准没错 中小散户要远离银行股 超级大盘,6549,2017-05-12,0.05626154386194859
去你妈的,43823,2017-01-07,0.4869103343988235
兴业银行除权价15.55元。长线持有。,2051194,2016-06-05,0.18275138910453137
银行反弹的第一步10倍市盈率，第二步15倍，第三,13830,2017-06-17,0.4871415370655291
2017半年度股票投资收益报告(06.30) . 期初账户,12844,2017-06-30,0.9961941621480255
今天不上车，兴业明天开始就不会给你上车的机会,15639,2017-06-02,0.19571809242010074
价值投资首选兴业银行,13622,2017-03-29,0.9937985757002552
告诉你们 兴业银行下半年跌破15元！,40695,2017-02-14,0.011690243567401226
“国家政策是真理”是个SB,真它妈的理,21050,2017-06-11,0.7279408496674333
兴业银行架构之变：四大虚拟总部替代三大条线总,23136,2017-06-30,0.9880912390137009
差一分钱没成交！郁闷郁闷！挂单16！最低16.01,4284,2017-06-23,2.7652523486354497e-05
601166:兴业银行信息披露暂缓与豁免管理办法,32202,2017-07-03,0.35107777981701305
高送转龙头英维克大跌23%,这里赚钱的可换股!,2456,2017-06-28,0.04261715538067834
A股随笔。,23290,2017-06-18,0.7848272212204557
兴业银行是大周期下跌中     跌回6天还是可以的,24799,2017-05-06,0.08642536978156068
加大波动幅度，今天第四笔了！牛！下午再跌回来,1679,2017-06-23,0.12464086998361501
兴业银行有大资金吸筹，很明显的盘口,32426,2017-05-04,0.7861661484308899
兴业银行非常适合用来压仓打新股,10312,2017-03-30,0.13965095197882882
好怕怕！兴业2020年底净资产30元业绩4.5元,15422,2017-05-10,0.10179262180691029
终于看见有点买盘了 15.82进来了 呵呵,15037,2017-06-16,0.4143763410834401
欢迎 在此大量做空，就是要将空头 消灭在这里。,1469,2015-10-22,0.4182376783950412
"""一带一路""超低估值才是财富__________________",22030,2017-05-13,0.9377853872176715
兴业银行，即将拉升！,33602,2016-04-22,0.3452498212731643
抢权进行时。 终于见分红实施公告了，股权登记6,23017,2016-05-31,0.3200588071873063
中国基金真是傻的可以，全在炒亏损股,4672,2016-06-03,0.2617491245540119
兴业银行一季报解读,31142,2016-05-16,0.6994125886109135
恶炒不死，股灾未已！,9811,2016-05-17,0.09040156671228661
分红到账48800，周一加仓30手,14138,2016-06-04,0.05839783377157859
601166:兴业银行2015年度优先股股息派发实施公,80865,2016-05-30,0.160904147572274
老子别的没有！就是有信心！！！,11545,2016-03-16,0.81177726969249
兴业银行完成首笔债券通一级市场分销,14950,2017-07-03,0.512198334850134
今天的星是尽头星吗？,4226,2017-06-29,0.25748752739088643
威孚高科： 360度大转弯 必将弯道超车变成超级,2978,2017-06-29,0.9765689378264211
最新数据显示，洋鬼子沪港通资金这几天在疯狂进,13243,2017-06-29,0.5321866171594214
兴业银行，为什么必过19元,18386,2017-06-29,0.08489936225852723
问一声唱衰的，填权没？,10963,2017-06-26,0.06855138308757125
兴业银行股你们都拿好没卖吗？明知道兴业银行现,31418,2017-06-25,0.07425487316292956
定增股东套利，损害中小股东，兴业无耻不顾反对,20280,2017-05-31,0.019745263894839993
银行股最大的缺点就是夕阳行业，未来成长性差，,11268,2017-06-12,0.9920292467385677
兴业遭遇10亿自有资金理财飞单,13516,2017-06-25,0.728587085495141
坐等分红，全部家当都 在兴业,22632,2017-05-29,0.2511748124835512
恭喜大家，恭喜中国A股，入摩成功。我再一次向,30900,2017-06-21,0.9248547294660546
兴业银行低价定增，举报！,16912,2017-03-21,0.27403265572903834
港股内银股暴涨，A股还是死样,5584,2017-03-16,0.14228393683796225
兴业银行已经加仓到33万股，目前亏损20多万元,65909,2017-05-06,0.016845417404545482
兴业银行，从今天起三年之内某时30元见，14.99,28171,2017-06-16,0.22077928258412505
二线蓝筹兴业银行，五倍市盈率，全行业最低。业,18272,2017-06-15,0.7035394842940804
加仓兴业银行,4547,2017-06-11,0.13905662083414427
大股东坑小散排行： 1平安银行 2光大银行 3浦发,10241,2017-06-17,4.865124135455812e-05
601166:兴业银行2016年年度权益分派实施公告,128507,2017-06-06,0.385404564061845
坚决满仓兴业银行，持股不动摇，兴业银行日、周,35810,2017-06-10,0.012852299119058275
咦？分红了？,9606,2017-06-14,0.5
兴业银行17年一季度每股净资产17.58元，每股收,31921,2017-06-11,0.021147480755656534
把红利补仓的人请举手.,13122,2017-06-14,0.5768298080458554
兴业千万别学招商，分红0.74元等于缩水了,5552,2017-06-01,0.02155892419172356
是金子总会发光,7853,2017-05-30,0.6430100135392368
兴业银行，目前价位贵不贵？一看国内同业性价比,23152,2017-06-07,0.8201074199803405
虽然分红了，钱也到账了，但股价折算之后，我发,16826,2017-06-13,0.25407655749070013
分红买入等填权,3565,2017-06-14,0.7085923308003611
2015年中央汇金公司通过减持银行股同时转账至子,10674,2016-08-27,0.07239622159529446
持有兴业五年多收益,16255,2017-06-11,0.9006958352076799
神奈川777,股友FtdyLz,股市无底裤,纳尼斯托克,,14987,2016-07-09,0.8121316952197316
只会迟到，不会缺席,30994,2016-11-11,0.7239279818429455
为什么要买入银行股的几个理由,21315,2016-12-26,0.12731185519785793
高盛/高华资深中国宏观经济学家宋宇做主题演讲,8704,2017-05-30,0.9999276649194618
美国银行24倍，花旗银行22倍市盈率,12492,2016-12-26,0.13727196437423161
601166 人好少啊，都去哪里了？wg,18555,2017-03-06,0.6007557001774082
兴业银行获期货存管业务全牌照,22326,2017-06-07,0.4126132397570048
我对分红的一点理解,19728,2017-06-05,0.5670399378003729
银行开始分化,8282,2017-06-07,0.2986479332114579
业绩最好的兴业银行市盈竟比工商银行还低,你说,14715,2017-05-27,0.016609925147543447
博鳌观点   英国罗斯柴尔德投资银行CEO：移动互,1772,2017-06-01,0.8617180953831888
音乐欣赏---王若琳演唱的 花样年华,34913,2017-03-25,0.9996598256273981
"""国家政策是真""的良心坏到极点",8049,2017-06-01,0.2768094678209353
浅谈市盈率的意义,10374,2017-06-01,0.4655957422983503
苦海无边回头是岸！,10012,2017-06-02,0.8581281864482353
外资QFII绝不会做低估值价值投资之类的蠢事，深,7945,2017-06-02,0.9612696277776106
兴业2020年底净资产30元业绩5元,7083,2017-05-14,0.056683711890884836
当国家政策是真理这帮人唱空时,10315,2017-05-31,0.8566809352447361
兴业银行融资额大的唯一缺陷是,23824,2017-05-02,0.38717350801926853
银行哪家强！请看排行榜！ 职工收入哪家强？浦,15772,2017-05-26,0.07279735150626654
关于股东大会投票结果的疑问,7305,2017-05-27,0.8294928541677501
兴业银行比招商银行盘子小,其他指标也不弱,为什,17193,2017-05-26,0.010682221567917538
兴业2017年业绩应达每股3元.9倍市盈率是27元.持,13810,2017-05-26,0.05232907968109113
高盛调降中资银行股评级及目标价 在美国股市中,6695,2017-05-29,0.9967079583237448
中国烟草近期增持兴业银行9亿股。 昨晚公布的股,24247,2017-05-27,0.01649912715685453
兴业银行将会暴涨，如今年A股6月9日入M成功，那,59102,2017-05-13,0.026897078281732267
“国家政策是真理”是个有人养没人教的野孩子，,10719,2017-05-16,0.9965970386456233
601166:兴业银行2016年年度股东大会决议公告,63685,2017-05-26,0.5282568275590767
兴业银行和招商银行、浦发银行比起来缺的是对中,13290,2017-04-29,0.030279408662417184
基本面反转，性价比凸显，重点推荐,111563,2017-05-26,0.9878957952808503
拉升这么慢是为了吸引小散进来吗？,4424,2017-05-25,0.10538429396077609
今天兴业股东大会，别忘了投反对票哦,6872,2017-05-26,0.7241575791874876
和中国平安同一天同一时间发生闪蹦时件后，平安,12460,2017-05-24,0.024865696043651297
如果贷款不增长或微增长，银行将会迎来高比例分,12300,2017-04-28,0.7968369290977048
兴业银行08股灾后2009年去了43元，再去也是完全,8360,2016-03-16,0.43903215531104844
兴业的基本面比招行好，可是股价差了六七元，兴,9774,2017-05-24,0.15476882523916846
兴业银行持有5年会怎样？,13493,2017-05-17,0.10698001400436685
“国家政策是真理”是一只可耻的空狗在乱叫，真,7594,2017-05-14,0.6061155821556926
你们落伍啦 人家高盛巴菲特价值投资不买市盈率,6289,2017-05-21,0.9998180607380271
兴业银行可以放开大涨了的几点理由,21401,2017-05-03,0.4600930936976072
2016年年报及2017年一季度季报,64590,2017-04-28,0.7315683257007307
令人气愤的股评，到底是什么意思,11998,2017-05-13,0.0147773355101265
现在买进兴业银行后，5年后来看，会怎样？,13013,2017-05-17,0.22629169007468142
银行股一直不让涨是加入MSCI的投名状？,5377,2017-05-05,0.11043391407153424
兴业银行今年至少要突破20元,21514,2017-05-02,0.5811656870495236
兴业银行的股价，比招商银行低了将近5元了，谁,9312,2017-05-15,0.08253317238933011
兴业中报巨亏，赶紧卖出,10328,2017-05-15,0.006874615571493603
601166:兴业银行2017年第一季度报告,67468,2017-04-29,0.5944017499447246
兴业银行(601166)融资融券信息(05-12),9597,2017-05-13,0.6380770554322551
我已满仓兴业银行，我是价值投资理念的人，现在,47289,2017-05-04,0.8310912101876251
今天抄底，先拿5年翻倍再说。,7052,2017-04-17,0.25786206409849877
负债结构仍有继续调整压力，但基本面亮点颇多,37468,2017-05-11,0.9954989523814184
兴业所得税率低的原因。 电话咨询过兴业，说是,6636,2017-05-01,0.003881268921532177
兴业银行这次超预期了：2.77利润，分红0.61正常,16079,2017-04-29,0.09581673667886381
今晚竞猜,13260,2017-04-28,0.32081015946146185
垃圾，有的公司一下子要上传30多个文件,7891,2017-04-28,0.13239303997150675
赞扬有眼光长久坚持持有兴业银行的广大投资者,28702,2017-04-20,0.9272022202988879
独家专访兴业银行行长陶以平：轻型银行谋定而动,21470,2017-05-06,0.0028099741243362564
这次兴业银行大跌是奔着9.5元的债转股去的。,10070,2017-04-21,0.276611198006703
愚昧无知！殊不知兴业银行未来几年已经负增长板,14196,2017-04-23,0.6664101282017972
兴业银行PE仅次于农行，为深沪股市最低市盈率，,12155,2017-03-20,0.3418871748962202
证监会：请依法常态化监管治市！查处操纵股价的,23781,2016-08-17,0.897761891575638
精神病与中国金银网就是一人,4821,2017-05-07,0.41758160867359106
17Q1营收同比下降15.57%，资产质量改善明显,36097,2017-05-07,0.29832981719183493
现价买入16.06元是净资产17.80元的0.9折.,41204,2017-03-30,0.33244962583064774
全体小股东联合起来起诉兴业银行,19135,2016-07-25,0.13207381645554706
举报兴业银行低价定增，操纵证券价格的行为，希,5512,2017-03-21,0.9210380253001945
大家都去证监会网站投诉增发,6363,2017-03-26,0.03375540895434148
已经向证监会反应兴业银行大股东欺诈,9944,2017-02-22,0.017357628083668586
养老金大规模入市将在跌破3000点时,5511,2017-01-25,0.09982522535167948
价值投资的实质是一种信仰？,7145,2017-05-05,0.9944019306214064
之前还说乌龙指，现在才发现其实是先知先觉。,3701,2017-05-05,0.7636793342159527
卫星图显示朝鲜最尖锐炮兵高度警备状态,2907,2017-05-05,0.9170205428256478
15.10元面向原意锁定十年的全体股东们定增行吗?,11944,2017-03-29,0.4177641209500428
用2418万股从16.07元恶意砸到15元的行为天理难,20729,2017-04-12,0.006511405210706811
601166:兴业银行关于召开2016年度现金分红投资,68275,2017-05-02,0.3044481095010816
16年报,27543,2017-05-02,0.15381395352167793
我看好兴业银行几点理由,15917,2017-04-30,0.06352637299719943
资产质量继续改善，业绩反转趋势明确,14641,2017-05-02,0.8731758769838411
兴业银行一季度净赚168亿 增逾7%,16999,2017-05-02,0.0433963025650147
银行股估值对比分析,21949,2017-04-29,0.46865862265270575
