标题,帖子数,回帖数,时间,情感
提议让云龙当大秦董事长，接替东福,4021,20,2017-09-01 22:12:00,0.8399243794949061
上半年净利润翻倍，股价仍处低估水平,26873,16,2017-09-04 13:23:40,0.8946006652671866
对今后大秦的看法,16445,35,2017-09-02 08:39:53,0.6429335818357281
半年报业绩超市场预期 运量反弹贡献主要业绩增,18085,7,2017-08-30 18:10:14,0.9878626517625159
咯咯咯 哈哈哈 晨鸣三年利润之和超市值。 今年,20712,39,2017-06-26 11:14:57,0.9975077488646191
哈哈哈,回来一看,"那个叫id萨呆啥的""山西人还爱",6815,25,2017-09-03 07:07:44,0.8684210526315791
大秦--全球顶级抗癌药，中国拥有自主研发产权,8990,9,2017-07-30 20:42:03,0.9997878165850281
大秦铁路最好的光阴是当下,39940,32,2017-09-01 15:44:15,0.9618944525539129
A股市场就像小孩，需要呵护,18942,33,2017-05-25 10:51:29,0.8999865365494804
对“大秦铁路最好的光阴是当下”这篇评论不敢苟,8111,12,2017-09-02 07:38:00,0.7005983998414879
灯下黑，山西人是不会看好大秦铁路的……,3027,7,2017-08-09 23:20:43,0.14215384579075363
放眼未来 作好布局,44428,75,2017-04-10 00:09:44,0.9813563967913842
真诚奉劝大秦的朋友们,22186,37,2017-08-29 19:12:35,0.050525585837683074
散户必看炒股格言和现金策略！     孙子云：先,51229,86,2017-03-27 10:22:59,0.08037291965991733
大秦铁路与铁龙物流不一样,14894,23,2017-08-23 16:31:13,0.602698773085549
今天大秦走势有意悲观，可能今晚上浮运价！,6815,23,2017-09-01 15:09:39,0.9156017669505369
《等待》,13584,27,2017-05-19 17:44:00,0.45255474452554734
守望，大秦 是一種信念~,28446,54,2017-04-24 11:32:57,0.8611630297213672
《大秦铁路》－国之大秦，中国唯一 世界第一！,48469,88,2017-04-14 13:56:49,0.971364866604646
兄弟们，国之大秦即将用震烁古今之力大力向上开,7659,18,2017-08-27 22:42:30,0.98818947891493
等待《公告》中报业绩……,10915,26,2017-08-29 15:08:26,0.7418905145240178
静一静，大家想一下，在大秦铁路、广深铁路和铁,28133,40,2017-08-21 15:05:51,0.9710287170189074
《大秦铁路》之打压篇章 － 市场经常会“犯错”,14478,15,2017-08-29 22:17:50,0.8877672302322449
云龙如果不是大秦公司的人，那就是个奇才，和小,6276,22,2017-08-29 16:48:01,0.6046581096002684
朋友你们去过黄河吗？你渡过黄河吗？,3222,6,2017-08-29 16:02:55,0.8582103628308354
601006:大秦铁路2017年半年度报告摘要,27622,12,2017-08-29 15:56:16,0.6843513336216378
大秦铁路半年报实现倍增 证金增持,38460,8,2017-08-29 17:34:07,0.4270999624607147
中报速递：大秦铁路2017年上半年盈利76.23亿元,27398,9,2017-08-29 16:15:07,0.2717586867603514
601006:大秦铁路关于发行债务融资工具获准注册,21855,7,2017-08-28 19:25:32,0.8927898871967053
大秦铁路(601006)融资融券信息(08-17),5881,4,2017-08-18 07:47:42,0.7884728735409863
实战炒股口决： 十四工作线，来回做波段；突破,48733,83,2017-03-28 08:03:16,0.986755970349184
上车买票，安全带已系好，准备发车了,15791,30,2017-04-25 10:02:21,0.843880132538333
兄弟们耐心是金耐心是银，天下第一神股即将横空,11594,22,2017-07-12 16:03:34,0.9650408395793398
老李和老张的大秦故事：,6667,8,2017-08-24 15:33:22,0.6730056669764268
601006:大秦铁路2017年6月大秦线生产经营数据简,44980,4,2017-07-06 17:30:36,0.3493732239356975
《民族大秦》之大集成篇章！！,8173,16,2017-08-24 16:44:13,0.8981883059434269
大秦铁路(601006)融资融券信息(08-24),5000,4,2017-08-25 07:46:07,0.7884728735409863
不必看重混改,大秦有它的节奏,7626,10,2017-08-21 22:48:29,0.23274427150653842
弟兄们，务必大胆的唱多，让霄小两面派们统统跪,6691,25,2017-08-21 11:56:18,0.9547088470999634
本土地历来强烈鄙视伟大散户进多了就没有人来抬,5619,12,2017-08-21 12:10:41,0.04015845092990156
前些天本人三处房产抵押银行贷款800多万，然后1,13237,18,2017-07-28 15:23:36,0.026202802077441856
不如银行股涨得快,17090,162,2017-07-26 09:49:22,0.3978703741993541
若“亚马逊”进来，比联通混改更有特色……,8176,22,2017-08-17 11:21:22,0.9036970400119184
大秦铁路(601006)融资融券信息(08-18),8202,33,2017-08-19 08:37:06,0.7884728735409863
岂有此理,8498,15,2017-08-18 10:30:39,0.010480751615932427
弟兄们！见证历史的时刻就快到了，恭喜至今仍然,13725,20,2017-08-16 14:28:58,0.9573548508954761
今天大家又买了，轻松一刻,20718,44,2017-07-26 13:09:19,0.9057763623740719
武当名门张三丰招收弟子，来1万人先扎三年马步,4578,7,2017-08-16 14:05:15,0.8080367250922721
七律·长征（红军主力赞歌）,9612,20,2017-07-07 18:40:54,0.8054594634321707
《今夜我和你有个约会》- 北山献给中国最伟大的,7032,14,2017-07-31 15:58:37,0.9769746129451451
《601006 您的名字叫大秦》,13092,27,2017-07-01 15:04:46,0.4751730431209348
他大舅他二舅都是他舅 走一步退一步等于没走卖,10204,20,2017-06-13 12:37:34,0.7268290049830953
对于现今8元出头的大秦，砸锅卖铁卖房卖车都要,15437,25,2017-06-22 20:43:38,0.05621718373734874
本土地大胆放言大秦铁路即将突发连续大涨 一扫,13202,26,2017-06-13 12:48:04,0.9988885664964064
如果明知大秦铁路不大跌又没到大涨，然你还是买,11472,23,2017-06-13 12:55:13,0.1654614702181607
《论持久战》—国之大秦,17836,29,2017-06-20 23:01:56,0.6024789436320738
螳螂捕蝉，黄雀在后，大秦当前价值金光闪耀！,24066,36,2017-05-03 11:31:52,0.7479866154371988
伟人的炒股秘籍 — 大秦铁路,16741,28,2017-05-03 11:28:38,0.7306582167475071
如果明知大秦铁路大涨，而你还买 那十足证明你,12922,27,2017-06-13 12:51:23,0.9126816011292707
除了个把的铁骨兄弟，本土地一次又一次的看到某,4325,7,2017-07-31 15:14:01,0.8684052408955655
为什吗说，《大秦铁路》才是最终大中华崛起极为,16291,28,2017-07-06 17:33:14,0.9235693053451363
阳光总在风雨后－－年复一年原来又一年！,8778,16,2017-06-20 23:15:28,0.9874459216665142
九天玄女已买入民族大秦 说 不到40不减持！,26420,33,2017-05-06 16:32:02,0.735368920626297
悟空～三打白骨精（赠大秦真正的投资达人）,10005,14,2017-07-17 14:51:52,0.8789049458022368
众人拾柴火焰高 弟兄们对目前形势下的大秦要做,10419,22,2017-07-05 15:49:26,0.9979441734706463
使命的召唤：华夏之矛 —《大秦帝国》,10131,21,2017-07-14 12:26:37,0.9389436758843533
如果明知大秦铁路大跌，但你还买 那十足证明你,10303,22,2017-06-13 12:49:42,0.5749484433550333
金甲圣衣重彼肩，大秦十年磨一剑，中国绩优龙抬,24587,91,2017-05-11 18:41:10,0.02977274627159343
龙潜深渊刘皇叔隐伏新野 — 大秦铁路 ，俺看行,7819,20,2017-06-13 12:44:21,0.9999495624897892
三论“战略上藐视敌人，战术上重视敌人”之古为,9653,23,2017-07-10 15:58:55,0.9963980338382729
《出师表》－中华大秦,8077,18,2017-07-19 13:37:37,0.17925756330105136
大秦一响，黄金万两，铁路一滚，钞票一捆！,5607,15,2017-07-05 14:43:11,0.07907439794648274
放眼未来，现今15元以下的大秦铁路，都是可以不,30798,36,2017-05-15 16:35:36,0.9848527712594985
主力加油！不能下跌，否则就跌破5天线了！,13448,44,2017-07-18 10:04:48,0.06381161224462639
外媒：大秦铁路两市独一无二，年年都是拿出50%,22875,18,2017-08-02 07:24:52,0.24496826746029143
大秦铁路要大忙了,中国停止进口朝鲜物资.,8459,13,2017-08-14 23:01:38,0.7085923308003625
大秦铁路上半年业绩同比预增90% 或因煤炭需求回,22048,7,2017-07-06 16:46:18,0.35310283472420867
港股与A股五大方面存差异,11618,15,2017-05-23 15:15:30,0.35810728504362954
601006:大秦铁路2017年7月大秦线生产经营数据简,47554,27,2017-08-09 16:04:50,0.40915591715855393
再次对大秦的老朋友做点表示,24892,54,2017-08-01 21:18:54,0.780316865814283
睡了一觉,少了一毛啊,我就是傻啊,5980,11,2016-10-24 15:03:23,0.35992209488079485
上证没跌，漂亮50没跌，铁路没跌，就你绩优股大,10415,15,2017-07-25 13:31:26,0.7956649450008572
黑哥发力：下午收盘6.4元见！,9434,18,2016-10-20 09:54:54,0.5609659106958649
维持满载运营预期 进口煤减少添新增量,31921,10,2017-07-10 12:25:22,0.3290860806257404
十九大前，出台铁路混改方案！,10985,10,2017-07-21 15:23:10,0.1117490389023098
百年铁运。哪里有抛弃的理由呢？,8551,11,2017-08-07 12:18:08,0.7067409325200988
不跑，反正也不是第一次坐电梯了。,6201,8,2017-07-17 14:35:44,0.06667899836130387
业绩这么好的股票比不上业绩差一大截的铁龙物流,7404,8,2017-08-07 11:17:05,0.667978509915385
还有那些人在？从16年到现在的兄弟还有那些人在,5025,18,2017-08-07 10:52:49,0.23267076471760906
早上6.76买的，7.03卖的，漂亮的t+0,净赚两万块,8923,12,2016-10-24 13:44:08,0.6599225182445186
哈哈哈咯咯咯！抢盘了，抢盘了，黄金砸头！晨鸣,15947,29,2017-04-11 15:33:23,0.9989421696668829
狂笑咯咯咯，业绩去年翻倍股0.99，今再翻倍超2,19805,29,2017-04-28 10:32:33,0.2919758660017877
大秦铁路(601006)融资融券信息(08-03),4386,1,2017-08-04 07:43:02,0.7884728735409863
周五沪港通,港资净买入大秦铁路8314.4万元,13969,14,2017-07-29 02:29:45,0.5068178411775941
破位价8.56元（后除权价）,79482,140,2017-05-10 15:28:09,0.8418906524929198
大秦铁路各年分红,52602,79,2017-03-11 17:34:53,0.42187459753097767
蓝筹股在未放量之前积极锁仓，坐享傻子来抬轿。,4200,5,2017-07-14 06:57:16,0.08923159445459272
上海国企改革即将成为大盘的领涨龙头 市北高新6,6032,28,2017-07-24 15:56:46,0.7070500111295003
大秦保持现在的分红15年可收回投资，公司截留的,8660,22,2017-07-28 18:29:38,0.30779117440446246
国家的利益高于一切，为国扶盘！,5554,11,2017-07-17 10:08:22,0.7173792079971587
未来十年，持有蓝筹股多的成为富豪…,7814,9,2017-07-15 14:38:19,0.886010035317662
大秦铁路(601006)融资融券信息(07-17),6507,4,2017-07-18 07:45:17,0.7884728735409863
大秦铁路：只要不跌破5天均线，仍可继续持有！,2755,3,2017-07-20 13:26:42,0.016871589262784537
大秦铁路：上半年净利预增90%左右,31279,18,2017-07-06 15:41:56,0.11764778420177668
看着K线，我陷入了沉思。,9322,44,2017-07-12 18:30:06,0.9602235724613903
大秦铁路（601006）：有一千个声音喊你下车,17605,15,2017-06-30 21:20:39,0.6812865295511678
大秦铁路：关于大秦线完成3万吨组合列车试验的,8204,11,2017-07-12 20:56:43,0.8381763061597908
大秦果然猛！,8627,28,2017-07-17 10:30:39,0.8630530555797126
601006:大秦铁路关于调整煤炭运输价格的公告,79608,43,2017-03-24 20:22:53,0.1905701215490746
热烈庆祝《大秦铁路》迎接八一建军节即将发动首,11054,24,2017-07-05 15:14:44,0.8999647115601841
大秦铁路(601006)融资融券信息(07-13),5896,4,2017-07-14 07:46:02,0.7884728735409863
大秦的混改一定会惊天地泣鬼神，不但招来了阿里,7130,8,2017-07-17 13:50:21,0.03064541022377487
经本人超能牛市指标研究得出结论，2014年的金陵,8124,9,2017-07-17 16:01:37,0.9993555416761816
可能被非法抽走三分之二利润，它还这样优秀！,7404,29,2017-06-26 03:55:04,0.19635361282860275
601333广深铁路：直线拉升，准备要涨停！,2891,4,2017-07-14 10:30:20,0.7429224248352909
大秦线历史PE估值与煤炭价格走势相关,7756,8,2017-07-08 23:11:07,0.3861477994737522
高盛说过，大秦铁路是中国股市中最垃圾的股票，,9303,15,2017-05-18 10:40:13,0.987749364799136
下周上证50和沪深300将暴跌，大秦将开启闪崩模,10755,21,2017-07-14 15:18:15,0.7020073548417433
B股是散户资金避风港，B股将为疯狂的市场。,42954,93,2016-12-28 17:12:32,0.8792316081649909
六大电厂日耗首破70万吨，高温提振火电耗煤,4596,5,2017-07-15 08:23:46,0.021574146237533176
大秦在高位，越涨越卖，只卖不买,50505,127,2017-05-16 15:14:07,0.6362878193223082
大秦铁路真是一个好股票，我错过了……也给我深,5262,4,2017-07-07 22:41:26,0.9865038532051781
怀疑人生,5896,12,2017-07-13 13:55:45,0.6923786120385603
2014年以来到现在涨幅超三倍以上的所谓白马，20,3285,10,2017-07-03 22:33:46,0.8085808318875445
大秦也有铁路行业内“保险经营业务”……,3627,12,2017-07-05 11:24:37,0.22622903016144902
神华集团占比《朔黄铁路》股份38.518%,11847,31,2017-06-17 09:51:21,0.7991818940279155
601006:大秦铁路2016年年度利润分配实施公告,80852,19,2017-06-21 18:14:36,0.17418784041182056
为什么选择大秦？受益于煤炭涨价、市盈率极低的,13194,19,2017-07-08 22:53:52,0.28467345368825736
盼星星盼月亮，老a终于被纳入msci,宣告：大秦铁,11923,16,2017-06-21 05:01:57,0.5513742760382975
近期，鉴于以《丁义珍》为首的牛鬼蛇神连翻兴风,8378,20,2017-06-13 12:33:15,0.6008086912535441
操作策略,22036,62,2017-06-07 14:38:45,0.7804038850064997
601006:大秦铁路2017年上半年业绩预增公告,70626,5,2017-07-06 17:30:38,0.516224533761745
总结猴年，虽然没有亏损，但也颗粒无收。就其原,252609,928,2017-01-28 04:30:33,0.06161585591887586
为什么说大秦铁路（601006）越涨越要加仓,7684,6,2017-06-11 13:09:36,0.50784202597949
今天的收盘价减去0.25元就是明天的开盘价，请问,9435,17,2017-06-28 06:29:04,0.04114411642131566
下一个漂亮50,3917,40,2017-06-29 15:11:32,0.8572178826606923
开盘买入,3619,12,2017-05-24 20:38:11,0.7297953905324696
601006:大秦铁路2017年第一季度业绩预增公告,56430,16,2017-04-07 16:00:41,0.6621318842395808
总之,4800,10,2017-06-26 15:41:18,0.5262327818078083
许多散户不明白这次降低运价的买单者不是大秦而,1964,10,2017-06-01 10:26:25,0.20260743660448643
个人观点,3734,11,2017-05-26 11:53:34,0.644184182607548
看不明白了，谁能告诉我，6.13的收盘价怎么来的,6370,13,2016-08-03 15:01:36,0.35157944473184244
马云：一天10亿包裹时代将至 物流企业不改变要,5455,5,2017-05-22 23:36:58,0.93104838359471
什么狗屁股票呀，天天跌,3268,1,2017-06-22 13:46:31,0.12067592145848971
问土地权证预计多少年内办好。答：谢谢关注,6646,16,2017-04-07 13:28:33,0.13287510179103568
有望冲过7.76，上升趋势䃒立。,5655,21,2017-04-06 14:09:09,0.666804945172101
费率调整凸显价格优势，运量回流扫除业绩阴霾,17155,4,2017-06-09 09:45:17,0.6260038814343398
这就是所谓的价值投资？,3910,1,2017-06-22 13:49:18,0.9045413616333499
感觉跌不下去了,4269,0,2017-06-22 14:54:34,0.14494405161539747
抢权行情路漫漫，与庄共舞乐融融。,5007,0,2017-06-22 14:54:46,0.9680688716265137
什么情况，这票跳水,3873,0,2017-06-22 13:58:49,0.14918852727235166
多少散户在晕龙疯虎的忽悠下套在了相对高点。真,24136,68,2017-06-05 19:29:42,0.038233288716756464
上汽集团已从自选中删除，大秦也不远了。,12327,30,2017-06-13 14:47:03,0.0881175273023308
想占郭字队的便宜，休想！,16625,51,2017-05-25 13:43:44,0.8457173860755536
5月日均运量121万吨 用电高峰有望维持满载,24985,7,2017-06-14 15:28:34,0.5889644360627415
601006:大秦铁路2016年年度股东大会决议公告,36815,7,2017-05-19 19:06:49,0.7030501384368975
大奏铁路，早盘跌多少，收盘就升多少,1569,7,2017-05-24 11:18:34,0.5107099140139272
四十九种阳面组  进入之后慢慢悟  三十六种阳面,6127,11,2017-06-10 17:40:24,0.991077459123367
601006:大秦铁路关于参加山西辖区上市公司2017,31496,11,2017-06-13 18:40:07,0.5801679337768073
砸盘套人，阴跌闷杀出货[鼓掌][鼓掌][鼓掌]希望,1744,30,2017-04-25 11:04:12,0.9234371204304622
云龙风虎，你又出来了，这次一定把你j奸了。,13162,36,2017-05-20 17:02:05,0.40355660870989074
走了！心里安心今晚可以睡个好觉，被主力玩真不,6221,14,2017-05-25 19:27:27,0.03349713171320201
601006:大秦铁路关于选举职工代表董事、职工代,26306,10,2017-05-16 16:11:10,0.3030963129191092
5月大秦线接近满负荷，期待夏季煤炭旺季来临,17538,4,2017-06-09 08:59:38,0.4851383686497034
601006：长线投资买进。,16811,51,2017-05-18 02:10:16,0.830497149902868
601006:大秦铁路2017年5月大秦线生产经营数据简,37033,9,2017-06-08 15:46:44,0.41632112579292524
食之无味，弃之可惜！大秦，你拿什么来爱我！,42669,128,2017-03-22 16:00:38,0.9089700637858884
大秦铁路(601006)融资融券信息(06-01),5328,4,2017-06-02 07:50:13,0.7884728735409863
中国恒大地产大涨15%连创新高 今年暴涨195%  凤,6949,62,2017-05-29 13:58:49,0.9843325384999048
天天低开，有意思吗,5139,12,2017-05-25 09:36:38,0.8081930401093922
下调电气化附加利润影响有限，意在降低物流用能,16341,3,2017-06-01 09:07:41,0.5136036964778123
向下调整开始,6798,18,2017-04-21 11:03:28,0.4308753477837757
大秦铁路:庄家大阴谋，该小心！,8107,7,2017-06-01 13:27:23,0.4530463641197344
派现太少，提议赵春雷下岗、建议东福跟随…,31117,96,2017-04-29 13:27:47,0.957158111006009
大秦铁路，明天或涨停！,18100,20,2017-05-17 18:08:01,0.3184875069312658
大秦铁路(601006)融资融券信息(05-25),7576,22,2017-05-26 07:51:05,0.7884728735409863
希望下周继续红盘,4361,22,2017-06-02 17:31:22,0.5107125457824768
只是格局上的变化,4984,23,2017-04-26 21:47:52,0.5175966805793916
601006:大秦铁路:2016年度控股股东及其他关联方,4593,4,2017-04-26 17:24:00,0.24129328038585096
601006:大秦铁路2015年度利润分配实施公告,123205,41,2016-06-29 18:00:10,0.161260298097759
大秦铁路(601006)融资融券信息(05-19),7553,3,2017-05-20 07:46:32,0.7884728735409863
打新离不开市值，市值离不开稳健的大秦…,6892,14,2017-05-19 21:57:50,0.06522267795330272
电气化附加费和电价同步调整，预计影响17年业绩,26311,5,2017-06-01 19:28:57,0.2332332006542176
因为股票，我们走到了一起...,3050,6,2017-05-25 18:09:59,0.7137621822909624
大秦本月能看到多少？10元的成本，是不是该走了,10105,13,2017-05-19 08:17:08,0.23491594264314586
《大秦铁路》－ 万年等一回！,5966,15,2017-05-19 17:32:46,0.5512761426551629
601006:大秦铁路关于调整铁路电气化附加费的公,37981,19,2017-05-31 20:14:32,0.43615492921002885
来算一下大秦今年的业绩 ，不得不说第一季度惊,26043,19,2017-04-08 18:31:06,0.9189938787349823
各路人马正在评估年报和一季报同时出炉的影响,3371,18,2017-04-26 23:00:14,0.05228499383532792
分红不理想。,1726,17,2017-04-27 08:19:31,0.38979996139734696
铁总：希望与阿里巴巴在混合所有制改革领域深化,7342,14,2017-05-17 15:44:33,0.9999860936054529
告诉你尾盘拉升的秘密--基金保仓位,9262,8,2017-05-22 15:15:53,0.9230006988842203
七个严禁，没有第八个严禁---没有严禁炒雄安概,19965,154,2017-04-06 20:05:20,0.8991304528612256
大秦是中国经济的耻辱，在世界上出卖着第二经济,44328,48,2017-01-26 10:52:03,0.9747121646597524
数据分析-持有大秦铁路是明智的,16803,46,2017-05-21 11:58:39,0.8405487819320576
本吧有三个偏痴狂,8388,8,2017-05-22 12:18:44,0.34430934941875213
听我的没错，买创业板都不要买大秦！我朋友的创,8261,18,2017-05-21 12:20:56,0.6507534762584143
或与公司业绩相匹配,5457,20,2017-05-17 12:45:15,0.6669561107233661
大秦铁路混改和业绩--引入加太铁路、美铁，还是,11452,14,2017-04-24 15:27:55,0.9438693941673458
好久没发言了，送走了忠实的河源网友，今天又送,9403,19,2017-05-15 23:04:59,0.40280779768666686
拿住大秦 要长期持有,32771,53,2016-07-25 11:23:25,0.11735208030161526
大秦铁路价值投资买入策略,226777,408,2016-01-14 10:55:50,0.9894045111052804
宁波港601018重大事项复牌联手铁路,65116,82,2016-04-07 11:03:51,0.2860469088834543
持股9个月，终于迎来大秦的春天，接下来一个半,15577,27,2017-03-25 20:47:12,0.0330493848592035
天津港禁汽运煤时限或提前，大秦铁路运量有望达,25529,13,2017-04-17 22:01:00,0.060593714896265416
大秦铁路，绝不割肉,60144,72,2016-05-02 10:23:18,0.37384576756737
大秦持股41.16%,19550,27,2017-04-04 12:51:36,0.16853909459910577
大秦铁路一季度净利预增45% 大秦线货物运输量增,33447,16,2017-04-07 16:03:53,0.11663206323915842
601006:大秦铁路2017年4月大秦线生产经营数据简,25687,7,2017-05-10 16:26:16,0.3694933259292632
点评大秦年报与季报：略高与预期，未派特别股息,8200,8,2017-04-26 19:11:21,0.43956394324237
云龙在，大禽不拉[胜利][胜利][胜利],3400,25,2017-04-11 10:51:13,0.8300095666313354
大秦铁路目标价上调到69.99元，是基与未来三个,10700,12,2017-03-26 08:26:34,0.9603578564761496
大秦铁路，与你同行,21921,34,2016-05-04 13:41:02,0.15262847583677308
601006:大秦铁路2016年年度报告,19195,10,2017-04-26 17:23:08,0.6278539360041306
也许大秦会涨到100元以上，有没有人和我一样想,9772,15,2017-04-01 11:20:14,0.5044591870766606
量价双升跑赢业绩 基本面改善拐点明确,13252,4,2017-04-26 19:22:26,0.9766933384440458
哈哈哈～哈哈哈～哈哈哈～云龙在哪？出来走二步,3164,21,2017-04-13 11:00:01,0.9998487495987767
再次告诉你们，云龙不走，大秦不涨[胜利][胜利],7654,22,2017-04-12 12:22:12,0.6144558945185754
601006:大秦铁路2017年第一季度报告,25497,9,2017-04-26 17:23:36,0.7560066739327199
大秦一般开盘涨时，收盘都是靠不住的，这个小散,3857,22,2017-04-13 09:53:55,0.25861415226602613
大秦铁路：大秦线2月货运量同比增近三成,28818,10,2017-03-09 16:19:04,0.20046191282147108
【联讯交运公司点评】大秦铁路：天津港禁汽运煤,16114,10,2017-04-25 12:48:13,0.04668999521481676
长期基本面依旧向好，静待估值修复,15198,6,2017-04-25 17:35:37,0.8865067392907753
大秦今天收盘8.88元，不符的话俺给你们吃屎。。,7264,13,2017-04-21 08:33:22,0.16585289512692725
很好，一季度还没提价，业绩就恢复0.2上方了，,5284,20,2017-04-07 18:58:36,0.2617385404906035
大秦铁路个人剖析,33601,37,2017-03-11 08:35:15,0.8294457583903986
为什么多次出现125手买盘哥?,5115,23,2017-04-12 13:24:10,0.566806933632466
4.0工业革命凸起黑科技受惠的上市公司（转）,10778,15,2017-04-03 15:53:24,0.2962239259185949
秦港涨势多好！大秦有点让人失望。没法，拿到今,2441,19,2017-04-10 14:52:47,0.03501494301639796
外资进场十分坚绝，看戏,5005,21,2017-04-12 14:09:08,0.5188071024048299
那些说什么有桩啊，骗散户筹码啊，好业绩啊～～,5071,27,2017-04-19 13:11:44,0.23355056784716044
国泰君安，十足空狗，汉奸！[胜利][胜利][胜利],2918,21,2017-04-17 13:40:19,0.9591154004035625
地主赢还是农民赢？,5603,8,2017-04-10 21:51:03,0.8538395238175275
601006:大秦铁路2016年度第一期短期融资券2017,22517,6,2017-04-10 16:24:51,0.7039710467870579
3月12日，大秦线运量达到130.2万吨，创2017年以,26799,56,2017-03-13 23:01:03,0.36289466075801646
601006:大秦铁路2017年3月大秦线生产经营数据简,28765,4,2017-04-07 15:58:02,0.34953849944951054
一季度煤炭运输淡季不淡，全年量价齐升确定,13980,2,2017-04-10 11:10:44,0.09916830507503183
3月运量表现靓丽，Q1业绩快报预增45%,19717,10,2017-04-09 18:03:46,0.9486663371499934
煤价影响运量，预期维持稳定,13941,11,2017-04-09 11:34:59,0.6111756017064209
沪股通已连续3天大幅净流入，已成沪股通第一股,17015,26,2017-03-30 13:51:44,0.05109220348960053
大秦铁路明天或涨停！,11484,10,2017-04-04 23:08:18,0.3184875069312658
天津港都一字涨停板了，你大秦铁路情何以堪啊，,7517,4,2017-04-05 10:47:49,0.9350329377468478
算一算，大秦“京津冀晋”9万亩铁路物流用地…,9214,16,2017-04-04 20:16:18,0.8229513285892471
雄安新区的建设用材料大部分会走铁路运输大秦线,9648,1,2017-04-02 10:31:51,0.4859014985838386
大秦铁路股票质地好，长期持有，踩准波段操作。,6644,15,2017-03-28 16:08:42,0.7089708103703797
U军工大黑马南海风云南北韩战争一触即发军工混,3751,16,2017-03-28 13:21:04,0.8920081364792851
正式启动“脱欧”程序,3531,31,2017-03-29 10:18:53,0.5463520209051264
买了大秦打新股，我已经中了7个签了、今年开年,11862,25,2017-03-22 13:32:36,0.25490930149151125
601006:大秦铁路2016年年度业绩预减公告,100482,61,2017-01-20 15:41:27,0.3750896307601077
早盘推荐 能者把握,7277,21,2017-03-27 09:33:56,0.8923834868754249
量价齐升，战略投资价值进一步凸显,14813,5,2017-03-27 22:42:05,0.9925634738425421
【联讯交运事件点评】大秦铁路：量价齐涨，经营,13580,6,2017-03-27 15:30:24,0.3897733594434857
运价如期恢复，下一个神华？,18724,8,2017-03-27 10:54:09,0.2779465676872518
提价落地，上调盈利预测7.5亿,19447,6,2017-03-27 08:29:40,0.9958441847635428
大秦铁路：调整煤炭运输价格,34228,13,2017-03-24 20:38:56,0.22508856543712363
建议：朔黄铁路分拆上市...,5780,8,2017-03-23 12:08:08,0.5201993506960441
601006:大秦铁路2016年度第二期短期融资券发行,40461,7,2016-11-11 15:40:14,0.5105204968478602
