标题,帖子数,日期,情感
[深度揭发]MSCI Inc.来了，漂亮50必将是永远中,9559,2017-06-22,0.9898933307019596
三角轮胎9/28日出东方 纯技术帖～不喜勿进！ 三,2786489,2016-09-28,0.23862661127049378
9月9号大家注意大批一元成本小非解禁,15236,2017-08-28,0.012823933522514208
三角轮胎等待基本面的改变,16164,2017-08-19,0.9252855890973286
·若不撇开总是苦，各能捺住即成名·,12651,2017-08-06,0.5685689580823642
601163:三角轮胎关于使用自有资金进行现金管理,22890,2017-08-31,0.7558544555438343
601163:三角轮胎关于使用暂时闲置募集资金进行,17386,2017-08-31,0.46865821173277855
江苏银行0.98元业绩次新股股价不到10块仅此1家,59426,2017-03-16,0.04997406222880718
北狗……何必呢！！！！,16827,2017-08-08,0.4744500505748962
北狗变态升级了，这衰神保证，绝对，食屎都用上,6261,2017-08-19,0.8646958184006583
威武不能屈,6707,2017-08-20,0.19185025305106962
此垃圾的走势和以前的中石油一样一样，你懂的，,4872,2017-08-28,0.03311892503193237
坚定的买下去，离正确越来越近,195404,2017-01-13,0.8940824127360291
三角大小非自愿锁定与减持的承诺及约束措施,41520,2017-06-20,0.8736146254048799
抄底成功附图,8515,2017-08-28,0.6560751417258955
601163:三角轮胎2017年半年度报告摘要,39859,2017-08-24,0.7166677956103105
中报速递：三角轮胎2017年上半年盈利2.72亿元，,47843,2017-08-24,0.3033137756620329
来预测一下半年报,13972,2017-08-17,0.8581968335895201
此垃圾在七月底前不破发北哥从此删号，见证，嗬,17168,2017-06-20,0.8644404785053569
今天收盘三角轮胎红色B点转强买入信号成立,13099,2017-08-17,0.6670953842093307
601163:三角轮胎关于公司收到第四笔土地补偿款,44125,2017-08-07,0.5156792242102841
三角轮胎：再收到3.15亿土地补偿款 已累计收到1,53615,2017-08-07,0.1277813437610854
中报肯定，绝对，北哥保证大亏特亏，嗬嗬嗬,10758,2017-08-18,0.5834801087147687
北哥说了此垃圾只要大盘稍调一下就会领跌滴，大,2379,2017-08-22,0.08942723108181927
此垃圾不破发北哥天天吃翔，见证，[大笑][大笑],50622,2017-05-25,0.5581613958205361
601163:三角轮胎关于参加山东辖区上市公司2017,34542,2017-08-18,0.874785512647198
持有三角中了第二只新股,7391,2017-08-03,0.503465951706487
我依然坚守，战友们还在吗？,7858,2016-09-20,0.9898204722459
谁买三角轮胎的股票就会倾家荡产，谁用三角轮胎,6010,2017-06-27,0.7156458806433353
601163:三角轮胎关于美国国际贸易委员会就进口,86497,2017-02-23,0.9784155787393131
到现在你多看不出此垃圾弱得不要再弱了吧，游狗,4223,2017-08-14,0.1353970135431637
又是逆市而跌，绝了，嗬嗬嗬,3764,2017-08-08,0.4790340922847386
诱多，诱多，诱多，空欢喜，嗬嗬嗬,4129,2017-08-09,0.9960206430616115
谁买三角轮胎就会车毁人亡，丁玉华是中国的杀手,7528,2017-06-22,0.10412386733552403
明天板了，信不信由你！,6694,2017-08-07,0.08132189551308644
你们着北狗的吗和猪干上了,10869,2017-01-18,0.45755008496067684
一起操三角老板丁玉华他妈,9268,2017-01-11,0.2211827823775443
有个人为啥老吼吼吼，不汪汪汪？,3540,2017-01-04,0.021972383719554567
北狗已经吃屎 吃到吐了,4952,2017-01-19,0.5372282892008313
北狗，你妈逼，我今晚到首都国际机场，来，约一,6138,2017-01-20,0.4747870036807317
北狗啃骨头迟早卡死,7984,2017-01-03,0.29776534666833887
三角轮胎，完美的军工概念股。下周涨30%不奇怪,8702,2017-08-05,0.17136477932388028
嗬嗬嗬，哈哈哈哈，糊涂啊，以游狗为首一帮牛鬼,4919,2017-08-05,0.904509908236243
没有只跌不涨的股票，天怒人怨的三角已经跌到头,8504,2017-08-04,0.3169031405031102
三角轮胎加速推进全球化战略,62204,2017-06-29,0.991810278091012
三角轮胎601163重大劲爆利好发力，后市惊喜不断,6240,2016-11-10,0.3826924461458918
突发奇想，为了未来三角轮胎能走出好的行情，是,5495,2017-08-03,0.9863419394803759
丁玉华他爸是曰本种,22728,2017-06-27,0.029351108410904492
新股定价报告：绿色三角，走向世界的领先轮胎品,242508,2016-09-02,0.9964567573642522
看涨的比看跌的多，看涨的帖子点击量和回复也多,4119,2017-07-26,0.10024617242663958
凤凰卫视《大政商道》栏目对三角轮胎,10576,2017-07-31,0.6272222920369391
反弹永远一个点，下跌总是三个点以上，你懂的，,5826,2017-07-27,0.643357220213302
三角大行情猜想,23023,2017-01-18,0.9909439025827114
我凭良心说下面的话。其实有点研究都能看出来，,17250,2017-03-10,0.6717954113739077
601163:三角轮胎2016年年度权益分派实施公告,101698,2017-07-23,0.6073525004008744
人生全靠赌，荣华富贵险中求！601163，三角轮胎,12767,2017-07-17,0.9916171244974687
大盘随时会展开周线大调整，垃圾三角绝对破破发,6218,2017-07-25,0.5178963247345532
三角你赢了，亏了36个点，割肉了，血汗钱,8219,2017-07-21,0.5008269042194486
想问一个问题：现在买入是不是等于中了个新股？,8270,2017-07-18,0.2252349290568767
垃圾三角不破大不摆休，垃圾三角的底在13元左右,6437,2017-07-18,0.0039170709377486235
最烂的次新股....没有之一！,2648,2017-07-06,0.004315813593399609
买三角轮胎的股票就会倾家荡产，用三角轮胎就会,8107,2017-06-30,0.2777715390919062
601163:三角轮胎关于变更持续督导保荐代表人的,29475,2017-07-11,0.4018132956986542
601163:三角轮胎关于使用暂时闲置募集资金进行,30529,2017-06-30,0.46865821173277855
北哥再次大声告诉大家，此垃圾绝对绝对绝对是等,8607,2017-07-07,0.016011395404866957
破轮胎，破股，快点破发吧。。嗬嗬嗬,5383,2017-07-05,0.005552461519493734
玲珑轮胎和三角轮胎到底谁是行业龙头？,27231,2016-09-09,0.31063323057174075
早上就跟你们说卖了，尾盘再买回来了,5198,2017-06-21,0.022310665186130785
欣泰因欺诈发行上市终于要退市了，垃圾三角也快,6980,2017-06-23,0.06020811093770184
涨少跌多的狗日的游狗它酿大烂逼股，嗬嗬嗬,2532,2017-06-23,0.10806359956517053
不管日，周，月线全在下降通道中，垃圾到一塌糊,6287,2017-06-13,0.004661558661835041
破发就在一瞬间，嗬嗬嗬,12115,2017-06-05,0.6578895941487263
垃圾三角完完全全彻彻底底沦落为次新股中的垃圾,9829,2017-06-11,0.07393436472547754
反弹乏力，跌起来波涛汹涌，无解，等破发，嗬嗬,7343,2017-06-12,0.5195560749739527
601163:三角轮胎2016年年度股东大会会议资料,38601,2017-06-15,0.5744129084196111
兜底增持超跌次新股，看好三角轮胎！,19339,2017-06-05,0.0317369781754574
此股会突然涨停的！我已满仓持有。47开始建仓。,16242,2017-05-26,0.05401362959964007
奇葩三角怪胎股，跟跌不跟涨的极度垃圾股，不破,5785,2017-06-13,0.0009453733868001191
还有37抄底三角的散户吗,7125,2017-06-13,0.5508347628345552
601163:三角轮胎关于选举职工代表监事的公告,19260,2017-06-09,0.2854645993602587
601163:三角轮胎关于召开2016年年度股东大会的,22710,2017-06-05,0.7731301172606717
601163:三角轮胎关于公司2017年度现金管理额度,17046,2017-06-05,0.3146457669836429
上市后就变成铁公鸡，三角也不例外,14163,2017-04-23,0.9328031770333848
我3000万在里面。29块的本[牛]砸下来再加1000万,4017,2017-04-24,0.3475408571757942
601163:三角轮胎关于使用暂时闲置募集资金进行,24455,2017-06-01,0.46865821173277855
601163:三角轮胎关于使用自有资金进行现金管理,24603,2017-06-01,0.7558544555438343
你们快跑吧！我留下做股东,2437,2017-04-24,0.7649339740498486
北哥说了垃圾三角破了30将永远见不到30罗，就算,9938,2017-05-28,0.06278085366819397
601163:三角轮胎关于公司2016年度利润分配预案,66711,2017-04-23,0.06827914005329216
看看人家2016年9月对三角轮胎的分析报告，多么,9316,2017-05-25,0.9143725727134129
最高点下来已经腰斩，必有反弹！大胆买进！立帖,7942,2017-05-24,0.7729608493675669
原赌服输，亏4万，多翻空，割肉走人！,4246,2017-05-24,0.8644678054814463
绝对是破发的节奏，不破发不摆休，破发后还要破,5938,2017-05-24,0.02674829627721642
三角轮胎借道庞大集团，与其联手在雄安布局轮胎,17528,2017-05-18,0.3543749767662928
601163:三角轮胎关于使用暂时闲置募集资金进行,25803,2017-04-28,0.46865821173277855
三角轮胎：一颗红心，两手准备。 一颗红心是坚,21709,2016-10-23,0.04864956904942663
报告！我己在最后十分钟清仓出局，明天盘中跳水,9181,2017-05-17,0.3031574946293709
601163:三角轮胎关于公司收到第三笔土地补偿款,64189,2017-05-05,0.4820405752237278
哈哈，今天有机会冲涨停。,5792,2017-05-17,0.8001199987194413
说说倍量不穿。图解2个例子。,18885,2016-11-12,0.3274402668158688
垃圾三角将永远见不要到30的太阳，往上几毛往下,6993,2017-05-16,0.23672798779173165
在尾盘的跳水中，我一次性满仓了！输赢就此一搏,8636,2017-05-15,0.05974917445602701
北哥预测一次比一次精准，垃圾三角破发后再也见,8674,2017-05-13,0.5936641234621644
请问公司有钱什么都不买自己公司的股票，去搞什,3314,2017-04-22,0.07114949510864788
股性不活，没庄，走了！,2370,2017-05-12,0.5236322662788879
现在知道北哥一直唱空的忠言逆耳了吗？现在知道,6578,2017-05-12,0.421874597530976
用三角市值还就中了一签,12895,2017-05-06,0.2422488262825241
这垃圾主要也是让短线客难赚到钱，涨了也就在一,2743,2017-05-12,0.10756769253811993
中国轮胎产业的领军企业之一,62353,2016-09-09,0.5230202590751571
一季报速递：三角轮胎2017年一季度盈利1.57亿元,78081,2017-04-24,0.3732225244688938
杀条鱼炖上丁狗肉喝点小酒！！,2456,2017-05-06,0.053143663596708746
有些人真的连狗都不配做，自己选择了，然后亏了,4865,2017-05-05,0.7299834241245083
嗷嗷叫80、100的鸟兽散，接着叫啊,3415,2016-09-21,0.3339439654565377
明天涨停，我的预感相当准确。立帖为证,10189,2017-05-02,0.7656954300641594
破发行情从今天开始罗，嗬嗬嗬,5563,2017-05-03,0.6312400718724166
昨天把我家承包的两台公交车都换上了三角胎，之,7366,2017-05-01,0.14487742830839934
北哥申明：北哥从没叫人割肉，也从没叫人买股，,8986,2017-04-27,0.008941185606420654
从36套到现在，看样子，大盘配合，本周要破28，,6739,2017-04-10,0.17112694918472482
601163:三角轮胎关于使用暂时闲置募集资金进行,26450,2017-04-28,0.46865821173277855
601163:三角轮胎关于使用自有资金进行现金管理,29980,2017-04-28,0.7558544555438343
看到了吗，大盘上来四十多点此垃圾还绿着，嗬嗬,1416,2017-04-27,0.18609739511418144
北哥从45元以来一路发风险贴，说破40见35 .说破,10895,2017-04-25,0.0009520848017050554
J20、运20等，5、26、31、41等。,19560,2017-02-24,0.26286815586544254
集天时地利人和之三角轮胎，即将启动上涨之旅,13458,2017-02-24,0.11406388912779009
3200股亏了3万多元，我该怎么办？？,45068,2017-01-18,0.04357658461295544
垃圾三角完蛋罗，北哥从45元唱空此垃圾到现在，,3936,2017-04-25,0.19751111660068887
601163:三角轮胎2017年第一季度报告,46166,2017-04-23,0.7833098711917784
暴跌罗，硬撑了二天终于撑不住罗，破发行情开始,5082,2017-04-24,0.9485858239195099
每年业绩1块多，净值没增加，何故？,9299,2016-09-06,0.20557185314946924
明天高开是肯定了，那么高开多少呢？如果高开2,9774,2017-04-23,0.17281805203332257
坐等周末重大利好，年报，一季报，捷报。周一一,15603,2017-04-20,0.44310833898893986
还有中签的不,7619,2017-04-21,0.34527875471283087
43买的亏了30个点,6908,2017-04-12,0.7816059110255984
是不是要补缺了，就在明天，嗬嗬嗬,4456,2017-02-27,0.1734105560759326
上证指数一点 == 三角轮胎一分,8297,2017-01-14,0.4130522567283128
只要你敢破29，老子立即买入三千万人民币。股神,9499,2017-04-12,0.9763534791416302
今天微跌明天大幅补跌，嗬嗬嗬,6425,2017-04-17,0.060580916952122865
二级市场进的，都套着，割就真亏了,8353,2017-04-14,0.8218811287913169
601163:三角轮胎关于使用暂时闲置募集资金进行,30582,2017-04-14,0.46865821173277855
上了北狗当，29.55割了2700股，38块多的本。28.,26502,2017-01-18,0.14952592346600202
又是低开低走暴跌之势，嗬嗬嗬,4423,2017-04-12,0.39220400406915745
割了，损失一万五。从此再也不玩山东股了。山东,6192,2017-04-14,0.7271335911334406
北哥预测一只垃圾股跌的准确率高达百分之百，嗬,3720,2017-04-14,0.36534155465171114
此畜牲股绝对绝对有大利空，要不就真是造假上市,4184,2017-04-14,0.09741699087339595
关于三角土地搬迁价值,26506,2016-09-11,0.9655475593606552
有没有33以上成本被套的,3600,2017-04-14,0.10772732209961067
601163:三角轮胎关于对部分暂时闲置募集资金进,33922,2017-04-11,0.29817120460951463
嗬嗬嗬，弱反弹如同昙花一现，最终还是下跌，大,4415,2017-04-11,0.8401578814625614
601163:三角轮胎关于变更轮值总经理的公告,24398,2017-04-11,0.12753477804039448
601163:三角轮胎关于变更轮值总经理的公告,14467,2017-04-11,0.12753477804039448
601163:三角轮胎关于公司收到第二笔土地补偿款,85079,2017-03-23,0.541547190391164
炒股也要多积口德，别自已亏了就乱骂董事长，骂,8116,2017-04-08,0.059103505922075805
北狗，你的嘴如同狗吃了泻药，咋把不住门呢？,11833,2017-03-26,0.9494644630262828
今天可能会破29.别说北哥不提醒大家，嗬嗬嗬,6584,2017-04-10,0.05877744811750374
春节前的抢筹开始……,15871,2017-01-23,0.7603084839221962
今日主力账户流入3个亿，流入4个亿，净流出1个,14381,2016-09-26,0.9521614307790395
散户在股市中的生存手册 0.鸡蛋不要放在一个篮,4350,2017-03-28,0.9157352600048988
三角现在相当于上市第三天就开板了！,8849,2016-10-09,0.5279407883141367
拉高出货已成定局，没戏罗，没救罗，嗬嗬嗬,2564,2017-04-06,0.4748147886854647
是不是跟跌不跟涨大单畜牲垃圾股，嗬嗬嗬,5624,2017-03-31,0.009623888432538474
節後8個一字板漲停!!!!!!!!!!!!!!!!!!!!!!!!!!!,9697,2017-03-31,0.01562220763108424
现价买三角等于新股第一天上市买入，智者选择三,10874,2017-03-01,0.9032122640138992
北哥一个人举报的力量是弱小的，希望更多的散户,4547,2017-03-30,0.9726638420713818
吼吼吼，糊涂啊,1712,2016-12-20,0.2847954186422592
北哥已举报证监会彻彻底底查查垃圾三角是否真的,7146,2017-03-29,0.1620420214751579
三角轮胎 婊子操盘 一帮无耻之徒天天唱多 坑小,6868,2016-12-19,0.262388836452106
北狗这么活跃有何居心，真是恶心至及,9613,2017-01-16,0.3189479768064519
有只疯狗天天在吼、吼、吼，看他在能吼几天?,11095,2016-12-17,0.5628806457657399
三角要涨必斩杀北，如何砍了它？凌迟它小散都不,3559,2017-02-08,0.7013957698441018
小通又在大涨罗，垃圾三角又要大跌罗，嗬嗬嗬,3045,2017-03-28,0.18318174838691947
三角轮胎该涨不涨，是不是在运酿重组而控制股价,17462,2017-02-09,0.6692859899504154
三角轮胎：手握重金、意欲何为？,78676,2016-11-24,0.2034982580844964
三角轮胎连获中国重汽两个大奖,11160,2017-01-16,0.2913324544002448
石墨烯概念，将有爆炒,37589,2017-01-04,0.16406546829353963
601163三角轮胎，重大题材即将暴涨！,18289,2017-03-27,0.8384527858912926
关：发行张家港行次新股4.37超上海银行发行17.7,4067,2017-03-12,0.021042430948363444
如果近期能见33.北哥不再踏入垃圾三角吧，见证,27865,2017-02-16,0.28986905094559234
我就说一个道理按照目前的价格买进也好加仓也好,7775,2017-03-27,0.23475377351342297
没用，，周线大调已开始，北哥早就拉响警报罗，,5390,2017-03-27,0.022919204049139608
又跑了三千多万罗，完不完自己看，别听狗畜牲忽,5404,2017-03-27,0.8759989141019006
公告: 此股因近期高抛资金己全部归位，，资金将,13981,2017-03-10,0.9795863175195455
小心公告卖地的第二笔钱要到账了！！,9408,2017-03-20,0.006426454388843594
北狗你笑不了几声了把戏就是把戏,6951,2017-01-19,0.9422150090296801
北京股友1，是不是250啊？总觉得这人有点像神经,10066,2016-12-17,0.030858067060364758
重磅，之前我一直不评价股价，只骂北狗，现在我,7367,2017-01-23,0.7193517378402892
北狗莫吼了吼得你大爷心烦[大笑],9483,2016-12-19,0.9247076150953357
大家别理北京烤鸭，一个跳梁小丑天天刷存在感，,7218,2017-01-11,0.13973038789235925
北狗中午在厕所吃得很饱，下午才有力气,8016,2017-01-18,0.2921012764488279
不管涨跌，我就是想骂SB北京股友,5852,2017-01-25,0.22577588647750413
再加2400股，不惧下跌，主动买套。长期持有！,6485,2017-03-17,0.3199968001364669
三角小庄如再打压只会丢筹码，毕竟三角业绩好手,7362,2017-03-03,0.9983049730676622
嗬嗬嗬，又是一路向下，嗬嗬嗬,10622,2017-03-24,0.7788257699856805
北狗，你主人喊你回去领狗粮了，别在这里丢人现,3740,2017-02-17,0.7344500812385428
北狗又吃屎去了@东方财富网,8796,2017-01-18,0.9725507638573
北京股友是庄托,10195,2017-01-20,0.4844436157882649
质问“北京股友1”及其马甲,13192,2016-12-22,0.03777312141447453
601163:三角轮胎关于对部分暂时闲置募集资金进,56792,2017-03-01,0.29817120460951463
底部已探明,11020,2017-03-15,0.4000007633354342
买进三角轮胎，看好二胎概念股！！！,3577,2017-03-14,0.0805993522436218
北京股友送两个字：缺德,5903,2017-01-25,0.18305119425329675
北京网友1，你要死咯,7658,2016-12-20,0.07197345305070524
北狗，穷逼，你的股不超过十手，这辈子你都是穷,5702,2017-01-26,0.43481754865334943
北京股友1你又没股，你还天天被人骂，你这是何,5697,2017-01-25,0.014570455433453144
空狗无空可唱，开始造谣了！,9390,2017-01-19,0.9035138036174863
北京市股友1我没有骂过人，可你为什么还在里面,5313,2017-01-25,0.010836136489507542
北狗啊北狗害得老子29卖了4000股你妈偷和尚把你,3327,2017-02-17,0.9332587157242337
世界几大著名轮胎品牌排名——《汽车之家论坛》,21895,2017-02-19,0.9721460382229097
洗洗更健康，机不可失，失不再来，再加9900股！,8219,2017-03-24,0.043217831707325405
坚定持有601163三角轮胎的道理！,15008,2017-03-13,0.39145456368445486
要暴涨，不用急，小回调正常的。,6606,2017-02-27,0.11807446019194756
三角公司部分产品,7828,2017-03-10,0.7489255883389677
利空出尽，利好组合拳终将引爆三角轮胎一飞冲天,11734,2017-03-02,0.6391707316408636
轮胎世界网：三角冬季轮胎，北欧销量竟增长300%,18705,2017-02-24,0.17622183280222325
cctv2在播中外轮胎测试对比，国内轮胎各项指标,7974,2017-03-14,0.7817213983510747
中央二台消费主张,轮胎测试,7866,2017-03-14,0.08356184576177705
军用轮胎，飞机用轮胎年销量渐增，业绩提升。,14946,2017-01-24,0.3954972087939066
鞋有Nike，轮有三角。中国的名牌，定会走向世界,3266,2017-03-15,0.9998234761023035
轮胎业双反首胜提升中企话语权 专家：应提高国,2791,2017-03-21,0.9758721951027747
双反首胜这个概念  长脸   感觉三角既有可能被,3503,2017-03-13,0.9100128507246397
回看了一下中央二套，中国轮胎完胜法国美国台湾,4178,2017-03-14,0.9167799134820567
和美国人打赢官司的企业，能有几家，为三角人点,9145,2017-02-24,0.8508249879314258
轮胎行业跟踪点评：美国对华卡客车双反案中国胜,11628,2017-02-23,0.9095729181819365
双反首胜概念应该会被炒起来。 毕竟，中国企业,4706,2017-03-14,0.945287542018695
轮胎供给側改革，有利于三角轮胎龙头优势环保企,2795,2017-03-17,0.48102531982946395
三角轮胎财大气粗，能否成为2017年并购重组王？,25170,2017-03-03,0.45645747977560425
2016轮胎行业十大并购事件,12903,2017-03-02,0.4886262275255375
烂看垃圾三角稍微有点弱反弹指标居然又全在高位,6743,2017-03-23,0.48574009032069576
给你机会你不买，给你脸你不要脸，继续唱空者死,15696,2017-01-25,0.46612744519694504
三角土地补偿款之影响,38010,2017-01-13,0.8842165690853132
中国轮胎业兼并重组走向世界的必然性！,11493,2017-03-18,0.9895023194275617
目标80,不信走着瞧,4366,2017-03-16,0.7806477359453221
持股三角轮胎的理由 持股三角轮胎的理由 1、流,13913,2017-03-04,0.0030686236767836217
利好不断、趋势向上！,2039,2017-03-23,0.817822171701558
各有能力的小散都加仓耗死恶庄，反正是闲钱！,2790,2017-03-13,0.12069305690752752
公布第二批土地款收到之日，就是三角起飞之日！,8175,2017-02-28,0.32299080577499106
今日三角最后一跌，他日必将乘风破浪，直上云霄,10715,2017-02-03,0.9998934440680107
没有死股和牛股之分，所有的牛股在爆发前都是死,6596,2017-02-22,0.017096688637632806
海通证券：增持,10233,2017-03-02,0.6086532793127573
此股三高：高净资、高收益、高公积[赞],3848,2017-03-08,0.9892393648124339
这股接盘能力这么强。没有庄家看中。是不可能的,6771,2017-03-01,0.6546570802478591
价值低估，抢筹,2830,2017-03-08,0.8543779879655325
军队预算增长百分之七，我就不相信轮胎不用,6018,2017-03-04,0.8138970217904498
利好消息两条！每股一元多的收益，你们持有过的,9682,2017-03-01,0.47220576217430954
吸筹完毕，马上大涨,8918,2017-02-24,0.568192103921279
天胶期货早报:山东1月轮胎出口额大增,13447,2017-02-16,0.10568068833011002
轮胎涨价,4381,2017-03-15,0.2523992690561059
三角轮胎畅销  2017年03月10日 14:03:05 中国2,5116,2017-03-10,0.033247711673089264
再加仓2000股！主动买套！持有三年！,4923,2017-03-14,0.065098609635722
三角轮胎股份有限公司涨价通知,16945,2017-03-01,0.47156855498398775
跌就加仓，必有厚报。,2540,2017-03-16,0.17423062838358083
大牛股:三角巨型工程子午胎获国家科技进步一等,21722,2016-09-01,0.8096859489851431
三角和格力福耀都是中国制造的骄傲,6237,2017-03-13,0.9994937234698739
看空的不好意思，我要继续加仓了*^_^*,2996,2017-03-06,0.18124099923332448
07:37 轮胎价格集体暴涨：本土企业涨价更狠最高,9101,2017-02-27,0.3971368993984986
轮胎产品涨价增厚轮胎行业公司业绩，如前段时间,3479,2017-03-14,0.5819353629385069
请还了解三角优势的股友，在后面加进去转发！共,12574,2017-03-17,0.01580238186660088
坚持不上50不卖,4982,2017-03-13,0.19482777378600324
社保持股三角轮胎2千万股，养老金入市已在目标,15011,2017-02-20,0.010879520751227445
优科豪马副总裁跳槽三角轮胎 文章来源:轮胎商业,8649,2017-03-18,0.869338898095758
三角轮胎，中国知名品牌，市场潜力巨大,4784,2017-03-02,0.9677502635023119
三角轮胎，中国的老字号知名品牌！品牌价值也值,7900,2017-03-02,0.9925337682846221
目标价50，如果下杀择机增持,5054,2017-03-08,0.8964586126356207
大家别忘了，中国的军用车大都是用三角轮胎，此,9468,2017-03-02,0.1995368086181123
为什么大多数股民赔钱，就是因为把手里的黄金，,4660,2017-03-06,0.8890526749619087
这股就是原始股，现在不买，更待何时。全仓，一,4141,2017-03-14,0.08250283538321945
证券日报：轮胎价格集体暴涨 部分轮企将倒闭,15194,2017-03-04,0.7919477183773035
浴火重生，进入上升通道!,15102,2017-01-23,0.2218749208719939
此时正是加仓好时机,3108,2017-03-03,0.7695339879255864
前期33元多绝对绝对是顶部，现在是弱势弱势反弹,7877,2017-03-21,0.39595306836611865
三角有三大庄托！！！股友V3DVRj....抄底三角启,6833,2017-03-18,0.026752340564816346
京巴狗头被我砍了当球踢来踢去,21361,2016-12-06,0.12309201863773922
北狗就是庄托，大家一起操他妈,22556,2017-01-13,0.7141907200988263
天赐良机，抄底抢筹码！,3385,2017-03-13,0.6919691913120307
601163三角轮胎是近期错杀的股票！听我分析！,11645,2017-03-03,0.9524752276336709
洗掉不坚定筹码，拉升就轻松了！,2348,2017-03-14,0.24530549543679236
思考了几天，投资房子还是轮子？房子能出口吗？,3018,2017-03-15,0.9744281337978781
大盘诱空成功，三角底部探明！,3049,2017-03-13,0.9568533101047317
美国加息说明经济增长，股市不断创新高！,2194,2017-03-13,0.9989924006097276
三角轮胎亮相抗战胜利7O周年阅兵式二炮导弹方队,39331,2016-09-03,0.9864069948140292
如果垃圾三角下周不大跌北哥绝不再发帖，可以留,4262,2017-03-19,0.02230986960632042
轮胎产业今年一季度将普遍预增,14939,2017-02-16,0.17988027734610268
我拿着99天一直输，今天卖了，亏了40个点，希望,6859,2017-03-20,0.2795080200903197
轮胎价格集体暴涨 行业洗牌将近 三角轮胎龙头企,10644,2017-03-06,0.2669650517677855
