标题,帖子数,日期,情感
我们三角轮胎中签散户太团结了，就是要这样把一,12058,2016-09-14,0.14044677003898132
三角轮胎比兆易创新强在哪？,13276,2016-09-12,0.848490977165051
中国的米其林——三角轮胎！最少15连板！,29535,2016-09-06,0.5557952032410199
持仓的朋友看下重要问题分析,5813,2016-09-13,0.8108973975175064
为了准确挂单,42005,2016-09-11,0.32863692668682454
三角轮胎今日上市 逐梦世界品牌影响力,41655,2016-09-09,0.9999627951819333
挂单护板行动正式开始（6）,11046,2016-09-18,0.30960735302767106
国庆回来再看，一天一万,15667,2016-09-14,0.11054577098406282
已挂封单。兄弟姐妹们我们尽人事，听天命。不管,1393,2016-09-20,0.05502932767689794
兄弟们：每天做好三件事：封单200股，不卖一股,1694,2016-09-19,0.0008456541218149205
明板价：51.19，以挂,5940,2016-09-19,0.5234599508919096
请大家看一下！       散户有18万，一人一手就,7387,2016-09-19,0.8056945021933518
傻子才卖！好好看看这四天龙虎板就知道，都是机,26438,2016-09-14,0.36416970034583807
$$ 三棵树的好兄弟三角轮胎上市，预测：,27883,2016-09-01,0.9778027141653024
三角认为能过60元的打111，认为过不了的打222，,6016,2016-09-14,0.08317948151554377
谢谢网管，让我发帖，即兴一首藏头诗！,4048,2016-09-19,0.6164227577110774
深度好文章！致中签户：  大家把这条信息多发各,20353,2016-09-14,0.8684287392873986
三角轮胎必将打破新股发行以来涨停板的最高纪录,8006,2016-09-19,0.8286801096277375
三角是中国第一轮胎，行业龙头，重组预期，20个,17327,2016-09-11,0.7768405087666864
干干干，大家拿好手中票，保卫我们的三角轮胎！,25145,2016-09-09,0.28322814494643633
一千股,7235,2016-09-19,0.35072516527654074
90% 的筹码都在我们手上 让我们好好做一回主力,11448,2016-09-11,0.4089435410531368
安心持股,7240,2016-09-19,0.2613422468933889
重要.重要.重要的事情得说三遍,7871,2016-09-15,0.7342887196393367
三角轮胎：主力没理由看空，目标20板,32857,2016-09-12,0.12230448155750895
三角绝对优势：散户占流通盘90％，散户就是庄家,15837,2016-09-10,0.46543868367685726
对空自卫反击战 中签联盟！！,26838,2016-09-10,0.41594231470114595
乱拳打死老师傅，用此招，机构想开板比登天还难,32241,2016-09-12,0.0007670749942103594
威海金三角一线海景房价格暴涨,4363,2016-09-19,0.989250513219615
中签散户静一静，请进来听我说两句！,24746,2016-09-17,0.15603238140218678
呼吁中签三角的散户们 每10分钟上来顶贴一次 大,18254,2016-09-11,0.052042795159833344
机构如何欺骗新股打开涨停板！ 托是如何欺骗中,32007,2016-09-06,0.0506170687485743
请每个中签和持有的朋友每天都顶一下这个帖子,15651,2016-09-09,0.03769439289671639
钱不多，不过会尽力保证挂单,2635,2016-09-13,0.09341690797023883
中秋节放了三天假，顶了三天贴！,10011,2016-09-17,0.043381418887052825
中国三角轮胎世界一流：,6897,2016-09-15,0.9991238991308334
向所有还在为护板而奋斗的三角散户们致敬：,19793,2016-09-14,0.9902256715792002
小小的贡献，希望大家都搞起来,4892,2016-09-18,0.880153425618369
三角股票近几天盘后数据分析,8843,2016-09-19,0.9881852387571353
请问晚上什么时候挂单有效呢？我每晚12点05分挂,2610,2016-09-19,0.010032192739793944
请大家顶起此贴,2497,2016-09-19,0.28536601873537815
我媳妇说27个板，我觉得25个板[献花][献花][献,3687,2016-09-18,0.00260010823391299
603868飞科电器：世界三大市场研究调查集团之一,1563,2016-09-19,0.952588534077851
中签兄弟们，做好每天三件事！,10461,2016-09-13,0.13303804212149806
锁股，锁股，锁股，锁股，锁股，锁股，锁股，锁,10947,2016-09-12,1.2600585030941858e-07
昨天的0.12%和今天的0.35%其实都是非常小的换手,4589,2016-09-19,0.595168055593192
换手率到了百分之四以后，还能有三个以上停板,4159,2016-09-19,0.504066287229527
其实转过来一想，三角的主力就是散户，只要散户,1919,2016-09-19,0.24106947659690436
本周不会开板,散户莫慌张!,3917,2016-09-19,0.3467268477088512
8个板就要偷笑了！,4959,2016-09-19,0.39903880554559745
延期开板靠大家齐心合力！,5811,2016-09-06,0.9387416269604263
致三角未挂单的散户同志：致三角未挂单的散户同,5586,2016-09-19,0.9735140670286299
我们三角轮胎中签散户太团结了，就是要这样把一,5227,2016-09-14,0.14044677003898132
现在机构狗进入病态疯狂了，成为疯狗，那就是畜,3528,2016-09-14,0.8783897624148623
我挂单买上了，是好事还是坏事？,11538,2016-09-14,0.2566455765577701
就算你跳伞，那也得等飞机飞上天啊！,2272,2016-09-19,0.2760319141455698
看看吧，前面的托盘谁撤了？,5437,2016-09-19,0.03084695653301206
再删再发。,5152,2016-09-19,0.116863154658567
中国第一支千元股价股票属601163,2628,2016-09-19,0.9336730993287871
是男人就把持住！,1870,2016-09-19,0.7317711059910693
换手率怎么这么高了？才几天啊,3657,2016-09-19,0.21097356969957526
[图片],7657,2016-09-17,0.5826086956521737
散户根本没人卖！散户也根本买不到！只是小丑对,4728,2016-09-13,0.11527694547794665
今天突然冒出一大波空狗，居心何在？,2177,2016-09-19,0.7502662084196858
特意登录上来有重要的发现 刚刚浏览了安图生物,4620,2016-09-19,0.9070121345998111
恭喜各位，也包括我自己！,17516,2016-09-01,0.7791809115746303
三角轮胎(601163)龙虎榜数据(09-14),35971,2016-09-14,0.821451959236984
深度好文章！致中签户：              大家把这,10847,2016-09-14,0.9405368236707986
战斗开始了， 速速挂单，加油,2332,2016-09-19,0.32227689493273226
明天又要投入战斗了，大家准备好了吗？,6846,2016-09-18,0.4453724176390663
三角轮胎供货解放军信息化部队和火箭军（可在三,5385,2016-09-18,0.42494905976690267
多空激战3000点 节后或小幅回升,864,2016-09-19,0.2791033375265328
转董事会致中签小散函：,20544,2016-09-10,0.157675228196427
大家只要明白一点，砸盘是需要筹码的,5568,2016-09-09,0.7186590529655916
中签的朋友必看你们一定很好奇为什么新股一上市,10641,2016-09-09,0.9383478099177949
封板期间机构操盘手段总结,7432,2016-09-13,0.38714118158929367
权威测算：至少18个板！ 行业龙头、绩优、军工,2794,2016-09-19,0.8970208102901722
中签的散户朋友，有钱的出钱封单，没钱的捂盘捧,4056,2016-09-16,0.006840878146795348
小散只要坚定不跑，并且积极参加每天封板行动，,6638,2016-09-06,0.5928598277163771
中国三角轮胎，走向世界军工及超大型工程设备顶,6466,2016-09-15,0.996138201140359
一年赚只几百万的垃圾公司上市都20几板才开板，,12901,2016-09-08,0.006498673833689517
今天庄家手上的筹码对换结束。散户没人卖,2646,2016-09-19,0.43104928121857555
今天放量太大，明天危险！不看好的朋友们抛吧！,6141,2016-09-19,0.12913907980106176
2016年，新股平均18个板，申购价在20元以上的新,24724,2016-09-12,0.299591100211243
2016年，新股平均18个板，申购价在20元以上的新,2305,2016-09-19,0.299591100211243
请大家明白一个事实,3216,2016-09-18,0.32773080570250623
消灭一切空狗，隐形空狗和消极帖子,5058,2016-09-16,0.4664555253997168
大家好，为不打烂丈，先瑞祥哥为总指挥好不好[,3028,2016-09-17,0.39976638880865245
好贴不能沉，大家用力顶！,1978,2016-09-18,0.3706319681547592
周二9月20日大盘的阻力是10和20日线,944,2016-09-19,0.019406355721026336
中签的朋友，看好三角轮胎，一定不要卖。五倍的,2437,2016-09-18,0.07526918319202025
三角爆利概念，爆发加井喷啊！挡也挡不住的，顺,2391,2016-09-19,0.7300404471847527
能挺到周五吗？感觉后天就要开了。市值马上超过,4161,2016-09-19,0.17903707821839432
流通盘200万手，成交量两三千手，什么概念？,10906,2016-09-14,0.3380179123411773
周四不开板，周五必开板！,3564,2016-09-19,0.7348700873481444
收评：今天A股早盘两市上幅高开,1341,2016-09-19,0.02887042438719356
大部分散户都不错，部分穷鬼因为区区几万块就投,2838,2016-09-19,0.6411821427034777
继续挂单护盘！！！[赞][赞][赞][牛][牛][牛][,2522,2016-09-19,0.9961593771343602
继续12手，尽一份力,3006,2016-09-19,0.6046382337460561
9点45准时哑火。,5264,2016-09-19,0.049203200620464904
三角有良心，土地拍卖在上市后开板前,7671,2016-09-19,0.9656078374502395
从我做起,1600,2016-09-19,0.8
自己为自己鼓劲！加油！用洪荒之力为三角护板！,1840,2016-09-19,0.9540300110410399
大盘是否到了加仓时?,1455,2016-09-19,0.5322574690723546
就这点换手。周五不可能开版了。主力有可能打照,3502,2016-09-19,0.24203831028798706
买了1000，呵呵,4146,2016-09-19,0.6360100994852977
截止到目前涨停个股不到30家,1463,2016-09-19,0.10511815138526415
今天30分钟大盘的最后一条短均线30X3,2217,2016-09-19,0.3705910240020074
三角轮胎，就如酒中极品茅台！！！！！！！！！,2101,2016-09-19,0.6543199291344666
就这成交量也想开板？,2824,2016-09-19,0.4917814607490165
今天封板已不满10万手了，明天早上会有多少？,3706,2016-09-19,0.03497343379678697
挂单,1720,2016-09-19,0.17360285248046092
股友们，什么都给你们算好了，挂单吧，每赚签十,2035,2016-09-13,0.055103463580132295
企业是什么，企业是股票的母体,1636,2016-09-19,0.8005766150851221
三角换手率！！！,4898,2016-09-19,0.12053252905365841
机构开始耍花样了，空狗越来越多了！！,869,2016-09-19,0.3592807706685405
机构开始一手一手的成交,5410,2016-09-13,0.8699470892246892
挂单封板的重要性以及几个误区的释疑,5878,2016-09-15,0.6082477442168764
星期三开板，立贴,3261,2016-09-19,0.21270991843231468
如果你打算长久在市场里拼杀,1465,2016-09-19,0.7605428018745698
中签散户赶紧出手追加挂买！,3011,2016-09-19,0.29380495531247064
今天开盘前半小时机构左右手对倒5000手,3993,2016-09-19,0.5314661635457882
下午好，朋友们，吃饭回来,1878,2016-09-19,0.6686477239057235
一分力！,1785,2016-09-19,0.5
我买进来500股,4004,2016-09-19,0.09512230973542801
护板不会被深套,3124,2016-09-16,0.7491380754883792
待会一点开盘还会对倒一波，然后开始两手五手的,1777,2016-09-19,0.41180425339178073
坚决护盘，要求不高，坚持到最后,2275,2016-09-19,0.455501721136782
主力资金在对倒两千多万。散户被骗六百多万。,2377,2016-09-19,0.2958413352281436
下周一时刻紧盯盘面，封单减少要开板时立马挂低,9311,2016-09-09,0.00932570568111124
大家看到江阴银行是怎么骗散户筹码的，集合竞价,1948,2016-09-19,0.01424512014559609
谁敢砸开板，炒暴风的干死她,4189,2016-09-09,0.0018662684222877646
挂单千万不能撤，让系统3点后自己撤，别给机构,1150,2016-09-19,0.00019742400700317742
同样的8万手，越往后机构吃掉封单需要的资金就,7009,2016-09-14,0.5047479642895333
挂单9手,3197,2016-09-19,0.09736243533054478
每个中签的朋友都要来看看，一定要看 三角轮胎,12926,2016-09-01,0.6541572570210727
米其林股价89欧元，三角轮胎打两折也到150元！,2156,2016-09-19,0.05700991282794099
友情提醒三角的朋友们,2797,2016-09-13,0.9752403395858305
继续奋斗，第一目标先封板到国庆节！然后拿挣的,2223,2016-09-18,0.9952372329553576
这篇文章我其实不太想写，大家进来都看看吧！！,2937,2016-09-18,0.36820139031637333
今年85只新股开板价与发行价比较:上海平均涨幅5,1626,2016-09-14,0.1919921617783399
凌晨就埋单我怎么没买到？,2797,2016-09-19,0.4171419762155357
每日挂5手参与封板,1677,2016-09-18,0.9077603895236553
且不说轮胎第一股！三块地拍价突破28亿就值120,7732,2016-09-16,0.024528471053231637
不要怕机构卖出，让他们砸出来，2000到4000万股,4942,2016-09-07,0.10857866344018674
鸡狗撤单贼快，同志们挺住！,1581,2016-09-19,0.6308190742053311
我已开始行动，就差你了！,1773,2016-09-19,0.12466252903144237
不要自己吓自己,2953,2016-09-19,0.3693910911319984
回答一下质疑三角轮胎成为高价股的人，,7238,2016-09-10,0.0026007594510024656
听三角轮胎要搬迁，原厂卖给万达开发，是不是有,26144,2016-09-10,0.19809895112127174
新股涨停板是怎么样被砸开来的!,1674,2016-09-19,0.36294511702077625
竞猜三角轮胎的开板价，恭喜中签的股友。,63046,2016-09-01,0.5561772787603539
三角拉到150巨大的广告效应,6116,2016-09-18,0.4524075532731392
三角轮胎，下周五开板,9311,2016-09-14,0.4942469029174249
内参：至少18板！捂紧就行，你们什么都别想！,1927,2016-09-18,0.009538110965185753
中国股市的制度决定了 开不开板现在谁也不知道,2666,2016-09-14,0.9573504410039444
快打开吧！我是真想买，一千股太少了！！,1818,2016-09-19,0.07545127521240802
轮胎行业品牌排名,5599,2016-09-17,0.4203570830308392
今天你们卖出的筹码就是明天机构砸散户的子弹，,1012,2016-09-19,0.23819057803763388
要开板的节奏啊。。,3026,2016-09-19,0.6280296631018764
2016年度全球轮胎75强排行析评,6594,2016-09-17,0.015651406114312816
中肯的分析总是不听，喜欢听乱吹的,6898,2016-09-18,0.9584442053393053
据报道，青岛至威海高铁十月通车，三角地价应升,5214,2016-09-19,0.9972464129427087
朋友在威海证实了，巨资补偿将入季报，业绩爆增,3665,2016-09-19,0.8728741953890949
挂单护板行动正式开始（4）,5124,2016-09-14,0.21202181726798597
我的贴怎么没有了，什么情况，每天挂单，要卖的,1361,2016-09-14,0.06553046187233447
已在十三日涨停位挂单1000股。请各位祝本人成交,3831,2016-09-12,0.10968037006337639
再坚持几天？开板？,4708,2016-09-18,0.25976900155347926
三角轮胎大家都醒醒吧。冷静下。,5399,2016-09-17,0.896037620507905
每日挂单的涨停价，请大家准确挂单！,3447,2016-09-13,0.863265764370355
明早割了点股票来护板。,1707,2016-09-18,0.5075243603706291
开始吧,2897,2016-09-18,0.5262327818078083
三角，800亿市值是完全可以撑起的，假如持股者,4192,2016-09-18,0.7564700848796255
中签的朋友看下这篇能让你多出好几万收入的文章,3290,2016-09-17,0.9789111345951766
第六天后所有的人都大吃一惊,当天换手率才0.05%,9836,2016-09-08,0.6545420224804567
今日挂单800股，希望能成交。 空头太少！子弹不,2338,2016-09-14,0.11908319334088258
重要的事情说三遍换手率换手率还是换手率,9447,2016-09-17,0.04555493595930893
本周日晚八点，金三角散户们贴吧集合，召开咱们,4366,2016-09-14,0.05002479100085566
至少板到国庆节！同意的顶起来！,16895,2016-09-10,0.4839513462934101
不多不空，玲珑轮胎是最有参考价值的,9303,2016-09-05,0.24374919997756594
只要中签散户不卖，每天封单，股价可以到天空。,1223,2016-09-14,0.22056417725463284
读懂祥瑞哥、擒头熊、福州正联胶带、A守护之光A,2463,2016-09-11,0.9995229660825731
感谢三角轮胎让我们聚集在了三角股吧，感谢三角,6496,2016-09-15,0.46096628097307046
开板价,31953,2016-09-01,0.7526499055869263
60块开板，心满意足了，,4896,2016-09-17,0.21742317729232385
别慌，成交正常！,19946,2016-09-14,0.36007671526828366
中签的朋友看下这篇能让你多出好几万收入的文章,3362,2016-09-16,0.9789111345951766
唱空的！你们唱空是为什么？走狗？卖早了？想买,1991,2016-09-15,0.8463961111734408
好不容易中签三角的朋友，一定要团结，让三角往,1773,2016-09-14,0.31316180649558945
珍惜当下与未来并肩作战的机会！,6110,2016-09-14,0.99797126137643
每天要做的事：不回空帖顶多贴、挂买2手、20个,4750,2016-09-14,0.017437812347117054
司马昭之心路人皆知,3788,2016-09-16,0.7930067221376376
战友们，我们的口号：追平兆易！我们的目标：超,8567,2016-09-13,0.9698794518782542
因为三角我们相聚，因为三角我们想知，因为三角,7446,2016-09-13,0.9922182133804203
哥是文盲，不懂k线，中签不易，天天护盘，起早,2816,2016-09-15,0.9253120212649724
603868飞科电器：是时候该给股民补上残缺的涨停,2492,2016-09-16,0.8925513880410829
至1.庄托；2.空狗；3.中签想卖或已卖的散户！1,3879,2016-09-14,0.1556894468672031
深度好文章！致中签户：  大家把这条信息多发各,1768,2016-09-14,0.8684287392873986
一天一万,2672,2016-09-14,0.40944305450989193
三角轮胎：一个轮胎换一部宝马X5，一脚油门一个,11286,2016-09-09,0.06077449434528692
轮胎龙头，军工概念，绩优，高分红，易地巨额搬,2575,2016-09-16,0.4796743198912017
每天都顶祥瑞哥，不要预测开板价，不要回空狗帖,1764,2016-09-17,0.8748018879794617
大家仔细看开盘的成交，就可以看到机构的意图了,10007,2016-09-13,0.3679550646552764
三角我们十几万散户大军，迈着整齐的方步，兆易,5468,2016-09-14,0.562635941249266
15个板是铁定的，只要大家齐心协力，坚持不卖，,6081,2016-09-11,0.36313126762922243
把其它股都割了，全力封板三角，一定要打破兆易,6643,2016-09-14,0.331998877709361
三角轮胎，每股收益行业第一。三角轮胎承载着千,4821,2016-09-14,0.9946485009898158
空狗又开始叫嚣了，估计今天过节，主人赏了两根,2222,2016-09-16,0.30714913023232204
中签散户必看：三角一定会有22个以上涨停板！,7943,2016-09-13,0.7552133538479714
中签兄弟们，做好每天三件事！ 1、一股不卖。2,3020,2016-09-14,0.0017270484139174647
三角轮胎股友们中秋快乐！顶上二十个板[胜利][,2820,2016-09-15,0.919280357251881
9-10军工唱主角，三角大量供货军用轮胎,5586,2016-09-11,0.9312440650340256
散户朋友们，平时我们没有多少资金掌握主动任人,1108,2016-09-15,0.946928291793184
机构骗走我们的筹码再砸我们。我们坚持挂单封板,1061,2016-09-15,0.005903778943986193
兆易一签16万了,7221,2016-09-13,0.1558163082514542
三角现在才三，四个板， 若能护板买进后面少说,2688,2016-09-18,0.19658253457472508
不要看不要回庄托空狗的贴子,875,2016-09-14,0.20609551499779388
天上月圆，人间半月，月月月圆逢半月，三角涨板,6960,2016-09-14,0.9576146033438664
对比分析 挂单护板,10762,2016-09-13,0.7287058016590421
现在吧里叫嚣快开板的才是最大的多头，能感觉到,3969,2016-09-15,0.9636954868170949
三角轮胎——奔驰在棱角犀利的路面上,2238,2016-09-13,0.9059992381611188
温馨提示：可爱的散庄们，不要回空狗的帖。因为,3364,2016-09-14,0.8746141788046088
大家注意不要打开去看空狗的贴子,3711,2016-09-14,0.315515818524827
《三角轮胎180元以下不卖联盟》每日签到簿！！,5429,2016-09-09,0.15846946335629208
三角轮胎210元！,3587,2016-09-14,0.1104837930894551
新股封板期间机构操盘手段总结 1.左右手互倒（,4505,2016-09-15,0.10803720690502161
三角轮胎中签看过来,4837,2016-09-12,0.4510910773218918
那个股票有牛角?还不只二个角乃三个角的妖股!牛,1781,2016-09-16,0.8123694207023885
权威测算：至少18个板！ 行业龙头、绩优、军工,12469,2016-09-15,0.8970208102901722
坚守、坚持，团结就是力量。,1872,2016-09-14,0.9879713248822978
伟大领袖毛老人家教导我们:“一切机构和空狗都,2420,2016-09-14,0.6484649237333155
因为三角我们相聚，因为三角我们想知，因为三角,1612,2016-09-14,0.9922182133804203
三角散户是最棒的,13642,2016-09-13,0.9847551094682347
虽然我没有中签三角，但是还是希望广大散户多赚,2510,2016-09-16,0.4914053774262337
你们挂单了吗？我每天都挂直到20个板,3705,2016-09-14,0.021140291114095877
三角轮胎出口欧美，产品名扬海外，与国际多家知,2375,2016-09-11,0.9649957483396653
开盘头一个小时，机构会拼命用自己的筹码对倒，,4887,2016-09-12,0.5640464875362865
散户小心机构昨天的戏法，开盘大单对倒，然后撤,1394,2016-09-14,0.029748985663433203
散户朋友：每天以涨停价挂单1000股！同意的顶！,1013,2016-09-13,0.20112324952752814
坚持挂单封板，坚决持有,当时暴风科技从9元涨到,1577,2016-09-13,0.05370884218864336
天天提醒，机构大户手中有百分之十的票，接近两,2426,2016-09-15,0.8329257695062411
一个山东军区，你就知道给三角带来多少收益了！,2943,2016-09-14,0.9893940169509193
这次命运要掌握在咱散户手里！,4421,2016-09-05,0.9818886244704144
当初欧普照明傻散吹牛逼说比兆易创新强的多,4653,2016-09-17,0.392015312517597
军车用轮胎，那三角轮胎当然是军工概念了！,2638,2016-09-12,0.4214265681166136
今天机构左右手对倒后,三角28分钟没卖出交易的,8125,2016-09-14,0.43899258458925017
关于三角土地搬迁价值 根据《中共威海市委威海,9042,2016-09-13,0.9999164817746522
中国任何行业老大目标都是世界前三，这是任务,12049,2016-09-16,0.9830640551604691
切勿忽视：三角轮胎军工背景低调背后是黑马,4840,2016-09-17,0.9742115847656236
肺腑之言： 每人每天挂封单100股以上，这点绝对,6511,2016-09-16,0.013901909593903583
我们的口号：把炒股亏损的钱从三角轮胎中夺回！,7609,2016-09-07,0.1090091055476281
恒大和万达争夺.金三角地王每股收益至少3.5元,5169,2016-09-15,0.9578417487954685
世界最大的中国军工超大型工程运输平板车共用三,8774,2016-09-15,0.8278329106696479
解释贴 换手率,5057,2016-09-14,0.12796018463755066
三角轮胎首次公开发行A股上市仪式在上交所举行,6998,2016-09-14,0.3918567817478591
星期一卖股护板,4576,2016-09-15,0.3345994933301487
40元以上争夺筹码过早开板，庄家、机构、散户自,3303,2016-09-17,0.8617644020068477
这只股的小散这么团结啊？,2183,2016-09-14,0.09279524813694984
同志们，有大单封板也要继续挂单，革命尚未成功,3921,2016-09-14,0.7399127426392674
三角轮胎厂房开始拆除,5288,2016-09-17,0.03896097717388791
各位中签的朋友，要想明白一个事，前面的板由于,2834,2016-09-13,0.3387871895202411
后两周10连板，再往后不好说了,3641,2016-09-17,0.02091378649012887
中国的米米奇林，三角轮胎！军工，加高业绩，加,3122,2016-09-14,0.9672967868513574
小散们选个吧主统一指挥好吗？,2117,2016-09-17,0.4448562147522399
乱喊没用，理性分板才会达到利益最大化。综合三,4454,2016-09-17,0.2415081435699893
日前，世界首条石墨烯导静电轮胎生产线——“森,4288,2016-09-17,0.7283626412336808
坚持到卖地分红,5332,2016-09-17,0.4737672181921908
哪位高手解释一下，机构为什么要砸开涨停板，机,7371,2016-09-15,0.07989486740843232
向兆易创新学习！,3106,2016-09-15,0.9347681034056284
看好至100元左右,3231,2016-09-17,0.2827301550077477
三角有块地要卖，转让费还25亿？,5206,2016-09-15,0.2655931192890615
如果土地出让达到22亿，那三角可以分16亿，合每,8211,2016-09-16,0.8792969167207901
天宫二号指定使用三角轮胎,5210,2016-09-17,0.43627608178508304
行业很重要！重要的事情说三遍，一个轮胎企业能,9867,2016-09-16,0.8307079594640142
三角轮胎四十板收益起码赚一百多万,25336,2016-09-06,0.8535259541711616
虽然我没有中签三角，但是还是希望广大散户多赚,1235,2016-09-15,0.4914053774262337
加油三角！！,1826,2016-09-14,0.9229022252969957
中国第一支千元股价股票属601163,4553,2016-09-16,0.9336730993287871
兆易创新（603986）一签赚16万,5255,2016-09-13,0.18498985884334507
大家仔细看开盘的成交，就可以看到机构的意图了,5831,2016-09-14,0.3679550646552764
三角轮胎要珍惜，中了好签实不易。 坚定不卖一,1761,2016-09-16,0.9879401899876442
我们小散的表现不错，继续努力,1778,2016-09-13,0.9634133424909079
最多还有三个板,3740,2016-09-16,0.5040926243040657
同志们 大家一起捂到 300元以上 兆易已经17个涨,7802,2016-09-10,0.03006956404080241
每天零时以涨停板价挂单买入三角轮胎，不相信买,5930,2016-09-08,0.5710100107676374
重估三角轮胎的合理股价,8519,2016-09-16,0.5425750854083031
三角轮胎的卖出位置,10325,2016-09-13,0.6192317620243709
功盖三分股，名成三角阵，江流石还转，唯是大牛,8357,2016-09-06,0.9672962351460715
保佑我周一中一签,5221,2016-09-16,0.177197785117303
兆易创新能做到的，三角轮胎也能做到！！,1742,2016-09-14,0.5437013629070286
以前是机构决定新股上市价格,1826,2016-09-14,0.40133137983370726
中签的朋友看下这篇能让你多出好几万收入的文章,3222,2016-09-15,0.9789111345951766
军工概念——三角轮胎,6413,2016-09-12,0.8322988763870875
重估三角轮胎的合理股价100元之上,2014,2016-09-16,0.8503586354286916
三角轮胎价值再发现,5175,2016-09-16,0.3817123731601384
总有开板的一天，那时谁来接盘？,6754,2016-09-15,0.409100646134791
