标题,帖子数,日期,情感
明天可能高开，有可能直接封涨停,14155,2016-09-01,0.14643374748337523
今天洗得凶，杀得狠，把所有获利盘全部洗刷刷了,36887,2016-08-31,0.0015138109199145378
东旭光电董事高管减持股份,58056,2016-07-27,0.3935890286538447
东旭光电(000413)高管持股变动信息(7-18),78889,2016-07-19,0.057350669966533596
东旭光电(000413)高管及相关人员持股变动信息(7,58647,2016-07-21,0.017323446132692544
烯王生于七月中 风光不与四时同 光芒四射无穷耀,3874,2016-09-01,0.9998390351089198
杭州私募：东旭光电2016年目标价50,11908,2016-09-01,0.9936108889827675
今天15.5全出清[胜利][胜利][胜利][胜利],6708,2016-09-01,0.8511262707647546
卖掉东旭光电，坚决卖掉的理由:,21489,2016-08-29,0.0076092111209656865
东旭光电今日超大单流入排名第4名(08-31),41900,2016-08-31,0.3623349469917052
东旭光电(000413)融资融券信息(08-31),15096,2016-09-01,0.5510693131469493
哈哈，高抛低吸，天天收钱，真爽啊！,9278,2016-08-23,0.558197783403649
小逼庄 今天14.78就是你的高点吗,7323,2016-09-01,0.4501890836497555
资金流出.快跑!,4731,2016-09-01,0.9408477801179208
逢低关注：000002，万科A 预计短期内会有拉升,12887,2016-08-30,0.9551661907171611
【讨论】午后突遭暴拉，东旭光电能否就此崛起？,81180,2016-08-31,0.9767163715888435
东旭杀跌确立，剑指何方？,16863,2016-08-22,0.12290900488545298
股海早參（09.01）,3630,2016-09-01,0.16765911034200498
东旭光电:简式权益变动报告书,32750,2016-08-24,0.13481568196496352
东旭光电:关于签订募集资金三方监管协议的公告,31137,2016-08-24,0.06508999324916742
今天13.20买了1500000股，呵呵,10915,2016-08-31,0.3206951312828201
突然发现唱空的都消停了？？！！,14271,2016-08-25,0.04830986183900443
东旭老人还有吗，你们可安好？,12816,2016-08-31,0.8913292239287575
旭日东升红似火[买入][买入][买入][买入][买入],4380,2016-08-31,0.9756632764571928
东旭官网已开始预售石墨烯充电宝!价格299元!,24604,2016-08-07,0.010272239712218356
我懂了，我敢满仓,17162,2016-08-09,0.1487617979694087
还有谁收到短信的？,7977,2016-08-31,0.255306437176532
今天13.40加仓……祝大家发财[满仓][满仓][满仓,4775,2016-08-31,0.07972895639920707
理论上东旭光电翻红概率比较大，你认为能涨到14,7979,2016-08-31,0.16246611700958546
好悔啊,13.25清的仓.14.73又满仓买回来了,7825,2016-08-31,0.5
今天的交易情况和明天的预测,98418,2016-08-01,0.39675034893942374
军号已吹响，部队正出发！,7596,2016-08-31,0.31307676350573643
今天运气太背，购房预付款亏了两万多,6104,2016-08-31,0.11719222206721547
我13．3吓跑，13．5又接回，不知道下午会不会红,7615,2016-08-31,0.15390657378729178
东旭光电今日超大单流出排名第4名(08-30),28561,2016-08-30,0.12438570173010333
半年报业绩估都可以估到,41383,2016-08-26,0.7076642659695959
怎么办，13.35被吓跑了，亏了2万多,4064,2016-08-31,0.29204145029160866
首款石墨烯基锂离子电池“烯王”遭质疑,22908,2016-08-28,0.2921425553340543
我弱弱的问一句，明天会怎样？,7130,2016-08-30,0.15999735397588888
大家都来看看增山粤的嘴脸，让他那个贴沉了吧，,12750,2016-08-23,0.8017058973022152
重大事项停牌公告,16994,2016-08-30,0.6008442546211871
东旭光电基本面到底咋样？人家董秘是这样说的  ,49252,2016-08-30,0.08335219239002645
宝泰隆和东旭我都喜欢，东旭的稀王是非常有诱惑,13204,2016-08-30,0.8543020636968693
那么多生面,4299,2016-08-29,0.5
这才是好消息: 聚焦  东旭光电亮相2016智能显示,18810,2016-08-24,0.11882293464290028
中报简析，大利好！！,11876,2016-08-30,0.6252430023768556
要时刻保持警惕！,3597,2016-08-30,0.769692533856882
不要掉以轻心,2023,2016-08-29,0.5
东旭光电(000413)融资融券信息(08-29),10246,2016-08-30,0.5510693131469493
咱们大多人都被表面所迷惑,3340,2016-08-30,0.4850859553078798
最后一次洗盘,7211,2016-08-30,0.7076550921540983
旗型整理，典型的上升尖旗型,8404,2016-08-30,0.3228217667966722
东旭光电:七届五十一次董事会决议公告,32402,2016-03-31,0.21193165326918584
计算一下：百吨石墨烯11月份可达产,9658,2016-08-30,0.43736238858284127
东旭光电：半年营收28.82亿 石墨烯成未来发展重,67725,2016-08-29,0.302505800836127
13年至16年共4次增发，堪比京东方还黑，发个假,9234,2016-08-30,0.24287830691421308
想不到这个事情闹大了，引起XXX的关注！,8564,2016-08-25,0.846786012087679
东旭光电:2016年半年度报告,85643,2016-08-29,0.2269755863576669
现在对报表不感兴趣，只关注石墨烯,8725,2016-08-29,0.6586291568970364
东旭光电:2016年半年度报告摘要,89180,2016-08-29,0.44228750693799
半年报还没出来，咱们先闲聊几句。今天盘面走势,15849,2016-08-29,0.5353200109172204
大盘处于相对低位，公司业绩连年快速发展,2533,2016-08-30,0.9849956113657746
国家政策持续推进 石墨烯联盟将力促产业化,1733,2016-08-30,0.9460806234905157
业绩不及预期，明日高开低走，继续死叉下跌之路,4675,2016-08-29,0.9112656315135587
专业看中报：坐等停牌注入与定增泰州百吨石墨烯,15254,2016-08-29,0.9939165058558445
周二情况，势不可挡！,6431,2016-08-29,0.09519384838158562
明天晚中报并重大事项停牌,20666,2016-08-28,0.20101345775203994
周二早盘，会是什么样？,7490,2016-08-29,0.16755737362773204
光电加油,2815,2016-08-29,0.9624885706296957
明天蓄势待发！,4875,2016-08-29,0.2845935741427815
想想明天，看看今天。扬眉吐气,4527,2016-08-29,0.386994645807891
000413半年报公告,12509,2016-08-29,0.44767845850986676
炒股失败的主要原因,2181,2016-08-08,0.077327378530888
000413主力已大幅进场，暴涨之势指日可待！,17087,2016-08-12,0.6103604307022797
今天的股价已是反应了 今晚的公告  你以为那些,8922,2016-08-24,0.6582109064580305
唱空的都是别有用心的空仓客,5032,2016-08-24,0.12326646828353172
石墨烯可能是个骗局？下周可能暴跌?,20017,2016-07-23,0.5678383114914001
东旭B:2016年半年度报告摘要(英文版),24298,2016-08-29,0.8082199361658465
请问大家，谁知道现在股东人数是多少啊？还有中,6600,2016-08-29,0.052305986044634434
明天大事件！,2469,2016-08-28,0.32617616156752305
百试不爽的九大实战定律,3478,2016-08-28,0.35437807333025073
2016年实力妖王：6元国中水务 11元中信国安 14,11740,2016-08-28,0.9994735970852506
想想明天好刺激！,5367,2016-08-29,0.5805528679293251
机构今天都在卖[好困惑][好困惑][好困惑],8547,2016-08-29,0.9999824963146525
今晚公布10送20股,12200,2016-08-29,0.019642447040808197
东旭光电(000413)融资融券信息(08-26),18431,2016-08-29,0.5510693131469493
读懂投资的那些“道”与“术”,2268,2016-08-28,0.9592270476559626
早上拉高诱多，下午小心砸盘啊[想一下],7681,2016-08-29,0.6277185891040097
我国科学家发现石墨烯对肿瘤早期诊断的作用,7674,2016-08-29,0.9982286756988817
买东旭光电不要忘记初衷，就是石墨烯技术，石墨,6392,2016-08-28,0.6326160766070037
看空的抓紧卖，千万别买，买了你缺德了,4663,2016-08-29,0.1828925202739904
下周走势，股吧不让发，真是可悲散户,28974,2016-08-20,0.26014902939295215
王忠辉告诉记者：“东旭光电是目前全球唯一可实,24596,2016-08-27,0.8074241737843892
东旭光电八元九元时候你们去哪了，为啥不买，低,7010,2016-08-28,0.0030919952748699187
东旭光电今日超大单流出排名第14名(08-26),34231,2016-08-26,0.11793370093793931
碳源汇谷单层石墨烯价格表,16563,2016-08-28,0.6437839859047891
蓝宝石涂层或革新苹果产业链 概念股站上风口,10611,2016-08-28,0.8063336516838854
2016年实力妖王：6元国中水务 11元中信国安 14,11677,2016-08-24,0.9994735970852506
资产注入、泰州项目规划、定增完成将同步发布,18357,2016-08-23,0.9603543627759229
(三)时机定律,2237,2016-08-28,0.1272762533589603
关于增发的低价: 8月东旭的价确实很高过了增发,16384,2016-08-28,0.6013098924106225
谈谈东旭的增发、主力、未来,7961,2016-08-25,0.789062481251952
603322 超讯通信 开板吃肉开始 适量关注,4608,2016-08-23,0.9712622120752711
各位猜一下，东旭光电石墨烯电池如果销售二百亿,9605,2016-08-28,0.1117018121151997
请向东旭高管发声，维护我们自己的权益。,5363,2016-08-28,0.3656077209436134
已破位下跌了,上攻无力,还不跑?,4086,2016-08-28,0.3349755156887987
关于东旭光电石墨烯之专利支持（1）,15389,2016-01-20,0.09670529562041652
(五)转化定律,4661,2016-08-28,0.34833758421897143
(四)决策定律,3171,2016-08-28,0.534828885418379
(三)时机定律,2547,2016-08-28,0.1272762533589603
(二)抢点定律,1978,2016-08-28,0.11734823346621037
继续带你飞,2110,2016-08-28,0.6691913577909936
猜猜东旭光电2016年派送红包的理由  1. 关于东,60744,2016-02-15,0.001665869282097332
还是另发了大家看吧: 这两点说明该发明克服了现,6592,2016-07-09,0.22713101060746166
《20160707题东旭光电》 东边有风来 舒爽轻一身,16637,2016-07-07,0.983377091083664
原来的2016年底东旭看高20提升至30-50了! 理由:,35811,2016-07-29,0.3038533158894533
大家不用再去猜东旭的价位了，我可以告诉大家，,13095,2016-08-28,0.787780036936656
周三公布中报，预计还是高增长， 周一周二开始,8877,2016-08-28,0.05774016315535413
我不看好这款充电宝，我只看好,29500,2016-08-02,0.2640688980215604
昨天也在秒杀石墨烯，今天也在秒杀石墨烯，到头,12344,2016-08-27,0.7757154537260628
通过3年内从600万元爆发式增至2亿元以上的速度,13797,2016-08-27,0.34833549158778876
因为有几个疑点一直未能够搞清楚，所以出局观望,9839,2016-08-27,0.5865656354182132
本月收盘16.93,8930,2016-08-26,0.7298610412885121
明天涨不涨停自己分析，8.30号半年报，高增长，,17176,2016-08-25,0.9043208235505911
此次增发后总股本近70亿,9649,2016-08-25,0.5112495766764412
都别再唧唧歪歪了，明天冲14.88元，下周过前高,11234,2016-08-25,0.021523076862664636
OK下周毕上16，拭目以待,6889,2016-08-26,0.08386109056025992
东旭光电，强势行情已经结束。,18686,2016-08-23,0.6732045077252825
挂低了 以为能破13.6那,9329,2016-08-26,0.44767845850986676
15.3的本，有人在吗？,6914,2016-08-25,0.5282352329672174
小弟一事相求，还望大家帮帮忙！！,5538,2016-08-26,0.0295222869111903
许多人都希望或认为东旭下周会跌或该跌，我也希,16715,2016-08-21,0.7987852479923615
东旭光电(000413)融资融券信息(08-25),14539,2016-08-26,0.5510693131469493
东旭光电今日超大单流出排名第4名(08-25),28952,2016-08-25,0.12438570173010333
裤裆都破了,4709,2016-08-25,0.5746308593108036
看来碳源汇谷网站确实是提前透漏了产业化扩增信,8077,2016-08-23,0.815268618963344
[cp]图解 I 带柄杯状图 牛股的经典形态有很多，,4418,2016-08-18,0.4426298720753461
东旭光电:董事会关于2015年度募集资金存放与使,6788,2016-02-05,0.8106275010436423
明天上演抢盘游戏！有本事的都别抢！,9264,2016-08-25,0.39407707470052744
世界首条石墨烯基锂电池生产线落户泰州,8429,2016-08-25,0.856009461402255
东旭光电:为全资子公司提供担保的公告,42957,2016-02-17,0.048198240502974055
东旭光电:2015年度股东大会的法律意见,34739,2016-02-29,0.8948464151447286
东旭光电技术分析！该股可连续四天跌破5日10日2,6906,2016-08-25,0.0026012264122093898
到目前，已有两条中试生产线在海陵区原有闲置厂,17583,2016-08-25,0.242117780849194
好吧，各位，我属于一直看好的，成本低，一直没,9135,2016-08-24,0.18274920780926684
北京旭碳、东北买矿，整合速度堪比蜗牛,8427,2016-08-25,0.10597900476879085
石墨烯的烯王电池太牛了，10几分钟就充满了，这,8160,2016-08-25,0.6874401654315885
世界首条石墨烯基锂电池生产线落户泰州 中新网-,8199,2016-08-25,0.9731698510759019
明天开启十倍之旅，目标62.9,16124,2016-08-24,0.5984065415197527
笑谈增发，九家机构收获11亿股后必将成为东旭的,13920,2016-08-24,0.8759231044440282
今天仍然属压盘等消息状态 1.泰州项目进展，建,6775,2016-08-25,0.4822189693869343
下午不跌停，我自宫！,11839,2016-08-25,0.35043312439159
东旭光电(000413)融资融券信息(08-24),14834,2016-08-25,0.5510693131469493
莫恐慌，真心希望你看到此贴睡个好觉,22295,2016-08-24,0.03125280516614193
东旭光电第一目标价格30。石墨烯纽扣电池，又一,14072,2016-08-25,0.383303039476102
东旭光电的石墨烯布局：如何从“天堑”走向“通,10545,2016-08-24,0.9271369687580925
东旭光电:非公开发行A股股票发行情况报告暨上市,60354,2016-08-24,0.23263800068796547
东旭光电:非公开发行股票相关承诺的公告,62347,2016-08-24,0.11786079600714416
好多托啊，周一暴跌，目标价10,11239,2016-08-20,0.8980814658826568
我觉得明天东旭光电也就集合竞价时候量比高一些,5524,2016-08-24,0.11927620826897989
看看盘面主力在干什么？疯狂吸筹码为什么？你抛,5795,2016-08-25,0.6653570253108229
东旭光电:验资报告,76105,2016-08-24,0.11811155541001894
明天开启299个跌停之旅?,6785,2016-08-24,0.0172432556722949
定增根本就不存在利空一说，我来给大家解惑，请,8188,2016-08-24,0.430723262323502
明天开盘价能不能是15.55多顺眼的数字！,11148,2016-08-24,0.3718388735859449
特大利空来袭,今天东旭光电跌停,8127,2016-08-25,0.31048736879361905
希望明天开始连续10个跌停板……,6442,2016-08-24,0.4209771793707968
东旭光电:关于股东权益变动的提示性公告,61029,2016-08-24,0.26893802710339065
有时间多看看互动平台内容,10054,2016-08-25,0.7997882897944981
而且中证金竟然增持了几百万股，国家资金都增持,9183,2016-08-25,0.4005776048154006
风影……愿做烯王的妻与妾,45148,2016-08-15,0.9698195699918869
坚决看好东旭光电，我不舍得卖，持有此股我不算,8553,2016-08-24,0.0032570280129484708
明天这个可能向上了,7735,2016-08-03,0.292729708747816
关于东旭光电的增发消息,11081,2016-08-24,0.5443984565471265
旭日东升红似火[买入][买入][买入][买入][买入],4457,2016-08-24,0.9756632764571928
到买入时机了吗,4024,2016-08-24,0.7826653358894131
定增根本就不存在利空一说，我来给大家解惑，请,10294,2016-08-24,0.430723262323502
哪怕天大的利好，都不及低价增发超级利空！增发,6182,2016-08-24,0.1464862085152806
前有向海外销售的假烯王，现在有柏斯顿的石墨烯,14124,2016-08-22,0.8205347228334703
宝泰隆在业绩上肯定比不过东旭光电，东旭光电毕,9133,2016-08-24,0.00930107928060464
不要想把老子骗进去,4297,2016-08-11,0.08739965268831773
聚焦  东旭光电亮相2016智能显示与触摸屏展 201,5399,2016-08-24,0.3082362920725391
我15.3站高岗,3055,2016-08-24,0.5319956569779325
定增了，大家觉得明天会怎么样，我觉得还好,12647,2016-08-24,0.5927332694461914
热点分流，获利盘丰厚，东旭无奈才调整,15177,2016-08-19,0.6872487922558997
趋势再次跌破。情况不容乐观！必须谨慎对待。血,4858,2016-08-24,0.08826010928835992
这个形态更像下跌中继啊,10066,2016-08-24,0.9850089899912362
尚未调整到位，目前至少是中线调整，目标13元附,4892,2016-08-24,0.8838531102848062
现宣布，15.93元已径解套所有历史套盘了，还有,12491,2016-08-23,0.4402175095842903
东旭光电今日超大单流出排名第6名(08-23),32489,2016-08-23,0.11517442617673634
KDJ所有指标显示目前处于超卖短线底部！,6418,2016-08-24,0.9315535117736544
终于抄到个大底底,5806,2016-08-24,0.4088204119531812
妄议东旭光电,8145,2016-08-24,0.2106839290372453
收盘价14.14元至14.17元,5002,2016-08-24,0.1828322581318662
东旭光电(000413)融资融券信息(08-23),21091,2016-08-24,0.5510693131469493
石墨烯比锂电牛,4792,2016-08-24,0.5967208596501693
13.86元割了,5738,2016-08-24,0.4737672181921908
13.93已经是极限了 主力你还要继续下杀？,4542,2016-08-24,0.05064938420587517
愿祥我说对了吧！11点涨开始拉升上涨了吧！怎么,5601,2016-08-24,0.2438841780033305
散户们不要怕今天午前一定将开始上攻稳住情绪今,4745,2016-08-24,0.697434455552292
石墨烯产业分析：关注四个标的,50753,2016-08-23,0.9847352553538231
明天这股股戴绿帽子的可能性80%,5769,2016-08-23,0.381894990603185
说黑磷会超过石墨烯的闭嘴，老贴子了，2015就说,5044,2016-08-24,0.04218553669560299
东旭将会一票难求,7592,2016-08-23,0.2251841802147473
谁去解放东旭高位500亿的套牢盘？,9482,2016-08-23,0.8600888388569308
你以为王总去泰州是旅游？ 告诉你:王总去泰州是,11825,2016-08-23,0.9396279920700678
东旭赢利50%的签到了,9282,2016-08-20,0.05128197099802201
庄你在筹码高度集中低位一字板，你敢在早上10点,6974,2016-08-23,0.3673449868986407
东旭光电(000413)融资融券信息(08-22),18957,2016-08-23,0.5510693131469493
“烯王”——世界首款石墨烯基锂离子电池充电“,14718,2016-08-19,0.9537326322702847
热烈祝贺今天上车的股友们尾盘末主力买入1.8亿,12015,2016-08-23,0.8470828624326628
注意:年初双方在接洽时就已经在石墨烯基锂电池,9396,2016-08-23,0.5293160268556277
强强联合，估计今晚要出公告,30091,2016-08-09,0.30793901405585855
上海碳源汇谷新材料科技有限公司 http://www.gr,15280,2016-08-22,0.8277687195570325
我15.70的本啊！但愿涨到20卖掉,5978,2016-08-23,0.6503426428991937
明天涨停，体现妖股，大家随便聊，明天收盘在看,13915,2016-08-18,0.5121157407379168
明大涨停,16786,2016-08-18,0.6763604038895666
东旭光电“烯王”8.8官网全球预售 世界首款石墨,20614,2016-08-17,0.5042369600190462
充电10分钟，续航400公里。真的要在413实现了，,22860,2016-08-19,0.2564333922673643
东旭光电控股公司上海碳源锂电池项目中试扩大了,27821,2016-08-18,0.9304695831509521
旭日东升红似火[买入][买入][买入][买入][买入],12582,2016-08-15,0.9756632764571928
14.15 来吧 我拥抱你,3954,2016-08-23,0.9000299615145505
这股能上25吗？,11047,2016-08-11,0.38625085229405565
东旭有高人,31927,2016-07-29,0.5181975285615493
上海碳源汇谷新材料科技有限公司董事长寄语,15616,2016-08-18,0.945378735525431
 揭秘新材料之王石墨烯：未来投资机会在哪？ 和,17903,2016-08-18,0.9942945661111852
烯王发布以来，上海碳源石墨烯签订销售意向合同,7523,2016-08-23,0.010756090826621323
周一互动平台爆料干货整理,11197,2016-08-23,0.24158060930155545
明日抄底603300。,2102,2016-08-22,0.6605500887099804
净流入再次第一名。名符其实的龙头,9169,2016-08-15,0.1688247139728647
冲啊 希王  亚寄给给,6450,2016-08-15,0.9055776933877894
只有蠢货在卖，机构小经理也不一定懂东旭光电,3238,2016-08-23,0.12586618670604022
东旭光电今日超大单流出排名第1名(08-22),46790,2016-08-22,0.08999800987389761
【讨论】主力连续出货，你选择安心持股还是落袋,43930,2016-08-22,0.6539400393460232
各位前备  15.35啊 这是不是得长期站岗了[哭][,16821,2016-08-22,0.5571033032586344
虽然我没上车 但是还是希望你涨停,16149,2016-08-10,0.39485208711372455
产业与资本“双引擎”布局 东旭光电“烯王”呼,62570,2016-08-22,0.972925957130992
上周刚完成一件事：把住房卖了租房住卖房钱今天,16723,2016-08-15,0.11248296282262049
15.70的本啊！现在应该割肉还是应该持有？？？,8555,2016-08-22,0.09981418016723154
上周让大家借钱买入东旭的，现依旧再去代钱补仓,13587,2016-08-22,0.41176489243991443
不是假网站！有些信息应该先公告再挂网站或媒体,6900,2016-08-22,0.013917497170775395
电池马上要生产 开始招工了！,37192,2016-08-18,0.275775172637456
明天如果低开敢不敢买入？,6421,2016-08-22,0.044522155472459524
被删无数次的帖:oppo接下来的超级闪冲真的一定,7017,2016-08-22,0.06216951911780377
从各种迹象看，股市老亏手是托,4945,2016-08-22,0.45569600606537874
有人吹嘘100吨500吨制备石墨烯,10531,2016-08-21,0.3275228847521754
东旭光电(000413)融资融券信息(08-19),20699,2016-08-22,0.5510693131469493
中国人有能力引领世界石墨烯产业发展的标志,9509,2016-07-18,0.9869619434701592
东旭光电明日短线调整开始,36619,2016-08-16,0.22726193686582674
东旭光电:导电膜及散热膜处中试阶段,177868,2016-08-12,0.36207154321043955
东旭光电今日超大单流出排名第1名(08-19),63946,2016-08-19,0.08999800987389761
21:52  财联社21日讯，广西大学校长赵艳林21日,10236,2016-08-21,0.9848860095853376
东旭水变电技术将入选2016年诺贝尔奖申报,20281,2016-08-18,0.9529563651236657
热烈欢迎强力砸盘！,8227,2016-08-20,0.6069004496550076
炒股十多年，不在乎股价起伏，能够人平心静气持,5859,2016-08-20,0.9452340901477404
上海碳源单层石墨烯制备技术已经突破500吨级,8264,2016-08-21,0.9412366281446655
东旭赢利100%的签到了,10440,2016-08-20,0.14802610768000823
东旭光电+东南网架+四川金顶,3968,2016-08-19,0.21321586758665068
000413东旭光电 最好10送30股后 股价变成 4元左,8691,2016-08-20,0.020117672267080722
同志们，大量买入，绝对不要给庄家便宜筹码，这,24951,2016-07-11,0.9123056596851722
妖王的世界你不懂，但要知道新高有的,14128,2016-08-09,0.9987319497845127
这么多庄拖，看着真烦，明明破位了周一会大跌嘛,6551,2016-08-20,0.0006329808580637364
做好短线及时获利，切记不要盲目的贪心！79,8384,2016-08-19,0.4320503962250358
泰州碳源汇谷新能源科技有限公司系上海碳源汇谷,10523,2016-08-20,0.14414991986084935
东旭光电:2016年第二次临时股东大会决议公告,86139,2016-07-28,0.23087764212068995
东旭光电，肯定是一只被误杀的潜力股,12513,2016-08-02,0.11969379565588834
公司在互动易上的答复是间接承认oppor与公司在,15694,2016-08-17,0.6549106760213557
超越黑磷,7873,2016-08-19,0.8724860262649541
游资开始活跃，大盘能否回暖,4280,2016-08-04,0.9078454410224117
KD高位死叉，5日线跌破，连中国保安涨停也带不,5508,2016-08-19,0.05320581483249076
我把东旭光电质押了,5017,2016-08-20,0.7197126021303022
东旭光电/非常好的热门股票！,8659,2016-08-19,0.917578003091747
公司年报点评：产能释放引爆业绩增长,105364,2016-02-19,0.908080166904442
公司季报点评：主业领先市场，业绩持续释放,80853,2016-05-03,0.885006362967471
东旭光电(000413)融资融券信息(08-18),19905,2016-08-19,0.5510693131469493
东旭光电:2016年累计新增借款的公告,160583,2016-08-11,0.02674806888421044
周末热爆:oppor9引发的石墨烯基电池应用的猜测 ,22901,2016-08-13,0.194998782899797
有什么值得大惊小怪的!新品出来前的网站正常维,7516,2016-08-19,0.8383232023312256
网管收了广告费任凭骗子大量发广告,3878,2016-08-17,0.0033895998647166525
锂电池水平东旭最多算国内第三,14085,2016-08-13,0.6689411649702387
东旭光电今日超大单流出排名第1名(08-04),62870,2016-08-04,0.08999800987389761
提前祝贺东旭光电今天将在15.9元附近收盘以掌扇,7703,2016-08-19,0.1319426310839752
华为mate9自带石墨烯黑科技，3000毫安电池五分,78490,2016-08-13,0.8397931709939472
割肉两回了，今天15元又买回来了，主力别叫我在,6087,2016-08-19,0.07183411370446202
“特停”在某些地方大放绿灯大开后门，如新股lP,7352,2016-08-13,0.089042253092663
感觉东旭光电这是强力洗盘,6727,2016-08-19,0.31044814389825603
石墨烯在充电电池领域已经完败只有向燃料电池方,3334,2016-08-19,0.7703255237137112
王忠辉向记者表示，东旭光电的这款石墨烯基锂离,24260,2016-07-16,0.980438034559011
烯王将小批量上市 未来有望实现新能源汽车快充,17951,2016-08-18,0.900996514401242
今天，东旭光电要大跌，快逃吧,6141,2016-08-19,0.23175432649535277
对不起，我说的这个不是预期，也不是中试样品，,9229,2016-08-18,0.1362267421568376
不涨的秘密,7416,2016-08-18,0.9683646317528674
上影线+准死叉=100%顶部，中级调整开启，明日如,9242,2016-08-18,0.3974134174952271
东旭光电今日超大单流入排名第3名(08-18),52539,2016-08-18,0.3425566768987781
我操，今天被骗了，15.95买的，有比我高的吗,10153,2016-08-18,0.22754680404309946
18650石墨烯锂电池,8111,2016-08-18,0.5896117084547706
谁能告诉我15.70的本，该咋操作，想哭了,19500,2016-08-18,0.5480156951018654
跳水中的这两大细节，你注意到了吗？致粉丝朋友,3675,2016-08-18,0.9830503389013153
请问大家对烯王15分钟冲电的理解是这样吗？是用,7489,2016-08-18,0.12806341658087883
今天冲高杀出、杀进江苏银行，永别了烯王，再也,9431,2016-08-18,0.7574371964362395
