标题,帖子数,日期,情感
再不疯狂我们就老了！,3712,2016-06-06,0.05826902416498925
众多利好难敌控股大股东对资本市场的漠视,23121,2016-04-18,0.9883769338814986
还好早上8.06就跑了,7336,2016-06-01,0.5442427206854509
看似风平浪静下的东旭光电，下面存着巨大危机。,43400,2016-05-31,0.9740746953058433
本发明所述方法制备的石墨烯能够用于锂离子电池,16296,2016-05-17,0.30780289211584244
东旭光电定增顺利过会 8.5代线成未来新看点,41402,2016-05-18,0.9701583912419968
东旭光电：定增落地 产业链生态建设优势凸显,38999,2016-05-18,0.8836820561352788
股指在支撑位处有较强的超跌反弹动能,11109,2016-04-25,0.697000464048509
本人花了四天时间在石墨烯板块中找到该股，又花,17049,2016-05-19,0.143936030269042
揭露该股的骗局！,27725,2016-06-04,0.8901750077275126
有机构故意诱骗投资者，导致关注的人太多。,12211,2016-06-04,0.8818469118934925
我本周二介入该股后准备中线持股。,7576,2016-06-04,0.2500724460589445
东旭光电与蓝思科技签署战略合作,44163,2016-06-01,0.8891062201154172
东旭光电合作蓝思科技 加快新材料市场导入节奏,41064,2016-06-01,0.9886899429018755
东旭光电定增申请获证监会审核通过,26409,2016-05-18,0.0448180965613334
东旭光电今日超大单流入排名第15名(05-27),33508,2016-05-27,0.3297636321639197
东旭光电:关于实施2015年度利润分配方案后调整,85065,2016-05-26,0.04860351986400668
东旭光电 第一天就跟着我吃了涨停，后期出货时,29927,2016-02-15,0.8447251662042764
全球首款石墨烯柔性屏手机诞生 6股或受益 04-24,9148,2016-04-24,0.8207803277752695
东旭光电:关于投资设立的石墨烯产业基金完成工,51367,2016-05-19,0.7174757726768244
东旭光电：已有试生产的LTPS玻璃基板下线,30492,2016-05-09,0.17052376541384573
【投资者传闻求证】公司有OLED屏幕生产计划？,17249,2016-05-09,0.7251164237734765
石墨烯概念股调查：谁是伪装者,173233,2016-05-05,0.31405581532613946
今天终于下了很大的决心，全仓000413，资金不多,6071,2016-05-05,0.9362831931931223
东旭光电：第5代彩色滤光片项目开工,7206,2015-12-28,0.6807792737066993
我感觉这次站稳在8元以上是没有问题，从告刎7.×,7661,2016-05-04,0.2792442388443961
东旭光电:关于开展融资租赁业务的公告,51461,2016-05-03,0.46388388459206875
东旭光电：一季报净利增120% 石墨烯战略布局有,49248,2016-04-28,0.9363688774862347
石墨烯或是热点板块 看好东旭光电！,10807,2016-04-27,0.42856928187245946
东旭光电:2016年第一季度报告全文,33716,2016-04-28,0.8032055743614958
东旭光电:2016年第一季度报告正文,45954,2016-04-28,0.5050389965865842
东旭光电在全国东西南北中石墨稀布局以完成、坐,10588,2016-04-05,0.6239785507823105
东旭光电石墨烯迈出全球并购第一步,35647,2016-04-26,0.20672334654431979
东旭光电:关于最近五年被证券监管部门和交易所,38399,2016-04-25,0.3576851492054778
东旭光电与西班牙研究机构在石墨烯方面达成合作,18074,2016-04-25,0.4175715483029603
东旭光电:非公开发行股票申请文件反馈意见的回,46104,2016-04-25,0.013893344454026568
再论东旭光电……,33378,2016-03-27,0.22954255206874397
【投资者传闻求证】公司在德国设立合资公司事项,17195,2016-04-22,0.9515042628175567
东旭光电:关于为全资子公司融资租赁业务提供担,28934,2016-04-21,0.3321843598840082
东旭光电:关于收到《中国证监会行政许可项目审,44247,2016-04-20,0.5997589668567257
明日大盘会继续上涨吗？,15299,2015-10-15,0.5761130153204796
解禁股如刀俎 我进去做鱼肉 买东旭光电若烹小鲜,100213,2016-04-15,0.017981970013934756
业绩稳增不差钱 24只优等生估值不足30倍,42897,2016-03-24,0.14506034653012312
东旭光电(000413)解禁股信息(04-18),25228,2016-04-17,0.06115617197713963
东旭光电:2016年第一季度业绩预告,93407,2016-04-14,0.6384683742868004
大股东的增持计划该实施了,23755,2016-02-25,0.4008531242625264
东旭光电一季度业绩大幅预增 多个新项目上马确,32256,2016-04-14,0.4344461725346318
满仓东旭,12888,2016-03-14,0.24679790893313935
未来新能源汽车，国家正常支持！ 6分钟内快速充,15595,2016-03-12,0.613032692623855
此股的庄老谋深算，在洗盘时要座住车，大盘在涨,14304,2016-03-14,0.9609438527306696
东旭光电(000413):碳源汇谷石墨烯实现超99%单层,16138,2016-03-14,0.23688915783988262
多头排列，上升趋势形成,11199,2016-03-14,0.45877566407547665
主力都在加仓石墨烯在德阳建设创业基地，十三五,13617,2016-03-14,0.25134597719142504
6分钟冲满电源  上海碳源汇谷生产的石墨烯产品,16832,2016-03-14,0.03636722890865596
震荡上行，创业板领涨两市。,9142,2016-03-14,0.5146778020685601
A股拐点来临，机会在中小创,11330,2016-03-14,0.9355511117793464
春季反弹有望延续,10061,2016-03-14,0.9499322625180527
两市逾百股涨停。,10688,2016-03-14,0.08283634799441764
利好叠加促普涨 估值优势正显现,10529,2016-03-14,0.9885424216295592
周末政策暖风频吹，形成了上午的高开高走。,11094,2016-03-14,0.6545721931855386
普涨标志井喷行情到来,8861,2016-03-14,0.9681820334455257
明天可能要大涨啦！可惜我早盘卖掉3成了！,11406,2016-03-14,0.09515868286459361
四川省建立石墨烯产业技术创新联盟,13737,2016-03-15,0.9091531011637339
此股主力是慢性人:这段时间货早吃足了:因为基本,18765,2016-03-15,0.42305141970130733
东旭光电筹码珍贵，主力吸筹基本完成，暴涨在即,19429,2016-03-15,0.8551172308254552
主力昨天买入了3000多万，13五又有利好消息德阳,13649,2016-03-15,0.9823047158222198
要想涨停需要大家努力只买不卖包括主力机构游资,10916,2016-03-15,0.28574401059629806
光电一季度业绩大增，快买，可加杠杆，必有回报,19210,2016-03-15,0.9945286116721106
石墨烯概念领头羊，看好就坚定持有，看不好请立,16213,2016-03-15,0.36856334415746206
未来中国石墨烯碳谷，7元多股价，1660点的市盈,15595,2016-03-15,0.7799466716019265
融资融券流出139亿,12726,2016-03-15,0.8733893695619113
东旭光电本周调整，下周起飞,13744,2016-03-15,0.13872335115449463
突破60日线屈指可待。半年线和年线还需更多时日,11538,2016-03-15,0.6736363460941016
4月18日令人诚惶诚恐 我先溜睡安稳觉,5588,2016-04-14,0.0225015345231232
东旭光电:广州证券股份有限公司关于公司非公开,58812,2016-04-13,0.27858681861600654
东旭光电4月18日大量的解禁股 恐惧,15220,2016-04-12,0.11438151634483329
用15个亿可以在000413上举牌，还等于买入了15个,21185,2016-03-13,0.42762460982058215
下跌空间有限，有俩次增发百亿垫底！ 上涨有压,11211,2016-03-13,0.19510518599073856
2016超级大牛股 非东旭光电莫属 [财力],13057,2016-03-13,0.14638480768018802
明天东旭光电大涨，主力操作方法简单，明天我赚,11951,2016-03-13,0.06609455604345382
下午大盘第一小时小幅震荡回调，1点50分后上涨,8328,2016-03-14,0.011607816781973979
东旭先下手为强领军石墨烯,10880,2016-03-13,0.30458144680881694
注册还要搞------没有时间表 证金未退出------,8406,2016-03-14,0.25725891999268236
好股，应吃，拿，住。,8585,2016-03-14,0.24944363342732778
祝东旭投资者猴年马月心想事成！[大笑],7704,2016-03-14,0.930367747267787
即将突破平台，大家拿住了,8887,2016-03-14,0.9623029556760233
满园春色关不住 一支红杏要出墙,7893,2016-04-11,0.14931619179147115
幽灵！一个黑科技幽灵！即将在中国，在东旭光电,26236,2016-03-24,0.8583574159537916
年报点评：业绩超预期，光电显示材料领域巨头显,212963,2016-02-15,0.9952904887411929
昨天是历史，今天是开始，也许在不久的将来会离,11243,2016-03-11,0.977066036182168
对于部分超跌、主力护盘类品种可放心持有,7683,2016-03-11,0.5484579579590703
前期暴跌中有主力资金深度介入被套的品种，此类,10584,2016-03-11,0.9984724880676159
继续大跌就买点儿过周末,7748,2016-03-11,0.3322791262293803
大盘也在等新主席,2213,2016-03-11,0.77718767658799
迎接下周爆发行情！,9305,2016-03-11,0.9465017311901943
午后股指先行走高之后出现缓慢回落，尾盘快速拉,1994,2016-03-11,0.3237224242693547
支持东旭做大做强，今年必成牛股之王,7776,2016-03-10,0.9438981807483579
！！周五早上继续回落 ，下周或迎持续反弹 今日,8020,2016-03-11,0.4270257919355094
散户持股总比那该死的基金持股好,7562,2016-03-11,0.17134349909795787
东旭光电虚拟现实产业链上的明星！,18697,2016-03-12,0.616472754207447
大的环镜太有利于公司的发展支持，好的领导班子,7915,2016-03-12,0.9288979436140106
洗盘充分，机会来了,8310,2016-03-11,0.8923087924845279
石磨电池量产对号新能源对号新能源汽车对号国家,15766,2016-03-12,0.8558560245575504
深港通通不通？今年肯定通。注册制搞不搞？暂时,9665,2016-03-12,0.003719270170924882
如东旭的石墨烯电池能成功，将是动力电池的革命,10320,2016-03-12,0.9209130330317461
东旭对石墨稀的研发前途似锦啊！液晶屏，蓄电池,12081,2016-03-12,0.23441183826725098
深市弱于沪市，爆发一下吧。深港通是远水,7211,2016-03-13,0.3932528873196288
东旭光电：后期会是怎么样的走势呢？,7533,2016-04-07,0.7287276422316298
这算利好吧？东旭光电拟1亿元设立全资子公司加,20793,2016-04-01,0.056782364755844084
耐心点，一切皆为418，东旭必上9元,11682,2016-03-10,0.49375535746675736
未来央行仍有继续降准，预计年内仍会有1-3次操,6300,2016-03-10,0.8639014039270904
大单流出!这么多资金流出大利好`三年后重回10元,6824,2016-03-11,0.12220044181347933
东旭光电7000万元再收石墨烯资产 行业领域多面,7814,2016-03-10,0.9217649455756111
石墨烯概念股表现强势,6839,2016-03-10,0.5818949500974337
下周必摸到8.8上,6926,2016-03-10,0.8127207736638223
证监会12日潜重炮利好！护航9连阳！,6407,2016-03-10,0.5695690723632097
9连阳后或会改变市场情绪 炒房熄火引股市回暖,4867,2016-03-10,0.9866826414033936
看好东是不为几个点进进出出！ 看中点的是能逆,6321,2016-03-11,0.7029480632433878
7.80有压力，冲破就好了,6612,2016-03-14,0.970104956036357
看样子东旭光电要成为石墨烯产业的龙头,8942,2016-03-10,0.04161528032509476
石墨烯板块今天强势，东旭光电又兼有利好，股票,11971,2016-03-10,0.25831450061063677
明天将大涨立贴为证！收盘八元以上。,9416,2016-03-10,0.38686591340392973
000413的K线语言也告诉你，这是个牛股。,19867,2016-03-12,0.36267459110119016
此股自从传出东旭要入主宝石以来，日K线多现长,12808,2016-03-11,0.14699331792544268
昨晚欧洲央行放水，中国股市地量，东旭利好连连,11907,2016-03-11,0.8023092584424126
[牛][牛][牛][牛][牛][牛][牛][牛][牛][牛][牛],5197,2016-03-11,0.971210445619843
这次应该确定了石墨烯龙头地位了吧,9044,2016-03-11,0.3774487647377136
抛砖引玉,7913,2016-03-11,0.48651329788797426
利好叠加,7323,2016-03-11,0.4737672181921908
2800点维稳成功，股市又冲3000点而去了！,5874,2016-03-11,0.9619504662320252
冲过7.75，加油石墨稀！,6410,2016-03-14,0.8221638292977147
快买“吧周一有戏[牛][牛],6313,2016-03-11,0.9263559824071013
上方压力太大,5165,2016-03-14,0.5035388444429313
两市持续攀升,3912,2016-03-02,0.22615651692135696
后市暴涨必让所有人目瞪口呆,8000,2016-03-02,0.6704155240998146
A股V型反转，多军初战告捷,4009,2016-03-02,0.18787153777918586
8.5 代玻璃基板进口替代空间巨大。 目前国内 6 ,6284,2016-03-02,0.9299106334139542
现在可以认为东旭股灾后的一波上升行情即将启动,5144,2016-03-01,0.8938733100670263
增持，利好，利润分配，利好，降准，利好,7703,2016-02-29,0.0781001312200319
央行降准市场情绪趋稳,4153,2016-03-01,0.8650322893484571
牛股偏向于热门行业,4939,2016-03-01,0.9744513506750437
看来要涨停，肯定不减持,4745,2016-03-01,0.36992364361811225
东旭光电，我对个股的看法很简短！！！,6227,2015-11-30,0.38516436280874244
拿好筹码，养老金首选股，今日会上8元，不要发,4196,2016-03-03,0.9870968323599473
上升趋势确立,4376,2016-03-03,0.5548767568986565
3月1日，总投资70亿元的东旭光电项目正式在福清,7514,2016-03-03,0.8509145963600254
市场有望走强的关键因素。,4161,2016-03-03,0.9399515797425765
大盘冲高回落为市场降温,3784,2016-03-03,0.3278335972949893
随便你涨跌.反正不到15元死都不卖.,3698,2016-03-04,0.0025765834678899147
A股输不起 9小时前和讯网 A股在牛市的时候让人,4679,2016-03-03,0.27722078907309455
给我一个卖出的理由,3547,2016-03-04,0.20197623643767137
涨停,3094,2016-03-04,0.5917277703202298
[加油]在眼泪中微笑才多姿 成败，在坚强中微笑,3917,2016-03-04,0.9999945414492637
坚定持股信心，不应一时的调整而错杀。,4763,2016-03-04,0.24620459199275013
庄家压盘是说明庄以经控盘，等待时及拉升,6289,2016-03-07,0.41006731541819386
中国面板需求庞大，弥补国产高世代液晶玻璃基板,8772,2016-03-07,0.9828603107695209
新经济首次写入政府工作报告 利好当前处于低迷,4688,2016-03-07,0.9731926202391198
石墨烯在多个领域有着广阔的应用前景，投资者可,6448,2016-03-07,0.9991839072002141
东旭光电是连续三年平均盈利20%以上的公司之一,6262,2016-03-08,0.3502332617401428
东旭光电限售股解禁 时间：2016-04-18 13003.1,9070,2016-03-08,0.10164714935228447
东旭光电 ……中国的苹果公司，不说石墨，光业,10453,2016-03-11,0.41472309119535833
想稳赚钱买东旭光电，本周会上7.50元，本月上8,7646,2016-03-08,0.22235548017930096
周二沪深两市小幅低开，创业板率先翻红。,4841,2016-03-08,0.21187847283305228
收了一个现成的石磨稀企业一一 上海碳源谷公司,5874,2016-03-08,0.026288901141800824
市场大逆转迈出重要一步,4619,2016-03-08,0.8139532384824137
看得到机会才能谈把握机会！,4815,2016-03-08,0.9631075763874467
大盘强势洗盘后劲更足,4830,2016-03-08,0.7472439922888825
坚定持股东旭光电必有厚报！,5524,2016-03-08,0.18047161023013547
（指日可待）重上十元机会来了！,6314,2016-03-08,0.3776177162326666
东旭董秘～对我们中小投资者的建议，持有东旭～,7111,2016-03-09,0.7748972974257022
今天东旭做了回好榜样， 无惧大盘下跌顶风拒跌,4323,2016-03-09,0.5596562327367258
本周管理层维稳盘面为主基调,4449,2016-03-09,0.9522590502937547
电子产业代表着先进制造业的发展方向，电子板块,5873,2016-03-09,0.9986425232463731
东旭我相信你,7113,2016-03-09,0.5
没国家队的持票的票，说明“稳过泰山”[财力]赞,6480,2016-03-09,0.560663965658461
牛定了！,7317,2016-03-10,0.5
既然进了股市的门，不埋怨，不后悔，不怨恨，不,6968,2016-03-10,0.17849032179616975
东旭今年量产石墨希已不是什么秘密,8293,2016-03-10,0.9839591905711313
超级大黑马石墨烯新秀东旭光电，石墨烯量产及量,11365,2016-03-10,0.07379580524938145
下午必涨5个点以上,6229,2016-03-10,0.7051806255666112
科工贸一体成型、石磨稀龙头地位己确立、有望下,1210,2016-03-10,0.09402364937159247
下午拉升，别错过最后上车机会,6803,2016-03-10,0.8173564698641324
一百多亿内定增发保底！增发合计都能重组了！ ,13497,2016-03-13,0.6593689237053191
还有利好，4月份增持，5月份分红,10451,2016-03-10,0.2782018800176823
下午开盘我拉000413～等待验证～拭目以待 事实,6864,2016-03-10,0.6229420626643339
开盘直线拉到7.80.拭目以待[鼓掌][鼓掌][鼓掌][,10444,2016-03-10,0.9842090081571321
为四月解禁准备,7668,2016-03-10,0.500821104265699
涨停,5930,2016-03-10,0.5917277703202298
东旭光电操作小策略，利用平台整理来盈利。,6737,2016-03-12,0.5312189754101414
绩优就是绩优连续三年利润增长20%，好像有了一,7294,2016-03-10,0.9912859365324226
冲过7.70[兴奋][兴奋][兴奋],7854,2016-03-10,0.9962621801924547
哈，好样的成龙头了!,7275,2016-03-10,0.18456362150305905
这是把石墨烯收购的前奏啊   这股要爆发了,8060,2016-03-10,0.7300128804086123
冲呀涨停板,4865,2016-03-10,0.8599127243778018
龙抬头！,5667,2016-03-10,0.7344102986238324
投资A股要踏准节奏 午后入场回报最佳,5713,2016-03-10,0.9842285937809899
东旭慢慢显露出走出独立行情开始！,6054,2016-03-10,0.9825773023314378
大股东增持400万股近3000万元、增持价6.83元、,6903,2016-02-29,0.4588242150819537
今天全仓买入,3556,2016-03-01,0.5769417180947369
东旭光电这好的业绩还拓展偏光片的生产，又布局,15793,2016-03-02,0.734113810210998
反弹还将继续,3250,2016-03-02,0.5488180064031624
有坏才有好！！,4912,2016-03-04,0.1641313073852203
我买股票不看一时的涨涨跌跌，股价的高低，而是,6799,2016-03-04,0.23017219225174101
周线收出中阳切入线，有利反弹,4049,2016-03-04,0.1582491461770822
反弹有望持续[加油],5389,2016-03-03,0.8797723681057047
融资减少！容出增多！看似有风险！ 其实不然，,5245,2016-03-05,0.9421861599469876
继续上涨[胜利],5011,2016-03-10,0.35072516527653985
大盘今天红，是个小红，光电涨3个点,4496,2016-03-04,0.8247311307853037
深交所独有的中小创股票会对低估值、高成长的小,5303,2016-03-07,0.9993727069466842
中国创造新增就业1312万人，超过其他19个最大经,5223,2016-03-07,0.677395980869576
石墨烯在行动,5990,2016-03-08,0.3750780384166793
哈哈，10元不见不散！,6226,2016-03-10,0.4143067316667324
冲3次7.70这次能成功吗[兴奋][兴奋][兴奋],4105,2016-03-10,0.9957623988465468
东旭光电:2015年公司债券跟踪评级分析报告,68916,2016-04-04,0.3407935210364663
不要灰心!!造成今日大盘回落的重要原因是：,5033,2016-03-03,0.522350119705246
新兴产业，行业热点，政策扶持，分红派现,4160,2016-03-01,0.9945571396505504
好股票,5218,2016-03-02,0.8373301868856754
看筹码可涨9元,3875,2016-03-02,0.6388613320333953
个人感觉此股肯定要暴发了！本人从去年5月12块,5667,2016-03-04,0.037738497372058255
趋势很重要！活着比什么都重要！,3245,2016-03-04,0.9658287988092474
2016是东旭规划的并购年，的确东旭并购开始启航,11628,2016-03-08,0.239514961984595
建议投资者，在股市上要耐心等待时机,4914,2016-03-04,0.9937520793349515
000413已是上市公司中站在石墨烯产业最前沿的个,15992,2016-03-12,0.6009986571114261
秸秆中提取石墨烯是创新之举。,6354,2016-03-07,0.5587985217976065
石墨烯产业化量产～即将诞生在东旭000413收购的,8920,2016-03-08,0.9862879815450537
厚积发,5538,2016-03-07,0.1391880786814842
明天会是个好日子,5767,2016-03-08,0.5715677931142561
创业板依然是后期的主攻方向,3576,2016-03-08,0.9818612610203583
指数回踩均前后回升，短期指数仍会向上运行,3736,2016-03-08,0.8177144418111987
试探压力位明天涨停，请叫我股神,6005,2016-03-08,0.8998063636565315
今天盘中涨停，最低收涨8%左右,3118,2016-03-09,0.5196987010041907
哈哈，7.42又抢到300手,3344,2016-03-09,0.5529601677133492
底部放量,8518,2016-02-24,0.20324116166719197
石墨稀中业绩最好价格最低,4576,2016-03-09,0.75847898914923
每人都有自己的性格，爱好，和追求，股票也有他,8949,2016-02-25,0.9859414290749484
明天大盘不容乐观。此股空中加油二天明天很可能,12537,2016-02-18,0.05077368061537568
升途开始,3421,2016-03-09,0.8718977767929451
调整是良性的,3748,2016-03-09,0.7486119867675628
光电够强势，主要是散民买的多，,4655,2016-03-10,0.8205042771390707
成长股做波段,4095,2016-03-09,0.904288235051214
东旭光电在铸造坚挺的宽阔的头肩底右肩。,7690,2016-03-09,0.43203272762230016
“只买不卖”--刘士余发出明确建仓信号 老沙自,1852,2016-03-10,0.09311748698465694
供给侧改革龙头,4982,2016-03-07,0.7356384330150527
若哪天放量冲关50天线站稳，那时30日K线向上趋,6950,2016-03-10,0.0015022632942796044
你看了我的建议再决定是否买东旭；1.当股懂长期,7911,2016-03-08,0.0733306008617215
超级电池”预计今年内天津量产 电动汽车充电仅,6631,2016-03-09,0.003287992688088215
供给侧改革春风 概念股站上风口,4203,2016-03-02,0.9623960941126608
东旭光电落户融侨开发区,24181,2016-03-02,0.8200734993439117
今天还象个石墨烯公司。,4243,2016-03-09,0.4003127081950686
跌了就买东旭,23627,2015-12-11,0.19796838022006935
今天收盘在均线下 短期大幅下跌可能性加大,25410,2015-12-10,0.4427736924709377
这货天天阴跌，受不了！！！就是个岳不群,25150,2015-12-11,0.04810745162704788
垃圾股遭遇了垃圾庄等狗屎！,25936,2015-12-14,0.02050324306132789
垃圾股！,22562,2015-12-14,0.04182518790829948
还好昨天卖了。一看就是个弱庄，一直这么阴跌，,28543,2015-12-10,0.9530053078761542
东旭阶段性底部，可以小跌小抄，大跌大抄底[满,33994,2015-12-12,0.024871336800022514
注册制利好东旭光电这样的绩优股，必然加大垃圾,36257,2015-12-10,0.014974169123803005
从买一直跌，1万6没有了，垃圾股，割肉，从此不,22875,2015-12-10,0.027783596301027336
急跌就是买入或补仓良机，KDJ己调整至o轴，快建,31538,2015-12-10,0.2630440395881589
君子问凶不问吉，高手看盘先看跌,26601,2015-12-10,0.011861601672231159
东旭光电:关于设立全资子公司的公告,38102,2016-03-31,0.08692266337679955
东旭光电:关于非公开发行股票申请获得中国证监,64176,2016-03-31,0.1280864961576551
东旭光电拟1亿元设立全资子公司 加码石墨烯业务,29970,2016-03-31,0.02395427350137247
蓄势,6632,2016-03-11,0.5
东旭光电：产能释放引爆业绩增长 维持买入评级,38841,2016-03-31,0.8865554362266611
现在石墨烯建产业园了，13五又有很多政策要出了,7020,2016-03-14,0.994106059374499
【投资者传闻求证】公司的石墨烯产品现在已有产,27179,2016-03-24,0.7266012578205588
不会生气的人是愚者，不生气的人乃真正的智者。,3617,2016-03-09,0.10553873896707766
东旭光电：我们广东游资涨停板敢死队转战平潭发,32271,2015-12-10,0.13619942524584472
000413继续大跌的,20884,2015-12-12,0.4737672181921908
东旭光电：石墨烯产品目前在中试生产线阶段,42938,2016-03-23,0.6948136255588284
缩量，跌无可跌，指标均调整到位，明天反弹开始,34260,2015-12-10,0.7444230379124155
东旭光电：业绩大增，市盈率20多倍，跌无可跌。,33266,2015-12-14,0.09597616220249983
光旭不电，散户跑吧，烂股别买。,23449,2015-12-10,0.0073458865033950715
天天跌，日日跌，跌你大爷,18526,2015-12-10,0.11622716806359423
垃圾股！！,21670,2015-12-10,0.01715587562042442
这样砸盘，东旭庄死跌了。,23371,2015-12-10,0.7848834423144085
全是他妈的老帖，什么玩意[兴奋][兴奋][兴奋][,24080,2015-12-14,0.9305159294948028
大盘涨它也跌，大盘跌它还先一步。下午跌破9元,24573,2015-12-10,0.027529569716145508
这个股吧没救了！基本都是托！,27342,2015-12-10,0.113505059282211
都是散户买，狗主力一直在出货，警告大家别买 ,31669,2015-12-14,0.34114736746454755
庄托又开始刷屏了,24784,2015-12-11,0.2966806369954209
这票主力昨天已经做死了。一周没戏,19277,2015-12-10,0.07064896597817638
关于“中试线”或“中试阶段”的几点知识求教,15098,2016-03-23,0.9166941659326326
北京旭碳在透明导电膜、散热膜领域取得了部分可,14820,2016-03-21,0.8963616856017915
现在进来的，一两年后必定是大赢家。只怕有人拿,13508,2016-03-27,0.780796029768149
小建议…,14417,2016-03-10,0.31607501733854626
东旭光电:关于大股东增持计划延期的公告,31860,2016-01-08,0.14694643975658717
东旭光电:收购报告书,115487,2015-12-18,0.7425130276940994
布局石墨烯 有赏黑科技 帷幄黑马啸 股价上大堤,14170,2016-03-22,0.7156681854726021
浏览用户5909 问 东旭光电(000413) 新申报的这,22402,2016-02-18,0.2478389917089474
逆势走强，后头大波段，大行情即将拉响！ 东旭,3119,2016-03-10,0.9461198523880678
下周会不会开盘涨停！……连续？,17746,2016-03-18,0.6400203839146557
东旭光电:关于签订石墨烯产业发展基金战略合作,79190,2016-03-17,0.6277622405169782
联手世界500强 东旭光电携巨资进军偏光片,10700,2016-02-17,0.23179689018356764
东旭光电：石墨烯产业基金再获突破 落子泰州加,33879,2016-03-17,0.9436211749932102
东旭光电:关于与北京协同创新研究院签订战略合,56460,2016-03-17,0.8189129709420075
昨日的股想必都吃到不少肉吧，今日再次会的公布,11583,2016-02-24,0.7508739796803542
东旭光电   近期这样操作,4540,2016-03-16,0.20553228731299822
