标题,帖子数,日期,情感
东旭光电下周十一亿股限售股解禁压力已经显现，,39346,2017-08-25,0.42501581383828146
增资收购目的猜想： 一、锂电池生产优质公司； ,743906,2017-02-07,0.9903798756821935
泛起陈旧的鼓吹围猎散户陷囹圄 虚幻梦中的金山,10584,2017-08-29,0.118785475017685
下周三买点。,66246,2017-07-15,0.5576042581707906
哈工大研究出真正的石墨烯电池《东旭光电》彻底,15979,2017-09-01,0.3851644672214517
加水就能走500公里的汽车诞生，东旭光电完了！,28555,2017-08-30,0.30465953088582587
转载《东旭光电机构今天护盘但明天必定跌停》韭,40954,2017-08-25,0.06897081650969261
东旭什么时候复牌啊？近日千万别复牌了,48664,2017-08-23,0.08543660266508335
6.82元/股定增的己解禁，6.29元/股定增的8月份,90740,2017-03-29,0.9225852093852495
~~002201九鼎新材 大股东低位增持随时拉升,8783,2017-07-21,0.2707181757177277
石墨烯技术属于长期的产业化布局，在投资收益的,13990,2017-06-13,0.9314016844776666
哪个王八说解禁新规？？？,5241,2017-08-02,0.9265386539888653
今天烯王二代终于到货了，试用了下，的确比一代,23981,2017-08-29,0.8484938601863959
2浪回调W底，马上3浪主升，懂的满仓干它。,27496,2017-08-16,0.004745665327840376
东旭光电:关于中国证监会并购重组审核委员会审,106593,2017-08-31,0.049931794797048124
在低位的MSCI个股,31108,2017-06-26,0.21270991843231346
东旭光电:中天国富证券有限公司关于公司发行股,47772,2017-08-31,0.0014112863611017712
东旭光电的股本扩张速度大于利润增长速度，这是,19998,2017-08-30,0.9762426090704512
东旭光电的新能源野心：石墨烯+电池+汽车，全产,48433,2017-08-30,0.048582160935930374
东旭光电:2017年第六次临时股东大会决议公告,113752,2017-08-28,0.23372491659891825
东旭光电继16年预选本人操作10大金股后17年7.18,29765,2017-07-19,0.03366822151757698
耐得住，拿的住，抓得牢,11909,2017-08-25,0.3128106908465066
庄托 A净水一方慌了神 等机构出完货该股就ST,7663,2017-08-30,0.32506179434377425
太恐怖了，8月26日配股上市，配股数11亿股，配,107523,2017-08-02,0.004540063508424952
东旭基本面还行，盘子过大不易拉升，题材概念故,69307,2017-07-28,0.6276103383859982
要跑赶紧滚，你们滚了，周一才好拉板，解禁新规,28206,2017-08-25,0.4273393725911395
东旭光电为何熊途漫漫？,16663,2017-08-26,0.9931735936902776
重大重组获批，几个涨停板可期。,26304,2017-08-24,0.9361619569680436
东旭切入石墨烯、新能源汽车领域，打通产业链，,48415,2017-06-02,0.19987395938069408
东旭光电(000413)融资融券信息(08-29),12238,2017-08-30,0.5510693131469493
10.5全仓买入，不知道是不是买对了？,11976,2017-08-29,0.16035695150416907
谈走势来切磋谈股论金，寻参考交朋友将心比心,2849238,2016-07-30,0.9771585541881055
东旭光电石墨烯产业化布局“多点开花”,73521,2017-06-13,0.0844758013073812
东旭光电拟并购申龙客车和旭虹光电,89632,2017-06-10,0.07873727121487784
东旭光电牵手山西国资开展石墨烯应用合作,54757,2017-05-15,0.03622781220421112
新能源汽车项目过会 东旭光电再添业绩新引擎,84815,2017-08-25,0.27232500401180393
业绩持续增长提升发展预期 东旭光电再推员工持,45442,2017-07-31,0.9068042441666766
石墨烯产业潜伏7只个股,312217,2016-04-07,0.09617879579522026
东旭光电与蓝思科技多领域全方位战略合作,36068,2016-06-01,0.9995384224591916
竟然有人一再说，9.9元增发价，没文化实在太可,72066,2017-08-26,0.06306638705912004
机构磨刀霍霍，韭菜欢欢乐乐,11764,2017-08-21,0.2690204422271151
1股遭营业部抢筹 东旭光电最受宠,109071,2016-09-09,0.682822467339668
东旭光电：迅速崛起的石墨烯之王,107335,2016-09-11,0.6376766953893278
东旭光电布局第一家石墨烯众创空间,27428,2016-12-19,0.09527696501950045
收购上海申龙 东旭光电完成产业链闭环,34672,2017-03-22,0.812510748969402
东旭光电30亿收购申龙客车 “电池+整车”模式分,44090,2017-03-22,0.6835855956107959
东旭光电多项重大项目已经落地进入收获期或即将,22809,2017-08-10,0.9700048064958557
揭穿价值投资的鬼话，如果真要价值投资，招商银,12766,2017-08-19,0.9997151511106501
东旭光电(000413)解禁股信息(08-28),72803,2017-08-27,0.06115617197713963
东旭光电:2017年第六次临时股东大会的法律意见,64502,2017-08-28,0.7668021262144051
持股待涨,38557,2017-08-02,0.6055402348319902
有些贱人真是贱,11965,2017-08-26,0.5181975285615502
石墨烯电池产业将很快迎来大发展期,82022,2017-04-13,0.5606474488037744
东旭光电应该看长期,7076,2017-07-25,0.22193436166153158
东旭光电天赐良机,10130,2017-07-31,0.21068392903724642
东旭光电:关于公司发行股份及支付现金购买资产,232498,2017-08-24,0.06117183481552091
喜忧参半的东旭光电，着实让散户左右无所适从。,17879,2017-08-24,0.8464639591617136
东旭光电，如果28日开盘不涨停的话，我敢挥刀自,41549,2017-08-25,0.06541011687314235
东旭石墨烯ing,7447,2017-08-22,0.3620685843707666
东旭光电:广州证券股份有限公司关于公司非公开,123581,2017-08-22,0.27858681861600654
卧槽卧槽！！120亿的解禁额！只有恒大前海类的,19242,2017-08-18,0.8650666585248544
真真假假、虚虚实实。总之坚持自己的想法不动摇,18343,2017-08-18,0.9665072771863096
复牌几个跌停？3个能打住吗？,18961,2017-08-21,0.13240850163684692
东旭光电下午如果不跌停的话，我敢挥刀自尽！,25159,2017-08-25,0.16674558572218778
东旭光电下午如果不跌停的话，我敢挥刀自宫！,9271,2017-08-25,0.15265889221771012
东旭光电:关于非公开发行限售股份解除限售的提,146375,2017-08-22,0.26885005753316527
我靠，今天好恐怖啊，割肉盘好多呀，人弃我取，,24823,2017-08-25,0.491220972739178
原来   东旭光电蓄势待发,16036,2017-08-18,0.21068392903724642
厉害  东旭光电财报显示平稳,10910,2017-08-18,0.4582435742959283
石墨烯电池产业将很快迎来爆发期！,108093,2017-04-13,0.7333034500974779
东旭光电子公司，碳源汇谷车间正在紧张的生产备,21234,2017-08-16,0.44611437988867664
东旭光电：参股“中国氢能第一股” 深拓新能源,11601,2017-06-28,0.025752073972375666
新能源汽车项目获批 东旭光电百亿营收目标有望,103122,2017-08-25,0.07335347859782015
新龙头东旭光电,6611,2017-08-16,0.1401219910951339
新龙头-石墨烯板块,6825,2017-08-16,0.2289910376289569
东旭光电午后强力爆发,12613,2017-08-25,0.34633431919790303
证监会：两公司并购重组过会 中通国脉被否,115613,2017-08-24,0.30715104855882547
东旭光电新能源汽车项目落子南宁 产业体量百亿,8012,2017-06-28,0.009842268255318753
稀王在东旭光电啊！,3983,2017-08-15,0.42536441803835723
"喜报，东旭集团顺利申报""2017年国家技术创新示",8287,2017-08-22,0.9517593245436624
东旭光电(000413)融资融券信息(08-24),10627,2017-08-25,0.5510693131469493
对于东旭光电，民生证券表示，中报业绩符合预期,13312,2017-08-16,0.6460502826581702
中国资本市场的现状未来投资方向正在发生着根本,10281,2017-07-29,0.9999953649094924
如何认清认识东旭光电是你投资的关键，东旭光电,29882,2017-08-10,0.8546648278887072
东旭光电8月25日打开跌停,39691,2017-08-25,0.0033252869809150543
东旭光电8月25日盘中跌停,58664,2017-08-25,0.024893715391716364
开盘坚决跌停卖出,15412,2017-08-21,0.09925470440614836
开盘以下跌为主。,4350,2017-08-18,0.20935743243827365
东旭光电8月25日开盘跌幅达5%,26803,2017-08-25,0.020803736757694646
收购“申龙客车”是老新闻；收购“旭虹光电”接,68739,2017-08-17,0.9848926287009478
东旭一千多项专利、其中石墨烯专利三十多项、最,18285,2017-07-27,0.8464384954408383
我是看好东旭上20 ，你们呢？,14153,2016-11-16,0.525675756397752
仅仅希望东旭跌幅不要超过百分之八，千万不要钉,12014,2017-08-24,0.012361459640085393
跌吧！小散们兑现赢利吧！要知道装进囗袋里才是,18464,2017-07-05,0.0028378640300555924
水军狗托们你们是英雄,11400,2017-08-21,0.9707876712199163
东旭光电：拟合计42.15亿并购申龙客车、旭虹光,109223,2017-06-09,0.1109016440406484
东旭光电并购申龙客车获股东大会通过,110478,2017-06-26,0.7978531594504649
东旭光电小子开始未来为何能一路长牛目标位38至,36144,2017-07-26,0.9977328415379911
东旭光电之路广阔前景无限,7952,2017-08-10,0.9641532020992478
~~支持董明珠的银隆新能源汽车,11197,2017-07-08,0.03977334193102622
东旭光电11亿股将解禁,89044,2017-08-23,0.051928090171342145
刚刚跟一个大师喝茶，无意中说起东旭光电，我问,58750,2017-08-22,0.9693583422740425
重组通过的话东旭光电就是：新能汽车龙头、石墨,23853,2017-08-16,0.3528247619062199
核心内参泄露（000430张家界）要大涨,16686,2017-08-21,0.6927658882437462
今晚发布中报，有人离场很正常，看走势应该业绩,16197,2017-08-10,0.7816967239994269
东旭光电:关于中国证监会并购重组委审核公司重,421896,2017-08-16,0.011040651698638215
东旭光电逢高减仓,41420,2017-04-10,0.31627101129632174
东旭光电目标价已出：2016年12月底40-50元；201,66403,2016-08-11,0.005387492432687879
碳谷科技石墨烯产品调研纪要,15437,2016-11-15,0.3431753816619767
玻璃基板进入收获期，外延发展添动力,72104,2017-08-15,0.9849257802592937
业务多点布局，营收稳中有增,72581,2017-08-15,0.5627851497162225
来自北京最新信息东旭光电周五过会下星期一或23,35609,2017-08-17,0.6450654451969733
东旭光电(000413)融资融券信息(08-17),16718,2017-08-18,0.5510693131469493
揭穿价值投资的鬼话，如果真要价值投资，招商银,78244,2017-07-01,0.9997151511106501
信息提示东旭光电今天股东大会后职工持股将进入,32720,2017-08-15,0.056127859360758925
东旭集团为东旭建设增资，大力开展PPP 东旭集团,53765,2017-04-04,0.07478410780002165
东旭光电王者风范即将显现其英雄本色放心大胆抢,8093,2017-08-11,0.9999799078525003
这个停牌已经不神秘。,33134,2017-08-16,0.8712292945850735
东旭光电:海际证券有限责任公司关于公司发行股,79052,2017-08-17,0.021507267904487648
11.4的成本，8万多股，是走还是留？握草，又跌,15346,2017-08-14,0.6810746804384932
其实000413起动也是6元多，600438同样是光电龙,20290,2017-07-30,0.7400655255208336
东旭光电:2017年第五次临时股东大会决议公告,77408,2017-08-15,0.14022719493522995
东旭光电：上半年营收达46亿 同比增长超六成,81788,2017-08-10,0.5238602253654381
东旭光电五年内随着基板产能增长到20元不成问题,13519,2017-08-14,0.0777185811436959
石墨烯业务表现亮眼，各项业务多点开花,105020,2017-08-14,0.8547064177814029
星期一，一阳串5线,20392,2017-08-11,0.7395924564490232
东旭光电有老鼠仓一一内鬼 每次一出什么利好公,17070,2017-08-13,0.23879338758973456
东旭光电2⃣0是最基本的价位，若一切发展顺利30,77066,2017-07-04,0.9070997664563418
告诉你为啥000413限售股解禁影响不大,18085,2017-08-10,0.003694879134379714
为什么说东光电可以逐步逢跌加仓，长期持有?因,19666,2017-08-11,0.05404139202086167
看图，收盘守住10.9，明天有戏,13566,2017-08-10,0.8628905911816077
东旭光电:上海申龙客车有限公司审计报告,42465,2017-08-10,0.25568665029148874
东旭光电：石墨烯散热膜技术的产业化应用取得阶,90810,2017-08-10,0.45818392796099283
东旭光电是中国上市公司最具活力和发展潜力的价,27733,2017-07-15,0.9969034133824253
中报速递：东旭光电2017年上半年盈利6.36亿元，,65686,2017-08-10,0.10944032999698161
价值投资是超值获利的根基资本市场永恒的主题,15952,2017-08-04,0.999991158210862
今天有人问我能不能卖房子买入东旭光电我告诉他,32284,2017-07-18,0.13307033751769837
坚定逢低建仓本人今天再次建仓100万股东旭光电,23475,2017-08-03,0.1925268041634921
宁波港601018祝东旭光电涨停板,15032,2016-08-09,0.7361990317341803
今年又是个灾难年呀，年初60万资金进入股市，到,44189,2017-01-26,0.9983729429707253
东旭光电高开高走12.57,8595,2017-08-02,0.8267251313838987
莲花健康 东旭光电,发图给咨询股友无关涨跌据此,10117,2017-08-08,0.8474938841892413
快讯：在郴州市科技局领导的陪同下，东旭集团华,21498,2017-08-04,0.4445852967416726
指标显示超卖，周一要割的请自便，自然有人接。,23524,2017-08-06,0.847953210609604
二期员工持股计划出来了，会拉升让你跑，内部高,26872,2017-08-04,0.2629245374957221
进场: “双重改革”受益股,社保养老金标的股,3041,2017-07-31,0.9893200488469195
亲们，十块以上都不要考虑进场，加仓，出局观望,15624,2017-08-04,0.6806315363336582
东旭光电:北京国枫律师事务所关于公司实施第二,102336,2017-08-04,0.9475764846629547
石墨烯电池，空客飞机上已在用了,22706,2016-09-24,0.0482964047877098
谈谈413：1、东旭股吧热、散户看多的多，这是一,23569,2017-07-25,0.059815836625471186
明日高开涨停！11元以下都是送红包！正能量的雄,12327,2017-08-03,0.48333439102115183
静水一方屎狗托！你他娘的昨天狗叫不是喊涨停的,8298,2017-08-03,0.8516958358239378
东旭光电：石墨烯题材热度冷却,65449,2017-07-17,0.4972869876340136
12亿解禁股马上来临，流通股增加50％，股价下跌,8540,2017-08-03,0.7065358698267297
我看东旭光电,16439,2017-08-02,0.2754628833537185
东旭光电：推二期员工持股计划 募资额不超1.9亿,94811,2017-07-30,0.037023087486379946
石墨烯今年下半年肯定会有一大波行情，石墨烯的,24369,2017-08-01,0.9655922458370833
牛哥已经进驻000413东旭光电，离大涨还远吗？,22063,2017-07-31,0.1395526137263361
东旭光电后面会怎样走？可以介入吗？,6371,2017-08-01,0.9111005052963693
东旭光电:第二期员工持股计划(草案),59493,2017-07-30,0.009751037777545046
百分之99的股友你为了1毛钱你可以走了百分之1的,9634,2017-07-28,0.3072264460494215
黑革尔先生作品：强烈看好  东旭光电 石墨烯的,33200,2017-07-29,0.43399678567695144
东旭光电:第八届十九次董事会决议公告,58092,2017-07-30,0.09593851137239229
东旭光电拟推第二期员工持股计划,17950,2017-07-31,0.008429629624993829
就他妈涨几分钱！你看看方大！,5496,2017-07-31,0.10393687942463492
还坚定持有东旭光电的散户有肉吃了，外资第一波,17402,2017-07-29,0.7345644845068638
东旭光电:第二期员工持股计划(草案)摘要,48557,2017-07-30,0.025906889765096586
东旭光电靠吹牛逼才能涨,2019,2017-07-27,0.05665970778211982
东旭光电八月二十六号17亿解禁股老虎要出笼了快,16998,2017-07-30,0.3206169700401853
东旭光电:关于公司第二期员工持股计划之独立董,29869,2017-07-30,0.01735228213954909
11亿定向增发股减持，要几百亿资金当接盘侠,13771,2017-07-29,0.6161284784196558
东旭光电:第二期员工持股计划管理办法,49794,2017-07-30,0.0019540710161086716
东旭光电趋势将一度跌到什么时候；回调能否在风,17968,2017-07-21,0.019378008563578075
东旭光电底部盘整了这么久了，今天该突破了，这,21242,2017-07-23,0.42572382964298616
大戏到来，石墨烯龙头，东旭光电下周巨量爆发[,22464,2017-07-28,0.2458057084354488
黑革尔先生作品：强烈看好  东旭光电 石墨烯的,14815,2017-07-29,0.43399678567695144
11.55还有更高的吗,20530,2017-07-27,0.7592728043519579
东旭大M头，慢慢下跌路启动到7元,8820,2017-07-27,0.34661354287309043
东旭光电:关于收到《中国证监会行政许可项目审,203105,2017-07-20,0.5997589668567257
警报！小心！,6895,2017-07-26,0.47018135094204083
东旭光电回档震荡即将结束！一波资金暗中逐步入,10432,2017-07-27,0.9779860302679294
什么解禁不解禁一切都不可怕对东旭光电来说正是,8514,2017-07-26,0.9198216375849602
割了，换万华化学,4204,2017-07-26,0.6502745928080227
基金抱团炒个股是中国式庞氏骗局，隐患危害大41,15540,2016-07-21,0.9262069561756864
东旭光电(000413)融资融券信息(07-24),12135,2017-07-25,0.5510693131469493
东旭光电拟16.5亿投建石墨烯基锂电池项目,42357,2016-09-12,0.06901404921368093
静水一方是被苟馹过得玩意，他买了就拼命推销，,5042,2017-07-25,0.004505024478907882
东旭光电下星期一将高开高走,25929,2017-07-22,0.5189712180808179
东旭光电，圆弧底已成形态，后市突破颈线位，股,55785,2017-07-04,0.42414094942695724
再次准备做多东旭光电,43369,2017-04-06,0.15074306984362462
实战炒股口决： 十四工作线，不破不走人。短线,53624,2017-01-30,0.9596611393517058
东旭光电牛基确立超级资金进场毋庸置疑中长期目,10785,2016-02-19,0.6184088042989041
东旭光电社保资金进场快速进场今天涨停板,9372,2016-02-19,0.9785371224220114
典型双顶形态！,7360,2017-07-13,0.7087839911321844
这个企业的领导太老实。,9148,2017-07-19,0.15893178816185738
30亿元收购上海申龙 东旭光电强势进军新能源汽,53538,2017-03-21,0.06353965264131778
东旭光电：或再布局5至8个新能源汽车基地 完成,82025,2017-06-12,0.003829615884642479
东旭光电 推出了世界首款石墨烯基锂离子电池产,23363,2017-04-12,0.16246521291121152
东旭光电：石墨烯将在汽车产业发展中扮演重要角,11130,2017-07-13,0.607897549912073
东旭光电:关于偏光片项目进展情况的公告,183189,2017-07-03,0.1710047194987473
本人独创最赚钱，最安全，最简单的炒股方法！ ,50926,2017-02-02,0.2634185967817144
石墨烯+锂电池+新能源汽车+雄安[赞],31651,2017-06-14,0.7386102810785483
液晶玻璃基板龙头，外拓石墨烯产业,191879,2016-11-01,0.18634783641042763
东旭光电：摩拜智能车锁爆炸电池并非公司产品,105387,2017-07-07,0.4033412845678329
跟了这个股票2个半月，第一次冒泡说话，第一次,33171,2017-07-11,0.1682416505895622
最后一笔3.6,2172,2017-07-07,0.313965363557528
撑死胆大的，饿死胆,2349,2017-07-07,0.4046860683342951
好久没涨停了,2377,2017-07-07,0.4331217088538797
东旭去年8,25增发价多少钱一股,4698,2017-07-07,0.5248064924311007
龙轩在此拜上,2168,2017-07-07,0.716706438556318
15元,1829,2017-07-07,0.24090089649307622
在日线上面,2401,2017-07-08,0.5
等待董秘回复,5775,2017-07-08,0.11686927569358885
今天11.09接回……谢谢主力,9119,2017-07-12,0.4099957962944849
东旭光电：“烯王”产品已小批量试用于共享电动,79672,2017-06-12,0.9112303817601802
屎,1771,2017-07-06,0.5999999999999999
石墨烯新贵,106545,2015-11-17,0.45491450064320604
一杯茶，一包烟，东旭何需看一天。求下联,18046,2017-07-08,0.70849778024186
东旭光电:2017年第二次临时股东大会决议公告,61983,2017-03-31,0.23087764212068995
东旭光电：石墨烯将在汽车产业发展中扮演重要角,43076,2017-07-08,0.607897549912073
东旭光电董秘好，请问回复内容是不是去年公告量,21948,2017-07-08,0.00260403340266091
下周东旭光电是否会替代方大碳素石墨烯领涨涨价,15211,2017-07-09,0.6694960927940736
东旭光电董秘好，请问回复内容是不是去年公告量,12603,2017-07-07,0.00260403340266091
减持新规对东旭可能是利空，延长了减持周期，只,11262,2017-05-31,0.956765038954231
东旭光电不涨没有道理啊,3195,2017-06-08,0.7911136779550401
上午洗盘结束，东旭光电下午涨停！,14337,2017-07-06,0.5931625496524862
这么多单子卖出,5142,2017-07-06,0.34000971201293706
收盘11.66看吧[兴奋][兴奋][胜利][鼓掌][鼓掌][,12664,2017-07-04,0.999169860799128
记得永远不要买这只烂股票。会影响其他事情,1054,2015-10-22,0.8709577352319433
东旭光电偏光片项目投产,82223,2017-07-04,0.20724362435497679
东旭光电：偏光片项目正式投产,88200,2017-07-03,0.42959648234069925
飚吧[牛][牛][牛],5770,2017-07-04,0.7324990729375995
东旭今日横盘清洗浮筹，明天必然震荡上升,122265,2017-04-05,0.8640382316088142
会涨停，相信我,55478,2017-04-05,0.6183473605994695
重大利好！烯王二代将于4月发布，暴涨就在下一,100528,2017-04-07,0.3169887531466722
石墨烯时代来临，东旭雄起,34689,2017-06-02,0.9368139476281985
东旭光电核心竞争力大大提高，可为投资者创造更,32792,2017-06-02,0.9979448780064507
最新石墨电极概念股一览 2017最全石墨电极概念,34073,2017-06-26,0.08012716604690506
方大炭素,17919,2017-06-28,0.3786613311661733
开启涨停模式[为什么][大笑][大笑][拜神][拜神],11138,2017-04-26,0.9570578448638507
今天下午东旭光电要暴涨，千万不要提前下车，否,25003,2017-04-24,0.03971702128055421
今天主力吸筹码，吃饱了，明天起，百分百涨起，,71143,2017-04-13,0.8217499683255745
烯王二代要出,59061,2017-03-31,0.47882469326530763
毫无疑问，增资东旭建设，剑指雄安新区！,114114,2017-04-04,0.968742529332379
南开大学本科学生团队研究氧化石墨烯复合态毒理,30848,2017-06-02,0.9664353716039145
看好的是东旭管理层对新科技的吸纳精神和对企业,27796,2017-06-02,0.8964619063665282
到2020年石墨烯应用市场将形成千亿级市场规模,73377,2017-04-13,0.6666753706377281
下周一大幅低开,59179,2017-04-04,0.053348758342693814
东旭的翅膀已经插上[大笑]雄安外加新能源汽车，,40745,2017-04-05,0.3228215833074457
东旭光电预计2017年营收可达百亿，可为投资者创,39036,2017-06-02,0.7578698666475614
明天东旭光电可能带领新材料，新能源，雄安板块,21979,2017-05-02,0.11230371089551616
东旭光电走势持续偏弱 短期风险继续释放中 游资,11071,2017-06-25,0.6183017298477601
雄安+石墨烯产业化！谁有这样的题材[牛][牛][牛,16326,2017-05-09,0.8589749235716956
上午10.95卖了，11.34买回,12184,2017-06-26,0.2971196354293191
今天有可能来个涨停！,7717,2017-04-28,0.5917277703202298
下周二，河北板块必定很热闹！,47759,2017-04-01,0.9897841775103843
大家忽略东旭与山西两家公司深层次全方位合作中,16626,2017-06-02,0.8727145121133459
估计也快了第二个新能源车基地-四川绵阳,82963,2017-04-04,0.002050429326207137
此股完全有能涨十倍,67931,2017-04-04,0.25246209987260426
东旭销售主要产品都属于高科技、亨受国家优惠税,25242,2017-06-02,0.8729163182303172
正处于反弹阶段，建议逢低买进，具备长期投资价,77429,2017-04-07,0.998341839920694
东旭光电的“黑科技”,147097,2016-07-10,0.8813755196890503
东风吹，战鼓擂，东旭光电要雄起。东旭已从石家,54008,2017-04-03,0.045167226823560336
看好东旭光电！成长空间非常大！,38363,2017-06-02,0.9388283682065964
东旭光电雄安黑马王者归来20元,8601,2017-06-06,0.7095811264832027
开始上攻，坐好了,47478,2017-04-13,0.7510420617512459
砸盘的快压不住了吧？这么大利好还砸盘，砸盘的,36807,2017-04-05,0.2927098016437385
是金子总会发光的，信不信由你,77337,2017-04-13,0.45558868395054974
不能受一时的跌涨所影响，重要的是看他是否有发,77331,2017-04-11,0.1511904929739033
东旭光电10.6元左右:[买入][买入][买入][加仓][,22682,2017-05-02,0.38267620188688944
北京石墨烯产业创新中心成立 打造千亿级产业规,15549,2017-05-09,0.9960062190998901
东旭光电适合长期持有，坚持就会有收获！,72699,2017-04-11,0.24612754006702242
11元石墨烯动力新能源汽车，哪里找？,51787,2017-03-31,0.0044218316941755376
人类发展史：石器时代，青铜器时代，铁器时代，,24856,2017-06-02,0.9997813727155831
东旭光电:关于收到《中国证监会行政许可申请受,168234,2017-06-30,0.38104006126765255
我走了，你还在吗,4950,2017-06-30,0.6293604162579277
领航石墨烯产业，非涨不可,44267,2017-03-31,0.4508826048443145
收购明朔科技或将成为东旭光电石墨烯产业业绩爆,24956,2017-05-10,0.9822680372482293
低位放量，吸筹明显，明天开始拉升，东旭光电，,17943,2017-05-10,0.016330231305931697
石墨烯电池升级，“烯王二代”即将面世,90881,2017-04-07,0.98499446559727
原山东东营告知16年跟我操作东旭光电的朋友你可,11566,2017-06-06,0.45618726946934396
东旭光电,下周开盘涨停！上周已经满仓买进了！,44535,2017-04-03,0.2286799044470117
明天东旭光电涨停，月底20元见！,9032,2017-06-14,0.04259726731321545
东旭光电:2017年第四次临时股东大会决议公告,64565,2017-06-26,0.21295617023934665
协议已签（可查），落户上海临港！,7532,2017-06-27,0.05810645398380021
综合分析看，特斯拉中国建厂合作方拟非天汽模莫,9389,2017-06-27,0.697109138209136
不建议割肉叻 长线资金 可主动配置,7209,2017-06-27,0.954289844622591
