标题,帖子数,日期,情感
业绩不及预期，但是前两季度平稳,12412,2017-09-01,0.9176192801314947
我的天啊！热卷上4400了。河钢下半年利润高达15,12543,2017-09-02,0.9605282244426089
勇者胜,7683,2017-09-02,0.8490992695232285
下周一5.49元开盘,17115,2017-09-01,0.2986645628714796
河钢股份：钒产品产能2.2万吨 钒产品涨价对业绩,205417,2017-07-29,0.9985598342893768
迎接第三次革命！,60995,2017-08-15,0.864405653466498
爱国吧,62976,2017-07-31,0.8571428571428571
年利润200亿！,91747,2017-06-30,0.17671076220305915
今天去了雄安概念股和券商股约20家的股吧大力推,7824,2017-09-02,0.03884601921361297
吉而祥兄弟/说说你下周要唱多或唱空河钢?,3424,2017-09-02,0.9992087663066888
按重要度:     1、优质钢企;       2、钒钛垄断,5850,2017-09-02,0.6160436641098052
2017-9-1公告,15453,2017-09-01,0.4737672181921908
河钢产垃圾中的垃圾.接下来将是下一轮的暴跌,9900,2017-08-30,0.6876190092369941
上方抛压那么重，还进的是有多蠢、,10187,2017-08-30,0.0863861682140854
一颗红心，二手准备！,13609,2017-08-31,0.0512657746883205
今天早盘买入的，明天上午冲高获利了结,9093,2017-08-30,0.45034903008389315
河钢宣工业内率先与雄安新区开展深度业务对接,55165,2017-09-01,0.9997213926002128
今天河钢股份是雄安老大[胜利][胜利]，4.23成本,37630,2017-07-19,0.9965428327936152
3季度报告来了,16838,2017-08-30,0.6919982948978743
无风不起浪,13908,2017-08-31,0.2619688907935418
IFII,13013,2017-08-30,0.5
长阴过后阳驱雾 春风又扶桃李颜,26261,2017-04-03,0.8418981633183388
000717 5倍市盈率，前三季度每股收益0.72元，四,2289,2017-08-31,0.6220834359815125
交浅勿言深，情深不刻薄 哒哒曾几次提醒我说：,14819,2017-08-18,0.9049509733578533
展示一下咱的短线能力[胜利][胜利][胜利][胜利],7077,2017-08-25,0.9981597202634322
河钢股份(000709)融资融券信息(08-31),10141,2017-09-01,0.9988396190344306
亚飞投资伴随“废铁”一路行！！,57106,2017-02-21,0.9740700005315377
河钢股份从公司基本面及发展潜力而言10元以下的,8838,2017-09-01,0.9996200293989536
河钢股份:关于设立全资子公司的公告,71755,2017-08-29,0.9852412727907823
唱空一天很有效果！河钢股份上涨4.39％股价报收,10627,2017-09-01,0.9984553788595408
股道教你盘中如何做T+0操作：,40435,2017-06-18,0.6242053051821247
2017-8-14公告,58071,2017-08-14,0.4737672181921908
河钢股份9月1日盘中涨幅达5%,12179,2017-09-01,0.7349065183768373
中报速递：河钢股份2017年上半年盈利12.51亿元,45718,2017-08-29,0.9885288554752587
河钢最大的问题是大股东及一股邪恶势力一直在减,7004,2017-08-31,0.9869074808641768
马上有人要说火箭两点发射了，准备一下,18159,2017-08-15,0.2419964950793979
河钢股份超级资金一直在流出！严重弱于大盘及钢,12485,2017-08-31,0.9999011995807888
河钢衡板马口铁产品首次出口俄罗斯,30259,2017-08-31,0.9872555706518219
哈哈 000488晨鸣纸业，最少涨三倍。,6410,2017-08-01,0.9856172771384978
三大执法部门全面介入,10786,2017-08-28,0.29287155908108564
河钢只要一次封板？必形成连续七连板！如果明天,20505,2017-08-28,0.9951210708473203
4.88卖一半，4.93接回，你进我进，你退我退，我,3942,2017-09-01,0.0028213415277777987
河钢股份：60分钟反弹继续中，形成顶分型卖出（,4233,2017-08-30,0.9936506188815157
尾盘2笔9999买进，懂行的解释一下,8705,2017-08-31,0.004770948782420237
老钢你的下跌是为了更好的上涨吗?,14356,2017-08-24,0.9101454721438715
抄底！洗盘结束下午及明天将上涨！河钢股份公告,11990,2017-08-31,0.8901720961423017
河钢股份(000709)融资融券信息(08-30),8396,2017-08-31,0.9988396190344306
河钢半年报！！,11250,2017-08-30,0.5896499049545663
河钢股份：30分钟图短线分析（2017年8月23日）,17996,2017-08-23,0.9978483674118089
河钢股份公告重大利好：业绩暴增205％，上半年,6149,2017-08-31,0.9973723960226941
开启暴跌模式，河钢重大利空！河北冬季限产方案,24339,2017-08-05,0.9988439914773838
明天可能直接低开跌停，上面的成效全部套牢！,21444,2017-08-06,0.5357757397673278
河钢股份:河钢集团有限公司合并资产负债表,40913,2017-08-29,0.9871100497803925
天天向上、明天记住你的诺言、若上升五点、你从,8009,2017-08-09,0.8974711908836381
河钢股份(000709)融资融券信息(08-29),8741,2017-08-30,0.9988396190344306
这么明显的圆顶，还有喊多的？[滴汗],15778,2017-08-14,0.38347246592769124
经过河钢这次最伤、最痛的洗劫，还是放手了，最,21797,2017-08-19,0.9988579345249258
今天终于卖了，随便一个钢铁，不需要任何概念，,12804,2017-08-03,0.2712691447657529
主营业绩稳健，钒钛锦上添花,73810,2017-08-30,0.8987045071892491
河钢--全球顶级抗癌药，中国拥有自主研发产权,7091,2017-08-02,0.9999972429212256
~~来自主力的内部消息,5881,2017-07-29,0.5842094947659204
河钢股份上半年净利润翻两倍 证金社保齐减持,63353,2017-08-29,0.985795681163548
河钢股份：上半年净利增长逾两倍 证金、社保纷,47140,2017-08-29,0.9920333855338502
挺进雄安.聚焦钒钛！,17610,2017-08-29,0.37172938066498173
河钢股份：60分钟图分析。8月24日,10531,2017-08-24,0.9954166567844832
河钢股份,12323,2017-08-29,0.9952130984212577
2019河北股份净资产预测,26074,2017-08-22,0.9930024159640679
省长调研的目的？,28374,2017-08-24,0.350800987440239
特别提示：中长线投资首选打新首选的价值洼地超,4689,2017-08-30,0.9999834573918462
河钢石钢承办的中国制造2025特殊钢高端论坛举行,31003,2017-08-25,0.9999839721612299
24日消息：24日晨河北前进钢铁已全面停产，廊坊,31062,2017-08-26,0.9689493698593712
真正的钒钛暴利公司成立了！河钢今天真不应该卖,18210,2017-08-29,0.9733617359415437
河钢股份:三届十次董事会决议公告,24714,2017-08-29,0.9872867754701319
河钢股份:2017年半年度报告摘要,44194,2017-08-29,0.998205029872464
“金融大鳄”已经浮出水面,16847,2017-08-25,0.9969536781292103
重磅消息： 雄安各部门领导60多人今天视察河钢,12548,2017-08-29,0.6878858170673288
今晚半年报,7731,2017-08-29,0.5077761043740994
上面全部是等待解套的，早割肉少亏损些。,8867,2017-08-07,0.17918554995363245
两点半后，融资借钱炒股的可能要抛牛还钱大跌的,9488,2017-08-08,0.06433610958954572
复盘,21300,2017-08-25,0.5
河钢股份：一季度净利增逾4倍 恒大人寿意外现身,118021,2017-04-27,0.9992322206811661
河钢股份(000709)融资融券信息(08-28),8053,2017-08-29,0.9988396190344306
强势涨停机构游资敢死队疯狂抢筹暴涨飙升超级大,8687,2017-08-12,0.7090289443624056
希望就在前头,47386,2017-07-29,0.5369038447347817
明天放量！000709河钢股份抢货进行中一飞冲天的,11228,2017-08-28,0.9902593557143261
周线横有多长竖有多高上升趋势不变！月线大三角,13461,2017-08-26,0.7679873799283832
[胜利]向全国人民问好！祝全国人民幸福安康！,5761,2017-08-14,0.9996911860165562
散户必看炒股格言和现金策略！     孙子云：先,45003,2017-04-05,0.08037291965991733
礼拜一如果高开散户千万别追特此忠告立贴为证希,19505,2017-08-19,0.7185602732723463
复盘,6332,2017-08-24,0.5
午评,6328,2017-08-25,0.4712368074161022
河北副省长张古江到河钢唐钢调研,41505,2017-08-23,0.9994724924005145
织女吟,18523,2017-08-18,0.4737672181921908
中钢协副秘书长王颖生：兼并重组是钢铁行业下一,11791,2017-08-24,0.32751337844565676
藏在深闺人未识的极品宝贝价值洼地河钢股份将一,5668,2017-08-28,0.9999756471781839
河钢股份(000709)融资融券信息(08-25),9947,2017-08-28,0.9988396190344306
小散的一片哀嚎，是对主力操盘手的最高奖赏，试,9319,2017-08-27,0.7740393283219922
放心持股何妨？,4886,2017-08-25,0.8405170201780556
河钢股份下周公布半年及第三季度超级业绩大利好,27590,2017-08-25,0.997150601837917
说时容易做时难,6921,2017-08-23,0.3148101969065983
八月份河钢剩下四个交易日演变如下：周一5.14。,18301,2017-08-25,0.993348303581035
荐股: 日线似锅底，周线底背离,10175,2017-08-21,0.5749818607783611
我割肉跑了，现在有点后悔了。赔了十几万。但是,59856,2017-08-12,0.011036217120861669
论“供给侧结构性改革”与河北股份的可持续发展,18821,2017-08-19,0.999564541326689
进场: 怎么跌的就会怎么涨上去（荐股）,7311,2017-08-04,0.7541933135049772
笑死我鸟！,27299,2017-08-14,0.4651678924166548
螺纹钢期货开盘大涨3％以上！国务院总理及国家,4891,2017-08-21,0.99499356875024
河钢股份(000709)融资融券信息(08-24),10952,2017-08-25,0.9988396190344306
已经开始产出石墨烯电池了,15809,2017-08-02,0.34723298603430675
周末钢铁企业重大利好！000709河钢股份有望补涨,29464,2017-08-19,0.998508994506105
河钢股份(000709)融资融券信息(08-18),13708,2017-08-21,0.9988396190344306
螺纹钢暴涨！河钢股份跟上,8058,2017-08-21,0.9992187340250467
坑娃！,14561,2017-08-21,0.5
河钢股份明日涨停！重要的事情只说一遍，不要问,11792,2017-08-24,0.9570853227327724
河钢股份(000709)融资融券信息(08-23),9619,2017-08-24,0.9988396190344306
漫步穹苍下，与君共风雨。 缘也有时起，缘也有,19884,2017-07-30,0.9992205952064753
忽然想起了螃蟹[胜利][胜利][胜利][胜利] 俗话,13849,2017-08-05,0.9991801423558507
河钢股份 河钢股份:二季度盈利维持较高水平 河,6800,2017-08-23,0.9999970004007718
河钢股份预计上半年净利润11.50亿元至12.70亿元,86494,2017-07-10,0.9565414651063551
复盘,7654,2017-08-23,0.5
河钢股份：上半年业绩预增约2倍 盈利超11亿元,78249,2017-07-10,0.977844536737332
是4.7元的河钢股份有投资价值，还是9.04元的中,8918,2017-08-23,0.9996282926092522
000709河钢股份即将公布河钢股份预告翻2番的业,12510,2017-08-22,0.9997931640615697
请怀疑请伤害请相忘于江湖[心碎][心碎][好逊] ,12251,2017-07-25,0.9563615333655215
复盘,9630,2017-08-22,0.5
今日周二河钢收盘5.31。周三收盘5.84。周四收盘,8469,2017-08-22,0.9995364629601329
河钢集团，河钢股份，邯钢集团，唐钢集团，承德,28051,2017-08-20,0.502830663701382
河钢股份(000709)融资融券信息(08-21),11844,2017-08-22,0.9988396190344306
午评,4776,2017-08-22,0.4712368074161022
公司新闻（开发高端特钢）,16083,2017-08-16,0.7759255505670174
明天涨停价：5.31,11586,2017-08-21,0.6123240201729157
复盘,9324,2017-08-21,0.5
黯然销魂者，唯别而己矣[哭][哭][哭] 多情自古,20802,2017-06-18,0.9804221549037327
一个错峰生产洗出去好多大傻瓜！,15038,2017-08-07,0.3568229533942533
复盘,8944,2017-08-18,0.5
河钢股份:2017年8月16日公告 公告日期：2017-08,25500,2017-08-16,0.8870582256287333
今儿起，这里我是爷，是八爷,6117,2017-08-17,0.9240011473500075
河钢股份(000709)融资融券信息(08-15),15187,2017-08-16,0.9988396190344306
认识一下行业前三的河钢,18222,2017-08-19,0.9951028451356583
受益京津冀协同发展加速的钢铁第一标的,93097,2017-02-22,0.9391799428537217
钢厂搞事开始，涨到你不能自己！ 河钢集团上调5,14422,2017-08-18,0.320457614211365
从站起来到强起来,12922,2017-08-17,0.7249592545098877
河钢股份:2017年半年度业绩预告,137442,2017-07-10,0.9968928084773109
二季度盈利维持较高水平,114049,2017-07-11,0.5266429156574153
业绩处于持续改善通道,46662,2017-04-28,0.8084168884601475
默默地做。在河钢有很多有本事的高手。我一路从,37946,2017-01-17,0.9983002947347658
河钢股份补涨行情启动！,8535,2017-08-18,0.9993323424192833
周一向上拉升！现货货期今天爆涨现货也同样提价,11985,2017-08-18,0.020826287808783484
河钢股份(000709)融资融券信息(08-17),13126,2017-08-18,0.9988396190344306
河钢股份(000709)融资融券信息(08-10),17699,2017-08-11,0.9988396190344306
打压已经结束！下午拉升！珍惜吧,8850,2017-08-17,0.6302989566410928
河钢股份(000709)融资融券信息(07-26),15669,2017-07-27,0.9988396190344306
市盈率钢铁板块最有价值地.无论动态与静态,33880,2017-08-10,0.13216941179763075
我顶你个钒价涨价真龙头！,92942,2017-08-02,0.2741187420913488
别人恐慌时我大胆抄底！想想国歌歌词！高唱国际,3915,2017-08-10,0.9956834462507015
吧里的河北于勇即使是假，但也假的很真，从其帖,9627,2017-08-16,0.998422542154095
河钢本钢上调9月份钢价,21564,2017-08-17,0.9996999884789152
河钢股份(000709)融资融券信息(08-16),14449,2017-08-17,0.9988396190344306
复盘,9862,2017-08-16,0.5
河钢股份(000709)融资融券信息(08-02),18209,2017-08-03,0.9988396190344306
河北股份有多少条蛀虫？,10890,2017-08-16,0.958884162178464
雄安第二波启动！恭喜河钢股份000709将涨停！大,7772,2017-08-17,0.9989654671341477
8月底如果上不了5.5我给留贴的每人充50话费！上,9178,2017-08-16,0.48966164674046264
砸！,19606,2017-08-10,0.18181818181818177
河钢董事长您好，今年如果评选垃圾股河钢一定会,18604,2017-08-09,0.991435580805668
明天河钢绝对一字涨停板！！5.71元原因非常简单,51337,2017-08-09,0.9857342186323188
000709：破掉4元抄底，3.6至4元是抄底区间,11398,2017-05-10,0.051328848818592565
把握机会！河钢今天开始向上反转！明天将迎来大,11893,2017-08-15,0.9922786913472562
今天强势洗盘明天大涨！明天将向上突破！今天强,7987,2017-08-16,0.9445070157735197
河钢股份000709明天将涨停！大家相互转告一声！,10933,2017-08-16,0.9872136942453817
向于董事长致敬！这是民族品牌的伟大领航人的心,8647,2017-08-15,0.9986403435413362
近期还是多看少动,9538,2017-08-16,0.5209430822103654
大家好！河钢集团公司董事长于勇董事长也在本吧,17162,2017-08-15,0.9878288323554848
底部抬高明天大涨！今天先知先觉者可以先行介入,7625,2017-08-16,0.15347568745725815
要有信心,8072,2015-09-10,0.7450980392156863
下周面对,40065,2017-08-11,0.8829041187753254
周一河钢股份将在河钢钢材大幅提价10％的利好支,22801,2017-08-11,0.9981638003527905
今日提示,6171,2017-08-16,0.8607246878564719
河钢中建钢结构有限公司正式成立 2017-06-21 　,10192,2017-08-15,0.9998650495356614
河钢股份(000709)融资融券信息(08-14),15662,2017-08-15,0.9988396190344306
哥今日己入驻000709 河钢股份！短炒！,98384,2017-07-20,0.9966869988799215
请教:5.28元进的！春节前能解套吗[滴汗]?,12425,2017-08-15,0.452691792608391
明天暴涨！坚决不在暴跌20％后割肉！坚决抄底！,21329,2017-08-14,0.19882779081003077
绿色为笔，描绘美丽中国新画卷,6363,2017-08-13,0.9997608705546237
复盘,8905,2017-08-14,0.5
河钢股份8月11日盘中跌幅达5%,23643,2017-08-11,0.7907165259979902
河钢股份:“16河钢02”公司债2017年付息公告,121224,2017-08-03,0.999951916432745
河钢股份第二波的爆发点在雄安新区公布建设规划,21028,2017-06-17,0.9979229670917155
暴跌原因的深度分析！精华,29706,2017-08-12,0.9543792957076958
河钢股份(000709)融资融券信息(08-11),16225,2017-08-14,0.9988396190344306
最新钢厂一线生产情况调研报告,8498,2017-08-14,0.4286037134874707
14点封板？！坚持持股！坚决不在暴跌20％后割肉,5711,2017-08-14,0.028959021335643653
2017-8-6公告,21746,2017-08-06,0.4737672181921908
河钢股份即将成为第二支方大炭素！抢到赚到！,6927,2017-08-02,0.9973252153683219
学学亏损企业！大股东别减持了！,12442,2017-08-09,0.671356990388199
河钢股份000709今天将开始发力：安阳钢钢和凌钢,9808,2017-08-10,0.9999917424959358
河钢股份(000709)融资融券信息(08-09),20757,2017-08-10,0.9988396190344306
河钢股份被错杀白马股下周一开始将用三天时间快,14438,2017-08-12,0.992690732521982
中国人民不能恐慌！命令国家队及所有基金抄底所,9941,2017-08-10,0.7848885178200011
8月11日，全国共有25家钢厂调整出厂价格，具体,27485,2017-08-11,0.007774995165624965
亏损了,7013,2017-08-11,0.2500000000000001
致股友们：热点还在资源类股票，主板和二线蓝筹,28259,2017-08-11,0.9951047548710159
V形反转已经开始！中国人民不能恐慌！命令国家,7890,2017-08-10,0.7636551847520032
假如河钢机构今天再打压股价实属不得善终行为了,4260,2017-08-14,0.998543374863601
河钢股份马上公布中报业绩增长2倍！暴力拉升！,15423,2017-08-10,0.9990952831384048
下午将V型反转！收盘上涨5％！团结起来一起拉升,13933,2017-08-11,0.047450900937497154
特大喜讯：超级资金今天开始将抄底河钢股份！河,6544,2017-08-14,0.9994271601211262
4.86买进，我己哭晕,5435,2017-08-14,0.421874597530976
000709河钢股份将V型反转暴力拉升！赶快抢筹抄,8389,2017-08-14,0.9983658495328966
下周上6元，绝对杀空头,17002,2017-08-12,0.13501945917250824
《炒股日记》（7月28日，周五）,15771,2017-07-28,0.036928782774772406
我信奉[好逊][好逊] 可以年轻但不能气盛， 可以,6884,2017-08-01,0.6453344036694444
我感觉周一可能开盘会封涨停！,19863,2017-08-12,0.31978810638769795
证监会已经开始调查恶意做空河钢资金！快快抢筹,20480,2017-08-09,0.9987642065983614
空头陷阱！马上V型反转！抢超廉价筹码！,5288,2017-08-09,0.17538408899124314
河钢股份(000709)融资融券信息(08-07),25362,2017-08-08,0.9988396190344306
《怎样摘除长期打压钢铁板块的这颗毒瘤?》,24777,2017-07-08,0.18586126127100178
河钢股份(000709)融资融券信息(08-08),22735,2017-08-09,0.9988396190344306
融券的空头赶紧买筹回补！否则小心收盘暴你仓！,4161,2017-08-08,0.045110862141632846
今天是河钢主升浪前的最后一次凶狠洗盘，十点后,6609,2017-08-09,0.9990806324538422
染料行业垄断性：分散染料历史底点每吨12000元,4284,2017-08-03,0.9620396989877411
有一群小丑手中无股专唱空河钢！大家抄底！,4410,2017-08-09,0.9973958673285251
此刻，如果你恐慌，你就输了！！！,17598,2017-08-09,0.8763068130960825
复盘,7343,2017-08-11,0.5
下午暴力拉升！收复河山！收盘上涨5％！赶快补,14348,2017-08-09,0.7682175315071028
很多唱空的sb拼命唱空目的是盼下跌想要买入！我,6935,2017-08-09,0.9814323690321198
明天河钢不涨停直播吃翔,11904,2017-08-09,0.8951748408830698
钢的了厂价在上调，业绩大增，钒价涨了那么多，,21511,2017-08-11,0.9962754563433116
河钢股份下周一是涨是跌？,11456,2017-08-11,0.9971081747543475
河钢以钢铁股还是雄安股涨,第一个板见分晓!,11344,2017-08-08,0.9718244129024886
谁在无情做空？,35386,2017-08-08,0.7329731637273806
河北省国资委的河钢股份，您看着办,24212,2017-08-07,0.9890682549041789
放心河钢不会涨的！什么钢铁涨价，钒铁，雄安概,20822,2017-08-08,0.9992557834922886
没有青藏高原让登高的人望而止步就没有珠峰的雄,9298,2017-08-07,0.6427578472562987
16:50   河钢集团出台8月中旬建筑钢材销售价格,18415,2017-08-11,0.00830235950884639
对于河钢多次提醒过.,98368,2017-07-25,0.9827116744651826
我为钢铁股正个名,7424,2017-08-11,0.028370475588584854
仙人指路！明天创新高！大白菜价！上半年盈利11,20307,2017-07-27,0.8228127277090185
这是我锁定河钢后每天都全天追踪走势后的分析 ,36418,2017-08-10,0.9769286490588136
减产的影响，总结就两个字：好事！,22912,2017-08-06,0.23136984998685262
今天5.75清仓了、心情不错。过来聊一聊后期走势,17089,2017-08-04,0.9660009897087951
机构大户请以国家利益为重不要砸盘！团结起来一,4847,2017-08-11,0.33505636880941814
钢价大幅上涨！4元多的000709河钢股份抢到赚到,4984,2017-08-11,0.6830784458504182
复盘,9099,2017-08-10,0.5
紧急公告：立即抢购7.25元历史最低位附近的金钼,5989,2017-04-27,0.9572144436642105
进展顺利，将提前完成,35368,2017-08-03,0.7400617364660835
比一比,24909,2017-08-05,0.5262327818078083
吓尿了！河北前进停产！纵横钢铁关门！钢厂疯涨,13198,2017-08-11,0.7048982909349683
谁打压河钢股份谁就是历史罪人！,7039,2017-08-10,0.9994927122745857
明天再不走强就全卖掉换买券商股600369了,4056,2017-08-03,0.0020199297315056652
河钢预测研讨,13417,2017-08-09,0.9980005371016472
河北省省长许勤：把钢铁煤炭去产能作为河北的标,16910,2017-08-09,0.6461373966002768
明天长阳大涨！扫货即刻开始！,7026,2017-08-09,0.6624253021677378
午评：强势周期股快到波段的头，面临波段调整，,3729,2017-08-08,0.7321212067931353
牛市来了？该干什么？抓牛股满仓持有，座等翻倍,4182,2017-08-04,0.03554587912171281
河钢股份 在整个钢铁板块走的最稳妥  其他的钢,23105,2017-08-07,0.9994545035611263
快买，主力给买进的机会可别错过了,5332,2017-08-07,0.9556502392937214
[图片],9541,2017-08-08,0.5826086956521737
希望它以雄安股涨!,2256,2017-08-09,0.681095257085788
明天涨停见：000709唐钢股份：中报暴涨钒大涨雄,15116,2017-08-08,0.9975850618212515
河北冬季限产方案公布 石家庄、唐山、邯郸钢铁,12110,2017-08-05,0.7103624198221183
关于河钢的钒概念，不看不知道，一看吓一跳,59405,2015-12-19,0.9661668689155098
超级资金已经停卖中户在卖！很好！明天后天加速,14087,2017-08-08,0.5591964036214918
雄安已经集体暴涨！河钢股份马上火箭发射！大资,16306,2017-08-08,0.999668360163715
空头陷阱！V型反转下午开始！超低白菜价格融资,8506,2017-08-08,0.7034916980738292
笑笑！,35155,2017-08-07,0.8333333333333333
大胆预测，河钢下周最少3个跌停,22893,2017-08-06,0.9929333947543764
明天大幅反弹！,8604,2017-08-08,0.06684129686339602
雄安投资启动，河北钢铁限产50%。邻居山东钢铁,3166,2017-08-08,0.9987194104721269
河北冬季限产，对河钢没有影响，7.8.9.10.11会,14108,2017-08-07,0.9971467998224666
河钢股份(000709)融资融券信息(08-03),14384,2017-08-04,0.9988396190344306
河钢股份洗盘结束，集雄安概念实质性利好，钒钢,12010,2017-08-08,0.9993026003033914
任你洗盘 底仓不到10元不卖！,11810,2017-08-07,0.0541520764040323
明天周二收盘5.96元！周三6.56元！周四7.22元！,17566,2017-08-07,0.057955155097502375
外交部：寸土必争,21744,2017-08-04,0.460961894195264
特大消息，雄安投资建设集团公司今日正式掛牌成,33662,2017-08-07,0.8529870928458311
珍惜手中筹码！V型反转马上开始！空头陷阱！000,23697,2017-08-07,0.9576026146733102
一个限产能就被空方利用乱解读~ 我来解读告诉你,31207,2017-08-05,0.9605070345721501
量,23187,2017-08-05,0.4374999999999999
2017-7-9公告,114544,2017-07-09,0.4737672181921908
河钢股份(000709)融资融券信息(08-04),20588,2017-08-07,0.9988396190344306
如果河钢明天不大跌，欢迎大家来开骂！,14364,2017-08-06,0.7975413371752275
明天大涨！ 《怎样摘除长期打压钢铁板块尤其是,7231,2017-08-07,0.24568609958508036
复盘,9615,2017-08-04,0.5
5.48一下跌到5.15，吓死了，赶紧割肉,7298,2017-08-07,0.0322586318934901
周五被骗卖光了，怎么办啊？完蛋了,4500,2017-08-07,0.034054608271210096
雄安+钒钛双料冠军不如没钒没安?,2677,2017-08-03,0.8600851825620155
河钢股份14点过后将暴力拉升！今天收盘创新高！,6114,2017-08-07,0.9994615306135833
5.21已买回了,3562,2017-08-07,0.31305946600384615
期货涨停，河钢涨停,6189,2017-08-07,0.991596192753776
小散的致命弱点：被套就拼命找利好！安慰自己，,8223,2017-08-05,0.5714754900028669
哥涨的是是钒!不仅仅是钢和雄安!看高10-12元!,33255,2017-07-28,0.9896039180767927
螺纹钢夜盘继续大涨3%. 热卷夜盘继续大涨2.83%,11528,2017-08-04,0.15528759949339355
河钢股份周一涨停！重大利好下周只发7只新股不,8885,2017-08-06,0.8590553929254803
黑色系期货开盘大涨 铁矿石、螺纹钢主力涨超6%,2097,2017-08-07,0.9362792483479263
河北冬季限产方案公布:石家庄唐山邯郸钢铁限产5,12334,2017-08-05,0.6279565475983929
屁股，屎味难闻！,14318,2017-06-17,0.09575198830211196
今日周一以5.55元开盘之后快速冲击5.84元！几率,9961,2017-08-07,0.6232361653505792
河钢，15年，把7.09元的高点以一个公告停牌关在,17603,2017-08-06,0.5640521830980754
原来是采暖季错峰生产，虚惊一场,11036,2017-08-06,0.9834457494894704
卖掉709后其它4个股今天全是红一遍!,3225,2017-08-04,0.04019903442713213
热卷、螺纹钢又创新高，河钢的热卷国内第一,18922,2017-08-04,0.9987306955792359
个人对河钢目前走势的看法！,17555,2017-08-06,0.9920498365769888
卖光了，期货都暴涨！河钢大骗子，操,24898,2017-08-04,0.8271872428171935
河钢深度分析，合理价值9.5-11元,31740,2017-08-04,0.9975917855948496
军工板块周一冲高回落！河钢股份今天走势复盘：,15341,2017-08-04,0.9888701267717316
