标题,帖子数,日期,情感
这哪是炒股，是在炒命呢,1471,2017-04-21,0.13264615193622398
转600307酒钢宏兴*一路一带边彊每次特钢龙头,963,2017-04-21,0.830212268919377
睡懒觉亏钱怪不怪晚上打炮 等你我等了那么久 跌,12297,2017-04-23,0.00736448295193648
三仟一百要破了，河钢会护盘大涨吗？我说不会吧,3360,2017-04-24,0.777692449842543
4,50开始抄底了,12075,2017-04-21,0.4109289617486338
今天设置买入线为4.5，卖出线为4.7,2559,2017-04-24,0.3726416152550046
深圳画圈讲春天故事，雄安西施效颦讲成冬天，好,10896,2017-04-21,0.997916810502333
4.5附近关注,9916,2017-04-21,0.7955253114026908
河北钢铁之我见。钢铁股在2007年见高下来后跌幅,24828,2017-04-21,0.3458498295493335
点评《券商恶炒伪雄安概念股上集体犯的几个大错,7066,2017-04-23,0.9449482914671196
再碰雄安，倾家荡产？,11398,2017-04-23,0.6309186710593138
人弃我取：漂亮红十字星，逐步建仓千年大计的国,12060,2017-04-19,0.9615366915136947
还要跌，不要买，谁买套死，老子套死了，可以套,3422,2017-04-21,0.21057044608863362
今天不发新帖了，对不住大家，四个交易日下跌了,34430,2017-04-19,0.07634418779641228
操你妈的，千年大计，套了30多个点了！！！,15712,2017-04-21,0.7265837389234181
抄底良机！拉升马上开始！下周一反弹开始！0007,15505,2017-04-21,0.11491971414878877
从河钢来证：天量见天价，对否？,15609,2017-04-15,0.7790944743748689
兄弟们，咱4.53,,抄底成功，请问收获多少可以出,12891,2017-04-21,0.3293418291102337
河钢股份(000709)融资融券信息(04-20),19240,2017-04-21,0.9988396190344306
河钢股份(000709)龙虎榜数据(04-20),57378,2017-04-20,0.998903096074308
跌太深无救了,3997,2017-04-20,0.2687848171262801
亏了24个点了，有没有人出点安家费的，我有个大,10084,2017-04-20,0.36298232913706163
又要跌停吗?,1277,2017-04-20,0.3893921383534412
河刚是不出什么事，怎么这个跌。,2042,2017-04-20,0.11126455666388058
不说了，——今天回到家,7451,2017-04-20,0.2568724946673674
继续涨，涨到你满意我满意大家都满意！,29499,2017-04-15,0.9809426728157612
充分理解雄安建设的意义，为什么最终龙头是它？,7214,2017-04-11,0.709541050131493
河钢股份(000709)融资融券信息(04-19),19176,2017-04-20,0.9988396190344306
河钢集团下调5月板材价格,56658,2017-04-18,0.09911165018818169
河钢股份:关于变更职工监事的公告,59718,2017-04-17,0.9785080587289938
金隅不跌，雄安第二波无望。等待金隅下调20%，,10568,2017-04-19,0.8231932162009413
有一种办法，叫着  傻子抄股。 这里能太多所以,9717,2017-04-11,0.016493194343436768
人民的名义，股民的权利,3512,2017-04-19,0.962748493549793
今天河钢股份主力流入7亿元？,15875,2017-04-19,0.9971904611820043
迟来的拉升迟来的爱,12132,2017-04-18,0.42718875924559974
河钢股份(000709)融资融券信息(04-18),16782,2017-04-19,0.9988396190344306
留了点,11558,2017-04-11,0.3769348583550194
河钢估份，低价雄安概念估，继续向上挺进！[牛],38380,2017-04-10,0.9993671625326818
785.3亿背后隐藏了什么,16694,2017-04-17,0.7056258559671754
比你妈次新股跌得还惨，操！！！,1137,2017-04-17,0.557509212209918
亏成沙壁了...有没有和我一样6块的成本的[心碎],12212,2017-04-18,0.30743556767998226
4月13日守住筹码等于胜利,24086,2017-04-14,0.5461030256867716
上午拉是诱多？？？,1946,2017-04-12,0.48180812036792997
雄安不行了[大笑],1481,2017-04-12,0.6442303910173557
河钢股份(000709)融资融券信息(04-17),15527,2017-04-18,0.9988396190344306
..水泥钢材是首要。还用找吗？。,2720,2017-04-07,0.20379369445462292
6.1就是今年的高点，刀口舔血，那些2.62都吓得,2480,2017-04-12,0.266447846639449
跌停买入啊,998,2017-04-12,0.3362481879986583
你上去，还是好样的,1051,2017-04-12,0.5
谁知道今天冰火两重天的真正原因？明天的走势如,1995,2017-04-12,0.8190290066751384
星期一还跌，只要是出货为主,2219,2017-04-14,0.5265929690083445
雄安概念股后市浅析,15676,2017-04-14,0.43139671503970034
今天绝对大跌迎接下周大部队回归。,1500,2017-04-14,0.8710672332872161
请问高手：6.2追人000709五万股，下周能否连续,12858,2017-04-16,0.04730422084744934
雄安如果趴下了，3301点就是此后中国股市的珠穆,13787,2017-04-12,0.9948911169570563
买了，听说已经涨了很多天了，接下来不会天天跌,6602,2017-04-18,0.2712070143251527
全部照套。,1502,2017-04-14,0.6552655265526551
本钢多年以前兼并天津钢厂，天津钢厂坐落在河北,2813,2017-04-11,0.4459921192693934
本大鳄继续复盘分析河钢股份，一个字：震！,24094,2017-04-17,0.9995863978925802
那个有经验的出来说两句此股4.8元能够止稳吗,6760,2017-04-17,0.29678827314287404
暴力洗盘结束，明天开始主升浪！恭喜今天加仓的,18504,2017-04-17,0.9416781650046382
国家监管严会持续，但炒作还会持续,6771,2017-04-17,0.2307210461785003
河钢股份(000709)融资融券信息(04-14),19091,2017-04-17,0.9988396190344306
建立雄安新区，钢材受益属第1层板块。,15647,2017-04-02,0.9779832755602925
河钢前十大股东占66%，实际流通股30亿，适合大,25392,2017-04-15,0.9729692280171754
河钢最后6分钟委挂买单6元钱成交了[哭][哭][哭],12448,2017-04-12,0.7029216098440716
王八日的，有人在操纵股价，小散是受害者！！！,12059,2017-04-17,0.8230090272977936
老股民我们都出聊聊天？现在有仓的（一五年以前,9057,2017-04-12,0.5155565532838691
五下五上、壹伍下跌时一跌就五个连板朋友都满仓,10668,2017-04-06,0.6173108149796979
河钢股份，4月17日，高开，收盘 涨停。目标 价 ,29765,2017-04-15,0.9954571091958322
追。追追。  买入    买入    买了河钢尤头股，,6172,2017-04-12,0.99540074307099
今天涨停能买上吗？主力你们都吃三天了叫我散吃,12166,2017-04-10,0.2415765474279301
雄安告急：被上市公司所在地的地霸合围！,13923,2017-04-06,0.7817319887996371
三路地霸，合围雄安！,22587,2017-04-07,0.6952122907081681
河钢是河北最大国企和我国最大的钢材制造和综合,14773,2017-04-16,0.9999662111004743
•••特大利多~,17215,2017-04-16,0.4737672181921908
河钢从各个角度看都是蛮优秀的～～360度无死角,15629,2017-04-16,0.9995080777148266
下周操作建议：第二梯队的雄安已经不行了，必须,13788,2017-04-15,0.1567592974241363
请转发此贴到任何股吧及财经信息中上证指数吧及,5660,2017-04-16,0.3135741360888412
南京汉北金隅，以及雄安十二大金刚复牌后最有可,14549,2017-04-15,0.9941533925576893
宣工发展100%股权委托河钢集团持有,15469,2017-04-15,0.42838950371340634
雄安概念龙头妖股全面剖析---河钢,23595,2017-04-15,0.9996228521207501
河钢股份操盘分析,35321,2017-04-12,0.9997420566561794
今天割肉的，注定周一哭！只此一句，用来纪念今,25609,2017-04-14,0.990474297784842
收盘了，总结！！,16680,2017-04-14,0.4443734357441702
下周河钢股份最少5个跌停板,16596,2017-04-14,0.9850306930844609
雄安新区的股票已经停牌了，复牌之后又是暴涨，,3027,2017-04-13,0.8765079314715143
4月13日河钢股份走势分析,36055,2017-04-13,0.993392748304789
4月14日分析；守住筹码等于胜利,12175,2017-04-14,0.8877162240852284
下午一开盘立马抢进300041。看空仓的谁手快！准,4612,2017-04-14,0.11594922498620364
妖榜谈个股：河钢分时图节节高说明什么？,15963,2017-04-13,0.7565533593958812
今天盘后，本大鳄再来跟各位朋友唠一下河钢股份,28037,2017-04-13,0.9407760385527528
提前给你们一颗定心丸,12829,2017-04-14,0.3377920072463071
谢谢各位朋友的优质筹码，主动买套河钢股份,11862,2017-04-14,0.999653242420565
河钢股份(000709)融资融券信息(04-13),16730,2017-04-14,0.9988396190344306
深康佳A，景兴纸业，渝三峡A，河钢股份,发图给,8420,2017-04-13,0.9988677310197969
都想听好话，但我一定要说句真心话。明天开盘最,11682,2017-04-13,0.5848612418773954
说服大家空仓真的有那么难吗？,8056,2017-04-14,0.7009773682582544
沉静的猎鹰 设置不让评论。呵呵 谁在心虚?骂人,7085,2017-04-12,0.06416187383565786
来吧，真的分析来了,13309,2017-04-13,0.8863556988821982
河钢股份散户很少，机构庄家静待利好，利润翻翻,43869,2017-04-03,0.9923522241919138
雄安概念必定要出一个妖股，请看我的分析,14443,2017-04-13,0.9927068982607051
今日走势分析和第二波预测（个人观点仅供参考）,15731,2017-04-13,0.9997364116766484
坚决涨停！谁参股了雄安本地金融企业？ 受中午,19967,2017-04-13,0.9795458416111011
河钢股份(000709)融资融券信息(04-12),27805,2017-04-13,0.9988396190344306
为什么说房企不是龙头，水泥钢铁才是最大的受益,16787,2017-04-06,0.014067572457931665
河钢股份4月12日思维点评,29465,2017-04-12,0.963532996571519
河北人民政府公开信息,15368,2017-04-13,0.8887681269197983
付出也不一定有回报的地方,1324,2017-04-13,0.8303346007606767
什么情况啊,1966,2017-04-13,0.3935742971887549
难道真是冥冥之中自有安排？,2458,2017-04-13,0.39345431824839294
控制节凑其实是一直都在努力平衡的任务！,1473,2017-04-13,0.7455748165360265
坚决贯彻慢，慢，慢,1605,2017-04-13,0.32471801904276143
可以视为一个转折点,2005,2017-04-13,0.5979118144517975
不是不让涨，是不能疯涨！,1563,2017-04-13,0.295117248540113
长驱直入！再度八个板！,2014,2017-04-13,0.7066507593826183
本大鳄给大家来压压惊，河钢股份注定不走寻常路,40171,2017-04-12,0.9998547174068237
这么有想象力？,869,2017-04-13,0.5121951219512196
或者说见怪不怪！,985,2017-04-13,0.12103093060305137
顺理成章！,1581,2017-04-13,0.5
我来说说昨天那十几支雄安股为啥停牌！再给你一,19576,2017-04-13,0.09695886813825871
付出必有回报,1396,2017-04-13,0.9609166860199924
6.04全仓买入。 今天还是涨停板。 正宗雄安概念,10168,2017-04-12,0.9891982138032434
雄安特停，相当于新股停发，是利好！,21748,2017-04-12,0.38219036048581945
不听鸡汤言，吃亏在眼前,7527,2017-04-12,0.9257613394218142
河钢股份机构专用席位净卖出16.4亿 疑似证金清,33269,2017-04-11,0.9905657037011943
我是昨天给你那颗安心丸的贴主，来看我给你分析,23130,2017-04-12,0.9323324563324514
今天最新消息：重磅！河北要成立10个省级“特区,18030,2017-04-12,0.6576718215781309
我记得张家港行停牌后，江阴银行等继续上冲了一,7652,2017-04-13,0.13310355216164693
看来河钢股份今天要跌停，快跑！,5945,2017-04-13,0.9964560732861548
河钢股份--明天会成为定海神钢吗？,21046,2017-04-12,0.9974848639318759
【讨论】午后涨停被砸落，河钢股份后市会怎么走,100397,2017-04-12,0.9997767451739905
庞大真牛板了,5545,2017-04-13,0.6468639541375649
河钢 荣盛 扛大旗，带领雄安开启上涨第二波！,5348,2017-04-13,0.9823187046363552
获利的短线盘，明天必须迅速出逃！,34423,2017-04-12,0.44072717389462446
河钢股份(000709)融资融券信息(04-11),18671,2017-04-12,0.9988396190344306
河钢股份:股票交易异常波动公告(2017/4/12),119135,2017-04-11,0.9995357261350524
全线特停，河钢这个十字星收的漂亮，国家队清场,19252,2017-04-12,0.965939385542058
我是昨天给你那颗安心丸的贴主，再来分析分下河,20196,2017-04-12,0.9727045071874985
我来给还持有着股票者一粒安心丸！,17977,2017-04-11,0.44418011048956263
我就是游资 2017.04.11 热股点评,24861,2017-04-11,0.06343639327074924
今日走势及是否有第二波（个人观点，仅供参考）,8970,2017-04-12,0.9862512312006726
牛逼呀,1813,2017-04-12,0.6923786120385603
青龙管业都打开了，跌停的越来越多,9108,2017-04-12,0.08777270378481972
够激烈吧？说过今天会大开大合的～～！有些人非,8585,2017-04-12,0.0565049247722712
下午一开盘就封住了，看谁手快！,13651,2017-04-12,0.3267504757616937
是股市是不是到大顶了？,2386,2017-04-12,0.90985724930633
明天继续涨停！下午涨停板洗盘结束拉升马上开始,11570,2017-04-12,0.717215176467927
【龙虎榜】尾盘开板两知名游资买入，一机构狂卖,42751,2017-04-11,0.5325159866723974
河北股明天开始暴跌,5216,2017-04-11,0.7437174689811566
上午洗盘，下午继续涨停！撑死胆大的！,10218,2017-04-12,0.8523647146201172
握草，国家队动手出货了。也好，把国家队一次性,10958,2017-04-11,0.6375884314487343
赶紧封板，拉雄安一把！！,2326,2017-04-12,0.2472105757489681
河钢股份(000709)龙虎榜数据(04-11),119017,2017-04-11,0.998903096074308
分析帖,4757,2017-04-12,0.5
河钢股份短期利好或有限 新区概念还能火多久,49059,2017-04-08,0.9994356737917309
谁出去了？说？,14646,2017-04-11,0.39041446358519516
4月6日河北省人民政府网站发布；河钢集团境外发,11214,2017-04-09,0.004634568152454999
明日走势预测（个人观点仅供参考）,18260,2017-04-11,0.9842184451940731
雄安板块尾市大单砸盘意欲何为,94964,2017-04-11,0.08361548522215945
明天必须是一字板。,23121,2017-04-10,0.2845935741427815
终于把证金洗出来了 天津港第一个板证金就被洗,5678,2017-04-11,0.06471800108730141
终于走了，早走早好,2607,2017-04-11,0.7890045224083777
如果说明天涨停，那证金为什么出呢？多赚个板不,8710,2017-04-11,0.06494432641578363
公募基金私募基金抱团取暖,2245,2017-04-11,0.9997656492200323
唉，昨天前天，一片唱多，今天，一片唱空，真是,5052,2017-04-11,0.9735602858574145
【讨论】雄安强势股疑似证金砸盘 2股尾盘开板抢,66563,2017-04-11,0.31863735556968276
河钢股份(000709)龙虎榜数据(04-10),70338,2017-04-10,0.998903096074308
国家队4.2左右的本获利出局，你怎么看,9787,2017-04-11,0.18958992633986327
河钢股份尾盘被砸 机构卖出逾16亿元,15161,2017-04-11,0.18119398662313613
又有多少人被甩出去？举手,6637,2017-04-11,0.5891625178571712
河钢股份目标价两倍市净率8-8.5元,14991,2017-04-10,0.9988133622487846
河钢明天继续开一字涨停板，不信走着瞧吧。,9107,2017-04-11,0.9498448388082297
买不到撤单买其它股,1568,2017-04-05,0.02022152776632624
明天开盘一字板！后天依然会强烈震荡～～～,12411,2017-04-10,0.05313899366717101
河钢股份:关于国家设立河北雄安新区对公司影响,148169,2017-04-04,0.9997822423209379
河钢股份:股票交易异常波动公告(2017/4/10),70834,2017-04-09,0.9995357261350524
咱村的事咱做主,4481,2017-04-09,0.48851513179874884
赚了3000万，今天卖出了，剩下给你们,5950,2017-04-07,0.22726499971302538
很快就到会3块钱了,2354,2017-03-21,0.4350302125381026
河钢股份(000709)融资融券信息(04-07),10465,2017-04-10,0.9988396190344306
请举手，谁被甩出去了～～,16002,2017-04-10,0.18805747778453163
没有最低，只有'更低,4945,2017-03-21,0.026839336325751972
补仓,1908,2017-03-21,0.3485697598175398
表明市场信心有所恢复。盘面上，雄安概念成为最,3688,2017-04-10,0.9875785393210852
沪指更是突破3283点创出新高，一度逼近3300点，,1384,2017-04-10,0.988888947325557
两市在雄安新区概念股的带动下连续三连阳，,1062,2017-04-10,0.5582777558971675
河钢股份(000709)龙虎榜数据(04-07),53715,2017-04-07,0.998903096074308
雄安八大金刚正正式出炉，下周开启翻倍浪！,187948,2017-04-09,0.9890763787083203
尾盘3分钟就成交了26万手，说明恐慌已经在蔓延,8941,2017-04-08,0.020644835588217947
注意了！这些雄安概念已经澄清,161698,2017-04-09,0.958520113762893
河钢股份下周一要开板大跌了！不排除大跌5个点,6306,2017-04-08,0.7285797974143489
机构为骗筹故意暴露，后面至少还有5个板，千年,15185,2017-04-07,0.06966389625329517
周一可能就得开板，最理想也只能维持到周二。但,12161,2017-04-08,0.24381472764078538
好奇怪，为啥河钢不出公告呢？3天涨幅超过20%了,17853,2017-04-07,0.2639503829713
好戏在2018,57097,2017-02-22,0.8338982947724591
钢铁股本来就要涨，一季报都好得不敢直视。雄安,8486,2017-04-07,0.5171033134043226
周三开盘，河钢涨停无悬念？,30367,2017-04-01,0.9856382077640378
河钢股份下周几打开，来个专家预测下,16072,2017-04-07,0.9993451822942646
大家千万别着急，正常还有4-5个板。大家团结抛,7184,2017-04-07,0.046690205321816336
发个图,6554,2017-04-07,0.5948433373448726
【讨论】雄安概念股再掀涨停潮 哪些股还能上车,165609,2017-04-06,0.7980961801045026
还亏1W多、能涨到7、8块吧！,9339,2017-04-06,0.3696116800656707
坚决肃清腐败分子对河北钢铁的影响,51835,2017-02-14,0.9964443218637886
今天洗出最后一批不忠者，明后天开始无量涨停！,16562,2017-04-05,0.02936408810984026
建仓3成，逐渐满仓！目前成本价3.70,13842,2017-03-29,0.016048677423649238
紧急通知,12625,2017-03-27,0.17736717170627514
河北钢铁最受益，新建一个深圳特区！下周准备买,25222,2017-04-01,0.9086112354057092
精神鸦片,17368,2017-03-21,0.90242506244081
我想回来了，可以吗,4946,2017-03-29,0.48126690417635565
买入还需等待,14629,2017-02-23,0.6936285820113127
真惨！,10094,2017-03-16,0.670469695610341
一直让大家在河钢调整期先暂时换300432，但就是,14991,2017-03-13,0.9347298141337715
300432，信鸡汤，得永生！明天开始一波大行情,13660,2017-03-09,0.6530867151986048
强烈建议大家关注300432，大家一起发财！现在是,13733,2017-03-07,0.646809732321567
是福是祸？3.72再次不要命买了。,8032,2017-03-08,0.7658882768122449
话说“鸡汤”,7886,2017-03-08,0.35142723561599265
让我闭嘴的后果就是这个，哈哈,6363,2017-03-07,0.5646236314392167
未来钢价将不会再出现重大低谷期,10170,2017-03-06,0.9459390750222657
那些小丑，股票一涨，欣欣然，觉得与信息流、技,10508,2017-02-27,0.9527496866484836
哈哈哈哈哈哈哈,12376,2017-02-28,0.9751349273004098
大周期四线开花，涨幅必有50%以上，今日调整到,18971,2017-03-01,0.7099702289470069
我已经换到了山东钢铁和南方航空了，河钢已经年,2627,2017-02-13,0.9953926125063688
基因太差,2032,2017-02-13,0.08860891438580754
旅游回来，下一周会一直唱多，让作T的永无上车,22187,2017-02-18,0.9858853142677086
重要通知,40355,2017-01-10,0.2770270270270271
兄弟姐妹，4.15结清了，我还是会回来的～～～祝,13539,2017-02-23,0.5797973630729544
2017年12月底前河钢股份必上10元立此贴为证,22832,2017-01-17,0.9898004033974546
朋友们认真看看这是河钢月线图。二十月线过去二,12717,2017-02-21,0.8933418404351252
哈哈哈哈哈，唱空狗出来呀,11996,2017-02-20,0.9697705973156473
说实话山东钢比河钢基本面目前好多了！虽然二股,8255,2017-02-19,0.9996918868970779
债务重组破冰 河钢通钢考虑债转股,22031,2017-02-17,0.9994117550785394
供给侧改革再升级，长材占比高的龙头钢企将充分,30466,2017-01-13,0.9349738247822359
进场信号？中期底？,25977,2016-08-15,0.7323685734859412
意想不到，闭门思过一周。祝好,14419,2017-02-15,0.9832352993719772
又给你进仓的机会，看你的胆子是否够大？今天直,12239,2017-02-15,0.35097417529390706
河钢下周的行情,15188,2017-02-10,0.9982223047085996
钢铁板块启动了，就你不涨停[不屑][不赞],8984,2017-02-11,0.5195148020736248
头条：委任状,10251,2017-02-10,0.49140331320987984
有点失望，不及预期！下周见,13697,2017-02-10,0.049707911880735645
目标10元,10899,2017-02-11,0.5174353916745623
有人想让我闭嘴，不给我唱多，我知道，你们就是,5623,2017-02-07,0.796319401252641
我一直近乎哗众取宠得唱多，仅仅是想引起你的注,6569,2017-02-07,0.4116400423345119
不是总有俗人吵着要看交割单吗？认真看～～～～,8235,2017-02-07,0.2394013860779436
3.11下长线投资,105510,2015-12-08,0.832847679718691
誓言,21962,2016-01-13,0.5
不好意思：今天吃了回头草。,10451,2017-02-03,0.7266504797171643
加仓100手。静等下午泛红,5412,2017-02-06,0.47346253223333645
玉人王祝朋友们！新春快乐，步步高升，股票翻倍,9187,2017-01-27,0.9950163614244485
河钢股份  给你带来希望了吗,29423,2017-01-19,0.9963998050278929
河钢股份:2016年度业绩预告,99846,2017-01-19,0.9983756804801797
明天高开，收长阳！不给上车机会,9310,2017-01-11,0.12623739939135115
河钢集团首次与中国中车直接合作,37718,2017-01-11,0.2372210008800606
每日一股：河钢股份（000709）,10932,2017-01-10,0.9982055735939445
河钢股份 今日操作,7279,2017-01-12,0.999165509367735
15号上午买入明细。,6327,2016-12-15,0.7649022521721909
14号买入明细。,8261,2016-12-14,0.6940389943633449
河钢股份:关于与河钢融资租赁公司开展融资租赁,52248,2016-12-29,0.9999973821056227
河钢股份:关于计提资产减值准备的公告,36570,2016-12-29,0.9982744197969915
如果收盘能吞掉3.34，我让你们插,20284,2016-12-27,0.10444560223289157
河北钢铁违规未批先建多人被处分 陷去产能增产,31387,2016-11-19,0.7248709234508736
卖你妈呀,1466,2016-02-03,0.3653621726456959
增持公告2,83414,2016-05-12,0.28583115968042905
向小河致敬。,6509,2016-12-23,0.9805510976692554
哪个装B爱晒单子的粤傻呢？最近怎么不装逼了？,6519,2016-12-20,0.40516172689786667
15号买入明细。,18402,2016-12-15,0.6760474978938548
龙回头,9439,2016-12-09,0.8613648797184118
卖了的都喊跌，买了的都喊涨！,5620,2016-12-18,0.5980234581089713
河钢股份:2016年第五次临时股东大会决议公告,37162,2016-11-16,0.9913323274331062
垃圾,2464,2016-12-20,0.12698412698412687
河北钢铁代言人？,9998,2016-12-01,0.879443356633473
河钢舞钢助力大飞机项目,7937,2015-11-13,0.9892928394272421
河北钢铁:唐山钢铁集团高强汽车板有限公司审计,37350,2015-08-23,0.9162697422800523
9号买入明细。,21532,2016-12-09,0.6214249271498161
今天证券公司限制融资买入河钢，河钢融资担保为,15747,2016-12-12,0.9999947642249521
科学家证明：赚钱的是傻子！,29408,2016-02-22,0.6476264755406258
29号融资买入明细。,22094,2016-11-29,0.9180174022981795
9号上午买入明细。,8277,2016-12-09,0.7190352081395638
河钢股份(000709)融资融券信息(12-08),6096,2016-12-09,0.9988396190344306
河北钢铁：钒电池电解液检测方法达国际先进水平,19214,2016-02-26,0.8108055712385399
河北钢铁--钒钛总龙头一一>数据说话,43668,2015-12-19,0.7662971498966442
妈的，这个货每次都挂这么多，,8168,2016-12-05,0.2659787126713644
钉子户,15196,2016-10-24,0.5
钢铁行业的利好消息。,10923,2016-11-30,0.7401148538479813
到600307看看好于这票几倍哦。,4613,2016-12-02,0.36687652107093605
废钞？,7397,2016-11-25,0.5
28号融资买入明细。,12363,2016-11-28,0.9347452574751838
河庄是垂死挣扎的蠢猪。,6218,2016-12-01,0.9461541093756595
钢协：2016年10月中国钢铁工业生产情况分析,5798,2016-12-01,0.9811354698020845
大盘出现高胜算见底形态 河北钢铁 后期将出现蝴,3771,2015-08-30,0.9951430322359825
河钢上10元的依据就是有3000万吨钢铁产能。,7037,2016-11-29,0.9923876640721279
河钢是未开掘的宝藏。,19244,2016-11-26,0.9989873744499591
河北老钢，小阶段涨到顶，短线割出,4124,2016-11-28,0.9993415070005842
坚决买入,7387,2016-11-25,0.7499999999999999
京东方世界级显示屏技术龙头企业只值2元？,74204,2016-05-22,0.04839145322809235
2014.11.11,13493,2016-11-11,0.5
0709还想看涨？本来均线向上,21803,2016-01-31,0.396504669887921
河钢钉子户,19541,2016-11-19,0.9857754780370559
河钢首钢没有重组的原因,18261,2016-11-09,0.977758083797584
嘎嘎水中鸭，3600点跌到如今恐怕内裤都输完了，,8294,2016-02-23,0.2966015907119247
河钢股份:关于董事被调查的公告,42039,2016-09-29,0.9823409270999097
河钢股份:关于召开2016年第五次临时股东大会的,53208,2016-11-11,0.9929629523961582
河钢大涨，日了狗了，3.19卖了马上又3.23买回来,7597,2016-11-14,0.9474885003152326
割了！,5245,2016-11-11,0.375
谁还在，签到。,11260,2016-11-06,0.2673564104476307
鸡蛋，不要放在一个篮子,23200,2016-09-24,0.2803614211703873
有老股友来聊聊天,33480,2016-08-12,0.29528972241821927
000709：大力买进；连续涨停+$,9231,2016-11-07,0.7295727775206396
仔猪已经买入圈,29511,2016-02-21,0.4737672181921908
河北钢铁——不要恐慌，下周稳収三个扳,14223,2016-01-07,0.8565801908668097
河钢真是阳痿，指数涨就他不涨！,3261,2016-08-15,0.9910231264678712
河钢集团提前2个月超额完成全年钢铁产能压减目,21776,2016-11-02,0.011175911491018597
河钢股份:关于2016年第三季度报告的更正公告,26955,2016-11-01,0.9899930633542545
本人7元买入28000股20万元 当时想赚到250000元,18220,2016-06-06,0.027883919713119765
