标题,帖子数,日期,情感
那个啥，我说后面大涨，楼主屏蔽了，嘿嘿，你懂,37176,2017-07-19,0.5908938020800305
如果您已错过腾讯，就不要再错过科大讯飞！,258612,2017-07-05,0.864401757101185
360手机vizza发布 将搭载科大讯飞语音识别 2017,7351,2017-09-02,0.7448232109959727
长远的不说，先给自己定个小目标：锁仓一年，不,103380,2017-08-18,0.15113641899063168
就目前的行情来看科大讯飞,20799,2017-09-01,0.8692855461455138
科大讯飞到底是乐视还是亚马逊？管理费营业费占,82072,2017-09-02,0.4207796303805531
解读讯飞中报：我看到了晨曦之光，伟大的未来！,49346,2017-08-09,0.8361058527306858
今天跳水原因已经查明！,48403,2017-07-11,0.3881304553445424
反面老罗的正效应,13513,2017-09-01,0.8302244262469204
依然坚持讯飞短期震荡整理，长期向好的判断。,13402,2017-09-02,0.8654595932990361
组团忽悠木有用,43058,2017-08-11,0.18497157775789286
心理阴暗的薛叫兽，诋毁科大讯飞就是误国害民！,5213,2017-09-02,0.9451491376953142
隆重公布九月初帝国讯飞仓位！,13607,2017-09-02,0.7784201319889289
《科大讯飞到底是乐视还是亚马逊？》摘评,5804,2017-09-02,0.3989675515321085
科大讯飞被炮轰风险巨大 周五开盘下跌,84762,2017-09-01,0.6555996615268647
科大讯飞莫非要弥补阿里、腾讯、百度带来的遗憾,132681,2017-08-16,0.14492222642669095
注意那高烧渐退的投机融资盘,129810,2017-04-22,0.8885142400362904
奶奶的主力一周出逃资金20个亿，散户投资者千万,8704,2017-08-31,0.9863038049554168
融资盘在罕见大对决,126374,2017-07-12,0.6027548425099842
科大讯飞2017中报解读,26477,2017-08-09,0.8582881137872326
一碗53元馊臭滴心灵鸡汤,106166,2017-05-23,0.02267132657819415
“48元果断低吸”撸凡达过街,59205,2017-07-06,0.15971409704972572
科大讯飞最核心的资产到底是什么,35938,2017-08-30,0.9725866681430059
科大讯飞,21035,2017-08-20,0.5517946718912456
看好，但希望继续探底，最好20元以下,171272,2017-01-18,0.28573431762457224
能不能把阿凡达的号封了，全是他的头像，看到就,88373,2016-09-12,0.030793447509355754
看来叫空做多的，套的不浅了，来个股权激励价13,19772,2017-01-18,0.8592221735986433
锁定了2元价差，成本又降低了，等待,82812,2017-02-06,0.10310372577790061
不要感到意外的是什么,14644,2017-06-27,0.9445642534888683
黔撸技已穷,71248,2017-06-03,0.44767845850986676
撸子的冬天,198307,2016-12-01,0.4546280053948576
外星呆瓜滴专注,49020,2017-06-29,0.8028718317826261
请分析，美股特斯拉于八月2日公布财报: 每股亏,8802,2017-08-09,0.46132757947395975
目前滴科大讯飞你玩不起,499774,2017-06-23,0.42492980600159047
进入只等002230成为世界级伟大公司，到时你也伟,214171,2017-07-17,0.3193952066614284
给每一个做空讯飞者的忠告！,32377,2017-09-01,0.18830920072379753
智能交互，优质价值个股：科大讯飞，建议波段，,4542,2017-07-19,0.20398014834349099
《千元讯飞笑春风》……,7509,2017-09-01,0.5754365305251516
科大讯飞滴上补缺口已完成,56980,2017-08-08,0.5013669985758956
闲人一指曰鸟毛,39210,2017-08-17,0.11363960021821784
你是相信美国麻省理工学院，还是长江商学院？,7710,2017-09-02,0.973656554653528
科大讯飞市值蒸发 50 亿，根正苗红的出身终究还,27651,2017-08-31,0.820596866675874
主力割韭菜割到手软一一一一一一一一一一一一一,8117,2017-08-30,0.902542726374522
参加首届投资者接待日活动简要感受。,33233,2017-08-11,0.9984350272169583
讯飞的庄家思维正在失灵，为什么,18607,2017-08-17,0.2916720233597895
我为讯飞盖楼至千亿市值,128373,2017-06-21,0.27369554736369783
科大讯飞看趋势应该是机构获利出局，前期的低吸,14307,2017-08-28,0.8015153691349715
科大讯飞语音机器人代替键盘记录法庭审判活动的,14473,2017-09-01,0.9655920225324905
科大讯飞到底值多少钱,58791,2017-08-24,0.32801094229250716
极具BAT潜质！值得长线投资！ 查查国内A股所有,13514,2017-08-10,0.7441082742657775
[兴奋]A股正在发生革命性的变化，去高市盈率正,10631,2017-06-05,0.9163831244508344
关键的是: 智慧教育，智慧医院，智慧政法三驾马,27337,2017-08-30,0.9977630368867624
讯飞是好公司，将来也可能成为象苹果一样的伟大,5075,2017-09-02,0.8868507135770012
广州中学今日揭牌成立，广泛使用科大讯飞的智慧,36291,2017-08-25,0.9919627399625862
薛云奎说的是财务，科大讯飞回答的未来,7558,2017-09-01,0.9519499259241311
今晚的。新闻联播当中当然指的是科大讯飞了，智,17932,2017-08-29,0.8888400060887208
壮观！气势磅礴！ 资本，巨浪滔天！ 我国资本的,36565,2017-08-14,0.9999917955255742
散户必看炒股格言和现金策略！     孙子云：先,49829,2017-03-21,0.08037291965991733
坚定持有的朋友，勿忘初心送给你们。,12033,2017-08-17,0.4043264177343996
我买的是人工智能的未来，不是现在的科大讯飞,8859,2017-09-01,0.7607558103730063
五问AⅠ国家战略,16275,2017-08-23,0.9645198339607424
中国第一世界第六聪明公司科大讯飞2000亿市值高,197219,2017-07-15,0.991891646064379
大家要理解刘庆峰董事长的战略思想。她要的不是,5667,2017-09-02,0.9997111692115052
撒狗粮,10791,2017-09-01,0.266510116144658
什么情况,9410,2017-08-03,0.3935742971887549
~~三浪三主升浪的龙头是军工，航天电子是领头,3346,2017-08-23,0.597809454038644
从今天起开始关注科大迅飞。现在（2017/06/29  ,104824,2017-06-29,0.8734108311585974
科大讯飞yy滴集中营,79991,2017-05-02,0.8056888780496834
昨日加仓的科大讯飞今日做了结，底仓仍在，继续,77862,2017-07-04,0.742234226887185
号外 人工智能催生“智慧医院” 科大讯飞将与江,19448,2017-08-24,0.875783988325615
二憨 别专注滴坑爹啦,87731,2017-06-07,0.5369101536072517
我要为亚马逊正名，也要为财报分析正名        ,14944,2017-09-01,0.9983691453291825
一些猜想,19066,2017-08-30,0.9375
两枚天量阴线滴科大讯飞还有得玩吗？,112372,2017-07-11,0.46087488865930326
并非不可能，国际视野下的科大讯飞,77869,2017-06-22,0.7259568265354709
哪天，讯飞每股收益达到近15元，股价又到多少呢,28797,2017-08-31,0.7615637647976335
建议追究华夏时报的责任，媒体不是法外之地,13673,2016-03-29,0.06381781589855517
薛教授的水平也不过如此,22057,2017-08-29,0.9551981530879006
一路好走 敬资本市场滴良心人,130241,2016-10-03,0.9983431410120575
不要低估砖家的水平，投资者应自重。,14886,2017-09-01,0.9714185221205685
人工智能将是一个伟大历史进程 —— 刘庆峰董事,62944,2017-08-06,0.9676050984791957
~~保护盈利头寸 该换股操作了,5984,2017-07-13,0.08363055190010582
大家来围观：我和大帝对赌，我赌本周周线是阴线,15986,2017-08-31,0.9943423011396563
写在科大股价即将挑战历史高位的话,41350,2017-08-16,0.9992177753854924
科大讯飞8月28日盘中跌幅达5%,29788,2017-08-28,0.037431861992251014
科大讯飞800亿市值遭质疑 半年报营收与净利剪刀,22202,2017-09-01,0.5078268363020468
下周多种攻击方式,22893,2017-08-25,0.9503854401249372
科大讯飞 ，突破50，就会一发不可收拾。,60797,2017-08-02,0.5040306081006075
科大，已经很明显了这两天已经在了49块区间游走,40835,2017-08-09,0.8506396577803812
没有看1000的信心,15272,2017-08-31,0.853566627706439
科大讯飞——可预期的世界级巨头,49442,2017-08-15,0.8552106984511326
科大讯飞惊人走势！,27164,2017-08-29,0.2349109779216929
重中之重的是，他是整个a股中的唯一一个！无限,27832,2017-06-28,0.9614766823771037
万古江山谁是主？登台讯飞才是主！ 今年绝对是,32165,2017-08-20,0.4000168895714399
秋天里的童话,111594,2016-09-01,0.9721394430678731
周五大涨，周线收红,23104,2017-08-31,0.3311985736848392
探索，科大暴跌的原因在那？,15588,2017-08-29,0.9752507962909633
还有逼散腆着脸喊融券的,17277,2017-08-30,0.17121453313403334
应流研发的航空发动机等都是填补国内空白的高科,4163,2017-08-30,0.7865732201592532
~~主力已经换股操作了,3160,2017-08-27,0.08932732537120425
科大讯飞(002230)龙虎榜数据(08-28),265468,2017-08-28,0.8435677484304678
滴滴估值500亿美元！科大讯飞。现在市值才100亿,168474,2017-08-02,0.28768579390684657
讯飞开放平台。 现在日服务量40亿人次。 合作伙,134652,2017-08-04,0.2589855020575532
减持一半，留一半清醒留一半醉！,11705,2017-07-05,0.9294961287136742
他山之石可攻玉，获诺奖时方知好！,5965,2017-09-01,0.7962788825539586
64.732抢进去2000股，不管了，进去再说,53925,2017-08-28,0.048124192256942866
一场关于估值的尴尬,21780,2017-08-31,0.5062303969422406
不忘初心~方得始终！多简单的理~记住,7205,2017-08-31,0.10571184318125448
错过了锂矿、钴矿翻倍机会，一定要抓住钛矿翻倍,4161,2017-08-30,0.1831406935243859
《纽约时报》在题为《China Gains on the U.S i,8327,2017-08-31,0.7923707317731278
获利盘争相涌出，一百多亿的成交量，吓坏了短线,68080,2017-08-28,0.7934574323412791
打擂贴,54502,2017-07-24,0.5
胡郁：科大讯飞将在脑和空气动力学进行更多储备,8528,2017-08-31,0.8774650973246189
我感觉科大讯飞就是未来的腾讯控股，就是茅台酒,5034,2017-08-31,0.7123388422174913
一句话终生受用,12064,2017-08-28,0.9915518345408073
短期均线别扭缠绕，洗洗,15932,2017-08-28,0.24357545505219003
每人都留10手讯飞永久珍藏。,23984,2017-08-27,0.969093868805456
5%仓位跪求崩盘,28940,2017-08-28,0.421874597530976
一看都是没入门的满仓狗,12276,2017-08-29,0.3280461558773311
科大讯飞面临的真正危机挑战与机遇,19834,2017-08-30,0.9996712842953929
短线巨震不改长期向好趋势,29037,2017-08-29,0.17837447303157694
历史总是惊人的相似！目前看来大盘在复制1999年,34090,2017-07-01,0.9893514555931372
积极抓住资本市场供给侧改革的历史性机遇！在底,24928,2017-07-01,0.9993050104352976
索罗斯有一句名言：“经济史是一部基于假象和谎,12558,2017-08-14,0.9587935807779091
预计明天还会跌2%收盘，周五起稳！下周一起飞！,14713,2017-08-29,0.06110906918916359
金钱永不眠,24596,2017-08-28,0.8097170892370886
中国股市的悲哀：实质性的利好视而不见！科大讯,41161,2017-08-29,0.24605159297946866
科大讯飞(002230)高管相关人员持股变动信息(1-2,44721,2016-01-25,0.22649311422827856
科大讯飞(002230)高管持股变动信息(6-6),88719,2016-06-07,0.2016835743558162
科大讯飞回应薛云奎的质疑：按这逻辑就没亚马逊,97559,2017-08-30,0.9118613414932868
你知道去年半年报更正闹剧吗？,19651,2017-08-13,0.9231174362460891
科大讯飞(002230)融资融券信息(08-30),15716,2017-08-31,0.8359910458932623
薛教授就是一叫兽，鼠目寸光乱喷科大讯飞，有几,6378,2017-08-30,0.6585519445149979
先有淮海路狂抛4个亿，再有薛教授炮轰巨大风险,6349,2017-08-30,0.8823041794521489
韭菜们别闹了  对于一家极有未来的公司来说 怎,23711,2017-08-09,0.8578887715524194
阿联酋阿布达比投资局会举牌科大迅飞吗？,35158,2017-08-26,0.3623770217018627
国务院：中小学应设置人工智能课程，推广编程教,21900,2017-08-27,0.9649582936161425
长江商学院终身教授：科大讯飞风险巨大,97864,2017-08-30,0.9956725129970786
六十四完美追入，今夜无眠,15750,2017-08-28,0.901859074597023
建议科大讯飞A股私有化。 去美国上市。 价值严,38518,2017-08-09,0.3885816783302838
深度分析：量能不大涨上3300是否牢靠？下周策略,6336,2017-08-25,0.9845931258888558
美股特斯拉每股亏损4.6美元，但昨曰收盘股价高,8082,2017-08-30,0.07038983036785096
【联讯计算机公司点评】科大讯飞：加强技术精进,138349,2017-05-15,0.6718338615019501
蛰伏已去，成长将至,78271,2017-04-19,0.9483453827762077
[大笑]阿里腾讯市值突破4400亿美金，科大讯飞还,27193,2017-08-22,0.9878701515406907
粤港澳大湾区将“梅开二度”,35265,2017-06-19,0.6381990585718805
科大讯飞中报分析,24160,2017-08-09,0.6927652260687331
如何客观评估讯飞公司,100838,2016-10-18,0.05346394787971176
对长江商学院薛某人的无情驳斥！,14954,2017-08-29,0.9960744639042041
科大讯飞(002230)融资融券信息(08-29),16514,2017-08-30,0.8359910458932623
与科大讯飞相比，智飞生物差在哪里？,12792,2017-08-18,0.39644399598969793
主力参与48%，完全控盘，20日本54.71元,8198,2017-08-29,0.7765197140206707
人工智能的里程碑：科大讯飞的机器人通过了医师,20047,2017-08-28,0.9363540131934853
我艹哥这下找到十三万股可融券的券源了明儿砸不,9620,2017-08-29,0.023121121823603263
长江商学院薛文奎在财经媒体黑科大讯飞。,15709,2017-08-29,0.9942709458279646
科大讯飞(002230)融资融券信息(08-28),22039,2017-08-29,0.8359910458932623
【干货合集】科大讯飞周一闪崩后会怎么走？,83712,2017-08-29,0.3380432161266783
价值数万亿美元的七个颠覆性技术    WElabs未来,40482,2017-08-25,0.9926346896998177
未来十年的风口,35726,2017-08-13,0.5898189256996038
周线调整开始,18785,2017-08-29,0.4267628168325339
长江商学院薛云奎:人工智能第一股科大讯飞风险,9857,2017-08-29,0.9936378219475667
白痴的增长 讯飞昨中报的各项指标中，唯一不符,216234,2015-08-12,0.9926087950680488
如何将成长投资进行到底,13566,2017-06-27,0.9920110394996587
低调的讯飞正得到国际认可，但希望,20119,2017-06-27,0.9440529098434398
只有少数机构是这样的，多数是那样的。,30152,2017-07-03,0.40306518103660505
重要更正：讯飞股价可能永远涨不到48元或53元了,52194,2016-08-24,0.5642619638512809
7月投资主题：从价值蓝筹走向成长蓝筹,30080,2017-07-04,0.9999866592231128
8.28-8.30洗盘,19988,2017-08-19,0.7297953905324696
~~同济科技燃料电池研究有重大突破,5040,2017-07-20,0.99304899423263
福利不停送,16759,2017-08-27,0.6862563084963899
解套了两只一一一一一一一一一一一一一一一一一,2375,2017-08-29,0.9160385998235512
2017中报点评：“平台 赛道”战略进展顺利，教,111967,2017-08-25,0.9790359381093459
都说科大讯飞是个好票，很难得的。有股友说，要,9825,2017-08-29,0.8129755225916326
2017.8.28科大讯飞历史性的日子 散户及还没配置,30954,2017-08-28,0.975534660015885
中报一个多亿的利润是怎么支撑800多亿的市直的,8063,2017-08-16,0.4651383928390376
未来架构师,28906,2017-08-27,0.9532838663569511
科大讯飞盘中创历史新高,43820,2017-08-29,0.9340873681598774
看的懂吗？不懂就卖完了走人……,22382,2017-08-22,0.2109227770763018
大帝教你：接下来怎么走,18090,2017-08-28,0.29414796834207346
哥今天有三万股可融券的额度。华泰证券有货,6040,2017-08-29,0.11797641555918192
科大讯飞股价跳水 游资机构联手狂砸逾12亿元,127827,2017-08-28,0.005615503469687422
我是你们可以敬仰的股神容颜和！！！,7672,2017-08-17,0.8885183313209299
为什么选择科大讯飞？,45467,2017-08-14,0.6388634341535715
科大讯飞悬崖式跳水[大笑][大笑],19045,2017-08-28,0.9167615518581842
重磅！捷成股份坐收电影《战狼2》50亿元票房,2234,2017-08-14,0.9135177402783389
【龙虎榜】暴力砸盘酿惨剧，一席位竟大举出货4.,116582,2017-08-28,0.6280849451231127
科大讯飞成交金额破百亿 游资和机构携手出逃,91780,2017-08-28,0.49819136493552985
老朽纵横股海二十年，深深感到：什么技术面、基,29231,2017-08-17,0.6170612614753647
科大讯飞跳水大跌 机构席位抛售超2亿元,86570,2017-08-28,0.2430180778445884
真正认识科大讯飞,29396,2017-02-22,0.5517946718912456
8-18收评,15549,2017-08-28,0.09196615376625594
科大讯飞：谨防关门打狗！只出不进！只卖不买！,13994,2017-08-17,0.04704886820318288
下周最靠谱走势出笼,23051,2017-08-27,0.6307299851757548
[爱心]向全国人民问好！祝全国人民幸福安康！,2694,2017-08-14,0.9998710805337541
科大讯飞(002230)融资融券信息(08-25),27322,2017-08-28,0.8359910458932623
002230-宇宙总龙头，目标825元，买买买,9606,2017-08-17,0.9434063559923385
为啥没有业绩的科大可以涨，方大不行呢？,8296,2017-08-17,0.041018871807535384
宇宙总龙头：大暴涨，短线目标296元，买入评级,15158,2017-08-17,0.9854802593587608
宇宙总龙头：大暴涨，中线目标596元，买入评级,14598,2017-08-17,0.9576700187737891
同学们大家来比较一下，阿里巴巴在美国上市的市,19371,2017-08-17,0.9668106626461357
宇宙总龙头：大暴涨，长线目标996元，买入评级,12299,2017-08-17,0.7637044488744221
超跌小盘603637有望快速反弹！,4608,2017-08-17,0.8318443738949635
002230-宇宙总龙头，目标825元，买买买买,8919,2017-08-17,0.9434063559923385
此股很快会步入方碳素股的步尘！,12610,2017-08-17,0.9348042511665158
11号冒出那么多研报买入，什么情况,7329,2017-08-17,0.24441742524610388
002230-宇宙总龙头，目标825元，买买,15388,2017-08-17,0.980395803381109
浙大网新做龙头,9333,2017-08-17,0.24203982665450696
002230-宇宙总龙头，目标825元，买,9739,2017-08-17,0.9452354145152401
明后天公告操控股价，这只股不知谁又进牢房,11073,2017-08-17,0.05813578311673173
拉个板给看空的看看,9393,2017-08-17,0.2796457065828213
不要涨停，只求不停的涨，就像茅台一样，这样的,8765,2017-08-17,0.708042753422954
有赚就可，不可恋才能立足不败。,8945,2017-08-17,0.6898902211974327
要核查了！大棒伺候要来了,12496,2017-08-17,0.28839286613269877
打脸啊, 59.59T飞了, 以为还要洗两个来回再冲60,12504,2017-08-17,0.3669724770642201
善意提醒：马上要调整1周了，看好自己的资金，,12865,2017-08-17,0.5949438010723763
进入女人逛街的节奏:：买，买，买！[大笑],5783,2017-08-17,0.9099447929621851
盘面观察,5749,2017-08-17,0.9177882834535862
干什么事都喜欢扎堆，前些天报道有不少机构几百,10728,2017-08-17,0.6270418057521118
高管减在54?自己都是,9210,2017-08-17,0.7214143308564241
换手率尚好，一边拉，一边洗。我也是减了半仓，,7172,2017-08-17,0.052684735475387656
25不买，涨到35，不买，汤到50，不买，现在60，,15657,2017-08-17,0.008570212558963508
2230晚上会不会停牌,11027,2017-08-17,0.2591457440001077
这是要逆天吧？？？,9641,2017-08-17,0.02949355824984423
现在进场会不会追高了呀？,8849,2017-08-17,0.47089146412443006
牛逼,9647,2017-08-17,0.6923786120385603
科大讯飞应该再飞一会,13331,2017-08-17,0.24503218068184562
哥走了。落袋为安。,8614,2017-08-17,0.8498332244044041
中国没有疯牛呀，这个一定是哪里有病，提前疯了,7815,2017-08-17,0.43717695552458624
45元哥就进来了，只是没想到这么强势,11223,2017-08-17,0.0928426223327965
我估计这股有问题！很快就会摔下来的！散户千万,11770,2017-08-17,0.4743497341188897
科大讯飞午后跳水大跌6.57% 成交金额破百亿,52210,2017-08-28,0.3512907536163534
科大讯飞的未来，好到你们无法想象！,17235,2017-08-17,0.9229041036240208
敢不敢进场接盘,10886,2017-08-17,0.14418017795884142
狂拉之后一地鸡毛，小心了,11168,2017-08-17,0.21031027791271284
人工视觉 3D激光雷达 无人驾驶龙头巨星科技0024,10008,2017-08-17,0.9897241525594106
科大讯飞8月17日盘中涨幅达5%,25822,2017-08-17,0.04121652552031618
凡是公司股价在短时间内疯狂拉升的公司都成不了,15914,2017-08-17,0.06231784476814983
全仓你,9183,2017-08-17,0.33551326498755707
打爆高抛者，清理高抛者！每年一个新高，价值凸,7674,2017-08-17,0.3780019349772341
隐约有牛气冲天的姿态，能走出方大炭素之前的气,15515,2017-08-17,0.9686417817082977
历史上从来没有一个主题概念象人工智能机器人这,20286,2017-08-17,0.8749389598373934
这两天60使劲吃,13808,2017-08-28,0.022471029049951685
1000亿已经越来越近,12860,2017-08-16,0.8380559228243868
语音龙头涨停板  视觉龙头睡大觉  3D激光雷达--,23460,2017-08-16,0.9714770934386525
002230科大讯飞 此股连续大涨，吸引资金大幅跟,15921,2017-08-16,0.8598102483143217
科大讯飞外围资金再次进仓了，终于等到了、大盘,32385,2017-08-15,0.8817949731346438
一个专利估价50万亿，还是美元！点赞科大讯飞,41042,2017-08-14,0.4008860368306165
人工智能在建筑领域运用开发人工智能装配式建筑,30717,2017-07-21,0.9833581598829612
什么漂亮50?还有俺大A 3000多家企业 你邦俺找找,44239,2017-08-08,0.6983862064625035
智能概念最小值融资股,4174,2017-07-03,0.9057060940736942
今天能说准科大是红是绿才是手上长毛的老手，,6347,2017-08-28,0.5643066912625146
哇噻！野心真大！讯飞不止想做中国的BAT！赞！ ,14918,2017-08-10,0.9824863635504951
今天成交量117亿，如此砸盘没有跌停，而且,24822,2017-08-28,0.19771987632181076
我也撤了，小赚。。。。。,10795,2017-08-17,0.06999590904569353
你们不要有人要，大把买单,10235,2017-08-17,0.3587861006326608
该减仓了,9674,2017-08-17,0.40306518103660427
许多被套在太空黑洞里了！,8823,2017-08-17,0.5988429391031627
这货出的完美。,11083,2017-08-17,0.807605262922147
大单狂抛 完蛋了,10525,2017-08-17,0.2741567171516375
市盈率388.12也是醉了，赌徒们,13918,2017-08-17,0.23266922610280494
成也是你败也是你，还好早上进的咋只要收红就不,6495,2017-08-17,0.16415019165892886
说不定给你拉个涨停[大笑],7319,2017-08-17,0.7173792079971616
难道到此为止 就要结束了吗,8273,2017-08-17,0.22795872053073174
孙子，跌吧，干,5284,2017-08-17,0.2866251736406884
敢不敢涨停，迟早都要到100的。何必搞这种飞机,13848,2017-08-17,0.022870878873109346
跳水是个很坏的信号，参考方大。但这个股比方大,12769,2017-08-17,0.09150239404701166
清仓 笑看割韭菜,8314,2017-08-17,0.4836835737287798
快跌，老子要骂人了,5451,2017-08-17,0.5304486250310199
不要涨停，只要涨不停[大笑],8080,2017-08-17,0.6534524487075786
后面的钱你们留给你们赚，我先撤,9808,2017-08-17,0.22568881913365768
如果明天给机会跑就跑吧,8229,2017-08-17,0.5667589078365819
别让柚子跑了,6182,2017-08-17,0.45347691578566196
辣鸡，快下来，凭个毛涨,6218,2017-08-17,0.879023379203963
到底谁进场接盘了，你是不是特背一进就如断崖走,10825,2017-08-17,0.32584339925693095
我觉得该调整下了,9403,2017-08-17,0.4308753477837757
跌下来，小散加仓，主力出货。。。。。。。厉害,8518,2017-08-17,0.011484416490107785
继续上。钓鱼线洗盘完毕,11904,2017-08-17,0.7056704686733303
死辣鸡，不准涨了，艹,7371,2017-08-17,0.5905751142149835
科大讯飞这回调法要吓死人的,18456,2017-08-17,0.061345050117781796
狠狠的洗掉了一批人，继续飙升！！！,16630,2017-08-17,0.026388638762776195
干就完了，17个点目前,12834,2017-08-17,0.2729943288178791
死辣鸡，凭个毛涨,4802,2017-08-17,0.5693824466523815
格局明朗化,17354,2017-08-28,0.6269976861599696
又要快速下跌,7069,2017-08-17,0.7901315522156727
底部绩优股002566,8896,2017-08-17,0.18676236167519145
涨停涨停[拜神],6434,2017-08-17,0.8362767583847663
拉科大，艹。都去大大,7641,2017-08-17,0.49153204930499483
我靠，被洗走,10734,2017-08-17,0.265777115465195
这洗澡洗的好舒服,18716,2017-08-17,0.2720812037752427
空气能电池将直接干掉锂离子电池,13072,2017-08-17,0.11615720968135002
哈哈，备查吧,6460,2017-08-17,0.7499999999999999
缩量反弹,8448,2017-08-17,0.4737672181921908
出货了！,7927,2017-08-17,0.3788569447456951
中国oled第一股。 欢迎主力入驻深天马。 苹果发,6569,2017-08-17,0.2624874233018114
散户们 今天怎么集中卖出了？,11531,2017-08-17,0.39487586724252266
眼红科大讯飞、踏空四维图新的：可以考虑超图软,13976,2017-08-17,0.35940389233996217
解套再等三年[大笑],11607,2017-08-17,0.7705321417859256
月线双顶已现，不要相信什么洗盘再拉高，明显的,21205,2017-08-17,0.6275068738835063
都买啥垃圾，快去买方大方大,5175,2017-08-17,0.9691475103635789
大海航行靠剁手[加油],23573,2017-08-17,0.9242485127528265
好多托和追高哭的啊！等下辈子解套吧。,12359,2017-08-17,0.9615450503342041
逢高减仓！,6754,2017-08-17,0.8939953426363553
联合收割机继续收割韭菜,7244,2017-08-17,0.28647080048133944
洗吧！呵呵呵,7830,2017-08-17,0.35060546784927926
镁矿暴涨100% 千万吨镁砂资源公司受益,6636,2017-08-17,0.9745084130397007
我好怕啊，主力再洗猛一点[大笑],12185,2017-08-17,0.7864443337486283
[图片],10220,2017-08-17,0.5826086956521737
跑跑跑跑跑跑,7370,2017-08-17,0.577723197119975
今天收阳或尾盘拉高，便于明天出清,11527,2017-08-17,0.5885141186552625
63进的傻逼了[亏大了],12636,2017-08-17,0.19332239285240205
