标题,帖子数,日期,情感
人工智能是个烧钱的无底洞，百度看来没戏，阿里,16281,2016-11-14,0.1755987032505243
科大讯飞:关于召开“2016科大讯飞年度发布会”,52691,2016-11-17,0.4989347143998284
科大讯飞:第三届董事会第三十一次会议决议公告,40714,2016-11-18,0.11837947494691714
把控智能语音入口，打造人工智能巨头,38423,2016-10-25,0.9631507114447108
以语音切口，布局人工智能的医疗、法律、教育领,15917,2016-10-07,0.9791055425543426
科大讯飞：讯飞输入法支持粤语等19种方言的输入,20017,2016-11-07,0.8529736562096922
日线头尖底形态,冲过31.60元,看好！,12318,2016-11-14,0.7461634168174031
不要轻易放过中签新股，可采取适度跟做以获得盈,6360,2016-11-15,0.8019353487810846
科大讯飞，没有认知的智能，等于是白痴，,3056,2016-11-14,0.800094526972056
人工智能到底能给教育带来什么？,10045,2016-11-11,0.48187795720273197
科大讯飞(002230)高管相关人员持股变动信息(5-2,47208,2016-05-24,0.22649311422827856
我也想买便宜货，可我不会像某些人一样唱空害人,5246,2016-11-11,0.7756862230782626
就那么简单一招对付讯飞的庄，一个月内有效，过,4363,2016-11-14,0.20973490043545084
小荷才露尖尖角——从时空和形态角度看讯飞的格,7702,2016-11-02,0.9925367059345365
我真不想谈这么LOW的问题，但是做错悔恨不已要,8951,2016-11-12,0.4898038176353109
下周要不要涨？,5162,2016-11-11,0.5190146996102576
会不会涨啊？,4423,2016-11-11,0.5996428147258794
接下来的情况会是啥？？,3763,2016-11-11,0.04755456600193553
这家中国企业竟是全球第二大智能语音公司 市值,26623,2016-11-01,0.3469126947054122
上联：牛逼吹上天，下联：股票坠深渊，横批：留,5138,2016-11-10,0.8099999823226095
写的股评不见了！ 晚上重来，请关注！有货！,11592,2016-11-06,0.13005807192648133
即将于11月23日举行科大讯飞年度发布会,23690,2016-11-04,0.2070574649564686
我已经不关心讯飞的基本面了,8828,2016-11-09,0.9058174340227677
科大讯飞透露搭载讯飞技术的汽车车型近百款,6871,2016-11-10,0.7148245221586803
科大讯飞：与中国移动合力推出儿童智能手表,4925,2016-11-10,0.9422361588903589
价高估位没戏了*明起全仓转买000731四川美丰10,147895,2016-01-27,0.23610387915583653
你整天吹牛逼挣钱吗？你的每股收益呢？,5156,2016-11-07,0.692613533811836
热烈祝贺科大讯飞鸟语输入法测试成功，,3907,2016-11-08,0.9719749638380575
60k快金叉了（MACD）,5262,2016-11-09,0.6483974138540229
一个玩具公司，竟然冒充是高科技公司，笑话，,4450,2016-11-07,0.3193645231060517
注意日线MACD金叉,4931,2016-11-08,0.44767845850986676
潜力无限-中国智脑第一股！ 科大讯飞背靠大股东,40299,2016-07-24,0.983523956415269
你输入法，就是支持火星人语也没用，,5071,2016-11-07,0.4890464553170749
此股实为大忽悠！,5391,2016-11-04,0.04154817467542071
收购乐知行获批，教育领域布局不断加深,65643,2016-11-04,0.9999973057054202
傻逼的幸福，来自傻逼的傻,15888,2016-10-29,0.9517331840730953
龟逝撸断背,47392,2016-01-07,0.8082385075348351
事件点评：营业收入稳定增长，人工智能技术行业,43176,2016-11-03,0.995957013320703
一个靠骗政府补贴的伪科技公司，,6669,2016-11-02,0.12769147673855752
讯飞怎么了？ 周未发言的走势，今天走出来了，,8420,2016-10-31,0.42778931011660193
今日是个长上隐的倒锤头，明天再来个长下隐的锤,7633,2016-11-02,0.9944589845669028
科大讯飞:国元证券股份有限公司关于公司发行股,44854,2016-11-02,0.30645341242494417
科大讯飞:关于公司发行股份及支付现金购买资产,52647,2016-11-02,0.2129489224464559
科大讯飞:发行股份及支付现金购买资产并募集配,37643,2016-11-02,0.21028825824626984
31.40成本8000股求同伴相扶到老,4252,2016-11-02,0.33958707170536206
讯之殇！真的吗？ 根据我的印象，讯是在上市公,6094,2016-11-01,0.5461761126181385
科大讯飞:关于对外投资的公告,45751,2016-10-31,0.7835124121699847
骗子“归回简单”的链接，现名：秋雨冬风,5888,2016-10-28,0.031858746345252875
又很久没谈讯飞了！ 今天来谈一下！至6月13日见,17068,2016-10-30,0.43059812143333975
科大讯飞:第三届董事会第三十次会议决议公告,29045,2016-10-31,0.11837947494691714
讯飞现在的路子上，华为也曾经栽过跟头,7225,2016-10-31,0.42230234432357205
30以下逐级低吸，30以上逐级高抛,8268,2016-10-29,0.7575357162571029
就这样一直 T 下去，捡捡小蘑菇,7733,2016-07-15,0.9845381374701474
看胡郁如何说讯飞,12242,2016-10-24,0.37228554011726034
等待中捡漏做T，既放松心情又降低成本,15184,2016-07-13,0.836336514483711
科大讯飞之我见（持有科大讯飞的理由）,13448,2016-10-13,0.08992072896852799
无为,6030,2016-10-19,0.40914866581956777
科大讯飞大骗子,9223,2016-10-25,0.12886865496643818
业绩短期承压，人工智能龙头地位稳固长期看好,34046,2016-10-26,0.9338094021143467
最后一次提醒大家清仓此股。后面会有连续暴跌！,6498,2016-07-05,0.5793252058470949
讯飞 有兴趣的朋友们把日k线尽量缩小，从15年10,17941,2016-10-22,0.5106625888207466
前9个月掌趣科技的净利润是科大讯飞的2倍 以往,6964,2016-10-25,0.7550131001641812
科大讯飞：机器人业内90%以上厂商使用公司技术,37485,2016-10-21,0.17326243927439522
科大讯飞语音输入法亮相锤子发布会 股价收盘涨1,15892,2016-10-20,0.9931015246823208
英特尔加速人工智能等行业布局 与科大讯飞签合,12661,2016-10-22,0.1286641768258423
【投资者传闻求证】华帝小V机器人使用公司技术,9902,2016-10-21,0.8802275450321205
关注29.00元的有效支撑！,7266,2016-10-20,0.7736365049871581
牛股000553沙隆达A强势封板 草甘膦涨价预期,3156,2016-10-21,0.2686509232479538
一文读懂人工智能第一股——科大讯飞的AI商业版,16718,2016-10-20,0.8196439136597569
图解科大讯飞三季报！,14327,2016-10-20,0.6540635397147689
科大讯飞(002230)大宗交易数据一览(10-20),22132,2016-10-20,0.28530539792426657
科大讯飞阿尔法蛋智能机器人正在京东众筹,10725,2016-10-20,0.5685868122597524
为何许多著名的成长性科技公司多是亏损的，研究,16793,2016-03-28,0.9990164726943411
这样的成长到底如何？,11836,2016-08-09,0.9535787063494484
讯飞三季报及近期基本面的喜与悲,6655,2016-10-18,0.9940859301028357
公司季报点评：人工智能产业布局仍处加大投入期,18791,2016-10-18,0.8165939556617813
业绩修正不等于造假，造假不必修正。,11837,2016-10-12,0.4219249196036914
科大讯飞:关于公司董事辞职的公告,35629,2016-10-17,0.19783553132729892
公司17号公布的季报，请大家好好看看，应该有不,15969,2016-10-14,0.019186592279464842
科大讯飞前三季度业绩同比增长逾两成,22439,2016-10-17,0.734367074120107
坚持一贯的观点与短期是否实现,4948,2016-07-31,0.9395524552153747
科大讯飞:2016年第三季度报告正文,49956,2016-10-17,0.6612591135309748
科大讯飞:2016年第三季度报告全文,33785,2016-10-17,0.8864724649991105
难道只有看空才是为人民服务,8009,2016-05-13,0.27792341784317576
科大讯飞:关于定期报告预约披露时间变更的公告,36808,2016-10-13,0.3751352967526812
=（转贴）一个科大讯飞老员工还原一个真实的科,32929,2016-07-07,0.7519954624674766
科大讯飞:2016年第三季度业绩预告修正公告,59477,2016-10-12,0.8042207780915516
三季度业绩下修看法分享，科大讯飞到底是迅还是,15282,2016-10-12,0.8598715882048786
弹簧被小心翼翼的压着，又不能,10632,2016-07-06,0.05605890790459733
科大讯飞昨日有见底反弹之势！,20522,2016-10-11,0.6619473193398646
科大讯飞曝出重大消息，下面走势已成定局，看好,6356,2016-06-12,0.2638125425287322
庄托现形记,46864,2016-04-19,0.4984914358077326
科大讯飞(002230)高管相关人员持股变动信息(6-8,34613,2016-06-13,0.22649311422827856
科大讯飞:非公开发行股票限售股份上市流通提示,51284,2016-08-16,0.7711518698538935
科大讯飞:非公开发行股票限售股份上市流通提示,44837,2016-04-19,0.7711518698538935
三季度就这样结束了，陆陆续续共买入47手讯飞。,13445,2016-10-02,0.9496624037788745
刘庆峰要聆听讯飞投资者声音,20837,2016-09-24,0.9769341684870976
只要阿凡达这个蠢货还在，可大就很难涨起来，主,9230,2016-08-23,0.858771086169895
科大讯飞(002230)融资融券信息(09-29),13317,2016-09-30,0.8359910458932623
号称中国语音第一？丟人啊！,7420,2016-09-30,0.45230722348769214
扭转局面，建议狂拉工业4.0概念股！,20170,2015-09-01,0.8372104302297514
评《千亿市值对应股价80元！ 豪言！ 创新正当其,16974,2016-06-23,0.5574108663674038
受欣泰电气影响，科大讯飞机构出逃明显,9090,2016-07-11,0.5093247310175739
关于讯飞打压洗筹效果不好的简要分析,15164,2016-08-31,0.526806491657673
我的科大讯飞,38928,2016-09-08,0.45077483130674334
要善于总结长期买卖讯飞的基本策略,17886,2016-05-17,0.5945607340491496
科大讯飞：近5亿并购乐知行 丰富教育类产品线,40709,2016-09-09,0.9888879406734638
人工智能领域龙头，行业应用成效显著,44018,2016-09-21,0.9912050114779436
讯飞到底怎么了,10841,2015-09-17,0.4259271524078386
此吧有一股托，啊烦达999！此货因发帖忽悠，早,47113,2016-02-19,0.00321010022314816
SB阿狗，只要跌你就低收，你是否是开银行的？,14523,2015-08-18,0.020674032031127942
短线为何不涨,6931,2016-09-22,0.7639949155916468
我还控制地住，不骂人 本人在此吧的最后一贴,27236,2016-05-20,0.05012565889120768
调查下，有几个是看了阿凡达的鼓动贴进来后挨套,5937,2016-08-02,0.052511400626179094
因为了解，所以参股投资,6045,2016-09-21,0.8580527279522847
意淫科大讯飞的人工智能，呵呵，只能证明--受害,5563,2016-09-23,0.5338625462452689
正常的逻辑是看好者留，不看者不在这里，不正常,4979,2016-09-24,0.11350910865144026
这股市你买入他下跌，你割了又拉升，上午拉下午,4087,2016-09-09,0.9798255494940165
龟回捡蛋,56056,2015-11-17,0.33565249294412625
我爱潜能妈？不爱，因为她太贱,10315,2015-08-18,0.7538437035741138
到唱空贴堆成山的科大讯飞买个聚宝盆,12034,2016-09-12,0.23846903148857446
“黑科技”龙头股问世 定增21.5亿 下周有望旱地,8252,2016-09-24,0.8217567128488713
怎么样,4823,2016-09-23,0.5262327818078083
重大利好：我清仓科大了。你们主力可以拉了,3470,2016-09-23,0.5114010535037404
人工智能平台ROOBO宣布获A轮1亿美元融资 科大讯,15015,2016-09-22,0.9614918576994201
已查明，“李民禹”是定增方派来的托，专门忽悠,4718,2016-09-13,0.06546477433313536
晒一下我们用科大讯飞语音技术做的机器人,11731,2016-09-12,0.8522936114268159
独家打脸“资本寒冬”，机器人系统公司ROOBO获,7128,2016-09-21,0.270318392510146
谁最希望尽快普及这项人工智能技术,12566,2016-09-14,0.7794634370019315
讯飞输入法V7.0完美速配iOS 10 成iPhone7绝配,11371,2016-09-17,0.7108778965968485
哈哈，更正后业绩大增，公司管理层不错，消息未,16994,2016-08-13,0.58776557589006
讯飞从去年8月见次底点以来，换手率达722.48。,6008,2016-09-20,0.04611681935911416
看好科大讯飞的基本都是炒股没啥水平的,5546,2016-08-26,0.04400657151792542
讯飞暴黑途径猜想：百度收购！,14467,2016-09-18,0.9943075884792306
科大讯飞包揽CHiME-4国际多通道语音分离和识别,14960,2016-09-14,0.9361748013381258
天命在人工智能，黄袍加身应在科大讯飞,6289,2016-09-13,0.3713744239677156
没见底，再等等,6937,2016-09-13,0.16764579581505612
9月13日公布的获奖名单中有没有科大讯飞。,8438,2016-09-14,0.007652209300858526
发达了发达了，一百万股涨一百倍是多少钱,4348,2016-09-11,0.8418887686564135
唱空的都是有主的托，唱多的都是真正的买股,3481,2016-09-11,0.4675841078679559
等候多时 买入,5768,2016-08-30,0.7353792240060403
AIUI评估板可以申购了，专业团队注意了。,5134,2016-08-25,0.028395526578936514
从灵犀到灵犀云，中国移动与科大讯飞合作在深入,9562,2016-08-18,0.7806441898986584
科大讯飞牵手广通服签署战略合作协议 共推智慧,9554,2016-09-07,0.27799960213363595
有人传说干托麻将在讯飞股票上被套吃亏了,4527,2016-09-09,0.43579066914967646
阿凡达高位套牢的,20938,2016-03-03,0.6142176184653515
科大讯飞:北京乐知行软件有限公司审计报告,48668,2016-09-09,0.9210681679321929
二买，就当下,6349,2016-09-08,0.6934539327368818
科大讯飞:国元证券股份有限公司关于公司发行股,40841,2016-09-09,0.30645341242494417
科大讯飞:发行股份及支付现金购买资产并募集配,47685,2016-09-09,0.21028825824626984
股价炒高了，拉几个彪子，傻子接盘呗。科大讯飞,15711,2016-07-23,0.3955565293944753
谢谢主力割肉,4325,2016-09-08,0.5451576192936964
阿凡达咨询你，小迅现在可以买进吗,4033,2016-09-08,0.18290533782192586
讯飞成长新闻联播001,8462,2016-08-18,0.9814602904464778
讯飞新闻联播002,11071,2016-08-19,0.7044754190750435
大盘天图底分型出来了，本周都比较乐观,6142,2016-09-05,0.8908224827995846
我错过了好多好股，从今以后就不换股了，希望科,7184,2016-09-06,0.21946786136718832
百度拥有全球第一的中文语音识别技术,59620,2016-06-09,0.9019998104731956
我周四把车位卖了，周五开盘29.99元全部买了讯,12783,2016-09-03,0.16466243305200334
【投资者传闻求证】合作探索医用智能图像识别技,11181,2016-09-02,0.9437874125123746
科大讯飞拟定增募集21.5亿 投建智慧课堂和讯飞,23587,2016-09-02,0.9924072619542702
透过真相看本质，科大讯飞（二）,14072,2016-06-01,0.9456798173152895
说实在的，我对短线跟讯飞纠缠下去真没耐心，可,12836,2016-08-31,0.7942107272738491
与中科院合作进军人脑工程！赞！ 7月23日新闻联,9443,2016-07-23,0.9440267117911476
“胡郁有约－人工智能领域独家干货分享”沙龙将,7858,2016-08-30,0.8377167304958018
靠吹牛逼忽悠是改变不了世界的，更无法改变净利,5809,2016-08-27,0.5924582504113826
三问科大讯飞的刘庆峰！一、你是资本运作外行，,9467,2016-08-27,0.9792276386750538
明天收盘价34.44,9931,2016-08-25,0.2637018024682164
我明白了，这是解禁抛售，3050附近抛售,5518,2016-08-24,0.4952973506456039
对于科大的看法，立贴为证,13639,2016-08-15,0.7133838943254905
科大讯飞拟定增募集21.5亿 投建智慧课堂和讯飞,42864,2016-08-26,0.9924072619542702
上市8年依靠政府“供血” 科大讯飞再融资43亿仍,93019,2016-03-26,0.9823217160823502
今天这个杀跌让我感觉不对了,13294,2016-08-26,0.06282365500430065
刘庆峰，资本运作的外行，是造成科大讯飞股价低,9294,2016-08-25,0.9932280408184964
方法中的计划(1),10176,2016-06-17,0.55399871437198
如何做好讯飞的短线和长线，一点体会。,16022,2016-05-14,0.6949608311045783
投资猜猜看,192424,2015-12-02,0.8857362673587144
做到模糊的正确就行,8670,2015-10-22,0.6760430560258307
精彩讯飞,8905,2015-08-30,0.64891451895829
复盘看了一下找不到股买了。,3253,2016-08-24,0.07583737999017326
IPHONE高峰已过，以后是谷歌的天下，讯飞别玩葛,9278,2016-08-22,0.9976504803842975
业绩增长强劲，人工智能技术持续领先,52283,2016-08-24,0.9905836583147504
讯飞最新调查访谈成果001,9004,2016-08-23,0.624533100011461
科大讯飞:关于深圳证券交易所对公司问询函回复,38531,2016-08-22,0.03029131951237818
科大停牌不是时候，复牌也不是时候,3510,2016-07-28,0.2570574492718398
今天收市不泛红直播吃翔[怒],4758,2016-08-22,0.3035713461106563
人工智能龙头维持高速增长，行业应用多点开花,35464,2016-08-19,0.9545788478449544
社保基金和券商都进来了，戏码越来越足了,7982,2016-08-18,0.7889185728094579
智能语音领导者地位稳固，教育信息化业务快速发,33772,2016-08-16,0.9848773403337415
我不活了，满仓满眼都是科大讯飞做了一年，还亏,6348,2016-08-01,0.6214579703209973
中报利润暴增，人工智能驱动个性化教育领先成长,56204,2016-08-15,0.9827476916107346
"""轩辕氏族"":你这个2B",疯狗，每天恶意攻击讯飞科,5810,2016-07-30,0.32727236396410775
居然改报表了，真无语,16960,2016-08-12,0.046964095538309714
科大讯飞(002230)大宗交易数据一览(08-12),26682,2016-08-12,0.28530539792426657
科大讯飞:2016年半年度财务报告(更新后),37866,2016-08-12,0.2903383676883329
科大讯飞:关于更正2016年半年度财务信息的公告,43731,2016-08-12,0.48782678002945445
科大讯飞:2016年半年度报告摘要(更新后),43788,2016-08-12,0.5248571210878696
人工智能应用快速渗透，利润低增为未来蓄能,34166,2016-08-11,0.621772903089839
科大讯飞又上焦点访谈，可股价怎么这么萎呢？,4061,2016-08-11,0.9646317247358558
换位思考一下就明白今天的行情,8651,2016-08-09,0.9763314908307589
中报业绩符合预期，人工智能布局持续深化,27103,2016-08-11,0.9626150060253944
语音龙头稳步增长，讯飞AI生态渐成熟,29353,2016-08-09,0.9504295279327588
营收持续高增长，人工智能掷地有声,28764,2016-08-10,0.6889324741862273
29元以上清仓科大讯飞是明智之举，里面全是新韭,8510,2016-08-05,0.289348547148256
科大讯飞股东违规减持 深交所发来监管函,54109,2016-02-24,0.6311129634421022
科大讯飞中报点评：业绩符合预期 人工智能应用,24628,2016-08-09,0.3929140502526266
科大讯飞:2016年半年度报告摘要,38994,2016-08-08,0.7670666510942318
收入持续高速增长，人工智能捷报频传,23416,2016-08-09,0.9888931615851273
风口上的科大讯飞，价值几何？,10124,2016-08-09,0.7101276502586663
收入高增长进一步延续，AI行业市场霸主地位得以,22179,2016-08-09,0.9999877977975187
科大讯飞-开盘走跌。立帖为证！,21213,2016-07-25,0.4733190704052749
科大讯飞:2016年半年度报告,30454,2016-08-08,0.5493974924286175
关心讯飞财务数据的可以去它的官网看看，有篇高,15717,2016-08-06,0.8548280298754751
科大讯飞大利好：优必选机器人亮相央视“说奥运,4504,2016-08-08,0.9829761541678763
搜狗发布语音交互引擎“知音” 支持多轮交互实,7375,2016-08-03,0.9528209519764023
科大讯飞，是否被媒体和股民妖魔化了? 说句实话,13146,2015-11-07,0.8712973803581612
机构想将2亿股融资盘逼入绝境无奈对手也是天天,10765,2016-08-03,0.5669832563600967
科大讯飞这个公司怎么样,20877,2016-04-02,0.503454285323472
科大讯飞的股权结构也是很容易被攻击的对象,9453,2016-08-05,0.9906372116379573
还是耐心一点儿好。28日就想建仓科大迅飞，忍住,16188,2016-07-30,0.22982930337323781
科大讯飞的高成长，全靠政府补贴，和融资圈钱，,5274,2016-07-11,0.8186979852667264
科大讯飞就是一个伪科技公司，,7839,2016-07-10,0.7510217997892559
求横批 ！！！,5876,2016-07-28,0.11091078823703149
拿讯飞净利润说事儿的“老人”你是揣着明白装糊,17180,2016-07-31,0.44434826322386145
LQF我晾你不敢出个不增长的中报,8192,2016-08-02,0.2871331311933192
讯飞今天咋样,2365,2016-08-02,0.11791900417592949
担心讯飞复牌后补跌,34097,2016-05-17,0.13029220705498712
今天最低到30，阿凡达，你贴上今天你的成交，从,7039,2016-07-28,0.5290935284104968
33.5的成本，啥时回来啊，孩子看病的钱,5392,2016-07-29,0.351453331776441
科大迅飞下周至少2个涨停！,9614,2016-07-29,0.5234127198420497
哈哈，现在的科大讯飞好便宜。,9637,2016-07-30,0.7141544673485735
Blizzard Challenge比赛结果出来了吗？,5179,2016-07-29,0.7298610412885121
可能会调整一段时间了，解禁几千万马上到了,5329,2016-07-29,0.4954484203167475
100迈跑车只是踩了下点刹，今天到下周一还有点,8211,2016-07-29,0.06713882680145156
通过了至少会有7个涨停，没通过此股也该拉升了,21043,2016-07-27,0.14604255032988167
据传闻但斌先生或已建仓科大讯飞,24116,2016-06-28,0.42212247762239075
科大讯飞上市8年依靠政府供血 再融资43亿仍缺血,66303,2016-03-28,0.9927213563469315
科大讯飞所谓的利好，只有他自己知道，,5353,2016-07-29,0.5257015748867134
科大讯飞:关于发行股份及支付现金购买资产并募,97846,2016-07-27,0.5965900084303046
科大讯飞助力长虹首推人工智能电视 让电视“懂,4136,2016-07-29,0.36659148260556407
科大讯飞募资购买资产获有条件通过 28日复牌,40890,2016-07-27,0.8771389327719407
科大讯飞下跌中继，换股为宜，,2189,2016-07-29,0.8983831388780735
关于大盘和讯飞的简单总结,6298,2016-07-28,0.6476072183868602
讯飞动不了，其他的建议卖，越涨越卖,12946,2016-07-26,0.24240350939243116
科大讯飞今日超大单流出排名第4名(07-28),16907,2016-07-28,0.37102229065530623
全国最大的金融诈骗集团昨天浮出水面，那就是中,4783,2016-07-28,0.9902776986401449
强烈要求深交所追究科大讯飞实际控制人的一致行,19478,2016-04-01,0.5180158910915262
科大讯飞仍然跳不出玩具公司的宿命，,8651,2015-12-21,0.6812922330306556
科大讯飞股东违规减持565万元 遭深交所监管,40829,2016-02-23,0.8623928200805464
请各位踊跃发帖把阿凡达挤到沟里去,16227,2016-04-24,0.16787889432108738
还在讯飞里的明友们，我想说的是目前机会大于风,9331,2016-07-19,0.19537483549712742
天天嗡嗡嗡的嚷嚷着看空讯飞图什么？,7556,2016-07-26,0.8743770873954753
猪一样的队友：LQF,3053,2016-07-28,0.7549049838107804
科大讯飞(002230)融资融券信息(07-27),6654,2016-07-28,0.8359910458932623
呵呵躲过一劫，复牌肯定是补跌,10921,2016-07-22,0.5385412671950128
屙[大便]凡达已被套的死翘翘！,22806,2016-02-25,0.0008011259332634246
坚定挖潜价值投资才是财富____________________,30964,2015-11-02,0.9649155048304365
科大讯飞重组有条件通过,7127,2016-07-27,0.3968113591530632
科大讯飞:关于中国证监会上市公司并购重组委员,100351,2016-07-21,0.6770231033719428
关于科大讯飞股份有限公司股票临时停牌的公告,175371,2016-07-21,0.7973023702580557
一个讲故事的科大讯飞，,4611,2016-05-20,0.7569516711961711
根据过往经验，一到要解禁，就要停牌了,9279,2016-07-21,0.6340757171191987
科大讯飞重组上会 今起停牌,55823,2016-07-21,0.34730739111871434
科大讯飞的市值之路,48601,2016-06-05,0.6542321364838164
科大讯飞与安徽省立医院共建医学人工智能联合实,12411,2016-06-22,0.2009350847524397
央视为何报道讯飞话增长？,22179,2016-07-17,0.9282340415883917
声学第一股！ 中国声谷-科大讯飞！ 2016年6月6,8567,2016-06-07,0.13525536084875056
讯飞的投资逻辑就差最后一环就可以闭环——业绩,7179,2016-07-22,0.9363127289666328
科大讯飞的价值逻辑及如何飞的更高,38787,2016-06-03,0.9148311731838485
我估计360有可能真的会借壳科大讯飞。[好困惑][,14693,2016-07-23,0.942754704367107
科大讯飞又上新闻联播了,12339,2016-07-23,0.7741247767582577
【投资者传闻求证】有军工方面订单？,27471,2016-07-20,0.7752867202432172
复牌3---5个板,9528,2016-07-21,0.27964570658281995
真想骂人，眼看大盘要拉主升浪了，又关禁闭了,7938,2016-07-21,0.4786240834665817
360借壳科大 可能性,9439,2016-07-21,0.1703595799915566
方法中的计划（4）,31219,2016-06-27,0.4270285316331579
营业外收入不及预期导致业绩低于预期；收入增速,44255,2016-04-26,0.9883774553963837
无题,7914,2016-07-19,0.5
骗子和托在装神，动不动叫老师，我呸,12720,2016-04-09,0.27864479189542857
科大讯飞(002230)大宗交易数据一览(06-29),27015,2016-06-29,0.28530539792426657
科大讯飞(002230)大宗交易数据一览(06-30),26163,2016-06-30,0.28530539792426657
科大讯飞(002230)大宗交易数据一览(07-05),23747,2016-07-05,0.28530539792426657
今天宜持股观望,5345,2016-07-14,0.8097683833352222
收入和盈利增长进入爆发期，5年内股价或超茅台,15803,2016-07-16,0.9956421108155069
科大讯飞上半年纯利润超2亿，增长50%。,24118,2016-07-16,0.8329532511991719
科大讯飞，央视播报，业绩暴增50%，周一强势涨,14669,2016-07-17,0.9506231002687423
科大讯飞今日超大单流入排名第15名(07-15),16118,2016-07-15,0.671383806068748
科大讯飞昨晚上中央二台信息联播了，一分钟介绍,14339,2016-07-16,0.1447254614328558
科大讯飞:关于安徽工程大学机电学院转设为安徽,89580,2016-06-12,0.9986438727753585
各位，据了解屙凡达999原是一说相声的，平时兼,17196,2016-03-25,0.5790769382807149
话唠阿凡达999何止坑爹，此货害人害己，其早已,15550,2016-03-25,0.014446296038638895
讯飞春晓行动的效果，如何评价,9837,2016-06-30,0.9620578862068486
