标题,帖子数,日期,情感
科大讯飞:2017年半年度报告摘要,124519,2017-08-09,0.7670666510942318
费用高企影响当期收益，源头技术驱动战略布局持,73692,2017-08-11,0.9577327167770218
终于找到了一个可以战略投资的标的~科大讯飞！,16258,2017-08-12,0.9902176855043379
长期持有天天玩，二宝结合创新招！,8904,2017-08-11,0.35869791042446997
投资者交流会纪要,84946,2017-08-11,0.9738799866942267
科大讯飞董事长：没有减持的打算,98003,2017-08-10,0.7687336865553918
行业应用加速落地、大投入布局大未来,39693,2017-08-11,0.99100249999509
科大讯飞:2017年8月10日投资者关系活动记录表,13966,2017-08-11,0.8127815014005878
事件点评：收入及毛利增长明显，战略布局持续落,57363,2017-08-11,0.9999067135190455
业绩符合预期，车载与大数据广告业务表现亮眼,46808,2017-08-11,0.7346643009066093
明天开盘，46以上卖掉就是赚到,14043,2017-08-10,0.038898036814118075
就这业绩，彻底玩完。,5274,2017-08-10,0.9066813421521751
一会朕买几千手，拉到47,9026,2017-08-07,0.014792790466863104
今晚朕驻守在此，有问必答。,72270,2017-08-04,0.8777736520778217
跌幅过大，上涨乏力,16314,2017-08-04,0.17173741071291593
明天破43,14597,2017-08-07,0.3546842745300547
明天不跌5个点,16162,2017-08-07,0.17498401126658825
动态市盈率312，科大讯飞是要崩盘的节奏啊，昨,7337,2017-08-09,0.41137578680149334
任何的短线预测，都毫无根据，也无意义。唯有符,9910,2017-08-11,0.611972473585837
只是一种可能性！应该没人信……,7868,2017-08-11,0.5438309361528583
好心游资让阿布达比投资局高位套现离场了。,7676,2017-08-10,0.7809887031727575
特别提示：MSCI指数标的股601958 金钼股份正创,3136,2017-06-22,0.6718236909983112
现在坚决不买科大核心四大理由,28910,2017-08-05,0.6663702120315045
教育率先突破，平台 赛道成果显现,64533,2017-08-10,0.9975247452214152
从今天开始，浙大网新步步高升，科大讯飞跌跌不,7805,2017-08-10,0.08673487489733678
解放了49.9的套牢盘，主力真好，还会给今天不接,11019,2017-08-10,0.5754940579270327
天网大帝称涨停，没有你是大忽悠！,8328,2017-08-10,0.0470409481183266
人工智能技术持续领先，产业化应用多点开花,42200,2017-08-10,0.8209106941350712
敬告天网大帝！,10143,2017-08-10,0.16154667869670913
2017年半年报点评：营收及毛利快速增长，“AI ,33715,2017-08-10,0.6779160279576955
【干货合集】科大讯飞半年报解读集锦,28916,2017-08-10,0.6069705213192358
收入提速，研发等投入加大导致利润下滑,43718,2017-08-10,0.3413618090951348
50.79卖出，47.87买回，神一般的操盘,7307,2017-08-10,0.5328489028017406
信托计划、QFII二季度进驻科大讯飞,75821,2017-08-09,0.24960476398408082
今天庄家反其道而行之！业绩利空本应下跌，但庄,6752,2017-08-10,0.7945621671766577
天网何处去？,1728,2017-08-10,0.19175216765602765
业绩符合预期，教育日益进入收获期,44806,2017-08-10,0.9889324417147459
董事长问答摘要[微笑]一是董事长至今一股股票未,8937,2017-08-10,0.8624970377615729
文川地震现象:  电闪雷鸣. 飞沙走石. 乱云飞渡;,5339,2017-08-10,0.7111302390996259
打造世界级旗舰，需厚积薄发,65876,2017-08-10,0.7020366196332968
科大讯飞何时飞？ 当一个又一个世界第一的消息,30791,2017-08-07,0.7682870569952086
科大讯飞：上半年营收增长四成 净利同比下降58%,74603,2017-08-09,0.6703146329455976
任何讲故事，任何广告都无法撬起这亚细亚的太阳,31634,2017-08-06,0.4439989610072772
科大讯飞:关于举办投资者接待日活动的公告,124728,2017-08-07,0.9742814628918379
不要和未来十年以上的大趋势对抗！科大讯飞是目,37006,2017-08-04,0.5996754342715075
科大讯飞预计前三季度净利润1.39亿元至2.78亿元,66486,2017-08-09,0.16745738145510436
科大讯飞上半年实现净利润1.07亿元,62085,2017-08-09,0.4882147499912922
科大讯飞:2017年半年度财务报告,74154,2017-08-09,0.5494799161509022
跳水还会等到下午吗？,13513,2017-08-09,0.969304739569006
我看科大核心三要点,24756,2017-07-11,0.9692865343062531
超级土豪阿布达比投资局居然藏在科大讯飞里，这,9711,2017-08-09,0.09355348057838275
小心被诱多，上山去站岗，呵呵。。。。。。,12818,2017-08-08,0.9741136353475598
客观的说两句,7989,2017-08-09,0.272911753811132
8月10日会出利好？那主力为何着急强拉？最后的,18107,2017-08-08,0.0815178863931707
特斯拉二季度亏损低于预期 ，股价盘后大涨！ 两,21056,2017-08-05,0.06576058834430931
中报要出来了，利润大减，还的调整,14872,2017-08-04,0.21975861879827785
洗盘而已，不要懂就说出货，这个股票除非脑子有,12760,2017-07-28,0.32593183378692425
一个在国内排名73（活在坎儿上）的小公司，你们,11800,2017-08-04,0.7167254203366024
登高望远~价冠中国,14719,2017-08-04,0.8952835524436816
科大讯飞(002230)融资融券信息(08-07),15342,2017-08-08,0.8359910458932623
融资盘尾盘大量出货，它们嗅到了什么？,41176,2017-07-28,0.35587525461834246
卖了买天齐锂业做个小差价,2100,2017-08-08,0.11335789010688924
相信讯飞会越玩越大！,45433,2017-06-27,0.8410819796889273
让快乐充满每一天……,2913,2017-08-07,0.9795260504393524
【投资者传闻求证】科大讯飞拟投资50亿元，在光,78229,2017-08-08,0.9449402999630987
下午跳水吗？等着吧，呵呵。。。。。。,14946,2017-08-07,0.5967797811174045
我的成本价是48块9毛5,已经套了7%,我该怎么处理,18927,2017-08-03,0.060990575942982295
好言相劝，建议浅套的朋友赶紧割肉出局，盈利的,35430,2017-07-31,0.11996690205165128
想想8月10日中报业绩地雷的威力，主力时不时反,12373,2017-08-07,0.5932305230799267
今天大盘如早盘所料,2830,2017-08-08,0.6541299100987495
对新浪发布的关于讯飞的居心叵测文章的解析,14565,2017-08-03,0.9543555753464275
股市里的童话都是骗憨子的,143115,2016-08-03,0.9326252059458168
科大讯飞2017.8.2飞起来。 请记住这个日子2017.,61188,2017-08-01,0.44347841255036236
天网大帝是骗子，私下注册N个小号互相吹捧，顶,5172,2017-08-05,0.015495142818884422
中国AI再突破：科大讯飞刷新LUNA医学影像国际权,9618,2017-08-07,0.9421810169164778
科大讯飞(002230)融资融券信息(08-04),14333,2017-08-07,0.8359910458932623
科大讯飞融资净买额已连续2个交易日为负，后市,21380,2017-08-04,0.6281403585129659
科大讯飞:关于对外投资进展的公告,180023,2017-08-02,0.8301500731263806
研报是配合出货的，大家小心,9929,2017-08-02,0.2611312238158675
SQuAD夺魁，认知计算再获突破,123167,2017-08-03,0.9914144984242877
跳水的时间2点15分，就这么定了！！,4720,2017-08-01,0.027282005808151544
进场: “双重改革”受益股,社保养老金标的股,4000,2017-07-31,0.9893200488469195
科大讯飞(002230)融资融券信息(08-03),17248,2017-08-04,0.8359910458932623
提示：暂时规避科大讯飞,4960,2017-07-28,0.36856550638064656
昨天科大讯飞融资净买额为-5498.88 万，融资盘,9161,2017-08-03,0.9859050580294622
科大讯飞有的炒，远望价格冠中国！,10236,2017-08-04,0.37087628823984786
明天涨停，主升浪开始。,39318,2017-07-25,0.4703155879888663
45.47*1.1=50.01,12106,2017-08-03,0.5
大帝教教你们怎么玩技术,24336,2017-07-27,0.5277064826165114
看这幅吊吊的样子,12366,2017-07-27,0.4261417848628887
规模投入接近尾声，业绩拐点临近,207278,2017-06-23,0.9141636384517466
摩根大通计划用AI机器人执行金融交易 受益股一,41535,2017-08-03,0.6301517621632639
《规律要知晓，盈利自然到》,6542,2017-08-03,0.7927056492188996
科大讯飞：主导编制的两项国家标准获批发布,90114,2017-08-01,0.5315278692843529
场外的散户一旦被诱涌入，这票可就废了。,13523,2017-07-27,0.7553013922567298
科大讯飞太高了，小心点，常熟银行601128 银行,3941,2017-08-03,0.031087301807871448
讯飞新声音,10305,2017-08-02,0.4174768055984799
科大讯飞(002230)融资融券信息(08-02),18156,2017-08-03,0.8359910458932623
我是股价止涨神！！我一买，第二天肯定跌~！,3641,2017-07-26,0.32166397923997914
置顶：国企改革中的战斗机！,6316,2017-07-05,0.9949934756833596
关于讯飞动态价值波动中枢的预计 系列之（二）,24890,2017-07-28,0.5429575329878324
重不重要盘面见，实盘走势说的算！,5592,2017-08-02,0.03883129238515193
穿越牛熊之科大讯飞：股价创两年新高 多家机构,51141,2017-08-02,0.9802444204706204
科大讯飞:关于公司主导编制的两项国家标准获得,168062,2017-08-01,0.2970452360346122
科大讯飞(002230)融资融券信息(08-01),10387,2017-08-02,0.8359910458932623
8.1日科大讯飞总裁做客中央电视台财经频道 主持,36740,2017-08-01,0.004111775556908337
还敢接飞刀，小心万刃穿心，死无全尸。,7159,2017-07-25,0.05883846779923063
科大讯飞-回落关注5日线支撑 不破可以继续持有-,12548,2017-07-30,0.3088508527903865
杀入白宫的中国黑科技,比Siri更实用的讯飞·译呗,15136,2017-07-31,0.7489142193755014
几万家公司搞人工智能，市场都是你的？,6944,2017-07-26,0.29254355697212053
熊市不论道,127741,2016-09-06,0.7486119867675622
寻到15年涨50倍的下一个恒瑞，要复制恒瑞需满足,11329,2017-07-17,0.9989926693485262
汎飞之我见！ 周未闲暇，聊聊这旧情人。个人浅,15065,2017-07-29,0.9347457294797437
（720）讯飞~高举人工智能之大旗！,15100,2017-07-20,0.8172879902406125
百元讯飞值得期待！,28796,2017-07-04,0.8008561464977786
（719）讯飞~人工智能大牛股,20000,2017-07-19,0.26442090127421036
人工智能~改变未来30年！,19894,2017-07-04,0.9538411277937648
科大讯飞往哪飞？ 原创 2017-07-29 孙老湿 孙说,23315,2017-07-30,0.11305471192625105
谁说讯飞的高成长已成过去？,19156,2016-07-20,0.9290457159301769
科大讯飞(002230)融资融券信息(07-28),16709,2017-07-31,0.8359910458932623
科大讯飞（002230）：梧桐生矣，于彼朝阳,22869,2017-07-16,0.6774836195956471
股神空翻多了要警惕，一点提示,8139,2017-07-03,0.7532883784217432
吓坏了吧？都以为继续回踩二零线吗？下周一大阳,16818,2017-07-28,0.16989829049082217
14年小米是全球第二聪明的公司，苹果没进50强,19241,2017-07-29,0.7002770048710577
这样才保险,7132,2017-04-27,0.2576013335224231
不忘初心，继续前进。,72562,2016-10-20,0.3668969578542959
且看讯飞公司如何反驳“输血”和“缺血”论,44131,2016-03-29,0.7939576106969578
将价值投资进行到底的基本策略和方法,42494,2016-07-08,0.9854648663706539
用假概念做皇帝新衣，泡沫比创业板高20倍,5766,2017-07-26,0.9682431984273259
今晨亚马逊放巨量下跌！持有科大的股友们注意风,12277,2017-07-28,0.5344034596043314
业绩地雷引爆前的疯狂，让谁迷失了？,3636,2017-07-28,0.9602735468517296
此吧已经被神经病占领,4990,2016-08-24,0.6117295695113586
下个星期冲破60元,26030,2017-07-21,0.12449628459744788
进场: “双重改革”受益股,社保养老金标的股,4123,2017-07-29,0.9893200488469195
高度提示风险的几位老空头终于可以谢幕了,18415,2017-03-24,0.4591107768695947
2017中国人工智能大会。,22438,2017-07-22,0.9161883240013391
科大讯飞发布最新产品“翻译领夹” 为了一步到,21574,2017-04-01,0.29932555348435874
作为中国最聪明公司，市值严重偏低！,28313,2017-07-23,0.6381400408194775
主升三浪中,19444,2017-07-21,0.6703760339293693
现在要炒小盘股的人工智能了 科大智能300222 人,2750,2017-07-25,0.3836433424142697
扫地机器人Roomba公司股价在美股一天涨幅21.5%,8085,2017-07-27,0.46850476342533265
牛来了 现在的科大智能300222就是将来的苹果和,1905,2017-07-27,0.9004930540064714
“涨停板陷阱”是诱散的重量级武器，不中招都难,6522,2017-07-27,0.0682056860807525
今天涨停抛了，好难受。明天估计要高开，诶，错,14998,2017-07-27,0.10741020905032872
别让主力痛痛快快的出货，行情方可延续。,9389,2017-07-27,0.988292864510081
老丫头的模式,9202,2017-07-27,0.5602480057131464
避免踏空的基本策略,20726,2017-03-25,0.8182313426953005
最后的胜利必将属于长短兼顾的多方,32119,2016-07-08,0.9944350777633175
哎哟，不错喔。,39168,2017-03-20,0.10961445040161344
明天大阳穿线，敢赌么？？,22709,2017-07-26,0.02846903538951806
阿凡达高水平帖子表,17740,2016-07-26,0.08150470914277952
目前讯飞的成长正当其时,12157,2017-06-27,0.9523657754706538
人工智能 智能机器人 人工智能+健康 新能源 工,1862,2017-07-27,0.31564593243034134
董事长和总裁的亲弟弟清仓减持说明什么？,17344,2017-07-26,0.9334919242292589
麻省理工科技评论的正式完整版发布，最新精华译,17742,2017-07-16,0.9436124868825406
昆仑万维跌三个点到涨停，讯飞行不行？,6267,2017-07-27,0.0853796305384632
主力机构终于明白：只有拉高才能吸筹，而且正在,11459,2017-06-30,0.39784264605628417
[抄底]漂亮50中国股市的心脏，沪深300中国股市,5511,2017-07-16,0.9999669706544685
科大讯飞融资盘在萎缩，成交量在下降，后市还能,10160,2017-07-26,0.7277990300223466
在目前强监管下，中报期当心业绩地雷，尤其要小,26327,2017-07-19,0.94069793205641
在大力整治金融乱象的当下，像科大讯飞这类缺乏,7410,2017-07-26,0.9714583593493874
揭穿唱空并叫骂者,4349,2017-07-24,0.9619777270819413
股民中谁见过和听说过科大讯飞的产品？,11246,2017-07-26,0.8709615588874562
科大讯飞下跌途中的无力反抽，别又被忽悠接盘呦,6347,2017-07-26,0.0021094046277428946
五年内讯飞市值,35863,2017-07-13,0.3867989711115396
世界最强语言识别公司亚马逊的无奈,10413,2017-07-26,0.9710961136093798
科大这次如收购 能涨几个版,462381,2016-03-15,0.9797563292412085
科大讯飞(002230)融资融券信息(07-25),15772,2017-07-26,0.8359910458932623
科大讯飞(002230)融资融券信息(07-24),19592,2017-07-25,0.8359910458932623
【投资者传闻求证】将在武汉建立第二总部？,31027,2017-07-25,0.6319811383514591
科大讯飞 攻坚战大响！ 2015年6月16日，难忘的,8849,2017-07-23,0.12436642451896118
科大讯飞纯粹炒作，业绩大幅下降，目标20元,8456,2017-07-25,0.008484860716931664
科大讯飞三方资金陆续就位，切勿盲目而行，能否,7994,2017-07-25,0.9544159951318055
大主力要把科大讯飞炒好 现在必须先把科大智能,4491,2017-07-24,0.44941912790494587
大家对科大讯飞未来的股价走势有什么想法？,31148,2017-07-21,0.9886816324864207
特大利好： 阿尔法大蛋机器人修炼“出关”正式,30279,2017-07-08,0.7623200015785251
业绩预减地雷，下周会在利好出尽后引爆，呵呵。,18071,2017-07-23,0.7427173478800158
高位蒸蛋出货，干净彻底完全的清仓。太吓人鸟,2869,2017-07-10,0.3346143633858901
科大讯飞与联想强强联手—有望给国内教育现代化,9561,2016-07-23,0.9684240208733715
科大讯飞：人工智能领域主要对标谷歌微软等,87809,2017-07-07,0.9970582426276852
科大讯飞，一只被严重高估的股票,24987,2017-07-21,0.8220722400275263
科大讯飞刚刚上了CCTV4的中国新闻了………人工,35301,2017-07-21,0.9005368649645848
海康威视2700亿市值，科大讯飞600亿元，笑话吗?,18402,2017-07-09,0.5419251212231613
讯飞·译呗便掀起了全球科技界的新浪潮，应美国,18251,2017-07-19,0.9483423188664847
今年不见150,22457,2017-07-19,0.08540668989844502
下午开始15K调整,7677,2017-07-20,0.4116105413755563
国务院刚刚公告人工智能发展规划，明天开盘能否,31031,2017-07-20,0.8898373657149985
科大讯飞一旦被砸下来就赶紧抢筹！,5374,2017-06-30,0.11350514749489371
人工智能龙头股科大讯飞洗盘后，将创历史新高！,29812,2017-06-29,0.9357464285568832
科大讯飞：全资子公司少量持股商汤科技,85439,2017-07-18,0.9173535757728567
伟大公司，我来了,7908,2017-06-22,0.4777448071216617
超越BAT的公司不买，你买什么？,13055,2017-07-03,0.7208497522467021
惊回首，离天三尺三！,10771,2017-07-04,0.9461755321993638
我看很多散户要顶不住了，按道理这时候，几个老,16251,2016-07-20,0.11888841087313395
我来正确分析。科大头部形成。首先业绩中报亏损,20041,2017-07-07,0.7464682796998211
大盘覆巢之下焉有完卵，科大讯飞躲得过初一，躲,13590,2017-07-17,0.8621235308645053
先头部队在任务完成后，是再接再厉，还是马放南,4264,2017-07-16,0.9857912764613695
拿讯飞滴市值说事，呵呵，建议傻散去查查世界语,11904,2017-07-16,0.45156757403912895
科大讯飞要注意10均压制，今日盘前股，龙大肉食,3651,2017-07-18,0.8756761747862596
四十的科大一朵花 看一眼少一眼的黄花,313715,2015-08-13,0.8611406517698698
科大近年无战事 五月刻将向下，十周刻下压股价,381131,2015-08-07,0.9464192439606056
成长股的投资价值不能只看市盈率(2017-07-18 06,3796,2017-07-18,0.9271049928480483
港股通今天买了2.07亿科大讯飞，说明国内基金太,13352,2017-07-17,0.7973470356765686
7月6日讯飞给广西领导，7月11日讯飞给浙江领导,19423,2017-07-15,0.024586883212814215
科大讯飞刘庆峰：AI引爆万亿级大市场，做到这些,29395,2017-06-05,0.9178500810791095
别全怪“熔断”惹得祸,124963,2016-01-04,0.5934061952629924
中科院人工智能发展战略研讨会暨科大讯飞对接会,20735,2017-07-15,0.9994507295380424
买了一个阿尔法大蛋机器人，我用行动来表示,18725,2017-07-09,0.35699822413267823
明牌公司，智能语音尖端科技公司,34981,2017-06-23,0.8369571741277826
明天围棋人机大战！讯飞涨,5901,2017-05-22,0.3288722110956963
抵抗难阻趋势向下，把握反弹逃命的机会。,8975,2017-07-12,0.716499437579806
[有图] 三只票两只涨停，一只9个点，恭喜了,9682,2017-07-12,0.4778774462354147
【投资者传闻求证】发明了声纹+刷脸技术支持p2p,48101,2017-07-13,0.38242754985903704
难道会跌停,5775,2017-07-13,0.05882091050628169
忽悠谁？如此高的市盈率，业绩预减，谁敢买啊？,7527,2017-07-09,0.012640421565366822
阿凡达水平其实是蛮高的,30055,2016-07-13,0.6254834417900319
科大讯飞(002230)融资融券信息(07-11),19886,2017-07-12,0.8359910458932623
话痨坑爹啊 烦达,334427,2016-01-13,0.008922596108250858
配置了乐视的基金，乐视复牌三个跌停应该是板上,22020,2017-07-09,0.7834750066821842
科技股重点布局大湾区三支股票 天源迪科 安居宝,2828,2017-07-04,0.8336791754745432
科大讯飞(002230)高管相关人员持股变动信息(6-2,106474,2017-06-30,0.22649311422827856
放量大跌[兴奋][兴奋],8175,2017-07-11,0.9207706404266921
兄弟们、头部已经形成、拉升是最后跑的机会！,8901,2017-07-11,0.05845442762215858
給别人兑现利润 是不是特别幸福？活雷锋,5076,2017-07-07,0.8828565826432878
科大讯飞(002230)高管相关人员持股变动信息(6-2,89043,2017-06-27,0.22649311422827856
科大讯飞主力今天要扛着出货了。,8649,2017-07-07,0.0987671329491383
高位横盘出货概念股，哈哈哈,6885,2017-07-11,0.8829025762763542
还记得你是来炒股的吗？,190947,2016-01-30,0.4043171039138025
我用行动支持了你，希望你能带给我希望和快乐！,6437,2017-07-09,0.9797470043386756
科大讯飞，第二个巅峰1000亿市值,44269,2017-07-09,0.843785777000685
转自雪球：$科大讯飞(SZ002230)$ 手机标配语音,18080,2017-07-06,0.4589615883052828
科大又到冲关时……,121122,2016-03-14,0.5884628231024429
每当你想走的时候，是不是就有人来坚定你信心了,34732,2016-07-06,0.8026456047970495
科大讯飞是一个不一般，不正常的高科技企业,54932,2017-03-03,0.6823334720138748
科大讯飞-A股最大的互联网公司，人工智能第一股,7604,2017-06-28,0.3249239469725911
7月7日，宏图Brookstone与科大讯飞品牌战略合作,18930,2017-07-08,0.5868691979953711
不敢买600亿市值的科大讯飞买点33市值的格尔软,24144,2017-07-04,0.14710034838310038
科大讯飞：暴风TV使用公司智能电视解决方案,57049,2017-07-04,0.023953691976147384
阿凡达说什么都别理会，理会了贴就顶上去了，这,13140,2016-08-12,0.007494778389305123
科大讯飞(002230)大宗交易数据一览(07-04),118922,2017-07-04,0.28530539792426657
科大讯飞：听见产品已在法院日常会议场景下应用,43369,2017-07-04,0.5121432054441917
观察已久。阿凡达是个给人发贴的五毛，辛苦挣钱,32138,2016-08-11,0.891236915830891
我心目中的科大讯飞,38481,2016-11-09,0.45492236891357685
科大讯飞：与多省市公安机关签署战略合作协议,50753,2017-07-04,0.011369495061212653
科大讯飞要是在美国上市，被麻省理工评为世界最,24705,2017-06-29,0.9320809055900487
庄家成功骗进了部分激进游资在板上进货了，明天,2133,2017-06-29,0.03604636501688929
敢不敢涨上去,1556,2017-07-04,0.22089590294132166
科大讯飞：公司AI技术在超50家三甲医院落地使用,67435,2017-07-03,0.8115390513106204
科大讯飞：占有中文语音市场70%以上的份额,57531,2017-07-03,0.8997637740679267
科大讯飞：智学网已在全国超过1万所学校使用,75584,2017-07-03,0.8545951200727917
吧里这个自称老师那个自称高手,25549,2016-06-29,0.4051713059684572
蚂蚁上树!,15854,2017-06-29,0.6491979825600002
一个会翻译的机器，呵呵呵。,6285,2017-07-02,0.8224974577739497
科大讯飞：现阶段人工智能技术发展不需要“被神,91234,2017-06-30,0.8506100938578646
事件：科大讯飞教育产品已被东南亚及周边国家学,20474,2017-06-30,0.9918171298308527
东撸西悠,205062,2016-07-01,0.16887998595850473
海南省政府与科大讯飞合作发展智能科技,50937,2017-06-30,0.40289906626063443
互动重大利好：加载了人脸识别、语音识别等人工,4097,2017-06-29,0.4298084071793008
涨了，就说你买了，跌了就说你卖了，你就是股神,4970,2017-06-29,0.22481276580745024
全线撒退全力护死亿纬锂能[牛][牛][牛],2505,2017-06-30,0.23130701144491406
九家中国公司上榜全球最聪明公司 里面的A股公司,106962,2017-06-28,0.17243658854733535
海南与科大讯飞合作发展智能科技,37933,2017-06-30,0.675305013067527
正宗吹牛逼公司！,4446,2017-06-29,0.18624387666785525
科大讯飞走势预判图,14587,2017-06-04,0.5943297552211593
求阿凡达不要发帖顶帖的帖发了二次被删了二次。,6264,2016-08-19,0.02250907530436308
增发最终合作对象起码还要两个月以后的事、如果,5180,2015-08-08,0.39886077078722226
36一冲而过，却不护盘，明显在造成压力，洗盘动,6245,2017-06-26,0.51956879943705
昨天卖出600249两面针后用新《飞行模式》出击了,2963,2017-06-29,0.48626913432710883
科大讯飞：讯飞智慧法院庭审系统在全国超过100,67288,2017-06-28,0.08455278134041033
坚守梦想 踏实前行 只争朝夕,16560,2015-08-26,0.9962039341414941
国联证券给予科大讯飞每股123元的估值！赞！,45120,2015-10-20,0.9813557269140092
中线牛股，持有。,4559,2017-06-28,0.11904744598636419
科大讯飞:关于签订募集资金专户存储四方监管协,96259,2017-06-28,0.7612352165467318
哈哈，科大讯飞30.38成交了，终于等到了。,39235,2017-05-05,0.44387308933471803
卖了一半，送红包嘻嘻！,2985,2017-06-28,0.7427589954075258
全球排名第六！超过腾讯排名第八！切买且珍惜~,5398,2017-06-27,0.08340267956034508
科大讯飞全球第六！腾讯第八！百度50名！,13223,2017-06-27,0.10992161139974355
科大讯飞-A股最大的互联网公司，人工智能第一股,10703,2017-06-27,0.3249239469725911
中美人工智能对决 这家中国公司被纽约时报认为,81646,2017-02-04,0.9322003039024627
大道至简，大智若愚。,40083,2016-09-08,0.5884218478069433
白马股再受追捧 科大讯飞海康威视获机构扎堆调,68840,2017-06-25,0.6424931972401084
耍股戏撸话科大,87715,2017-02-18,0.40573618497021446
初心不改 共创未来 —— 科大讯飞董事长刘庆峰,11769,2017-06-13,0.9911509353690358
一月未来看讯飞的朋友们了，今天来聊聊讯飞！ ,11096,2017-06-07,0.601280578403108
科大讯飞否认为王者荣耀提供语音技术,43012,2017-06-23,0.9460709174413063
如何应对自如，涨跌无忧,25649,2017-02-10,0.9397515857886153
波段操作的好股票，五年内不会离开。好行业，好,3840,2017-06-22,0.9099876549175544
科大讯飞： 销售收入或在年末赶上人员增速 增长,73936,2017-06-21,0.9934001576222902
科大讯飞：何时迎来“成人礼”？,12908,2017-06-20,0.07984156726898306
科大讯飞的愚儿节,173268,2016-06-01,0.6747074878009043
怕了吗，原来是这样。,24943,2017-04-11,0.397058823529412
科大讯飞:2017年6月19日投资者关系活动记录表,67670,2017-06-21,0.7585122082657936
现在不是追求利润的时候，如何看待讯飞基本面趋,26545,2017-03-20,0.5290081292944164
