标题,帖子数,日期,情感
科大讯飞 请放大大们出去！,129287,2016-04-11,0.5257015748867134
为什么有人不是蛮喜欢涨，特别是,6873,2017-03-27,0.8960364443401361
呵呵，0.05分的一季报，科讯股价无业绩支撑，早,9140,2017-06-15,0.8839899344806676
讯飞的技术应用到雄安新区建设上,6544,2017-04-05,0.8183759392235989
看磨术的心态变了吗,14779,2016-09-23,0.9452631307156277
马上见千手大单，买进,4067,2017-06-13,0.2070818105087262
【投资者传闻求证】旗下智学网恶评如潮？,22992,2017-06-14,0.9066617577026875
沉痛悼念阿凡达999“48--53元低吸的货”被套一,60006,2016-06-16,0.4844976986751466
阿凡达是不是疯了，每天机械重复顶他自己的老贴,83678,2016-06-16,0.011213489169318636
阿凡达是庄托，他不出来无非是已经套住足够多的,25001,2016-08-03,0.6425995426808271
不同的观点是这样的,24484,2017-03-27,0.6024590163934426
晓译翻译机京东又开始预订！这一次卖断需要多久,51857,2017-05-15,0.16095910051025908
关于讯飞的绝对干货,16921,2017-02-08,0.1281741205125203
科大讯飞:第四届董事会第六次会议决议公告,54888,2017-06-12,0.10049704511839708
刘庆峰在庆祝公司17周年会议上的讲话解读,32702,2016-06-11,0.875802707499434
发几张“**简单”自己发的截图，大家都来看看,49697,2016-10-27,0.10112004744760483
对讯飞的期待先要打一个对折,27216,2017-04-24,0.5879001163461298
万变不离其宗,24157,2016-10-05,0.5
国际化高端人才加盟记,19602,2017-03-22,0.8062211905041736
并不意外，合作多赢,16066,2017-04-07,0.785968235182447
科大讯飞股份有限公司情况调查,14371,2017-06-05,0.36605284663301985
坚持这么做，庄家最难受。,13749,2017-02-10,0.4051665471292307
我所关注的年报数据，是否增长。,12636,2017-03-20,0.9736597163357616
为什么有技术的公司不怕泡沫,21925,2016-10-07,0.35238847695493525
讯飞的价值在未来，着急无用，慢慢来。,35406,2016-05-25,0.9037318255897631
从股吧情绪观察，看来过于谨慎，在观望中踏空的,15226,2017-03-27,0.9265652433453935
你看看，首次参赛就把别人惊呆了,33870,2016-09-14,0.8826900229314364
晓译翻译机预订,53023,2017-04-21,0.35763445098367097
厚积薄发的讯飞，是返璞归真的领头羊（1）,23569,2017-05-12,0.05154973008032604
按既定策略办,23266,2016-08-28,0.8933195208516923
讯飞战略布局之国际化趋势,18763,2017-03-14,0.9862128615662911
科大讯飞:公司章程(2017年6月),25882,2017-06-02,0.23144203306458278
又到相对低位，你又怕了吗？,8097,2017-05-11,0.37220643379052776
35.59有比我成本高了吗？,12856,2017-05-26,0.5309359353251838
安徽有望全省推广语音电子病历 边检查边读出结,14314,2017-03-14,0.7694895238079505
科大讯飞最有可能成为科技蓝筹股,22463,2017-05-24,0.8729303869910089
那个吃屎达就是个托，估计是这个垃圾股派来的托,26425,2016-05-20,0.026710494085422032
震荡筑底区间,72249,2015-11-04,0.7144428827478814
确实不是一般的公司可以做到的，祝福讯飞。,20745,2016-11-22,0.9142636300061369
无所不在的讯飞应用,19514,2017-03-19,0.4450907405736909
科大讯飞(002230)融资融券信息(05-22),6410,2017-05-23,0.8359910458932623
讯飞有可能被收购。技术实力较强，但商业实力非,24944,2017-05-24,0.9980116051566456
有一种幸运叫感恩，应该,32299,2017-02-06,0.9857592000892307
探讨一下减低成本的方法,20926,2017-01-31,0.7820921963694298
科大讯飞与海南省高院签署战略合作协议,44411,2017-05-23,0.09282928281180636
科大讯飞与杭州合建人工智能研究院 探索城市智,49214,2017-05-17,0.9573623322654174
找到了，就是这样。,23695,2016-09-05,0.5778781038374716
讯飞还是那个讯飞，经常变的,16604,2016-07-28,0.5417100377906178
拿别人账号试个手，感觉大部分人还是没耐心的啊,6360,2017-05-15,0.7963760019653098
不到园林，怎知春色如许，央视三次报道科大讯飞,27961,2016-07-24,0.8854042469658397
现在不涨，不等于总是不涨。,15106,2016-07-21,0.3653529794744881
科大讯飞:国元证券股份有限公司关于公司“智慧,21078,2017-05-17,0.8914187332255034
科大讯飞:国元证券股份有限公司关于公司变更部,35337,2017-05-17,0.6602611597633983
讯飞输入法诉百度侵权，要求赔偿经济损失 100 ,27731,2016-10-09,0.0318309909958836
向锤子科技的老罗致敬，因为,33197,2016-10-20,0.9896421234348981
阿凡达必死于屎中,40448,2016-05-20,0.6346726660373618
我的女朋友是在天虹任职的，她说天虹是非常好的,8605,2017-05-15,0.8456416359543745
科大讯飞:关于“智慧课堂及在线教学云平台”募,32533,2017-05-17,0.9985965457046087
明天无论涨跌，都要,17159,2016-07-27,0.30549808078920826
低吸不追高，高抛为低吸的交易计划,18732,2016-12-09,0.034364076795337595
科大讯飞:关于吸收合并上海讯飞瑞元信息技术有,64462,2017-05-17,0.250336831710152
即使科大讯飞十年后将成为超越谷歌苹果百度阿里,80255,2016-03-26,0.9361913671957517
阿凡达999不是个庄托，就是个啥比,53490,2016-04-26,0.29575479972716956
看百度大会，再回看科大发布会,10564,2016-09-02,0.6296188609242945
科大讯飞:关于限制性股票首次授予完成的公告,54910,2017-05-16,0.7592790150808385
科大讯飞在智慧医疗领域的三大布局,14649,2017-03-14,0.9959172024260055
叫空做多又不像，破绽百出。,14935,2017-03-25,0.5870749141514876
我眼中的讯飞：2016年全球最大市值排名前5都是,16590,2017-04-10,0.265662691225077
科大讯飞：智学网已覆盖1万多所学校 未来能商业,43685,2017-05-15,0.9962793713674246
含蓄点有什么不好？,6866,2017-04-18,0.6199133095657076
托到底长什么样？,69581,2015-08-28,0.35873737587190435
那个叫阿凡达999的垃圾又出现了,48935,2015-08-17,0.18803703631292878
科大讯飞:2017年5月10日投资者关系活动记录表,12650,2017-05-12,0.8160617802933711
讯飞的价格趋势,15599,2017-05-07,0.5945365027400302
科大讯飞预计上半年净利润7682.89万元至1.79亿,59862,2017-04-17,0.2096012493661501
所谓武汉网友，中国网友，屙狗凡达，就是一个货,90740,2016-04-19,0.0376367717321342
可以接受这种公司不涨的真实原因,34183,2016-09-22,0.6396010154155481
JD 智能音频解决方案引发行业“共鸣” 布局智能,18823,2016-04-13,0.7885281181800988
不怕讯飞下跌的根本原因是什么？,26279,2016-09-10,0.5305794690270438
只要能定期确认讯飞在成长改进就够了（基本面信,195769,2015-08-11,0.9327369817757647
科大讯飞 到了关健的时刻！ 往下看,16562,2017-05-08,0.6508183092726418
今天高点已到，下午30.0见,11302,2017-05-08,0.06488457473017162
中信这个垃圾还有科大讯飞吗？,2913,2017-03-11,0.5039718992189847
进驻科大讯飞,18293,2017-02-28,0.26978467856272503
参考消息网：在“一带一路”沿线国家中，讯飞的,24319,2017-04-22,0.7817037747628754
科大讯飞一季报怎样看？,15117,2017-04-18,0.4730423647294436
科大讯飞与协和签战略合作框架协议,18441,2017-04-19,0.6761131865479509
科大讯飞与协和医学院达成合作 拟推进人工智能,23212,2017-04-18,0.6101558046871526
一季报毛利下滑现金流大降，中期利润预计下滑70,7763,2017-04-17,0.025887947586677562
科大讯飞:关于签署战略合作协议的公告,100123,2017-04-18,0.2542772524230906
科大讯飞一季报点评：业绩符合预期 AI技术向多,44895,2017-04-18,0.4922127138512009
科大讯飞在2016年10月已相继完成河北讯飞公司的,29598,2017-04-11,0.8457958358459748
科大讯飞就是一个吹牛逼讲故事的公司,7780,2017-04-18,0.40056700159644265
科大讯飞:关于向激励对象授予限制性股票的公告,16307,2017-04-17,0.956136323189257
重金投入AI技术研发和市场推广,43199,2017-04-18,0.3016860862206945
2017排名，讯飞与百度争第一！但我们只能买到讯,14800,2017-04-16,0.074158823049848
操盘笔记,25522,2017-03-25,0.9067445755974359
科大讯飞:2017年第一季度报告正文,41875,2017-04-17,0.8090519075442384
半月没说汎飞了 今天浅聊几句！ 半月前我说过，,11772,2017-04-14,0.04111716971451396
科大讯飞:2016年年度权益分派实施公告,84006,2017-04-13,0.6681935576088397
外长王毅说，要把这个系统引入外交部！,14343,2017-04-12,0.8943974702490934
科大讯飞透露车载领域已与宝马和雷克萨斯等厂商,33529,2017-04-12,0.964296648394309
科大讯飞:2016年年度股东大会决议公告,44376,2017-04-11,0.7824233209838282
科大讯飞是中国纯正人工智能的骄傲！,20213,2017-03-21,0.9968274134506355
人工智能板块后期还有机会吗？,19941,2017-04-10,0.9671261702355937
科大讯飞:2015年年度权益分派实施公告,87444,2016-04-12,0.6681935576088397
年报点评：智慧教育进展可喜，人工智能爆发在即,41994,2017-04-10,0.9563709593081644
600271航天信息，每股收益0.83元，才22元,5330,2017-04-09,0.3949269045314723
开启智能时代 CITE2017在深圳盛大开幕,13595,2017-04-09,0.22437515355977422
科大讯飞下周要在深圳发布《人工智能中国宣言》,23951,2017-04-05,0.7513520864809886
人工智能龙头，开放平台扩张迅猛,55722,2017-04-06,0.754039894355627
如何评价讯飞近期的表现,5849,2017-03-13,0.689243134103101
科大讯飞发布最新产品“翻译领夹” 为了一步到,10672,2017-04-04,0.29932555348435874
冬风来了，春天还会远吗？,23669,2016-11-22,0.9453452315780957
人工智能峰会今日举行 机构最爱科大讯飞等5只白,119265,2017-03-28,0.7325162232260175
人工智能龙头科大讯飞的AB面：主营利润下降 IPO,28075,2017-03-28,0.38888406291826105
科大讯飞：与中国移动浙江公司签战略合作协议,34001,2017-03-28,0.5737730939026363
下午主力再次拉高，逢高还是要减仓！,12205,2017-03-03,0.8849057307335818
科大讯飞(002230)大宗交易数据一览(03-27),28105,2017-03-27,0.28530539792426657
逢高要坚决减仓！,10314,2017-02-27,0.8939953426363553
科大讯飞，一浪的3-4已经基本构建完毕，最迟3月,20326,2017-03-12,0.2623485882186096
科大讯飞连续三周“霸占”热股榜首：去年基金减,28326,2017-03-27,0.2901557555674382
科大讯飞:2017年3月22日投资者关系活动记录表,8967,2017-03-27,0.8567747395462239
科大讯飞:国元证券股份有限公司关于公司发行股,49219,2017-03-27,0.30645341242494417
科大讯飞晓译翻译机,11854,2017-03-17,0.6187501100256326
科大讯飞的小蛋机器人卖的超好，688元一个，每,24754,2017-03-25,0.3544955943723428
事件点评：人工智能龙头，多领域拓展应用,51698,2017-03-26,0.9341759581177198
应用场景不断拓展，厚积薄发潜力无限,37740,2017-03-26,0.9579454772058826
讯飞周末谈！ 先说浪形，数浪很关健，浪如数对,25629,2017-03-12,0.869646798008021
出一个智力选择题吧，活跃一下,18162,2016-07-04,0.9943439996648111
今天到货,12012,2017-03-23,0.45679012345678993
集成电路望成智能应用核心 技术创新战略联盟成,36609,2017-03-24,0.9996892877351092
科大讯飞AI+行业持续发力,27841,2017-03-25,0.7299878684096296
科大讯飞机器人销量突破！,12543,2017-03-24,0.606312566445801
业绩符合预期，长短逻辑兼备的战略标的,24048,2017-03-23,0.9984355867310506
收入高增长，AI 行业持续发力,32405,2017-03-23,0.9971486148112452
就凭科大讯飞的源创技术股价就值50元！,10607,2017-03-19,0.6124429195298332
号外！！！晓译翻译机断货了,36730,2017-03-17,0.07705919133253025
明天如何呢（3月22日）,9294,2017-03-22,0.09426119130765453
科大讯飞:2016年年度报告,35347,2017-03-20,0.7193017738654514
点评报告：人工智能有望爆发，行业龙头引领发展,29440,2017-03-22,0.8484396165378536
营收高增长，人工智能产业化应用持续落地,32849,2017-03-22,0.9257170478889312
下午有个机构让我36速度进仓，，，好家伙，把我,15921,2017-03-22,0.1803811779511998
AI巨匠，即将起跑,42330,2017-03-22,0.7885711534452624
年报点评：拐点已现 龙头崛起,38214,2017-03-21,0.12010003681499304
投入加大致利润低增，人工智能生态加速构建,34304,2017-03-21,0.5433857257428141
科大讯飞:关于举办2016年度网上业绩说明会的公,62778,2017-03-17,0.8087784028165156
战略投入持续加大，多领域业务全面铺开,22237,2017-03-21,0.9969543132027396
人工智能A股样本：科大讯飞“听辨”大格局,26622,2017-03-21,0.14973176721591464
科大讯飞：2016年净利4.84亿 讯飞输入法总用户,41240,2017-03-20,0.7311492017355421
刚看了科大讯飞刘董事长关心大别山深处21个留守,9201,2017-03-19,0.9988422454480468
吉利博越 语音识别率是一种怎样的体验,14910,2017-02-16,0.8514536942483392
科大讯飞:2016年度业绩快报,139299,2017-02-27,0.7081521946682913
2016年业绩快报点评：大力投入加强教育领域布局,43963,2017-03-02,0.9958885376555847
主力缩量十字星释放重磅变盘信号,50792,2016-06-07,0.28962044036092527
携手长安汽车，发力智能驾驶,31371,2017-03-17,0.8748896564646619
而套利做空的，此心是不灭的，尤其是这种交割日,1935,2017-03-15,0.5033357194879108
维持长期看好讯飞投资价值不变，但交易策略要灵,22585,2016-07-04,0.7680420910969032
快看，公司董事长刘总在央视2套上播出！,15564,2017-03-12,0.9884380465140797
人工智能语音交互世界领先科大讯飞2017起飞之年,15376,2017-03-16,0.9753697046840291
科大讯飞已有超大主力控盘,6926,2017-03-16,0.5400121431497886
科大讯飞:关于发行股份及支付现金购买资产并募,49564,2017-03-15,0.5965900084303046
科大讯飞:发行股份及支付现金购买资产并募集配,38836,2017-03-15,0.21028825824626984
所以总体上说，期货松绑后，股市是下跌的，但也,1356,2017-03-15,0.8001318332454572
到昨天才彻底一阳扭转颓势，今天是想旗形突破。,2166,2017-03-15,0.9933205650072301
两会拉动人工智能概念股飙升，百度机会几何？,12871,2017-03-10,0.9515264701223578
领衔主演看空记,16222,2016-04-18,0.7480168106796666
执着叫空“看空”众生相,17297,2016-04-22,0.9822481310163996
成长中的讯飞不完美，如何选择,11463,2016-05-01,0.9930152507699054
不要小看收购乐知行公司的意义,73072,2016-03-22,0.9920004993004942
董事长“带盐”引争议 科大讯飞年内股价涨26%减,37357,2017-03-13,0.960318411291848
临近尾市再次上行，最终以全天最高点3237点报收,2950,2017-03-13,0.18990343139241805
盘中没有出现较为明显的回调，构建了漂亮的诱空,7057,2017-03-13,0.78514654436567
随即早有色，保险及锂电池等拉升下大盘开始不动,1980,2017-03-13,0.027697223712800145
发布的应用超出预期，公司成长的见证,16948,2016-11-23,0.9814682018096943
可是谁愿意做出头鸟呢？谁愿意去冒那个险,2961,2017-03-12,0.9465568792763052
我相信基本面的力量,31802,2016-12-18,0.9884431103746639
科大讯飞已站上风口，昨天强势整理，今天再次起,14778,2017-03-09,0.3711516874468267
回调碰5日线坚决回补！,6323,2017-03-10,0.009184066485463549
为什么没封住？明天该封死了吧,2103,2017-03-07,0.005871793801314418
敢买你就赚,1930,2017-03-07,0.1791799482873473
你了解科大讯飞吗,11222,2017-03-08,0.5517946718912456
科大讯飞(002230)大宗交易数据一览(03-07),43871,2017-03-07,0.28530539792426657
谈谈今天的大阳！！！ 涨停固然好，但破板就有,10581,2017-03-07,0.0908472350909254
科大讯飞连续两日登榜深股通活跃股,28063,2017-03-07,0.30528947499324366
可以跑了哟[大笑][大笑][大笑],2138,2017-03-03,0.8630002817799751
感觉不妙， 不玩了。,5097,2017-03-07,0.5127145789030656
论持久战---探索专注讯飞可行之道,219523,2015-12-02,0.9850859664990304
讲真，科大讯飞的语音与人工智能业务怎样才能真,22096,2017-03-06,0.6658560004521387
科大讯飞产品再度亮相两会 公司股价涨起来,32842,2017-03-07,0.9269746220079966
板块今日暴动，人工智能春天不远了？,39897,2017-03-07,0.9794225835113836
玩转AI ，教育医疗汽车齐发力,51292,2017-03-05,0.7605152338392486
人工智能龙头，教育变现值得期待,41491,2017-03-01,0.8628208506659691
今天讯如果上不去，明日5，10日线将粘合，选择,12092,2017-03-01,0.2402389774419752
连续4天都是获利回吐盘面,9724,2017-02-27,0.7049443665972194
正确认识科大讯飞,60292,2017-01-26,0.7756910545553494
哈哈，严为民看上了科大讯飞。,25523,2017-02-24,0.8267697196922655
股票，是一种修行,8744,2017-02-22,0.7478713963504697
2017年的牛股就是科大讯飞,31973,2017-02-24,0.44771172254830793
希望明天来根大阳！ 这是今天的K线组合结构想向,10611,2017-02-22,0.34360717099993787
人工智能风头正劲，科大讯飞独领风骚！,21706,2017-02-21,0.46632811308668043
转发一篇值得学习的好文,58429,2016-06-05,0.9792285187531871
庄辛苦啦，今天任务完成了。,7713,2017-02-21,0.9535031356315482
测试完长安CS95语音控制，小编全跪了！-今日头,20491,2017-02-15,0.9929893406519609
等会有内容！,9964,2017-02-20,0.46373312748890927
讯飞！！！ 月线，还没到月底，先不谈。 周线，,11633,2017-02-17,0.02232666334647182
创新是什么？创新就是单一来源采购！ 比如科大,13963,2017-02-16,0.609504377237176
打通企业与企业的连接，继续正确认识科大讯飞,9021,2017-02-17,0.17669712148375238
讯飞广告也精彩,19746,2016-10-28,0.43439389658144256
科大讯飞(002230)高管持股变动信息(2-16),22505,2017-02-17,0.2016835743558162
判断错误，大盘今天摔不死，就还要涨2-3天,10092,2017-02-16,0.05024956105086875
干空头是股神，强烈建议跟着干空头做就够了,22664,2016-04-24,0.5421141173565904
空仓空仓空仓,10910,2016-08-04,0.03415533385884573
缺乏自信的表现，一直还在,11123,2016-08-14,0.9814757562915172
不看好，为何不离不弃？,8549,2016-07-26,0.5388471737246909
应对AI产业浪潮 科大讯飞喊出“二次创业”口号,19069,2017-02-15,0.846014594494685
娱乐一下，轻松一刻。除了,5257,2016-09-09,0.9339829393194841
注意年线压力,9620,2017-02-06,0.8077440180096216
这是一家百元股，技术世界第一！,9075,2017-02-14,0.5469031187525358
《价值与成长》,13812,2015-09-18,0.9720760781818776
火力全开，不余遗力，只为,10764,2016-07-05,0.37335046413526807
科大讯飞(002230)高管相关人员持股变动信息(2-6,36880,2017-02-07,0.22649311422827856
科大讯飞:关于限制性股票激励计划内幕信息知情,53601,2017-02-08,0.712553066144035
讯飞的终极目标分析,6857,2016-08-15,0.9859020536500916
投资讯飞完成任务,4418,2016-11-07,0.8433953064518248
科大讯飞:监事会关于公司限制性股票激励计划之,74028,2017-02-03,0.5732577888783911
科大讯飞又上CCTV10,18617,2017-01-25,0.20606671699293155
另一个颠覆：从TO B 到 TO C,20541,2016-11-22,0.8309363740030639
大棋局,17563,2016-11-11,0.505746216935643
熊市可论道,14451,2016-09-09,0.7297953905324696
科大讯飞:关于部分股票期权注销完成的公告,43238,2017-01-23,0.7081521946682943
讯飞答疑 投资真理,29697,2016-12-06,0.9181984610847342
深互动上有人问科大讯飞军工方面的事，不应该问,11265,2016-12-15,0.5619697148287901
低价股权激励居然被吹成前所未有的利好，哥也是,23297,2017-01-18,0.10219959305257187
股权激励深度绑定，加快人工智能应用落地,54027,2017-01-16,0.7566735666094508
语音龙头厚积薄发，讯飞AI生态展翅高飞,78268,2016-11-14,0.4059034446528399
科大讯飞:限制性股票激励计划(草案),33850,2017-01-15,0.6199327031057693
我掐指那么一算，周五尾盘到周一早盘买较合适,14300,2017-01-12,0.17870147894587451
人工智能迎爆发临界点，巨头纷纷布局这五大领域,45500,2017-01-10,0.9912581289625642
讯飞面面观,42836,2016-08-24,0.5724371915964988
胡郁在接受澎湃新闻（www.thepaper.cn）专访,14699,2016-10-07,0.723507871849989
科大讯飞(002230)大宗交易数据一览(01-10),21680,2017-01-10,0.28530539792426657
关于解禁成本是7.49元，本人已向官方求证,79703,2016-04-01,0.08357533214143986
市场关注度不断提升，这几类概念股闻风而动！,37683,2017-01-04,0.8871829821899179
问答讯飞看成长,18088,2016-08-24,0.8509795532642682
科大讯飞暂停评级,90523,2016-03-17,0.7312888539207746
百度大脑要挑战“最强大脑”，李彦宏：代表人工,16478,2016-12-17,0.9831060097534747
科大讯飞:关于解除一致行动协议暨公司实际控制,45819,2016-12-26,0.4451235670747803
深股通连续两日净买入科大讯飞,30832,2016-12-29,0.36641184834056095
科大讯飞:关于召开2017年第一次临时股东大会的,29250,2016-12-29,0.7245026522714456
关于讯飞的新视点,18737,2015-09-18,0.8161554236318606
科大讯飞:简式权益变动报告书,30190,2016-12-26,0.3928544748467163
科大讯飞就是一个彻头彻尾伪科技公司！一个臭狗,6179,2016-12-25,0.2595271506990041
科大讯飞:国元证券股份有限公司关于公司非公开,51189,2016-08-16,0.6625255360374248
科大讯飞:国元证券股份有限公司关于公司非公开,51229,2016-04-19,0.6625255360374248
只有在跌下来之后 才知道狗托们都无耻 也只有跌,9273,2015-08-27,0.011463098119394388
适者生存，抱怨无益。如何,6609,2016-07-29,0.8087552623282703
科大讯飞与新东方成立合资公司 专攻智能识别口,19004,2016-12-15,0.4064648310330702
科大讯飞:关于首期股权激励计划第三个行权期集,40905,2016-12-18,0.5911462412916222
讯飞有哪些重要合作伙伴?请大家接力！,16612,2016-11-25,0.11142662522535429
新闻播报，免费广告，这公司,18757,2016-07-23,0.6385769320219448
现在是最困难最难熬的时期！看谁能坚持住！,7157,2016-12-07,0.7029274058571428
俞敏洪：携手科大讯飞让教育智能化更进一步 原,8274,2016-12-15,0.9981653999511069
科大投资价值凸现 隐性资产高达50亿以上！60066,8394,2016-11-28,0.9820771028958729
科大讯飞智能语音庭审系统通过最高法专家鉴定 ,13095,2016-12-13,0.6720474495992514
讯飞的磨底可能还要持续3-4个月,11342,2016-11-29,0.19687856328125053
既无独门技术又没实体！只会讲情怀！,4964,2016-12-05,0.798931754461439
天天跑几千万跑了3个月了还没跑干净？,2957,2016-12-09,0.352627826852455
是否存在大股东违规减持？是否存在利益输送？,2378,2016-12-08,0.20618106207170273
什么破股！一天一个新低！,3949,2016-12-09,0.04470988464385095
我今天开始建仓28.5附近买买买，打算持股过大年,4487,2016-12-09,0.07938274917177257
下个礼拜破28，抢反弹的你小心，远远没有跌透，,8649,2016-12-09,0.023253272326152263
新华社  人工智能将成顶尖专家？ 2016-11-30 屈,12487,2016-11-30,0.7277953449683086
发布会观感,19539,2016-11-23,0.40306518103660505
转发一篇值得分享的好文,48196,2016-05-14,0.9755023382671206
科大讯飞拟举行2016科大讯飞年度发布会,27244,2016-11-20,0.3860862921049093
目前，寒武纪公司正紧锣密鼓地将自己的芯片推向,7542,2016-11-30,0.5266207877305759
最近大家可能有一个感觉，就是只挣指数不挣线。,6783,2016-11-28,0.4794259009788878
讯飞也是一年来没怎么动过的股票了，发布会的热,12872,2016-11-26,0.22532853940385722
大盘接近通道上轨3267，深港通预计下周一出，短,7744,2016-11-23,0.06458574013049956
002230科大讯飞下周涨幅30%！,14478,2016-11-25,0.447151706363352
本月初两中签，善待他人随遇而安,13107,2016-11-11,0.9454167972511316
科大讯飞为何被“围攻”三十分钟？,14981,2016-11-25,0.46370249559694077
TMD,今天错过了建仓良机,7602,2016-11-23,0.19999999999999996
要以平常心看待11月23日的到来,18617,2016-11-11,0.7480134851037898
今天不卖，接下来的日子还要惨，,7305,2016-11-24,0.15695086845140194
利好不涨是利空，问题是利空他也跌不下去啊，这,5345,2016-11-23,0.057089821824753195
科大讯飞与东北师范大学共建“人工智能与教育融,8433,2016-10-30,0.9942050383553227
科大讯飞就是骗子加流氓，,2917,2016-11-22,0.010848445121796613
唱空唱多都与我无关，我相信三到五年内，科大讯,7029,2016-11-22,0.6888687612990267
科大讯飞:关于发行股份及支付现金购买资产并募,39160,2016-11-22,0.5965900084303046
老子本不想谈股价，现在对你们实在看不下去了。,9633,2016-11-21,0.6698533457711773
研报上说目标价35元？,3743,2016-11-22,0.8366929665294661
喜报科大讯飞人工智能深度学习，战胜IBM，获美,8034,2016-11-21,0.999296063938004
喜报  科大讯飞认知智能研究再传佳绩 包揽国际,11026,2016-11-21,0.9006826292619141
下周三个低吸档位,4844,2016-11-20,0.2541959350970071
整天吹牛逼，世界互联网大会你有资格参加吗？,9986,2016-11-16,0.9948019950117811
在接呢？,2349,2016-08-11,0.4194528875379938
学习佳作，理性投资,14995,2016-05-14,0.999644915597686
科大讯飞:对外投资管理制度(2016年11月),27984,2016-11-18,0.82591023792601
