标题,帖子数,日期,情感
张近东关注中国足球发展，认为应该扩大足球人口,9824,2017-03-09,0.8551211761186678
扶持 500 家重量级合作伙伴 苏宁公布平台“聚”,12505,2017-03-08,0.2911768344973694
张近东的政协报告处处以小见大，对于经济发展苏,17121,2017-03-09,0.9960759672660304
苏宁易购献礼女神，女人就要对自己狠一点,11786,2017-03-09,0.7749364982745305
张近东两会提案：扩容中国足球联赛,11156,2017-03-09,0.09691453424486907
苏宁金融具有强大的风控技术，消费者可以放心投,15712,2017-03-08,0.9973440918752841
苏宁品质联盟的目标是共同为用户提供货真价实的,6861,2017-03-17,0.9933993295619791
苏宁联合四大厨电品牌老板、方太、西门子、华帝,11011,2017-03-08,0.9519571885335938
苏宁与长虹强强联合，在以往合作基础上再添新砖,10961,2017-03-09,0.9314231175420338
大数据解决金融发展痛点 苏宁金融智能案件分析,13555,2017-03-10,0.9999991772482267
海尔与苏宁深入合作，将最大限度进行资源共享,11837,2017-03-08,0.5930747996499317
科沃斯将借助苏宁平台为消费者带来更多立体式场,11516,2017-03-08,0.9367218148136376
升级产品 开80家体验店  苏宁携手华帝启动年度,11637,2017-03-08,0.9003211258794162
苏宁与美的小天鹅有了更深层合作，达成70亿战略,11928,2017-03-08,0.9998479547470687
苏宁爱心盒子温暖山区孩子的心,11386,2017-03-08,0.9997503631749506
消费者更加重视品质消费，苏宁进一步丰富销售场,7263,2017-03-10,0.6343288854892961
电商排名,29133,2017-03-13,0.31604743434026994
看张近东的两会提案，他更关心的是中国足球,7168,2017-03-09,0.7687628180783445
苏宁云商(002024)融资融券信息(03-07),13707,2017-03-08,0.9966477929911505
重磅来袭！德施曼联手苏宁即将发布新品指纹锁T7,13089,2017-03-09,0.5523908512782308
苏宁的终极目标是聚焦生态开放，更多地服务民生,7901,2017-03-09,0.9998787807865426
苏宁联合德施曼研发智能门锁  指纹、手机蓝牙、,10664,2017-03-10,0.2761491116109174
莱克与苏宁加强合作，双方将合作目标定为3亿,11500,2017-03-08,0.5915780937072415
迎战风口 苏宁厨卫携手A.O.史密斯搅动燃热市场,9655,2017-03-10,0.960424085174638
华硕高端商务笔记本“灵珑”在苏宁易购独家首发,9501,2017-03-08,0.36276762589623957
品质升级 价格优惠 苏宁携海信容声让鱼和熊掌兼,12528,2017-03-10,0.20679412011383702
小米总裁林斌造访苏宁，带来100亿订单,19858,2017-03-08,0.9965330898616545
苏宁云商(002024)大宗交易数据一览(03-07),37087,2017-03-07,0.9588214143783317
关心税务管理，张近东坚持税务管理电子化的提案,6779,2017-03-09,0.025500713626410376
张近东提议，保障青训建设，扩容足球联赛,18326,2017-03-09,0.15216445768108622
苏宁喊你换彩电啦,7154,2017-03-09,0.7996665411417079
喜迎妇女节 苏宁金融发起“幸福女王”评选,12313,2017-03-08,0.998944897767878
苏宁携手9大国品掌门人亮相央视   “琴瑟共鸣”,9323,2017-03-10,0.9999069624897208
苏宁把线上线下相融合的方式做到了极致,13003,2017-03-09,0.9896192679660187
苏宁体育传媒又把2017赛季中超联赛独家新媒体版,10977,2017-03-09,0.43774822104649946
扶持500家重量级合作伙伴 苏宁公布平台“聚”计,8393,2017-03-08,0.42517722223411913
50家零售数据继续回升，高端消费复苏延续！增持,16850,2017-03-13,0.9116335511070798
苏宁易购用大数据证实，老百姓更愿意为高品质数,7412,2017-03-10,0.9999453463914573
灵珑笔记本将成为华硕和苏宁合作的良好开端,14596,2017-03-08,0.7981549331309677
苏宁众筹项目成功，声音盒子踏上爱心旅程,11093,2017-03-08,0.9637619702532992
莱克到访家电3C峰会，与苏宁签下3亿销售计划,11015,2017-03-08,0.6100696642251117
以后多多关注苏宁易购,6596,2017-03-08,0.9788467333785896
张近东：中国是世界增速最快经济体 苏宁对前景,11488,2017-03-08,0.9896412603405835
今天你升级了吗？苏宁金融APP升级扫码支付最高,7471,2017-03-09,0.994326935006064
苏宁80元买了阿里巴巴140亿元的股票 现在赚多少,11689,2017-06-09,0.9163403809112932
永辉将超过苏宁,4281,2017-04-20,0.8336929884341451
苏宁携手海信容声启动“海信容声品牌盛典”，为,15867,2017-03-10,0.9974015324599035
2017家电3C全球峰会惊现机场  4架飞机现场助阵,12039,2017-02-28,0.059832109762001484
苏宁云商:第六届董事会第一次会议决议公告,33585,2017-03-02,0.9251668191410591
苏宁引爆“315品质国货节” 网红探厂看“真品质,8277,2017-03-15,0.966285616382831
这个国货节炒鸡有料，服务与品质双管齐下,7882,2017-03-17,0.8840845704859448
家电3C峰会盛大召开，莱克与苏宁实现战略合作,8836,2017-03-08,0.9916653870139932
苏宁爱心盒子为山区孩子构建一个多彩的世界,7148,2017-03-08,0.9993120232862739
苏宁拥抱时代技术，积极创新零售业态，提升消费,12024,2017-03-10,0.9956188685152423
苏宁亚冠前瞻:盼止住颓势 特谢拉勤王冲3连胜,6747,2017-03-14,0.9556114969038347
苏宁与飞利浦展开深入合作，开启电动牙刷风潮,10338,2017-03-08,0.9374534699531756
2017年消费复苏已经到来,11049,2017-03-13,0.6174822600902998
今年建议关注苏宁云商，步步高，中国电建，南宁,10851,2017-03-08,0.9784149689905519
2017年合作还将继续，科沃斯预计将在苏宁易购推,10682,2017-03-08,0.11716526916111825
苏宁云商:董事会关于召开2017年第三次临时股东,21517,2017-03-20,0.9339246484161655
博西家电与苏宁2017年继续加大合作力度，制定15,12809,2017-03-08,0.6297746748693641
依托大数据技术，苏宁金融开发多项技术，全力提,7649,2017-03-17,0.9931310696443438
线上销售猛增赶超京东趋势,5384,2017-04-11,0.6865879951608388
fa 发公告，苏宁电器又增持五十亿。[胜利][胜利,12618,2017-03-13,0.986521899803694
PPTV头部优质内容全面开花，苏宁文创在内容上的,5876,2017-03-17,0.4901866274764294
苏宁云商(002024)融资融券信息(03-17),9888,2017-03-20,0.9966477929911505
苏宁此时状态正好，对战大阪钢巴更有看头,8495,2017-03-15,0.9996313058188232
四大厨电品牌强势加盟，苏宁场景式营销受欢迎,6117,2017-03-08,0.9827727209227871
苏宁云商(002024)融资融券信息(03-16),9982,2017-03-17,0.9966477929911505
聚焦公益事业，苏宁为山区孩子带来爱的礼物,9982,2017-03-08,0.9998970873392982
海信为苏宁线上用户提供2款多门冰箱，直供6万台,6396,2017-03-08,0.3589514148771641
玩直播，看测评，再购物这样的女神节很爽,16112,2017-03-08,0.9914205203441284
加强数据共享，苏宁为合作伙伴提供数据营销便利,6676,2017-03-10,0.9684231847368613
苏宁开放大数据，为合作伙伴提供全方位的支持,11025,2017-03-09,0.8991398954549297
扶持500家重量级合作伙伴 苏宁公布平台“聚”计,13012,2017-03-07,0.42517722223411913
莱克参加家电3C峰会，与苏宁达成3亿战略合作目,8963,2017-03-08,0.9858048589361751
苏宁携手50大品牌共建“知识产权保护生态联盟”,13110,2017-03-10,0.9999464486809636
再造苏宁：张近东的新零售时代,36302,2017-03-14,0.9026536081119473
品质生活成为新“风口”，苏宁联合九大家电企业,11057,2017-03-10,0.9951694520518085
苏宁重新定义手机卖场,6018,2017-03-09,0.947092757114064
华硕于苏宁易购展开合作，将有七成新品在苏宁首,9064,2017-03-08,0.9959987679996594
苏宁联合德施曼研发智能门锁  指纹、手机蓝牙、,15744,2017-03-11,0.2761491116109174
苏宁消费金融获“江苏省放心消费创建示范单位”,15008,2017-03-08,0.9958726279345055
苏宁旗下PPTV智能电视首次参展AWE,9499,2017-03-13,0.9532219566285172
苏宁的发展壮大也是带动了经济发展，中国需要更,10176,2017-03-09,0.9998206313959039
扶持500家重量级合作伙伴 苏宁公布平台“聚”计,12924,2017-03-07,0.42517722223411913
政协委员张近东：消费升级新机遇将助力O2O零售,9456,2017-03-15,0.2569776261687404
十五年时代在变，张近东的提案也在变，始终与时,10853,2017-03-09,0.842945378756195
“四个聚焦”苏宁全面提升发展速度,6706,2017-03-09,0.9978407680671953
【投资者传闻求证】“猫宁电商”现在开展的是什,40841,2017-03-10,0.9942751563582195
苏宁签约40家重点商户，努力实现发展共赢,11272,2017-03-09,0.9585658800053888
苏宁在AWE环境论坛发福利  1万个家庭可免费试用,9149,2017-03-13,0.9938125890186381
苏宁发展前景广阔，家电3C大佬争相落地苏宁,11668,2017-03-09,0.9999969188699854
关注中小创绩优股！,10215,2017-03-13,0.87508396878469
苏宁体育传媒拿下 2017 中超新媒体全场次独家版,10716,2017-03-06,0.2172009934507091
今日15点，全国政协十二届五次会议新闻发布会将,9503,2017-03-02,0.7535023683788663
苏宁的“新空计划”对空气净化器知识的普及有重,6779,2017-03-08,0.9824430859831119
用app扫码付款享受立减优惠？对的，苏宁金融app,4480,2017-03-09,0.9973604824971709
苏宁提出了O2O融合和场景化销售，让人们看到了,7581,2017-03-09,0.9851751152607461
苏宁打造 3 月 OLED 有机电视节 今年或将成 OLE,13960,2017-03-06,0.975320924274058
苏宁打造家电3C行业的“广交会”，众多品牌商前,5794,2017-03-08,0.9998274897741124
张近东认为政府可与企业紧密协同、互联互通，打,4277,2017-03-09,0.5548291672213082
张近东抛出了开放大数据的橄榄枝，全面开放苏宁,6856,2017-03-09,0.9829863023329055
飞利浦团队现身家电3C全球峰会 “星火计划”曝,9491,2017-03-02,0.8216491450647326
江苏苏宁发布亚冠主场首战海报： 17 同行！,11099,2017-03-02,0.020383758394776463
物流快递朝阳行业...,17749,2017-03-01,0.5173635422905969
买买买，2017翻倍。,15607,2017-03-07,0.4178288077673197
全渠道运营时代来临 苏宁华为强强联手,15410,2017-02-28,0.9974629014002699
第一批FOF产品将诞生,11708,2017-03-03,0.8581504924078481
全国政协委员张近东：对今年有信心，企业要努力,4415,2017-03-06,0.8242076606052402
年度冲刺 20 亿 苏宁携手美菱发力大容量冰箱市,9175,2017-03-06,0.9663040676223178
苏宁美的2017厨卫首战西南 全国再建90家体验馆,8669,2017-03-02,0.5384179891548034
彭博：环保部等4部委和6个省市2月下旬联合印发,9347,2017-03-02,0.7565033004460738
张近东两会提案：扩容中国足球联赛 保障球员生,11244,2017-03-02,0.3017704186845094
苏宁云商:2017年第二次临时股东大会的法律意见,26124,2017-03-02,0.9987258003849433
苏宁云商:独立董事关于公司聘任董事会秘书的独,16601,2017-03-02,0.997795024671417
莱克到访家电3C峰会 与苏宁签下3亿销售计划,9533,2017-03-01,0.6100696642251117
与江苏省家庭服务协会达成战略合作 苏宁帮客全,9705,2017-03-06,0.9934358195824037
苏宁取代华人文化 成体奥动力控股方,9008,2017-03-01,0.9982934350731586
莱克与苏宁继续合作，达成了3亿的战略合作目标,10728,2017-03-08,0.9810998724227443
苏宁云商:总裁工作细则(2017年3月),22948,2017-03-02,0.9661749680839115
体奥动力即将易主 苏宁取代华人文化成大股东,14489,2017-02-28,0.9996300121703252
苏宁云商(002024)融资融券信息(03-08),14053,2017-03-09,0.9966477929911505
海尔2017年将有多款新品在苏宁首发,6651,2017-03-08,0.694985338776239
工信部等四部委印发促进汽车动力电池产业发展行,10262,2017-03-02,0.9154452599688219
O2O零售打造电商生态群 家电市场迎来“精准营销,9808,2017-03-02,0.9810795544521074
美国总统特朗普：要求国会批准1万亿美元的基建,17645,2017-03-02,0.3066985151726245
苏宁接棒乐视体育,11151,2017-03-03,0.961350310253001
中金公司维持目标价 18.9元，对应2017年约1倍P/,25666,2017-03-06,0.6023732343799141
科沃斯董事长到访苏宁,8886,2017-03-08,0.9855298943400035
张近东两会提案：扩容中国足球联赛 保障球员生,8984,2017-03-06,0.3017704186845094
苏宁小米超级品牌日大幕将启 “松果”新机首度,9245,2017-03-06,0.8265059074109008
科沃斯董事长到访苏宁 未来智能机器人可取代琐,7577,2017-03-02,0.9900442208106939
苏宁金融 2016 年交易额增长超 150% 连续盈利,12290,2017-03-02,0.9994222286656758
布局提升大数据风控 苏宁金融聚焦核心竞争力,11749,2017-03-02,0.9999420526376943
昨天土财主我上点山货！11.16成本80000股，开盘,11670,2017-03-07,0.10423713470016172
身为国米球迷  我支持苏宁,8322,2017-03-01,0.9697652359032186
布局精准单品 提升线下体验 2017苏宁携手博西家,8730,2017-03-02,0.9986317814947386
刘士余：中央银行正在牵头一行三会、有关机关在,10717,2017-03-02,0.17275552158779173
布局精准单品 提升线下体验  2017苏宁携手博西,8373,2017-03-02,0.9991208972041091
凤凰网：苏宁与美的小天鹅签订70亿战略协议,9132,2017-03-02,0.986109970818184
百年夏普王者归来 苏宁开放全渠道资源力挺鸿海,12983,2017-03-01,0.9999601573478494
汪嵩发长文谈转会:感谢球迷支持 感谢苏宁认可,11159,2017-03-02,0.9937554314355962
苏宁云商:2017年3月2日投资者关系活动记录表,9025,2017-03-02,0.9943803102497228
两融余额连升三日，续创一个半月新高,7583,2017-03-03,0.7334358911710265
苏宁投资天天快递小哥~估计也是可能会补涨了！,11194,2017-02-28,0.9837203617653549
苏宁取代华人文化 成体奥动力控股方,32584,2017-03-01,0.9982934350731586
央行：2月通过MLF和SLF工具投放4138.53亿流动性,8241,2017-03-02,0.4351346070352944
苏宁云商包含哪些内容？,14166,2017-02-28,0.9877150565067496
设想试买后：近期阿里新经济概念与顺风快递上市,11597,2017-02-28,0.6955481041734902
张近东在15年履职全国政协委员的经历中，曾多次,9923,2017-03-09,0.8199738120342381
政协委员张近东对于中国足球发展有自己的看法,13636,2017-03-09,0.9190459706578955
淘宝入股20%，顺丰也要入股20%，市场股权互相融,13267,2017-02-28,0.9268509362201188
苏宁上线＂大咖来了＂ 家电 3C 工厂合力开年秀,13984,2017-03-02,0.9989901792555406
林斌带100亿订单到访苏宁  3.3小米超品日打响第,10167,2017-03-02,0.9773100645603058
苏宁金融APP版本升级啦！首次登录扫码可享受立,9798,2017-03-09,0.9994235349776308
苏宁张近东开放供应链 康佳率先接入共谋OTT大格,11169,2017-03-01,0.604872963252995
苏宁金融APP,12536,2017-03-09,0.9945599458743838
苏宁云商(002024)融资融券信息(02-28),10509,2017-03-01,0.9966477929911505
分享大数据，开放经营，苏宁为自己赢得了更多的,11790,2017-03-08,0.9989492798216671
苏宁上线数据超市  让合作伙伴尝到“数据营销”,13958,2017-03-09,0.7825851864938629
超过乐视网,9653,2017-03-06,0.5472009472403715
商务部：中国坚决反对韩国萨德部署，韩国部署萨,8657,2017-03-03,0.904279401904815
产品将更优质，消费体验更好，苏宁美的小天鹅团,5932,2017-03-08,0.9818871127656632
明天会补涨...,9802,2017-02-28,0.4170241388660675
空调行业迎升级，苏宁会盟抢风口,11370,2017-02-28,0.5426963343403164
四大战略布局,14783,2017-03-08,0.9709804431750888
政协委员张近东：政企共建社会化数据体系,12179,2017-03-02,0.850801046536238
根据成都蓉生向中生股份购买北生研100%股权和长,10147,2017-03-03,0.9052800685238472
苏宁云台2017首场招商会开幕 剑指300亿销售额,11102,2017-02-27,0.9087361866757037
风控体系完善，苏宁金融是老百姓可以放心投资的,10020,2017-03-08,0.9999961056097142
国土部等三部门将于3月至8月在全国开展煤矿超层,9667,2017-03-02,0.026933127278087055
天极网：科沃斯董事长到访苏宁 未来机器人取代,8934,2017-03-02,0.9971020673855241
苏宁打造O2O零售集群 实现业绩快速增长,13496,2017-03-02,0.9986641553800708
北京青年报：北京下一步将对自住房销售政策进行,8060,2017-03-02,0.4746835435055554
苏宁云商:执行委员会工作细则(2017年3月),20704,2017-03-02,0.9873700482633011
苏宁云商 2016 年营收 1486 亿，线上业务同比增,17515,2017-03-02,0.9665323361427169
3月1日开始正式常驻苏宁云商吧,11945,2017-03-01,0.9333172495018734
光大证券调升盈利预测，维持未来6个月15元目标,11411,2017-03-06,0.8636411480691428
工银瑞信旗下工银瑞信丰淳半年定开债券基金宣告,8907,2017-03-02,0.9914501354244954
苏宁云商:独立董事关于公司聘任高级管理人员的,15673,2017-03-02,0.9659857215950133
苏宁云商:2017年第二次临时股东大会决议公告,36247,2017-03-02,0.9864325876674415
苏宁易购瞄准“她经济” “闺蜜节”美妆美食一,9455,2017-03-02,0.9942965684874844
s业绩暴增9倍小盘绩优低价绝对估值安全股食品安,6406,2017-03-01,0.9610400206933358
“宠爱”在心口难开？ 苏宁超市替学子“表白”,9605,2017-03-02,0.9993456777058856
发改委：今年全国32个省级单位固定资产投资将达,8960,2017-03-02,0.7943528709627141
苏宁易购瞄准“她经济” “闺蜜节”美妆美食一,8693,2017-03-06,0.9942965684874844
苏宁“平安精灵声音盒子”众筹成功 918名盲童和,2635,2017-03-06,0.11101769462374911
苏宁荣耀超级新品日 72 秒狂扫 20000 台！,10943,2017-03-02,0.99782606902925
联合四大厨电品牌 苏宁打造全国最大餐饮体验计,9016,2017-03-01,0.9981614601465749
发改委等7部委：充分发挥财政资金的引导作用，,9475,2017-03-02,0.9949021176413697
联合四大厨电品牌 苏宁打造全国最大餐饮体验计,8024,2017-03-02,0.9981614601465749
天风证券：16Q4主业扭亏为盈 苏宁发展迎来新拐,10285,2017-03-02,0.856536632131192
苏宁接过顺丰的枪，带领物流板块领涨大市！,10295,2017-02-28,0.5894529997119998
工信部部长：今年将加大新能源车充电桩建设力度,12962,2017-03-06,0.004189125381339864
林斌带 100 亿订单到访苏宁 3.3 小米超品日打响,13123,2017-03-02,0.9773100645603058
苏宁张近东开放供应链 康佳率先接入共谋 OTT 大,12759,2017-03-02,0.6350224662838753
央行进行连续五日净回笼,8046,2017-03-02,0.6613093254568877
莱克到访家电 3C 峰会 与苏宁签下 3 亿销售计划,8334,2017-03-02,0.6100696642251117
构筑零售生态闭环,13418,2017-03-08,0.6201303248115865
深化2017年战略合作 苏宁与艾欧史密斯定下30亿,12017,2017-03-02,0.9984904770719508
战胜武汉，苏宁女足取得全国女足锦标赛第五名,10505,2017-03-06,0.5033979518377073
苏宁云商(002024)融资融券信息(03-06),13111,2017-03-07,0.9966477929911505
中泰证券维持目标价19.61元和买入评级。,18151,2017-03-06,0.8491023543587337
2016年我国农村网络零售额8945.4亿元，占网络零,9661,2017-03-06,0.9298564902528111
苏宁云商:2017年3月1日投资者关系活动记录表,8894,2017-03-02,0.9942868719369435
刘强东：保证京东快递员的收入要比县长高,13182,2017-03-03,0.9489673707895747
17年苏宁实现高速增长,10408,2017-03-01,0.981393005487862
全渠道运营时代来临 苏宁华为强强联手,13999,2017-03-02,0.9974629014002699
楼市调控力度远超投机客想象 调控政策已涉及28,9730,2017-02-27,0.7314590751543737
张近东乐观看待经济增长  五提案聚焦消费升级机,13174,2017-03-06,0.9828672438537492
苏宁长虹敲定“小目标”： 2017 年线上增长 200,16386,2017-03-06,0.9913802839749
2016年《政府工作报告》三十多项硬指标有的达标,8506,2017-03-02,0.9727531346987394
苏宁云商线上业务增长60.14%,11394,2017-03-01,0.9881043380420691
飞利浦与苏宁达成共识，发布电动牙刷“星火计划,9387,2017-03-08,0.9784038376178168
九阳苏宁敲定： 2017 腾飞元年实现 10 亿新突破,9505,2017-03-02,0.9969250957732082
苏宁易购已遍布全国城镇,16139,2017-03-01,0.9366340207864036
2 月中国物流业景气指数为 53.2%环比回升,13090,2017-03-06,0.6110222621063
持有公司股票，就该上苏宁易购购物！,22897,2017-03-05,0.9040317121481625
空净大佬来苏宁“搞大事” 将重磅启动“新空计,3221,2017-03-06,0.7894203555089132
杭州房管局：3月3日起进一步调整住房限购政策扩,12331,2017-03-03,0.42323504024703973
苏宁长虹敲定“小目标”：2017年线上增长200%,9673,2017-03-02,0.9924988159886396
苏宁云商(002024)融资融券信息(03-03),13436,2017-03-06,0.9966477929911505
去年家电市场利润总额同比增两成,14916,2017-03-02,0.6692378070979623
苏宁云商2017谈“聚焦” 佛山打造家电亿元俱乐,34505,2017-03-02,0.9997916369865907
业内称，2月一手住宅成交量接近2008年同期低位,8697,2017-03-03,0.08963031431756507
未来一年到两年，银监会最重要的工作将是金融风,8461,2017-03-03,0.9901649256835002
北京今年将推进20条轨道交通线路建设再创历史新,14382,2017-03-03,0.9948658495628497
空净大佬来苏宁“搞大事” 将重磅启动“新空计,12542,2017-03-02,0.7894203555089132
杭州市进一步调整住房限购政策：扩大限购范围 ,13861,2017-03-03,0.47113545705313165
我陪着苏宁成为牛股 陪近东成为中国新的首富,12031,2017-03-01,0.9970336940464034
苏宁体育传媒拿下2017年中超联赛独家新媒体版权,11558,2017-03-06,0.07564959902793778
苏宁云商(002024)新攻势有望一触即发,16192,2017-03-01,0.9872680285789461
2024必定有厚报,14102,2017-03-01,0.5486976325915089
中国网：年度冲刺20亿 苏宁携手美菱发力大容量,9343,2017-03-02,0.9915421242855333
苏宁超市闺蜜节直播带给用户直观体验 两小时拉,12424,2017-03-06,0.9982565706992218
苏宁云商(002024)融资融券信息(03-01),11076,2017-03-02,0.9966477929911505
深交所：2016年创业板合计营收和净利润增速达近,14060,2017-03-02,0.47588230677231425
政协委员张近东：政企共建社会化数据体系,9717,2017-03-02,0.850801046536238
张近东：苏宁技术研究院将联手合作伙伴，护航零,9749,2017-03-06,0.31175958817519056
两融余额突破9100亿，续创一个半月新高,9224,2017-03-02,0.9834576641052103
10月1日起三大运营商全面取消手机国内长途和漫,8975,2017-03-06,0.04759799643777707
松果的”第一次”给了苏宁 苏米为啥这么亲,12481,2017-03-02,0.9116708303622943
苏宁张近东开放供应链 康佳率先接入共谋OTT大格,12541,2017-03-01,0.604872963252995
苏宁荣耀超级新品日 72秒狂扫20000台,12712,2017-02-28,0.99782606902925
交通部：今年将力争再降 400-500 亿元物流成本,9264,2017-03-02,0.029418956093317572
苏宁荣耀超级新品日 72秒狂扫20000台！,11776,2017-03-01,0.99782606902925
楼市调控力度远超投机客想象 调控政策已涉及28,9233,2017-02-27,0.7314590751543737
康佳与苏宁达成战略合作协议，三大维度谋求OTT,13104,2017-03-06,0.9532755616239029
方正宏观任泽平：战略看多A股，结构性牛市,9638,2017-03-02,0.9968323342559899
今天上涨的逻辑是什么？,10951,2017-02-28,0.27142262057517175
维持未来六个月15 元的目标价以及买入评级,9554,2017-02-28,0.9628112987791391
直击大佬两会上精彩发言,17614,2017-03-06,0.944495771814799
亚冠-特谢拉梅开二度 苏宁主场赢球获两连胜,9503,2017-03-06,0.9592908028104842
苏宁云台2017首场招商会开幕 剑指300亿销售额,11559,2017-02-27,0.9087361866757037
苏宁云商(002024)融资融券信息(03-10),13645,2017-03-13,0.9966477929911505
郑州苏宁开展阳光1+1植树活动 百位会员为大自然,11624,2017-03-14,0.9958378335045398
苏宁云商(002024)融资融券信息(03-09),15516,2017-03-10,0.9966477929911505
欧盟委员会如期决定将针对中国光伏面板反倾销关,8143,2017-03-03,0.4813125572520206
十三五期间中石化计划投资2000亿元，升级打造4,11940,2017-03-03,0.739036471005605
连续四年建言电子税务 张近东呼吁税务管理电子,16595,2017-03-06,0.030585946648666096
海信总裁刘洪新到访苏宁 谋划2017年120亿大目标,16042,2017-03-02,0.9986457328900553
贾康:调控应将短期治标与中长期治本相结合,14346,2017-03-03,0.8611475278736033
构筑零售生态闭环 苏宁与美的小天鹅签订 70 亿,9010,2017-03-06,0.9541694870209608
最喜欢中超联赛了，以后就在苏宁体育传媒平台看,11418,2017-03-09,0.9293043371187716
天风证券17年目标价18.71元，上调盈利预测，上,21912,2017-03-06,0.937651857546492
苏宁田睿：破除渠道界限的O2O，是罗盘针为零售,10454,2017-03-06,0.9970235709819875
银监会：“三会合并”传闻称系谣传,8008,2017-03-03,0.7781003722992592
苏宁优惠活动，女生节体验女王特权,6463,2017-03-09,0.9943739237563212
落实创新发展  改革造福民生 全国政协委员张近,8732,2017-03-06,0.9990584430075437
苏宁云商:第六届监事会第一次会议决议公告,20092,2017-03-02,0.9251668191410591
中金梁红团队两会前瞻：预计宏观政策维持稳定,12719,2017-03-03,0.6504199039474323
PC行业2017年聚焦苏宁易购 150款新品集中首发,15007,2017-03-01,0.7284819200214095
我是苏宁小股东，买东西我只上苏宁易购!苏宁股,18603,2017-03-06,0.9904121554417986
