标题,帖子数,日期,情感
军工股近期表现都不错，我也在帖子里重点提了下,15287,2016-01-06,0.8135143910884371
苏宁云商接下来的走势会如何?分析附策略   注：,20552,2015-12-15,0.9992940168522959
昨天满仓，今天数钱，哈哈哈,32407,2016-01-07,0.7032746249019086
苏宁大手笔收购背后的逻辑,63416,2016-01-06,0.9985242206963302
增持消息真的值得那么高兴吗，咱们来分析下,19554,2016-01-05,0.9372875850383641
【讨论】第二股东增持十亿后，苏宁真的能企稳吗,67439,2016-01-06,0.9689773310048581
注意大盘下周下调风险很大，从十一月27号大盘回,14578,2015-12-06,0.6105257551998651
3月31公布年报,11592,2016-01-06,0.05422216828030879
苏宁云商二股东将增持逾十亿,47668,2016-01-06,0.8397906641686051
就凭这一点就让我很坚定的对苏宁云商有强烈看好,21442,2016-01-03,0.9773938840949269
周五重仓苏宁了。 没有无缘无故的爱，也没有无,30625,2015-12-26,0.60872040970362
苏宁云商:2016年1月5日投资者关系活动记录表,54418,2016-01-05,0.9956897225685114
尾盘探底回升  何时才能进场？,6145,2016-01-05,0.14482282753234066
在下轻仓观战，留得青山在到处是美景。手持重仓,7102,2015-11-15,0.11465315856710223
苏宁云商 个人看法 (论股),27763,2015-11-20,0.9748759809940551
苏宁云商第二大股东拟3月内增持不低于10亿,46796,2016-01-05,0.2740485504283757
苏宁好样的，在市场担心股东减持的情况下不仅承,12866,2016-01-05,0.9793099080334492
一个人的成功，格局很重要，目光要放长远。,5903,2016-01-06,0.9779806818484711
致苏宁主力,28339,2015-12-30,0.9659503581716621
苏宁云商：苏宁电器集团拟斥资10亿元增持,50073,2016-01-05,0.9968915984708999
保驾业绩  苏宁云商剥离PPTV,36789,2016-01-05,0.9954153083033709
苏宁云商合理价格应该是18元左右。,18213,2016-01-03,0.8743280145081229
苏宁今日抗跌力度明显，说明庄家已经控盘，作为,10474,2016-01-05,0.9539204149216642
辞职做专职股民,42915,2015-12-28,0.6569635966893362
节后：千股跌停，两次熔断，明天怎么走？怎么发,14511,2016-01-04,0.14618847215004982
文体产业能让苏宁青春不老吗,28612,2016-01-04,0.9992328045584962
下周一不涨停，我脱光了由大家摸,27744,2016-01-02,0.2298565293586845
准备拆借资金进入,9563,2015-12-23,0.9000299615145505
关于熔断机制大家需要认清这几点。,10621,2016-01-04,0.6290852872952053
20的本[哭],15986,2016-01-04,0.562284800182491
今天苏宁不涨停 我脱光了在大街上跑一圈。,9126,2016-01-04,0.4957114031910911
【讨论】你对苏宁完成对PPTV的整体出售有什么看,50222,2016-01-04,0.989098225037154
业绩符合预期，加速推进全渠道融合战略,21070,2015-09-02,0.9989104659994488
牵手万达积极拥抱线下，互联网零售更进一步,22829,2015-09-07,0.9654233608076896
苏宁云商25.88亿售PPTV 68.08%股权予苏宁文化,25245,2016-01-04,0.9982661659459905
这次下跌换个角度看也是好事，重新洗牌，把泡沫,14135,2016-01-04,0.5232610233128503
努比亚引入苏宁为第二大股东 与锤子魅族“沾亲,61583,2016-01-04,0.9487525525389726
大家不要恐慌，苏宁主力已高度控盘，就算大盘有,9425,2016-01-04,0.8830135811089863
【讨论】你对苏宁未来走势的看法是？,49087,2015-12-31,0.9980107005360275
苏宁云商:关于实施完成出售PPLive Corporation,203112,2016-01-03,0.9912452420709841
今天是苏宁最后的上车机会，手中有货的千万不要,6781,2016-01-04,0.976852959622002
零售产业链之外 苏宁在投什么,40589,2016-01-01,0.7551001567643678
最近很多人在问苏宁云商 苏宁云商我也说过了 13,15333,2016-01-03,0.9992772492900345
苏宁这个时候完成pptv整体出售的个人见解。就简,14359,2016-01-03,0.9915094620813243
平时都是在苏宁云商发帖，不知道大家看到我的风,45273,2015-12-28,0.9176487981558413
大举买入苏宁，下午翻红上涨概率极大！已上车的,25007,2015-12-31,0.8299502117780321
有消息说不久要大涨,24028,2016-01-01,0.3622917930563069
周三大盘分析及周四走向预测,15498,2015-12-30,0.999164770519819
一条均线走天下（永远多赚少亏）个人观点，不喜,49680,2015-12-14,0.8810968516120936
苏宁云商:关于非公开发行股票摊薄即期回报的风,47164,2015-11-26,0.9747691442921892
细看了苏宁回复证监会的意见，似乎有被否的可能,34164,2015-12-28,0.6598085492666029
苏宁今天开吊念会,11721,2015-12-31,0.8440493403026885
【讨论】苏宁再度下跌，它何时才能重整旗鼓呢？,81010,2015-12-28,0.9050878848895033
明天继续走高的希望还是挺大的！,11889,2015-12-29,0.7432184754768877
一些小经验，希望这篇文章对大家以后的炒股历程,17963,2015-12-16,0.9421017082799363
苏宁从价值上来说 根本不值10块钱  散户不要心,5926,2015-12-30,0.847805002338117
一定要稳住，最后的黑暗即将结束，苏宁是价值股,4026,2015-12-31,0.9843661119164212
苏宁阿里欲交叉持股 舜天转让考验足协智慧,54962,2015-12-30,0.9595233081077307
苏宁今不涨停，我脱光了给大家看,9003,2015-12-31,0.8311715190150464
规避被套的关键,10011,2015-12-29,0.3692402493863105
今日的苏宁是历史难得的机会，新的一年苏宁股价,11696,2015-12-30,0.9999969467593786
【讨论】苏宁迟迟无法强势大涨的原因是？,106503,2015-12-29,0.8804428389776532
反弹还将继续，看接下来苏宁唱戏吧！！,33617,2015-09-08,0.6847856756812004
混迹股市10余载让我明白了，散户不能碰的五件事,105087,2015-12-17,0.3822840594798852
苏宁整合资源加码体育业务,25158,2015-12-28,0.7445033833809475
黑周四魔咒能否打破？,4668,2015-09-10,0.9759690258665015
偏偏就是有人不喜欢但总是丢西瓜捡芝麻,10090,2015-12-21,0.024567482699624943
看完25周年晚会后感.,35943,2015-12-26,0.9641200486088596
一日一涨停！ 12月27日,21381,2015-12-27,0.3943820270933962
苏宁即刻反转，抓紧上车！,5079,2015-12-29,0.9863479586676284
苏宁宣布进军新的亿级市场!开启“电竞 ”模式,30591,2015-12-28,0.6963319994251395
苏宁董事长张近东连入足球与电影“富人俱乐部”,42072,2015-12-28,0.9596807625970674
瞄准年轻化市场 苏宁开启“电竞 ”模式,29686,2015-12-28,0.7633783575127845
真是心寒啊！今天晚上苏宁易购什么东西都买不了,13646,2015-12-28,0.23535081772372768
不要碰此股。苏宁的托可以去挂墙上了,8786,2015-12-10,0.1883671468244763
待苏宁转型成功之时，股价必然已经站在50之上！,9981,2015-12-28,0.9988661198241962
前两天的盘面分析还算准确吧 看帖子的朋友应该,31219,2015-12-24,0.9753100757225037
今日盘面分析及下周预测,23574,2015-12-25,0.9990816838260971
补仓的一些知识,5323,2015-12-28,0.7659060302695012
苏宁25周年掀青春风暴  捐资超三千万助力互联网,20353,2015-12-27,0.9999986147318806
苏宁云商:关于收到《中国证监会行政许可项目审,123958,2015-11-18,0.9972523211413453
传统零售寒气未消 苏宁“软硬”兼施谋O2O转型,17969,2015-12-28,0.9976113538208266
苏宁云商如果下午出现 诱多的走势……,26212,2015-11-24,0.9888815084991486
断剑重铸之日，骑士归来之时,81023,2015-12-19,0.5030237503883043
重大增持公告 证券代码：002024 股票简称：苏宁,16805,2015-12-25,0.9654764738603048
苏宁与陕西省签署战略协议 300亿元支持互联网零,40551,2015-12-27,0.9816094127630776
苏宁为什么不做院线呢？这是O2O的标配啊！,10826,2015-10-24,0.6772643333670046
请看蓝光发展600466必将成为千元大股的理由,9069,2015-11-28,0.7775228382090229
终于等到明天停牌，可惜上周五已全抛，,34534,2015-12-27,0.26517215480961753
双11买入苏宁云商的还有人在吗 ？,25448,2015-12-25,0.9472192101610594
【讨论】苏宁再度下跌，后市你怎么看？,92755,2015-12-25,0.9862036254239462
分享之五——谈谈交易理念、策略、技巧的问题,28328,2015-12-11,0.9758249554727164
苏宁与陕西省签署战略协议  300亿元支持互联网,19695,2015-12-26,0.9826716358290338
小姨子大骂苏宁太监，发誓永不买苏宁产品！,31284,2015-11-24,0.9400029533152815
苏宁接手原江苏舜天俱乐部,40549,2015-12-25,0.972182926941041
张近东不死，苏宁不涨,8616,2015-12-24,0.589945547191509
针对六类股民的六种建议,36319,2015-12-16,0.9059706982181865
我的14.5啊，真的真的到不了吗,9771,2015-12-23,0.4314992333705132
本轮调整多变数 年前温水煮青蛙，摸着良心说话,107586,2015-11-20,0.7098503142853815
关于苏宁云商价值分析，总之无忧，春节前收益至,72551,2015-12-11,0.9999433640047374
【讨论】苏宁逆市上涨，你看好它的未来吗？,151216,2015-12-24,0.9897826293398315
苏宁云商今日超大单流入排名第7名(12-24),56095,2015-12-24,0.9938886501845585
今天涨幅5%以上,4459,2015-12-25,0.4737672181921908
我买了一些东西在苏宁易购。我发现确实都比京东,12611,2015-12-24,0.9707987906939693
直播跟进两支票，拒绝马后炮（福利贴）,11066,2015-12-15,0.26685935075089506
一日一涨停；关注我关注游资,15615,2015-12-23,0.9920301233536462
昨日提示的002482盘中强力拉升直击涨停，相信关,9062,2015-12-22,0.14522315482408854
耐心，坚持，厚报！,15721,2015-08-25,0.3109200778963447
为什么一直删帖，对苏宁和后市大盘的一些看法,39292,2015-12-22,0.9583230932628863
【讨论】苏宁接手舜天后，股价能企稳了吗？,126993,2015-12-23,0.997085018455811
苏宁云商、健康元等我已经跟踪同潜伏将近30天，,17850,2015-12-17,0.8624504260790873
码的，我没听我朋友的话 今天买入了,13028,2015-12-23,0.6726844760620961
下午苏宁要是不跌停我就喷水枯竭而死！,11440,2015-12-23,0.24432116371609036
苏宁云商拟“内部转让”PPTV 有望提振业绩,20175,2015-10-31,0.8320665996328352
今天又收锤子线，这是给我们什么预示吗？,16177,2015-12-22,0.5117453318291537
【讨论】进军中超会对苏宁的股价产生何种影响呢,97973,2015-12-22,0.991511640351581
苏宁集团宣布接手江苏舜天,76050,2015-12-22,0.9281425456552433
接手俱乐部  苏宁阿里球场对垒,36986,2015-12-22,0.9539204149216642
还记不记得，昨天说22日苏宁大概率收绿？,22369,2015-12-22,0.6650604076221647
苏宁接手舜天足球 全面进军体育产业,56944,2015-12-22,0.8734629867417274
苏宁在构建底部结构，不要随意割肉了,99491,2015-12-13,0.7169197143021551
苏宁正式进军中超 入主江苏足球,41824,2015-12-22,0.9813957059619332
最后20分钟苏宁拉涨停你们相信吗,9785,2015-12-22,0.8247270258356869
看盘技巧:盘口信息深度指导,37166,2015-12-17,0.8015949936900407
老军医来了，大家多支持,31952,2015-12-08,0.6206550786073286
【讨论】接手舜天后苏宁能否强势崛起？,80308,2015-12-21,0.9945173203996658
疾风知劲草，要是再荡几下，你会？（附周二关键,10066,2015-12-21,0.41190339224582717
京东、苏宁颤抖吧，国美那个小伙即将出狱！,29592,2015-12-17,0.9996464083237598
苏宁云商今日超大单流入排名第11名(12-21),57660,2015-12-21,0.9867855508584857
苏宁接手舜天 中超投资商呈现“地产 电商”格局,92811,2015-12-21,0.9992179457439494
下周发公告！阿里巴巴定赠获批！,79414,2015-12-19,0.628615301740958
足球投资集中爆发 苏宁即将宣布接受江苏舜天,102046,2015-12-21,0.9967005157476597
苏宁云商:短线操作宝典十招精解!,6305,2015-12-21,0.9984631275351845
开贴论苏宁，短期回调有限，必读（附解股）,21685,2015-11-30,0.9903412015604255
听说下周一开始已经有几个机构要联手做几个涨停,24798,2015-12-20,0.6288129524341872
苏宁下午宣布收购足球，又要生产苏宁手机，近期,12906,2015-12-21,0.9989406854501252
苏宁云商(002024)融资融券信息(12-18),43272,2015-12-21,0.9966477929911505
12.18周五大盘精准预测！（美国加息靴子落地，,33149,2015-12-17,0.9849498336464124
明天宣布收购舜天，希望来一个久违的涨停！,20231,2015-12-20,0.9797326672494464
支持宝能系！,13097,2015-12-19,0.505100089851168
大家讲个离婚的笑话解解闷。股市很热，我坐在电,13327,2015-12-19,0.8443126735310118
冷静，冷静一，场新风暴强势袭来？,13976,2015-11-09,0.9994641068789968
中国足球迎来资本时代：苏宁收购江苏舜天,16050,2015-12-20,0.9997439942131712
12.21 苏宁宣布收购江苏舜天足球俱乐部 　　北,27516,2015-12-19,0.9958472855739521
多谢大家的关注，大家有收获才是真正的收获,19907,2015-12-14,0.9834806065382617
江苏足球周一新起航 苏宁将召开发布会宣布接手,23770,2015-12-19,0.9461766416946354
和大家聊一聊最近直播室的战绩，看你错过了多少,10514,2015-12-11,0.4375650417249045
苏宁云商:2015年12月17日投资者关系活动记录表,58847,2015-12-18,0.995028300995568
下周有戏,10344,2015-12-18,0.7452861405752153
【讨论】苏宁无法持续上涨的原因是？,97471,2015-12-18,0.8519856044011104
哥买电器也不买你苏宁的,18880,2015-12-11,0.95880001398677
为什么总发不上——股市中骗术太多，不会分辨的,9223,2015-12-18,0.8189975781354003
破苏宁害惨我了,13252,2015-12-18,0.8393860327410769
我的天哪，我要死了,29451,2015-12-18,0.20323303077480204
阿里巴巴283亿元战略投资苏宁 成为第二大股东,108041,2015-08-10,0.9997339122127966
我对买卖点的看法见解,74568,2015-12-14,0.5114651246410573
3600点压力位临近，量能能否继续放大，vd,6380,2015-12-17,0.9551679036488063
清仓，就宣传！让我身边的所有人，都不要去苏宁,6360,2015-12-18,0.8624210619113696
居然有人还把证监会接下来批准马云入股当利好？,116482,2015-12-09,0.0943230883445153
苏宁云商今日超大单流入排名第9名(12-17),64573,2015-12-17,0.989444184216645
【讨论】确立发展方向后苏宁能否就此企稳呢？,52911,2015-12-17,0.9978469628115897
控盘主力如何演绎后期的上涨行情,9044,2015-12-17,0.9889904324555624
（12.17）震荡攀升，逐步走强_苏宁云商,94405,2015-12-16,0.9911058673608653
“资产荒”是个伪命题 苏宁金融将走O2O金融模式,57252,2015-12-17,0.9999668073129312
股市关注 今日周四大盘预测与操作要领,5867,2015-12-17,0.9996087678307402
提一句：,8957,2015-12-16,0.44904918455645226
电贺苏宁主力在做低位“弃婴”技术形态,59380,2015-12-09,0.9977164440653136
根据证监会进度,本周停牌审核阿里巴巴15.43入股,80000,2015-12-07,0.4737672181921917
苏宁云商；五大买入良机 一定要抓住！1,32187,2015-12-16,0.9892501798980556
我对大盘的看法！,126273,2015-12-10,0.7297953905324703
苏宁云商今日超大单流出排名第17名(12-16),44651,2015-12-16,0.9728781890613803
【讨论】苏宁进入转型期，你看好它的未来吗？,53272,2015-12-16,0.9976819726145334
大家都多少钱入的？我16[哭],11621,2015-12-16,0.6816381897657579
苏宁全线订单增长超3倍,82285,2015-12-14,0.8295586050022566
每日一贴：今日观测，明日猜测,5812,2015-12-16,0.9981060720444044
如何步入炒股的最高境界,8767,2015-12-16,0.6823259018324322
【讨论】全线订单增长超3倍，苏宁会就此崛起吗,94163,2015-12-14,0.8888139208572096
带钱进股市 求下联 。ee,9899,2015-12-15,0.932963314646778
作为当下投资者的感悟,18188,2015-12-15,0.9977588450079334
苏宁最后的机会了，抓紧上车，下午苏宁直线拉升,7597,2015-12-16,0.9985434832404013
苏宁最后的抄底补仓的机会，抓紧上车 把握机会,4843,2015-12-16,0.9997262210709168
苏宁今天是个难得的机会，给了踏空的人加仓的良,6117,2015-12-16,0.9978856643418702
张近东：所有转型都有时间窗口,77310,2015-12-15,0.5860490184107205
耐心持有苏宁，苏宁是价值股，价值股看的是长期,5835,2015-12-16,0.9252581645585778
！！！苏宁云商个人不成熟的猜想（个人观点）,18788,2015-12-15,0.9991530365746437
苏宁云商 怎样面对美联储是否加息消息冲击？,5885,2015-12-15,0.9960331678838978
【讨论】苏宁持续上涨，终于要正式启航了吗？,446387,2015-12-15,0.9137658316528245
今日战况汇总！,23816,2015-12-14,0.5933258601462934
苏宁云商(002024)融资融券信息(12-14),24085,2015-12-15,0.9966477929911505
苏宁二次转型必将成功，股价必上50元！,8770,2015-12-15,0.9964607444356863
给股海中迷茫的朋友一些帮助：亏损和无法持续获,5997,2015-12-15,0.9690455021881927
苏……即从回13.5以上。赶快[抄底],9704,2015-12-14,0.858608814598201
"苏宁云商互联网""急转弯"" 强化阵营战略合作",51748,2015-12-14,0.9999257286492594
苏宁云商二次转型必将王者归来，年底看至20元，,18003,2015-12-14,0.9966553205372408
下周股市预测及应对策略,13460,2015-12-11,0.9962604861117685
带钱进股市 求下联 。,9478,2015-09-12,0.939240803166934
苏宁云商(002024)融资融券信息(12-11),32468,2015-12-14,0.9966477929911505
别人笑我太疯癫，我笑他人看不穿12.07,39841,2015-12-07,0.17916432163605245
苏宁云商:2015年12月11日投资者关系活动记录表,53012,2015-12-11,0.9904907584652854
【讨论】“双十二”即将来临，苏宁能否借势崛起,83750,2015-12-11,0.9994974055853466
告诉我这内容为什么发不上,8909,2015-12-09,0.109251270282963
周五多空决战，看一板块行情！,8548,2015-12-10,0.9673721608390573
苏宁云商,小马的个人看法,16249,2015-12-11,0.9862653849892171
苏宁云商:2015年12月4日投资者关系活动记录表,41892,2015-12-11,0.994817835683089
明天 开盘涨停,14746,2015-12-09,0.341705359872037
必须缩量至极致才有戏！,11708,2015-12-09,0.8588308739469488
如果下星期苏宁云商三个涨停板，我们就一辈子在,11421,2015-12-11,0.996753001616864
高开震荡暗藏重磅转势信号！,23132,2015-11-03,0.4906119219505142
张近东宣布月底进军三大领域,90381,2015-12-10,0.9012883485044216
大家放心，两点之后 苏宁会给大家一个交代的。,6137,2015-12-11,0.9749521589545002
双十二来了，电子商务再迎盛宴,128056,2015-12-10,0.852634035599386
苏宁关闭满座网  门店O2O生态重回原点,63751,2015-12-10,0.9208813093886233
梦归来，人气贴测试完毕，祝大家好运！苏宁上二,15557,2015-12-07,0.998520657636261
【讨论】门店O2O生态重回原点，你还看好苏宁的,64277,2015-12-10,0.991691997856102
苏宁云商(002024)大宗交易数据一览(12-09),123386,2015-12-09,0.9588214143783317
已无退路，唯有持股待涨，一月、一季、一年，不,12418,2015-12-10,0.2894964717270173
苏宁云商:“12苏宁01”2015年付息公告,160609,2015-12-07,0.9981638595085142
现在的市场主要还是看量能，耐心等待进场的机会,6661,2015-12-10,0.9320331510130399
淘宝村淘完善乡镇供销体系,农村电商有望爆发,31917,2015-12-01,0.5494348401575647
发誓再也不去苏宁易购上买东西了，自从买入苏宁,7065,2015-11-24,0.7151756026690564
【讨论】苏宁利好不断，为何股价仍旧不涨？,116357,2015-12-09,0.9903952740809973
给大家说一个真实的笑话！ 我在2015.11.16日尾,24729,2015-12-09,0.21980658874334946
风口上的刘强东：再提与苏宁“双东世纪之约” ,19930,2015-12-09,0.660039521299143
苏宁云商 持有苏宁云商的朋友可以看一下,8328,2015-11-25,0.9972945495883889
苏宁云商(002024)融资融券信息(12-08),24673,2015-12-09,0.9966477929911505
下周盘面分析，最迟下周二大盘会站上3700,71018,2015-11-21,0.9770419801783317
苏宁云商今日超大单流出排名第6名(12-08),45039,2015-12-08,0.9692562887934357
周三或有小幅反弹，继续阴跌（控制仓位）,12257,2015-12-08,0.14422997688035777
苏宁下周涨20以上，立帖为证，评论的看帖的。如,56213,2015-12-05,0.8443149260611417
苏宁打造政企采购电商平台,99320,2015-12-08,0.8129014533099916
苏宁进军文体创投在即,56728,2015-12-08,0.9709690262477467
专门设置一个帖子解股,9241,2015-12-08,0.07847512420763492
【讨论】苏宁宣布多栖发展，后市值得可期吗？,88476,2015-12-08,0.9973432755301166
苏宁宣布进军创业、体育和娱乐领域,45359,2015-12-08,0.9994930495719857
苏宁云商小清龙个人是看好的仓位不重可以暂时持,7166,2015-12-08,0.8559329509601369
苏宁云商各类技术指标都已经走坏，5天线下穿10,87035,2015-11-21,0.9586670280916012
周二主力的这个阴谋不得不防,16788,2015-12-07,0.3045212678547078
震荡中积蓄力量 强势格局不会改变,31395,2015-12-07,0.966944149864196
苏宁宣布进军创业体育和娱乐领域,36028,2015-12-08,0.9994930495719857
震荡中前进-前进-前进进,10361,2015-11-23,0.5210934575014035
16.2什么时候能解套 求大神帮忙,13224,2015-12-07,0.35994630403350025
今天肯定涨停，啥不用说了,9969,2015-12-08,0.4736890905957324
张近东首曝苏宁六年转型心得：看清趋势 耐住非,116694,2015-12-07,0.9355673487992111
苏宁云商今日超大单流入排名第8名(12-07),66167,2015-12-07,0.9939361926418313
【讨论】苏宁止跌上涨，后市能否持续走强？,121588,2015-12-07,0.8849459783152176
梦归来，苏宁12月7日涨停！,13712,2015-12-04,0.8873472928730742
今天竟然没跌，感动的哭了,13856,2015-12-07,0.7847823102111021
苏宁超市上线国家馆,106668,2015-12-07,0.8908201339160461
12月的开端是一个好的开始，直播室的兄弟姐妹们,8593,2015-12-05,0.04082206122860399
下周弱势反弹已定，周一个股布局方向曝光！,35419,2015-12-06,0.3181535803504305
明天上涨三个点就送mate8一部！,9244,2015-12-07,0.07267210510502764
苏宁云商，最后一跌，即将惊天反弹大涨！！ 走,23760,2015-12-07,0.9954878612018124
支持苏宁易购，刚下了订单,7529,2015-12-04,0.6944221857296898
以我对苏宁的经验， 有大单压顶反而会突破。,10397,2015-12-07,0.9887229370956342
操！居然这么多人看涨。我敢说如果最近半个月超,31727,2015-12-03,0.0526220404653539
苏宁云商！地量之后会有天价[献花][献花][献花],13944,2015-11-19,0.9556799945357842
13.98成功逃顶，yeah,8628,2015-12-07,0.714259297067483
这个月不上20一人一部爱疯6,9582,2015-12-06,0.2231389193796478
明天涨停，送mate8十部，与大家同乐！,5284,2015-12-06,0.6724901269090946
下周关注能否出现抄短底机会！,9803,2015-12-05,0.8355438498302203
苏宁控股集团董事长张近东 腾讯财经讯 苏宁控股,36760,2015-12-05,0.9788427644621251
苏宁云商:第五届董事会第二十七次会议决议公告,39004,2015-12-03,0.8437784364676816
下周跌破13的话，我补偿大家一部华为mate8！,8274,2015-12-05,0.01376677026319717
张近东光荣：苏宁在大盘稳固时开启了股灾模式！,6307,2015-12-04,0.9494214461453393
苏宁150亿入股阿里巴巴，大概2750万股，每股浮,15655,2015-12-06,0.9927189381265161
我们小散如果团结每人拿个20多万下去，肯定能涨,5389,2015-12-06,0.4170199891833608
市场为何未能持续上涨？不出意外，下周市场将会,25003,2015-12-04,0.8789763558256962
苏宁云商今日超大单流出排名第7名(12-04),9733,2015-12-04,0.9759947148236312
今日三支个股提示,5927,2015-12-04,0.7017711297215234
苏宁云商(002024)融资融券信息(12-03),6926,2015-12-04,0.9966477929911505
苏宁尾盘将跳水跌停，不跌停我发本人绝招照片！,7386,2015-12-04,0.10251193174918904
梦归来，苏宁12月3日涨停！,11274,2015-12-02,0.8593998448936305
俄超市将用中国同类商品代替禁运的土耳其食品,20634,2015-12-03,0.9102809709293109
互联网下乡土特产上线：电商扶贫开启精准扶贫新,6945,2015-11-30,0.9200347023514917
明日会有上万亿打新资金解冻，大盘有望延续上涨,19891,2015-12-03,0.9744711462347482
【讨论】苏宁借势“跑男”能否使行情有所好转呢,33216,2015-12-03,0.9993852940369622
十部门启动农民工返乡创业试点 加快建设农村电,27917,2015-12-03,0.22008686511644537
五天內停牌,78259,2015-11-19,0.22275762894502416
苏宁易购上线新西兰馆 直采专供助阵“双十二”,7138,2015-12-03,0.07607082179141567
打新资金即将解冻，目前操作还须谨慎，回避不确,23256,2015-12-02,0.5365162633359449
最迟明天发公告。收购舜天足球。,54020,2015-12-03,0.31744934422266546
梦归来，苏宁明天涨停！,41115,2015-11-26,0.9696879224778392
梦归来，苏宁12月1日涨停！,9342,2015-11-30,0.8227178495134794
“羊肉泡馍”借势跑男 苏宁描绘中华美食版图,15367,2015-12-02,0.9991308910501346
网店卖“山寨” 网络平台或将“连坐”,12682,2015-12-02,0.25141195026005414
不知大家注意到了没有，我观察了好多天这支股票,5606,2015-12-03,0.8561610772264407
【讨论】苏宁止跌上涨，后市能否持续走强？,57972,2015-12-02,0.8849459783152176
苏宁云商短线不宜操作,9700,2015-12-02,0.9893708070333144
对股吧的观察，想给这个股吧的所有人一些话。据,5713,2015-12-02,0.31559342420000736
那些被套未解套的现在要这样做！,5584,2015-12-02,0.6929205081569525
苏宁云商，利好尚未兑现你还在持有，长期看好！,19071,2015-11-12,0.8905312930473581
