标题,帖子数,日期,情感
是典型出货，不是砸盘。昨天是明显的上断头走势,4495,2016-08-18,0.19801831659083957
投资需要确定性，我再一次选择了苏宁云商！,10182,2016-08-13,0.9990873981454513
苏宁云商今日超大单流入排名第4名(08-17),19357,2016-08-17,0.9927863635485608
一个字：爽！苏宁：继续跌！加油哦,18429,2016-03-10,0.9910813552803523
刚才看到有人苏宁买了80多万，我没那么多，但是,19582,2016-07-08,0.8876618572697755
刚喝完假酒！踏空了高兴！这是境界！席间忽闻以,3667,2016-08-17,0.09512206550263358
我哭，11.53卖出了我的10000股！我的筹码没了！,9783,2016-08-17,0.6023837071246032
压单吸筹，有大行情,8972,2016-08-12,0.6105101445790934
11.47清仓！等8.47满仓不行呀？一直唱空到6元犯,3703,2016-08-17,0.1856731906896626
卖了 你可以随便涨了,2598,2016-08-17,0.3239460267350851
有感于马云增持！马云增持了国内多家公司（有分,9485,2016-08-16,0.895962893952702
今天买入三万股,7687,2016-08-16,0.44767845850986676
坊间据传说：淘宝要A股借壳苏宁，马云已经在15,12533,2016-08-16,0.9773368306187836
苏宁与阿里比，简直是太值了,6459,2016-08-16,0.6631393951569678
同志们，深港通批准了，港深两市就这么一家电商,9597,2016-08-16,0.33832232069606194
苏宁云商(002024)大宗交易数据一览(08-15),40390,2016-08-15,0.9588214143783317
主力发动猛攻 或将加速攻击3280点！,3973,2016-08-15,0.9512181591748001
说了这是震荡偏空行情,4260,2016-08-11,0.6902303613862064
10.97三百万股大宗交易，星期一苏宁危险了,15528,2016-08-12,0.725030817486697
难道是：丁蟹效应？,3022,2016-08-15,0.3492585499859615
今天卖了，11.31卖出10000股，下周择机接回！,10547,2016-08-12,0.3840415242832673
明天跌停！如不跌停，我从600层楼跳下去！,8784,2016-08-14,0.017244723292141217
床前明月光，地上鞋两双。再往床上看，两个腚光,6229,2016-08-14,0.05584969090387182
苏宁，你可别让我踏空了，我只有100股！有图为,5368,2016-08-12,0.6638071821040759
苏宁云商今日超大单流入排名第15名(08-12),16636,2016-08-12,0.9916782992123634
苏宁云商(002024)大宗交易数据一览(08-12),48380,2016-08-12,0.9588214143783317
游资……正资……涨死队？,14211,2016-08-12,0.8371309251288885
苏宁云商星期一会不会涨停？,15959,2016-08-13,0.9920688170046842
京东亏损股价最低还19.51美元，苏宁暂时小亏才1,10757,2016-08-13,0.6299251373632982
看看下周苏宁被谁举牌.第一大股东和第二就差那,6366,2016-08-13,0.35327314023836254
今天是主力诱多出货，估计明天跌停,6009,2016-08-12,0.11019824730434313
这股票不适合短线，最理性的办法，双11之前，低,4359,2016-08-12,0.8116263715322171
记住，一定要牢记，苏宁不到30决不能出来！,8643,2016-08-11,0.20467363162589347
现在说目标价30，很多人认为是笑话,24538,2016-04-16,0.9336551647345361
阿里巴巴涨6%，价格92美元,11304,2016-08-11,0.9634301874104032
马云定增和员工持股15.17，大股东增持34亿均价1,10769,2016-08-11,0.34944831414714816
我正式宣布，苏宁明日开始暴力拉升！！最终12.1,18581,2016-08-09,0.9960827302952178
惊天动地！！！苏宁内部传来消息，苏宁实际或有,12808,2016-08-03,0.7493960867028192
苏宁云商庄家标准的横盘出货，几干万主力资金瞬,7153,2016-08-10,0.9893981190156784
11.04能接回不[胜利][胜利][胜利][胜利][胜利][,4171,2016-08-10,0.9297060663209428
经过苏宁这一票走出来的人！等于经历一次魔鬼训,7011,2016-08-10,0.8536297810049445
线上交易额高速增长，转型驶入快车道,69022,2016-08-01,0.9375953402282144
苏宁计划在湖南投资400亿 将建100家旗舰店,46867,2016-01-19,0.9499033053666653
002024盘子大且亏损…,8142,2016-08-09,0.009802344808152785
恒大举牌苏宁云商,7057,2016-08-10,0.9821495286026943
7月来近十次调研 这次竟被高毅资产董事总经理瞄,77674,2016-08-07,0.09363216815327047
苏宁云商到底那只江苏银行影子股含金量高,25081,2016-07-23,0.9899160374693561
苏银苏宁，叫我这个小本人家怎么办？啊啊啊……,6032,2016-08-09,0.9995230628240002
有没有像我一样的 15.22买入的,8164,2016-08-08,0.7297953905324696
收于11.31,4622,2016-08-09,0.1851958414750854
苏宁云商今日超大单流入排名第1名(08-08),40498,2016-08-08,0.9896710454987644
回顾去年定增初以为腾讯，万达，阿里共同投资30,25389,2016-08-06,0.9365282289363163
苏宁云商(002024)融资融券信息(08-05),10269,2016-08-08,0.9966477929911505
点评：苏宁云商,8404,2016-08-08,0.9774484330522211
试探买入苏宁云商,28962,2016-07-18,0.9985702968260499
减仓！,4999,2016-08-01,0.40306518103660427
今后空方司令改行唱多,7037,2016-08-03,0.9023745248140655
20见,7763,2016-08-06,0.25228205991487873
苏宁云商今日超大单流入排名第4名(08-05),27029,2016-08-05,0.9927863635485608
去年定增初定  万达和百度入住100亿，发布消息,24011,2016-08-05,0.4742018343731432
终于长舒一口气,卖掉垃圾了,10419,2016-08-05,0.8371384751491293
求证一事，务请股友协助： 中信软件显示12以上,12070,2016-08-05,0.0030728094371963444
我觉得马云布局苏宁云商，是想借苏宁云商的壳，,14440,2016-08-05,0.9999669850273282
我14的本还在呢. 大家都是多少钱的本啊. 尼玛啊,9227,2016-08-05,0.5789707928066739
停牌啦！,19733,2016-08-05,0.5
淘宝（中国）软件有限公司欲派两名董事进入苏宁,9812,2016-08-05,0.9242467109541977
明天苏宁暴力上涨！！！支持的点赞,8523,2016-08-04,0.9966940325707085
苏宁云商:关于以募集资金置换预先已投入部分募,36083,2016-08-03,0.9991259257631803
苏宁云商:以自筹资金预先投入部分募集资金投资,61090,2016-08-03,0.9999369641110714
苏宁云商:关于为子公司提供担保的公告,26966,2016-08-03,0.9489342697725179
苏宁云商:第五届董事会第三十七次会议决议公告,34502,2016-08-03,0.8437784364676816
苏宁云商(002024)融资融券信息(08-02),6595,2016-08-03,0.9966477929911505
江苏银行 苏宁云商1.5亿股,10922,2016-08-03,0.9621064690826275
1H16收入增9%，主业经营亏损略增，关注线上快速,36359,2016-08-02,0.9930823143374746
苏宁云商(002024)融资融券信息(07-29),9763,2016-08-01,0.9966477929911505
怕什么，该来的总会来，该走的不一定会走！,6031,2016-08-01,0.5540802512082295
苏宁云商:2016年半年度业绩快报,115358,2016-07-29,0.9866446319389311
其实亏损不亏损是次要的，关键的还是花费了那么,9039,2016-07-30,0.2530891768508847
8月2号江苏银行上市，苏宁至少赚五个亿,6120,2016-07-31,0.4914700346163636
江苏银行周二上市了，呵呵，也该回本了,12164,2016-07-29,0.42840044325471016
跌1.24亿算什么，8月2号江苏银行上市第一天就回,12133,2016-07-30,0.03797412716548465
开会了！下边根据当前苏宁的情况！请国际知名经,4538,2016-07-31,0.11370819516637554
大家都不要骂人，说点个人见解。阿里入股苏宁，,9303,2016-07-30,0.6279859354193879
半年报亏损早就是定局，属于利空提前消化了，而,10542,2016-07-29,0.7620885994522868
二级市场散户致苏宁云商董事会请愿书： 贵公司,27556,2016-07-24,0.9980243951881992
京东商城总股本28亿，15年亏0.53美元，最高38美,9024,2016-07-30,0.8995834525439237
苏宁云商:关于非公开发行股票进展情况的公告,159882,2016-06-01,0.9839771226822552
为什么不可能上涨：总市值983亿；净资产314亿，,9472,2016-07-29,0.2802406881317471
阿里十五元左右的增发价都不怕，咱们怕啥啊,7226,2016-07-29,0.10889882650565696
机构在扎堆吸筹苏宁，而散户们却在拼命的割肉，,8597,2016-07-28,0.8180717407038526
明天涨停斥候,6882,2016-07-28,0.219878470741659
重大闻讯：阿里巴巴近期极可能与苏宁云商资产重,23417,2016-07-28,0.9579445195743636
苏宁云商(002024)融资融券信息(07-27),8432,2016-07-28,0.9966477929911505
苏宁可以适当加点仓，有些股票见顶，有些股票见,9560,2016-07-27,0.9547724589524348
苏宁云商今日超大单流出排名第8名(07-27),17995,2016-07-27,0.9761781243616683
庄的资金实力很强，但操纵股价的手法暴露其水平,27439,2016-07-22,0.9996404953358382
苏宁云商，这周涨涨涨！,8840,2016-07-25,0.9915366449020616
苏宁云商，涨涨涨！,4392,2016-07-26,0.9924970785899139
苏宁云商易跌难拉600802仅其1.54元可翻7倍到77,121036,2015-12-23,0.3773466137727475
苏宁云商等8公司年内获增持超10亿,40950,2016-07-22,0.9596965615350762
我老师说,苏宁今天涨10%.,5123,2016-07-25,0.807101814357487
我老师说,明天苏宁绝对涨停,20893,2016-07-19,0.807101814357487
下周三个涨停？真的假的？我好期待呀！,12847,2016-07-22,0.8035060725544222
散户都过于激动了，买进就想暴涨，卖出就希望天,13303,2016-07-22,0.31866323194312096
已清仓此股。,7396,2016-07-13,0.20725440857648425
今天融资盘爆掉应该2个亿。现在庄家只有收集融,7634,2016-07-22,0.3339824231799693
老婆问我：你为什么不把苏宁卖掉，换个其他的早,5947,2016-07-22,0.2900672724980926
10.88买入，涨不涨下午，V形11.19以上。上图,4151,2016-07-22,0.8823229849348228
明年苏宁的高点为28，哈哈，信吗？,10719,2016-07-19,0.9599560728432788
携优势资产对接阿里，边际改善确定性强,110446,2016-06-08,0.5988155081217935
苏宁云商(002024)融资融券信息(07-20),8572,2016-07-21,0.9966477929911505
真的吗？,8122,2016-07-19,0.6111111111111113
水皮：旅游业前景肯定美好 有股能穿越牛熊周期,30300,2015-10-09,0.4228185055604846
心里难受！以后我要按图说话，这样心里好受些！,4734,2016-07-21,0.6628739907810225
听说今天苏宁会涨停，真的吗,4462,2016-07-21,0.9598378156803772
重大闻迅：阿里巴巴近期极可能全额收购苏宁云商,18475,2016-07-20,0.985495922563795
苏宁走势，预料之中！我曾说过10日内有涨停！大,15337,2016-07-18,0.9789374009787347
下午能涨停不？,4343,2016-07-20,0.41800090866382644
明天让做空的机构去死，不要问我是谁，请叫我“,6460,2016-07-19,0.010026312225349221
今天买入二万股苏宁。[微笑][微笑][微笑]11.03,9250,2016-07-19,0.9962114103304617
雄赳赳气昂昂跨过鸭绿江！苏宁，我喜欢你！哈哈,8082,2016-07-13,0.9948378573805318
江苏银行股今天上市，苏宁中午要上涨5个点以上,4021,2016-07-20,0.16031425595417537
11块以上你敢不敢买？我为自己代言。,9344,2016-07-19,0.020750190397647694
今天觉得还未买够，明天让我在11左右价位再进些,4890,2016-07-19,0.25088523871844626
能别随便删帖子？？你是庄托吗？,7346,2016-07-19,0.042559638824666735
彩电半价销售？！苏宁投下8•18百万彩电销售战,6199,2016-07-19,0.812693937457818
坚定自己的判断，只做不说,4680,2016-07-19,0.5157860602126371
苏宁云商今日超大单流入排名第15名(07-18),18943,2016-07-18,0.9916782992123634
苏宁云商，下周拉升！,13538,2016-07-16,0.952398098989587
今天逢低买入苏宁二万股，交建11.41清仓,6122,2016-07-18,0.951744316264044
老是买高跟鞋，擦擦擦擦！,4637,2016-07-15,0.05366179777653424
银监会网站：扩大民间投资银行业，推动12家民营,17688,2016-07-15,0.9609384299212639
苏宁云商:2016年半年度业绩预告修正公告,142586,2016-07-14,0.9926323869050341
全市大股东增持最多、员工持股、马云15元定增，,17350,2016-07-15,0.6914203451075918
苏宁增持成本11.34，定增价格15.17。市价10.95,17541,2016-07-15,0.3652206677193258
我就想知道苏宁下半年卖什么？大家竞猜一下[想,9253,2016-07-15,0.8789208048840623
我这人最不喜欢事后诸葛亮,6650,2016-07-15,0.44136582181782236
提醒：苏宁云商不到8-10元肯定没有真正的大机构,6137,2016-07-15,0.9050364129839226
苏宁未来注定是要超过阿里和万达的公司，五年内,10970,2016-07-14,0.994722500777175
求你们别再喊着苏宁要涨了，请看理由,6691,2016-06-17,0.6132143427991106
苏宁与上海市达成合作 拟打造华东电子商务基地,13715,2016-07-14,0.9919591060922074
别再叫嚣着苏宁会大涨了,6899,2016-07-14,0.9740798864067337
别怪我没提醒你们,4408,2016-06-28,0.2669278871753704
买入苏宁 等同于买个印钞机回家，躺着赚大钱！,6209,2016-07-14,0.9162914862081688
熊市中，苏宁这块黄金正在闪闪发亮，难道你们看,3734,2016-07-14,0.9992732563374611
王者总是诞生在争议中，苏宁具备王者条件，有牛,6698,2016-06-30,0.9998441944040247
三天的累积上涨可以一日跌回，大盘技术上有强烈,17254,2016-07-11,0.024540318371292558
16年中国互联网企业百强榜出炉，苏宁云商进入前,17067,2016-07-13,0.9441942512521138
竞猜今收盘价,30416,2016-07-08,0.38099392131436804
去年第19名，今年第10名，明年铁定进前八名,7223,2016-07-13,0.7596511560730584
哎，今天大盘三阳，你1109都不收住，操盘手该换,9999,2016-07-13,0.16682580785103274
今天不涨停现场直播吃大便,14522,2016-03-18,0.08795819302752139
明天苏宁补涨，收盘11.11以上。,8867,2016-07-12,0.9427734119870144
翻看老夫今天发的贴吧！说老夫是庄托的现在你怎,10103,2016-07-12,0.2411630267366095
10.66清仓。求安慰,8032,2016-07-12,0.4373754628483245
竞技体育＋全民运动 苏宁体育布局进入大数据阶,35010,2016-07-12,0.9930258298503947
公理我在，敬请勿删 置顶的财经新闻（网龄3.4年,16116,2016-07-09,0.7969787183007
同花顺有个新闻说苏宁中报预亏6个亿，是真的吗,14391,2016-07-12,0.7411470356148848
为什么今天喜欢上了苏宁？哈哈，原来里面有黄金,10739,2016-07-12,0.9749616814197031
越跌越买，买买买,4887,2016-07-12,0.5860043087377673
我也说说个人观点,11645,2016-07-07,0.644184182607548
随时都会停牌公布重大重组事项，将暴涨,7417,2016-07-12,0.42109287148050556
依老夫观察，苏宁在10个交易日内就有一个实实在,4993,2016-07-12,0.8989088082844264
看看原因,7095,2016-07-11,0.4390243902439026
说说看什么样的利好能让苏宁云商股价涨到15.17,12622,2016-07-11,0.9975815061666428
珍惜调整下来的机会，最近马上进入调整，对于已,22237,2016-07-08,0.9314183318644532
粮尽弹绝，日出再见。,7097,2016-07-11,0.5056947865919087
已买至50成仓，剩下37.5成仓给特钢,4816,2016-07-08,0.023771062887914973
江苏银行7月20号,8675,2016-07-10,0.08390929166338734
建仓完毕，卸载软件不看盘了，国庆期间清仓。,16402,2016-07-08,0.005055460713477178
二个星期，持有等待惊喜！[鼓掌][鼓掌][鼓掌][,12140,2016-07-09,0.935542051673625
苏宁云商以34.38亿元的净增持额成为两市的“净,8944,2016-07-10,0.771368072978102
特大号外：苏宁云商半年报巨亏，看是要倒闭的节,16460,2016-07-08,0.8300991342526175
干啥来了？,22218,2016-07-05,0.2328180848821818
7月8日收盘11.24以上，否则无颜再发言,14990,2016-07-07,0.3228848416189256
后半周 几点问题,9313,2016-07-06,0.3818545887294713
打压吸筹可能性很大，大家不要轻易卖掉筹码。,6187,2016-07-07,0.3402199285755537
苏宁商业帝国即将崛起，未来市值冲破万亿不是梦,9346,2016-07-06,0.9999021415181362
马云是不是想要把阿里转回A股上市？会不会借苏,9130,2016-07-05,0.860209079348409
如果这都不算利好，那还有什么是利好？淘宝，菜,59372,2016-06-02,0.3526647713825909
已买至14.2成仓,10450,2016-07-07,0.1983512984730179
今天发公告停牌,10809,2016-07-07,0.28139513439631236
哪又猜收盘价?帮机构定了。,6304,2016-07-07,0.5361646197468883
已买至8.2成仓,2704,2016-07-07,0.1983512984730179
竞猜下午最低价?,4630,2016-07-07,0.745504539856048
我来帮助大家赚钱，现买进就会涨，下周一、二拉,6712,2016-07-07,0.1735815829715579
我又来骂庄家十八代了  哈哈,9068,2016-06-20,0.9705380030939761
成本16以上的来这报个到。,14255,2016-06-27,0.1881441886803935
苏宁，要用心，买一个ipadmini2.32g的，苏宁不,12849,2016-07-06,0.9931856555389041
今天有可能是最后的一次买入苏宁的好机会了，时,15416,2016-07-06,0.9900654615910192
明天有3个点升幅。,3069,2016-07-06,0.13777640599608332
苏宁这个价位，随时可以拉板，一旦拉板那就见不,4762,2016-07-06,0.9398525199805968
大家抓紧布局苏宁，苏宁一旦启动那就是火箭式的,3532,2016-07-06,0.9983120731330638
苏宁要涨了，马云高价入股，江苏银行上市，两大,47360,2016-06-21,0.6834099651102427
军工冲高回落  哪个将接力领跑？,9840,2016-07-05,0.5512262195997043
我的成本14.28,13508,2016-07-05,0.39493583783453856
7月5日马云率阿里高管团队再现苏宁总部 难道又,13288,2016-07-05,0.5453130895339287
会停牌，目标价35至40元,24136,2016-07-04,0.5595195451995125
强烈预感，涨停即将到来！少到13，冲破就到15[,11967,2016-07-05,0.9876484049747547
姚老板两天市值损失123.43亿,5449,2016-07-05,0.08774095944300042
从1月底到现在，股价4次接近10元附近就反弹。还,22996,2016-06-08,0.1437335614173716
苏宁云商，真心喜欢，投资价值显现，果断买入！,8982,2016-07-01,0.9999121673042543
苏宁云商30亿增持的平均价位是多少呢？,11617,2016-07-02,0.9950488859905152
早上老婆打开股票交易系统例行检查工作！（心中,8116,2016-07-03,0.08366468551399342
江苏新领导上任，苏宁云商路在何方？,14456,2016-07-01,0.9720535090986255
002024就是垃圾，刻扣底层员工工资，强行要求加,11147,2016-07-01,0.023908899541102202
有的股友既没能力又不会做人，好吧，还是晒晒图,9151,2016-07-01,0.7900141255773879
苏宁云商今日超大单流出排名第13名(07-01),17520,2016-07-01,0.971441066827607
买入苏宁等同于买入一台印钞机，躺着赚钱！,14320,2016-07-01,0.9738558785124276
苏宁云商，我作为持股你一年的投资者，我是真心,10629,2016-07-01,0.9986577087181897
苏宁云商:关于实施完成以部分供应链仓储物业为,73257,2016-06-27,0.958949340767378
苏宁云商，7月开始，再有股票质押之事，就是希,10093,2016-06-24,0.9988750310893957
收盘价有奖大竞猜：猜中者按收盘价奖发红包一个,1799,2016-07-01,0.3520102124353205
苏宁正在清理最后浮筹阶段，股价小幅震荡整理很,3287,2016-07-01,0.9995668718015388
老夫多年经验来看，苏宁该割肉的小散已经走的差,8457,2016-06-30,0.802157851564729
冲上云霄,6503,2016-06-30,0.9446807009477102
苏宁云商:招商证券股份有限公司关于公司以募集,55363,2016-06-28,0.9940793869857638
苏宁云商:关于以募集资金置换预先已投入部分募,46257,2016-06-28,0.9991259257631803
苏宁云商:第五届监事会第二十一次会议决议公告,32470,2016-06-28,0.8437784364676816
苏宁云商:第五届董事会第三十六次会议决议公告,39484,2016-06-28,0.8437784364676816
庄托慎入，气死莫怪。尤其是东北大傻！,9469,2016-06-23,0.10981625802895045
62-63=1这个等式是错的。 只移动一个数字（不能,16580,2015-10-14,0.5659644235435476
苏宁云商 暴发就在这个夏天,36658,2016-05-27,0.9820034107859297
苏宁易购涉嫌虚假促销！,16597,2016-06-18,0.4240226340486545
都拿半年了，加仓52万了，在跌加到100万，后期,7829,2016-06-22,0.8926154392204229
苏宁坑害消费者！我618被坑了。作为股东，我在,5952,2016-06-22,0.08563070647193705
三天卖出600万斤苹果 农业部点赞苏宁农村电商专,10302,2016-06-22,0.9887738609344409
重大利好！江苏银行即将上市，苏宁云商有原始股,23041,2016-06-17,0.9810847115107031
苏宁底部已经探明，庄家洗盘结束，大幅拉升指日,6683,2016-06-22,0.48292738993276796
苏宁云商:关于签订募集资金三方监管协议的公告,62763,2016-06-20,0.944017573819122
苏宁云商：苏宁易购暂不支持支付宝,37554,2016-06-21,0.9593086863502787
从苏宁电器看成长股坑人的两个阶段,19837,2016-06-20,0.9997460708218516
苏宁易购网站崩溃了！,19997,2016-06-18,0.4692923833007482
， 苏宁云商未来还有多大上涨空间？其实支持苏,27634,2016-06-04,0.9969057863357998
张近东在26日晚会上的宣布,31726,2015-12-27,0.239201626148402
苏宁云商:第五届董事会第三十五次会议决议公告,86329,2016-06-17,0.8437784364676816
不多说，快讯: 苏宁银行牌照已获批！！！,29643,2016-06-16,0.1808798241082359
617下午2：:30不拉升起来，从此退出股吧！！大,6958,2016-06-17,0.5341389187370619
今天苏宁店买了个三星S7和Y700，半年报将增1180,12527,2016-06-15,0.9218230990964771
苏宁云商:招商证券股份有限公司关于公司非公开,83557,2016-06-02,0.9940793869857638
明天开盘价有奖竞猜！！猜中的冲100元话费，没,11032,2016-06-15,0.05712110710833429
马云直接亏8亿多了，不如直接买现货！,12811,2016-06-15,0.5557559081262705
聚力传媒布局家庭互联网 苏宁文化在下一盘大棋,36053,2016-06-15,0.9655944222110006
苏宁云商靠电商概念支撑走了很远，双十一开始水,119984,2015-11-18,0.9981215611581085
是否纠错就看明天深成指的表现,7322,2016-06-13,0.7634533269534344
是谁给你勇气来嘲笑我的？回头看看我在股吧说的,9343,2016-06-06,0.8268503076534331
哈哈哈哈哈哈哈哈哈哈哈哈！腹痛，有孕在身！可,4577,2016-06-13,0.9999777520506574
苏宁云商:关于第二期员工持股计划完成股票购买,197547,2016-06-06,0.9229390566280198
苏宁云商(002024)大宗交易数据一览(12-30),73089,2015-12-30,0.9588214143783317
苏宁作为上市公司，请给苏宁银河商铺的广大业主,54380,2016-03-31,0.9666528616922796
已卸载苏宁易购app，观看表演,11762,2016-06-08,0.9125445697146071
作为股东收到了苏宁10元消费券，欣慰,27550,2016-06-08,0.8764614939250004
11.36元加仓亏了我负责，立贴为证,19220,2016-06-08,0.21691448574054872
强烈要求张董把那快什么的下三烂公司往死里整，,11476,2016-05-24,0.18829610058425195
苏宁收购国米背后的商业逻辑,44541,2016-06-08,0.9992755111597134
苏宁云商今日超大单流出排名第3名(06-07),35111,2016-06-07,0.9692779451896754
转型进入快车道，供应链金融爆发性增长,70041,2016-05-03,0.9807546509742608
公司跟踪报告：推进与阿里战略合作，构筑零售 ,49756,2016-06-07,0.7081492955272349
苏宁云商等拟在天津设立金诚保险 注册资本10亿,46817,2016-06-06,0.8272000211324002
苏宁收购国际米兰,28250,2016-06-07,0.9515109075289674
苏宁2.7亿欧元“娶”国米 这“交杯酒”喝得值不,43777,2016-06-07,0.9120548108286713
苏宁2.7亿欧元控股国米 中国资本闯入足球豪门,32532,2016-06-07,0.9987961345477918
2.7亿欧元控股国米 张近东的体育“野心”很大,37696,2016-06-07,0.8023632314801611
金股奇侠：涨停个股分析,16846,2016-06-06,0.8225150491560791
【讨论】苏宁控股收购国米，你看好它的未来吗？,96969,2016-06-06,0.9998742304667694
苏宁宣布斥资2.7亿欧元 收购国际米兰约70%股份,80862,2016-06-06,0.995468561808314
苏宁周一大涨的几率很大: 1、员工持股价15.29元,21032,2016-06-05,0.632772611627346
苏宁确定控股收购国米 今日下午三点宣布,84365,2016-06-06,0.9986858329740291
中金给出的苏宁目标价：18.9,46777,2016-06-02,0.9928481898353745
尘埃落定！苏宁2.7亿欧元收购国际米兰七成股权,18765,2016-06-06,0.9889609717728853
那不是明天又要涨停了,7770,2016-06-06,0.233163499001397
我已进入发布会现场！,3774,2016-06-06,0.1778770632250265
业绩同比大幅减亏，线上交易额翻倍增长,98646,2016-05-04,0.6764235253925922
苏宁云商今日超大单流入排名第13名(06-03),56507,2016-06-03,0.992703992054394
我敢发大胆预测，云商星期一会以跌6%开盘，然后,38010,2016-06-04,0.9957164022547553
金股奇侠：继续坚持做多次新股,5360,2016-06-03,0.6863641014625972
[图片],8171,2016-06-05,0.5826086956521737
淘宝282亿元入股苏宁云商 成公司第二大股东,60742,2016-06-03,0.9655565332329485
一点看法:无事查看了一下一整天的交易明细，有,35525,2016-06-03,0.39609883293269466
苏宁云商坚定持有有几大理由,15155,2016-06-04,0.9360493583560784
今天去买了个苹果手机U盘，苏宁和京东对比了一,13296,2016-06-04,0.8202137034466547
投资苏宁的高手们，谁能明白阿里为何投给它，便,21904,2016-06-04,0.9774256903906634
马云以290亿买入苏宁股份，苏宁又以140亿买入阿,25478,2016-06-04,0.9998994897967537
一天连嫁三次---打一谜语。答对有奖励。,101675,2015-11-27,0.27886319717130104
大家一定要看。对明天有帮助。特大利好特特大利,86588,2016-01-07,0.531178555356211
大家看看吧大家看看吧大家看看吧不得不说的秘密,82378,2016-01-15,0.9530460979092205
今年的成果。直接来个特写的图。什么都不说了。,38645,2016-03-31,0.550002165841866
10个人名的启示。大家的智商是多少呢？都是人名,32559,2016-03-25,0.20060183573053725
苏宁云商：尽快推出支持支付功能的新产品,42202,2016-06-03,0.9840372394607974
