标题,帖子数,日期,情感
18.97的本   从配完股一路下跌   还有比我高的,16673,2017-08-29,0.838249022231344
尔等误会带头和煎熬了，它们是这样的,19692,2017-07-27,0.916853806787601
赶紧跌下来啊。空仓了急人，跌下来好建点仓,26018,2017-07-19,0.0023792565213045513
西部的分时走势图极其难看，直直的拉上去，又直,29146,2017-08-31,0.07435868151125558
此段时间证券板块走主升浪无疑，但西部证券确实,21941,2017-08-31,0.9534589134656116
上证指数各均线多头排列，踩过5日线后继续上攻,8154,2017-09-01,0.25025191235052635
券商股值得重仓买入和拼命捂住的根本原因,67154,2017-05-10,0.22994020083370292
一心陪股友走完西部证券从13.52到30元全程,71146,2017-04-27,0.8079955370755766
->华泰证券+美国金融科技企业颠覆“金融系统”,284425,2016-05-29,0.9999687895317774
笑 瞎子狂笑 连续4年业绩翻倍，三年利润之和将,19208,2017-07-09,0.5546191684240064
小盘2.6亿次新股杭州银行发行价14.39业绩1.7元,32977,2017-03-28,0.7004243411165897
昨天虽然收阴线主力资金显示流出，但振幅不大股,18936,2017-08-30,0.15655877942308194
重复我的观点：三个月内西部会跌破前期低点12.6,36859,2017-06-12,0.11297788897093597
虽然我空仓，但我坚信三年必上20元。17.5.19,28445,2017-05-19,0.461900724975962
现在看空大盘，三个月跌破3000点。17.6.16,25126,2017-06-16,0.0266847436374138
空仓看空，看戏，看两个煎熬忽悠看多。,16483,2017-06-30,0.09968398664844791
大家说说西部证券怎么回事？前几天最强势，周五,35059,2017-08-26,0.23679833538845463
大家管住手，真么多托单，还得跌，不到14不买一,31189,2017-08-14,0.03108292867606688
今日回探半年线，预计缩量收星，属于上涨中继，,34073,2017-08-24,0.514787978386182
西部证券(002673)融资融券信息(08-29),7039,2017-08-30,0.8613526542713288
上证连续长阳逼空，疯牛阶段正式确立。,33212,2017-08-28,0.9631899764297498
好久没来西部吧了！下周一西部应该还要涨一天。,17295,2017-08-26,0.37467884456543976
次新雪崩上演大逃亡，明天券商扛大旗，蓄势充分,13682,2017-08-29,0.6931302259553251
中报速递：西部证券2017年上半年盈利4.37亿元，,12687,2017-08-15,0.38345894504581046
上证指数光头光脚巨阳创新高，意味着什么？看似,26323,2017-08-25,0.9940754606781624
西部证券上半年净利润同比下降25.7%,13667,2017-08-15,0.49399289154074566
西部两阳夹一阴架起了火箭炮，这种上攻组合都看,30539,2017-08-25,0.10250813593004648
进场: “双重改革”受益股,社保养老金标的股,6820,2017-07-31,0.9893200488469195
西部证券是个好股，今天实盘再战，祝愿自己也祝,14501,2017-08-24,0.8973579899792677
海阔凭鱼跃,天高任鸟飞，跟随风哥高抛低吸及60,28330,2017-08-23,0.5
已觉秋窗秋不尽,那堪风雨助凄凉！大阴之后西部,27506,2017-08-11,0.9649040792841482
老夫 15.40买入西部证券，券商出动，大家不要错,23774,2017-08-23,0.9031298440522042
重磅通知：本人自去年8月15日27元精准逃顶西部,67747,2017-05-08,0.1397036918507597
哥有软件显示本周西部证券主力吃货吸筹幅度空前,63834,2017-05-10,0.23030121708461382
重磅通知：不忘初心，方得始终，一路坎坷但我们,38871,2017-07-26,0.7673761666428275
煎熬和带头俩啥玩意儿，从哪抄的都，这不俩2比,13382,2017-07-17,0.23302953368067902
西部证券 继续持有，没有券商大盘是上不了3300,15555,2017-08-24,0.4221126670402696
行情进入阶段性头部注意风险,13506,2017-08-23,0.7834962569830344
好气啊，刚刚看涨停，再一看又没了,17382,2017-08-23,0.47355819512172626
不再煎熬之后，西部吧再无高人,8062,2017-08-24,0.7231979025822729
券商股早盘全线飘红 西部证券领涨,14515,2017-08-23,0.14372872304111395
证监会已经批复2年了，但西部证券的实际控制人,20984,2017-08-20,0.4210076566972982
结合证券指数看板块和西部未来的走势,65403,2017-07-11,0.9521762735299782
果嘉队不要太任性了,114101,2017-07-26,0.7849769944190644
明天是券商的天下！小西将一阳穿三线，重回上升,23656,2017-08-16,0.31075760539227426
15.50全仓被套！,28348,2017-08-04,0.4375423123609333
券商板块拉升 西部证券涨逾4%,29971,2017-08-22,0.13499217089495696
这两天完全没什么好点评的，60日线附近磨够时间,26171,2017-08-16,0.04799315333386622
西部证券:关于完成工商变更登记的公告,40917,2017-08-18,0.060869658856596676
营收净利双降、评级下调 西部证券“大投行+大资,25006,2017-08-17,0.9301470191555433
再从全国金融工作会议谈后市，3301绝对不是顶,29172,2017-07-23,0.3437310362343433
西部证券：上半年净利下滑26% 紫光系连续两个季,35262,2017-08-15,0.7510540153505141
券商板块单靠这一点就足以成为下一场牛市领头羊,26347,2017-06-08,0.606145593313407
西吧双拖不煎2017及呆头大哥265的前世今生。,26481,2017-06-16,0.17703682667764908
西部证券2017年上半年年报点评:：业务结构趋均,35273,2017-08-16,0.28561773492294673
西部证券:关于转让陕西股权交易中心股份有限公,23316,2017-08-15,0.35478898653826796
我现在明确看空西部，一年跌至16元。17.3.17,62209,2017-03-17,0.06839349345510959
今天收盘后，还持有西部股票的，可参与配股。,38470,2017-03-29,0.8503662113040367
这一波下跌，是券商整体下跌。不是西部单独下跌,33491,2017-05-03,0.9761518747173847
今天的收盘价格12.88元。现在就是底部。17.5.8,39132,2017-05-08,0.043001940444596154
宝能和万科股权之争，决定大盘8000点或1800点的,12415,2017-05-27,0.5743628036539575
我现在空仓，短期看空，长期看多。17年5月31,19478,2017-05-31,0.32036893014475953
8月10日新帖，关于西部证券操作整理贴。,14509,2017-08-10,0.14294103402460678
试玉要烧三日满，辨材须待七年期！今天本没怎么,13288,2017-08-08,0.3584314415286646
不要说我唱多  今天不涨  现场剁吊,9908,2017-08-08,0.2606596270227671
暂时还脱离不了均线[摊手],17567,2017-07-14,0.34881130289186346
西部证券:关于变更公司章程重要条款获得核准批,46069,2017-08-08,0.28826316232468474
不煎沟闭嘴这几天西部猛涨，只可惜不煎沟昨天下,8155,2017-08-03,0.07342487878158699
西部的股友请擦亮眼睛，好好看看某人的高论，他,10672,2017-08-07,0.1016051444723517
西部证券7月份净利润环比下滑超50%,49143,2017-08-04,0.5627085206834135
让你们见识一下什么叫做神！！或许有些人已经被,14581,2017-06-28,0.8655959604010149
西部证券:2017年7月主要财务信息公告,48290,2017-08-04,0.3410629554302832
猛一看，都以为中原证券是龙头，其实真正能替代,17535,2017-05-16,0.963824734660644
上证指今天早已涨超过4月顶3295.离去年11月顶33,13289,2017-08-02,0.07288832090464747
想当年豪情壮，顶风轻松尿三丈，而如今中了邪，,8994,2017-08-02,0.9938581373091829
封笔,26922,2017-07-26,0.33678471989030123
券商就是缩头乌龟,16775,2017-06-28,0.40314529261729115
西部证券(002673)高管相关人员持股变动信息(7-2,37029,2017-07-31,0.26301692819911193
通知，煎熬哥准备在下周预测的13元附近重仓抄底,15726,2017-05-05,0.4590233553564995
想玩西部证券不关注哥的帖子那绝对是你的失误，,27039,2017-05-12,0.8674156592722895
西部证券(002673)融资融券信息(07-28),4233,2017-07-31,0.8613526542713288
大盘冲3300，必须靠券商,4859,2017-07-31,0.5486976325915107
证监会通报操纵股价四种方式：关联账户，自买自,25089,2016-09-26,0.9372710066314004
价高估出了下来全转买*一路一带丝路龙头600307,31493,2017-05-06,0.6861482291290991
某庄拖不煎2017，天天搞一些新闻联播一样的帖子,15207,2017-06-16,0.18580708816466263
转让公告：因以不再煎熬为首的沟拖团伙屡屡纠缠,8425,2017-07-07,0.4246048665786971
S不煎又抄袭哥的观点，说什么3301不是顶，这预,8758,2017-07-24,0.0027393264526588412
大盘呈现一九行情，上证50新高不断，创业板指新,13790,2017-06-02,0.9962583887436937
6月9日贴，上证指数自煎熬提出年线做双底，单阳,16982,2017-06-09,0.18871484951199402
MD跟定煎熬哥想不发财都不行，煎熬去年27元逃顶,26369,2017-05-25,0.3741923246476543
又过了一周,15054,2017-07-21,0.4959016393442627
本人最近一年过于精准，各种相似号蜂拥而出，什,8809,2017-06-08,0.9112269495785646
6月12日贴，在沟托不在煎熬2017高声大呼看多西,11204,2017-06-12,0.018074415086678508
真的就这么结束了吗？急跌慢涨的西部该何去何从,14791,2017-07-18,0.20569498877752734
西部证券布林线喇叭口已经张开，接下来股价将沿,17009,2017-07-20,0.2830326029906841
000712锦龙股份重大事项停牌，有故事的股就是这,13117,2017-06-08,0.7360944996954627
注册制是解决中国股市大起大落的唯一之路,59718,2016-01-18,0.9377730707569107
刚刚！一重大消息火爆来袭  “西部证券”下周将,16174,2017-07-21,0.07758443316008201
中国股市不会因为伪专家们的集体唱空而倒下,14402,2017-07-19,0.9906754437040204
恭喜西部证券周线八连阳，连续小阳之后必有大阳,27262,2017-07-14,0.9390756502425273
西部证券:关于获准设立6家分支机构的公告,59927,2017-07-17,0.4655673954951901
各位早上好，煎熬哥自从用此号发帖一来就一直是,11396,2017-06-09,0.4346466054047362
暴跌之后的市场分析,37628,2017-07-17,0.9773296981428238
前证监会副主席姚刚被移交司法机关查办对空头的,19867,2017-07-20,0.8308810522863816
空沟今天注定要被洗哭，抓紧割肉吧，看空的辣鸡,14435,2017-07-17,0.9718937910807013
证券最近经常开火箭，证券板块是不是又想搞事情,15114,2017-07-13,0.0652721901961073
胜不骄败不馁，沿着右侧方向曲折前行！,26076,2017-07-19,0.7594063751708836
高位急拉升是大跌前的诱多！机构出货是一个价格,11341,2016-03-29,0.6430174647853848
煎熬并不意外，今日再次遭到几个庄拖号围攻，每,20780,2017-06-06,0.981228335398251
从历次全国金融工作会议后大盘的表现看后市,23773,2017-07-17,0.9579949549206753
不煎沟终于要消停了，嚷嚷着涨停被打脸后老实多,7394,2017-06-28,0.13698150912377782
无知的悲哀之被人卖了还帮着别人数钱,40349,2017-07-12,0.7444544461312745
假煎熬你给我看清楚！,17704,2017-07-05,0.6977949954708578
形势很不好，但底还是要抄一抄的[微笑],5270,2017-07-17,0.8561345818481998
别的股哥不敢担保，西部证券哥那可是最了解的。,29812,2017-05-12,0.21725736378561566
新帖：大盘继煎熬精准预判的单阳不破之后，有可,14580,2017-06-08,0.9557004297805278
八爷面咋样，服不服,2367,2017-06-12,0.023135885363292474
煎熬哥昨晚夜观天象，有一异星自西部升起，光彩,14958,2017-06-14,0.9638910765130804
漂亮，祝你们套的丝丝的哈哈哈,15120,2017-05-15,0.9992756265485071
早盘诱空，坚定持有,14724,2017-07-10,0.6990443166352824
中证期指一大早就砸盘，中信国泰君安为最大空头,22346,2017-07-14,0.9116479493081445
尔等的八爷是个好人不,4111,2017-06-07,0.9211267250293264
神棍呆头大哥天天说些模棱两可的东西，一会说价,8512,2017-04-26,0.22809201836235837
都进来抽奖啦，八爷有赏啦,6499,2017-05-09,0.5581061046742118
跌的漂亮，差点要吃屎了,4657,2017-06-15,0.553910584152321
抛！机构连拉股价，制造概念，用人性贪婪，忽悠,45661,2016-03-22,0.9616263649280308
西部不敢让八爷吃屎的，借他老总俩胆都不敢,4684,2017-06-14,0.04289947867655064
尔等舍得让八爷吃屎吗，看投票率,5430,2017-06-16,0.944377396463925
八爷叮咚 黑色的大天鹅已经降临，谨记这个,5229,2017-04-21,0.9530271965179249
西部证券从除权后的均线系统可以看的很清楚，周,17846,2017-07-07,0.5794392683307358
现在可以买入，即时价买入。长期投资。,38079,2017-04-24,0.9985829158252288
我今天已经建仓，成本价14.45元。17.4.21,48535,2017-04-21,0.056963749011581855
我收女弟子，不介意年龄。只收女,61876,2017-03-29,0.20757589913836416
预测下午广发中信招券大涨携券商站稳3225点，量,4033,2017-07-07,0.9344527080368614
我本将心向明月，奈何明月照沟渠之致那些要我滚,69127,2017-07-07,0.9786717194246995
再次被黑，帖子又被删了,19584,2017-07-10,0.12984917149183295
何其相似的一幕,20575,2017-06-28,0.9700695488307891
西部证券，双底测高，18元左右。,19471,2017-06-06,0.4994046215341684
煎熬哥今天要拿成交量说事了，大盘成交量今天缩,16354,2017-06-06,0.9669833019250301
重磅提醒：请问有没有人怀念西部证券连续几天涨,17655,2017-06-13,0.43096294780712485
宁炒退市的新都，勿碰婊子的西部。   友情提醒,4783,2017-06-28,0.3129182227477666
客观的说句实在话  西部还是太弱 成不了龙头,6635,2017-07-07,0.058625238402826185
我本将心向明月，奈何明月照沟渠之西部盘后观,68125,2017-06-30,0.9690341644605311
西部证券:2017年7月5日投资者关系活动记录表,9930,2017-07-06,0.8912216909044041
西部证券：未来将进一步实现公司业务的多元化,30627,2017-07-07,0.8628837261659065
大家都知道，煎熬哥手中绝非只有西部证券一只券,10144,2017-06-15,0.8789014369673268
煎熬大哥把话放这儿了，证券最后一次诱多。明天,23258,2016-12-01,0.49598916310752883
重见天日,14891,2017-07-07,0.5
看清楚了，煎熬只说一遍，18块，18块，煎熬才考,30826,2016-12-14,0.28953087781770515
西部7月净利润1.67亿元，环比增长近7倍,16821,2017-07-06,0.7428072144294776
究竟是谁？意图何为？,8563,2017-07-05,0.7500624229391235
西部证券6月净利润环比增长超5倍,44269,2017-07-06,0.6834213051101672
靴子落地！A股被正式纳入MSCI指数，18年8月正式,15803,2017-06-21,0.9120039177922138
西部证券最后两个交易日收季月周日线，各种迹象,20978,2017-06-28,0.06579160491736269
今天券商只是被股指期货闪了一下腰，该起来还会,15561,2017-07-06,0.41401708078039934
西部证券：6月份母公司净利环比增长553%,63875,2017-07-06,0.8900227235356594
超低估值机构扫货可能性大____________________,19331,2017-05-13,0.8509949174455376
西部证券周线KDJ、MACD均死叉，双叉共振力量不,21397,2016-12-09,0.8746152171026792
自去年26元以上抛出西部证券筹码后没再炒过此股,12130,2017-04-23,0.12779493911580275
今天涨这点，部分人就开始飘飘然了。也难怪西部,22329,2017-02-08,0.5884077008687858
西部证券:2017年6月主要财务信息公告,71396,2017-07-06,0.28640667982237267
底部区域满仓买入一一一一一一一一一一一一一一,16438,2017-06-11,0.6193649467920188
今天收个完美的阳包阴，之前几次都没成功。大底,13192,2017-05-24,0.43900404463464804
今天大盘扬眉吐气中阳收盘。中国人讲究大吉大利,10324,2017-01-03,0.952847663829604
对深港通正式公布的正确解读，利好出尽，预期落,16781,2016-11-25,0.9878723860701781
揭露真假,6537,2017-06-30,0.9782679491337355
被黑了,15728,2017-07-04,0.5147058823529411
我今天卖了19.73元，减持平均价。17.3.16,37692,2017-03-16,0.35463353259209107
2017.6.28资金换到国泰君安，西部证券太弱了，,17146,2017-06-28,0.9975997863505114
诚收志同道合者，大家一起赚。信我者跟我。,28190,2017-05-06,0.10800471966989478
学费，高利贷，买房首款，杠杆，看病钱。不要来,20893,2017-05-05,0.575166354819085
基金抱团炒个股是中国式庞氏骗局，隐患危害大26,16370,2016-07-21,0.8776344671534044
有个煎熬2017在那里卖弄什么沟批135战法，什么,10653,2017-06-09,0.11716260381147692
紧急公告：立即抢购7.02元历史最低位附近的金钼,3290,2017-05-10,0.9179398754119068
呆头大割256对外宣称14.45元(实际成本15.5元以,16222,2017-04-24,0.2609399537374394
西部明天涨停！！！今天尾盘所有做T资金全仓了,23746,2017-06-26,0.5432064961568533
西部盘面观之用135战法来看西部的走势也许你就,35559,2017-06-09,0.9552074437148961
假煎熬你给我看清楚！,21825,2017-06-29,0.6977949954708578
证券板块，资金量说话。其他小盘股可以做骗线，,12861,2017-06-28,0.8322456071155515
想要回到3000点其实很容易,20861,2016-03-13,0.6709624115324819
冒个泡,26671,2017-06-08,0.3623188405797101
我已建仓成本价18.61元。我现在看多。17.2.7,26024,2017-02-07,0.06321542898509414
雄安板块加速崩盘是市场资金面的重大利好,23331,2017-06-26,0.9640370497823406
我刚才已经清仓了，西部证券再见了，17.2.10,32639,2017-02-10,0.2459220326832824
我今天建仓了18.86元，17.3.13,27893,2017-03-13,0.2115900175358877
不再煎熬2017是真煎熬，注册10个月的是假煎熬。,10839,2017-06-13,0.433738072039453
今天最高20.19元收盘价19.74，我已清仓17.2.10,34992,2017-02-10,0.2311843502553188
重磅提醒，本吧有数只沟托疯狂攻击本人，干扰众,7104,2017-05-19,0.48457183021022476
本周继续看空，大家自己注意风险吧。,14890,2016-06-27,0.511029327188653
下半年坚持看空。我现在空仓看空。,22088,2016-06-22,0.34069134199709294
不说大盘看西部之完美的操盘,37692,2017-06-23,0.9086794717446888
下周西部直奔40元，恭喜持有西部的你们。,19500,2016-09-23,0.09992714239938694
我已经卖了，刚刚。赚了几个点。17.1.23,12874,2017-01-23,0.18515464940185988
西部会持续震荡下跌，下半年看到18元,18332,2016-06-13,0.7442582025905111
现在不是底部，是阶段顶部。西部我看到18元，6,18062,2016-06-02,0.07516296886695328
~！！西部证券 三重利好涌入，多头释放大动作，,10690,2017-06-26,0.17006753556028043
买入上海石化(600688),101692,2016-06-17,0.3141388674957901
大盘急需券商老龙头的一个涨停板,11456,2017-05-11,0.8700459805140804
西部超跌msci标地股，也该补涨3涨停了,7616,2017-06-26,0.37522280789560003
2017.6.24，证券板块的那些事。,20448,2017-06-24,0.3906485953280412
西部之我的看法和研究，终于可以分手了。11月13,27714,2015-11-13,0.9562036239748851
证券在沉寂了多日之后放量大涨气势如虹，符合本,17862,2017-03-02,0.9674086068163387
881157证券，已在年线附近盘整多日，5日10日60,13097,2017-02-24,0.004199720458862077
重复被删的贴：大盘马上到前高3301点，是继续升,26242,2017-02-20,0.309445453060041
谁才是券商龙头？,18070,2017-03-28,0.16010290715333808
881157券商板块日K已升到半年线处，预计接下来,20093,2017-02-21,0.010590279746335307
煎熬说能到21元，那就铁定能到。,39880,2017-02-14,0.3919358399754399
证券板块重要均线粘合程度相当惊人，只有14年牛,14527,2017-03-18,0.05394632672231181
券商启动前剧烈震荡就是在给空头和墙头草上教育,20800,2017-03-24,0.9083511753800098
今日大盘有望收出光头光脚阳线，一扫阴霾。煎熬,14969,2016-12-21,0.9725800989528077
有的人（二）,13392,2017-06-15,0.531950906905614
假煎熬居然发帖骂过如风1109，呵呵，假煎熬的前,16013,2017-06-16,0.04053806751752376
看来太看得起证券股了，2017.6.21早盘近收盘清,18854,2017-06-21,0.3534546674943342
锦龙股份,25978,2017-01-10,0.7297953905324696
券商票中，锦龙股份还是不错的，有龙头大哥模样,7350,2016-12-13,0.5649374583502612
重要关口的尾盘杀跌,21419,2017-06-22,0.593406195262989
风物长宜放眼量,23318,2017-06-21,0.773005845418883
有的人,16304,2017-05-26,0.5702515177797052
西部证券，如何都掩盖不了你的骚气。,15928,2017-06-19,0.5865132746094582
西部只是正常调整，五日线都没碰到，空狗们嘚瑟,13234,2017-06-16,0.20423359480406889
常与同好论高下，不与傻瓜论短长之告别篇（二）,28993,2017-06-16,0.7478168246903976
共有17只券商股入选MSCI成份股。早前，MSCI公布,35973,2017-06-05,0.06488746787104338
大家还好吗？我是你们煎熬大哥，今天在涨停板让,12487,2016-08-15,0.873782498199621
当沪市每一步反弹都举步维艰的时候，深成指已悄,20207,2017-06-13,0.362965508843092
如果msci通过了，证券应该有两个涨停板,18649,2017-06-17,0.786431100235277
最后时刻闪跌得相当有个性！昨天的分红眨眼间没,3827,2017-06-16,0.46030884919162174
今早14.10出光光，开心死了,16466,2017-06-14,0.24240974077954258
上周五（4月7日）本人凭借敏锐的观察力指出接下,8518,2017-04-11,0.9725820348979297
3100点以下就是诱空。大盘正在筑底，煎熬继续看,21103,2016-12-20,0.8993923560285767
关于老西部的当年雄风。,9866,2017-05-12,0.801695267574076
最牛叉的洗盘就是启动前搞出个大利空出来，让一,22341,2017-02-15,0.11617709959510858
大盘已红非常强势，煎熬观点不止一次透露明年（,25066,2016-12-22,0.9815581968625167
重磅提醒：手上有券商票的都给我捏紧喽，老司机,48973,2017-02-10,0.05697976970140006
魔咒接踵而至的A股将去向何方？,20377,2017-06-14,0.9597667152903686
如果装神弄鬼观天象借天力就能让股票涨，那真是,16614,2017-06-14,0.915107975290382
关于大盘，今日大盘成交量1622亿振幅0.45%，均,13399,2016-12-27,0.944185640583665
上周四暴涨逼近前高3301周五却又放量巨阴补了缺,17887,2017-03-18,0.1506078315004752
881157证券板块今日放量光头光脚长阳，此乃后市,9918,2017-03-16,0.40188562075640477
西部看来能走出一波填权行情。不错，大盘稳，券,23386,2017-04-12,0.9938116317518354
不知哪个带头大哥作何感想，熊途慢慢天天见他来,25821,2017-02-17,0.9734712925779637
亲爱的股友，请别叫我老师,31584,2015-11-09,0.8807294804677862
强烈要求暂停实施熔断机制,7261,2016-01-07,0.8140701019902251
西部已经全流通不存在解禁的问题，不要受带头猪,19056,2016-07-05,0.8336607760916601
今日盘面综述之当利空已成为过眼云烟时,12417,2017-06-15,0.9479974206618628
煎熬哥突然有个大胆的想法，明天给西部拉个涨停,18523,2017-06-14,0.9715208117194101
西部盘面观之关注13日34日线的支撑,16986,2017-06-12,0.947449960443348
连下三级台阶后的西部将去向何方？,25914,2017-05-10,0.6229865307374624
券商板块已不宜再割肉了，现在割等于是割在了地,25675,2017-05-23,0.1636760260667237
我坚持现在就是底部，我坚持我的观点。,17203,2017-02-08,0.27879691095365855
我不是针对西部。我在所有券商吧里都发看空的帖,13437,2016-06-10,0.6354123596111776
都有谁听煎熬的，23元上了锦龙股份？,16654,2016-12-28,0.7553648392443775
今日长有标志意义,23923,2017-02-08,0.8665657835787886
西部证券:2016年年度权益分派实施公告,71074,2017-06-08,0.7105176777413009
券商已经跌无可跌，只能剧烈震荡。看多券商看多,15760,2016-05-26,0.22000023931245538
煎熬，你那只猪眼看我到我说券商串通了？,11680,2016-06-06,0.5173421744730073
给带头大哥和赚点就撤退普及一点券商月报公告的,8251,2016-06-06,0.2270072381084376
5月券商业绩的分化说明了什么？,13000,2017-06-07,0.518956464381163
西部证券:2017年5月主要财务信息公告,48320,2017-06-06,0.3477375205980162
呐喊了一天，我的眼睛湿润了！,11383,2017-06-02,0.743549725665284
从2007年入股市已经十年了，算老股民了，年年赔,12378,2017-05-27,0.6234691548071902
西部证券5月净利润环比下降51.27%,29997,2017-06-06,0.49653576308020064
[资金流向]西部证券主力资金连续净流入9天,26778,2015-11-13,0.9985659472404879
配股和抢钱有什么区别？ （1那些拿长线不看盘的,24342,2017-04-07,0.04397556314423301
西部证券未来二十天走势请参照2015年9月~11月或,19187,2017-05-31,0.3289933683049926
讲讲自己被老梁所骗的经过,23802,2017-05-07,0.8275885439471068
管理层急需推出诸如降低印花税等措施以对冲中外,9381,2017-06-02,0.08558056856406082
上海老梁这一波害了不少人[大笑]@上海老梁,12377,2016-08-03,0.5788087353950826
看看全世界的股市，严重怀疑中国股市被希望中国,10388,2017-06-02,0.9960534262062914
沪指出现了很多人期待已久的第三个向下跳空缺口,9963,2017-05-24,0.4025108433518255
现在炒A股的感受是,5837,2017-05-26,0.34419507812973615
终极决战2！散户炒股很赚钱很简单，一年稳赚10%,22066,2016-06-01,0.8379107664848096
西部给套朋友们，端午节后会涨吗？我是20本的[,17138,2017-05-26,0.7846138340631231
3000点保卫战有一个很显著的特点，就是强拉漂亮,14965,2017-05-29,0.8075713368685639
西部盘面观,21286,2017-05-31,0.9146080176251428
拭目以待 这票配股以后大飞,30728,2017-03-28,0.6633504905617814
十年炒股两茫茫，先亏车，再赔房。千古跌停无处,7167,2017-05-22,0.4039693577067719
600871煎熬看好。,14117,2016-12-23,0.5193969958594796
大家帮我看看  我的西部证券配股怎么是灰色的啊,10938,2017-05-25,0.5464312496007395
西部加油啊。,6463,2017-05-25,0.9344466276897723
