标题,帖子数,日期,情感
今天让你们跑你们不跑，看重大利空来了，21号预,37547,2016-04-08,0.1472830014989116
西部证券3月净利1.5亿 环比增超3倍,44743,2016-04-09,0.7363590665451522
为什么我的帖一发出就被秒删？,8473,2016-04-09,0.42619732560814105
别吵吵了， 配股是1年以后的事情， 对西部走势,20589,2016-04-09,0.04606068192424595
西部证券3月实现净利1.5亿元 环比增长超3倍,50416,2016-04-08,0.7675359854364742
西部，天量之下有天价,40490,2016-03-23,0.4733906777364284
大利空，券商加融资融券税了,10938,2016-04-08,0.40550352859867667
巨量假阴线乃凶狠之洗盘手法,24261,2016-03-22,0.9601599719357555
西部证券3月净利1.5385亿元环比增长超三倍,9938,2016-04-08,0.7885459303091017
4.7收盘（大盘潜在的风险）,12434,2016-04-07,0.9681615136073837
龙头股未来走势,19735,2016-04-01,0.44846637207995677
四月反弹行情已经启动，大家一起等着数钱。今天,16716,2016-04-05,0.6664319552643572
周二西部暴跌5个点以上，一个也别想跑，套你没,23490,2016-04-02,0.01571268369493184
大盘攀升3000点不是遥不可及的目标，如今站上高,4040,2016-04-06,0.9348216803728201
西部证券没有煎熬这样的傻缺，就会涨，相反，西,8609,2016-04-06,0.7014233784799335
燕雀安知鸿鹄之志哉！,15316,2015-11-28,0.8736924346302866
西部证券今日超大单流出排名第3名(04-06),29173,2016-04-06,0.3973216436551157
关注低价603002。,6107,2016-03-30,0.7448268322299219
西部证券今日超大单流入排名第15名(04-05),30827,2016-04-05,0.7134754854427102
量能疲态导致拉锯战常态化,6533,2016-03-31,0.8477835193885314
下一个反弹高点应该在3200点附近。也是国家层面,15457,2016-04-02,0.3749637811119695
致来西部吧打广告的大神们！,26717,2016-03-28,0.27224837561035486
西部证券吧牛人集中扎营了，快来看看牛人观点,75918,2016-04-01,0.953057624527151
周二开始，西部证券开启下跌模式，誓要把大盘拉,25370,2016-04-02,0.331618171612872
历史再次惊人相似 中国请警惕这一阴谋！,17372,2016-04-02,0.8680225450773337
股指近期一直在2950至3000点的区间做窄幅箱体运,6294,2016-03-28,0.4572093557724999
西部证券强力上冲，现在成交量连续放大,10620,2016-04-01,0.8567332297429434
市北高新  可以关注,6625,2016-04-02,0.5386523807468298
還有70小時，大家就會見證西部證券一字漲停開盤,11856,2016-04-02,0.0003533582647229361
券商股普跌 西部证券跌4.50%,29580,2016-04-01,0.08004561039630642
美股低開高走，週二千股漲停，西部證券收盤放量,11802,2016-04-02,0.003718166867584083
【讨论】主力连续出货，小散们该何去何从？,21542,2016-04-01,0.7717146198491245
西部证券今日超大单流出排名第1名(04-01),24827,2016-04-01,0.3335703172071012
西部证券今日超大单流出排名第2名(03-31),35940,2016-03-31,0.33726712486434274
西部证券:想想这件事的后果，我都觉的后怕啊,8627,2016-03-31,0.36194259490898806
002673,13279,2016-03-21,0.5
明天西部證券超大單流入排名第一，一字漲停,23471,2016-03-30,0.4666298530703542
解密资金出逃股 连续5日净流出168股,42403,2016-03-30,0.24267898632502083
16亿主力资金近三日撤出证金汇金概念股,31099,2016-03-30,0.8689776335955541
【讨论】数亿主力资金出逃 现在是关键时刻！  ,42356,2016-03-30,0.9852390537118149
西部证券今日超大单流出排名第5名(03-30),33312,2016-03-30,0.4666836467393607
小谢带你走进下周市场的三大看点,9656,2016-03-25,0.7670981549245978
再发一图看西部，前期缺口以补，一个字：进！,30822,2015-08-24,0.705456689884754
西部今天又要涨停，你信吗？,10884,2016-03-30,0.6711863605545946
西部证券今日超大单流出排名第1名(03-29),39748,2016-03-29,0.3335703172071012
西部信托减持西部证券2795万余股,42770,2016-02-26,0.9031087234497077
西部证券股东拟减持不超过2796万股,25298,2016-02-02,0.12535404384714177
3分钟之内答错了 证明你不适合炒股票,17754,2016-03-29,0.08312227579982345
西部证券今日超大单流出排名第1名(03-28),44421,2016-03-28,0.3335703172071012
下午千股跌停是肯定的，西部證券逆市拉升，兩點,7431,2016-03-29,0.41934096934150467
无惧限售股解禁 融资客上周五净买入西部证券8亿,41472,2016-03-29,0.6358931955300136
今日重点概念（附股）,3617,2016-03-29,0.9386677904024486
关注下周走势,8105,2016-03-18,0.7593099486506906
002673今天收盤不紅5個點以上(含)，評論此帖的,26800,2016-03-28,0.0002670085310321202
周一低开震荡 券商板块跌幅居前 西部证券维持在,24484,2016-03-26,0.3613168336582566
西部证券(002673)融资融券信息(03-25),18530,2016-03-28,0.8613526542713288
庄家边拉边出 西部证券下周将面临狂轰滥炸 预计,26714,2016-03-25,0.5344989896879756
大家想过没有,周五二级市场交易加大综市场交易,13305,2016-03-27,0.5441789912779675
把握好回调良机 选择强势股积极建仓,16040,2016-03-27,0.30710304415312484
减持之殇,51978,2016-01-23,0.574549474228723
面对灾难，我们必须和国家站在一起！,5821,2016-01-08,0.9944965644494057
西部证券今日超大单流出排名第3名(03-24),50337,2016-03-24,0.3973216436551157
请大神们自重！,32099,2016-01-05,0.24699418451209887
我只想说一句CTMD哪儿来这么多老师，这么多托。,10136,2016-03-25,0.7362176683751032
狙击65只涨停股：券商股崛起护盘,43212,2016-03-23,0.03185312946742935
西部证券今日超大单流出排名第1名(03-25),49548,2016-03-25,0.3335703172071012
作为一名二十多年股龄的老股民，主力如此操盘我,17912,2016-03-25,0.8058787287870396
这波又得冲40了！牛,20512,2016-03-24,0.7962492995122765
城投控股去年减持西部证券得不偿失,17348,2016-01-08,0.6345836979173163
晕蛋！看了成交额  脑袋一热27.7买了1万股！我,14495,2016-03-25,0.00592832462779791
浮籌清洗完畢，下午兩點左右暴力拉漲停,6469,2016-03-25,0.6632661564009192
~C出货豫光金铅杀入无人驾驶概念万安科技表现强,9143,2016-03-24,0.944352512590405
[资金流向]西部证券主力资金连续净流入6天,14982,2016-03-24,0.9989336931228204
西部证券(002673)解禁股信息(03-25),70200,2016-03-23,0.24793799618820933
西部证券午间看盘,23976,2016-03-24,0.5693762026234159
Z昨天介入的高送转概念个财信发展和豫光金铅今,7256,2016-03-23,0.9438114089696912
[资金流向]西部证券主力资金连续净流入5天,13234,2016-03-23,0.9991970289402483
2股遭营业部抢筹 西部证券最受宠,69719,2016-03-23,0.9172029043130447
——大牛市谁主沉浮 唯我证券——,10255,2016-03-21,0.9897678969173267
西部证券今日超大单流出排名第9名(03-23),40990,2016-03-23,0.3287076244759085
券商股再度拉升 西部证券涨8.31%,35659,2016-03-23,0.17223924467590934
真心英雄西部证券,139942,2016-03-23,0.9911657469070102
【龙虎榜】尾盘涨停 两家游资扫货上亿元,83638,2016-03-23,0.5127582071076264
关注低价冠军哥600321。,2756,2016-03-23,0.9725939908288452
主力资金出逃券商板块 西部证券登龙虎榜遭卖出7,140346,2016-03-23,0.845886710406723
[置顶]西部证券 明天低开高走 冲击涨停，同意的,26387,2016-03-22,0.8255245279275525
别人恐惧我贪婪，今天没被吓跑的举手看看,8777,2016-03-23,0.9749711271352971
西部证券:关于独立董事辞职的公告,110698,2016-03-23,0.4428178463191714
西部证券(002673)龙虎榜数据(03-23),74559,2016-03-23,0.8679428054597429
美股道琼斯指数从历史最高峰下来仅跌了百分之4.,16655,2016-03-19,0.9489418269026064
西部证券的投资价值分析,33086,2015-11-07,0.9888086518039471
西部证券(002673)融资融券信息(03-22),16984,2016-03-23,0.8613526542713288
晚评+预测：短线反抽虽被破坏 但转机逐渐到来,12979,2016-01-15,0.7544086834327531
【讨论】西部证券遭减持 小散此时适合接盘吗？,66989,2016-01-21,0.864288215958388
哈哈哈!秀一下自己的收获,10636,2016-03-23,0.9912977161198427
今天我订婚了，男朋友开盘送给了我西部证券,16097,2016-03-18,0.8489612554769527
西部证券(002673)龙虎榜数据(03-22),74393,2016-03-22,0.8679428054597429
西部证券：短线反弹已开启，也需谨慎,20579,2016-01-18,0.5665918130198571
[资金流向]西部证券主力资金连续净流入4天,11644,2016-03-22,0.9990228488565918
西部证券今日超大单流入排名第6名(03-22),37470,2016-03-22,0.7249061412672388
西部证券早盘资金流向分析,50594,2016-03-22,0.9956088665995007
三大主线引领大盘近日反弹 机构大卖券商股,145258,2016-03-22,0.43634141224503364
券商股走高 西部证券涨9.28%,26978,2016-03-22,0.6194276420857074
【龙虎榜】强势涨停 一游资大买近1.4亿元,37401,2016-03-21,0.6588379700119722
提督进场，黄金万两[微笑],20038,2016-03-18,0.9035816927968284
在西部证券强势涨停的带领下，大盘重回了久违的,17837,2016-03-21,0.8381735827847093
资金大举抢筹西部证券，逼空行情再次上演,16671,2016-03-21,0.9974338596010295
西部证券(002673)龙虎榜数据(03-21),56647,2016-03-21,0.8679428054597429
注册制是中国股市重生的希望！,19640,2016-03-09,0.9558003378818456
关注低价冠军哥600321。,6067,2016-03-18,0.9725939908288452
券商股集体走高 西部证券涨停,19575,2016-03-21,0.8384431152547526
太棒了…大盘需要突破必备券商…[加油][加油],4364,2016-03-18,0.9998667900253206
气死我，卖了就连续两个板,5045,2016-03-21,0.3224104586326263
西部证券增发股份3月上市，成本约12.64元/股。,148104,2015-12-29,0.1139652469119562
题材股全面开花 百股涨停确立突破,26336,2016-03-18,0.8393412170858465
下周沪深两市限售股解禁市值逾千亿元,11388,2016-03-20,0.09244769765312544
只要制度完善，管理有方和足够的信心，中国股市,14219,2016-03-19,0.9996030650049431
西部证券今日超大单流入排名第1名(03-18),38251,2016-03-18,0.6669035663283297
十大机构论市：波段行情五大主线脉络曝光,37417,2016-03-18,0.9871777416031026
券商板块持续走高 西部证券锦龙股份涨停,24853,2016-03-18,0.8887946952579605
西部证券连续涨停模式开启，大家猜几个版！[微,11675,2016-03-18,0.9418417881376906
事实证明只有券商板块不跌普涨才能带动市场人气,15632,2016-03-17,0.9457783504772853
33元成本好冷，有谁陪我？,42946,2016-02-03,0.3206158883319431
揣测主力的意图，找到大脉络，从而顺水推舟，达,6240,2016-03-17,0.8134212828181229
仅仅靠银行和两桶油能撑起中国股市的一片天吗？,60097,2016-03-16,0.7936052594436629
西部证券今日超大单流出排名第11名(03-16),11115,2016-03-16,0.28062558849286867
26万还剩11万，你呢,32028,2016-03-01,0.4840480533696486
看完两会“阳线秀” 两会后行情到底有没有？,14808,2016-03-16,0.8396282193885478
券业乌云报告：589项系统漏洞暴露 部分导致投资,50721,2016-03-16,0.8918707395433041
此股很危险，作为散户，要弄清楚二个逻辑,9798,2016-03-15,0.42078642535499877
在这股上亏了45w，说说你们多少的本，我36.1,23723,2016-02-29,0.0748208456233097
西部证券今日超大单流出排名第19名(03-15),11419,2016-03-15,0.34524848166877553
西部证券——操作策略,57971,2016-01-26,0.8983526111754132
西 部 证 券,18999,2016-03-10,0.5228985302878875
跟着大盘走有什么好处？,7989,2016-03-14,0.8269233567505914
谢天谢地，城投控股终于减持完了,16711,2016-03-14,0.664054414273943
西部证券——（补）谨慎持有,7120,2016-03-14,0.23300933589497486
现阶段困扰西部证券的两大因素,28041,2016-03-11,0.8763208129425264
散户福利：牛散总结的选股秘笈，太实用了,13755,2016-03-10,0.8896376012059442
不仗义的城投控股,14677,2016-03-11,0.4916308641172945
西部证券近期的操作,49084,2016-01-06,0.566972380166954
西部证劵反弹指日可待！依然也触目惊心,16341,2016-03-08,0.34513994546706783
老子40的本就是不走,9196,2016-03-07,0.8896025636335744
西部证券:2016年2月主要财务信息公告,83494,2016-03-04,0.2366683737118347
西部证券2月净利3660万 环比下降61%,23933,2016-03-04,0.6860519019339167
小心一点,8068,2016-03-03,0.20477300526054598
西部证券2月净利润环比下降60%,19598,2016-03-04,0.36449879664549745
西部证券(002673)融资融券信息(03-03),9636,2016-03-04,0.8613526542713288
姓叶的天天叫嚣见证奇迹！西部就天天跌！还圈钱,13997,2016-03-01,0.9354476171608115
国金涌富“牵手”西部资管 打造良性资产管理生,13775,2016-03-02,0.9976683447208147
西部证券(002673)融资融券信息(03-01),10718,2016-03-02,0.8613526542713288
西部证券(002673)融资融券信息(02-29),12744,2016-03-01,0.8613526542713288
大盘，这个位置怕啥，西部，不敢说,13192,2016-02-03,0.25340196030197903
短线买入强势股技巧和涨停后策略,12345,2016-01-15,0.9491601289511569
这个市场的赚钱机会，是留给有准备的人。呵呵,16162,2016-02-23,0.9256800172944801
收于2900点，谨记事项和应对策略-必看,15273,2016-02-23,0.9966918698214489
当心万手封单封死跌停板35元！,14998,2015-11-17,0.04350705321128179
西部证券：西部信托减持2796万股,42057,2016-02-25,0.740063157672973
不冲高不卖，不跳水不买，横盘不交易,6681,2015-11-11,0.011943629574347692
西部证券衷心提醒，如果觉得说的不对尽可一笑而,61727,2015-12-30,0.2869688433213621
高层人士变动与股市的巨幅波动,25416,2016-02-21,0.971077485941991
四十买的还有在得吗？,17824,2016-02-19,0.48244778683568157
梅先生：对目前西部证券的简单评估！！,100878,2015-12-14,0.0810892948009383
西部证券今日超大单流出排名第1名(02-18),32480,2016-02-18,0.3335703172071012
马哥妙股：持股过节的朋友红包拿好了吧,8480,2016-02-16,0.054978673887675855
晨晨的战略部署（不喜勿喷）,13902,2015-12-26,0.9989738615279137
券商板块颓势尽去 个股全线上扬,15538,2016-02-16,0.05870492542956296
站在黑暗中的勇者，黎明终会到来 相信本周大家,47170,2016-01-16,0.9955098032442886
不要因为欧美股市的暴跌就看空中国股市,19970,2016-01-16,0.9975045538565487
西部证券:2016年1月主要财务信息公告,70169,2016-02-04,0.23368542473545384
西部证券1月净利9360万 环比降39.9%,23730,2016-02-04,0.48692710471100975
西部证券目标价9元 ，时间在明年3月,29062,2015-12-08,0.9167711121683253
西部可能又要做一颗老鼠屎,10531,2016-02-02,0.4308372924917516
甘肃首富阙文彬被证监会立案稽查 涉嫌违反证券,61484,2016-02-03,0.20113477831796434
“寒流”击穿婴儿底 A股明日大势猜想,10100,2016-01-26,0.9923895841668783
西部证券：两融业务市场份额继续提升,18355,2016-02-01,0.7918044841635243
周五的红盘感觉不太踏实,13486,2016-01-31,0.48301863230111197
西部证券：节前有望展开一波反弹行情,20595,2016-01-28,0.988179338152733
西部证券:2016年1月29日投资者关系活动记录表,35493,2016-01-29,0.7451439243985573
西部证券今日超大单流出排名第15名(01-28),13269,2016-01-28,0.3836769391943
一月最后一个交易日，我们还有什么可期待？,6497,2016-01-29,0.24783292883322627
過年前西部證券不突破35你回來找我。西部證券，,11826,2016-01-27,0.5751292228000168
西部证券2015年业绩增近两倍,30036,2016-01-27,0.9118102895808342
西部证券年报快报：业绩增两倍,16286,2016-01-27,0.7707919278003784
西部证券:2015年度业绩快报,80787,2016-01-27,0.7473068715252343
西部证券-燕子小小分析 ，祝大家周末愉快。。。,15718,2016-01-23,0.9955839949236205
西部证券(002673)融资融券信息(01-26),7432,2016-01-27,0.8613526542713288
大盘破了前底2844点，下面的支撑暂时看不到。大,6867,2016-01-26,0.173353346236381
梅先生再开一帖：解股 附及西部证券近期操盘建,34043,2015-12-10,0.6789275488023162
西部已经跌了55%还能跌到哪去，明天高开高走,17209,2016-01-26,0.08658725438154502
西部证券(002673)融资融券信息(01-25),11101,2016-01-26,0.8613526542713288
西部证券今日超大单流入排名第2名(01-19),31893,2016-01-19,0.6705773822876854
下周行情看好，周末愉快，赚钱多多！,12010,2016-01-22,0.8675523049245241
从今日市场盘口语言我们会发现：午盘市场跳水后,9415,2016-01-25,0.8969212417971478
推荐股票的大神们滚出去！,9168,2016-01-14,0.7153271544366835
从现在起越跌越买，赚钱的机率一定会大于赔钱，,7223,2016-01-24,0.19795383934338273
马哥妙股：二次探底期待反转，伤痛的A股焕发精,26578,2016-01-23,0.6294275864908053
不要让早晨的太阳只能照在你的尸体上！,8518,2016-01-22,0.05139838502563754
如此要闻、可使下周西部证券所有人将开怀大笑 ,18735,2016-01-22,0.9466197330362418
2015年第四季度基金增持西部证券1093.83万股,17840,2016-01-23,0.714650386389255
女侠总结下这周的收货，把握住的朋友应该赚到了,7925,2016-01-23,0.16076771607747797
八年内能解套吗？,13550,2016-01-22,0.8041604134087401
下週開始報復性反彈，歐美已經在我們之前了，西,12979,2016-01-22,0.24183395803700136
西部证券，macd白线走平，有向上形成金叉的可能,21281,2016-01-19,0.7802209784621271
买到好票，就是任性。眼红的朋友们不要哭,19207,2016-01-22,0.9413346114545643
哈哈，高開，就是讓你們這些踏空狗永遠沒機會上,6330,2016-01-22,0.007154048865675056
√手中的票收益都还不赖。跟着炼股哥过肥年，总,9921,2016-01-17,0.9946241733334118
西部证券今日超大单流出排名第1名(01-21),27844,2016-01-21,0.3335703172071012
西部信托拟减持西部证券,42582,2016-01-21,0.831336032691032
2016年大盘必在西部证券的带领下重上6000点，(,9397,2016-01-21,0.8712556594384794
圣诞节快乐！！恭喜恭喜！收益满满的，用心做好,10966,2015-12-25,0.9998128398441466
关于西部证券，跟我的粉丝说声对不起,7556,2016-01-21,0.21160325195992757
西部证券(002673)融资融券信息(01-20),6174,2016-01-21,0.8613526542713288
西部证券股东西部信托抛减持计划,76291,2016-01-20,0.25424105867420854
【讨论】巨额超大单流出，主力在出货？,23261,2016-01-20,0.3762498330797116
年底红包行情（红包）,57440,2015-12-29,0.4508344708542559
西部证券老朋友了，第二波操作开始介入,27254,2016-01-19,0.983853380357851
西部证券今日超大单流出排名第3名(01-20),16677,2016-01-20,0.3973216436551157
高位不懂空仓,到头将白忙一场!本ID空仓坐等暴跌,7094,2015-11-13,0.3311244245522591
大家猜猜今天幾點漲停？我買下午兩點十二分,7984,2016-01-20,0.5421937833544123
2016年最被看好的股,19574,2016-01-02,0.18985470490709533
手贱，不小心29.7买入了,8621,2016-01-19,0.27501428207126055
四十三的本！[哭],4850,2016-01-19,0.6594340616847674
注意 山西证券肯定会成为第二个西部证券，会大,11873,2016-01-13,0.46092082867398854
！疯狂砸盘砸出春节前暴利黄金坑,36429,2016-01-08,0.038181023186638186
券商必然创新低：熊市IPO停,佣金缩水，自营亏,18012,2015-09-24,0.7154048892447542
反弹存隐忧，底部还需多磨,10650,2016-01-14,0.10070925396412933
非银金融行业 政策红利将开启新一轮业绩爆发,74007,2016-01-16,0.9975543684887841
<为何不能发帖>--股市给你们点信心,6205,2016-01-15,0.7018339800072758
券商股护盘拉升 西部证券领涨,32610,2016-01-13,0.20307952818656128
西部证券我一买你就跌，嚓,8627,2016-01-15,0.36178110637650807
西部证券:2016年第一次临时股东大会的法律意见,43117,2016-01-14,0.965525866620882
西部证券:2016年第一次临时股东大会决议暨中小,57099,2016-01-14,0.8386033692402504
明天一字板涨停！哈哈哈哈哈哈哈哈哈哈哈哈哈,8694,2016-01-14,0.998456972349062
受益IPO重启 券商板块起舞,28212,2015-11-10,0.20686460697764086
西部证券今日超大单流入排名第2名(01-13),36237,2016-01-13,0.6705773822876854
002673下午必涨停带动券商股拯救大盘危局，布依,13320,2016-01-13,0.7553241481659343
今天追进去的人 ，明天 就套住 拭目以待！,10853,2016-01-13,0.42994964823509985
可以查一下14年10月27日西部证券的走势 各位就,25621,2015-12-24,0.021603177212580205
强烈要求公安部介入调查这一周期指交易记录抓出,8933,2016-01-07,0.2788146668364664
477只个股今日尾盘资金净流入,34262,2016-01-13,0.938762686229676
西部证券(002673)融资融券信息(01-12),9590,2016-01-13,0.8613526542713288
西部证券：持股以待涨，不要自乱阵脚,126704,2015-12-22,0.540199621944311
论西部证券趋势,12276,2015-12-27,0.6516257118372478
对西部证券的个人见解和多年经验分享注：新手多,67833,2015-12-16,0.9516569153896172
西部证券12月净利润环比增长超过11倍,65229,2016-01-11,0.2358524644222606
新一轮股灾过后，西部应该何去何从,7735,2016-01-08,0.8019576579726042
大盘暴跌时操盘自救技巧（绝对干货）,15724,2016-01-10,0.878563393187412
我要坚持不住了……明天要不要跑啊……,12829,2016-01-11,0.5228638635761305
西部证券:关于净资本指标变动情况的公告,54872,2016-01-11,0.9021139322365538
西部证券:2015年12月主要财务信息公告,52292,2016-01-11,0.23573317104550362
有缘者见、积功德：002673该股将连续涨停的 ，,26466,2015-12-13,0.30016618923436234
2016又见深V，又现牛股！,29940,2016-01-08,0.31427478070873494
全球各国争相储备黄金导致黄金价格持续上涨，西,19689,2016-01-09,0.9658166246191089
根本不用担心西部11日1亿股原始股的解禁,23456,2016-01-08,0.16412630202412504
盘短线有望止跌反抽,17451,2016-01-06,0.16159080185140873
这下跌速度，后面还有空间吗？,15090,2016-01-06,0.8511145076445682
西部证券:限售股份上市流通提示性公告,92291,2016-01-07,0.9134955850505748
大黑马史玉柱威风大了，马云肯定不服输啊，中海,9662,2015-12-19,0.9587252538476201
西部证券:国海证券股份有限公司关于公司限售股,56656,2016-01-07,0.3968818390079306
机密——大跌时，资金在流入这30股（名单）,30078,2016-01-06,0.8050600395822399
八年一瞬间，投资在路上,27958,2015-12-29,0.9889615942115453
我炒股时间不长，却一直在见证历史，见证了千股,6552,2016-01-04,0.8739559647135561
A股市场新纪元的开始,6387,2016-01-04,0.45762670906602587
风雨无常切记放平心态,39334,2015-12-21,0.7876477450882987
不要做股指期货砸盘的帮凶,12474,2016-01-05,0.33496504320660125
叶荣添叫我买入西部证券。就是今天，一定会赚钱,17797,2016-01-05,0.8357704067153305
八年一瞬间，投资在路上,38312,2015-12-25,0.9889615942115453
西部35.5的成本，14900股 想哭,14161,2016-01-03,0.37953336712447316
想骂叶XX的进来喷喷！,28041,2015-12-31,0.4999358957892883
看完后你就知道---西部至少5个跌停,28341,2016-01-01,0.22528145025202062
最后一发子弹都补上去了，再跌就要去借钱补仓了,15037,2015-12-31,0.06651671984613061
再见了大家，愿天堂无股市！真舍不得儿子！,25249,2016-01-04,0.9976982664528988
再见了大家40买的西部，我走了愿天堂没有跌停,12551,2016-01-04,0.4950332456708204
首日总结+预测：非理性暴跌没必要恐慌性杀,11117,2016-01-04,0.9775978406432198
哇，M头！下周赶快上涨，要不然就形成了。,14840,2015-12-25,0.18068991094493703
西部证券多方因素暗示 还有突破！大家不要乱,24631,2015-11-14,0.9129182706836289
34的本，咋整？,8012,2016-01-04,0.38066217344317343
同志们，西部证券跌破33了，怎么办？还可以拿吗,23490,2015-12-31,0.05319601680697961
【讨论】近期走势偏弱的西部证券真的难有大作为,51120,2015-12-31,0.7406160477841398
证券股的龙头--西部证券 近来资金流出不少哦,23598,2015-11-21,0.4273093900821412
真的有点过了,西部操盘的你这样做何必呢!,11265,2015-12-31,0.5305096913137115
西部证券今日超大单流出排名第16名(12-30),20047,2015-12-30,0.2889869788328736
西部证券:关于租赁西安人民大厦办公用房的公告,48644,2015-12-29,0.8623102397262199
2015年1至11月沪深三大指数和券商板块的涨跌幅,22334,2015-12-01,0.2940992372654674
券商绝对是奇兵!大盘要想上去没奇兵怎行!,8753,2015-12-29,0.6040768640319818
西部证券：个人浅析！（不信勿喷）,23725,2015-12-29,0.012849498813091276
西部证券走势分析。注意,29791,2015-12-28,0.903141216905026
我对当前股市的看法,68549,2015-12-15,0.941878694556059
我说西部明天要大涨。为什么呢。因为高开。但是,14522,2015-12-28,0.4169890796299677
西部证券(002673)融资融券信息(12-25),9605,2015-12-28,0.8613526542713288
出货，出货，绝对是出货！,3886,2015-11-13,0.155347160095322
西部证券今日超大单流出排名第4名,8495,2015-12-24,0.4440027462177897
西部证券，花木兰之浅见,42383,2015-12-16,0.988712883042439
叶荣添自从推荐西部以来一路大跌,16429,2015-12-26,0.7925364929099624
下周预测+晚评：下周大盘有望蓄势上攻,43131,2015-12-25,0.596318664368326
